Date,Time,Species,Size_cm,Sex,Status,Tags,SD_region,Beach,DateTime,Year,Month,Species_Code,Target_Shark,Has_ID_Tag,Has_Acoustic_Tag,Source_PDF
9/02/2022,13:31,Bull Shark,212,M,Alive,"ID, A",Kingscliff,Hastings Point Beach,2022-02-09T13:31:00Z,2022,2,BUL,TRUE,TRUE,TRUE,NSW-SMART-Shark-Management-Alert-in-Real-Time-Drumlines-Report-July-2021-June-2022.pdf
5/06/2022,9:40,White Shark,271,M,Alive,"ID, A",Kingscliff,Hastings Point Beach,2022-06-05T09:40:00Z,2022,6,WHI,TRUE,TRUE,TRUE,NSW-SMART-Shark-Management-Alert-in-Real-Time-Drumlines-Report-July-2021-June-2022.pdf
10/11/2021,8:05,Tiger Shark,202,F,Alive,"ID, A",Kingscliff,Cabarita Beach,2021-11-10T08:05:00Z,2021,11,TIG,TRUE,TRUE,TRUE,NSW-SMART-Shark-Management-Alert-in-Real-Time-Drumlines-Report-July-2021-June-2022.pdf
20/11/2021,13:54,Tiger Shark,200,F,Alive,"ID, A",Kingscliff,Cabarita Beach,2021-11-20T13:54:00Z,2021,11,TIG,TRUE,TRUE,TRUE,NSW-SMART-Shark-Management-Alert-in-Real-Time-Drumlines-Report-July-2021-June-2022.pdf
3/12/2021,12:55,Common Blacktip,220,M,Alive,ID,Kingscliff,Cabarita Beach,2021-12-03T12:55:00Z,2021,12,CBT,FALSE,TRUE,FALSE,NSW-SMART-Shark-Management-Alert-in-Real-Time-Drumlines-Report-July-2021-June-2022.pdf
8/03/2022,8:33,Bull Shark,203,M,Alive,"ID, A",Kingscliff,Cabarita Beach,2022-03-08T08:33:00Z,2022,3,BUL,TRUE,TRUE,TRUE,NSW-SMART-Shark-Management-Alert-in-Real-Time-Drumlines-Report-July-2021-June-2022.pdf
13/03/2022,8:08,Bull Shark,187,F,Alive,"ID, A",Kingscliff,Cabarita Beach,2022-03-13T08:08:00Z,2022,3,BUL,TRUE,TRUE,TRUE,NSW-SMART-Shark-Management-Alert-in-Real-Time-Drumlines-Report-July-2021-June-2022.pdf
5/04/2022,13:25,Whitespotted Guitarfish,NA,NA,Alive,-,Kingscliff,Cabarita Beach,2022-04-05T13:25:00Z,2022,4,WSG,FALSE,FALSE,FALSE,NSW-SMART-Shark-Management-Alert-in-Real-Time-Drumlines-Report-July-2021-June-2022.pdf
1/06/2022,12:10,Bull Shark,174,F,Alive,"ID, A",Kingscliff,Cabarita Beach,2022-06-01T12:10:00Z,2022,6,BUL,TRUE,TRUE,TRUE,NSW-SMART-Shark-Management-Alert-in-Real-Time-Drumlines-Report-July-2021-June-2022.pdf
2/02/2022,7:36,Manta Ray,330,NA,Alive,-,Kingscliff,South Kingscliff Beach,2022-02-02T07:36:00Z,2022,2,MAN,FALSE,FALSE,FALSE,NSW-SMART-Shark-Management-Alert-in-Real-Time-Drumlines-Report-July-2021-June-2022.pdf
9/02/2022,9:02,Bull Shark,204,F,Alive,"ID, A",Kingscliff,South Kingscliff Beach,2022-02-09T09:02:00Z,2022,2,BUL,TRUE,TRUE,TRUE,NSW-SMART-Shark-Management-Alert-in-Real-Time-Drumlines-Report-July-2021-June-2022.pdf
9/03/2022,8:27,Sandbar Shark,192,M,Alive,ID,Kingscliff,South Kingscliff Beach,2022-03-09T08:27:00Z,2022,3,SAN,FALSE,TRUE,FALSE,NSW-SMART-Shark-Management-Alert-in-Real-Time-Drumlines-Report-July-2021-June-2022.pdf
1/06/2022,12:34,Tiger Shark,285,F,Alive,"ID, A",Kingscliff,South Kingscliff Beach,2022-06-01T12:34:00Z,2022,6,TIG,TRUE,TRUE,TRUE,NSW-SMART-Shark-Management-Alert-in-Real-Time-Drumlines-Report-July-2021-June-2022.pdf
29/06/2022,13:59,Tiger Shark,286,F,Alive,"ID, A",Kingscliff,South Kingscliff Beach,2022-06-29T13:59:00Z,2022,6,TIG,TRUE,TRUE,TRUE,NSW-SMART-Shark-Management-Alert-in-Real-Time-Drumlines-Report-July-2021-June-2022.pdf
9/12/2021,11:51,Tiger Shark,206,F,Alive,"ID, A",Kingscliff,Kingscliff Beach,2021-12-09T11:51:00Z,2021,12,TIG,TRUE,TRUE,TRUE,NSW-SMART-Shark-Management-Alert-in-Real-Time-Drumlines-Report-July-2021-June-2022.pdf
18/01/2022,16:57,Whitespotted Guitarfish,215,F,Alive,ID,Kingscliff,Kingscliff Beach,2022-01-18T16:57:00Z,2022,1,WSG,FALSE,TRUE,FALSE,NSW-SMART-Shark-Management-Alert-in-Real-Time-Drumlines-Report-July-2021-June-2022.pdf
14/03/2022,8:45,Bull Shark,199,F,Alive,"ID, A",Kingscliff,Kingscliff Beach,2022-03-14T08:45:00Z,2022,3,BUL,TRUE,TRUE,TRUE,NSW-SMART-Shark-Management-Alert-in-Real-Time-Drumlines-Report-July-2021-June-2022.pdf
07/07/2021,9:21,Dusky Whaler,196,F,Alive,ID,Ballina to Lennox Head,Lennox Head Beach,2021-07-07T09:21:00Z,2021,7,DUS,FALSE,TRUE,FALSE,NSW-SMART-Shark-Management-Alert-in-Real-Time-Drumlines-Report-July-2021-June-2022.pdf
27/07/2021,13:23,Dusky Whaler,275,M,Alive,ID,Ballina to Lennox Head,Lennox Head Beach,2021-07-27T13:23:00Z,2021,7,DUS,FALSE,TRUE,FALSE,NSW-SMART-Shark-Management-Alert-in-Real-Time-Drumlines-Report-July-2021-June-2022.pdf
12/08/2021,15:05,Greynurse Shark,279,F,Alive,ID,Ballina to Lennox Head,Lennox Head Beach,2021-08-12T15:05:00Z,2021,8,GRN,FALSE,TRUE,FALSE,NSW-SMART-Shark-Management-Alert-in-Real-Time-Drumlines-Report-July-2021-June-2022.pdf
14/08/2021,8:30,Dusky Whaler,330,F,Alive,ID,Ballina to Lennox Head,Lennox Head Beach,2021-08-14T08:30:00Z,2021,8,DUS,FALSE,TRUE,FALSE,NSW-SMART-Shark-Management-Alert-in-Real-Time-Drumlines-Report-July-2021-June-2022.pdf
18/08/2021,8:49,White Shark,243,M,Alive,"ID, A",Ballina to Lennox Head,Lennox Head Beach,2021-08-18T08:49:00Z,2021,8,WHI,TRUE,TRUE,TRUE,NSW-SMART-Shark-Management-Alert-in-Real-Time-Drumlines-Report-July-2021-June-2022.pdf
22/08/2021,8:32,White Shark,242,F,Alive,"ID, A",Ballina to Lennox Head,Lennox Head Beach,2021-08-22T08:32:00Z,2021,8,WHI,TRUE,TRUE,TRUE,NSW-SMART-Shark-Management-Alert-in-Real-Time-Drumlines-Report-July-2021-June-2022.pdf
29/08/2021,9:26,White Shark,273,M,Alive,"ID, A",Ballina to Lennox Head,Lennox Head Beach,2021-08-29T09:26:00Z,2021,8,WHI,TRUE,TRUE,TRUE,NSW-SMART-Shark-Management-Alert-in-Real-Time-Drumlines-Report-July-2021-June-2022.pdf
20/09/2021,NA,Smooth Hammerhead,161,F,Dead,-,Ballina to Lennox Head,Lennox Head Beach,NA,2021,9,SMH,FALSE,FALSE,FALSE,NSW-SMART-Shark-Management-Alert-in-Real-Time-Drumlines-Report-July-2021-June-2022.pdf
02/10/2021,13:25,Smooth Hammerhead,162,F,Alive,ID,Ballina to Lennox Head,Lennox Head Beach,2021-10-02T13:25:00Z,2021,10,SMH,FALSE,TRUE,FALSE,NSW-SMART-Shark-Management-Alert-in-Real-Time-Drumlines-Report-July-2021-June-2022.pdf
11/10/2021,10:40,White Shark,297,M,Alive,"ID, A",Ballina to Lennox Head,Lennox Head Beach,2021-10-11T10:40:00Z,2021,10,WHI,TRUE,TRUE,TRUE,NSW-SMART-Shark-Management-Alert-in-Real-Time-Drumlines-Report-July-2021-June-2022.pdf
30/11/2021,13:17,Dusky Whaler,283,M,Alive,ID,Ballina to Lennox Head,Lennox Head Beach,2021-11-30T13:17:00Z,2021,11,DUS,FALSE,TRUE,FALSE,NSW-SMART-Shark-Management-Alert-in-Real-Time-Drumlines-Report-July-2021-June-2022.pdf
30/11/2021,13:52,Smooth Hammerhead,172,M,Alive,ID,Ballina to Lennox Head,Lennox Head Beach,2021-11-30T13:52:00Z,2021,11,SMH,FALSE,TRUE,FALSE,NSW-SMART-Shark-Management-Alert-in-Real-Time-Drumlines-Report-July-2021-June-2022.pdf
17/02/2022,9:50,Common Blacktip,128,F,Alive,ID,Ballina to Lennox Head,Lennox Head Beach,2022-02-17T09:50:00Z,2022,2,CBT,FALSE,TRUE,FALSE,NSW-SMART-Shark-Management-Alert-in-Real-Time-Drumlines-Report-July-2021-June-2022.pdf
25/03/2022,13:51,Bull Shark,169,M,Alive,"ID, A",Ballina to Lennox Head,Lennox Head Beach,2022-03-25T13:51:00Z,2022,3,BUL,TRUE,TRUE,TRUE,NSW-SMART-Shark-Management-Alert-in-Real-Time-Drumlines-Report-July-2021-June-2022.pdf
04/04/2022,11:22,Sandbar Shark,138,M,Alive,ID,Ballina to Lennox Head,Lennox Head Beach,2022-04-04T11:22:00Z,2022,4,SAN,FALSE,TRUE,FALSE,NSW-SMART-Shark-Management-Alert-in-Real-Time-Drumlines-Report-July-2021-June-2022.pdf
20/04/2022,10:17,Sandbar Shark,193,F,Alive,ID,Ballina to Lennox Head,Lennox Head Beach,2022-04-20T10:17:00Z,2022,4,SAN,FALSE,TRUE,FALSE,NSW-SMART-Shark-Management-Alert-in-Real-Time-Drumlines-Report-July-2021-June-2022.pdf
30/04/2022,10:36,Sandbar Shark,139,M,Alive,ID,Ballina to Lennox Head,Lennox Head Beach,2022-04-30T10:36:00Z,2022,4,SAN,FALSE,TRUE,FALSE,NSW-SMART-Shark-Management-Alert-in-Real-Time-Drumlines-Report-July-2021-June-2022.pdf
15/07/2021,12:28,Dusky Whaler,362,F,Alive,ID,Ballina to Lennox Head,Lennox Headland,2021-07-15T12:28:00Z,2021,7,DUS,FALSE,TRUE,FALSE,NSW-SMART-Shark-Management-Alert-in-Real-Time-Drumlines-Report-July-2021-June-2022.pdf
25/08/2021,10:07,Tiger Shark,176,F,Alive,"ID, A",Ballina to Lennox Head,Lennox Headland,2021-08-25T10:07:00Z,2021,8,TIG,TRUE,TRUE,TRUE,NSW-SMART-Shark-Management-Alert-in-Real-Time-Drumlines-Report-July-2021-June-2022.pdf
11/09/2021,11:46,White Shark,211,F,Alive,"ID, A",Ballina to Lennox Head,Lennox Headland,2021-09-11T11:46:00Z,2021,9,WHI,TRUE,TRUE,TRUE,NSW-SMART-Shark-Management-Alert-in-Real-Time-Drumlines-Report-July-2021-June-2022.pdf
19/11/2021,10:14,Common Blacktip,233,M,Alive,ID,Ballina to Lennox Head,Lennox Headland,2021-11-19T10:14:00Z,2021,11,CBT,FALSE,TRUE,FALSE,NSW-SMART-Shark-Management-Alert-in-Real-Time-Drumlines-Report-July-2021-June-2022.pdf
23/12/2021,12:21,White Shark,384,F,Alive,"ID, A",Ballina to Lennox Head,Lennox Headland,2021-12-23T12:21:00Z,2021,12,WHI,TRUE,TRUE,TRUE,NSW-SMART-Shark-Management-Alert-in-Real-Time-Drumlines-Report-July-2021-June-2022.pdf
27/01/2022,10:18,Common Blacktip,159,F,Alive,ID,Ballina to Lennox Head,Lennox Headland,2022-01-27T10:18:00Z,2022,1,CBT,FALSE,TRUE,FALSE,NSW-SMART-Shark-Management-Alert-in-Real-Time-Drumlines-Report-July-2021-June-2022.pdf
17/05/2022,10:51,Sandbar Shark,201,F,Alive,ID,Ballina to Lennox Head,Lennox Headland,2022-05-17T10:51:00Z,2022,5,SAN,FALSE,TRUE,FALSE,NSW-SMART-Shark-Management-Alert-in-Real-Time-Drumlines-Report-July-2021-June-2022.pdf
06/06/2022,9:40,Common Blacktip,249,F,Alive,ID,Ballina to Lennox Head,Lennox Headland,2022-06-06T09:40:00Z,2022,6,CBT,FALSE,TRUE,FALSE,NSW-SMART-Shark-Management-Alert-in-Real-Time-Drumlines-Report-July-2021-June-2022.pdf
26/06/2022,12:01,Common Blacktip,255,M,Alive,ID,Ballina to Lennox Head,Lennox Headland,2022-06-26T12:01:00Z,2022,6,CBT,FALSE,TRUE,FALSE,NSW-SMART-Shark-Management-Alert-in-Real-Time-Drumlines-Report-July-2021-June-2022.pdf
16/08/2021,10:34,White Shark,256,M,Alive,"ID, A",Ballina to Lennox Head,Boulders Beach,2021-08-16T10:34:00Z,2021,8,WHI,TRUE,TRUE,TRUE,NSW-SMART-Shark-Management-Alert-in-Real-Time-Drumlines-Report-July-2021-June-2022.pdf
19/08/2021,9:38,Tiger Shark,354,F,Alive,"ID, A",Ballina to Lennox Head,Boulders Beach,2021-08-19T09:38:00Z,2021,8,TIG,TRUE,TRUE,TRUE,NSW-SMART-Shark-Management-Alert-in-Real-Time-Drumlines-Report-July-2021-June-2022.pdf
29/09/2021,10:17,Tiger Shark,241,F,Alive,"ID, A",Ballina to Lennox Head,Boulders Beach,2021-09-29T10:17:00Z,2021,9,TIG,TRUE,TRUE,TRUE,NSW-SMART-Shark-Management-Alert-in-Real-Time-Drumlines-Report-July-2021-June-2022.pdf
21/02/2022,10:37,Tiger Shark,262,F,Alive,"ID, A",Ballina to Lennox Head,Boulders Beach,2022-02-21T10:37:00Z,2022,2,TIG,TRUE,TRUE,TRUE,NSW-SMART-Shark-Management-Alert-in-Real-Time-Drumlines-Report-July-2021-June-2022.pdf
29/04/2022,9:52,Bull Shark,204,F,Alive,"ID, A",Ballina to Lennox Head,Boulders Beach,2022-04-29T09:52:00Z,2022,4,BUL,TRUE,TRUE,TRUE,NSW-SMART-Shark-Management-Alert-in-Real-Time-Drumlines-Report-July-2021-June-2022.pdf
29/05/2022,9:41,Sandbar Shark,202,F,Alive,ID,Ballina to Lennox Head,Boulders Beach,2022-05-29T09:41:00Z,2022,5,SAN,FALSE,TRUE,FALSE,NSW-SMART-Shark-Management-Alert-in-Real-Time-Drumlines-Report-July-2021-June-2022.pdf
10/07/2021,13:00,White Shark,301,M,Alive,"ID, A",Ballina to Lennox Head,Sharpes Beach,2021-07-10T13:00:00Z,2021,7,WHI,TRUE,TRUE,TRUE,NSW-SMART-Shark-Management-Alert-in-Real-Time-Drumlines-Report-July-2021-June-2022.pdf
13/07/2021,12:28,White Shark,292,M,Alive,"ID, A",Ballina to Lennox Head,Sharpes Beach,2021-07-13T12:28:00Z,2021,7,WHI,TRUE,TRUE,TRUE,NSW-SMART-Shark-Management-Alert-in-Real-Time-Drumlines-Report-July-2021-June-2022.pdf
15/07/2021,11:10,White Shark,236,F,Alive,"ID, A",Ballina to Lennox Head,Sharpes Beach,2021-07-15T11:10:00Z,2021,7,WHI,TRUE,TRUE,TRUE,NSW-SMART-Shark-Management-Alert-in-Real-Time-Drumlines-Report-July-2021-June-2022.pdf
11/08/2021,14:01,White Shark,283,M,Alive,"ID, A",Ballina to Lennox Head,Sharpes Beach,2021-08-11T14:01:00Z,2021,8,WHI,TRUE,TRUE,TRUE,NSW-SMART-Shark-Management-Alert-in-Real-Time-Drumlines-Report-July-2021-June-2022.pdf
18/08/2021,8:19,White Shark,280,M,Alive,"ID, A",Ballina to Lennox Head,Sharpes Beach,2021-08-18T08:19:00Z,2021,8,WHI,TRUE,TRUE,TRUE,NSW-SMART-Shark-Management-Alert-in-Real-Time-Drumlines-Report-July-2021-June-2022.pdf
19/08/2021,8:27,White Shark,201,M,Alive,"ID, A",Ballina to Lennox Head,Sharpes Beach,2021-08-19T08:27:00Z,2021,8,WHI,TRUE,TRUE,TRUE,NSW-SMART-Shark-Management-Alert-in-Real-Time-Drumlines-Report-July-2021-June-2022.pdf
31/08/2021,15:17,Dusky Whaler,NA,NA,Alive,-,Ballina to Lennox Head,Sharpes Beach,2021-08-31T15:17:00Z,2021,8,DUS,FALSE,FALSE,FALSE,NSW-SMART-Shark-Management-Alert-in-Real-Time-Drumlines-Report-July-2021-June-2022.pdf
31/08/2021,13:19,White Shark,171,F,Alive,"ID, A",Ballina to Lennox Head,Sharpes Beach,2021-08-31T13:19:00Z,2021,8,WHI,TRUE,TRUE,TRUE,NSW-SMART-Shark-Management-Alert-in-Real-Time-Drumlines-Report-July-2021-June-2022.pdf
02/09/2021,9:28,White Shark,240,F,Alive,"ID, A",Ballina to Lennox Head,Sharpes Beach,2021-09-02T09:28:00Z,2021,9,WHI,TRUE,TRUE,TRUE,NSW-SMART-Shark-Management-Alert-in-Real-Time-Drumlines-Report-July-2021-June-2022.pdf
05/10/2021,14:24,White Shark,298,F,Alive,"ID, A",Ballina to Lennox Head,Sharpes Beach,2021-10-05T14:24:00Z,2021,10,WHI,TRUE,TRUE,TRUE,NSW-SMART-Shark-Management-Alert-in-Real-Time-Drumlines-Report-July-2021-June-2022.pdf
02/11/2021,9:06,Dusky Whaler,290,M,Alive,ID,Ballina to Lennox Head,Sharpes Beach,2021-11-02T09:06:00Z,2021,11,DUS,FALSE,TRUE,FALSE,NSW-SMART-Shark-Management-Alert-in-Real-Time-Drumlines-Report-July-2021-June-2022.pdf
13/11/2021,11:20,Tiger Shark,232,M,Alive,"ID, A",Ballina to Lennox Head,Sharpes Beach,2021-11-13T11:20:00Z,2021,11,TIG,TRUE,TRUE,TRUE,NSW-SMART-Shark-Management-Alert-in-Real-Time-Drumlines-Report-July-2021-June-2022.pdf
15/11/2021,10:43,Tiger Shark,238,M,Alive,"ID, A",Ballina to Lennox Head,Sharpes Beach,2021-11-15T10:43:00Z,2021,11,TIG,TRUE,TRUE,TRUE,NSW-SMART-Shark-Management-Alert-in-Real-Time-Drumlines-Report-July-2021-June-2022.pdf
30/11/2021,13:24,Dusky Whaler,300,NA,Alive,-,Ballina to Lennox Head,Sharpes Beach,2021-11-30T13:24:00Z,2021,11,DUS,FALSE,FALSE,FALSE,NSW-SMART-Shark-Management-Alert-in-Real-Time-Drumlines-Report-July-2021-June-2022.pdf
10/12/2021,10:49,Bull Shark,201,M,Alive,"ID, A",Ballina to Lennox Head,Sharpes Beach,2021-12-10T10:49:00Z,2021,12,BUL,TRUE,TRUE,TRUE,NSW-SMART-Shark-Management-Alert-in-Real-Time-Drumlines-Report-July-2021-June-2022.pdf
22/12/2021,10:53,White Shark,297,F,Alive,"ID, A",Ballina to Lennox Head,Sharpes Beach,2021-12-22T10:53:00Z,2021,12,WHI,TRUE,TRUE,TRUE,NSW-SMART-Shark-Management-Alert-in-Real-Time-Drumlines-Report-July-2021-June-2022.pdf
30/12/2021,12:44,Bull Shark,198,F,Alive,"ID, A",Ballina to Lennox Head,Sharpes Beach,2021-12-30T12:44:00Z,2021,12,BUL,TRUE,TRUE,TRUE,NSW-SMART-Shark-Management-Alert-in-Real-Time-Drumlines-Report-July-2021-June-2022.pdf
29/01/2022,17:10,Common Blacktip,156,F,Alive,ID,Ballina to Lennox Head,Sharpes Beach,2022-01-29T17:10:00Z,2022,1,CBT,FALSE,TRUE,FALSE,NSW-SMART-Shark-Management-Alert-in-Real-Time-Drumlines-Report-July-2021-June-2022.pdf
02/02/2022,9:25,Bull Shark,242,F,Alive,"ID, A",Ballina to Lennox Head,Sharpes Beach,2022-02-02T09:25:00Z,2022,2,BUL,TRUE,TRUE,TRUE,NSW-SMART-Shark-Management-Alert-in-Real-Time-Drumlines-Report-July-2021-June-2022.pdf
10/02/2022,8:34,Bull Shark,188,M,Alive,"ID, A",Ballina to Lennox Head,Sharpes Beach,2022-02-10T08:34:00Z,2022,2,BUL,TRUE,TRUE,TRUE,NSW-SMART-Shark-Management-Alert-in-Real-Time-Drumlines-Report-July-2021-June-2022.pdf
15/02/2022,10:06,Bull Shark,166,F,Alive,"ID, A",Ballina to Lennox Head,Sharpes Beach,2022-02-15T10:06:00Z,2022,2,BUL,TRUE,TRUE,TRUE,NSW-SMART-Shark-Management-Alert-in-Real-Time-Drumlines-Report-July-2021-June-2022.pdf
16/02/2022,9:48,Bull Shark,188,F,Alive,"ID, A",Ballina to Lennox Head,Sharpes Beach,2022-02-16T09:48:00Z,2022,2,BUL,TRUE,TRUE,TRUE,NSW-SMART-Shark-Management-Alert-in-Real-Time-Drumlines-Report-July-2021-June-2022.pdf
18/02/2022,NA,Tiger Shark,253,F,Alive,"ID, A",Ballina to Lennox Head,Sharpes Beach,NA,2022,2,TIG,TRUE,TRUE,TRUE,NSW-SMART-Shark-Management-Alert-in-Real-Time-Drumlines-Report-July-2021-June-2022.pdf
22/02/2022,14:00,Tiger Shark,198,M,Alive,"ID, A",Ballina to Lennox Head,Sharpes Beach,2022-02-22T14:00:00Z,2022,2,TIG,TRUE,TRUE,TRUE,NSW-SMART-Shark-Management-Alert-in-Real-Time-Drumlines-Report-July-2021-June-2022.pdf
28/03/2022,9:51,Bull Shark,162,M,Alive,"ID, A",Ballina to Lennox Head,Sharpes Beach,2022-03-28T09:51:00Z,2022,3,BUL,TRUE,TRUE,TRUE,NSW-SMART-Shark-Management-Alert-in-Real-Time-Drumlines-Report-July-2021-June-2022.pdf
05/05/2022,13:15,Dusky Whaler,270,M,Alive,ID,Ballina to Lennox Head,Sharpes Beach,2022-05-05T13:15:00Z,2022,5,DUS,FALSE,TRUE,FALSE,NSW-SMART-Shark-Management-Alert-in-Real-Time-Drumlines-Report-July-2021-June-2022.pdf
16/06/2022,14:57,Common Blacktip,233,M,Alive,ID,Ballina to Lennox Head,Sharpes Beach,2022-06-16T14:57:00Z,2022,6,CBT,FALSE,TRUE,FALSE,NSW-SMART-Shark-Management-Alert-in-Real-Time-Drumlines-Report-July-2021-June-2022.pdf
25/06/2022,9:13,Greynurse Shark,NA,NA,Alive,-,Ballina to Lennox Head,Sharpes Beach,2022-06-25T09:13:00Z,2022,6,GRN,FALSE,FALSE,FALSE,NSW-SMART-Shark-Management-Alert-in-Real-Time-Drumlines-Report-July-2021-June-2022.pdf
29/07/2021,7:26,Smooth Hammerhead,159,F,Alive,ID,Ballina to Lennox Head,Angels Beach,2021-07-29T07:26:00Z,2021,7,SMH,FALSE,TRUE,FALSE,NSW-SMART-Shark-Management-Alert-in-Real-Time-Drumlines-Report-July-2021-June-2022.pdf
03/08/2021,14:54,Dusky Whaler,291,M,Alive,ID,Ballina to Lennox Head,Angels Beach,2021-08-03T14:54:00Z,2021,8,DUS,FALSE,TRUE,FALSE,NSW-SMART-Shark-Management-Alert-in-Real-Time-Drumlines-Report-July-2021-June-2022.pdf
27/08/2021,8:38,White Shark,232,M,Alive,"ID, A",Ballina to Lennox Head,Angels Beach,2021-08-27T08:38:00Z,2021,8,WHI,TRUE,TRUE,TRUE,NSW-SMART-Shark-Management-Alert-in-Real-Time-Drumlines-Report-July-2021-June-2022.pdf
02/09/2021,8:12,Tiger Shark,193,M,Alive,"ID, A",Ballina to Lennox Head,Angels Beach,2021-09-02T08:12:00Z,2021,9,TIG,TRUE,TRUE,TRUE,NSW-SMART-Shark-Management-Alert-in-Real-Time-Drumlines-Report-July-2021-June-2022.pdf
05/09/2021,7:58,White Shark,238,F,Alive,"ID, A",Ballina to Lennox Head,Angels Beach,2021-09-05T07:58:00Z,2021,9,WHI,TRUE,TRUE,TRUE,NSW-SMART-Shark-Management-Alert-in-Real-Time-Drumlines-Report-July-2021-June-2022.pdf
17/09/2021,11:45,Dusky Whaler,174,F,Alive,ID,Ballina to Lennox Head,Angels Beach,2021-09-17T11:45:00Z,2021,9,DUS,FALSE,TRUE,FALSE,NSW-SMART-Shark-Management-Alert-in-Real-Time-Drumlines-Report-July-2021-June-2022.pdf
30/12/2021,13:27,Tiger Shark,214,F,Alive,"ID, A",Ballina to Lennox Head,Angels Beach,2021-12-30T13:27:00Z,2021,12,TIG,TRUE,TRUE,TRUE,NSW-SMART-Shark-Management-Alert-in-Real-Time-Drumlines-Report-July-2021-June-2022.pdf
27/01/2022,10:17,Bull Shark,182,M,Alive,"ID, A",Ballina to Lennox Head,Angels Beach,2022-01-27T10:17:00Z,2022,1,BUL,TRUE,TRUE,TRUE,NSW-SMART-Shark-Management-Alert-in-Real-Time-Drumlines-Report-July-2021-June-2022.pdf
19/07/2021,11:27,Dusky Whaler,162,M,Alive,ID,Ballina to Lennox Head,Shelly Beach,2021-07-19T11:27:00Z,2021,7,DUS,FALSE,TRUE,FALSE,NSW-SMART-Shark-Management-Alert-in-Real-Time-Drumlines-Report-July-2021-June-2022.pdf
27/08/2021,12:49,White Shark,271,F,Alive,"ID, A",Ballina to Lennox Head,Shelly Beach,2021-08-27T12:49:00Z,2021,8,WHI,TRUE,TRUE,TRUE,NSW-SMART-Shark-Management-Alert-in-Real-Time-Drumlines-Report-July-2021-June-2022.pdf
23/10/2021,10:05,White Shark,254,F,Alive,"ID, A",Ballina to Lennox Head,Shelly Beach,2021-10-23T10:05:00Z,2021,10,WHI,TRUE,TRUE,TRUE,NSW-SMART-Shark-Management-Alert-in-Real-Time-Drumlines-Report-July-2021-June-2022.pdf
22/11/2021,13:29,Tiger Shark,243,M,Alive,"ID, A",Ballina to Lennox Head,Shelly Beach,2021-11-22T13:29:00Z,2021,11,TIG,TRUE,TRUE,TRUE,NSW-SMART-Shark-Management-Alert-in-Real-Time-Drumlines-Report-July-2021-June-2022.pdf
11/12/2021,11:47,Bull Shark,278,F,Alive,"ID, A",Ballina to Lennox Head,Shelly Beach,2021-12-11T11:47:00Z,2021,12,BUL,TRUE,TRUE,TRUE,NSW-SMART-Shark-Management-Alert-in-Real-Time-Drumlines-Report-July-2021-June-2022.pdf
27/01/2022,9:25,Common Blacktip,146,F,Alive,ID,Ballina to Lennox Head,Shelly Beach,2022-01-27T09:25:00Z,2022,1,CBT,FALSE,TRUE,FALSE,NSW-SMART-Shark-Management-Alert-in-Real-Time-Drumlines-Report-July-2021-June-2022.pdf
21/02/2022,10:41,Tiger Shark,NA,NA,Alive,-,Ballina to Lennox Head,Shelly Beach,2022-02-21T10:41:00Z,2022,2,TIG,TRUE,FALSE,FALSE,NSW-SMART-Shark-Management-Alert-in-Real-Time-Drumlines-Report-July-2021-June-2022.pdf
26/05/2022,10:32,Common Blacktip,160,F,Alive,ID,Ballina to Lennox Head,Shelly Beach,2022-05-26T10:32:00Z,2022,5,CBT,FALSE,TRUE,FALSE,NSW-SMART-Shark-Management-Alert-in-Real-Time-Drumlines-Report-July-2021-June-2022.pdf
31/05/2022,9:30,White Shark,305,F,Alive,"ID, A",Ballina to Lennox Head,Shelly Beach,2022-05-31T09:30:00Z,2022,5,WHI,TRUE,TRUE,TRUE,NSW-SMART-Shark-Management-Alert-in-Real-Time-Drumlines-Report-July-2021-June-2022.pdf
16/06/2022,11:52,Common Blacktip,131,M,Alive,ID,Ballina to Lennox Head,Shelly Beach,2022-06-16T11:52:00Z,2022,6,CBT,FALSE,TRUE,FALSE,NSW-SMART-Shark-Management-Alert-in-Real-Time-Drumlines-Report-July-2021-June-2022.pdf
31/08/2021,16:33,Dusky Whaler,275,F,Alive,ID,Ballina to Lennox Head,Lighthouse Beach,2021-08-31T16:33:00Z,2021,8,DUS,FALSE,TRUE,FALSE,NSW-SMART-Shark-Management-Alert-in-Real-Time-Drumlines-Report-July-2021-June-2022.pdf
31/08/2021,10:24,White Shark,204,M,Alive,"ID, A",Ballina to Lennox Head,Lighthouse Beach,2021-08-31T10:24:00Z,2021,8,WHI,TRUE,TRUE,TRUE,NSW-SMART-Shark-Management-Alert-in-Real-Time-Drumlines-Report-July-2021-June-2022.pdf
08/10/2021,8:01,White Shark,340,M,Alive,"ID, A",Ballina to Lennox Head,Lighthouse Beach,2021-10-08T08:01:00Z,2021,10,WHI,TRUE,TRUE,TRUE,NSW-SMART-Shark-Management-Alert-in-Real-Time-Drumlines-Report-July-2021-June-2022.pdf
04/11/2021,10:27,Tiger Shark,245,M,Alive,"ID, A",Ballina to Lennox Head,Lighthouse Beach,2021-11-04T10:27:00Z,2021,11,TIG,TRUE,TRUE,TRUE,NSW-SMART-Shark-Management-Alert-in-Real-Time-Drumlines-Report-July-2021-June-2022.pdf
13/11/2021,14:23,Tiger Shark,255,M,Alive,"ID, A",Ballina to Lennox Head,Lighthouse Beach,2021-11-13T14:23:00Z,2021,11,TIG,TRUE,TRUE,TRUE,NSW-SMART-Shark-Management-Alert-in-Real-Time-Drumlines-Report-July-2021-June-2022.pdf
15/02/2022,8:23,Bull Shark,186,M,Alive,"ID, A",Ballina to Lennox Head,Lighthouse Beach,2022-02-15T08:23:00Z,2022,2,BUL,TRUE,TRUE,TRUE,NSW-SMART-Shark-Management-Alert-in-Real-Time-Drumlines-Report-July-2021-June-2022.pdf
16/05/2022,15:27,Sandbar Shark,140,F,Alive,ID,Ballina to Lennox Head,Lighthouse Beach,2022-05-16T15:27:00Z,2022,5,SAN,FALSE,TRUE,FALSE,NSW-SMART-Shark-Management-Alert-in-Real-Time-Drumlines-Report-July-2021-June-2022.pdf
27/05/2022,11:23,Leatherback Turtle,200,NA,Alive,-,Ballina to Lennox Head,Lighthouse Beach,2022-05-27T11:23:00Z,2022,5,LBT,FALSE,FALSE,FALSE,NSW-SMART-Shark-Management-Alert-in-Real-Time-Drumlines-Report-July-2021-June-2022.pdf
29/05/2022,8:22,Common Blacktip,229,F,Alive,ID,Ballina to Lennox Head,Lighthouse Beach,2022-05-29T08:22:00Z,2022,5,CBT,FALSE,TRUE,FALSE,NSW-SMART-Shark-Management-Alert-in-Real-Time-Drumlines-Report-July-2021-June-2022.pdf
15/06/2022,8:28,Dusky Whaler,365,F,Alive,ID,Ballina to Lennox Head,Lighthouse Beach,2022-06-15T08:28:00Z,2022,6,DUS,FALSE,TRUE,FALSE,NSW-SMART-Shark-Management-Alert-in-Real-Time-Drumlines-Report-July-2021-June-2022.pdf
17/07/2021,14:50,Smooth Hammerhead,171,F,Alive,ID,Ballina to Lennox Head,South Ballina Beach,2021-07-17T14:50:00Z,2021,7,SMH,FALSE,TRUE,FALSE,NSW-SMART-Shark-Management-Alert-in-Real-Time-Drumlines-Report-July-2021-June-2022.pdf
28/07/2021,8:36,White Shark,265,F,Alive,"ID, A",Ballina to Lennox Head,South Ballina Beach,2021-07-28T08:36:00Z,2021,7,WHI,TRUE,TRUE,TRUE,NSW-SMART-Shark-Management-Alert-in-Real-Time-Drumlines-Report-July-2021-June-2022.pdf
30/07/2021,12:33,White Shark,163,M,Alive,"ID, A",Ballina to Lennox Head,South Ballina Beach,2021-07-30T12:33:00Z,2021,7,WHI,TRUE,TRUE,TRUE,NSW-SMART-Shark-Management-Alert-in-Real-Time-Drumlines-Report-July-2021-June-2022.pdf
15/08/2021,11:07,White Shark,192,F,Alive,"ID, A",Ballina to Lennox Head,South Ballina Beach,2021-08-15T11:07:00Z,2021,8,WHI,TRUE,TRUE,TRUE,NSW-SMART-Shark-Management-Alert-in-Real-Time-Drumlines-Report-July-2021-June-2022.pdf
19/09/2021,11:56,Shortfin Mako,204,F,Alive,ID,Ballina to Lennox Head,South Ballina Beach,2021-09-19T11:56:00Z,2021,9,SMA,FALSE,TRUE,FALSE,NSW-SMART-Shark-Management-Alert-in-Real-Time-Drumlines-Report-July-2021-June-2022.pdf
19/09/2021,14:33,Dusky Whaler,289,M,Alive,ID,Ballina to Lennox Head,South Ballina Beach,2021-09-19T14:33:00Z,2021,9,DUS,FALSE,TRUE,FALSE,NSW-SMART-Shark-Management-Alert-in-Real-Time-Drumlines-Report-July-2021-June-2022.pdf
23/09/2021,8:50,White Shark,251,M,Alive,"ID, A",Ballina to Lennox Head,South Ballina Beach,2021-09-23T08:50:00Z,2021,9,WHI,TRUE,TRUE,TRUE,NSW-SMART-Shark-Management-Alert-in-Real-Time-Drumlines-Report-July-2021-June-2022.pdf
30/09/2021,8:29,White Shark,180,M,Alive,"ID, A",Ballina to Lennox Head,South Ballina Beach,2021-09-30T08:29:00Z,2021,9,WHI,TRUE,TRUE,TRUE,NSW-SMART-Shark-Management-Alert-in-Real-Time-Drumlines-Report-July-2021-June-2022.pdf
04/10/2021,14:26,White Shark,212,F,Alive,"ID, A",Ballina to Lennox Head,South Ballina Beach,2021-10-04T14:26:00Z,2021,10,WHI,TRUE,TRUE,TRUE,NSW-SMART-Shark-Management-Alert-in-Real-Time-Drumlines-Report-July-2021-June-2022.pdf
08/10/2021,14:49,Greynurse Shark,273,F,Alive,ID,Ballina to Lennox Head,South Ballina Beach,2021-10-08T14:49:00Z,2021,10,GRN,FALSE,TRUE,FALSE,NSW-SMART-Shark-Management-Alert-in-Real-Time-Drumlines-Report-July-2021-June-2022.pdf
21/10/2021,7:23,White Shark,299,F,Alive,"ID, A",Ballina to Lennox Head,South Ballina Beach,2021-10-21T07:23:00Z,2021,10,WHI,TRUE,TRUE,TRUE,NSW-SMART-Shark-Management-Alert-in-Real-Time-Drumlines-Report-July-2021-June-2022.pdf
24/10/2021,16:53,White Shark,215,F,Alive,"ID, A",Ballina to Lennox Head,South Ballina Beach,2021-10-24T16:53:00Z,2021,10,WHI,TRUE,TRUE,TRUE,NSW-SMART-Shark-Management-Alert-in-Real-Time-Drumlines-Report-July-2021-June-2022.pdf
26/10/2021,10:06,White Shark,270,F,Alive,"ID, A",Ballina to Lennox Head,South Ballina Beach,2021-10-26T10:06:00Z,2021,10,WHI,TRUE,TRUE,TRUE,NSW-SMART-Shark-Management-Alert-in-Real-Time-Drumlines-Report-July-2021-June-2022.pdf
15/11/2021,13:26,White Shark,220,M,Alive,"ID, A",Ballina to Lennox Head,South Ballina Beach,2021-11-15T13:26:00Z,2021,11,WHI,TRUE,TRUE,TRUE,NSW-SMART-Shark-Management-Alert-in-Real-Time-Drumlines-Report-July-2021-June-2022.pdf
03/12/2021,11:35,Common Blacktip,158,F,Alive,ID,Ballina to Lennox Head,South Ballina Beach,2021-12-03T11:35:00Z,2021,12,CBT,FALSE,TRUE,FALSE,NSW-SMART-Shark-Management-Alert-in-Real-Time-Drumlines-Report-July-2021-June-2022.pdf
15/01/2022,10:52,Common Blacktip,250,M,Alive,ID,Ballina to Lennox Head,South Ballina Beach,2022-01-15T10:52:00Z,2022,1,CBT,FALSE,TRUE,FALSE,NSW-SMART-Shark-Management-Alert-in-Real-Time-Drumlines-Report-July-2021-June-2022.pdf
26/01/2022,8:06,Bull Shark,189,F,Alive,"ID, A",Ballina to Lennox Head,South Ballina Beach,2022-01-26T08:06:00Z,2022,1,BUL,TRUE,TRUE,TRUE,NSW-SMART-Shark-Management-Alert-in-Real-Time-Drumlines-Report-July-2021-June-2022.pdf
22/03/2022,7:27,Bull Shark,229,F,Alive,"ID, A",Ballina to Lennox Head,South Ballina Beach,2022-03-22T07:27:00Z,2022,3,BUL,TRUE,TRUE,TRUE,NSW-SMART-Shark-Management-Alert-in-Real-Time-Drumlines-Report-July-2021-June-2022.pdf
23/03/2022,9:14,Bull Shark,173,M,Alive,"ID, A",Ballina to Lennox Head,South Ballina Beach,2022-03-23T09:14:00Z,2022,3,BUL,TRUE,TRUE,TRUE,NSW-SMART-Shark-Management-Alert-in-Real-Time-Drumlines-Report-July-2021-June-2022.pdf
20/04/2022,7:59,Bull Shark,182,M,Alive,"ID, A",Ballina to Lennox Head,South Ballina Beach,2022-04-20T07:59:00Z,2022,4,BUL,TRUE,TRUE,TRUE,NSW-SMART-Shark-Management-Alert-in-Real-Time-Drumlines-Report-July-2021-June-2022.pdf
26/05/2022,13:28,White Shark,258,F,Alive,"ID, A",Ballina to Lennox Head,South Ballina Beach,2022-05-26T13:28:00Z,2022,5,WHI,TRUE,TRUE,TRUE,NSW-SMART-Shark-Management-Alert-in-Real-Time-Drumlines-Report-July-2021-June-2022.pdf
27/05/2022,10:59,Common Blacktip,222,M,Alive,ID,Ballina to Lennox Head,South Ballina Beach,2022-05-27T10:59:00Z,2022,5,CBT,FALSE,TRUE,FALSE,NSW-SMART-Shark-Management-Alert-in-Real-Time-Drumlines-Report-July-2021-June-2022.pdf
29/05/2022,9:25,Common Blacktip,145,F,Alive,ID,Ballina to Lennox Head,South Ballina Beach,2022-05-29T09:25:00Z,2022,5,CBT,FALSE,TRUE,FALSE,NSW-SMART-Shark-Management-Alert-in-Real-Time-Drumlines-Report-July-2021-June-2022.pdf
31/05/2022,8:00,Common Blacktip,242,F,Alive,ID,Ballina to Lennox Head,South Ballina Beach,2022-05-31T08:00:00Z,2022,5,CBT,FALSE,TRUE,FALSE,NSW-SMART-Shark-Management-Alert-in-Real-Time-Drumlines-Report-July-2021-June-2022.pdf
16/06/2022,11:54,White Shark,323,F,Alive,"ID, A",Ballina to Lennox Head,South Ballina Beach,2022-06-16T11:54:00Z,2022,6,WHI,TRUE,TRUE,TRUE,NSW-SMART-Shark-Management-Alert-in-Real-Time-Drumlines-Report-July-2021-June-2022.pdf
16/06/2022,14:41,Common Blacktip,231,M,Alive,ID,Ballina to Lennox Head,South Ballina Beach,2022-06-16T14:41:00Z,2022,6,CBT,FALSE,TRUE,FALSE,NSW-SMART-Shark-Management-Alert-in-Real-Time-Drumlines-Report-July-2021-June-2022.pdf
29/06/2022,7:27,White Shark,241,M,Alive,"ID, A",Ballina to Lennox Head,South Ballina Beach,2022-06-29T07:27:00Z,2022,6,WHI,TRUE,TRUE,TRUE,NSW-SMART-Shark-Management-Alert-in-Real-Time-Drumlines-Report-July-2021-June-2022.pdf
13/07/2021,12:51,White Shark,317,M,Alive,"ID, A",Evans Head,Joggly Point,2021-07-13T12:51:00Z,2021,7,WHI,TRUE,TRUE,TRUE,NSW-SMART-Shark-Management-Alert-in-Real-Time-Drumlines-Report-July-2021-June-2022.pdf
14/07/2021,11:12,White Shark,265,M,Alive,"ID, A",Evans Head,Joggly Point,2021-07-14T11:12:00Z,2021,7,WHI,TRUE,TRUE,TRUE,NSW-SMART-Shark-Management-Alert-in-Real-Time-Drumlines-Report-July-2021-June-2022.pdf
16/07/2021,13:55,White Shark,212,M,Alive,"ID, A",Evans Head,Joggly Point,2021-07-16T13:55:00Z,2021,7,WHI,TRUE,TRUE,TRUE,NSW-SMART-Shark-Management-Alert-in-Real-Time-Drumlines-Report-July-2021-June-2022.pdf
16/08/2021,10:43,White Shark,167,F,Alive,"ID, A",Evans Head,Joggly Point,2021-08-16T10:43:00Z,2021,8,WHI,TRUE,TRUE,TRUE,NSW-SMART-Shark-Management-Alert-in-Real-Time-Drumlines-Report-July-2021-June-2022.pdf
17/08/2021,10:08,White Shark,203,M,Alive,"ID, A",Evans Head,Joggly Point,2021-08-17T10:08:00Z,2021,8,WHI,TRUE,TRUE,TRUE,NSW-SMART-Shark-Management-Alert-in-Real-Time-Drumlines-Report-July-2021-June-2022.pdf
21/08/2021,9:34,White Shark,228,M,Alive,"ID, A",Evans Head,Joggly Point,2021-08-21T09:34:00Z,2021,8,WHI,TRUE,TRUE,TRUE,NSW-SMART-Shark-Management-Alert-in-Real-Time-Drumlines-Report-July-2021-June-2022.pdf
21/08/2021,14:39,White Shark,224,M,Alive,"ID, A",Evans Head,Joggly Point,2021-08-21T14:39:00Z,2021,8,WHI,TRUE,TRUE,TRUE,NSW-SMART-Shark-Management-Alert-in-Real-Time-Drumlines-Report-July-2021-June-2022.pdf
02/09/2021,8:26,Greynurse Shark,263,F,Alive,ID,Evans Head,Joggly Point,2021-09-02T08:26:00Z,2021,9,GRN,FALSE,TRUE,FALSE,NSW-SMART-Shark-Management-Alert-in-Real-Time-Drumlines-Report-July-2021-June-2022.pdf
03/09/2021,11:52,White Shark,215,M,Alive,"ID, A",Evans Head,Joggly Point,2021-09-03T11:52:00Z,2021,9,WHI,TRUE,TRUE,TRUE,NSW-SMART-Shark-Management-Alert-in-Real-Time-Drumlines-Report-July-2021-June-2022.pdf
05/09/2021,10:01,Tiger Shark,308,F,Alive,"ID, A",Evans Head,Joggly Point,2021-09-05T10:01:00Z,2021,9,TIG,TRUE,TRUE,TRUE,NSW-SMART-Shark-Management-Alert-in-Real-Time-Drumlines-Report-July-2021-June-2022.pdf
12/09/2021,9:56,White Shark,205,M,Alive,"ID, A",Evans Head,Joggly Point,2021-09-12T09:56:00Z,2021,9,WHI,TRUE,TRUE,TRUE,NSW-SMART-Shark-Management-Alert-in-Real-Time-Drumlines-Report-July-2021-June-2022.pdf
26/09/2021,9:11,Tiger Shark,225,F,Alive,"ID, A",Evans Head,Joggly Point,2021-09-26T09:11:00Z,2021,9,TIG,TRUE,TRUE,TRUE,NSW-SMART-Shark-Management-Alert-in-Real-Time-Drumlines-Report-July-2021-June-2022.pdf
03/10/2021,9:12,White Shark,205,M,Alive,"ID, A",Evans Head,Joggly Point,2021-10-03T09:12:00Z,2021,10,WHI,TRUE,TRUE,TRUE,NSW-SMART-Shark-Management-Alert-in-Real-Time-Drumlines-Report-July-2021-June-2022.pdf
24/11/2021,16:04,White Shark,260,F,Alive,"ID, A",Evans Head,Joggly Point,2021-11-24T16:04:00Z,2021,11,WHI,TRUE,TRUE,TRUE,NSW-SMART-Shark-Management-Alert-in-Real-Time-Drumlines-Report-July-2021-June-2022.pdf
27/11/2021,17:00,Common Blacktip,147,M,Alive,ID,Evans Head,Joggly Point,2021-11-27T17:00:00Z,2021,11,CBT,FALSE,TRUE,FALSE,NSW-SMART-Shark-Management-Alert-in-Real-Time-Drumlines-Report-July-2021-June-2022.pdf
22/02/2022,11:24,Tiger Shark,240,F,Alive,"ID, A",Evans Head,Joggly Point,2022-02-22T11:24:00Z,2022,2,TIG,TRUE,TRUE,TRUE,NSW-SMART-Shark-Management-Alert-in-Real-Time-Drumlines-Report-July-2021-June-2022.pdf
22/02/2022,12:37,Tiger Shark,241,F,Alive,"ID, A",Evans Head,Joggly Point,2022-02-22T12:37:00Z,2022,2,TIG,TRUE,TRUE,TRUE,NSW-SMART-Shark-Management-Alert-in-Real-Time-Drumlines-Report-July-2021-June-2022.pdf
22/04/2022,12:23,Tiger Shark,NA,NA,Alive,-,Evans Head,Joggly Point,2022-04-22T12:23:00Z,2022,4,TIG,TRUE,FALSE,FALSE,NSW-SMART-Shark-Management-Alert-in-Real-Time-Drumlines-Report-July-2021-June-2022.pdf
29/04/2022,13:30,Sandbar Shark,136,M,Alive,ID,Evans Head,Joggly Point,2022-04-29T13:30:00Z,2022,4,SAN,FALSE,TRUE,FALSE,NSW-SMART-Shark-Management-Alert-in-Real-Time-Drumlines-Report-July-2021-June-2022.pdf
4/05/2022,9:15,Tiger Shark,205,M,Alive,"ID, A",Evans Head,Joggly Point,2022-05-04T09:15:00Z,2022,5,TIG,TRUE,TRUE,TRUE,NSW-SMART-Shark-Management-Alert-in-Real-Time-Drumlines-Report-July-2021-June-2022.pdf
16/05/2022,13:04,Tiger Shark,220,M,Alive,"ID, A",Evans Head,Joggly Point,2022-05-16T13:04:00Z,2022,5,TIG,TRUE,TRUE,TRUE,NSW-SMART-Shark-Management-Alert-in-Real-Time-Drumlines-Report-July-2021-June-2022.pdf
03/06/2022,10:18,White Shark,265,M,Alive,"ID, A",Evans Head,Joggly Point,2022-06-03T10:18:00Z,2022,6,WHI,TRUE,TRUE,TRUE,NSW-SMART-Shark-Management-Alert-in-Real-Time-Drumlines-Report-July-2021-June-2022.pdf
06/06/2022,10:49,Tiger Shark,183,F,Alive,"ID, A",Evans Head,Joggly Point,2022-06-06T10:49:00Z,2022,6,TIG,TRUE,TRUE,TRUE,NSW-SMART-Shark-Management-Alert-in-Real-Time-Drumlines-Report-July-2021-June-2022.pdf
13/06/2022,10:09,Greynurse Shark,265,F,Alive,ID,Evans Head,Joggly Point,2022-06-13T10:09:00Z,2022,6,GRN,FALSE,TRUE,FALSE,NSW-SMART-Shark-Management-Alert-in-Real-Time-Drumlines-Report-July-2021-June-2022.pdf
15/06/2022,10:35,White Shark,240,F,Alive,"ID, A",Evans Head,Joggly Point,2022-06-15T10:35:00Z,2022,6,WHI,TRUE,TRUE,TRUE,NSW-SMART-Shark-Management-Alert-in-Real-Time-Drumlines-Report-July-2021-June-2022.pdf
27/06/2022,7:00,White Shark,250,M,Alive,"ID, A",Evans Head,Joggly Point,2022-06-27T07:00:00Z,2022,6,WHI,TRUE,TRUE,TRUE,NSW-SMART-Shark-Management-Alert-in-Real-Time-Drumlines-Report-July-2021-June-2022.pdf
27/06/2022,11:07,White Shark,235,M,Alive,"ID, A",Evans Head,Joggly Point,2022-06-27T11:07:00Z,2022,6,WHI,TRUE,TRUE,TRUE,NSW-SMART-Shark-Management-Alert-in-Real-Time-Drumlines-Report-July-2021-June-2022.pdf
28/06/2022,12:40,White Shark,NA,NA,Alive,-,Evans Head,Joggly Point,2022-06-28T12:40:00Z,2022,6,WHI,TRUE,FALSE,FALSE,NSW-SMART-Shark-Management-Alert-in-Real-Time-Drumlines-Report-July-2021-June-2022.pdf
28/06/2022,NA,White Shark,298,F,Alive,"ID, A",Evans Head,Joggly Point,NA,2022,6,WHI,TRUE,TRUE,TRUE,NSW-SMART-Shark-Management-Alert-in-Real-Time-Drumlines-Report-July-2021-June-2022.pdf
18/09/2021,8:46,Greynurse Shark,215,M,Alive,ID,Evans Head,Shark Bay,2021-09-18T08:46:00Z,2021,9,GRN,FALSE,TRUE,FALSE,NSW-SMART-Shark-Management-Alert-in-Real-Time-Drumlines-Report-July-2021-June-2022.pdf
24/09/2021,8:11,White Shark,210,F,Alive,"ID, A",Evans Head,Shark Bay,2021-09-24T08:11:00Z,2021,9,WHI,TRUE,TRUE,TRUE,NSW-SMART-Shark-Management-Alert-in-Real-Time-Drumlines-Report-July-2021-June-2022.pdf
29/04/2022,13:23,Sandbar Shark,NA,NA,Alive,-,Evans Head,Shark Bay,2022-04-29T13:23:00Z,2022,4,SAN,FALSE,FALSE,FALSE,NSW-SMART-Shark-Management-Alert-in-Real-Time-Drumlines-Report-July-2021-June-2022.pdf
13/07/2021,12:14,White Shark,240,F,Alive,"ID, A",Evans Head,Main Beach,2021-07-13T12:14:00Z,2021,7,WHI,TRUE,TRUE,TRUE,NSW-SMART-Shark-Management-Alert-in-Real-Time-Drumlines-Report-July-2021-June-2022.pdf
19/07/2021,NA,Loggerhead turtle,70,NA,Alive,-,Evans Head,Main Beach,NA,2021,7,LOG,FALSE,FALSE,FALSE,NSW-SMART-Shark-Management-Alert-in-Real-Time-Drumlines-Report-July-2021-June-2022.pdf
28/07/2021,NA,Loggerhead turtle,70,NA,Alive,-,Evans Head,Main Beach,NA,2021,7,LOG,FALSE,FALSE,FALSE,NSW-SMART-Shark-Management-Alert-in-Real-Time-Drumlines-Report-July-2021-June-2022.pdf
30/07/2021,14:54,Loggerhead turtle,95,NA,Alive,-,Evans Head,Main Beach,2021-07-30T14:54:00Z,2021,7,LOG,FALSE,FALSE,FALSE,NSW-SMART-Shark-Management-Alert-in-Real-Time-Drumlines-Report-July-2021-June-2022.pdf
8/08/2021,14:17,White Shark,187,M,Alive,"ID, A",Evans Head,Main Beach,2021-08-08T14:17:00Z,2021,8,WHI,TRUE,TRUE,TRUE,NSW-SMART-Shark-Management-Alert-in-Real-Time-Drumlines-Report-July-2021-June-2022.pdf
9/08/2021,12:50,White Shark,238,F,Alive,"ID, A",Evans Head,Main Beach,2021-08-09T12:50:00Z,2021,8,WHI,TRUE,TRUE,TRUE,NSW-SMART-Shark-Management-Alert-in-Real-Time-Drumlines-Report-July-2021-June-2022.pdf
12/08/2021,NA,White Shark,202,M,Alive,"ID, A",Evans Head,Main Beach,NA,2021,8,WHI,TRUE,TRUE,TRUE,NSW-SMART-Shark-Management-Alert-in-Real-Time-Drumlines-Report-July-2021-June-2022.pdf
18/08/2021,11:28,Greynurse Shark,280,F,Alive,ID,Evans Head,Main Beach,2021-08-18T11:28:00Z,2021,8,GRN,FALSE,TRUE,FALSE,NSW-SMART-Shark-Management-Alert-in-Real-Time-Drumlines-Report-July-2021-June-2022.pdf
18/08/2021,NA,Loggerhead turtle,NA,NA,Alive,-,Evans Head,Main Beach,NA,2021,8,LOG,FALSE,FALSE,FALSE,NSW-SMART-Shark-Management-Alert-in-Real-Time-Drumlines-Report-July-2021-June-2022.pdf
28/08/2021,8:11,White Shark,250,M,Alive,"ID, A",Evans Head,Main Beach,2021-08-28T08:11:00Z,2021,8,WHI,TRUE,TRUE,TRUE,NSW-SMART-Shark-Management-Alert-in-Real-Time-Drumlines-Report-July-2021-June-2022.pdf
28/08/2021,10:48,White Shark,277,F,Alive,"ID, A",Evans Head,Main Beach,2021-08-28T10:48:00Z,2021,8,WHI,TRUE,TRUE,TRUE,NSW-SMART-Shark-Management-Alert-in-Real-Time-Drumlines-Report-July-2021-June-2022.pdf
6/09/2021,8:51,White Shark,225,F,Alive,"ID, A",Evans Head,Main Beach,2021-09-06T08:51:00Z,2021,9,WHI,TRUE,TRUE,TRUE,NSW-SMART-Shark-Management-Alert-in-Real-Time-Drumlines-Report-July-2021-June-2022.pdf
6/09/2021,9:48,White Shark,168,F,Alive,"ID, A",Evans Head,Main Beach,2021-09-06T09:48:00Z,2021,9,WHI,TRUE,TRUE,TRUE,NSW-SMART-Shark-Management-Alert-in-Real-Time-Drumlines-Report-July-2021-June-2022.pdf
10/09/2021,10:06,White Shark,340,M,Alive,"ID, A",Evans Head,Main Beach,2021-09-10T10:06:00Z,2021,9,WHI,TRUE,TRUE,TRUE,NSW-SMART-Shark-Management-Alert-in-Real-Time-Drumlines-Report-July-2021-June-2022.pdf
10/09/2021,14:00,White Shark,210,F,Alive,"ID, A",Evans Head,Main Beach,2021-09-10T14:00:00Z,2021,9,WHI,TRUE,TRUE,TRUE,NSW-SMART-Shark-Management-Alert-in-Real-Time-Drumlines-Report-July-2021-June-2022.pdf
12/09/2021,14:30,White Shark,215,F,Alive,"ID, A",Evans Head,Main Beach,2021-09-12T14:30:00Z,2021,9,WHI,TRUE,TRUE,TRUE,NSW-SMART-Shark-Management-Alert-in-Real-Time-Drumlines-Report-July-2021-June-2022.pdf
15/09/2021,11:44,White Shark,240,M,Alive,"ID, A",Evans Head,Main Beach,2021-09-15T11:44:00Z,2021,9,WHI,TRUE,TRUE,TRUE,NSW-SMART-Shark-Management-Alert-in-Real-Time-Drumlines-Report-July-2021-June-2022.pdf
4/10/2021,11:12,Tiger Shark,228,F,Alive,"ID, A",Evans Head,Main Beach,2021-10-04T11:12:00Z,2021,10,TIG,TRUE,TRUE,TRUE,NSW-SMART-Shark-Management-Alert-in-Real-Time-Drumlines-Report-July-2021-June-2022.pdf
5/10/2021,11:26,White Shark,208,M,Alive,"ID, A",Evans Head,Main Beach,2021-10-05T11:26:00Z,2021,10,WHI,TRUE,TRUE,TRUE,NSW-SMART-Shark-Management-Alert-in-Real-Time-Drumlines-Report-July-2021-June-2022.pdf
6/10/2021,16:14,White Shark,300,F,Alive,"ID, A",Evans Head,Main Beach,2021-10-06T16:14:00Z,2021,10,WHI,TRUE,TRUE,TRUE,NSW-SMART-Shark-Management-Alert-in-Real-Time-Drumlines-Report-July-2021-June-2022.pdf
3/11/2021,10:11,White Shark,254,M,Alive,"ID, A",Evans Head,Main Beach,2021-11-03T10:11:00Z,2021,11,WHI,TRUE,TRUE,TRUE,NSW-SMART-Shark-Management-Alert-in-Real-Time-Drumlines-Report-July-2021-June-2022.pdf
4/11/2021,9:51,White Shark,217,F,Alive,"ID, A",Evans Head,Main Beach,2021-11-04T09:51:00Z,2021,11,WHI,TRUE,TRUE,TRUE,NSW-SMART-Shark-Management-Alert-in-Real-Time-Drumlines-Report-July-2021-June-2022.pdf
24/11/2021,16:06,White Shark,228,F,Dead,-,Evans Head,Main Beach,2021-11-24T16:06:00Z,2021,11,WHI,TRUE,FALSE,FALSE,NSW-SMART-Shark-Management-Alert-in-Real-Time-Drumlines-Report-July-2021-June-2022.pdf
12/01/2022,13:24,Bull Shark,192,M,Alive,"ID, A",Evans Head,Main Beach,2022-01-12T13:24:00Z,2022,1,BUL,TRUE,TRUE,TRUE,NSW-SMART-Shark-Management-Alert-in-Real-Time-Drumlines-Report-July-2021-June-2022.pdf
16/02/2022,14:28,Loggerhead turtle,NA,NA,Alive,-,Evans Head,Main Beach,2022-02-16T14:28:00Z,2022,2,LOG,FALSE,FALSE,FALSE,NSW-SMART-Shark-Management-Alert-in-Real-Time-Drumlines-Report-July-2021-June-2022.pdf
9/03/2022,9:25,Bull Shark,185,M,Alive,"ID, A",Evans Head,Main Beach,2022-03-09T09:25:00Z,2022,3,BUL,TRUE,TRUE,TRUE,NSW-SMART-Shark-Management-Alert-in-Real-Time-Drumlines-Report-July-2021-June-2022.pdf
27/03/2022,11:31,Sandbar Shark,145,M,Alive,ID,Evans Head,Main Beach,2022-03-27T11:31:00Z,2022,3,SAN,FALSE,TRUE,FALSE,NSW-SMART-Shark-Management-Alert-in-Real-Time-Drumlines-Report-July-2021-June-2022.pdf
27/03/2022,12:28,Sandbar Shark,136,M,Alive,ID,Evans Head,Main Beach,2022-03-27T12:28:00Z,2022,3,SAN,FALSE,TRUE,FALSE,NSW-SMART-Shark-Management-Alert-in-Real-Time-Drumlines-Report-July-2021-June-2022.pdf
27/03/2022,12:50,Sandbar Shark,145,F,Alive,ID,Evans Head,Main Beach,2022-03-27T12:50:00Z,2022,3,SAN,FALSE,TRUE,FALSE,NSW-SMART-Shark-Management-Alert-in-Real-Time-Drumlines-Report-July-2021-June-2022.pdf
27/03/2022,14:38,Sandbar Shark,135,F,Alive,ID,Evans Head,Main Beach,2022-03-27T14:38:00Z,2022,3,SAN,FALSE,TRUE,FALSE,NSW-SMART-Shark-Management-Alert-in-Real-Time-Drumlines-Report-July-2021-June-2022.pdf
27/03/2022,16:16,Sandbar Shark,155,F,Alive,ID,Evans Head,Main Beach,2022-03-27T16:16:00Z,2022,3,SAN,FALSE,TRUE,FALSE,NSW-SMART-Shark-Management-Alert-in-Real-Time-Drumlines-Report-July-2021-June-2022.pdf
2/04/2022,7:50,Spinner Shark,237,M,Alive,ID,Evans Head,Main Beach,2022-04-02T07:50:00Z,2022,4,SPN,FALSE,TRUE,FALSE,NSW-SMART-Shark-Management-Alert-in-Real-Time-Drumlines-Report-July-2021-June-2022.pdf
2/04/2022,10:31,Bull Shark,156,M,Alive,"ID, A",Evans Head,Main Beach,2022-04-02T10:31:00Z,2022,4,BUL,TRUE,TRUE,TRUE,NSW-SMART-Shark-Management-Alert-in-Real-Time-Drumlines-Report-July-2021-June-2022.pdf
7/04/2022,14:18,Bull Shark,194,M,Alive,"ID, A",Evans Head,Main Beach,2022-04-07T14:18:00Z,2022,4,BUL,TRUE,TRUE,TRUE,NSW-SMART-Shark-Management-Alert-in-Real-Time-Drumlines-Report-July-2021-June-2022.pdf
11/04/2022,8:44,Bull Shark,242,F,Alive,"ID, A",Evans Head,Main Beach,2022-04-11T08:44:00Z,2022,4,BUL,TRUE,TRUE,TRUE,NSW-SMART-Shark-Management-Alert-in-Real-Time-Drumlines-Report-July-2021-June-2022.pdf
12/04/2022,7:53,Loggerhead Turtle,86,F,Alive,-,Evans Head,Main Beach,2022-04-12T07:53:00Z,2022,4,LOG,FALSE,FALSE,FALSE,NSW-SMART-Shark-Management-Alert-in-Real-Time-Drumlines-Report-July-2021-June-2022.pdf
19/04/2022,14:10,Common Blacktip,152,M,Alive,ID,Evans Head,Main Beach,2022-04-19T14:10:00Z,2022,4,CBT,FALSE,TRUE,FALSE,NSW-SMART-Shark-Management-Alert-in-Real-Time-Drumlines-Report-July-2021-June-2022.pdf
28/04/2022,7:59,Common Blacktip,150,M,Alive,ID,Evans Head,Main Beach,2022-04-28T07:59:00Z,2022,4,CBT,FALSE,TRUE,FALSE,NSW-SMART-Shark-Management-Alert-in-Real-Time-Drumlines-Report-July-2021-June-2022.pdf
29/04/2022,11:21,Sandbar Shark,160,M,Alive,ID,Evans Head,Main Beach,2022-04-29T11:21:00Z,2022,4,SAN,FALSE,TRUE,FALSE,NSW-SMART-Shark-Management-Alert-in-Real-Time-Drumlines-Report-July-2021-June-2022.pdf
30/04/2022,8:50,Sandbar Shark,195,F,Alive,ID,Evans Head,Main Beach,2022-04-30T08:50:00Z,2022,4,SAN,FALSE,TRUE,FALSE,NSW-SMART-Shark-Management-Alert-in-Real-Time-Drumlines-Report-July-2021-June-2022.pdf
30/04/2022,9:46,Sandbar Shark,149,M,Alive,ID,Evans Head,Main Beach,2022-04-30T09:46:00Z,2022,4,SAN,FALSE,TRUE,FALSE,NSW-SMART-Shark-Management-Alert-in-Real-Time-Drumlines-Report-July-2021-June-2022.pdf
30/04/2022,12:12,Sandbar Shark,136,F,Alive,ID,Evans Head,Main Beach,2022-04-30T12:12:00Z,2022,4,SAN,FALSE,TRUE,FALSE,NSW-SMART-Shark-Management-Alert-in-Real-Time-Drumlines-Report-July-2021-June-2022.pdf
1/05/2022,9:21,Sandbar Shark,135,M,Alive,ID,Evans Head,Main Beach,2022-05-01T09:21:00Z,2022,5,SAN,FALSE,TRUE,FALSE,NSW-SMART-Shark-Management-Alert-in-Real-Time-Drumlines-Report-July-2021-June-2022.pdf
8/06/2022,9:33,Greynurse Shark,270,F,Alive,ID,Evans Head,Main Beach,2022-06-08T09:33:00Z,2022,6,GRN,FALSE,TRUE,FALSE,NSW-SMART-Shark-Management-Alert-in-Real-Time-Drumlines-Report-July-2021-June-2022.pdf
26/06/2022,10:24,White Shark,214,M,Alive,"ID, A",Evans Head,Main Beach,2022-06-26T10:24:00Z,2022,6,WHI,TRUE,TRUE,TRUE,NSW-SMART-Shark-Management-Alert-in-Real-Time-Drumlines-Report-July-2021-June-2022.pdf
8/07/2021,12:55,White Shark,210,F,Alive,"ID, A",Evans Head,Airforce Beach,2021-07-08T12:55:00Z,2021,7,WHI,TRUE,TRUE,TRUE,NSW-SMART-Shark-Management-Alert-in-Real-Time-Drumlines-Report-July-2021-June-2022.pdf
8/07/2021,12:58,White Shark,242,F,Alive,"ID, A",Evans Head,Airforce Beach,2021-07-08T12:58:00Z,2021,7,WHI,TRUE,TRUE,TRUE,NSW-SMART-Shark-Management-Alert-in-Real-Time-Drumlines-Report-July-2021-June-2022.pdf
9/07/2021,11:06,White Shark,180,M,Alive,"ID, A",Evans Head,Airforce Beach,2021-07-09T11:06:00Z,2021,7,WHI,TRUE,TRUE,TRUE,NSW-SMART-Shark-Management-Alert-in-Real-Time-Drumlines-Report-July-2021-June-2022.pdf
10/07/2021,14:31,White Shark,233,F,Alive,"ID, A",Evans Head,Airforce Beach,2021-07-10T14:31:00Z,2021,7,WHI,TRUE,TRUE,TRUE,NSW-SMART-Shark-Management-Alert-in-Real-Time-Drumlines-Report-July-2021-June-2022.pdf
13/07/2021,10:51,White Shark,290,M,Alive,"ID, A",Evans Head,Airforce Beach,2021-07-13T10:51:00Z,2021,7,WHI,TRUE,TRUE,TRUE,NSW-SMART-Shark-Management-Alert-in-Real-Time-Drumlines-Report-July-2021-June-2022.pdf
10/09/2021,12:45,White Shark,264,M,Alive,"ID, A",Evans Head,Airforce Beach,2021-09-10T12:45:00Z,2021,9,WHI,TRUE,TRUE,TRUE,NSW-SMART-Shark-Management-Alert-in-Real-Time-Drumlines-Report-July-2021-June-2022.pdf
11/09/2021,NA,White Shark,204,M,Dead,-,Evans Head,Airforce Beach,NA,2021,9,WHI,TRUE,FALSE,FALSE,NSW-SMART-Shark-Management-Alert-in-Real-Time-Drumlines-Report-July-2021-June-2022.pdf
15/09/2021,12:45,Loggerhead turtle,NA,NA,Alive,-,Evans Head,Airforce Beach,2021-09-15T12:45:00Z,2021,9,LOG,FALSE,FALSE,FALSE,NSW-SMART-Shark-Management-Alert-in-Real-Time-Drumlines-Report-July-2021-June-2022.pdf
27/09/2021,9:37,White Shark,225,M,Alive,"ID, A",Evans Head,Airforce Beach,2021-09-27T09:37:00Z,2021,9,WHI,TRUE,TRUE,TRUE,NSW-SMART-Shark-Management-Alert-in-Real-Time-Drumlines-Report-July-2021-June-2022.pdf
6/10/2021,11:47,White Shark,215,F,Alive,"ID, A",Evans Head,Airforce Beach,2021-10-06T11:47:00Z,2021,10,WHI,TRUE,TRUE,TRUE,NSW-SMART-Shark-Management-Alert-in-Real-Time-Drumlines-Report-July-2021-June-2022.pdf
9/10/2021,9:21,White Shark,253,F,Alive,"ID, A",Evans Head,Airforce Beach,2021-10-09T09:21:00Z,2021,10,WHI,TRUE,TRUE,TRUE,NSW-SMART-Shark-Management-Alert-in-Real-Time-Drumlines-Report-July-2021-June-2022.pdf
25/10/2021,12:27,White Shark,238,F,Alive,"ID, A",Evans Head,Airforce Beach,2021-10-25T12:27:00Z,2021,10,WHI,TRUE,TRUE,TRUE,NSW-SMART-Shark-Management-Alert-in-Real-Time-Drumlines-Report-July-2021-June-2022.pdf
1/11/2021,14:42,White Shark,323,F,Alive,"ID, A",Evans Head,Airforce Beach,2021-11-01T14:42:00Z,2021,11,WHI,TRUE,TRUE,TRUE,NSW-SMART-Shark-Management-Alert-in-Real-Time-Drumlines-Report-July-2021-June-2022.pdf
19/11/2021,9:22,White Shark,267,F,Alive,"ID, A",Evans Head,Airforce Beach,2021-11-19T09:22:00Z,2021,11,WHI,TRUE,TRUE,TRUE,NSW-SMART-Shark-Management-Alert-in-Real-Time-Drumlines-Report-July-2021-June-2022.pdf
6/12/2021,13:36,Bull Shark,283,F,Alive,"ID, A",Evans Head,Airforce Beach,2021-12-06T13:36:00Z,2021,12,BUL,TRUE,TRUE,TRUE,NSW-SMART-Shark-Management-Alert-in-Real-Time-Drumlines-Report-July-2021-June-2022.pdf
14/12/2021,16:05,White Shark,229,F,Alive,"ID, A",Evans Head,Airforce Beach,2021-12-14T16:05:00Z,2021,12,WHI,TRUE,TRUE,TRUE,NSW-SMART-Shark-Management-Alert-in-Real-Time-Drumlines-Report-July-2021-June-2022.pdf
12/01/2022,9:34,Bull Shark,185,F,Alive,"ID, A",Evans Head,Airforce Beach,2022-01-12T09:34:00Z,2022,1,BUL,TRUE,TRUE,TRUE,NSW-SMART-Shark-Management-Alert-in-Real-Time-Drumlines-Report-July-2021-June-2022.pdf
29/01/2022,NA,Common Blacktip,142,M,Dead,-,Evans Head,Airforce Beach,NA,2022,1,CBT,FALSE,FALSE,FALSE,NSW-SMART-Shark-Management-Alert-in-Real-Time-Drumlines-Report-July-2021-June-2022.pdf
11/02/2022,11:00,Common Blacktip,140,M,Alive,ID,Evans Head,Airforce Beach,2022-02-11T11:00:00Z,2022,2,CBT,FALSE,TRUE,FALSE,NSW-SMART-Shark-Management-Alert-in-Real-Time-Drumlines-Report-July-2021-June-2022.pdf
8/03/2022,13:36,Common Blacktip,233,M,Alive,ID,Evans Head,Airforce Beach,2022-03-08T13:36:00Z,2022,3,CBT,FALSE,TRUE,FALSE,NSW-SMART-Shark-Management-Alert-in-Real-Time-Drumlines-Report-July-2021-June-2022.pdf
23/03/2022,7:38,Sandbar Shark,132,M,Alive,ID,Evans Head,Airforce Beach,2022-03-23T07:38:00Z,2022,3,SAN,FALSE,TRUE,FALSE,NSW-SMART-Shark-Management-Alert-in-Real-Time-Drumlines-Report-July-2021-June-2022.pdf
23/03/2022,14:17,Bull Shark,193,F,Alive,"ID, A",Evans Head,Airforce Beach,2022-03-23T14:17:00Z,2022,3,BUL,TRUE,TRUE,TRUE,NSW-SMART-Shark-Management-Alert-in-Real-Time-Drumlines-Report-July-2021-June-2022.pdf
27/03/2022,12:23,Sandbar Shark,124,M,Alive,ID,Evans Head,Airforce Beach,2022-03-27T12:23:00Z,2022,3,SAN,FALSE,TRUE,FALSE,NSW-SMART-Shark-Management-Alert-in-Real-Time-Drumlines-Report-July-2021-June-2022.pdf
27/03/2022,14:49,Sandbar Shark,137,F,Alive,ID,Evans Head,Airforce Beach,2022-03-27T14:49:00Z,2022,3,SAN,FALSE,TRUE,FALSE,NSW-SMART-Shark-Management-Alert-in-Real-Time-Drumlines-Report-July-2021-June-2022.pdf
18/04/2022,11:39,Tiger Shark,248,F,Alive,"ID, A",Evans Head,Airforce Beach,2022-04-18T11:39:00Z,2022,4,TIG,TRUE,TRUE,TRUE,NSW-SMART-Shark-Management-Alert-in-Real-Time-Drumlines-Report-July-2021-June-2022.pdf
27/04/2022,11:28,Tiger Shark,227,F,Alive,"ID, A",Evans Head,Airforce Beach,2022-04-27T11:28:00Z,2022,4,TIG,TRUE,TRUE,TRUE,NSW-SMART-Shark-Management-Alert-in-Real-Time-Drumlines-Report-July-2021-June-2022.pdf
29/04/2022,9:33,Common Blacktip,110,M,Alive,ID,Evans Head,Airforce Beach,2022-04-29T09:33:00Z,2022,4,CBT,FALSE,TRUE,FALSE,NSW-SMART-Shark-Management-Alert-in-Real-Time-Drumlines-Report-July-2021-June-2022.pdf
30/04/2022,8:33,Sandbar Shark,148,M,Alive,ID,Evans Head,Airforce Beach,2022-04-30T08:33:00Z,2022,4,SAN,FALSE,TRUE,FALSE,NSW-SMART-Shark-Management-Alert-in-Real-Time-Drumlines-Report-July-2021-June-2022.pdf
1/05/2022,14:56,Common Blacktip,161,M,Alive,ID,Evans Head,Airforce Beach,2022-05-01T14:56:00Z,2022,5,CBT,FALSE,TRUE,FALSE,NSW-SMART-Shark-Management-Alert-in-Real-Time-Drumlines-Report-July-2021-June-2022.pdf
25/05/2022,8:17,Common Blacktip,249,M,Alive,ID,Evans Head,Airforce Beach,2022-05-25T08:17:00Z,2022,5,CBT,FALSE,TRUE,FALSE,NSW-SMART-Shark-Management-Alert-in-Real-Time-Drumlines-Report-July-2021-June-2022.pdf
25/05/2022,9:22,Tiger Shark,192,F,Alive,"ID, A",Evans Head,Airforce Beach,2022-05-25T09:22:00Z,2022,5,TIG,TRUE,TRUE,TRUE,NSW-SMART-Shark-Management-Alert-in-Real-Time-Drumlines-Report-July-2021-June-2022.pdf
31/05/2022,15:02,Tiger Shark,220,F,Alive,"ID, A",Evans Head,Airforce Beach,2022-05-31T15:02:00Z,2022,5,TIG,TRUE,TRUE,TRUE,NSW-SMART-Shark-Management-Alert-in-Real-Time-Drumlines-Report-July-2021-June-2022.pdf
31/05/2022,15:50,Sandbar Shark,112,F,Dead,-,Evans Head,Airforce Beach,2022-05-31T15:50:00Z,2022,5,SAN,FALSE,FALSE,FALSE,NSW-SMART-Shark-Management-Alert-in-Real-Time-Drumlines-Report-July-2021-June-2022.pdf
4/06/2022,11:22,Tiger Shark,157,F,Alive,"ID, A",Evans Head,Airforce Beach,2022-06-04T11:22:00Z,2022,6,TIG,TRUE,TRUE,TRUE,NSW-SMART-Shark-Management-Alert-in-Real-Time-Drumlines-Report-July-2021-June-2022.pdf
16/03/2022,13:51,Tiger Shark,NA,NA,Alive,-,Yamba - Iluka Bluff to Angourie Point,Angourie Back Beach,2022-03-16T13:51:00Z,2022,3,TIG,TRUE,FALSE,FALSE,NSW-SMART-Shark-Management-Alert-in-Real-Time-Drumlines-Report-July-2021-June-2022.pdf
3/04/2022,9:45,Bronze Whaler,220,M,Alive,ID,Yamba - Iluka Bluff to Angourie Point,Angourie Back Beach,2022-04-03T09:45:00Z,2022,4,BRO,FALSE,TRUE,FALSE,NSW-SMART-Shark-Management-Alert-in-Real-Time-Drumlines-Report-July-2021-June-2022.pdf
23/06/2022,9:20,Common Blacktip,229,M,Alive,ID,Yamba - Iluka Bluff to Angourie Point,Angourie Back Beach,2022-06-23T09:20:00Z,2022,6,CBT,FALSE,TRUE,FALSE,NSW-SMART-Shark-Management-Alert-in-Real-Time-Drumlines-Report-July-2021-June-2022.pdf
26/01/2022,9:30,Common Blacktip,160,F,Alive,ID,Yamba - Iluka Bluff to Angourie Point,Angourie Point,2022-01-26T09:30:00Z,2022,1,CBT,FALSE,TRUE,FALSE,NSW-SMART-Shark-Management-Alert-in-Real-Time-Drumlines-Report-July-2021-June-2022.pdf
18/02/2022,8:34,Common Blacktip,158,F,Alive,ID,Yamba - Iluka Bluff to Angourie Point,Angourie Point,2022-02-18T08:34:00Z,2022,2,CBT,FALSE,TRUE,FALSE,NSW-SMART-Shark-Management-Alert-in-Real-Time-Drumlines-Report-July-2021-June-2022.pdf
18/03/2022,14:47,Tiger Shark,228,F,Alive,"ID, A",Yamba - Iluka Bluff to Angourie Point,Angourie Point,2022-03-18T14:47:00Z,2022,3,TIG,TRUE,TRUE,TRUE,NSW-SMART-Shark-Management-Alert-in-Real-Time-Drumlines-Report-July-2021-June-2022.pdf
7/05/2022,13:13,Tiger Shark,182,F,Alive,"ID, A",Yamba - Iluka Bluff to Angourie Point,Angourie Point,2022-05-07T13:13:00Z,2022,5,TIG,TRUE,TRUE,TRUE,NSW-SMART-Shark-Management-Alert-in-Real-Time-Drumlines-Report-July-2021-June-2022.pdf
18/05/2022,10:49,Tiger Shark,173,F,Alive,"ID, A",Yamba - Iluka Bluff to Angourie Point,Angourie Point,2022-05-18T10:49:00Z,2022,5,TIG,TRUE,TRUE,TRUE,NSW-SMART-Shark-Management-Alert-in-Real-Time-Drumlines-Report-July-2021-June-2022.pdf
25/05/2022,12:36,White Shark,336,F,Alive,"ID, A",Yamba - Iluka Bluff to Angourie Point,Angourie Point,2022-05-25T12:36:00Z,2022,5,WHI,TRUE,TRUE,TRUE,NSW-SMART-Shark-Management-Alert-in-Real-Time-Drumlines-Report-July-2021-June-2022.pdf
30/05/2022,14:11,White Shark,234,F,Alive,"ID, A",Yamba - Iluka Bluff to Angourie Point,Angourie Point,2022-05-30T14:11:00Z,2022,5,WHI,TRUE,TRUE,TRUE,NSW-SMART-Shark-Management-Alert-in-Real-Time-Drumlines-Report-July-2021-June-2022.pdf
7/06/2022,10:47,Greynurse Shark,275,F,Alive,ID,Yamba - Iluka Bluff to Angourie Point,Angourie Point,2022-06-07T10:47:00Z,2022,6,GRN,FALSE,TRUE,FALSE,NSW-SMART-Shark-Management-Alert-in-Real-Time-Drumlines-Report-July-2021-June-2022.pdf
16/06/2022,15:01,White Shark,223,M,Alive,"ID, A",Yamba - Iluka Bluff to Angourie Point,Angourie Point,2022-06-16T15:01:00Z,2022,6,WHI,TRUE,TRUE,TRUE,NSW-SMART-Shark-Management-Alert-in-Real-Time-Drumlines-Report-July-2021-June-2022.pdf
23/06/2022,9:54,White Shark,310,M,Alive,"ID, A",Yamba - Iluka Bluff to Angourie Point,Angourie Point,2022-06-23T09:54:00Z,2022,6,WHI,TRUE,TRUE,TRUE,NSW-SMART-Shark-Management-Alert-in-Real-Time-Drumlines-Report-July-2021-June-2022.pdf
16/06/2022,11:53,Bull Shark,188,F,Alive,"ID, A",Yamba - Iluka Bluff to Angourie Point,Spooky Beach,2022-06-16T11:53:00Z,2022,6,BUL,TRUE,TRUE,TRUE,NSW-SMART-Shark-Management-Alert-in-Real-Time-Drumlines-Report-July-2021-June-2022.pdf
9/01/2022,15:17,Manta Ray,NA,NA,Alive,-,Yamba - Iluka Bluff to Angourie Point,Pippi Beach,2022-01-09T15:17:00Z,2022,1,MAN,FALSE,FALSE,FALSE,NSW-SMART-Shark-Management-Alert-in-Real-Time-Drumlines-Report-July-2021-June-2022.pdf
24/01/2022,11:36,Bull Shark,179,F,Alive,"ID, A",Yamba - Iluka Bluff to Angourie Point,Pippi Beach,2022-01-24T11:36:00Z,2022,1,BUL,TRUE,TRUE,TRUE,NSW-SMART-Shark-Management-Alert-in-Real-Time-Drumlines-Report-July-2021-June-2022.pdf
6/04/2022,10:19,Common Blacktip,157,F,Alive,ID,Yamba - Iluka Bluff to Angourie Point,Pippi Beach,2022-04-06T10:19:00Z,2022,4,CBT,FALSE,TRUE,FALSE,NSW-SMART-Shark-Management-Alert-in-Real-Time-Drumlines-Report-July-2021-June-2022.pdf
16/04/2022,10:51,Common Blacktip,206,M,Alive,ID,Yamba - Iluka Bluff to Angourie Point,Pippi Beach,2022-04-16T10:51:00Z,2022,4,CBT,FALSE,TRUE,FALSE,NSW-SMART-Shark-Management-Alert-in-Real-Time-Drumlines-Report-July-2021-June-2022.pdf
22/06/2022,12:45,White Shark,280,F,Alive,"ID, A",Yamba - Iluka Bluff to Angourie Point,Pippi Beach,2022-06-22T12:45:00Z,2022,6,WHI,TRUE,TRUE,TRUE,NSW-SMART-Shark-Management-Alert-in-Real-Time-Drumlines-Report-July-2021-June-2022.pdf
27/06/2022,9:20,White Shark,375,F,Alive,"ID, A",Yamba - Iluka Bluff to Angourie Point,Pippi Beach,2022-06-27T09:20:00Z,2022,6,WHI,TRUE,TRUE,TRUE,NSW-SMART-Shark-Management-Alert-in-Real-Time-Drumlines-Report-July-2021-June-2022.pdf
1/01/2022,16:17,Common Blacktip,142,M,Alive,ID,Yamba - Iluka Bluff to Angourie Point,"Main Beach, Yamba",2022-01-01T16:17:00Z,2022,1,CBT,FALSE,TRUE,FALSE,NSW-SMART-Shark-Management-Alert-in-Real-Time-Drumlines-Report-July-2021-June-2022.pdf
15/01/2022,7:59,Bull Shark,182,M,Alive,"ID, A",Yamba - Iluka Bluff to Angourie Point,"Main Beach, Yamba",2022-01-15T07:59:00Z,2022,1,BUL,TRUE,TRUE,TRUE,NSW-SMART-Shark-Management-Alert-in-Real-Time-Drumlines-Report-July-2021-June-2022.pdf
15/02/2022,13:08,Bull Shark,169,M,Alive,"ID, A",Yamba - Iluka Bluff to Angourie Point,"Main Beach, Yamba",2022-02-15T13:08:00Z,2022,2,BUL,TRUE,TRUE,TRUE,NSW-SMART-Shark-Management-Alert-in-Real-Time-Drumlines-Report-July-2021-June-2022.pdf
10/02/2022,15:26,Bull Shark,155,F,Alive,"ID, A",Yamba - Iluka Bluff to Angourie Point,Iluka Beach,2022-02-10T15:26:00Z,2022,2,BUL,TRUE,TRUE,TRUE,NSW-SMART-Shark-Management-Alert-in-Real-Time-Drumlines-Report-July-2021-June-2022.pdf
8/03/2022,7:43,Bull Shark,190,F,Alive,"ID, A",Yamba - Iluka Bluff to Angourie Point,Iluka Beach,2022-03-08T07:43:00Z,2022,3,BUL,TRUE,TRUE,TRUE,NSW-SMART-Shark-Management-Alert-in-Real-Time-Drumlines-Report-July-2021-June-2022.pdf
3/04/2022,11:11,Bronze Whaler,225,M,Alive,ID,Yamba - Iluka Bluff to Angourie Point,Iluka Beach,2022-04-03T11:11:00Z,2022,4,BRO,FALSE,TRUE,FALSE,NSW-SMART-Shark-Management-Alert-in-Real-Time-Drumlines-Report-July-2021-June-2022.pdf
11/04/2022,7:32,Bronze Whaler,198,F,Alive,ID,Yamba - Iluka Bluff to Angourie Point,Iluka Beach,2022-04-11T07:32:00Z,2022,4,BRO,FALSE,TRUE,FALSE,NSW-SMART-Shark-Management-Alert-in-Real-Time-Drumlines-Report-July-2021-June-2022.pdf
16/05/2022,10:22,Tiger Shark,178,F,Alive,"ID, A",Yamba - Iluka Bluff to Angourie Point,Iluka Beach,2022-05-16T10:22:00Z,2022,5,TIG,TRUE,TRUE,TRUE,NSW-SMART-Shark-Management-Alert-in-Real-Time-Drumlines-Report-July-2021-June-2022.pdf
5/06/2022,9:55,White Shark,348,F,Alive,"ID, A",Yamba - Iluka Bluff to Angourie Point,Iluka Beach,2022-06-05T09:55:00Z,2022,6,WHI,TRUE,TRUE,TRUE,NSW-SMART-Shark-Management-Alert-in-Real-Time-Drumlines-Report-July-2021-June-2022.pdf
20/06/2022,13:57,White Shark,257,M,Alive,"ID, A",Yamba - Iluka Bluff to Angourie Point,Iluka Beach,2022-06-20T13:57:00Z,2022,6,WHI,TRUE,TRUE,TRUE,NSW-SMART-Shark-Management-Alert-in-Real-Time-Drumlines-Report-July-2021-June-2022.pdf
25/06/2022,7:40,White Shark,204,M,Alive,"ID, A",Yamba - Iluka Bluff to Angourie Point,Iluka Beach,2022-06-25T07:40:00Z,2022,6,WHI,TRUE,TRUE,TRUE,NSW-SMART-Shark-Management-Alert-in-Real-Time-Drumlines-Report-July-2021-June-2022.pdf
26/06/2022,11:32,White Shark,258,F,Alive,"ID, A",Yamba - Iluka Bluff to Angourie Point,Iluka Beach,2022-06-26T11:32:00Z,2022,6,WHI,TRUE,TRUE,TRUE,NSW-SMART-Shark-Management-Alert-in-Real-Time-Drumlines-Report-July-2021-June-2022.pdf
26/06/2022,12:30,White Shark,266,M,Alive,"ID, A",Yamba - Iluka Bluff to Angourie Point,Iluka Beach,2022-06-26T12:30:00Z,2022,6,WHI,TRUE,TRUE,TRUE,NSW-SMART-Shark-Management-Alert-in-Real-Time-Drumlines-Report-July-2021-June-2022.pdf
8/12/2021,8:23,Tiger Shark,NA,NA,Alive,-,Coffs Harbour - Coffs Harbour to Sawtell,Sawtell Headland,2021-12-08T08:23:00Z,2021,12,TIG,TRUE,FALSE,FALSE,NSW-SMART-Shark-Management-Alert-in-Real-Time-Drumlines-Report-July-2021-June-2022.pdf
20/12/2021,10:53,Tiger Shark,191,F,Alive,"ID, A",Coffs Harbour - Coffs Harbour to Sawtell,Sawtell Headland,2021-12-20T10:53:00Z,2021,12,TIG,TRUE,TRUE,TRUE,NSW-SMART-Shark-Management-Alert-in-Real-Time-Drumlines-Report-July-2021-June-2022.pdf
23/12/2021,8:46,Scalloped Hammer Head,169,F,Alive,ID,Coffs Harbour - Coffs Harbour to Sawtell,Sawtell Headland,2021-12-23T08:46:00Z,2021,12,SCH,FALSE,TRUE,FALSE,NSW-SMART-Shark-Management-Alert-in-Real-Time-Drumlines-Report-July-2021-June-2022.pdf
23/12/2021,11:14,Tiger Shark,180,F,Alive,"ID, A",Coffs Harbour - Coffs Harbour to Sawtell,Sawtell Headland,2021-12-23T11:14:00Z,2021,12,TIG,TRUE,TRUE,TRUE,NSW-SMART-Shark-Management-Alert-in-Real-Time-Drumlines-Report-July-2021-June-2022.pdf
30/12/2021,10:08,Common Blacktip,218,M,Alive,ID,Coffs Harbour - Coffs Harbour to Sawtell,Sawtell Headland,2021-12-30T10:08:00Z,2021,12,CBT,FALSE,TRUE,FALSE,NSW-SMART-Shark-Management-Alert-in-Real-Time-Drumlines-Report-July-2021-June-2022.pdf
15/04/2022,12:03,Tiger Shark,275,F,Alive,"ID, A",Coffs Harbour - Coffs Harbour to Sawtell,Sawtell Headland,2022-04-15T12:03:00Z,2022,4,TIG,TRUE,TRUE,TRUE,NSW-SMART-Shark-Management-Alert-in-Real-Time-Drumlines-Report-July-2021-June-2022.pdf
25/04/2022,12:00,Bull Shark,181,F,Alive,"ID, A",Coffs Harbour - Coffs Harbour to Sawtell,Sawtell Headland,2022-04-25T12:00:00Z,2022,4,BUL,TRUE,TRUE,TRUE,NSW-SMART-Shark-Management-Alert-in-Real-Time-Drumlines-Report-July-2021-June-2022.pdf
29/04/2022,12:09,Common Blacktip,169,M,Alive,ID,Coffs Harbour - Coffs Harbour to Sawtell,Sawtell Headland,2022-04-29T12:09:00Z,2022,4,CBT,FALSE,TRUE,FALSE,NSW-SMART-Shark-Management-Alert-in-Real-Time-Drumlines-Report-July-2021-June-2022.pdf
17/05/2022,13:10,Common Blacktip,223,M,Alive,ID,Coffs Harbour - Coffs Harbour to Sawtell,Sawtell Headland,2022-05-17T13:10:00Z,2022,5,CBT,FALSE,TRUE,FALSE,NSW-SMART-Shark-Management-Alert-in-Real-Time-Drumlines-Report-July-2021-June-2022.pdf
28/05/2022,10:09,White Shark,273,M,Alive,"ID, A",Coffs Harbour - Coffs Harbour to Sawtell,Sawtell Headland,2022-05-28T10:09:00Z,2022,5,WHI,TRUE,TRUE,TRUE,NSW-SMART-Shark-Management-Alert-in-Real-Time-Drumlines-Report-July-2021-June-2022.pdf
12/06/2022,NA,Whaler - unidentified,141,F,Alive,ID,Coffs Harbour - Coffs Harbour to Sawtell,Sawtell Headland,NA,2022,6,WHL,FALSE,TRUE,FALSE,NSW-SMART-Shark-Management-Alert-in-Real-Time-Drumlines-Report-July-2021-June-2022.pdf
25/06/2022,8:38,White Shark,223,F,Alive,"ID, A",Coffs Harbour - Coffs Harbour to Sawtell,Sawtell Headland,2022-06-25T08:38:00Z,2022,6,WHI,TRUE,TRUE,TRUE,NSW-SMART-Shark-Management-Alert-in-Real-Time-Drumlines-Report-July-2021-June-2022.pdf
3/11/2021,10:19,Bronze Whaler,260,M,Alive,ID,Coffs Harbour - Coffs Harbour to Sawtell,Sawtell Beach,2021-11-03T10:19:00Z,2021,11,BRO,FALSE,TRUE,FALSE,NSW-SMART-Shark-Management-Alert-in-Real-Time-Drumlines-Report-July-2021-June-2022.pdf
6/11/2021,9:13,Scalloped Hammer Head,108,M,Alive,ID,Coffs Harbour - Coffs Harbour to Sawtell,Sawtell Beach,2021-11-06T09:13:00Z,2021,11,SCH,FALSE,TRUE,FALSE,NSW-SMART-Shark-Management-Alert-in-Real-Time-Drumlines-Report-July-2021-June-2022.pdf
30/11/2021,13:41,Snapper,NA,NA,Dead,-,Coffs Harbour - Coffs Harbour to Sawtell,Sawtell Beach,2021-11-30T13:41:00Z,2021,11,SNP,FALSE,FALSE,FALSE,NSW-SMART-Shark-Management-Alert-in-Real-Time-Drumlines-Report-July-2021-June-2022.pdf
18/12/2021,10:55,Tiger Shark,226,F,Alive,"ID, A",Coffs Harbour - Coffs Harbour to Sawtell,Sawtell Beach,2021-12-18T10:55:00Z,2021,12,TIG,TRUE,TRUE,TRUE,NSW-SMART-Shark-Management-Alert-in-Real-Time-Drumlines-Report-July-2021-June-2022.pdf
31/01/2022,11:23,Bull Shark,179,M,Alive,"ID, A",Coffs Harbour - Coffs Harbour to Sawtell,Sawtell Beach,2022-01-31T11:23:00Z,2022,1,BUL,TRUE,TRUE,TRUE,NSW-SMART-Shark-Management-Alert-in-Real-Time-Drumlines-Report-July-2021-June-2022.pdf
1/02/2022,8:20,Common Blacktip,189,M,Alive,ID,Coffs Harbour - Coffs Harbour to Sawtell,Sawtell Beach,2022-02-01T08:20:00Z,2022,2,CBT,FALSE,TRUE,FALSE,NSW-SMART-Shark-Management-Alert-in-Real-Time-Drumlines-Report-July-2021-June-2022.pdf
25/03/2022,14:06,Bull Shark,186,F,Alive,"ID, A",Coffs Harbour - Coffs Harbour to Sawtell,Sawtell Beach,2022-03-25T14:06:00Z,2022,3,BUL,TRUE,TRUE,TRUE,NSW-SMART-Shark-Management-Alert-in-Real-Time-Drumlines-Report-July-2021-June-2022.pdf
27/03/2022,10:27,Tiger Shark,323,F,Alive,"ID, A",Coffs Harbour - Coffs Harbour to Sawtell,Sawtell Beach,2022-03-27T10:27:00Z,2022,3,TIG,TRUE,TRUE,TRUE,NSW-SMART-Shark-Management-Alert-in-Real-Time-Drumlines-Report-July-2021-June-2022.pdf
25/04/2022,11:03,Greynurse Shark,271,F,Alive,ID,Coffs Harbour - Coffs Harbour to Sawtell,Sawtell Beach,2022-04-25T11:03:00Z,2022,4,GRN,FALSE,TRUE,FALSE,NSW-SMART-Shark-Management-Alert-in-Real-Time-Drumlines-Report-July-2021-June-2022.pdf
9/06/2022,9:40,White Shark,174,M,Alive,"ID, A",Coffs Harbour - Coffs Harbour to Sawtell,Sawtell Beach,2022-06-09T09:40:00Z,2022,6,WHI,TRUE,TRUE,TRUE,NSW-SMART-Shark-Management-Alert-in-Real-Time-Drumlines-Report-July-2021-June-2022.pdf
20/06/2022,12:41,Tiger Shark,345,F,Alive,"ID, A",Coffs Harbour - Coffs Harbour to Sawtell,Sawtell Beach,2022-06-20T12:41:00Z,2022,6,TIG,TRUE,TRUE,TRUE,NSW-SMART-Shark-Management-Alert-in-Real-Time-Drumlines-Report-July-2021-June-2022.pdf
27/06/2022,11:34,Bronze Whaler,258,M,Alive,ID,Coffs Harbour - Coffs Harbour to Sawtell,Sawtell Beach,2022-06-27T11:34:00Z,2022,6,BRO,FALSE,TRUE,FALSE,NSW-SMART-Shark-Management-Alert-in-Real-Time-Drumlines-Report-July-2021-June-2022.pdf
1/11/2021,14:02,Dusky Whaler,NA,NA,Alive,-,Coffs Harbour - Coffs Harbour to Sawtell,Boambee Headland,2021-11-01T14:02:00Z,2021,11,DUS,FALSE,FALSE,FALSE,NSW-SMART-Shark-Management-Alert-in-Real-Time-Drumlines-Report-July-2021-June-2022.pdf
15/11/2021,9:10,White Shark,210,M,Alive,"ID, A",Coffs Harbour - Coffs Harbour to Sawtell,Boambee Headland,2021-11-15T09:10:00Z,2021,11,WHI,TRUE,TRUE,TRUE,NSW-SMART-Shark-Management-Alert-in-Real-Time-Drumlines-Report-July-2021-June-2022.pdf
20/12/2021,12:11,Dusky Whaler,275,F,Alive,ID,Coffs Harbour - Coffs Harbour to Sawtell,Boambee Headland,2021-12-20T12:11:00Z,2021,12,DUS,FALSE,TRUE,FALSE,NSW-SMART-Shark-Management-Alert-in-Real-Time-Drumlines-Report-July-2021-June-2022.pdf
8/02/2022,10:48,Sandbar Shark,190,F,Alive,ID,Coffs Harbour - Coffs Harbour to Sawtell,Boambee Headland,2022-02-08T10:48:00Z,2022,2,SAN,FALSE,TRUE,FALSE,NSW-SMART-Shark-Management-Alert-in-Real-Time-Drumlines-Report-July-2021-June-2022.pdf
16/04/2022,8:05,Tiger Shark,158,F,Alive,"ID, A",Coffs Harbour - Coffs Harbour to Sawtell,Boambee Headland,2022-04-16T08:05:00Z,2022,4,TIG,TRUE,TRUE,TRUE,NSW-SMART-Shark-Management-Alert-in-Real-Time-Drumlines-Report-July-2021-June-2022.pdf
11/06/2022,11:55,Tiger Shark,311,F,Alive,"ID, A",Coffs Harbour - Coffs Harbour to Sawtell,Boambee Headland,2022-06-11T11:55:00Z,2022,6,TIG,TRUE,TRUE,TRUE,NSW-SMART-Shark-Management-Alert-in-Real-Time-Drumlines-Report-July-2021-June-2022.pdf
21/06/2022,13:04,Bronze Whaler,268,M,Alive,ID,Coffs Harbour - Coffs Harbour to Sawtell,Boambee Headland,2022-06-21T13:04:00Z,2022,6,BRO,FALSE,TRUE,FALSE,NSW-SMART-Shark-Management-Alert-in-Real-Time-Drumlines-Report-July-2021-June-2022.pdf
1/11/2021,11:19,Greynurse Shark,258,F,Alive,ID,Coffs Harbour - Coffs Harbour to Sawtell,Boambee Beach,2021-11-01T11:19:00Z,2021,11,GRN,FALSE,TRUE,FALSE,NSW-SMART-Shark-Management-Alert-in-Real-Time-Drumlines-Report-July-2021-June-2022.pdf
25/11/2021,9:48,White Shark,202,F,Alive,"ID, A",Coffs Harbour - Coffs Harbour to Sawtell,Boambee Beach,2021-11-25T09:48:00Z,2021,11,WHI,TRUE,TRUE,TRUE,NSW-SMART-Shark-Management-Alert-in-Real-Time-Drumlines-Report-July-2021-June-2022.pdf
9/12/2021,10:16,Tiger Shark,NA,NA,Alive,-,Coffs Harbour - Coffs Harbour to Sawtell,Boambee Beach,2021-12-09T10:16:00Z,2021,12,TIG,TRUE,FALSE,FALSE,NSW-SMART-Shark-Management-Alert-in-Real-Time-Drumlines-Report-July-2021-June-2022.pdf
15/12/2021,16:36,Tiger Shark,NA,NA,Alive,-,Coffs Harbour - Coffs Harbour to Sawtell,Boambee Beach,2021-12-15T16:36:00Z,2021,12,TIG,TRUE,FALSE,FALSE,NSW-SMART-Shark-Management-Alert-in-Real-Time-Drumlines-Report-July-2021-June-2022.pdf
13/01/2022,13:43,Tiger Shark,263,F,Alive,"ID, A",Coffs Harbour - Coffs Harbour to Sawtell,Boambee Beach,2022-01-13T13:43:00Z,2022,1,TIG,TRUE,TRUE,TRUE,NSW-SMART-Shark-Management-Alert-in-Real-Time-Drumlines-Report-July-2021-June-2022.pdf
17/01/2022,9:18,Common Blacktip,216,M,Alive,ID,Coffs Harbour - Coffs Harbour to Sawtell,Boambee Beach,2022-01-17T09:18:00Z,2022,1,CBT,FALSE,TRUE,FALSE,NSW-SMART-Shark-Management-Alert-in-Real-Time-Drumlines-Report-July-2021-June-2022.pdf
1/02/2022,10:23,Common Blacktip,154,M,Alive,ID,Coffs Harbour - Coffs Harbour to Sawtell,Boambee Beach,2022-02-01T10:23:00Z,2022,2,CBT,FALSE,TRUE,FALSE,NSW-SMART-Shark-Management-Alert-in-Real-Time-Drumlines-Report-July-2021-June-2022.pdf
8/02/2022,8:44,Common Blacktip,154,M,Alive,ID,Coffs Harbour - Coffs Harbour to Sawtell,Boambee Beach,2022-02-08T08:44:00Z,2022,2,CBT,FALSE,TRUE,FALSE,NSW-SMART-Shark-Management-Alert-in-Real-Time-Drumlines-Report-July-2021-June-2022.pdf
14/02/2022,8:12,Smooth Hammerhead,294,M,Alive,ID,Coffs Harbour - Coffs Harbour to Sawtell,Boambee Beach,2022-02-14T08:12:00Z,2022,2,SMH,FALSE,TRUE,FALSE,NSW-SMART-Shark-Management-Alert-in-Real-Time-Drumlines-Report-July-2021-June-2022.pdf
15/02/2022,8:17,Common Blacktip,152,M,Alive,ID,Coffs Harbour - Coffs Harbour to Sawtell,Boambee Beach,2022-02-15T08:17:00Z,2022,2,CBT,FALSE,TRUE,FALSE,NSW-SMART-Shark-Management-Alert-in-Real-Time-Drumlines-Report-July-2021-June-2022.pdf
16/02/2022,7:34,Bull Shark,206,M,Alive,"ID, A",Coffs Harbour - Coffs Harbour to Sawtell,Boambee Beach,2022-02-16T07:34:00Z,2022,2,BUL,TRUE,TRUE,TRUE,NSW-SMART-Shark-Management-Alert-in-Real-Time-Drumlines-Report-July-2021-June-2022.pdf
23/02/2022,11:00,Smooth Hammerhead,179,F,Alive,ID,Coffs Harbour - Coffs Harbour to Sawtell,Boambee Beach,2022-02-23T11:00:00Z,2022,2,SMH,FALSE,TRUE,FALSE,NSW-SMART-Shark-Management-Alert-in-Real-Time-Drumlines-Report-July-2021-June-2022.pdf
9/03/2022,9:14,Common Blacktip,217,M,Alive,ID,Coffs Harbour - Coffs Harbour to Sawtell,Boambee Beach,2022-03-09T09:14:00Z,2022,3,CBT,FALSE,TRUE,FALSE,NSW-SMART-Shark-Management-Alert-in-Real-Time-Drumlines-Report-July-2021-June-2022.pdf
22/03/2022,12:00,Common Blacktip,220,F,Alive,ID,Coffs Harbour - Coffs Harbour to Sawtell,Boambee Beach,2022-03-22T12:00:00Z,2022,3,CBT,FALSE,TRUE,FALSE,NSW-SMART-Shark-Management-Alert-in-Real-Time-Drumlines-Report-July-2021-June-2022.pdf
10/04/2022,9:04,Common Blacktip,246,F,Alive,ID,Coffs Harbour - Coffs Harbour to Sawtell,Boambee Beach,2022-04-10T09:04:00Z,2022,4,CBT,FALSE,TRUE,FALSE,NSW-SMART-Shark-Management-Alert-in-Real-Time-Drumlines-Report-July-2021-June-2022.pdf
2/05/2022,8:18,Tiger Shark,163,M,Alive,"ID, A",Coffs Harbour - Coffs Harbour to Sawtell,Boambee Beach,2022-05-02T08:18:00Z,2022,5,TIG,TRUE,TRUE,TRUE,NSW-SMART-Shark-Management-Alert-in-Real-Time-Drumlines-Report-July-2021-June-2022.pdf
17/05/2022,14:45,Common Blacktip,229,M,Alive,ID,Coffs Harbour - Coffs Harbour to Sawtell,Boambee Beach,2022-05-17T14:45:00Z,2022,5,CBT,FALSE,TRUE,FALSE,NSW-SMART-Shark-Management-Alert-in-Real-Time-Drumlines-Report-July-2021-June-2022.pdf
19/05/2022,12:28,Dusky Whaler,242,F,Alive,ID,Coffs Harbour - Coffs Harbour to Sawtell,Boambee Beach,2022-05-19T12:28:00Z,2022,5,DUS,FALSE,TRUE,FALSE,NSW-SMART-Shark-Management-Alert-in-Real-Time-Drumlines-Report-July-2021-June-2022.pdf
22/05/2022,11:25,Bull Shark,196,M,Alive,"ID, A",Coffs Harbour - Coffs Harbour to Sawtell,Boambee Beach,2022-05-22T11:25:00Z,2022,5,BUL,TRUE,TRUE,TRUE,NSW-SMART-Shark-Management-Alert-in-Real-Time-Drumlines-Report-July-2021-June-2022.pdf
23/06/2022,12:52,White Shark,290,M,Alive,"ID, A",Coffs Harbour - Coffs Harbour to Sawtell,Boambee Beach,2022-06-23T12:52:00Z,2022,6,WHI,TRUE,TRUE,TRUE,NSW-SMART-Shark-Management-Alert-in-Real-Time-Drumlines-Report-July-2021-June-2022.pdf
26/06/2022,15:13,Tiger Shark,164,F,Alive,"ID, A",Coffs Harbour - Coffs Harbour to Sawtell,Boambee Beach,2022-06-26T15:13:00Z,2022,6,TIG,TRUE,TRUE,TRUE,NSW-SMART-Shark-Management-Alert-in-Real-Time-Drumlines-Report-July-2021-June-2022.pdf
01/11/2021,9:40,Dusky Whaler,140,F,Alive,ID,Coffs Harbour - Coffs Harbour to Sawtell,Park Beach,2021-11-01T09:40:00Z,2021,11,DUS,FALSE,TRUE,FALSE,NSW-SMART-Shark-Management-Alert-in-Real-Time-Drumlines-Report-July-2021-June-2022.pdf
02/11/2021,9:09,White Shark,258,F,Alive,"ID, A",Coffs Harbour - Coffs Harbour to Sawtell,Park Beach,2021-11-02T09:09:00Z,2021,11,WHI,TRUE,TRUE,TRUE,NSW-SMART-Shark-Management-Alert-in-Real-Time-Drumlines-Report-July-2021-June-2022.pdf
06/11/2021,14:13,White Shark,232,F,Alive,"ID, A",Coffs Harbour - Coffs Harbour to Sawtell,Park Beach,2021-11-06T14:13:00Z,2021,11,WHI,TRUE,TRUE,TRUE,NSW-SMART-Shark-Management-Alert-in-Real-Time-Drumlines-Report-July-2021-June-2022.pdf
20/12/2021,8:36,Tiger Shark,368,F,Alive,"ID, A",Coffs Harbour - Coffs Harbour to Sawtell,Park Beach,2021-12-20T08:36:00Z,2021,12,TIG,TRUE,TRUE,TRUE,NSW-SMART-Shark-Management-Alert-in-Real-Time-Drumlines-Report-July-2021-June-2022.pdf
20/12/2021,15:52,Tiger Shark,156,F,Alive,"ID, A",Coffs Harbour - Coffs Harbour to Sawtell,Park Beach,2021-12-20T15:52:00Z,2021,12,TIG,TRUE,TRUE,TRUE,NSW-SMART-Shark-Management-Alert-in-Real-Time-Drumlines-Report-July-2021-June-2022.pdf
01/02/2022,9:12,Common Blacktip,162,F,Alive,ID,Coffs Harbour - Coffs Harbour to Sawtell,Park Beach,2022-02-01T09:12:00Z,2022,2,CBT,FALSE,TRUE,FALSE,NSW-SMART-Shark-Management-Alert-in-Real-Time-Drumlines-Report-July-2021-June-2022.pdf
14/02/2022,9:29,Common Blacktip,175,F,Alive,ID,Coffs Harbour - Coffs Harbour to Sawtell,Park Beach,2022-02-14T09:29:00Z,2022,2,CBT,FALSE,TRUE,FALSE,NSW-SMART-Shark-Management-Alert-in-Real-Time-Drumlines-Report-July-2021-June-2022.pdf
15/02/2022,11:50,Dusky Whaler,246,F,Alive,ID,Coffs Harbour - Coffs Harbour to Sawtell,Park Beach,2022-02-15T11:50:00Z,2022,2,DUS,FALSE,TRUE,FALSE,NSW-SMART-Shark-Management-Alert-in-Real-Time-Drumlines-Report-July-2021-June-2022.pdf
17/02/2022,8:46,Common Blacktip,189,F,Alive,ID,Coffs Harbour - Coffs Harbour to Sawtell,Park Beach,2022-02-17T08:46:00Z,2022,2,CBT,FALSE,TRUE,FALSE,NSW-SMART-Shark-Management-Alert-in-Real-Time-Drumlines-Report-July-2021-June-2022.pdf
06/03/2022,8:55,Bull Shark,NA,NA,Alive,-,Coffs Harbour - Coffs Harbour to Sawtell,Park Beach,2022-03-06T08:55:00Z,2022,3,BUL,TRUE,FALSE,FALSE,NSW-SMART-Shark-Management-Alert-in-Real-Time-Drumlines-Report-July-2021-June-2022.pdf
26/03/2022,16:12,Greynurse Shark,290,F,Alive,ID,Coffs Harbour - Coffs Harbour to Sawtell,Park Beach,2022-03-26T16:12:00Z,2022,3,GRN,FALSE,TRUE,FALSE,NSW-SMART-Shark-Management-Alert-in-Real-Time-Drumlines-Report-July-2021-June-2022.pdf
10/04/2022,7:35,Greynurse Shark,257,F,Alive,ID,Coffs Harbour - Coffs Harbour to Sawtell,Park Beach,2022-04-10T07:35:00Z,2022,4,GRN,FALSE,TRUE,FALSE,NSW-SMART-Shark-Management-Alert-in-Real-Time-Drumlines-Report-July-2021-June-2022.pdf
15/04/2022,9:52,Common Blacktip,227,M,Alive,ID,Coffs Harbour - Coffs Harbour to Sawtell,Park Beach,2022-04-15T09:52:00Z,2022,4,CBT,FALSE,TRUE,FALSE,NSW-SMART-Shark-Management-Alert-in-Real-Time-Drumlines-Report-July-2021-June-2022.pdf
29/05/2022,15:06,Greynurse Shark,268,M,Alive,ID,Coffs Harbour - Coffs Harbour to Sawtell,Park Beach,2022-05-29T15:06:00Z,2022,5,GRN,FALSE,TRUE,FALSE,NSW-SMART-Shark-Management-Alert-in-Real-Time-Drumlines-Report-July-2021-June-2022.pdf
30/05/2022,14:47,White Shark,222,M,Alive,"ID, A",Coffs Harbour - Coffs Harbour to Sawtell,Park Beach,2022-05-30T14:47:00Z,2022,5,WHI,TRUE,TRUE,TRUE,NSW-SMART-Shark-Management-Alert-in-Real-Time-Drumlines-Report-July-2021-June-2022.pdf
06/06/2022,10:01,Greynurse Shark,252,F,Alive,ID,Coffs Harbour - Coffs Harbour to Sawtell,Park Beach,2022-06-06T10:01:00Z,2022,6,GRN,FALSE,TRUE,FALSE,NSW-SMART-Shark-Management-Alert-in-Real-Time-Drumlines-Report-July-2021-June-2022.pdf
23/06/2022,13:48,Bronze Whaler,257,M,Alive,ID,Coffs Harbour - Coffs Harbour to Sawtell,Park Beach,2022-06-23T13:48:00Z,2022,6,BRO,FALSE,TRUE,FALSE,NSW-SMART-Shark-Management-Alert-in-Real-Time-Drumlines-Report-July-2021-June-2022.pdf
24/06/2022,13:58,Sandbar Shark,195,F,Alive,ID,Coffs Harbour - Coffs Harbour to Sawtell,Park Beach,2022-06-24T13:58:00Z,2022,6,SAN,FALSE,TRUE,FALSE,NSW-SMART-Shark-Management-Alert-in-Real-Time-Drumlines-Report-July-2021-June-2022.pdf
24/06/2022,14:07,Whaler - unidentified,NA,NA,Alive,-,Coffs Harbour - Coffs Harbour to Sawtell,Park Beach,2022-06-24T14:07:00Z,2022,6,WHL,FALSE,FALSE,FALSE,NSW-SMART-Shark-Management-Alert-in-Real-Time-Drumlines-Report-July-2021-June-2022.pdf
01/11/2021,8:25,Greynurse Shark,242,F,Alive,ID,Coffs Harbour - Coffs Harbour to Sawtell,Diggers Beach,2021-11-01T08:25:00Z,2021,11,GRN,FALSE,TRUE,FALSE,NSW-SMART-Shark-Management-Alert-in-Real-Time-Drumlines-Report-July-2021-June-2022.pdf
03/11/2021,12:57,Dusky Whaler,159,M,Alive,ID,Coffs Harbour - Coffs Harbour to Sawtell,Diggers Beach,2021-11-03T12:57:00Z,2021,11,DUS,FALSE,TRUE,FALSE,NSW-SMART-Shark-Management-Alert-in-Real-Time-Drumlines-Report-July-2021-June-2022.pdf
04/11/2021,9:46,Dusky Whaler,156,F,Alive,ID,Coffs Harbour - Coffs Harbour to Sawtell,Diggers Beach,2021-11-04T09:46:00Z,2021,11,DUS,FALSE,TRUE,FALSE,NSW-SMART-Shark-Management-Alert-in-Real-Time-Drumlines-Report-July-2021-June-2022.pdf
04/11/2021,NA,Dusky Whaler,136,M,Alive,ID,Coffs Harbour - Coffs Harbour to Sawtell,Diggers Beach,NA,2021,11,DUS,FALSE,TRUE,FALSE,NSW-SMART-Shark-Management-Alert-in-Real-Time-Drumlines-Report-July-2021-June-2022.pdf
08/11/2021,15:45,Tiger Shark,182,F,Alive,"ID, A",Coffs Harbour - Coffs Harbour to Sawtell,Diggers Beach,2021-11-08T15:45:00Z,2021,11,TIG,TRUE,TRUE,TRUE,NSW-SMART-Shark-Management-Alert-in-Real-Time-Drumlines-Report-July-2021-June-2022.pdf
17/12/2021,10:00,Tiger Shark,206,F,Alive,"ID, A",Coffs Harbour - Coffs Harbour to Sawtell,Diggers Beach,2021-12-17T10:00:00Z,2021,12,TIG,TRUE,TRUE,TRUE,NSW-SMART-Shark-Management-Alert-in-Real-Time-Drumlines-Report-July-2021-June-2022.pdf
17/12/2021,16:18,Tiger Shark,176,F,Alive,"ID, A",Coffs Harbour - Coffs Harbour to Sawtell,Diggers Beach,2021-12-17T16:18:00Z,2021,12,TIG,TRUE,TRUE,TRUE,NSW-SMART-Shark-Management-Alert-in-Real-Time-Drumlines-Report-July-2021-June-2022.pdf
20/12/2021,15:58,Tiger Shark,235,F,Alive,"ID, A",Coffs Harbour - Coffs Harbour to Sawtell,Diggers Beach,2021-12-20T15:58:00Z,2021,12,TIG,TRUE,TRUE,TRUE,NSW-SMART-Shark-Management-Alert-in-Real-Time-Drumlines-Report-July-2021-June-2022.pdf
26/12/2021,7:14,Tiger Shark,230,F,Alive,"ID, A",Coffs Harbour - Coffs Harbour to Sawtell,Diggers Beach,2021-12-26T07:14:00Z,2021,12,TIG,TRUE,TRUE,TRUE,NSW-SMART-Shark-Management-Alert-in-Real-Time-Drumlines-Report-July-2021-June-2022.pdf
13/01/2022,13:15,Dusky Whaler,198,F,Alive,ID,Coffs Harbour - Coffs Harbour to Sawtell,Diggers Beach,2022-01-13T13:15:00Z,2022,1,DUS,FALSE,TRUE,FALSE,NSW-SMART-Shark-Management-Alert-in-Real-Time-Drumlines-Report-July-2021-June-2022.pdf
01/02/2022,7:33,Dusky Whaler,192,F,Alive,ID,Coffs Harbour - Coffs Harbour to Sawtell,Diggers Beach,2022-02-01T07:33:00Z,2022,2,DUS,FALSE,TRUE,FALSE,NSW-SMART-Shark-Management-Alert-in-Real-Time-Drumlines-Report-July-2021-June-2022.pdf
09/02/2022,6:54,Sandbar Shark,188,F,Alive,ID,Coffs Harbour - Coffs Harbour to Sawtell,Diggers Beach,2022-02-09T06:54:00Z,2022,2,SAN,FALSE,TRUE,FALSE,NSW-SMART-Shark-Management-Alert-in-Real-Time-Drumlines-Report-July-2021-June-2022.pdf
16/02/2022,7:04,Sandbar Shark,190,F,Alive,ID,Coffs Harbour - Coffs Harbour to Sawtell,Diggers Beach,2022-02-16T07:04:00Z,2022,2,SAN,FALSE,TRUE,FALSE,NSW-SMART-Shark-Management-Alert-in-Real-Time-Drumlines-Report-July-2021-June-2022.pdf
16/02/2022,10:02,Dusky Whaler,237,M,Alive,ID,Coffs Harbour - Coffs Harbour to Sawtell,Diggers Beach,2022-02-16T10:02:00Z,2022,2,DUS,FALSE,TRUE,FALSE,NSW-SMART-Shark-Management-Alert-in-Real-Time-Drumlines-Report-July-2021-June-2022.pdf
04/03/2022,15:14,Dusky Whaler,234,M,Alive,ID,Coffs Harbour - Coffs Harbour to Sawtell,Diggers Beach,2022-03-04T15:14:00Z,2022,3,DUS,FALSE,TRUE,FALSE,NSW-SMART-Shark-Management-Alert-in-Real-Time-Drumlines-Report-July-2021-June-2022.pdf
22/03/2022,11:49,Tiger Shark,231,F,Alive,"ID, A",Coffs Harbour - Coffs Harbour to Sawtell,Diggers Beach,2022-03-22T11:49:00Z,2022,3,TIG,TRUE,TRUE,TRUE,NSW-SMART-Shark-Management-Alert-in-Real-Time-Drumlines-Report-July-2021-June-2022.pdf
22/03/2022,17:40,Sandbar Shark,208,F,Alive,ID,Coffs Harbour - Coffs Harbour to Sawtell,Diggers Beach,2022-03-22T17:40:00Z,2022,3,SAN,FALSE,TRUE,FALSE,NSW-SMART-Shark-Management-Alert-in-Real-Time-Drumlines-Report-July-2021-June-2022.pdf
23/03/2022,8:25,Bull Shark,178,F,Alive,"ID, A",Coffs Harbour - Coffs Harbour to Sawtell,Diggers Beach,2022-03-23T08:25:00Z,2022,3,BUL,TRUE,TRUE,TRUE,NSW-SMART-Shark-Management-Alert-in-Real-Time-Drumlines-Report-July-2021-June-2022.pdf
28/03/2022,7:47,Tiger Shark,247,M,Alive,"ID, A",Coffs Harbour - Coffs Harbour to Sawtell,Diggers Beach,2022-03-28T07:47:00Z,2022,3,TIG,TRUE,TRUE,TRUE,NSW-SMART-Shark-Management-Alert-in-Real-Time-Drumlines-Report-July-2021-June-2022.pdf
15/04/2022,9:39,Tiger Shark,214,F,Alive,"ID, A",Coffs Harbour - Coffs Harbour to Sawtell,Diggers Beach,2022-04-15T09:39:00Z,2022,4,TIG,TRUE,TRUE,TRUE,NSW-SMART-Shark-Management-Alert-in-Real-Time-Drumlines-Report-July-2021-June-2022.pdf
01/05/2022,15:28,Dusky Whaler,199,M,Alive,ID,Coffs Harbour - Coffs Harbour to Sawtell,Diggers Beach,2022-05-01T15:28:00Z,2022,5,DUS,FALSE,TRUE,FALSE,NSW-SMART-Shark-Management-Alert-in-Real-Time-Drumlines-Report-July-2021-June-2022.pdf
15/05/2022,8:51,Sandbar Shark,198,F,Alive,ID,Coffs Harbour - Coffs Harbour to Sawtell,Diggers Beach,2022-05-15T08:51:00Z,2022,5,SAN,FALSE,TRUE,FALSE,NSW-SMART-Shark-Management-Alert-in-Real-Time-Drumlines-Report-July-2021-June-2022.pdf
29/05/2022,7:05,Sandbar Shark,154,F,Alive,ID,Coffs Harbour - Coffs Harbour to Sawtell,Diggers Beach,2022-05-29T07:05:00Z,2022,5,SAN,FALSE,TRUE,FALSE,NSW-SMART-Shark-Management-Alert-in-Real-Time-Drumlines-Report-July-2021-June-2022.pdf
29/05/2022,9:01,Tiger Shark,242,F,Alive,"ID, A",Coffs Harbour - Coffs Harbour to Sawtell,Diggers Beach,2022-05-29T09:01:00Z,2022,5,TIG,TRUE,TRUE,TRUE,NSW-SMART-Shark-Management-Alert-in-Real-Time-Drumlines-Report-July-2021-June-2022.pdf
20/04/2022,13:44,Dusky Whaler,355,F,Alive,ID,Port Macquarie  Port Macquarie to Tacking Point,Lighthouse Beach,2022-04-20T13:44:00Z,2022,4,DUS,FALSE,TRUE,FALSE,NSW-SMART-Shark-Management-Alert-in-Real-Time-Drumlines-Report-July-2021-June-2022.pdf
21/04/2022,7:15,Common Blacktip,240,M,Alive,ID,Port Macquarie  Port Macquarie to Tacking Point,Lighthouse Beach,2022-04-21T07:15:00Z,2022,4,CBT,FALSE,TRUE,FALSE,NSW-SMART-Shark-Management-Alert-in-Real-Time-Drumlines-Report-July-2021-June-2022.pdf
25/04/2022,14:21,White Shark,329,F,Alive,"ID, A",Port Macquarie  Port Macquarie to Tacking Point,Lighthouse Beach,2022-04-25T14:21:00Z,2022,4,WHI,TRUE,TRUE,TRUE,NSW-SMART-Shark-Management-Alert-in-Real-Time-Drumlines-Report-July-2021-June-2022.pdf
03/05/2022,9:30,Smooth Hammerhead,213,M,Alive,ID,Port Macquarie  Port Macquarie to Tacking Point,Lighthouse Beach,2022-05-03T09:30:00Z,2022,5,SMH,FALSE,TRUE,FALSE,NSW-SMART-Shark-Management-Alert-in-Real-Time-Drumlines-Report-July-2021-June-2022.pdf
10/05/2022,9:20,White Shark,213,M,Alive,"ID, A",Port Macquarie  Port Macquarie to Tacking Point,Lighthouse Beach,2022-05-10T09:20:00Z,2022,5,WHI,TRUE,TRUE,TRUE,NSW-SMART-Shark-Management-Alert-in-Real-Time-Drumlines-Report-July-2021-June-2022.pdf
28/05/2022,11:54,White Shark,296,F,Alive,"ID, A",Port Macquarie  Port Macquarie to Tacking Point,Lighthouse Beach,2022-05-28T11:54:00Z,2022,5,WHI,TRUE,TRUE,TRUE,NSW-SMART-Shark-Management-Alert-in-Real-Time-Drumlines-Report-July-2021-June-2022.pdf
30/05/2022,10:09,White Shark,254,F,Alive,"ID, A",Port Macquarie  Port Macquarie to Tacking Point,Lighthouse Beach,2022-05-30T10:09:00Z,2022,5,WHI,TRUE,TRUE,TRUE,NSW-SMART-Shark-Management-Alert-in-Real-Time-Drumlines-Report-July-2021-June-2022.pdf
01/06/2022,13:29,White Shark,227,F,Alive,"ID, A",Port Macquarie  Port Macquarie to Tacking Point,Lighthouse Beach,2022-06-01T13:29:00Z,2022,6,WHI,TRUE,TRUE,TRUE,NSW-SMART-Shark-Management-Alert-in-Real-Time-Drumlines-Report-July-2021-June-2022.pdf
05/06/2022,8:02,White Shark,204,F,Alive,"ID, A",Port Macquarie  Port Macquarie to Tacking Point,Lighthouse Beach,2022-06-05T08:02:00Z,2022,6,WHI,TRUE,TRUE,TRUE,NSW-SMART-Shark-Management-Alert-in-Real-Time-Drumlines-Report-July-2021-June-2022.pdf
12/06/2022,12:25,White Shark,336,F,Alive,"ID, A",Port Macquarie  Port Macquarie to Tacking Point,Lighthouse Beach,2022-06-12T12:25:00Z,2022,6,WHI,TRUE,TRUE,TRUE,NSW-SMART-Shark-Management-Alert-in-Real-Time-Drumlines-Report-July-2021-June-2022.pdf
17/06/2022,9:37,White Shark,NA,NA,Alive,-,Port Macquarie  Port Macquarie to Tacking Point,Lighthouse Beach,2022-06-17T09:37:00Z,2022,6,WHI,TRUE,FALSE,FALSE,NSW-SMART-Shark-Management-Alert-in-Real-Time-Drumlines-Report-July-2021-June-2022.pdf
21/06/2022,9:41,White Shark,280,M,Alive,"ID, A",Port Macquarie  Port Macquarie to Tacking Point,Lighthouse Beach,2022-06-21T09:41:00Z,2022,6,WHI,TRUE,TRUE,TRUE,NSW-SMART-Shark-Management-Alert-in-Real-Time-Drumlines-Report-July-2021-June-2022.pdf
21/06/2022,10:29,Bull Shark,207,F,Alive,"ID, A",Port Macquarie  Port Macquarie to Tacking Point,Lighthouse Beach,2022-06-21T10:29:00Z,2022,6,BUL,TRUE,TRUE,TRUE,NSW-SMART-Shark-Management-Alert-in-Real-Time-Drumlines-Report-July-2021-June-2022.pdf
25/06/2022,10:42,White Shark,212,M,Alive,"ID, A",Port Macquarie  Port Macquarie to Tacking Point,Lighthouse Beach,2022-06-25T10:42:00Z,2022,6,WHI,TRUE,TRUE,TRUE,NSW-SMART-Shark-Management-Alert-in-Real-Time-Drumlines-Report-July-2021-June-2022.pdf
26/06/2022,12:36,White Shark,244,M,Alive,"ID, A",Port Macquarie  Port Macquarie to Tacking Point,Lighthouse Beach,2022-06-26T12:36:00Z,2022,6,WHI,TRUE,TRUE,TRUE,NSW-SMART-Shark-Management-Alert-in-Real-Time-Drumlines-Report-July-2021-June-2022.pdf
30/06/2022,9:26,Bronze Whaler,286,F,Alive,ID,Port Macquarie  Port Macquarie to Tacking Point,Lighthouse Beach,2022-06-30T09:26:00Z,2022,6,BRO,FALSE,TRUE,FALSE,NSW-SMART-Shark-Management-Alert-in-Real-Time-Drumlines-Report-July-2021-June-2022.pdf
04/04/2022,13:50,Dusky Whaler,290,F,Alive,"ID, A",Port Macquarie  Port Macquarie to Tacking Point,Miners Beach,2022-04-04T13:50:00Z,2022,4,DUS,FALSE,TRUE,TRUE,NSW-SMART-Shark-Management-Alert-in-Real-Time-Drumlines-Report-July-2021-June-2022.pdf
11/06/2022,9:20,White Shark,234,M,Alive,"ID, A",Port Macquarie  Port Macquarie to Tacking Point,Miners Beach,2022-06-11T09:20:00Z,2022,6,WHI,TRUE,TRUE,TRUE,NSW-SMART-Shark-Management-Alert-in-Real-Time-Drumlines-Report-July-2021-June-2022.pdf
04/04/2022,9:03,White Shark,238,F,Alive,"ID, A",Port Macquarie  Port Macquarie to Tacking Point,Shelly Beach,2022-04-04T09:03:00Z,2022,4,WHI,TRUE,TRUE,TRUE,NSW-SMART-Shark-Management-Alert-in-Real-Time-Drumlines-Report-July-2021-June-2022.pdf
20/04/2022,8:08,Dusky Whaler,345,M,Alive,ID,Port Macquarie  Port Macquarie to Tacking Point,Shelly Beach,2022-04-20T08:08:00Z,2022,4,DUS,FALSE,TRUE,FALSE,NSW-SMART-Shark-Management-Alert-in-Real-Time-Drumlines-Report-July-2021-June-2022.pdf
26/05/2022,8:44,Common Blacktip,208,F,Alive,ID,Port Macquarie  Port Macquarie to Tacking Point,Shelly Beach,2022-05-26T08:44:00Z,2022,5,CBT,FALSE,TRUE,FALSE,NSW-SMART-Shark-Management-Alert-in-Real-Time-Drumlines-Report-July-2021-June-2022.pdf
19/06/2022,11:48,White Shark,252,M,Alive,"ID, A",Port Macquarie  Port Macquarie to Tacking Point,Shelly Beach,2022-06-19T11:48:00Z,2022,6,WHI,TRUE,TRUE,TRUE,NSW-SMART-Shark-Management-Alert-in-Real-Time-Drumlines-Report-July-2021-June-2022.pdf
21/06/2022,NA,White Shark,287,F,Alive,"ID, A",Port Macquarie  Port Macquarie to Tacking Point,Shelly Beach,NA,2022,6,WHI,TRUE,TRUE,TRUE,NSW-SMART-Shark-Management-Alert-in-Real-Time-Drumlines-Report-July-2021-June-2022.pdf
27/04/2022,14:15,White Shark,362,M,Alive,"ID, A",Port Macquarie  Port Macquarie to Tacking Point,Rocky Beach,2022-04-27T14:15:00Z,2022,4,WHI,TRUE,TRUE,TRUE,NSW-SMART-Shark-Management-Alert-in-Real-Time-Drumlines-Report-July-2021-June-2022.pdf
15/06/2022,11:10,White Shark,307,F,Alive,"ID, A",Port Macquarie  Port Macquarie to Tacking Point,Rocky Beach,2022-06-15T11:10:00Z,2022,6,WHI,TRUE,TRUE,TRUE,NSW-SMART-Shark-Management-Alert-in-Real-Time-Drumlines-Report-July-2021-June-2022.pdf
21/06/2022,8:42,White Shark,374,F,Alive,"ID, A",Port Macquarie  Port Macquarie to Tacking Point,Rocky Beach,2022-06-21T08:42:00Z,2022,6,WHI,TRUE,TRUE,TRUE,NSW-SMART-Shark-Management-Alert-in-Real-Time-Drumlines-Report-July-2021-June-2022.pdf
04/04/2022,7:30,Bull Shark,185,F,Alive,"ID, A",Port Macquarie  Port Macquarie to Tacking Point,Oxley Beach,2022-04-04T07:30:00Z,2022,4,BUL,TRUE,TRUE,TRUE,NSW-SMART-Shark-Management-Alert-in-Real-Time-Drumlines-Report-July-2021-June-2022.pdf
27/05/2022,7:54,Greynurse Shark,296,F,Alive,ID,Port Macquarie  Port Macquarie to Tacking Point,Oxley Beach,2022-05-27T07:54:00Z,2022,5,GRN,FALSE,TRUE,FALSE,NSW-SMART-Shark-Management-Alert-in-Real-Time-Drumlines-Report-July-2021-June-2022.pdf
25/06/2022,15:05,Greynurse Shark,255,M,Alive,ID,Port Macquarie  Port Macquarie to Tacking Point,Oxley Beach,2022-06-25T15:05:00Z,2022,6,GRN,FALSE,TRUE,FALSE,NSW-SMART-Shark-Management-Alert-in-Real-Time-Drumlines-Report-July-2021-June-2022.pdf
21/04/2022,14:58,Greynurse Shark,276,F,Alive,ID,Port Macquarie  Port Macquarie to Tacking Point,North Shore Beach,2022-04-21T14:58:00Z,2022,4,GRN,FALSE,TRUE,FALSE,NSW-SMART-Shark-Management-Alert-in-Real-Time-Drumlines-Report-July-2021-June-2022.pdf
16/05/2022,14:15,Greynurse Shark,252,F,Alive,ID,Port Macquarie  Port Macquarie to Tacking Point,North Shore Beach,2022-05-16T14:15:00Z,2022,5,GRN,FALSE,TRUE,FALSE,NSW-SMART-Shark-Management-Alert-in-Real-Time-Drumlines-Report-July-2021-June-2022.pdf
30/05/2022,6:54,Greynurse Shark,278,F,Alive,ID,Port Macquarie  Port Macquarie to Tacking Point,North Shore Beach,2022-05-30T06:54:00Z,2022,5,GRN,FALSE,TRUE,FALSE,NSW-SMART-Shark-Management-Alert-in-Real-Time-Drumlines-Report-July-2021-June-2022.pdf
05/06/2022,9:57,White Shark,307,F,Alive,"ID, A",Port Macquarie  Port Macquarie to Tacking Point,North Shore Beach,2022-06-05T09:57:00Z,2022,6,WHI,TRUE,TRUE,TRUE,NSW-SMART-Shark-Management-Alert-in-Real-Time-Drumlines-Report-July-2021-June-2022.pdf
08/06/2022,12:27,White Shark,198,F,Alive,"ID, A",Port Macquarie  Port Macquarie to Tacking Point,North Shore Beach,2022-06-08T12:27:00Z,2022,6,WHI,TRUE,TRUE,TRUE,NSW-SMART-Shark-Management-Alert-in-Real-Time-Drumlines-Report-July-2021-June-2022.pdf
15/06/2022,9:23,White Shark,229,M,Alive,"ID, A",Port Macquarie  Port Macquarie to Tacking Point,North Shore Beach,2022-06-15T09:23:00Z,2022,6,WHI,TRUE,TRUE,TRUE,NSW-SMART-Shark-Management-Alert-in-Real-Time-Drumlines-Report-July-2021-June-2022.pdf
27/06/2022,11:53,White Shark,254,F,Alive,"ID, A",Port Macquarie  Port Macquarie to Tacking Point,North Shore Beach,2022-06-27T11:53:00Z,2022,6,WHI,TRUE,TRUE,TRUE,NSW-SMART-Shark-Management-Alert-in-Real-Time-Drumlines-Report-July-2021-June-2022.pdf
30/06/2022,7:38,White Shark,264,F,Alive,"ID, A",Port Macquarie  Port Macquarie to Tacking Point,North Shore Beach,2022-06-30T07:38:00Z,2022,6,WHI,TRUE,TRUE,TRUE,NSW-SMART-Shark-Management-Alert-in-Real-Time-Drumlines-Report-July-2021-June-2022.pdf
11/11/2021,8:35,White Shark,212,F,Alive,"ID, A",Port Macquarie  Port Macquarie to Tacking Point,Tuncurry Beach,2021-11-11T08:35:00Z,2021,11,WHI,TRUE,TRUE,TRUE,NSW-SMART-Shark-Management-Alert-in-Real-Time-Drumlines-Report-July-2021-June-2022.pdf
16/11/2021,14:57,Bronze Whaler,269,M,Alive,ID,Port Macquarie  Port Macquarie to Tacking Point,Tuncurry Beach,2021-11-16T14:57:00Z,2021,11,BRO,FALSE,TRUE,FALSE,NSW-SMART-Shark-Management-Alert-in-Real-Time-Drumlines-Report-July-2021-June-2022.pdf
20/11/2021,9:50,White Shark,287,F,Alive,"ID, A",Port Macquarie  Port Macquarie to Tacking Point,Tuncurry Beach,2021-11-20T09:50:00Z,2021,11,WHI,TRUE,TRUE,TRUE,NSW-SMART-Shark-Management-Alert-in-Real-Time-Drumlines-Report-July-2021-June-2022.pdf
20/11/2021,16:16,White Shark,252,F,Alive,"ID, A",Port Macquarie  Port Macquarie to Tacking Point,Tuncurry Beach,2021-11-20T16:16:00Z,2021,11,WHI,TRUE,TRUE,TRUE,NSW-SMART-Shark-Management-Alert-in-Real-Time-Drumlines-Report-July-2021-June-2022.pdf
23/11/2021,9:42,White Shark,228,F,Alive,"ID, A",Port Macquarie  Port Macquarie to Tacking Point,Tuncurry Beach,2021-11-23T09:42:00Z,2021,11,WHI,TRUE,TRUE,TRUE,NSW-SMART-Shark-Management-Alert-in-Real-Time-Drumlines-Report-July-2021-June-2022.pdf
11/12/2021,17:46,White Shark,220,F,Alive,"ID, A",Port Macquarie  Port Macquarie to Tacking Point,Tuncurry Beach,2021-12-11T17:46:00Z,2021,12,WHI,TRUE,TRUE,TRUE,NSW-SMART-Shark-Management-Alert-in-Real-Time-Drumlines-Report-July-2021-June-2022.pdf
14/12/2021,11:26,White Shark,240,F,Alive,"ID, A",Port Macquarie  Port Macquarie to Tacking Point,Tuncurry Beach,2021-12-14T11:26:00Z,2021,12,WHI,TRUE,TRUE,TRUE,NSW-SMART-Shark-Management-Alert-in-Real-Time-Drumlines-Report-July-2021-June-2022.pdf
03/01/2022,9:05,White Shark,259,F,Alive,"ID, A",Port Macquarie  Port Macquarie to Tacking Point,Tuncurry Beach,2022-01-03T09:05:00Z,2022,1,WHI,TRUE,TRUE,TRUE,NSW-SMART-Shark-Management-Alert-in-Real-Time-Drumlines-Report-July-2021-June-2022.pdf
03/01/2022,NA,White Shark,277,F,Alive,"ID, A",Port Macquarie  Port Macquarie to Tacking Point,Tuncurry Beach,NA,2022,1,WHI,TRUE,TRUE,TRUE,NSW-SMART-Shark-Management-Alert-in-Real-Time-Drumlines-Report-July-2021-June-2022.pdf
09/01/2022,12:30,White Shark,262,F,Alive,"ID, A",Port Macquarie  Port Macquarie to Tacking Point,Tuncurry Beach,2022-01-09T12:30:00Z,2022,1,WHI,TRUE,TRUE,TRUE,NSW-SMART-Shark-Management-Alert-in-Real-Time-Drumlines-Report-July-2021-June-2022.pdf
14/01/2022,8:15,White Shark,220,F,Alive,"ID, A",Port Macquarie  Port Macquarie to Tacking Point,Tuncurry Beach,2022-01-14T08:15:00Z,2022,1,WHI,TRUE,TRUE,TRUE,NSW-SMART-Shark-Management-Alert-in-Real-Time-Drumlines-Report-July-2021-June-2022.pdf
17/01/2022,15:46,White Shark,287,F,Alive,"ID, A",Port Macquarie  Port Macquarie to Tacking Point,Tuncurry Beach,2022-01-17T15:46:00Z,2022,1,WHI,TRUE,TRUE,TRUE,NSW-SMART-Shark-Management-Alert-in-Real-Time-Drumlines-Report-July-2021-June-2022.pdf
25/01/2022,15:06,White Shark,263,F,Alive,"ID, A",Port Macquarie  Port Macquarie to Tacking Point,Tuncurry Beach,2022-01-25T15:06:00Z,2022,1,WHI,TRUE,TRUE,TRUE,NSW-SMART-Shark-Management-Alert-in-Real-Time-Drumlines-Report-July-2021-June-2022.pdf
03/02/2022,13:21,White Shark,254,M,Alive,"ID, A",Port Macquarie  Port Macquarie to Tacking Point,Tuncurry Beach,2022-02-03T13:21:00Z,2022,2,WHI,TRUE,TRUE,TRUE,NSW-SMART-Shark-Management-Alert-in-Real-Time-Drumlines-Report-July-2021-June-2022.pdf
09/02/2022,15:58,White Shark,290,F,Alive,"ID, A",Port Macquarie  Port Macquarie to Tacking Point,Tuncurry Beach,2022-02-09T15:58:00Z,2022,2,WHI,TRUE,TRUE,TRUE,NSW-SMART-Shark-Management-Alert-in-Real-Time-Drumlines-Report-July-2021-June-2022.pdf
10/04/2022,11:38,Bull Shark,181,F,Alive,"ID, A",Port Macquarie  Port Macquarie to Tacking Point,Tuncurry Beach,2022-04-10T11:38:00Z,2022,4,BUL,TRUE,TRUE,TRUE,NSW-SMART-Shark-Management-Alert-in-Real-Time-Drumlines-Report-July-2021-June-2022.pdf
10/04/2022,12:24,Bull Shark,176,F,Alive,"ID, A",Port Macquarie  Port Macquarie to Tacking Point,Tuncurry Beach,2022-04-10T12:24:00Z,2022,4,BUL,TRUE,TRUE,TRUE,NSW-SMART-Shark-Management-Alert-in-Real-Time-Drumlines-Report-July-2021-June-2022.pdf
16/05/2022,NA,White Shark,257,M,Alive,"ID, A",Port Macquarie  Port Macquarie to Tacking Point,Tuncurry Beach,NA,2022,5,WHI,TRUE,TRUE,TRUE,NSW-SMART-Shark-Management-Alert-in-Real-Time-Drumlines-Report-July-2021-June-2022.pdf
20/05/2022,8:12,White Shark,238,M,Alive,"ID, A",Port Macquarie  Port Macquarie to Tacking Point,Tuncurry Beach,2022-05-20T08:12:00Z,2022,5,WHI,TRUE,TRUE,TRUE,NSW-SMART-Shark-Management-Alert-in-Real-Time-Drumlines-Report-July-2021-June-2022.pdf
22/05/2022,10:30,White Shark,254,M,Alive,"ID, A",Port Macquarie  Port Macquarie to Tacking Point,Tuncurry Beach,2022-05-22T10:30:00Z,2022,5,WHI,TRUE,TRUE,TRUE,NSW-SMART-Shark-Management-Alert-in-Real-Time-Drumlines-Report-July-2021-June-2022.pdf
03/06/2022,10:29,White Shark,280,F,Alive,"ID, A",Port Macquarie  Port Macquarie to Tacking Point,Tuncurry Beach,2022-06-03T10:29:00Z,2022,6,WHI,TRUE,TRUE,TRUE,NSW-SMART-Shark-Management-Alert-in-Real-Time-Drumlines-Report-July-2021-June-2022.pdf
09/06/2022,13:11,White Shark,231,M,Alive,"ID, A",Port Macquarie  Port Macquarie to Tacking Point,Tuncurry Beach,2022-06-09T13:11:00Z,2022,6,WHI,TRUE,TRUE,TRUE,NSW-SMART-Shark-Management-Alert-in-Real-Time-Drumlines-Report-July-2021-June-2022.pdf
10/06/2022,12:18,White Shark,230,F,Alive,"ID, A",Port Macquarie  Port Macquarie to Tacking Point,Tuncurry Beach,2022-06-10T12:18:00Z,2022,6,WHI,TRUE,TRUE,TRUE,NSW-SMART-Shark-Management-Alert-in-Real-Time-Drumlines-Report-July-2021-June-2022.pdf
15/06/2022,11:14,White Shark,308,M,Alive,"ID, A",Port Macquarie  Port Macquarie to Tacking Point,Tuncurry Beach,2022-06-15T11:14:00Z,2022,6,WHI,TRUE,TRUE,TRUE,NSW-SMART-Shark-Management-Alert-in-Real-Time-Drumlines-Report-July-2021-June-2022.pdf
19/06/2022,9:30,White Shark,266,F,Alive,"ID, A",Port Macquarie  Port Macquarie to Tacking Point,Tuncurry Beach,2022-06-19T09:30:00Z,2022,6,WHI,TRUE,TRUE,TRUE,NSW-SMART-Shark-Management-Alert-in-Real-Time-Drumlines-Report-July-2021-June-2022.pdf
20/06/2022,13:29,White Shark,235,M,Alive,"ID, A",Port Macquarie  Port Macquarie to Tacking Point,Tuncurry Beach,2022-06-20T13:29:00Z,2022,6,WHI,TRUE,TRUE,TRUE,NSW-SMART-Shark-Management-Alert-in-Real-Time-Drumlines-Report-July-2021-June-2022.pdf
20/06/2022,NA,White Shark,202,F,Alive,"ID, A",Port Macquarie  Port Macquarie to Tacking Point,Tuncurry Beach,NA,2022,6,WHI,TRUE,TRUE,TRUE,NSW-SMART-Shark-Management-Alert-in-Real-Time-Drumlines-Report-July-2021-June-2022.pdf
26/06/2022,15:36,White Shark,201,F,Alive,"ID, A",Port Macquarie  Port Macquarie to Tacking Point,Tuncurry Beach,2022-06-26T15:36:00Z,2022,6,WHI,TRUE,TRUE,TRUE,NSW-SMART-Shark-Management-Alert-in-Real-Time-Drumlines-Report-July-2021-June-2022.pdf
30/06/2022,7:24,White Shark,223,M,Alive,"ID, A",Port Macquarie  Port Macquarie to Tacking Point,Tuncurry Beach,2022-06-30T07:24:00Z,2022,6,WHI,TRUE,TRUE,TRUE,NSW-SMART-Shark-Management-Alert-in-Real-Time-Drumlines-Report-July-2021-June-2022.pdf
09/11/2021,9:15,White Shark,265,F,Alive,"ID, A",Port Macquarie  Port Macquarie to Tacking Point,"Main Beach, Forster",2021-11-09T09:15:00Z,2021,11,WHI,TRUE,TRUE,TRUE,NSW-SMART-Shark-Management-Alert-in-Real-Time-Drumlines-Report-July-2021-June-2022.pdf
09/11/2021,12:56,White Shark,205,F,Alive,"ID, A",Port Macquarie  Port Macquarie to Tacking Point,"Main Beach, Forster",2021-11-09T12:56:00Z,2021,11,WHI,TRUE,TRUE,TRUE,NSW-SMART-Shark-Management-Alert-in-Real-Time-Drumlines-Report-July-2021-June-2022.pdf
12/11/2021,12:28,White Shark,241,F,Alive,"ID, A",Port Macquarie  Port Macquarie to Tacking Point,"Main Beach, Forster",2021-11-12T12:28:00Z,2021,11,WHI,TRUE,TRUE,TRUE,NSW-SMART-Shark-Management-Alert-in-Real-Time-Drumlines-Report-July-2021-June-2022.pdf
26/11/2021,17:02,Bronze Whaler,261,M,Alive,ID,Port Macquarie  Port Macquarie to Tacking Point,"Main Beach, Forster",2021-11-26T17:02:00Z,2021,11,BRO,FALSE,TRUE,FALSE,NSW-SMART-Shark-Management-Alert-in-Real-Time-Drumlines-Report-July-2021-June-2022.pdf
30/11/2021,14:03,White Shark,266,F,Alive,"ID, A",Port Macquarie  Port Macquarie to Tacking Point,"Main Beach, Forster",2021-11-30T14:03:00Z,2021,11,WHI,TRUE,TRUE,TRUE,NSW-SMART-Shark-Management-Alert-in-Real-Time-Drumlines-Report-July-2021-June-2022.pdf
10/12/2021,11:33,White Shark,188,M,Alive,"ID, A",Port Macquarie  Port Macquarie to Tacking Point,"Main Beach, Forster",2021-12-10T11:33:00Z,2021,12,WHI,TRUE,TRUE,TRUE,NSW-SMART-Shark-Management-Alert-in-Real-Time-Drumlines-Report-July-2021-June-2022.pdf
10/12/2021,NA,Tiger Shark,166,M,Alive,"ID, A",Port Macquarie  Port Macquarie to Tacking Point,"Main Beach, Forster",NA,2021,12,TIG,TRUE,TRUE,TRUE,NSW-SMART-Shark-Management-Alert-in-Real-Time-Drumlines-Report-July-2021-June-2022.pdf
13/12/2021,16:26,White Shark,228,F,Alive,"ID, A",Port Macquarie  Port Macquarie to Tacking Point,"Main Beach, Forster",2021-12-13T16:26:00Z,2021,12,WHI,TRUE,TRUE,TRUE,NSW-SMART-Shark-Management-Alert-in-Real-Time-Drumlines-Report-July-2021-June-2022.pdf
16/01/2022,14:11,White Shark,280,M,Alive,"ID, A",Port Macquarie  Port Macquarie to Tacking Point,"Main Beach, Forster",2022-01-16T14:11:00Z,2022,1,WHI,TRUE,TRUE,TRUE,NSW-SMART-Shark-Management-Alert-in-Real-Time-Drumlines-Report-July-2021-June-2022.pdf
24/04/2022,13:51,White Shark,238,F,Alive,"ID, A",Port Macquarie  Port Macquarie to Tacking Point,"Main Beach, Forster",2022-04-24T13:51:00Z,2022,4,WHI,TRUE,TRUE,TRUE,NSW-SMART-Shark-Management-Alert-in-Real-Time-Drumlines-Report-July-2021-June-2022.pdf
31/05/2022,13:34,White Shark,NA,NA,Alive,-,Port Macquarie  Port Macquarie to Tacking Point,"Main Beach, Forster",2022-05-31T13:34:00Z,2022,5,WHI,TRUE,FALSE,FALSE,NSW-SMART-Shark-Management-Alert-in-Real-Time-Drumlines-Report-July-2021-June-2022.pdf
02/06/2022,12:15,White Shark,228,M,Alive,"ID, A",Port Macquarie  Port Macquarie to Tacking Point,"Main Beach, Forster",2022-06-02T12:15:00Z,2022,6,WHI,TRUE,TRUE,TRUE,NSW-SMART-Shark-Management-Alert-in-Real-Time-Drumlines-Report-July-2021-June-2022.pdf
07/06/2022,15:07,White Shark,296,F,Alive,"ID, A",Port Macquarie  Port Macquarie to Tacking Point,"Main Beach, Forster",2022-06-07T15:07:00Z,2022,6,WHI,TRUE,TRUE,TRUE,NSW-SMART-Shark-Management-Alert-in-Real-Time-Drumlines-Report-July-2021-June-2022.pdf
20/06/2022,NA,White Shark,248,F,Alive,"ID, A",Port Macquarie  Port Macquarie to Tacking Point,"Main Beach, Forster",NA,2022,6,WHI,TRUE,TRUE,TRUE,NSW-SMART-Shark-Management-Alert-in-Real-Time-Drumlines-Report-July-2021-June-2022.pdf
30/06/2022,11:02,White Shark,259,F,Alive,"ID, A",Port Macquarie  Port Macquarie to Tacking Point,"Main Beach, Forster",2022-06-30T11:02:00Z,2022,6,WHI,TRUE,TRUE,TRUE,NSW-SMART-Shark-Management-Alert-in-Real-Time-Drumlines-Report-July-2021-June-2022.pdf
12/11/2021,13:01,White Shark,260,F,Alive,"ID, A",Port Macquarie  Port Macquarie to Tacking Point,Pebbly Beach,2021-11-12T13:01:00Z,2021,11,WHI,TRUE,TRUE,TRUE,NSW-SMART-Shark-Management-Alert-in-Real-Time-Drumlines-Report-July-2021-June-2022.pdf
17/11/2021,16:14,White Shark,275,F,Alive,"ID, A",Port Macquarie  Port Macquarie to Tacking Point,Pebbly Beach,2021-11-17T16:14:00Z,2021,11,WHI,TRUE,TRUE,TRUE,NSW-SMART-Shark-Management-Alert-in-Real-Time-Drumlines-Report-July-2021-June-2022.pdf
23/11/2021,10:57,White Shark,289,F,Alive,"ID, A",Port Macquarie  Port Macquarie to Tacking Point,Pebbly Beach,2021-11-23T10:57:00Z,2021,11,WHI,TRUE,TRUE,TRUE,NSW-SMART-Shark-Management-Alert-in-Real-Time-Drumlines-Report-July-2021-June-2022.pdf
29/11/2021,8:40,White Shark,295,F,Alive,"ID, A",Port Macquarie  Port Macquarie to Tacking Point,Pebbly Beach,2021-11-29T08:40:00Z,2021,11,WHI,TRUE,TRUE,TRUE,NSW-SMART-Shark-Management-Alert-in-Real-Time-Drumlines-Report-July-2021-June-2022.pdf
08/12/2021,15:50,White Shark,267,F,Alive,"ID, A",Port Macquarie  Port Macquarie to Tacking Point,Pebbly Beach,2021-12-08T15:50:00Z,2021,12,WHI,TRUE,TRUE,TRUE,NSW-SMART-Shark-Management-Alert-in-Real-Time-Drumlines-Report-July-2021-June-2022.pdf
11/12/2021,15:33,Smooth Hammerhead,148,F,Alive,ID,Port Macquarie  Port Macquarie to Tacking Point,Pebbly Beach,2021-12-11T15:33:00Z,2021,12,SMH,FALSE,TRUE,FALSE,NSW-SMART-Shark-Management-Alert-in-Real-Time-Drumlines-Report-July-2021-June-2022.pdf
21/12/2021,11:03,Tiger Shark,178,F,Alive,"ID, A",Port Macquarie  Port Macquarie to Tacking Point,Pebbly Beach,2021-12-21T11:03:00Z,2021,12,TIG,TRUE,TRUE,TRUE,NSW-SMART-Shark-Management-Alert-in-Real-Time-Drumlines-Report-July-2021-June-2022.pdf
22/12/2021,17:53,Tiger Shark,141,M,Alive,"ID, A",Port Macquarie  Port Macquarie to Tacking Point,Pebbly Beach,2021-12-22T17:53:00Z,2021,12,TIG,TRUE,TRUE,TRUE,NSW-SMART-Shark-Management-Alert-in-Real-Time-Drumlines-Report-July-2021-June-2022.pdf
23/12/2021,9:16,White Shark,238,F,Alive,"ID, A",Port Macquarie  Port Macquarie to Tacking Point,Pebbly Beach,2021-12-23T09:16:00Z,2021,12,WHI,TRUE,TRUE,TRUE,NSW-SMART-Shark-Management-Alert-in-Real-Time-Drumlines-Report-July-2021-June-2022.pdf
09/01/2022,7:39,White Shark,247,M,Alive,"ID, A",Port Macquarie  Port Macquarie to Tacking Point,Pebbly Beach,2022-01-09T07:39:00Z,2022,1,WHI,TRUE,TRUE,TRUE,NSW-SMART-Shark-Management-Alert-in-Real-Time-Drumlines-Report-July-2021-June-2022.pdf
26/01/2022,8:07,Tiger Shark,128,F,Alive,"ID, A",Port Macquarie  Port Macquarie to Tacking Point,Pebbly Beach,2022-01-26T08:07:00Z,2022,1,TIG,TRUE,TRUE,TRUE,NSW-SMART-Shark-Management-Alert-in-Real-Time-Drumlines-Report-July-2021-June-2022.pdf
09/02/2022,16:58,Smooth Hammerhead,184,M,Alive,ID,Port Macquarie  Port Macquarie to Tacking Point,Pebbly Beach,2022-02-09T16:58:00Z,2022,2,SMH,FALSE,TRUE,FALSE,NSW-SMART-Shark-Management-Alert-in-Real-Time-Drumlines-Report-July-2021-June-2022.pdf
16/05/2022,12:05,White Shark,276,M,Alive,"ID, A",Port Macquarie  Port Macquarie to Tacking Point,Pebbly Beach,2022-05-16T12:05:00Z,2022,5,WHI,TRUE,TRUE,TRUE,NSW-SMART-Shark-Management-Alert-in-Real-Time-Drumlines-Report-July-2021-June-2022.pdf
17/05/2022,10:33,White Shark,273,M,Alive,"ID, A",Port Macquarie  Port Macquarie to Tacking Point,Pebbly Beach,2022-05-17T10:33:00Z,2022,5,WHI,TRUE,TRUE,TRUE,NSW-SMART-Shark-Management-Alert-in-Real-Time-Drumlines-Report-July-2021-June-2022.pdf
06/06/2022,8:50,White Shark,237,F,Alive,"ID, A",Port Macquarie  Port Macquarie to Tacking Point,Pebbly Beach,2022-06-06T08:50:00Z,2022,6,WHI,TRUE,TRUE,TRUE,NSW-SMART-Shark-Management-Alert-in-Real-Time-Drumlines-Report-July-2021-June-2022.pdf
06/06/2022,10:39,White Shark,230,M,Alive,"ID, A",Port Macquarie  Port Macquarie to Tacking Point,Pebbly Beach,2022-06-06T10:39:00Z,2022,6,WHI,TRUE,TRUE,TRUE,NSW-SMART-Shark-Management-Alert-in-Real-Time-Drumlines-Report-July-2021-June-2022.pdf
17/06/2022,10:22,White Shark,217,F,Alive,"ID, A",Port Macquarie  Port Macquarie to Tacking Point,Pebbly Beach,2022-06-17T10:22:00Z,2022,6,WHI,TRUE,TRUE,TRUE,NSW-SMART-Shark-Management-Alert-in-Real-Time-Drumlines-Report-July-2021-June-2022.pdf
21/06/2022,11:18,White Shark,300,M,Alive,"ID, A",Port Macquarie  Port Macquarie to Tacking Point,Pebbly Beach,2022-06-21T11:18:00Z,2022,6,WHI,TRUE,TRUE,TRUE,NSW-SMART-Shark-Management-Alert-in-Real-Time-Drumlines-Report-July-2021-June-2022.pdf
27/06/2022,10:37,White Shark,231,F,Alive,"ID, A",Port Macquarie  Port Macquarie to Tacking Point,Pebbly Beach,2022-06-27T10:37:00Z,2022,6,WHI,TRUE,TRUE,TRUE,NSW-SMART-Shark-Management-Alert-in-Real-Time-Drumlines-Report-July-2021-June-2022.pdf
30/06/2022,9:44,White Shark,276,F,Alive,"ID, A",Port Macquarie  Port Macquarie to Tacking Point,Pebbly Beach,2022-06-30T09:44:00Z,2022,6,WHI,TRUE,TRUE,TRUE,NSW-SMART-Shark-Management-Alert-in-Real-Time-Drumlines-Report-July-2021-June-2022.pdf
12/11/2021,NA,Tiger Shark,125,F,Alive,"ID, A",Port Macquarie  Port Macquarie to Tacking Point,One Mile Beach,NA,2021,11,TIG,TRUE,TRUE,TRUE,NSW-SMART-Shark-Management-Alert-in-Real-Time-Drumlines-Report-July-2021-June-2022.pdf
20/11/2021,NA,Dusky Whaler,169,F,Alive,ID,Port Macquarie  Port Macquarie to Tacking Point,One Mile Beach,NA,2021,11,DUS,FALSE,TRUE,FALSE,NSW-SMART-Shark-Management-Alert-in-Real-Time-Drumlines-Report-July-2021-June-2022.pdf
23/11/2021,11:47,Shortfin Mako,77,M,Alive,ID,Port Macquarie  Port Macquarie to Tacking Point,One Mile Beach,2021-11-23T11:47:00Z,2021,11,SMA,FALSE,TRUE,FALSE,NSW-SMART-Shark-Management-Alert-in-Real-Time-Drumlines-Report-July-2021-June-2022.pdf
07/12/2021,11:19,Common Blacktip,219,M,Alive,ID,Port Macquarie  Port Macquarie to Tacking Point,One Mile Beach,2021-12-07T11:19:00Z,2021,12,CBT,FALSE,TRUE,FALSE,NSW-SMART-Shark-Management-Alert-in-Real-Time-Drumlines-Report-July-2021-June-2022.pdf
16/12/2021,10:25,Smooth Hammerhead,152,F,Alive,ID,Port Macquarie  Port Macquarie to Tacking Point,One Mile Beach,2021-12-16T10:25:00Z,2021,12,SMH,FALSE,TRUE,FALSE,NSW-SMART-Shark-Management-Alert-in-Real-Time-Drumlines-Report-July-2021-June-2022.pdf
30/12/2021,11:27,White Shark,221,F,Alive,"ID, A",Port Macquarie  Port Macquarie to Tacking Point,One Mile Beach,2021-12-30T11:27:00Z,2021,12,WHI,TRUE,TRUE,TRUE,NSW-SMART-Shark-Management-Alert-in-Real-Time-Drumlines-Report-July-2021-June-2022.pdf
12/01/2022,15:19,Common Blacktip,162,M,Alive,ID,Port Macquarie  Port Macquarie to Tacking Point,One Mile Beach,2022-01-12T15:19:00Z,2022,1,CBT,FALSE,TRUE,FALSE,NSW-SMART-Shark-Management-Alert-in-Real-Time-Drumlines-Report-July-2021-June-2022.pdf
16/01/2022,12:45,White Shark,222,F,Alive,"ID, A",Port Macquarie  Port Macquarie to Tacking Point,One Mile Beach,2022-01-16T12:45:00Z,2022,1,WHI,TRUE,TRUE,TRUE,NSW-SMART-Shark-Management-Alert-in-Real-Time-Drumlines-Report-July-2021-June-2022.pdf
18/01/2022,11:08,White Shark,NA,M,Alive,-,Port Macquarie  Port Macquarie to Tacking Point,One Mile Beach,2022-01-18T11:08:00Z,2022,1,WHI,TRUE,FALSE,FALSE,NSW-SMART-Shark-Management-Alert-in-Real-Time-Drumlines-Report-July-2021-June-2022.pdf
13/02/2022,17:25,White Shark,259,F,Alive,"ID, A",Port Macquarie  Port Macquarie to Tacking Point,One Mile Beach,2022-02-13T17:25:00Z,2022,2,WHI,TRUE,TRUE,TRUE,NSW-SMART-Shark-Management-Alert-in-Real-Time-Drumlines-Report-July-2021-June-2022.pdf
04/04/2022,14:52,White Shark,236,F,Alive,"ID, A",Port Macquarie  Port Macquarie to Tacking Point,One Mile Beach,2022-04-04T14:52:00Z,2022,4,WHI,TRUE,TRUE,TRUE,NSW-SMART-Shark-Management-Alert-in-Real-Time-Drumlines-Report-July-2021-June-2022.pdf
06/06/2022,7:25,White Shark,210,F,Alive,"ID, A",Port Macquarie  Port Macquarie to Tacking Point,One Mile Beach,2022-06-06T07:25:00Z,2022,6,WHI,TRUE,TRUE,TRUE,NSW-SMART-Shark-Management-Alert-in-Real-Time-Drumlines-Report-July-2021-June-2022.pdf
16/06/2022,9:38,White Shark,311,F,Alive,"ID, A",Port Macquarie  Port Macquarie to Tacking Point,One Mile Beach,2022-06-16T09:38:00Z,2022,6,WHI,TRUE,TRUE,TRUE,NSW-SMART-Shark-Management-Alert-in-Real-Time-Drumlines-Report-July-2021-June-2022.pdf
18/06/2022,9:35,White Shark,228,F,Alive,"ID, A",Port Macquarie  Port Macquarie to Tacking Point,One Mile Beach,2022-06-18T09:35:00Z,2022,6,WHI,TRUE,TRUE,TRUE,NSW-SMART-Shark-Management-Alert-in-Real-Time-Drumlines-Report-July-2021-June-2022.pdf
20/11/2021,12:05,Dusky Whaler,144,F,Alive,ID,Port Macquarie  Port Macquarie to Tacking Point,Burgess Beach,2021-11-20T12:05:00Z,2021,11,DUS,FALSE,TRUE,FALSE,NSW-SMART-Shark-Management-Alert-in-Real-Time-Drumlines-Report-July-2021-June-2022.pdf
22/12/2021,8:53,Tiger Shark,166,F,Alive,"ID, A",Port Macquarie  Port Macquarie to Tacking Point,Burgess Beach,2021-12-22T08:53:00Z,2021,12,TIG,TRUE,TRUE,TRUE,NSW-SMART-Shark-Management-Alert-in-Real-Time-Drumlines-Report-July-2021-June-2022.pdf
30/01/2022,11:27,Smooth Hammerhead,177,M,Alive,ID,Port Macquarie  Port Macquarie to Tacking Point,Burgess Beach,2022-01-30T11:27:00Z,2022,1,SMH,FALSE,TRUE,FALSE,NSW-SMART-Shark-Management-Alert-in-Real-Time-Drumlines-Report-July-2021-June-2022.pdf
16/05/2022,11:03,Common Blacktip,236,F,Alive,ID,Port Macquarie  Port Macquarie to Tacking Point,Burgess Beach,2022-05-16T11:03:00Z,2022,5,CBT,FALSE,TRUE,FALSE,NSW-SMART-Shark-Management-Alert-in-Real-Time-Drumlines-Report-July-2021-June-2022.pdf
06/06/2022,8:45,White Shark,265,F,Alive,"ID, A",Port Macquarie  Port Macquarie to Tacking Point,Burgess Beach,2022-06-06T08:45:00Z,2022,6,WHI,TRUE,TRUE,TRUE,NSW-SMART-Shark-Management-Alert-in-Real-Time-Drumlines-Report-July-2021-June-2022.pdf
21/06/2022,12:31,White Shark,296,F,Alive,"ID, A",Port Macquarie  Port Macquarie to Tacking Point,Burgess Beach,2022-06-21T12:31:00Z,2022,6,WHI,TRUE,TRUE,TRUE,NSW-SMART-Shark-Management-Alert-in-Real-Time-Drumlines-Report-July-2021-June-2022.pdf
08/12/2021,9:27,Tiger Shark,187,F,Alive,"ID, A",Port Macquarie  Port Macquarie to Tacking Point,Seven Mile Beach,2021-12-08T09:27:00Z,2021,12,TIG,TRUE,TRUE,TRUE,NSW-SMART-Shark-Management-Alert-in-Real-Time-Drumlines-Report-July-2021-June-2022.pdf
15/12/2021,12:30,Tiger Shark,NA,F,Alive,"ID, A",Port Macquarie  Port Macquarie to Tacking Point,Seven Mile Beach,2021-12-15T12:30:00Z,2021,12,TIG,TRUE,TRUE,TRUE,NSW-SMART-Shark-Management-Alert-in-Real-Time-Drumlines-Report-July-2021-June-2022.pdf
27/05/2022,11:03,Dusky Whaler,310,F,Alive,ID,Port Macquarie  Port Macquarie to Tacking Point,Seven Mile Beach,2022-05-27T11:03:00Z,2022,5,DUS,FALSE,TRUE,FALSE,NSW-SMART-Shark-Management-Alert-in-Real-Time-Drumlines-Report-July-2021-June-2022.pdf
12/06/2022,12:23,Dusky Whaler,290,F,Alive,ID,Port Macquarie  Port Macquarie to Tacking Point,Seven Mile Beach,2022-06-12T12:23:00Z,2022,6,DUS,FALSE,TRUE,FALSE,NSW-SMART-Shark-Management-Alert-in-Real-Time-Drumlines-Report-July-2021-June-2022.pdf
28/03/2022,17:34,Dusky Whaler,87,F,Alive,ID,Newcastle - Stockton to Redhead,Stockton Beach,2022-03-28T17:34:00Z,2022,3,DUS,FALSE,TRUE,FALSE,NSW-SMART-Shark-Management-Alert-in-Real-Time-Drumlines-Report-July-2021-June-2022.pdf
05/06/2022,12:47,White Shark,249,F,Alive,"ID, A",Newcastle - Stockton to Redhead,Stockton Beach,2022-06-05T12:47:00Z,2022,6,WHI,TRUE,TRUE,TRUE,NSW-SMART-Shark-Management-Alert-in-Real-Time-Drumlines-Report-July-2021-June-2022.pdf
15/06/2022,9:05,White Shark,207,M,Alive,"ID, A",Newcastle - Stockton to Redhead,Stockton Beach,2022-06-15T09:05:00Z,2022,6,WHI,TRUE,TRUE,TRUE,NSW-SMART-Shark-Management-Alert-in-Real-Time-Drumlines-Report-July-2021-June-2022.pdf
21/06/2022,9:13,White Shark,202,F,Alive,"ID, A",Newcastle - Stockton to Redhead,Stockton Beach,2022-06-21T09:13:00Z,2022,6,WHI,TRUE,TRUE,TRUE,NSW-SMART-Shark-Management-Alert-in-Real-Time-Drumlines-Report-July-2021-June-2022.pdf
13/05/2022,15:22,White Shark,248,F,Alive,"ID, A",Newcastle - Stockton to Redhead,Newcastle Beach,2022-05-13T15:22:00Z,2022,5,WHI,TRUE,TRUE,TRUE,NSW-SMART-Shark-Management-Alert-in-Real-Time-Drumlines-Report-July-2021-June-2022.pdf
17/06/2022,9:31,White Shark,244,F,Alive,"ID, A",Newcastle - Stockton to Redhead,Newcastle Beach,2022-06-17T09:31:00Z,2022,6,WHI,TRUE,TRUE,TRUE,NSW-SMART-Shark-Management-Alert-in-Real-Time-Drumlines-Report-July-2021-June-2022.pdf
20/06/2022,15:36,White Shark,249,F,Alive,"ID, A",Newcastle - Stockton to Redhead,Newcastle Beach,2022-06-20T15:36:00Z,2022,6,WHI,TRUE,TRUE,TRUE,NSW-SMART-Shark-Management-Alert-in-Real-Time-Drumlines-Report-July-2021-June-2022.pdf
26/06/2022,12:06,Tiger Shark,278,F,Alive,"ID, A",Newcastle - Stockton to Redhead,Newcastle Beach,2022-06-26T12:06:00Z,2022,6,TIG,TRUE,TRUE,TRUE,NSW-SMART-Shark-Management-Alert-in-Real-Time-Drumlines-Report-July-2021-June-2022.pdf
23/04/2022,9:01,Dusky Whaler,130,F,Alive,ID,Newcastle - Stockton to Redhead,Bar Beach,2022-04-23T09:01:00Z,2022,4,DUS,FALSE,TRUE,FALSE,NSW-SMART-Shark-Management-Alert-in-Real-Time-Drumlines-Report-July-2021-June-2022.pdf
15/06/2022,9:17,Bronze Whaler,279,F,Alive,ID,Newcastle - Stockton to Redhead,Bar Beach,2022-06-15T09:17:00Z,2022,6,BRO,FALSE,TRUE,FALSE,NSW-SMART-Shark-Management-Alert-in-Real-Time-Drumlines-Report-July-2021-June-2022.pdf
24/06/2022,9:45,Bronze Whaler,262,F,Alive,ID,Newcastle - Stockton to Redhead,Bar Beach,2022-06-24T09:45:00Z,2022,6,BRO,FALSE,TRUE,FALSE,NSW-SMART-Shark-Management-Alert-in-Real-Time-Drumlines-Report-July-2021-June-2022.pdf
25/06/2022,9:57,White Shark,186,F,Alive,"ID, A",Newcastle - Stockton to Redhead,Bar Beach,2022-06-25T09:57:00Z,2022,6,WHI,TRUE,TRUE,TRUE,NSW-SMART-Shark-Management-Alert-in-Real-Time-Drumlines-Report-July-2021-June-2022.pdf
04/04/2022,10:16,Dusky Whaler,140,F,Alive,ID,Newcastle - Stockton to Redhead,Merewether Beach,2022-04-04T10:16:00Z,2022,4,DUS,FALSE,TRUE,FALSE,NSW-SMART-Shark-Management-Alert-in-Real-Time-Drumlines-Report-July-2021-June-2022.pdf
23/04/2022,NA,Dusky Whaler,124,F,Alive,ID,Newcastle - Stockton to Redhead,Merewether Beach,NA,2022,4,DUS,FALSE,TRUE,FALSE,NSW-SMART-Shark-Management-Alert-in-Real-Time-Drumlines-Report-July-2021-June-2022.pdf
02/06/2022,11:09,Dusky Whaler,261,M,Alive,ID,Newcastle - Stockton to Redhead,Merewether Beach,2022-06-02T11:09:00Z,2022,6,DUS,FALSE,TRUE,FALSE,NSW-SMART-Shark-Management-Alert-in-Real-Time-Drumlines-Report-July-2021-June-2022.pdf
20/06/2022,13:24,Bronze Whaler,297,F,Alive,ID,Newcastle - Stockton to Redhead,Glenrock Reserve,2022-06-20T13:24:00Z,2022,6,BRO,FALSE,TRUE,FALSE,NSW-SMART-Shark-Management-Alert-in-Real-Time-Drumlines-Report-July-2021-June-2022.pdf
21/06/2022,9:28,White Shark,223,F,Alive,"ID, A",Newcastle - Stockton to Redhead,Glenrock Reserve,2022-06-21T09:28:00Z,2022,6,WHI,TRUE,TRUE,TRUE,NSW-SMART-Shark-Management-Alert-in-Real-Time-Drumlines-Report-July-2021-June-2022.pdf
03/06/2022,12:01,Dusky Whaler,178.5,M,Alive,ID,Newcastle - Stockton to Redhead,Redhead Beach,2022-06-03T12:01:00Z,2022,6,DUS,FALSE,TRUE,FALSE,NSW-SMART-Shark-Management-Alert-in-Real-Time-Drumlines-Report-July-2021-June-2022.pdf
16/06/2022,9:50,Bronze Whaler,304,F,Alive,ID,Newcastle - Stockton to Redhead,Redhead Beach,2022-06-16T09:50:00Z,2022,6,BRO,FALSE,TRUE,FALSE,NSW-SMART-Shark-Management-Alert-in-Real-Time-Drumlines-Report-July-2021-June-2022.pdf
24/06/2022,8:51,Bronze Whaler,271,F,Alive,ID,Newcastle - Stockton to Redhead,Redhead Beach,2022-06-24T08:51:00Z,2022,6,BRO,FALSE,TRUE,FALSE,NSW-SMART-Shark-Management-Alert-in-Real-Time-Drumlines-Report-July-2021-June-2022.pdf
18/03/2022,13:36,Dusky Whaler,189,M,Alive,ID,Lake Macquarie -Blacksmiths to Frazer Park,Frazer Beach,2022-03-18T13:36:00Z,2022,3,DUS,FALSE,TRUE,FALSE,NSW-SMART-Shark-Management-Alert-in-Real-Time-Drumlines-Report-July-2021-June-2022.pdf
15/04/2022,11:43,Dusky Whaler,156,F,Alive,ID,Lake Macquarie -Blacksmiths to Frazer Park,Frazer Beach,2022-04-15T11:43:00Z,2022,4,DUS,FALSE,TRUE,FALSE,NSW-SMART-Shark-Management-Alert-in-Real-Time-Drumlines-Report-July-2021-June-2022.pdf
15/04/2022,12:31,Dusky Whaler,137,F,Alive,ID,Lake Macquarie -Blacksmiths to Frazer Park,Frazer Beach,2022-04-15T12:31:00Z,2022,4,DUS,FALSE,TRUE,FALSE,NSW-SMART-Shark-Management-Alert-in-Real-Time-Drumlines-Report-July-2021-June-2022.pdf
02/05/2022,11:31,Dusky Whaler,176,M,Alive,ID,Lake Macquarie -Blacksmiths to Frazer Park,Frazer Beach,2022-05-02T11:31:00Z,2022,5,DUS,FALSE,TRUE,FALSE,NSW-SMART-Shark-Management-Alert-in-Real-Time-Drumlines-Report-July-2021-June-2022.pdf
08/05/2022,8:02,White Shark,285,F,Alive,"ID, A",Lake Macquarie -Blacksmiths to Frazer Park,Frazer Beach,2022-05-08T08:02:00Z,2022,5,WHI,TRUE,TRUE,TRUE,NSW-SMART-Shark-Management-Alert-in-Real-Time-Drumlines-Report-July-2021-June-2022.pdf
09/05/2022,8:47,Dusky Whaler,139,F,Alive,ID,Lake Macquarie -Blacksmiths to Frazer Park,Frazer Beach,2022-05-09T08:47:00Z,2022,5,DUS,FALSE,TRUE,FALSE,NSW-SMART-Shark-Management-Alert-in-Real-Time-Drumlines-Report-July-2021-June-2022.pdf
17/05/2022,NA,Dusky Whaler,134,M,Alive,ID,Lake Macquarie -Blacksmiths to Frazer Park,Frazer Beach,NA,2022,5,DUS,FALSE,TRUE,FALSE,NSW-SMART-Shark-Management-Alert-in-Real-Time-Drumlines-Report-July-2021-June-2022.pdf
18/05/2022,8:28,Dusky Whaler,134,F,Alive,ID,Lake Macquarie -Blacksmiths to Frazer Park,Frazer Beach,2022-05-18T08:28:00Z,2022,5,DUS,FALSE,TRUE,FALSE,NSW-SMART-Shark-Management-Alert-in-Real-Time-Drumlines-Report-July-2021-June-2022.pdf
20/05/2022,11:00,Dusky Whaler,135,F,Alive,ID,Lake Macquarie -Blacksmiths to Frazer Park,Frazer Beach,2022-05-20T11:00:00Z,2022,5,DUS,FALSE,TRUE,FALSE,NSW-SMART-Shark-Management-Alert-in-Real-Time-Drumlines-Report-July-2021-June-2022.pdf
25/05/2022,9:37,Dusky Whaler,145,F,Alive,ID,Lake Macquarie -Blacksmiths to Frazer Park,Frazer Beach,2022-05-25T09:37:00Z,2022,5,DUS,FALSE,TRUE,FALSE,NSW-SMART-Shark-Management-Alert-in-Real-Time-Drumlines-Report-July-2021-June-2022.pdf
30/05/2022,9:08,Dusky Whaler,194,F,Alive,ID,Lake Macquarie -Blacksmiths to Frazer Park,Frazer Beach,2022-05-30T09:08:00Z,2022,5,DUS,FALSE,TRUE,FALSE,NSW-SMART-Shark-Management-Alert-in-Real-Time-Drumlines-Report-July-2021-June-2022.pdf
16/06/2022,10:24,Dusky Whaler,149,F,Alive,ID,Lake Macquarie -Blacksmiths to Frazer Park,Frazer Beach,2022-06-16T10:24:00Z,2022,6,DUS,FALSE,TRUE,FALSE,NSW-SMART-Shark-Management-Alert-in-Real-Time-Drumlines-Report-July-2021-June-2022.pdf
28/03/2022,15:52,Dusky Whaler,175,F,Alive,ID,Lake Macquarie -Blacksmiths to Frazer Park,Ghosties Beach,2022-03-28T15:52:00Z,2022,3,DUS,FALSE,TRUE,FALSE,NSW-SMART-Shark-Management-Alert-in-Real-Time-Drumlines-Report-July-2021-June-2022.pdf
19/04/2022,11:38,Dusky Whaler,143,M,Alive,ID,Lake Macquarie -Blacksmiths to Frazer Park,Ghosties Beach,2022-04-19T11:38:00Z,2022,4,DUS,FALSE,TRUE,FALSE,NSW-SMART-Shark-Management-Alert-in-Real-Time-Drumlines-Report-July-2021-June-2022.pdf
01/05/2022,NA,Dusky Whaler,122,M,Alive,ID,Lake Macquarie -Blacksmiths to Frazer Park,Ghosties Beach,NA,2022,5,DUS,FALSE,TRUE,FALSE,NSW-SMART-Shark-Management-Alert-in-Real-Time-Drumlines-Report-July-2021-June-2022.pdf
02/05/2022,10:46,Dusky Whaler,150,F,Alive,ID,Lake Macquarie -Blacksmiths to Frazer Park,Ghosties Beach,2022-05-02T10:46:00Z,2022,5,DUS,FALSE,TRUE,FALSE,NSW-SMART-Shark-Management-Alert-in-Real-Time-Drumlines-Report-July-2021-June-2022.pdf
06/05/2022,7:33,Dusky Whaler,127,F,Alive,ID,Lake Macquarie -Blacksmiths to Frazer Park,Ghosties Beach,2022-05-06T07:33:00Z,2022,5,DUS,FALSE,TRUE,FALSE,NSW-SMART-Shark-Management-Alert-in-Real-Time-Drumlines-Report-July-2021-June-2022.pdf
25/05/2022,11:51,Dusky Whaler,140,M,Alive,ID,Lake Macquarie -Blacksmiths to Frazer Park,Ghosties Beach,2022-05-25T11:51:00Z,2022,5,DUS,FALSE,TRUE,FALSE,NSW-SMART-Shark-Management-Alert-in-Real-Time-Drumlines-Report-July-2021-June-2022.pdf
30/06/2022,13:00,Bronze Whaler,289,F,Alive,ID,Lake Macquarie -Blacksmiths to Frazer Park,Ghosties Beach,2022-06-30T13:00:00Z,2022,6,BRO,FALSE,TRUE,FALSE,NSW-SMART-Shark-Management-Alert-in-Real-Time-Drumlines-Report-July-2021-June-2022.pdf
29/05/2022,7:58,Smooth Hammerhead,146,F,Alive,ID,Lake Macquarie -Blacksmiths to Frazer Park,Moonee Beach,2022-05-29T07:58:00Z,2022,5,SMH,FALSE,TRUE,FALSE,NSW-SMART-Shark-Management-Alert-in-Real-Time-Drumlines-Report-July-2021-June-2022.pdf
14/04/2022,11:30,Dusky Whaler,NA,NA,Alive,-,Lake Macquarie -Blacksmiths to Frazer Park,Middle Camp Beach,2022-04-14T11:30:00Z,2022,4,DUS,FALSE,FALSE,FALSE,NSW-SMART-Shark-Management-Alert-in-Real-Time-Drumlines-Report-July-2021-June-2022.pdf
13/03/2022,14:36,Dusky Whaler,128,M,Alive,ID,Lake Macquarie -Blacksmiths to Frazer Park,Caves Beach,2022-03-13T14:36:00Z,2022,3,DUS,FALSE,TRUE,FALSE,NSW-SMART-Shark-Management-Alert-in-Real-Time-Drumlines-Report-July-2021-June-2022.pdf
28/03/2022,9:19,Dusky Whaler,162,M,Alive,ID,Lake Macquarie -Blacksmiths to Frazer Park,Caves Beach,2022-03-28T09:19:00Z,2022,3,DUS,FALSE,TRUE,FALSE,NSW-SMART-Shark-Management-Alert-in-Real-Time-Drumlines-Report-July-2021-June-2022.pdf
19/04/2022,NA,Dusky Whaler,98,M,Alive,ID,Lake Macquarie -Blacksmiths to Frazer Park,Caves Beach,NA,2022,4,DUS,FALSE,TRUE,FALSE,NSW-SMART-Shark-Management-Alert-in-Real-Time-Drumlines-Report-July-2021-June-2022.pdf
02/05/2022,NA,Dusky Whaler,140,F,Alive,ID,Lake Macquarie -Blacksmiths to Frazer Park,Caves Beach,NA,2022,5,DUS,FALSE,TRUE,FALSE,NSW-SMART-Shark-Management-Alert-in-Real-Time-Drumlines-Report-July-2021-June-2022.pdf
03/05/2022,9:49,Dusky Whaler,160,F,Alive,ID,Lake Macquarie -Blacksmiths to Frazer Park,Caves Beach,2022-05-03T09:49:00Z,2022,5,DUS,FALSE,TRUE,FALSE,NSW-SMART-Shark-Management-Alert-in-Real-Time-Drumlines-Report-July-2021-June-2022.pdf
05/05/2022,9:19,Dusky Whaler,148,F,Alive,ID,Lake Macquarie -Blacksmiths to Frazer Park,Caves Beach,2022-05-05T09:19:00Z,2022,5,DUS,FALSE,TRUE,FALSE,NSW-SMART-Shark-Management-Alert-in-Real-Time-Drumlines-Report-July-2021-June-2022.pdf
15/05/2022,9:34,Dusky Whaler,159,F,Alive,ID,Lake Macquarie -Blacksmiths to Frazer Park,Caves Beach,2022-05-15T09:34:00Z,2022,5,DUS,FALSE,TRUE,FALSE,NSW-SMART-Shark-Management-Alert-in-Real-Time-Drumlines-Report-July-2021-June-2022.pdf
20/05/2022,12:31,Dusky Whaler,142,F,Alive,ID,Lake Macquarie -Blacksmiths to Frazer Park,Caves Beach,2022-05-20T12:31:00Z,2022,5,DUS,FALSE,TRUE,FALSE,NSW-SMART-Shark-Management-Alert-in-Real-Time-Drumlines-Report-July-2021-June-2022.pdf
23/05/2022,7:34,Smooth Hammerhead,145,M,Alive,ID,Lake Macquarie -Blacksmiths to Frazer Park,Caves Beach,2022-05-23T07:34:00Z,2022,5,SMH,FALSE,TRUE,FALSE,NSW-SMART-Shark-Management-Alert-in-Real-Time-Drumlines-Report-July-2021-June-2022.pdf
26/05/2022,8:55,Dusky Whaler,166,M,Alive,ID,Lake Macquarie -Blacksmiths to Frazer Park,Caves Beach,2022-05-26T08:55:00Z,2022,5,DUS,FALSE,TRUE,FALSE,NSW-SMART-Shark-Management-Alert-in-Real-Time-Drumlines-Report-July-2021-June-2022.pdf
26/05/2022,NA,Dusky Whaler,137,F,Dead,-,Lake Macquarie -Blacksmiths to Frazer Park,Caves Beach,NA,2022,5,DUS,FALSE,FALSE,FALSE,NSW-SMART-Shark-Management-Alert-in-Real-Time-Drumlines-Report-July-2021-June-2022.pdf
05/06/2022,8:47,Bronze Whaler,255,F,Alive,ID,Lake Macquarie -Blacksmiths to Frazer Park,Caves Beach,2022-06-05T08:47:00Z,2022,6,BRO,FALSE,TRUE,FALSE,NSW-SMART-Shark-Management-Alert-in-Real-Time-Drumlines-Report-July-2021-June-2022.pdf
17/06/2022,14:00,Bronze Whaler,287,M,Alive,ID,Lake Macquarie -Blacksmiths to Frazer Park,Caves Beach,2022-06-17T14:00:00Z,2022,6,BRO,FALSE,TRUE,FALSE,NSW-SMART-Shark-Management-Alert-in-Real-Time-Drumlines-Report-July-2021-June-2022.pdf
28/03/2022,12:20,Dusky Whaler,116,F,Alive,ID,Lake Macquarie -Blacksmiths to Frazer Park,Hams Beach,2022-03-28T12:20:00Z,2022,3,DUS,FALSE,TRUE,FALSE,NSW-SMART-Shark-Management-Alert-in-Real-Time-Drumlines-Report-July-2021-June-2022.pdf
21/04/2022,13:31,Dusky Whaler,124,F,Alive,ID,Lake Macquarie -Blacksmiths to Frazer Park,Hams Beach,2022-04-21T13:31:00Z,2022,4,DUS,FALSE,TRUE,FALSE,NSW-SMART-Shark-Management-Alert-in-Real-Time-Drumlines-Report-July-2021-June-2022.pdf
02/05/2022,NA,Dusky Whaler,97,M,Alive,ID,Lake Macquarie -Blacksmiths to Frazer Park,Hams Beach,NA,2022,5,DUS,FALSE,TRUE,FALSE,NSW-SMART-Shark-Management-Alert-in-Real-Time-Drumlines-Report-July-2021-June-2022.pdf
22/05/2022,NA,Dusky Whaler,102,M,Alive,ID,Lake Macquarie -Blacksmiths to Frazer Park,Blacksmiths Beach,NA,2022,5,DUS,FALSE,TRUE,FALSE,NSW-SMART-Shark-Management-Alert-in-Real-Time-Drumlines-Report-July-2021-June-2022.pdf
02/06/2022,7:23,White Shark,189,M,Alive,"ID, A",Lake Macquarie -Blacksmiths to Frazer Park,Blacksmiths Beach,2022-06-02T07:23:00Z,2022,6,WHI,TRUE,TRUE,TRUE,NSW-SMART-Shark-Management-Alert-in-Real-Time-Drumlines-Report-July-2021-June-2022.pdf
21/06/2022,8:15,White Shark,212,M,Alive,"ID, A",Lake Macquarie -Blacksmiths to Frazer Park,Blacksmiths Beach,2022-06-21T08:15:00Z,2022,6,WHI,TRUE,TRUE,TRUE,NSW-SMART-Shark-Management-Alert-in-Real-Time-Drumlines-Report-July-2021-June-2022.pdf
21/06/2022,14:10,White Shark,228,M,Alive,"ID, A",Lake Macquarie -Blacksmiths to Frazer Park,Blacksmiths Beach,2022-06-21T14:10:00Z,2022,6,WHI,TRUE,TRUE,TRUE,NSW-SMART-Shark-Management-Alert-in-Real-Time-Drumlines-Report-July-2021-June-2022.pdf
17/05/2022,7:24,Dusky Whaler,194,F,Alive,ID,Central Coast North,Crackneck Point,2022-05-17T07:24:00Z,2022,5,DUS,FALSE,TRUE,FALSE,NSW-SMART-Shark-Management-Alert-in-Real-Time-Drumlines-Report-July-2021-June-2022.pdf
24/05/2022,15:30,Dusky Whaler,208,F,Alive,ID,Central Coast North,Crackneck Point,2022-05-24T15:30:00Z,2022,5,DUS,FALSE,TRUE,FALSE,NSW-SMART-Shark-Management-Alert-in-Real-Time-Drumlines-Report-July-2021-June-2022.pdf
26/05/2022,7:34,Dusky Whaler,212,F,Alive,ID,Central Coast North,Crackneck Point,2022-05-26T07:34:00Z,2022,5,DUS,FALSE,TRUE,FALSE,NSW-SMART-Shark-Management-Alert-in-Real-Time-Drumlines-Report-July-2021-June-2022.pdf
30/05/2022,10:48,Dusky Whaler,144,M,Alive,ID,Central Coast North,Crackneck Point,2022-05-30T10:48:00Z,2022,5,DUS,FALSE,TRUE,FALSE,NSW-SMART-Shark-Management-Alert-in-Real-Time-Drumlines-Report-July-2021-June-2022.pdf
04/06/2022,12:59,Dusky Whaler,120,F,Alive,ID,Central Coast North,Crackneck Point,2022-06-04T12:59:00Z,2022,6,DUS,FALSE,TRUE,FALSE,NSW-SMART-Shark-Management-Alert-in-Real-Time-Drumlines-Report-July-2021-June-2022.pdf
14/06/2022,9:23,Bronze Whaler,NA,NA,Alive,-,Central Coast North,Crackneck Point,2022-06-14T09:23:00Z,2022,6,BRO,FALSE,FALSE,FALSE,NSW-SMART-Shark-Management-Alert-in-Real-Time-Drumlines-Report-July-2021-June-2022.pdf
14/06/2022,11:35,Bronze Whaler,213,F,Alive,ID,Central Coast North,Crackneck Point,2022-06-14T11:35:00Z,2022,6,BRO,FALSE,TRUE,FALSE,NSW-SMART-Shark-Management-Alert-in-Real-Time-Drumlines-Report-July-2021-June-2022.pdf
15/06/2022,7:51,Dusky Whaler,155,M,Alive,ID,Central Coast North,Crackneck Point,2022-06-15T07:51:00Z,2022,6,DUS,FALSE,TRUE,FALSE,NSW-SMART-Shark-Management-Alert-in-Real-Time-Drumlines-Report-July-2021-June-2022.pdf
17/05/2022,13:55,Dusky Whaler,187,F,Alive,ID,Central Coast North,Bateau Bay Beach,2022-05-17T13:55:00Z,2022,5,DUS,FALSE,TRUE,FALSE,NSW-SMART-Shark-Management-Alert-in-Real-Time-Drumlines-Report-July-2021-June-2022.pdf
18/05/2022,9:45,Dusky Whaler,192,M,Alive,ID,Central Coast North,Bateau Bay Beach,2022-05-18T09:45:00Z,2022,5,DUS,FALSE,TRUE,FALSE,NSW-SMART-Shark-Management-Alert-in-Real-Time-Drumlines-Report-July-2021-June-2022.pdf
23/05/2022,9:01,Dusky Whaler,213,M,Alive,ID,Central Coast North,Bateau Bay Beach,2022-05-23T09:01:00Z,2022,5,DUS,FALSE,TRUE,FALSE,NSW-SMART-Shark-Management-Alert-in-Real-Time-Drumlines-Report-July-2021-June-2022.pdf
23/05/2022,11:26,Dusky Whaler,180,F,Alive,ID,Central Coast North,Bateau Bay Beach,2022-05-23T11:26:00Z,2022,5,DUS,FALSE,TRUE,FALSE,NSW-SMART-Shark-Management-Alert-in-Real-Time-Drumlines-Report-July-2021-June-2022.pdf
25/05/2022,11:18,Dusky Whaler,172,M,Alive,ID,Central Coast North,Bateau Bay Beach,2022-05-25T11:18:00Z,2022,5,DUS,FALSE,TRUE,FALSE,NSW-SMART-Shark-Management-Alert-in-Real-Time-Drumlines-Report-July-2021-June-2022.pdf
27/05/2022,14:46,Dusky Whaler,181,M,Alive,ID,Central Coast North,Bateau Bay Beach,2022-05-27T14:46:00Z,2022,5,DUS,FALSE,TRUE,FALSE,NSW-SMART-Shark-Management-Alert-in-Real-Time-Drumlines-Report-July-2021-June-2022.pdf
02/06/2022,7:51,Bronze Whaler,294,F,Alive,ID,Central Coast North,Bateau Bay Beach,2022-06-02T07:51:00Z,2022,6,BRO,FALSE,TRUE,FALSE,NSW-SMART-Shark-Management-Alert-in-Real-Time-Drumlines-Report-July-2021-June-2022.pdf
07/06/2022,12:23,Bronze Whaler,264,F,Alive,ID,Central Coast North,Bateau Bay Beach,2022-06-07T12:23:00Z,2022,6,BRO,FALSE,TRUE,FALSE,NSW-SMART-Shark-Management-Alert-in-Real-Time-Drumlines-Report-July-2021-June-2022.pdf
17/06/2022,11:07,Bronze Whaler,280,F,Alive,ID,Central Coast North,Bateau Bay Beach,2022-06-17T11:07:00Z,2022,6,BRO,FALSE,TRUE,FALSE,NSW-SMART-Shark-Management-Alert-in-Real-Time-Drumlines-Report-July-2021-June-2022.pdf
16/05/2022,NA,Dusky Whaler,NA,NA,Dead,-,Central Coast North,Shelly Beach,NA,2022,5,DUS,FALSE,FALSE,FALSE,NSW-SMART-Shark-Management-Alert-in-Real-Time-Drumlines-Report-July-2021-June-2022.pdf
17/05/2022,13:40,Dusky Whaler,187,F,Alive,ID,Central Coast North,Shelly Beach,2022-05-17T13:40:00Z,2022,5,DUS,FALSE,TRUE,FALSE,NSW-SMART-Shark-Management-Alert-in-Real-Time-Drumlines-Report-July-2021-June-2022.pdf
18/05/2022,11:10,Dusky Whaler,146,F,Alive,ID,Central Coast North,Shelly Beach,2022-05-18T11:10:00Z,2022,5,DUS,FALSE,TRUE,FALSE,NSW-SMART-Shark-Management-Alert-in-Real-Time-Drumlines-Report-July-2021-June-2022.pdf
18/05/2022,12:28,Dusky Whaler,141,M,Alive,ID,Central Coast North,Shelly Beach,2022-05-18T12:28:00Z,2022,5,DUS,FALSE,TRUE,FALSE,NSW-SMART-Shark-Management-Alert-in-Real-Time-Drumlines-Report-July-2021-June-2022.pdf
18/05/2022,14:15,Dusky Whaler,162,F,Alive,ID,Central Coast North,Shelly Beach,2022-05-18T14:15:00Z,2022,5,DUS,FALSE,TRUE,FALSE,NSW-SMART-Shark-Management-Alert-in-Real-Time-Drumlines-Report-July-2021-June-2022.pdf
21/05/2022,12:54,Dusky Whaler,180,M,Alive,ID,Central Coast North,Shelly Beach,2022-05-21T12:54:00Z,2022,5,DUS,FALSE,TRUE,FALSE,NSW-SMART-Shark-Management-Alert-in-Real-Time-Drumlines-Report-July-2021-June-2022.pdf
23/05/2022,13:43,Dusky Whaler,173,F,Alive,ID,Central Coast North,Shelly Beach,2022-05-23T13:43:00Z,2022,5,DUS,FALSE,TRUE,FALSE,NSW-SMART-Shark-Management-Alert-in-Real-Time-Drumlines-Report-July-2021-June-2022.pdf
25/05/2022,8:39,Dusky Whaler,213,F,Alive,ID,Central Coast North,Shelly Beach,2022-05-25T08:39:00Z,2022,5,DUS,FALSE,TRUE,FALSE,NSW-SMART-Shark-Management-Alert-in-Real-Time-Drumlines-Report-July-2021-June-2022.pdf
25/05/2022,10:26,Dusky Whaler,204,M,Alive,ID,Central Coast North,Shelly Beach,2022-05-25T10:26:00Z,2022,5,DUS,FALSE,TRUE,FALSE,NSW-SMART-Shark-Management-Alert-in-Real-Time-Drumlines-Report-July-2021-June-2022.pdf
26/05/2022,10:52,Dusky Whaler,203,F,Alive,ID,Central Coast North,Shelly Beach,2022-05-26T10:52:00Z,2022,5,DUS,FALSE,TRUE,FALSE,NSW-SMART-Shark-Management-Alert-in-Real-Time-Drumlines-Report-July-2021-June-2022.pdf
28/05/2022,7:38,Dusky Whaler,173,F,Alive,ID,Central Coast North,Shelly Beach,2022-05-28T07:38:00Z,2022,5,DUS,FALSE,TRUE,FALSE,NSW-SMART-Shark-Management-Alert-in-Real-Time-Drumlines-Report-July-2021-June-2022.pdf
04/06/2022,13:37,Bronze Whaler,230,F,Alive,ID,Central Coast North,Shelly Beach,2022-06-04T13:37:00Z,2022,6,BRO,FALSE,TRUE,FALSE,NSW-SMART-Shark-Management-Alert-in-Real-Time-Drumlines-Report-July-2021-June-2022.pdf
06/06/2022,8:54,Dusky Whaler,159,F,Alive,ID,Central Coast North,Shelly Beach,2022-06-06T08:54:00Z,2022,6,DUS,FALSE,TRUE,FALSE,NSW-SMART-Shark-Management-Alert-in-Real-Time-Drumlines-Report-July-2021-June-2022.pdf
14/06/2022,9:48,Dusky Whaler,198,F,Alive,ID,Central Coast North,Shelly Beach,2022-06-14T09:48:00Z,2022,6,DUS,FALSE,TRUE,FALSE,NSW-SMART-Shark-Management-Alert-in-Real-Time-Drumlines-Report-July-2021-June-2022.pdf
15/06/2022,12:41,Dusky Whaler,199,F,Alive,ID,Central Coast North,Shelly Beach,2022-06-15T12:41:00Z,2022,6,DUS,FALSE,TRUE,FALSE,NSW-SMART-Shark-Management-Alert-in-Real-Time-Drumlines-Report-July-2021-June-2022.pdf
16/06/2022,8:33,Bronze Whaler,249,F,Alive,ID,Central Coast North,Shelly Beach,2022-06-16T08:33:00Z,2022,6,BRO,FALSE,TRUE,FALSE,NSW-SMART-Shark-Management-Alert-in-Real-Time-Drumlines-Report-July-2021-June-2022.pdf
16/06/2022,NA,Dusky Whaler,115,M,Alive,ID,Central Coast North,Shelly Beach,NA,2022,6,DUS,FALSE,TRUE,FALSE,NSW-SMART-Shark-Management-Alert-in-Real-Time-Drumlines-Report-July-2021-June-2022.pdf
23/06/2022,7:30,Bronze Whaler,202,F,Alive,ID,Central Coast North,Shelly Beach,2022-06-23T07:30:00Z,2022,6,BRO,FALSE,TRUE,FALSE,NSW-SMART-Shark-Management-Alert-in-Real-Time-Drumlines-Report-July-2021-June-2022.pdf
25/05/2022,9:28,Dusky Whaler,199,F,Alive,ID,Central Coast North,Toowoon Bay,2022-05-25T09:28:00Z,2022,5,DUS,FALSE,TRUE,FALSE,NSW-SMART-Shark-Management-Alert-in-Real-Time-Drumlines-Report-July-2021-June-2022.pdf
26/05/2022,7:53,Dusky Whaler,205,F,Alive,ID,Central Coast North,Toowoon Bay,2022-05-26T07:53:00Z,2022,5,DUS,FALSE,TRUE,FALSE,NSW-SMART-Shark-Management-Alert-in-Real-Time-Drumlines-Report-July-2021-June-2022.pdf
02/06/2022,8:10,Bronze Whaler,237,F,Alive,ID,Central Coast North,Toowoon Bay,2022-06-02T08:10:00Z,2022,6,BRO,FALSE,TRUE,FALSE,NSW-SMART-Shark-Management-Alert-in-Real-Time-Drumlines-Report-July-2021-June-2022.pdf
03/06/2022,12:40,Bronze Whaler,243,F,Alive,ID,Central Coast North,Toowoon Bay,2022-06-03T12:40:00Z,2022,6,BRO,FALSE,TRUE,FALSE,NSW-SMART-Shark-Management-Alert-in-Real-Time-Drumlines-Report-July-2021-June-2022.pdf
09/06/2022,7:55,Dusky Whaler,166,F,Alive,ID,Central Coast North,Toowoon Bay,2022-06-09T07:55:00Z,2022,6,DUS,FALSE,TRUE,FALSE,NSW-SMART-Shark-Management-Alert-in-Real-Time-Drumlines-Report-July-2021-June-2022.pdf
11/06/2022,12:21,Bronze Whaler,195,F,Alive,ID,Central Coast North,Toowoon Bay,2022-06-11T12:21:00Z,2022,6,BRO,FALSE,TRUE,FALSE,NSW-SMART-Shark-Management-Alert-in-Real-Time-Drumlines-Report-July-2021-June-2022.pdf
16/06/2022,9:19,Bronze Whaler,288,F,Alive,ID,Central Coast North,Toowoon Bay,2022-06-16T09:19:00Z,2022,6,BRO,FALSE,TRUE,FALSE,NSW-SMART-Shark-Management-Alert-in-Real-Time-Drumlines-Report-July-2021-June-2022.pdf
29/06/2022,9:20,Bronze Whaler,292,F,Alive,ID,Central Coast North,Toowoon Bay,2022-06-29T09:20:00Z,2022,6,BRO,FALSE,TRUE,FALSE,NSW-SMART-Shark-Management-Alert-in-Real-Time-Drumlines-Report-July-2021-June-2022.pdf
15/05/2022,11:50,Dusky Whaler,142,M,Alive,ID,Central Coast North,The Entrance Beach,2022-05-15T11:50:00Z,2022,5,DUS,FALSE,TRUE,FALSE,NSW-SMART-Shark-Management-Alert-in-Real-Time-Drumlines-Report-July-2021-June-2022.pdf
15/05/2022,13:06,Dusky Whaler,174,M,Alive,ID,Central Coast North,The Entrance Beach,2022-05-15T13:06:00Z,2022,5,DUS,FALSE,TRUE,FALSE,NSW-SMART-Shark-Management-Alert-in-Real-Time-Drumlines-Report-July-2021-June-2022.pdf
15/05/2022,15:10,Dusky Whaler,141,F,Alive,ID,Central Coast North,The Entrance Beach,2022-05-15T15:10:00Z,2022,5,DUS,FALSE,TRUE,FALSE,NSW-SMART-Shark-Management-Alert-in-Real-Time-Drumlines-Report-July-2021-June-2022.pdf
16/05/2022,11:08,Dusky Whaler,183,F,Alive,ID,Central Coast North,The Entrance Beach,2022-05-16T11:08:00Z,2022,5,DUS,FALSE,TRUE,FALSE,NSW-SMART-Shark-Management-Alert-in-Real-Time-Drumlines-Report-July-2021-June-2022.pdf
16/05/2022,14:32,Dusky Whaler,174,F,Alive,ID,Central Coast North,The Entrance Beach,2022-05-16T14:32:00Z,2022,5,DUS,FALSE,TRUE,FALSE,NSW-SMART-Shark-Management-Alert-in-Real-Time-Drumlines-Report-July-2021-June-2022.pdf
18/05/2022,14:36,Dusky Whaler,193,F,Alive,ID,Central Coast North,The Entrance Beach,2022-05-18T14:36:00Z,2022,5,DUS,FALSE,TRUE,FALSE,NSW-SMART-Shark-Management-Alert-in-Real-Time-Drumlines-Report-July-2021-June-2022.pdf
20/05/2022,11:48,Dusky Whaler,180,F,Alive,ID,Central Coast North,The Entrance Beach,2022-05-20T11:48:00Z,2022,5,DUS,FALSE,TRUE,FALSE,NSW-SMART-Shark-Management-Alert-in-Real-Time-Drumlines-Report-July-2021-June-2022.pdf
21/05/2022,11:35,Dusky Whaler,202,M,Alive,ID,Central Coast North,The Entrance Beach,2022-05-21T11:35:00Z,2022,5,DUS,FALSE,TRUE,FALSE,NSW-SMART-Shark-Management-Alert-in-Real-Time-Drumlines-Report-July-2021-June-2022.pdf
22/05/2022,9:30,Dusky Whaler,152,F,Alive,ID,Central Coast North,The Entrance Beach,2022-05-22T09:30:00Z,2022,5,DUS,FALSE,TRUE,FALSE,NSW-SMART-Shark-Management-Alert-in-Real-Time-Drumlines-Report-July-2021-June-2022.pdf
24/05/2022,9:02,Dusky Whaler,163,F,Alive,ID,Central Coast North,The Entrance Beach,2022-05-24T09:02:00Z,2022,5,DUS,FALSE,TRUE,FALSE,NSW-SMART-Shark-Management-Alert-in-Real-Time-Drumlines-Report-July-2021-June-2022.pdf
24/05/2022,9:15,Dusky Whaler,173,F,Alive,ID,Central Coast North,The Entrance Beach,2022-05-24T09:15:00Z,2022,5,DUS,FALSE,TRUE,FALSE,NSW-SMART-Shark-Management-Alert-in-Real-Time-Drumlines-Report-July-2021-June-2022.pdf
25/05/2022,9:06,Dusky Whaler,191,F,Alive,ID,Central Coast North,The Entrance Beach,2022-05-25T09:06:00Z,2022,5,DUS,FALSE,TRUE,FALSE,NSW-SMART-Shark-Management-Alert-in-Real-Time-Drumlines-Report-July-2021-June-2022.pdf
25/05/2022,11:42,Dusky Whaler,172,F,Alive,ID,Central Coast North,The Entrance Beach,2022-05-25T11:42:00Z,2022,5,DUS,FALSE,TRUE,FALSE,NSW-SMART-Shark-Management-Alert-in-Real-Time-Drumlines-Report-July-2021-June-2022.pdf
26/05/2022,9:04,Dusky Whaler,184,F,Alive,ID,Central Coast North,The Entrance Beach,2022-05-26T09:04:00Z,2022,5,DUS,FALSE,TRUE,FALSE,NSW-SMART-Shark-Management-Alert-in-Real-Time-Drumlines-Report-July-2021-June-2022.pdf
26/05/2022,13:50,Dusky Whaler,170,F,Alive,ID,Central Coast North,The Entrance Beach,2022-05-26T13:50:00Z,2022,5,DUS,FALSE,TRUE,FALSE,NSW-SMART-Shark-Management-Alert-in-Real-Time-Drumlines-Report-July-2021-June-2022.pdf
26/05/2022,13:56,Dusky Whaler,216,F,Alive,ID,Central Coast North,The Entrance Beach,2022-05-26T13:56:00Z,2022,5,DUS,FALSE,TRUE,FALSE,NSW-SMART-Shark-Management-Alert-in-Real-Time-Drumlines-Report-July-2021-June-2022.pdf
27/05/2022,15:48,Dusky Whaler,185,M,Alive,ID,Central Coast North,The Entrance Beach,2022-05-27T15:48:00Z,2022,5,DUS,FALSE,TRUE,FALSE,NSW-SMART-Shark-Management-Alert-in-Real-Time-Drumlines-Report-July-2021-June-2022.pdf
28/05/2022,13:04,Dusky Whaler,171,F,Alive,ID,Central Coast North,The Entrance Beach,2022-05-28T13:04:00Z,2022,5,DUS,FALSE,TRUE,FALSE,NSW-SMART-Shark-Management-Alert-in-Real-Time-Drumlines-Report-July-2021-June-2022.pdf
02/06/2022,9:13,Dusky Whaler,204,F,Alive,ID,Central Coast North,The Entrance Beach,2022-06-02T09:13:00Z,2022,6,DUS,FALSE,TRUE,FALSE,NSW-SMART-Shark-Management-Alert-in-Real-Time-Drumlines-Report-July-2021-June-2022.pdf
05/06/2022,10:13,Bronze Whaler,255,F,Alive,ID,Central Coast North,The Entrance Beach,2022-06-05T10:13:00Z,2022,6,BRO,FALSE,TRUE,FALSE,NSW-SMART-Shark-Management-Alert-in-Real-Time-Drumlines-Report-July-2021-June-2022.pdf
11/06/2022,10:21,Bronze Whaler,256,F,Alive,ID,Central Coast North,The Entrance Beach,2022-06-11T10:21:00Z,2022,6,BRO,FALSE,TRUE,FALSE,NSW-SMART-Shark-Management-Alert-in-Real-Time-Drumlines-Report-July-2021-June-2022.pdf
15/06/2022,11:25,Bronze Whaler,272,F,Alive,ID,Central Coast North,The Entrance Beach,2022-06-15T11:25:00Z,2022,6,BRO,FALSE,TRUE,FALSE,NSW-SMART-Shark-Management-Alert-in-Real-Time-Drumlines-Report-July-2021-June-2022.pdf
22/06/2022,14:00,Bronze Whaler,276,F,Alive,ID,Central Coast North,The Entrance Beach,2022-06-22T14:00:00Z,2022,6,BRO,FALSE,TRUE,FALSE,NSW-SMART-Shark-Management-Alert-in-Real-Time-Drumlines-Report-July-2021-June-2022.pdf
22/05/2022,9:22,Dusky Whaler,172,F,Alive,ID,Central Coast North,Pelican Beach,2022-05-22T09:22:00Z,2022,5,DUS,FALSE,TRUE,FALSE,NSW-SMART-Shark-Management-Alert-in-Real-Time-Drumlines-Report-July-2021-June-2022.pdf
30/05/2022,10:33,Dusky Whaler,173,F,Alive,ID,Central Coast North,Pelican Beach,2022-05-30T10:33:00Z,2022,5,DUS,FALSE,TRUE,FALSE,NSW-SMART-Shark-Management-Alert-in-Real-Time-Drumlines-Report-July-2021-June-2022.pdf
22/06/2022,9:36,Dusky Whaler,142,F,Alive,ID,Central Coast North,Pelican Beach,2022-06-22T09:36:00Z,2022,6,DUS,FALSE,TRUE,FALSE,NSW-SMART-Shark-Management-Alert-in-Real-Time-Drumlines-Report-July-2021-June-2022.pdf
24/06/2022,14:41,Bronze Whaler,231,F,Alive,ID,Central Coast North,Pelican Beach,2022-06-24T14:41:00Z,2022,6,BRO,FALSE,TRUE,FALSE,NSW-SMART-Shark-Management-Alert-in-Real-Time-Drumlines-Report-July-2021-June-2022.pdf
16/05/2022,11:18,Dusky Whaler,177,M,Alive,ID,Central Coast North,Point Beach,2022-05-16T11:18:00Z,2022,5,DUS,FALSE,TRUE,FALSE,NSW-SMART-Shark-Management-Alert-in-Real-Time-Drumlines-Report-July-2021-June-2022.pdf
04/06/2022,9:39,Dusky Whaler,148,F,Alive,ID,Central Coast North,Point Beach,2022-06-04T09:39:00Z,2022,6,DUS,FALSE,TRUE,FALSE,NSW-SMART-Shark-Management-Alert-in-Real-Time-Drumlines-Report-July-2021-June-2022.pdf
20/06/2022,12:22,Bronze Whaler,311,F,Alive,ID,Central Coast North,Point Beach,2022-06-20T12:22:00Z,2022,6,BRO,FALSE,TRUE,FALSE,NSW-SMART-Shark-Management-Alert-in-Real-Time-Drumlines-Report-July-2021-June-2022.pdf
21/06/2022,11:21,White Shark,212,F,Alive,"ID, A",Central Coast North,Point Beach,2022-06-21T11:21:00Z,2022,6,WHI,TRUE,TRUE,TRUE,NSW-SMART-Shark-Management-Alert-in-Real-Time-Drumlines-Report-July-2021-June-2022.pdf
25/05/2022,12:50,Dusky Whaler,195,F,Alive,ID,Central Coast North,Soldiers Point Beach,2022-05-25T12:50:00Z,2022,5,DUS,FALSE,TRUE,FALSE,NSW-SMART-Shark-Management-Alert-in-Real-Time-Drumlines-Report-July-2021-June-2022.pdf
04/06/2022,8:39,Dusky Whaler,152,F,Alive,ID,Central Coast North,Soldiers Point Beach,2022-06-04T08:39:00Z,2022,6,DUS,FALSE,TRUE,FALSE,NSW-SMART-Shark-Management-Alert-in-Real-Time-Drumlines-Report-July-2021-June-2022.pdf
15/06/2022,11:27,Dusky Whaler,145,F,Alive,ID,Central Coast North,Soldiers Point Beach,2022-06-15T11:27:00Z,2022,6,DUS,FALSE,TRUE,FALSE,NSW-SMART-Shark-Management-Alert-in-Real-Time-Drumlines-Report-July-2021-June-2022.pdf
16/05/2022,10:43,Dusky Whaler,171,M,Alive,ID,Central Coast North,Pebbly Beach,2022-05-16T10:43:00Z,2022,5,DUS,FALSE,TRUE,FALSE,NSW-SMART-Shark-Management-Alert-in-Real-Time-Drumlines-Report-July-2021-June-2022.pdf
16/05/2022,12:56,Dusky Whaler,168,M,Alive,ID,Central Coast North,Pebbly Beach,2022-05-16T12:56:00Z,2022,5,DUS,FALSE,TRUE,FALSE,NSW-SMART-Shark-Management-Alert-in-Real-Time-Drumlines-Report-July-2021-June-2022.pdf
21/05/2022,NA,White Shark,331,F,Alive,"ID, A",Central Coast North,Pebbly Beach,NA,2022,5,WHI,TRUE,TRUE,TRUE,NSW-SMART-Shark-Management-Alert-in-Real-Time-Drumlines-Report-July-2021-June-2022.pdf
23/05/2022,12:12,Dusky Whaler,159,F,Alive,ID,Central Coast North,Pebbly Beach,2022-05-23T12:12:00Z,2022,5,DUS,FALSE,TRUE,FALSE,NSW-SMART-Shark-Management-Alert-in-Real-Time-Drumlines-Report-July-2021-June-2022.pdf
27/05/2022,9:33,Dusky Whaler,192,F,Alive,ID,Central Coast North,Pebbly Beach,2022-05-27T09:33:00Z,2022,5,DUS,FALSE,TRUE,FALSE,NSW-SMART-Shark-Management-Alert-in-Real-Time-Drumlines-Report-July-2021-June-2022.pdf
02/06/2022,8:47,Bronze Whaler,226,F,Alive,ID,Central Coast North,Pebbly Beach,2022-06-02T08:47:00Z,2022,6,BRO,FALSE,TRUE,FALSE,NSW-SMART-Shark-Management-Alert-in-Real-Time-Drumlines-Report-July-2021-June-2022.pdf
02/06/2022,14:14,Dusky Whaler,175,M,Alive,ID,Central Coast North,Pebbly Beach,2022-06-02T14:14:00Z,2022,6,DUS,FALSE,TRUE,FALSE,NSW-SMART-Shark-Management-Alert-in-Real-Time-Drumlines-Report-July-2021-June-2022.pdf
05/06/2022,10:06,Bronze Whaler,261,M,Alive,ID,Central Coast North,Pebbly Beach,2022-06-05T10:06:00Z,2022,6,BRO,FALSE,TRUE,FALSE,NSW-SMART-Shark-Management-Alert-in-Real-Time-Drumlines-Report-July-2021-June-2022.pdf
07/06/2022,9:04,Bronze Whaler,285,F,Alive,ID,Central Coast North,Pebbly Beach,2022-06-07T09:04:00Z,2022,6,BRO,FALSE,TRUE,FALSE,NSW-SMART-Shark-Management-Alert-in-Real-Time-Drumlines-Report-July-2021-June-2022.pdf
07/06/2022,12:41,Bronze Whaler,284,F,Alive,ID,Central Coast North,Pebbly Beach,2022-06-07T12:41:00Z,2022,6,BRO,FALSE,TRUE,FALSE,NSW-SMART-Shark-Management-Alert-in-Real-Time-Drumlines-Report-July-2021-June-2022.pdf
15/06/2022,9:26,Bronze Whaler,290,F,Alive,ID,Central Coast North,Pebbly Beach,2022-06-15T09:26:00Z,2022,6,BRO,FALSE,TRUE,FALSE,NSW-SMART-Shark-Management-Alert-in-Real-Time-Drumlines-Report-July-2021-June-2022.pdf
16/03/2022,12:24,Dusky Whaler,137,M,Alive,ID,Central Coast South - Forresters to MacMasters,MacMasters Beach,2022-03-16T12:24:00Z,2022,3,DUS,FALSE,TRUE,FALSE,NSW-SMART-Shark-Management-Alert-in-Real-Time-Drumlines-Report-July-2021-June-2022.pdf
05/05/2022,9:42,Dusky Whaler,162,F,Alive,ID,Central Coast South - Forresters to MacMasters,MacMasters Beach,2022-05-05T09:42:00Z,2022,5,DUS,FALSE,TRUE,FALSE,NSW-SMART-Shark-Management-Alert-in-Real-Time-Drumlines-Report-July-2021-June-2022.pdf
14/05/2022,11:58,Dusky Whaler,161,M,Alive,ID,Central Coast South - Forresters to MacMasters,MacMasters Beach,2022-05-14T11:58:00Z,2022,5,DUS,FALSE,TRUE,FALSE,NSW-SMART-Shark-Management-Alert-in-Real-Time-Drumlines-Report-July-2021-June-2022.pdf
13/06/2022,11:09,White Shark,226,F,Alive,"ID, A",Central Coast South - Forresters to MacMasters,MacMasters Beach,2022-06-13T11:09:00Z,2022,6,WHI,TRUE,TRUE,TRUE,NSW-SMART-Shark-Management-Alert-in-Real-Time-Drumlines-Report-July-2021-June-2022.pdf
11/04/2022,7:56,Dusky Whaler,179,F,Alive,ID,Central Coast South - Forresters to MacMasters,Copacabana Beach,2022-04-11T07:56:00Z,2022,4,DUS,FALSE,TRUE,FALSE,NSW-SMART-Shark-Management-Alert-in-Real-Time-Drumlines-Report-July-2021-June-2022.pdf
16/04/2022,9:43,Dusky Whaler,157,M,Alive,ID,Central Coast South - Forresters to MacMasters,Copacabana Beach,2022-04-16T09:43:00Z,2022,4,DUS,FALSE,TRUE,FALSE,NSW-SMART-Shark-Management-Alert-in-Real-Time-Drumlines-Report-July-2021-June-2022.pdf
25/04/2022,9:59,Dusky Whaler,187,F,Alive,ID,Central Coast South - Forresters to MacMasters,Copacabana Beach,2022-04-25T09:59:00Z,2022,4,DUS,FALSE,TRUE,FALSE,NSW-SMART-Shark-Management-Alert-in-Real-Time-Drumlines-Report-July-2021-June-2022.pdf
28/04/2022,10:14,Dusky Whaler,153,M,Alive,ID,Central Coast South - Forresters to MacMasters,Copacabana Beach,2022-04-28T10:14:00Z,2022,4,DUS,FALSE,TRUE,FALSE,NSW-SMART-Shark-Management-Alert-in-Real-Time-Drumlines-Report-July-2021-June-2022.pdf
30/04/2022,NA,Dusky Whaler,132,F,Alive,ID,Central Coast South - Forresters to MacMasters,Copacabana Beach,NA,2022,4,DUS,FALSE,TRUE,FALSE,NSW-SMART-Shark-Management-Alert-in-Real-Time-Drumlines-Report-July-2021-June-2022.pdf
04/05/2022,13:20,Dusky Whaler,149,M,Alive,ID,Central Coast South - Forresters to MacMasters,Copacabana Beach,2022-05-04T13:20:00Z,2022,5,DUS,FALSE,TRUE,FALSE,NSW-SMART-Shark-Management-Alert-in-Real-Time-Drumlines-Report-July-2021-June-2022.pdf
16/05/2022,7:35,Dusky Whaler,152,F,Alive,ID,Central Coast South - Forresters to MacMasters,Copacabana Beach,2022-05-16T07:35:00Z,2022,5,DUS,FALSE,TRUE,FALSE,NSW-SMART-Shark-Management-Alert-in-Real-Time-Drumlines-Report-July-2021-June-2022.pdf
16/05/2022,14:39,Dusky Whaler,173,M,Alive,ID,Central Coast South - Forresters to MacMasters,Copacabana Beach,2022-05-16T14:39:00Z,2022,5,DUS,FALSE,TRUE,FALSE,NSW-SMART-Shark-Management-Alert-in-Real-Time-Drumlines-Report-July-2021-June-2022.pdf
23/05/2022,15:36,Dusky Whaler,153,F,Alive,ID,Central Coast South - Forresters to MacMasters,Copacabana Beach,2022-05-23T15:36:00Z,2022,5,DUS,FALSE,TRUE,FALSE,NSW-SMART-Shark-Management-Alert-in-Real-Time-Drumlines-Report-July-2021-June-2022.pdf
27/05/2022,8:17,Dusky Whaler,162,F,Alive,ID,Central Coast South - Forresters to MacMasters,Copacabana Beach,2022-05-27T08:17:00Z,2022,5,DUS,FALSE,TRUE,FALSE,NSW-SMART-Shark-Management-Alert-in-Real-Time-Drumlines-Report-July-2021-June-2022.pdf
17/06/2022,9:59,Dusky Whaler,142,F,Alive,ID,Central Coast South - Forresters to MacMasters,Copacabana Beach,2022-06-17T09:59:00Z,2022,6,DUS,FALSE,TRUE,FALSE,NSW-SMART-Shark-Management-Alert-in-Real-Time-Drumlines-Report-July-2021-June-2022.pdf
29/06/2022,NA,Bronze Whaler,273,F,Alive,ID,Central Coast South - Forresters to MacMasters,Copacabana Beach,NA,2022,6,BRO,FALSE,TRUE,FALSE,NSW-SMART-Shark-Management-Alert-in-Real-Time-Drumlines-Report-July-2021-June-2022.pdf
17/03/2022,10:55,Dusky Whaler,204,F,Alive,ID,Central Coast South - Forresters to MacMasters,Avoca Beach,2022-03-17T10:55:00Z,2022,3,DUS,FALSE,TRUE,FALSE,NSW-SMART-Shark-Management-Alert-in-Real-Time-Drumlines-Report-July-2021-June-2022.pdf
10/04/2022,12:34,Dusky Whaler,174,F,Alive,ID,Central Coast South - Forresters to MacMasters,Avoca Beach,2022-04-10T12:34:00Z,2022,4,DUS,FALSE,TRUE,FALSE,NSW-SMART-Shark-Management-Alert-in-Real-Time-Drumlines-Report-July-2021-June-2022.pdf
21/04/2022,10:13,Dusky Whaler,166,F,Alive,ID,Central Coast South - Forresters to MacMasters,Avoca Beach,2022-04-21T10:13:00Z,2022,4,DUS,FALSE,TRUE,FALSE,NSW-SMART-Shark-Management-Alert-in-Real-Time-Drumlines-Report-July-2021-June-2022.pdf
05/05/2022,11:30,Dusky Whaler,158,M,Alive,ID,Central Coast South - Forresters to MacMasters,Avoca Beach,2022-05-05T11:30:00Z,2022,5,DUS,FALSE,TRUE,FALSE,NSW-SMART-Shark-Management-Alert-in-Real-Time-Drumlines-Report-July-2021-June-2022.pdf
17/03/2022,13:04,Dusky Whaler,201,F,Alive,ID,Central Coast South - Forresters to MacMasters,North Avoca Beach,2022-03-17T13:04:00Z,2022,3,DUS,FALSE,TRUE,FALSE,NSW-SMART-Shark-Management-Alert-in-Real-Time-Drumlines-Report-July-2021-June-2022.pdf
11/04/2022,12:35,Dusky Whaler,182,M,Alive,ID,Central Coast South - Forresters to MacMasters,North Avoca Beach,2022-04-11T12:35:00Z,2022,4,DUS,FALSE,TRUE,FALSE,NSW-SMART-Shark-Management-Alert-in-Real-Time-Drumlines-Report-July-2021-June-2022.pdf
26/05/2022,8:45,Dusky Whaler,155,F,Alive,ID,Central Coast South - Forresters to MacMasters,North Avoca Beach,2022-05-26T08:45:00Z,2022,5,DUS,FALSE,TRUE,FALSE,NSW-SMART-Shark-Management-Alert-in-Real-Time-Drumlines-Report-July-2021-June-2022.pdf
15/06/2022,NA,Dusky Whaler,114,M,Alive,ID,Central Coast South - Forresters to MacMasters,North Avoca Beach,NA,2022,6,DUS,FALSE,TRUE,FALSE,NSW-SMART-Shark-Management-Alert-in-Real-Time-Drumlines-Report-July-2021-June-2022.pdf
21/06/2022,12:47,White Shark,223,M,Alive,"ID, A",Central Coast South - Forresters to MacMasters,North Avoca Beach,2022-06-21T12:47:00Z,2022,6,WHI,TRUE,TRUE,TRUE,NSW-SMART-Shark-Management-Alert-in-Real-Time-Drumlines-Report-July-2021-June-2022.pdf
14/03/2022,NA,Dusky Whaler,99,F,Alive,ID,Central Coast South - Forresters to MacMasters,Terrigal Beach,NA,2022,3,DUS,FALSE,TRUE,FALSE,NSW-SMART-Shark-Management-Alert-in-Real-Time-Drumlines-Report-July-2021-June-2022.pdf
18/03/2022,14:00,Dusky Whaler,201,F,Alive,ID,Central Coast South - Forresters to MacMasters,Terrigal Beach,2022-03-18T14:00:00Z,2022,3,DUS,FALSE,TRUE,FALSE,NSW-SMART-Shark-Management-Alert-in-Real-Time-Drumlines-Report-July-2021-June-2022.pdf
18/03/2022,16:17,Dusky Whaler,171,M,Alive,ID,Central Coast South - Forresters to MacMasters,Terrigal Beach,2022-03-18T16:17:00Z,2022,3,DUS,FALSE,TRUE,FALSE,NSW-SMART-Shark-Management-Alert-in-Real-Time-Drumlines-Report-July-2021-June-2022.pdf
28/03/2022,13:57,Dusky Whaler,169,F,Alive,ID,Central Coast South - Forresters to MacMasters,Terrigal Beach,2022-03-28T13:57:00Z,2022,3,DUS,FALSE,TRUE,FALSE,NSW-SMART-Shark-Management-Alert-in-Real-Time-Drumlines-Report-July-2021-June-2022.pdf
28/03/2022,15:08,Dusky Whaler,NA,NA,Alive,-,Central Coast South - Forresters to MacMasters,Terrigal Beach,2022-03-28T15:08:00Z,2022,3,DUS,FALSE,FALSE,FALSE,NSW-SMART-Shark-Management-Alert-in-Real-Time-Drumlines-Report-July-2021-June-2022.pdf
06/04/2022,10:08,Dusky Whaler,156,F,Alive,ID,Central Coast South - Forresters to MacMasters,Terrigal Beach,2022-04-06T10:08:00Z,2022,4,DUS,FALSE,TRUE,FALSE,NSW-SMART-Shark-Management-Alert-in-Real-Time-Drumlines-Report-July-2021-June-2022.pdf
14/04/2022,10:59,Dusky Whaler,154,F,Alive,ID,Central Coast South - Forresters to MacMasters,Terrigal Beach,2022-04-14T10:59:00Z,2022,4,DUS,FALSE,TRUE,FALSE,NSW-SMART-Shark-Management-Alert-in-Real-Time-Drumlines-Report-July-2021-June-2022.pdf
16/05/2022,NA,Tiger Shark,366,F,Alive,"ID, A",Central Coast South - Forresters to MacMasters,Terrigal Beach,NA,2022,5,TIG,TRUE,TRUE,TRUE,NSW-SMART-Shark-Management-Alert-in-Real-Time-Drumlines-Report-July-2021-June-2022.pdf
13/06/2022,7:46,White Shark,213,F,Alive,"ID, A",Central Coast South - Forresters to MacMasters,Terrigal Beach,2022-06-13T07:46:00Z,2022,6,WHI,TRUE,TRUE,TRUE,NSW-SMART-Shark-Management-Alert-in-Real-Time-Drumlines-Report-July-2021-June-2022.pdf
18/03/2022,12:17,Dusky Whaler,188,F,Alive,ID,Central Coast South - Forresters to MacMasters,Wamberal Beach,2022-03-18T12:17:00Z,2022,3,DUS,FALSE,TRUE,FALSE,NSW-SMART-Shark-Management-Alert-in-Real-Time-Drumlines-Report-July-2021-June-2022.pdf
22/03/2022,10:34,Dusky Whaler,200,F,Alive,ID,Central Coast South - Forresters to MacMasters,Wamberal Beach,2022-03-22T10:34:00Z,2022,3,DUS,FALSE,TRUE,FALSE,NSW-SMART-Shark-Management-Alert-in-Real-Time-Drumlines-Report-July-2021-June-2022.pdf
22/03/2022,12:37,Dusky Whaler,154,M,Alive,ID,Central Coast South - Forresters to MacMasters,Wamberal Beach,2022-03-22T12:37:00Z,2022,3,DUS,FALSE,TRUE,FALSE,NSW-SMART-Shark-Management-Alert-in-Real-Time-Drumlines-Report-July-2021-June-2022.pdf
22/03/2022,12:58,Dusky Whaler,218,F,Alive,ID,Central Coast South - Forresters to MacMasters,Wamberal Beach,2022-03-22T12:58:00Z,2022,3,DUS,FALSE,TRUE,FALSE,NSW-SMART-Shark-Management-Alert-in-Real-Time-Drumlines-Report-July-2021-June-2022.pdf
15/04/2022,12:38,Dusky Whaler,163,M,Alive,ID,Central Coast South - Forresters to MacMasters,Wamberal Beach,2022-04-15T12:38:00Z,2022,4,DUS,FALSE,TRUE,FALSE,NSW-SMART-Shark-Management-Alert-in-Real-Time-Drumlines-Report-July-2021-June-2022.pdf
17/04/2022,12:35,Dusky Whaler,155,F,Alive,ID,Central Coast South - Forresters to MacMasters,Wamberal Beach,2022-04-17T12:35:00Z,2022,4,DUS,FALSE,TRUE,FALSE,NSW-SMART-Shark-Management-Alert-in-Real-Time-Drumlines-Report-July-2021-June-2022.pdf
02/06/2022,NA,Dusky Whaler,157,F,Alive,ID,Central Coast South - Forresters to MacMasters,Wamberal Beach,NA,2022,6,DUS,FALSE,TRUE,FALSE,NSW-SMART-Shark-Management-Alert-in-Real-Time-Drumlines-Report-July-2021-June-2022.pdf
11/06/2022,8:44,Dusky Whaler,147,F,Alive,ID,Central Coast South - Forresters to MacMasters,Wamberal Beach,2022-06-11T08:44:00Z,2022,6,DUS,FALSE,TRUE,FALSE,NSW-SMART-Shark-Management-Alert-in-Real-Time-Drumlines-Report-July-2021-June-2022.pdf
12/06/2022,12:57,White Shark,270,M,Alive,"ID, A",Central Coast South - Forresters to MacMasters,Wamberal Beach,2022-06-12T12:57:00Z,2022,6,WHI,TRUE,TRUE,TRUE,NSW-SMART-Shark-Management-Alert-in-Real-Time-Drumlines-Report-July-2021-June-2022.pdf
13/06/2022,10:17,Bronze Whaler,271,F,Alive,ID,Central Coast South - Forresters to MacMasters,Wamberal Beach,2022-06-13T10:17:00Z,2022,6,BRO,FALSE,TRUE,FALSE,NSW-SMART-Shark-Management-Alert-in-Real-Time-Drumlines-Report-July-2021-June-2022.pdf
15/06/2022,11:29,Dusky Whaler,146,M,Alive,ID,Central Coast South - Forresters to MacMasters,Wamberal Beach,2022-06-15T11:29:00Z,2022,6,DUS,FALSE,TRUE,FALSE,NSW-SMART-Shark-Management-Alert-in-Real-Time-Drumlines-Report-July-2021-June-2022.pdf
15/06/2022,11:27,Dusky Whaler,154,F,Alive,ID,Central Coast South - Forresters to MacMasters,Wamberal Beach,2022-06-15T11:27:00Z,2022,6,DUS,FALSE,TRUE,FALSE,NSW-SMART-Shark-Management-Alert-in-Real-Time-Drumlines-Report-July-2021-June-2022.pdf
15/06/2022,14:38,Dusky Whaler,196,F,Alive,ID,Central Coast South - Forresters to MacMasters,Wamberal Beach,2022-06-15T14:38:00Z,2022,6,DUS,FALSE,TRUE,FALSE,NSW-SMART-Shark-Management-Alert-in-Real-Time-Drumlines-Report-July-2021-June-2022.pdf
14/03/2022,NA,Dusky Whaler,92,F,Alive,ID,Central Coast South - Forresters to MacMasters,Forresters Beach,NA,2022,3,DUS,FALSE,TRUE,FALSE,NSW-SMART-Shark-Management-Alert-in-Real-Time-Drumlines-Report-July-2021-June-2022.pdf
20/03/2022,10:25,Dusky Whaler,182,M,Alive,ID,Central Coast South - Forresters to MacMasters,Forresters Beach,2022-03-20T10:25:00Z,2022,3,DUS,FALSE,TRUE,FALSE,NSW-SMART-Shark-Management-Alert-in-Real-Time-Drumlines-Report-July-2021-June-2022.pdf
22/03/2022,8:38,Dusky Whaler,214,F,Alive,ID,Central Coast South - Forresters to MacMasters,Forresters Beach,2022-03-22T08:38:00Z,2022,3,DUS,FALSE,TRUE,FALSE,NSW-SMART-Shark-Management-Alert-in-Real-Time-Drumlines-Report-July-2021-June-2022.pdf
25/03/2022,9:40,Dusky Whaler,166,F,Alive,ID,Central Coast South - Forresters to MacMasters,Forresters Beach,2022-03-25T09:40:00Z,2022,3,DUS,FALSE,TRUE,FALSE,NSW-SMART-Shark-Management-Alert-in-Real-Time-Drumlines-Report-July-2021-June-2022.pdf
04/04/2022,14:08,Dusky Whaler,188,F,Alive,ID,Central Coast South - Forresters to MacMasters,Forresters Beach,2022-04-04T14:08:00Z,2022,4,DUS,FALSE,TRUE,FALSE,NSW-SMART-Shark-Management-Alert-in-Real-Time-Drumlines-Report-July-2021-June-2022.pdf
11/04/2022,9:37,Dusky Whaler,187,F,Alive,ID,Central Coast South - Forresters to MacMasters,Forresters Beach,2022-04-11T09:37:00Z,2022,4,DUS,FALSE,TRUE,FALSE,NSW-SMART-Shark-Management-Alert-in-Real-Time-Drumlines-Report-July-2021-June-2022.pdf
15/04/2022,12:22,Dusky Whaler,156,M,Alive,ID,Central Coast South - Forresters to MacMasters,Forresters Beach,2022-04-15T12:22:00Z,2022,4,DUS,FALSE,TRUE,FALSE,NSW-SMART-Shark-Management-Alert-in-Real-Time-Drumlines-Report-July-2021-June-2022.pdf
16/04/2022,11:15,Dusky Whaler,102,F,Alive,ID,Central Coast South - Forresters to MacMasters,Forresters Beach,2022-04-16T11:15:00Z,2022,4,DUS,FALSE,TRUE,FALSE,NSW-SMART-Shark-Management-Alert-in-Real-Time-Drumlines-Report-July-2021-June-2022.pdf
30/04/2022,11:21,Dusky Whaler,161,M,Alive,ID,Central Coast South - Forresters to MacMasters,Forresters Beach,2022-04-30T11:21:00Z,2022,4,DUS,FALSE,TRUE,FALSE,NSW-SMART-Shark-Management-Alert-in-Real-Time-Drumlines-Report-July-2021-June-2022.pdf
19/05/2022,13:29,Dusky Whaler,145,F,Alive,ID,Central Coast South - Forresters to MacMasters,Forresters Beach,2022-05-19T13:29:00Z,2022,5,DUS,FALSE,TRUE,FALSE,NSW-SMART-Shark-Management-Alert-in-Real-Time-Drumlines-Report-July-2021-June-2022.pdf
16/03/2022,NA,Dusky Whaler,114,M,Dead,-,Barrenjoey - Barrenjoey to Warriewood,Palm Beach,NA,2022,3,DUS,FALSE,FALSE,FALSE,NSW-SMART-Shark-Management-Alert-in-Real-Time-Drumlines-Report-July-2021-June-2022.pdf
04/04/2022,NA,Dusky Whaler,91,M,Alive,ID,Barrenjoey - Barrenjoey to Warriewood,Palm Beach,NA,2022,4,DUS,FALSE,TRUE,FALSE,NSW-SMART-Shark-Management-Alert-in-Real-Time-Drumlines-Report-July-2021-June-2022.pdf
12/03/2022,NA,Dusky Whaler,90,M,Dead,-,Barrenjoey - Barrenjoey to Warriewood,Whale Beach,NA,2022,3,DUS,FALSE,FALSE,FALSE,NSW-SMART-Shark-Management-Alert-in-Real-Time-Drumlines-Report-July-2021-June-2022.pdf
4/04/2022,10:13,Dusky Whaler,144,F,Alive,ID,Barrenjoey - Barrenjoey to Warriewood,Whale Beach,2022-04-04T10:13:00Z,2022,4,DUS,FALSE,TRUE,FALSE,NSW-SMART-Shark-Management-Alert-in-Real-Time-Drumlines-Report-July-2021-June-2022.pdf
16/03/2022,12:03,Dusky Whaler,180,M,Alive,ID,Barrenjoey - Barrenjoey to Warriewood,Avalon Beach,2022-03-16T12:03:00Z,2022,3,DUS,FALSE,TRUE,FALSE,NSW-SMART-Shark-Management-Alert-in-Real-Time-Drumlines-Report-July-2021-June-2022.pdf
5/04/2022,NA,Dusky Whaler,98,F,Alive,ID,Barrenjoey - Barrenjoey to Warriewood,Avalon Beach,NA,2022,4,DUS,FALSE,TRUE,FALSE,NSW-SMART-Shark-Management-Alert-in-Real-Time-Drumlines-Report-July-2021-June-2022.pdf
11/04/2022,13:30,Dusky Whaler,146,M,Alive,ID,Barrenjoey - Barrenjoey to Warriewood,Avalon Beach,2022-04-11T13:30:00Z,2022,4,DUS,FALSE,TRUE,FALSE,NSW-SMART-Shark-Management-Alert-in-Real-Time-Drumlines-Report-July-2021-June-2022.pdf
16/04/2022,9:10,Dusky Whaler,162,M,Alive,ID,Barrenjoey - Barrenjoey to Warriewood,Avalon Beach,2022-04-16T09:10:00Z,2022,4,DUS,FALSE,TRUE,FALSE,NSW-SMART-Shark-Management-Alert-in-Real-Time-Drumlines-Report-July-2021-June-2022.pdf
19/04/2022,9:51,Dusky Whaler,165,M,Alive,ID,Barrenjoey - Barrenjoey to Warriewood,Avalon Beach,2022-04-19T09:51:00Z,2022,4,DUS,FALSE,TRUE,FALSE,NSW-SMART-Shark-Management-Alert-in-Real-Time-Drumlines-Report-July-2021-June-2022.pdf
20/04/2022,9:32,Dusky Whaler,169,F,Alive,ID,Barrenjoey - Barrenjoey to Warriewood,Avalon Beach,2022-04-20T09:32:00Z,2022,4,DUS,FALSE,TRUE,FALSE,NSW-SMART-Shark-Management-Alert-in-Real-Time-Drumlines-Report-July-2021-June-2022.pdf
8/05/2022,9:43,Tiger Shark,171,F,Alive,"ID, A",Barrenjoey - Barrenjoey to Warriewood,Avalon Beach,2022-05-08T09:43:00Z,2022,5,TIG,TRUE,TRUE,TRUE,NSW-SMART-Shark-Management-Alert-in-Real-Time-Drumlines-Report-July-2021-June-2022.pdf
9/05/2022,9:14,Dusky Whaler,111,F,Alive,ID,Barrenjoey - Barrenjoey to Warriewood,Avalon Beach,2022-05-09T09:14:00Z,2022,5,DUS,FALSE,TRUE,FALSE,NSW-SMART-Shark-Management-Alert-in-Real-Time-Drumlines-Report-July-2021-June-2022.pdf
23/05/2022,8:47,Dusky Whaler,189,M,Alive,ID,Barrenjoey - Barrenjoey to Warriewood,Avalon Beach,2022-05-23T08:47:00Z,2022,5,DUS,FALSE,TRUE,FALSE,NSW-SMART-Shark-Management-Alert-in-Real-Time-Drumlines-Report-July-2021-June-2022.pdf
24/05/2022,10:15,Dusky Whaler,138,M,Alive,ID,Barrenjoey - Barrenjoey to Warriewood,Avalon Beach,2022-05-24T10:15:00Z,2022,5,DUS,FALSE,TRUE,FALSE,NSW-SMART-Shark-Management-Alert-in-Real-Time-Drumlines-Report-July-2021-June-2022.pdf
25/05/2022,13:37,Dusky Whaler,158,F,Alive,ID,Barrenjoey - Barrenjoey to Warriewood,Avalon Beach,2022-05-25T13:37:00Z,2022,5,DUS,FALSE,TRUE,FALSE,NSW-SMART-Shark-Management-Alert-in-Real-Time-Drumlines-Report-July-2021-June-2022.pdf
28/05/2022,13:30,Dusky Whaler,165,F,Alive,ID,Barrenjoey - Barrenjoey to Warriewood,Avalon Beach,2022-05-28T13:30:00Z,2022,5,DUS,FALSE,TRUE,FALSE,NSW-SMART-Shark-Management-Alert-in-Real-Time-Drumlines-Report-July-2021-June-2022.pdf
30/05/2022,11:04,Dusky Whaler,171,M,Alive,ID,Barrenjoey - Barrenjoey to Warriewood,Avalon Beach,2022-05-30T11:04:00Z,2022,5,DUS,FALSE,TRUE,FALSE,NSW-SMART-Shark-Management-Alert-in-Real-Time-Drumlines-Report-July-2021-June-2022.pdf
6/06/2022,9:33,Dusky Whaler,176,F,Alive,ID,Barrenjoey - Barrenjoey to Warriewood,Avalon Beach,2022-06-06T09:33:00Z,2022,6,DUS,FALSE,TRUE,FALSE,NSW-SMART-Shark-Management-Alert-in-Real-Time-Drumlines-Report-July-2021-June-2022.pdf
10/04/2022,13:26,Dusky Whaler,157,F,Alive,ID,Barrenjoey - Barrenjoey to Warriewood,Bilgola Beach,2022-04-10T13:26:00Z,2022,4,DUS,FALSE,TRUE,FALSE,NSW-SMART-Shark-Management-Alert-in-Real-Time-Drumlines-Report-July-2021-June-2022.pdf
17/04/2022,8:55,Smooth Hammerhead,171,M,Alive,ID,Barrenjoey - Barrenjoey to Warriewood,Bilgola Beach,2022-04-17T08:55:00Z,2022,4,SMH,FALSE,TRUE,FALSE,NSW-SMART-Shark-Management-Alert-in-Real-Time-Drumlines-Report-July-2021-June-2022.pdf
25/05/2022,10:07,Dusky Whaler,160,M,Alive,ID,Barrenjoey - Barrenjoey to Warriewood,Bilgola Beach,2022-05-25T10:07:00Z,2022,5,DUS,FALSE,TRUE,FALSE,NSW-SMART-Shark-Management-Alert-in-Real-Time-Drumlines-Report-July-2021-June-2022.pdf
3/06/2022,10:58,Bronze Whaler,250,F,Alive,ID,Barrenjoey - Barrenjoey to Warriewood,Bilgola Beach,2022-06-03T10:58:00Z,2022,6,BRO,FALSE,TRUE,FALSE,NSW-SMART-Shark-Management-Alert-in-Real-Time-Drumlines-Report-July-2021-June-2022.pdf
6/06/2022,14:11,Bronze Whaler,243,F,Alive,ID,Barrenjoey - Barrenjoey to Warriewood,Bilgola Beach,2022-06-06T14:11:00Z,2022,6,BRO,FALSE,TRUE,FALSE,NSW-SMART-Shark-Management-Alert-in-Real-Time-Drumlines-Report-July-2021-June-2022.pdf
14/03/2022,10:26,Common Blacktip,141,F,Alive,ID,Barrenjoey - Barrenjoey to Warriewood,Newport Beach,2022-03-14T10:26:00Z,2022,3,CBT,FALSE,TRUE,FALSE,NSW-SMART-Shark-Management-Alert-in-Real-Time-Drumlines-Report-July-2021-June-2022.pdf
20/04/2022,9:18,Dusky Whaler,146,F,Alive,ID,Barrenjoey - Barrenjoey to Warriewood,Newport Beach,2022-04-20T09:18:00Z,2022,4,DUS,FALSE,TRUE,FALSE,NSW-SMART-Shark-Management-Alert-in-Real-Time-Drumlines-Report-July-2021-June-2022.pdf
23/04/2022,NA,Dusky Whaler,132,F,Alive,ID,Barrenjoey - Barrenjoey to Warriewood,Newport Beach,NA,2022,4,DUS,FALSE,TRUE,FALSE,NSW-SMART-Shark-Management-Alert-in-Real-Time-Drumlines-Report-July-2021-June-2022.pdf
5/05/2022,13:31,Dusky Whaler,157,F,Alive,ID,Barrenjoey - Barrenjoey to Warriewood,Newport Beach,2022-05-05T13:31:00Z,2022,5,DUS,FALSE,TRUE,FALSE,NSW-SMART-Shark-Management-Alert-in-Real-Time-Drumlines-Report-July-2021-June-2022.pdf
14/06/2022,NA,Bronze Whaler,286,F,Alive,ID,Barrenjoey - Barrenjoey to Warriewood,Newport Beach,NA,2022,6,BRO,FALSE,TRUE,FALSE,NSW-SMART-Shark-Management-Alert-in-Real-Time-Drumlines-Report-July-2021-June-2022.pdf
16/03/2022,15:40,Dusky Whaler,129,F,Alive,ID,Barrenjoey - Barrenjoey to Warriewood,Bungan Beach,2022-03-16T15:40:00Z,2022,3,DUS,FALSE,TRUE,FALSE,NSW-SMART-Shark-Management-Alert-in-Real-Time-Drumlines-Report-July-2021-June-2022.pdf
10/04/2022,8:03,Dusky Whaler,155,M,Alive,ID,Barrenjoey - Barrenjoey to Warriewood,Bungan Beach,2022-04-10T08:03:00Z,2022,4,DUS,FALSE,TRUE,FALSE,NSW-SMART-Shark-Management-Alert-in-Real-Time-Drumlines-Report-July-2021-June-2022.pdf
15/04/2022,11:59,Dusky Whaler,152,M,Alive,ID,Barrenjoey - Barrenjoey to Warriewood,Bungan Beach,2022-04-15T11:59:00Z,2022,4,DUS,FALSE,TRUE,FALSE,NSW-SMART-Shark-Management-Alert-in-Real-Time-Drumlines-Report-July-2021-June-2022.pdf
23/04/2022,14:16,Dusky Whaler,161,F,Alive,ID,Barrenjoey - Barrenjoey to Warriewood,Bungan Beach,2022-04-23T14:16:00Z,2022,4,DUS,FALSE,TRUE,FALSE,NSW-SMART-Shark-Management-Alert-in-Real-Time-Drumlines-Report-July-2021-June-2022.pdf
24/04/2022,12:13,Dusky Whaler,115,F,Alive,ID,Barrenjoey - Barrenjoey to Warriewood,Bungan Beach,2022-04-24T12:13:00Z,2022,4,DUS,FALSE,TRUE,FALSE,NSW-SMART-Shark-Management-Alert-in-Real-Time-Drumlines-Report-July-2021-June-2022.pdf
25/04/2022,11:04,Dusky Whaler,191,F,Alive,ID,Barrenjoey - Barrenjoey to Warriewood,Bungan Beach,2022-04-25T11:04:00Z,2022,4,DUS,FALSE,TRUE,FALSE,NSW-SMART-Shark-Management-Alert-in-Real-Time-Drumlines-Report-July-2021-June-2022.pdf
25/04/2022,12:59,Dusky Whaler,173,F,Alive,ID,Barrenjoey - Barrenjoey to Warriewood,Bungan Beach,2022-04-25T12:59:00Z,2022,4,DUS,FALSE,TRUE,FALSE,NSW-SMART-Shark-Management-Alert-in-Real-Time-Drumlines-Report-July-2021-June-2022.pdf
26/04/2022,14:40,Dusky Whaler,116,F,Alive,ID,Barrenjoey - Barrenjoey to Warriewood,Bungan Beach,2022-04-26T14:40:00Z,2022,4,DUS,FALSE,TRUE,FALSE,NSW-SMART-Shark-Management-Alert-in-Real-Time-Drumlines-Report-July-2021-June-2022.pdf
1/05/2022,11:55,Dusky Whaler,122,F,Alive,ID,Barrenjoey - Barrenjoey to Warriewood,Bungan Beach,2022-05-01T11:55:00Z,2022,5,DUS,FALSE,TRUE,FALSE,NSW-SMART-Shark-Management-Alert-in-Real-Time-Drumlines-Report-July-2021-June-2022.pdf
14/05/2022,9:00,Dusky Whaler,176,M,Alive,ID,Barrenjoey - Barrenjoey to Warriewood,Bungan Beach,2022-05-14T09:00:00Z,2022,5,DUS,FALSE,TRUE,FALSE,NSW-SMART-Shark-Management-Alert-in-Real-Time-Drumlines-Report-July-2021-June-2022.pdf
9/06/2022,NA,Dusky Whaler,118,F,Alive,ID,Barrenjoey - Barrenjoey to Warriewood,Bungan Beach,NA,2022,6,DUS,FALSE,TRUE,FALSE,NSW-SMART-Shark-Management-Alert-in-Real-Time-Drumlines-Report-July-2021-June-2022.pdf
4/04/2022,12:09,Dusky Whaler,130,M,Alive,ID,Barrenjoey - Barrenjoey to Warriewood,Mona Vale Beach,2022-04-04T12:09:00Z,2022,4,DUS,FALSE,TRUE,FALSE,NSW-SMART-Shark-Management-Alert-in-Real-Time-Drumlines-Report-July-2021-June-2022.pdf
14/04/2022,NA,Dusky Whaler,110,M,Alive,ID,Barrenjoey - Barrenjoey to Warriewood,Mona Vale Beach,NA,2022,4,DUS,FALSE,TRUE,FALSE,NSW-SMART-Shark-Management-Alert-in-Real-Time-Drumlines-Report-July-2021-June-2022.pdf
10/05/2022,10:19,Dusky Whaler,152,F,Alive,ID,Barrenjoey - Barrenjoey to Warriewood,Mona Vale Beach,2022-05-10T10:19:00Z,2022,5,DUS,FALSE,TRUE,FALSE,NSW-SMART-Shark-Management-Alert-in-Real-Time-Drumlines-Report-July-2021-June-2022.pdf
17/03/2022,10:22,Dusky Whaler,119,M,Alive,ID,Barrenjoey - Barrenjoey to Warriewood,Warriewood Beach,2022-03-17T10:22:00Z,2022,3,DUS,FALSE,TRUE,FALSE,NSW-SMART-Shark-Management-Alert-in-Real-Time-Drumlines-Report-July-2021-June-2022.pdf
23/04/2022,NA,Dusky Whaler,136,F,Alive,ID,Barrenjoey - Barrenjoey to Warriewood,Warriewood Beach,NA,2022,4,DUS,FALSE,TRUE,FALSE,NSW-SMART-Shark-Management-Alert-in-Real-Time-Drumlines-Report-July-2021-June-2022.pdf
9/05/2022,9:58,Dusky Whaler,141,F,Alive,ID,Barrenjoey - Barrenjoey to Warriewood,Warriewood Beach,2022-05-09T09:58:00Z,2022,5,DUS,FALSE,TRUE,FALSE,NSW-SMART-Shark-Management-Alert-in-Real-Time-Drumlines-Report-July-2021-June-2022.pdf
5/06/2022,12:56,Dusky Whaler,112,M,Alive,ID,Barrenjoey - Barrenjoey to Warriewood,Warriewood Beach,2022-06-05T12:56:00Z,2022,6,DUS,FALSE,TRUE,FALSE,NSW-SMART-Shark-Management-Alert-in-Real-Time-Drumlines-Report-July-2021-June-2022.pdf
09/05/2022,7:54,Dusky Whaler,162,F,Alive,ID,Manly - Manly to Turimetta,Fairy Bower Beach,2022-05-09T07:54:00Z,2022,5,DUS,FALSE,TRUE,FALSE,NSW-SMART-Shark-Management-Alert-in-Real-Time-Drumlines-Report-July-2021-June-2022.pdf
14/06/2022,10:39,Dusky Whaler,130,M,Alive,ID,Manly - Manly to Turimetta,Fairy Bower Beach,2022-06-14T10:39:00Z,2022,6,DUS,FALSE,TRUE,FALSE,NSW-SMART-Shark-Management-Alert-in-Real-Time-Drumlines-Report-July-2021-June-2022.pdf
16/05/2022,9:36,Dusky Whaler,169,M,Alive,ID,Manly - Manly to Turimetta,Manly Beach,2022-05-16T09:36:00Z,2022,5,DUS,FALSE,TRUE,FALSE,NSW-SMART-Shark-Management-Alert-in-Real-Time-Drumlines-Report-July-2021-June-2022.pdf
25/05/2022,7:21,Dusky Whaler,170,M,Alive,ID,Manly - Manly to Turimetta,Manly Beach,2022-05-25T07:21:00Z,2022,5,DUS,FALSE,TRUE,FALSE,NSW-SMART-Shark-Management-Alert-in-Real-Time-Drumlines-Report-July-2021-June-2022.pdf
25/05/2022,11:00,Dusky Whaler,122,M,Alive,ID,Manly - Manly to Turimetta,North Steyne Beach,2022-05-25T11:00:00Z,2022,5,DUS,FALSE,TRUE,FALSE,NSW-SMART-Shark-Management-Alert-in-Real-Time-Drumlines-Report-July-2021-June-2022.pdf
25/03/2022,NA,Dusky Whaler,106,F,Alive,ID,Manly - Manly to Turimetta,Queenscliff Beach,NA,2022,3,DUS,FALSE,TRUE,FALSE,NSW-SMART-Shark-Management-Alert-in-Real-Time-Drumlines-Report-July-2021-June-2022.pdf
27/03/2022,15:56,Dusky Whaler,159,F,Alive,ID,Manly - Manly to Turimetta,Queenscliff Beach,2022-03-27T15:56:00Z,2022,3,DUS,FALSE,TRUE,FALSE,NSW-SMART-Shark-Management-Alert-in-Real-Time-Drumlines-Report-July-2021-June-2022.pdf
03/05/2022,15:54,Tiger Shark,157,M,Alive,"ID, A",Manly - Manly to Turimetta,Queenscliff Beach,2022-05-03T15:54:00Z,2022,5,TIG,TRUE,TRUE,TRUE,NSW-SMART-Shark-Management-Alert-in-Real-Time-Drumlines-Report-July-2021-June-2022.pdf
07/06/2022,11:30,Tiger Shark,210,F,Alive,"ID, A",Manly - Manly to Turimetta,Queenscliff Beach,2022-06-07T11:30:00Z,2022,6,TIG,TRUE,TRUE,TRUE,NSW-SMART-Shark-Management-Alert-in-Real-Time-Drumlines-Report-July-2021-June-2022.pdf
08/06/2022,9:15,Bronze Whaler,287,F,Alive,ID,Manly - Manly to Turimetta,Queenscliff Beach,2022-06-08T09:15:00Z,2022,6,BRO,FALSE,TRUE,FALSE,NSW-SMART-Shark-Management-Alert-in-Real-Time-Drumlines-Report-July-2021-June-2022.pdf
08/06/2022,13:00,Bronze Whaler,280,F,Alive,ID,Manly - Manly to Turimetta,Queenscliff Beach,2022-06-08T13:00:00Z,2022,6,BRO,FALSE,TRUE,FALSE,NSW-SMART-Shark-Management-Alert-in-Real-Time-Drumlines-Report-July-2021-June-2022.pdf
15/03/2022,10:31,Dusky Whaler,152,M,Alive,ID,Manly - Manly to Turimetta,Freshwater Beach,2022-03-15T10:31:00Z,2022,3,DUS,FALSE,TRUE,FALSE,NSW-SMART-Shark-Management-Alert-in-Real-Time-Drumlines-Report-July-2021-June-2022.pdf
21/03/2022,9:15,Dusky Whaler,133,F,Alive,ID,Manly - Manly to Turimetta,Freshwater Beach,2022-03-21T09:15:00Z,2022,3,DUS,FALSE,TRUE,FALSE,NSW-SMART-Shark-Management-Alert-in-Real-Time-Drumlines-Report-July-2021-June-2022.pdf
28/03/2022,12:31,Dusky Whaler,140,F,Alive,ID,Manly - Manly to Turimetta,Freshwater Beach,2022-03-28T12:31:00Z,2022,3,DUS,FALSE,TRUE,FALSE,NSW-SMART-Shark-Management-Alert-in-Real-Time-Drumlines-Report-July-2021-June-2022.pdf
15/04/2022,9:21,Dusky Whaler,152,F,Alive,ID,Manly - Manly to Turimetta,Freshwater Beach,2022-04-15T09:21:00Z,2022,4,DUS,FALSE,TRUE,FALSE,NSW-SMART-Shark-Management-Alert-in-Real-Time-Drumlines-Report-July-2021-June-2022.pdf
19/04/2022,7:27,Dusky Whaler,125,F,Alive,ID,Manly - Manly to Turimetta,Freshwater Beach,2022-04-19T07:27:00Z,2022,4,DUS,FALSE,TRUE,FALSE,NSW-SMART-Shark-Management-Alert-in-Real-Time-Drumlines-Report-July-2021-June-2022.pdf
27/04/2022,10:09,Tiger Shark,260,F,Alive,"ID, A",Manly - Manly to Turimetta,Freshwater Beach,2022-04-27T10:09:00Z,2022,4,TIG,TRUE,TRUE,TRUE,NSW-SMART-Shark-Management-Alert-in-Real-Time-Drumlines-Report-July-2021-June-2022.pdf
19/05/2022,NA,Dusky Whaler,119,F,Alive,ID,Manly - Manly to Turimetta,Freshwater Beach,NA,2022,5,DUS,FALSE,TRUE,FALSE,NSW-SMART-Shark-Management-Alert-in-Real-Time-Drumlines-Report-July-2021-June-2022.pdf
08/06/2022,7:27,Dusky Whaler,151,M,Alive,ID,Manly - Manly to Turimetta,Freshwater Beach,2022-06-08T07:27:00Z,2022,6,DUS,FALSE,TRUE,FALSE,NSW-SMART-Shark-Management-Alert-in-Real-Time-Drumlines-Report-July-2021-June-2022.pdf
17/06/2022,10:25,Shortfin Mako,185,M,Alive,ID,Manly - Manly to Turimetta,Freshwater Beach,2022-06-17T10:25:00Z,2022,6,SMA,FALSE,TRUE,FALSE,NSW-SMART-Shark-Management-Alert-in-Real-Time-Drumlines-Report-July-2021-June-2022.pdf
02/06/2022,14:49,Dusky Whaler,153,M,Alive,ID,Manly - Manly to Turimetta,South Curl Curl Beach,2022-06-02T14:49:00Z,2022,6,DUS,FALSE,TRUE,FALSE,NSW-SMART-Shark-Management-Alert-in-Real-Time-Drumlines-Report-July-2021-June-2022.pdf
18/06/2022,13:03,Dusky Whaler,210,F,Alive,ID,Manly - Manly to Turimetta,South Curl Curl Beach,2022-06-18T13:03:00Z,2022,6,DUS,FALSE,TRUE,FALSE,NSW-SMART-Shark-Management-Alert-in-Real-Time-Drumlines-Report-July-2021-June-2022.pdf
25/05/2022,9:45,Dusky Whaler,153,F,Alive,ID,Manly - Manly to Turimetta,Curl Curl Beach,2022-05-25T09:45:00Z,2022,5,DUS,FALSE,TRUE,FALSE,NSW-SMART-Shark-Management-Alert-in-Real-Time-Drumlines-Report-July-2021-June-2022.pdf
07/06/2022,14:12,Tiger Shark,227,F,Alive,"ID, A",Manly - Manly to Turimetta,Curl Curl Beach,2022-06-07T14:12:00Z,2022,6,TIG,TRUE,TRUE,TRUE,NSW-SMART-Shark-Management-Alert-in-Real-Time-Drumlines-Report-July-2021-June-2022.pdf
03/05/2022,14:15,Tiger Shark,198,M,Alive,"ID, A",Manly - Manly to Turimetta,North Curl Curl Beach,2022-05-03T14:15:00Z,2022,5,TIG,TRUE,TRUE,TRUE,NSW-SMART-Shark-Management-Alert-in-Real-Time-Drumlines-Report-July-2021-June-2022.pdf
15/03/2022,10:01,Dusky Whaler,179,F,Alive,ID,Manly - Manly to Turimetta,Dee Why Beach,2022-03-15T10:01:00Z,2022,3,DUS,FALSE,TRUE,FALSE,NSW-SMART-Shark-Management-Alert-in-Real-Time-Drumlines-Report-July-2021-June-2022.pdf
20/03/2022,14:07,Dusky Whaler,155,F,Alive,ID,Manly - Manly to Turimetta,Dee Why Beach,2022-03-20T14:07:00Z,2022,3,DUS,FALSE,TRUE,FALSE,NSW-SMART-Shark-Management-Alert-in-Real-Time-Drumlines-Report-July-2021-June-2022.pdf
27/04/2022,14:06,Dusky Whaler,152,F,Alive,ID,Manly - Manly to Turimetta,Dee Why Beach,2022-04-27T14:06:00Z,2022,4,DUS,FALSE,TRUE,FALSE,NSW-SMART-Shark-Management-Alert-in-Real-Time-Drumlines-Report-July-2021-June-2022.pdf
27/05/2022,13:12,Dusky Whaler,165,M,Alive,ID,Manly - Manly to Turimetta,Dee Why Beach,2022-05-27T13:12:00Z,2022,5,DUS,FALSE,TRUE,FALSE,NSW-SMART-Shark-Management-Alert-in-Real-Time-Drumlines-Report-July-2021-June-2022.pdf
30/05/2022,10:42,Dusky Whaler,132,M,Alive,ID,Manly - Manly to Turimetta,Dee Why Beach,2022-05-30T10:42:00Z,2022,5,DUS,FALSE,TRUE,FALSE,NSW-SMART-Shark-Management-Alert-in-Real-Time-Drumlines-Report-July-2021-June-2022.pdf
31/05/2022,14:58,Dusky Whaler,135,M,Alive,ID,Manly - Manly to Turimetta,Dee Why Beach,2022-05-31T14:58:00Z,2022,5,DUS,FALSE,TRUE,FALSE,NSW-SMART-Shark-Management-Alert-in-Real-Time-Drumlines-Report-July-2021-June-2022.pdf
04/06/2022,11:55,Dusky Whaler,146,M,Alive,ID,Manly - Manly to Turimetta,Dee Why Beach,2022-06-04T11:55:00Z,2022,6,DUS,FALSE,TRUE,FALSE,NSW-SMART-Shark-Management-Alert-in-Real-Time-Drumlines-Report-July-2021-June-2022.pdf
09/06/2022,8:36,Dusky Whaler,140,M,Alive,ID,Manly - Manly to Turimetta,Dee Why Beach,2022-06-09T08:36:00Z,2022,6,DUS,FALSE,TRUE,FALSE,NSW-SMART-Shark-Management-Alert-in-Real-Time-Drumlines-Report-July-2021-June-2022.pdf
15/03/2022,8:22,Dusky Whaler,151,F,Alive,ID,Manly - Manly to Turimetta,Long Reef Beach,2022-03-15T08:22:00Z,2022,3,DUS,FALSE,TRUE,FALSE,NSW-SMART-Shark-Management-Alert-in-Real-Time-Drumlines-Report-July-2021-June-2022.pdf
16/04/2022,11:39,Dusky Whaler,155,F,Alive,ID,Manly - Manly to Turimetta,Long Reef Beach,2022-04-16T11:39:00Z,2022,4,DUS,FALSE,TRUE,FALSE,NSW-SMART-Shark-Management-Alert-in-Real-Time-Drumlines-Report-July-2021-June-2022.pdf
21/05/2022,8:15,Dusky Whaler,164,F,Alive,ID,Manly - Manly to Turimetta,Long Reef Beach,2022-05-21T08:15:00Z,2022,5,DUS,FALSE,TRUE,FALSE,NSW-SMART-Shark-Management-Alert-in-Real-Time-Drumlines-Report-July-2021-June-2022.pdf
04/05/2022,10:18,Dusky Whaler,129,M,Alive,ID,Manly - Manly to Turimetta,Collaroy Beach,2022-05-04T10:18:00Z,2022,5,DUS,FALSE,TRUE,FALSE,NSW-SMART-Shark-Management-Alert-in-Real-Time-Drumlines-Report-July-2021-June-2022.pdf
27/05/2022,10:33,Dusky Whaler,146,F,Alive,ID,Manly - Manly to Turimetta,Narrabeen Beach,2022-05-27T10:33:00Z,2022,5,DUS,FALSE,TRUE,FALSE,NSW-SMART-Shark-Management-Alert-in-Real-Time-Drumlines-Report-July-2021-June-2022.pdf
13/03/2022,12:22,Dusky Whaler,148,F,Alive,ID,Manly - Manly to Turimetta,Turimetta Beach,2022-03-13T12:22:00Z,2022,3,DUS,FALSE,TRUE,FALSE,NSW-SMART-Shark-Management-Alert-in-Real-Time-Drumlines-Report-July-2021-June-2022.pdf
16/03/2022,8:41,Dusky Whaler,132,F,Alive,ID,Manly - Manly to Turimetta,Turimetta Beach,2022-03-16T08:41:00Z,2022,3,DUS,FALSE,TRUE,FALSE,NSW-SMART-Shark-Management-Alert-in-Real-Time-Drumlines-Report-July-2021-June-2022.pdf
10/04/2022,10:37,Dusky Whaler,198,F,Alive,ID,Manly - Manly to Turimetta,Turimetta Beach,2022-04-10T10:37:00Z,2022,4,DUS,FALSE,TRUE,FALSE,NSW-SMART-Shark-Management-Alert-in-Real-Time-Drumlines-Report-July-2021-June-2022.pdf
16/04/2022,10:57,Dusky Whaler,159,F,Alive,ID,Manly - Manly to Turimetta,Turimetta Beach,2022-04-16T10:57:00Z,2022,4,DUS,FALSE,TRUE,FALSE,NSW-SMART-Shark-Management-Alert-in-Real-Time-Drumlines-Report-July-2021-June-2022.pdf
18/04/2022,10:13,Dusky Whaler,150,F,Alive,ID,Manly - Manly to Turimetta,Turimetta Beach,2022-04-18T10:13:00Z,2022,4,DUS,FALSE,TRUE,FALSE,NSW-SMART-Shark-Management-Alert-in-Real-Time-Drumlines-Report-July-2021-June-2022.pdf
26/04/2022,12:54,Dusky Whaler,186,F,Alive,ID,Manly - Manly to Turimetta,Turimetta Beach,2022-04-26T12:54:00Z,2022,4,DUS,FALSE,TRUE,FALSE,NSW-SMART-Shark-Management-Alert-in-Real-Time-Drumlines-Report-July-2021-June-2022.pdf
23/06/2022,11:06,Dusky Whaler,146,F,Alive,ID,Manly - Manly to Turimetta,Turimetta Beach,2022-06-23T11:06:00Z,2022,6,DUS,FALSE,TRUE,FALSE,NSW-SMART-Shark-Management-Alert-in-Real-Time-Drumlines-Report-July-2021-June-2022.pdf
14/06/2022,12:12,Dusky Whaler,140,F,Alive,ID,Bondi - Bondi to Little Bay,Malabar Beach,2022-06-14T12:12:00Z,2022,6,DUS,FALSE,TRUE,FALSE,NSW-SMART-Shark-Management-Alert-in-Real-Time-Drumlines-Report-July-2021-June-2022.pdf
17/06/2022,11:01,Bronze Whaler,313,F,Alive,ID,Bondi - Bondi to Little Bay,Malabar Beach,2022-06-17T11:01:00Z,2022,6,BRO,FALSE,TRUE,FALSE,NSW-SMART-Shark-Management-Alert-in-Real-Time-Drumlines-Report-July-2021-June-2022.pdf
15/03/2022,9:58,Dusky Whaler,142,F,Alive,ID,Bondi - Bondi to Little Bay,Maroubra Beach,2022-03-15T09:58:00Z,2022,3,DUS,FALSE,TRUE,FALSE,NSW-SMART-Shark-Management-Alert-in-Real-Time-Drumlines-Report-July-2021-June-2022.pdf
27/03/2022,10:43,Dusky Whaler,130,F,Alive,ID,Bondi - Bondi to Little Bay,Maroubra Beach,2022-03-27T10:43:00Z,2022,3,DUS,FALSE,TRUE,FALSE,NSW-SMART-Shark-Management-Alert-in-Real-Time-Drumlines-Report-July-2021-June-2022.pdf
29/03/2022,10:46,Tiger Shark,270,F,Alive,"ID, A",Bondi - Bondi to Little Bay,Maroubra Beach,2022-03-29T10:46:00Z,2022,3,TIG,TRUE,TRUE,TRUE,NSW-SMART-Shark-Management-Alert-in-Real-Time-Drumlines-Report-July-2021-June-2022.pdf
17/04/2022,8:06,Tiger Shark,165,M,Alive,"ID, A",Bondi - Bondi to Little Bay,Maroubra Beach,2022-04-17T08:06:00Z,2022,4,TIG,TRUE,TRUE,TRUE,NSW-SMART-Shark-Management-Alert-in-Real-Time-Drumlines-Report-July-2021-June-2022.pdf
5/06/2022,9:51,Tiger Shark,156,M,Alive,"ID, A",Bondi - Bondi to Little Bay,Maroubra Beach,2022-06-05T09:51:00Z,2022,6,TIG,TRUE,TRUE,TRUE,NSW-SMART-Shark-Management-Alert-in-Real-Time-Drumlines-Report-July-2021-June-2022.pdf
7/06/2022,8:52,Tiger Shark,235,F,Alive,"ID, A",Bondi - Bondi to Little Bay,Maroubra Beach,2022-06-07T08:52:00Z,2022,6,TIG,TRUE,TRUE,TRUE,NSW-SMART-Shark-Management-Alert-in-Real-Time-Drumlines-Report-July-2021-June-2022.pdf
9/06/2022,10:18,Tiger Shark,310,F,Alive,"ID, A",Bondi - Bondi to Little Bay,Maroubra Beach,2022-06-09T10:18:00Z,2022,6,TIG,TRUE,TRUE,TRUE,NSW-SMART-Shark-Management-Alert-in-Real-Time-Drumlines-Report-July-2021-June-2022.pdf
13/03/2022,12:06,Tiger Shark,191,F,Alive,"ID, A",Bondi - Bondi to Little Bay,Coogee Beach,2022-03-13T12:06:00Z,2022,3,TIG,TRUE,TRUE,TRUE,NSW-SMART-Shark-Management-Alert-in-Real-Time-Drumlines-Report-July-2021-June-2022.pdf
25/03/2022,9:00,Dusky Whaler,159,M,Alive,ID,Bondi - Bondi to Little Bay,Coogee Beach,2022-03-25T09:00:00Z,2022,3,DUS,FALSE,TRUE,FALSE,NSW-SMART-Shark-Management-Alert-in-Real-Time-Drumlines-Report-July-2021-June-2022.pdf
14/04/2022,11:06,Dusky Whaler,150,F,Alive,ID,Bondi - Bondi to Little Bay,Coogee Beach,2022-04-14T11:06:00Z,2022,4,DUS,FALSE,TRUE,FALSE,NSW-SMART-Shark-Management-Alert-in-Real-Time-Drumlines-Report-July-2021-June-2022.pdf
17/04/2022,8:21,Dusky Whaler,145,F,Alive,ID,Bondi - Bondi to Little Bay,Coogee Beach,2022-04-17T08:21:00Z,2022,4,DUS,FALSE,TRUE,FALSE,NSW-SMART-Shark-Management-Alert-in-Real-Time-Drumlines-Report-July-2021-June-2022.pdf
19/04/2022,8:39,Tiger Shark,360,F,Alive,"ID, A",Bondi - Bondi to Little Bay,Coogee Beach,2022-04-19T08:39:00Z,2022,4,TIG,TRUE,TRUE,TRUE,NSW-SMART-Shark-Management-Alert-in-Real-Time-Drumlines-Report-July-2021-June-2022.pdf
8/05/2022,13:54,Dusky Whaler,147,M,Alive,ID,Bondi - Bondi to Little Bay,Coogee Beach,2022-05-08T13:54:00Z,2022,5,DUS,FALSE,TRUE,FALSE,NSW-SMART-Shark-Management-Alert-in-Real-Time-Drumlines-Report-July-2021-June-2022.pdf
19/05/2022,11:25,Tiger Shark,167,F,Alive,"ID, A",Bondi - Bondi to Little Bay,Coogee Beach,2022-05-19T11:25:00Z,2022,5,TIG,TRUE,TRUE,TRUE,NSW-SMART-Shark-Management-Alert-in-Real-Time-Drumlines-Report-July-2021-June-2022.pdf
4/06/2022,7:50,Dusky Whaler,150,M,Alive,ID,Bondi - Bondi to Little Bay,Coogee Beach,2022-06-04T07:50:00Z,2022,6,DUS,FALSE,TRUE,FALSE,NSW-SMART-Shark-Management-Alert-in-Real-Time-Drumlines-Report-July-2021-June-2022.pdf
1/06/2022,10:20,Tiger Shark,254,F,Alive,"ID, A",Bondi - Bondi to Little Bay,Clovelly Beach,2022-06-01T10:20:00Z,2022,6,TIG,TRUE,TRUE,TRUE,NSW-SMART-Shark-Management-Alert-in-Real-Time-Drumlines-Report-July-2021-June-2022.pdf
16/06/2022,8:33,Bronze Whaler,290,F,Alive,ID,Bondi - Bondi to Little Bay,Clovelly Beach,2022-06-16T08:33:00Z,2022,6,BRO,FALSE,TRUE,FALSE,NSW-SMART-Shark-Management-Alert-in-Real-Time-Drumlines-Report-July-2021-June-2022.pdf
22/06/2022,9:45,Tiger Shark,389,F,Alive,"ID, A",Bondi - Bondi to Little Bay,Clovelly Beach,2022-06-22T09:45:00Z,2022,6,TIG,TRUE,TRUE,TRUE,NSW-SMART-Shark-Management-Alert-in-Real-Time-Drumlines-Report-July-2021-June-2022.pdf
20/03/2022,12:52,Smooth Hammerhead,NA,NA,Alive,-,Bondi - Bondi to Little Bay,Bronte Beach,2022-03-20T12:52:00Z,2022,3,SMH,FALSE,FALSE,FALSE,NSW-SMART-Shark-Management-Alert-in-Real-Time-Drumlines-Report-July-2021-June-2022.pdf
3/05/2022,13:16,Tiger Shark,205,M,Alive,"ID, A",Bondi - Bondi to Little Bay,Bronte Beach,2022-05-03T13:16:00Z,2022,5,TIG,TRUE,TRUE,TRUE,NSW-SMART-Shark-Management-Alert-in-Real-Time-Drumlines-Report-July-2021-June-2022.pdf
5/05/2022,12:39,Tiger Shark,212,M,Alive,"ID, A",Bondi - Bondi to Little Bay,Bronte Beach,2022-05-05T12:39:00Z,2022,5,TIG,TRUE,TRUE,TRUE,NSW-SMART-Shark-Management-Alert-in-Real-Time-Drumlines-Report-July-2021-June-2022.pdf
25/05/2022,10:24,Tiger Shark,245,F,Alive,"ID, A",Bondi - Bondi to Little Bay,Bronte Beach,2022-05-25T10:24:00Z,2022,5,TIG,TRUE,TRUE,TRUE,NSW-SMART-Shark-Management-Alert-in-Real-Time-Drumlines-Report-July-2021-June-2022.pdf
19/06/2022,10:24,Dusky Whaler,159,M,Alive,ID,Bondi - Bondi to Little Bay,Bronte Beach,2022-06-19T10:24:00Z,2022,6,DUS,FALSE,TRUE,FALSE,NSW-SMART-Shark-Management-Alert-in-Real-Time-Drumlines-Report-July-2021-June-2022.pdf
21/05/2022,10:48,White Shark,242,F,Alive,"ID, A",Bondi - Bondi to Little Bay,Tamarama Beach,2022-05-21T10:48:00Z,2022,5,WHI,TRUE,TRUE,TRUE,NSW-SMART-Shark-Management-Alert-in-Real-Time-Drumlines-Report-July-2021-June-2022.pdf
17/03/2022,7:28,Dusky Whaler,159,F,Alive,ID,Bondi - Bondi to Little Bay,Bondi Beach,2022-03-17T07:28:00Z,2022,3,DUS,FALSE,TRUE,FALSE,NSW-SMART-Shark-Management-Alert-in-Real-Time-Drumlines-Report-July-2021-June-2022.pdf
25/04/2022,8:15,Dusky Whaler,150,F,Alive,ID,Bondi - Bondi to Little Bay,Bondi Beach,2022-04-25T08:15:00Z,2022,4,DUS,FALSE,TRUE,FALSE,NSW-SMART-Shark-Management-Alert-in-Real-Time-Drumlines-Report-July-2021-June-2022.pdf
3/05/2022,11:27,Tiger Shark,145,F,Alive,"ID, A",Bondi - Bondi to Little Bay,Bondi Beach,2022-05-03T11:27:00Z,2022,5,TIG,TRUE,TRUE,TRUE,NSW-SMART-Shark-Management-Alert-in-Real-Time-Drumlines-Report-July-2021-June-2022.pdf
5/05/2022,8:39,Shortfin Mako,160,M,Alive,ID,Bondi - Bondi to Little Bay,Bondi Beach,2022-05-05T08:39:00Z,2022,5,SMA,FALSE,TRUE,FALSE,NSW-SMART-Shark-Management-Alert-in-Real-Time-Drumlines-Report-July-2021-June-2022.pdf
19/05/2022,15:39,Dusky Whaler,192,F,Alive,ID,Bondi - Bondi to Little Bay,Bondi Beach,2022-05-19T15:39:00Z,2022,5,DUS,FALSE,TRUE,FALSE,NSW-SMART-Shark-Management-Alert-in-Real-Time-Drumlines-Report-July-2021-June-2022.pdf
27/05/2022,12:21,Dusky Whaler,163,M,Alive,ID,Bondi - Bondi to Little Bay,Bondi Beach,2022-05-27T12:21:00Z,2022,5,DUS,FALSE,TRUE,FALSE,NSW-SMART-Shark-Management-Alert-in-Real-Time-Drumlines-Report-July-2021-June-2022.pdf
14/06/2022,10:06,Tiger Shark,258,F,Alive,"ID, A",Sutherland,Shark Island,2022-06-14T10:06:00Z,2022,6,TIG,TRUE,TRUE,TRUE,NSW-SMART-Shark-Management-Alert-in-Real-Time-Drumlines-Report-July-2021-June-2022.pdf
20/06/2022,8:30,White Shark,225,F,Alive,"ID, A",Sutherland,Shark Island,2022-06-20T08:30:00Z,2022,6,WHI,TRUE,TRUE,TRUE,NSW-SMART-Shark-Management-Alert-in-Real-Time-Drumlines-Report-July-2021-June-2022.pdf
07/05/2022,14:03,Shortfin Mako,117,F,Alive,ID,Sutherland,South Cronulla Beach,2022-05-07T14:03:00Z,2022,5,SMA,FALSE,TRUE,FALSE,NSW-SMART-Shark-Management-Alert-in-Real-Time-Drumlines-Report-July-2021-June-2022.pdf
22/06/2022,15:19,Bronze Whaler,268,F,Alive,ID,Sutherland,South Cronulla Beach,2022-06-22T15:19:00Z,2022,6,BRO,FALSE,TRUE,FALSE,NSW-SMART-Shark-Management-Alert-in-Real-Time-Drumlines-Report-July-2021-June-2022.pdf
10/06/2022,9:34,Bronze Whaler,272,F,Alive,ID,Sutherland,Elouera Beach,2022-06-10T09:34:00Z,2022,6,BRO,FALSE,TRUE,FALSE,NSW-SMART-Shark-Management-Alert-in-Real-Time-Drumlines-Report-July-2021-June-2022.pdf
17/03/2022,NA,Tailor,42,NA,Dead,-,Sutherland,Wanda Beach,NA,2022,3,TLR,FALSE,FALSE,FALSE,NSW-SMART-Shark-Management-Alert-in-Real-Time-Drumlines-Report-July-2021-June-2022.pdf
12/04/2022,NA,Tailor,44,NA,Dead,-,Sutherland,Wanda Beach,NA,2022,4,TLR,FALSE,FALSE,FALSE,NSW-SMART-Shark-Management-Alert-in-Real-Time-Drumlines-Report-July-2021-June-2022.pdf
30/05/2022,13:15,Black/Bull Ray,200,F,Alive,-,Sutherland,Wanda Beach,2022-05-30T13:15:00Z,2022,5,BLR,FALSE,FALSE,FALSE,NSW-SMART-Shark-Management-Alert-in-Real-Time-Drumlines-Report-July-2021-June-2022.pdf
04/06/2022,NA,Dusky Whaler,111,F,Alive,ID,Sutherland,Wanda Beach,NA,2022,6,DUS,FALSE,TRUE,FALSE,NSW-SMART-Shark-Management-Alert-in-Real-Time-Drumlines-Report-July-2021-June-2022.pdf
10/06/2022,NA,Dusky Whaler,116,F,Alive,ID,Sutherland,Wanda Beach,NA,2022,6,DUS,FALSE,TRUE,FALSE,NSW-SMART-Shark-Management-Alert-in-Real-Time-Drumlines-Report-July-2021-June-2022.pdf
26/04/2022,8:48,Tiger Shark,177,F,Alive,"ID, A",Wollongong,Wollongong Beach,2022-04-26T08:48:00Z,2022,4,TIG,TRUE,TRUE,TRUE,NSW-SMART-Shark-Management-Alert-in-Real-Time-Drumlines-Report-July-2021-June-2022.pdf
29/04/2022,12:00,Tiger Shark,148,F,Alive,"ID, A",Wollongong,Wollongong Beach,2022-04-29T12:00:00Z,2022,4,TIG,TRUE,TRUE,TRUE,NSW-SMART-Shark-Management-Alert-in-Real-Time-Drumlines-Report-July-2021-June-2022.pdf
12/04/2022,NA,Dusky Whaler,94,M,Alive,ID,Wollongong,Puckeys Beach,NA,2022,4,DUS,FALSE,TRUE,FALSE,NSW-SMART-Shark-Management-Alert-in-Real-Time-Drumlines-Report-July-2021-June-2022.pdf
09/05/2022,9:00,Shortfin Mako,146,F,Alive,ID,Wollongong,Puckeys Beach,2022-05-09T09:00:00Z,2022,5,SMA,FALSE,TRUE,FALSE,NSW-SMART-Shark-Management-Alert-in-Real-Time-Drumlines-Report-July-2021-June-2022.pdf
28/05/2022,15:54,Dusky Whaler,225,F,Alive,ID,Wollongong,Corrimal Beach,2022-05-28T15:54:00Z,2022,5,DUS,FALSE,TRUE,FALSE,NSW-SMART-Shark-Management-Alert-in-Real-Time-Drumlines-Report-July-2021-June-2022.pdf
08/06/2022,9:19,Bronze Whaler,230,F,Alive,ID,Wollongong,Corrimal Beach,2022-06-08T09:19:00Z,2022,6,BRO,FALSE,TRUE,FALSE,NSW-SMART-Shark-Management-Alert-in-Real-Time-Drumlines-Report-July-2021-June-2022.pdf
15/06/2022,12:23,Black/Bull Ray,150,NA,Alive,-,Wollongong,Bellambi Beach,2022-06-15T12:23:00Z,2022,6,BLR,FALSE,FALSE,FALSE,NSW-SMART-Shark-Management-Alert-in-Real-Time-Drumlines-Report-July-2021-June-2022.pdf
28/04/2022,8:05,Shortfin Mako,123,M,Alive,ID,Wollongong,Bulli Beach,2022-04-28T08:05:00Z,2022,4,SMA,FALSE,TRUE,FALSE,NSW-SMART-Shark-Management-Alert-in-Real-Time-Drumlines-Report-July-2021-June-2022.pdf
25/05/2022,NA,Dusky Whaler,100,M,Alive,ID,Wollongong,Bulli Beach,NA,2022,5,DUS,FALSE,TRUE,FALSE,NSW-SMART-Shark-Management-Alert-in-Real-Time-Drumlines-Report-July-2021-June-2022.pdf
29/05/2022,13:22,Dusky Whaler,227,F,Alive,ID,Wollongong,Bulli Beach,2022-05-29T13:22:00Z,2022,5,DUS,FALSE,TRUE,FALSE,NSW-SMART-Shark-Management-Alert-in-Real-Time-Drumlines-Report-July-2021-June-2022.pdf
15/06/2022,9:12,Bronze Whaler,211,F,Alive,ID,Wollongong,Bulli Beach,2022-06-15T09:12:00Z,2022,6,BRO,FALSE,TRUE,FALSE,NSW-SMART-Shark-Management-Alert-in-Real-Time-Drumlines-Report-July-2021-June-2022.pdf
23/05/2022,NA,Dusky Whaler,96,F,Alive,ID,Wollongong,Sandon Point Beach,NA,2022,5,DUS,FALSE,TRUE,FALSE,NSW-SMART-Shark-Management-Alert-in-Real-Time-Drumlines-Report-July-2021-June-2022.pdf
15/06/2022,10:45,Bronze Whaler,200,F,Alive,ID,Wollongong,Sandon Point Beach,2022-06-15T10:45:00Z,2022,6,BRO,FALSE,TRUE,FALSE,NSW-SMART-Shark-Management-Alert-in-Real-Time-Drumlines-Report-July-2021-June-2022.pdf
23/06/2022,13:19,Black/Bull Ray,150,NA,Alive,-,Wollongong,Sandon Point Beach,2022-06-23T13:19:00Z,2022,6,BLR,FALSE,FALSE,FALSE,NSW-SMART-Shark-Management-Alert-in-Real-Time-Drumlines-Report-July-2021-June-2022.pdf
18/05/2022,7:31,Greynurse Shark,260,M,Alive,ID,Wollongong,Thirroul Beach,2022-05-18T07:31:00Z,2022,5,GRN,FALSE,TRUE,FALSE,NSW-SMART-Shark-Management-Alert-in-Real-Time-Drumlines-Report-July-2021-June-2022.pdf
24/06/2022,14:52,Sevengill Shark,205,M,Alive,ID,Wollongong,Thirroul Beach,2022-06-24T14:52:00Z,2022,6,SVG,FALSE,TRUE,FALSE,NSW-SMART-Shark-Management-Alert-in-Real-Time-Drumlines-Report-July-2021-June-2022.pdf
05/06/2022,9:01,Bronze Whaler,250,F,Alive,ID,Wollongong,Austinmer Beach,2022-06-05T09:01:00Z,2022,6,BRO,FALSE,TRUE,FALSE,NSW-SMART-Shark-Management-Alert-in-Real-Time-Drumlines-Report-July-2021-June-2022.pdf
04/06/2022,9:10,Bronze Whaler,235,F,Alive,ID,Wollongong,Little Austinmer Beach,2022-06-04T09:10:00Z,2022,6,BRO,FALSE,TRUE,FALSE,NSW-SMART-Shark-Management-Alert-in-Real-Time-Drumlines-Report-July-2021-June-2022.pdf
27/05/2022,10:16,Tiger Shark,350,F,Alive,"ID, A",Wollongong,Sharky Beach,2022-05-27T10:16:00Z,2022,5,TIG,TRUE,TRUE,TRUE,NSW-SMART-Shark-Management-Alert-in-Real-Time-Drumlines-Report-July-2021-June-2022.pdf
26/04/2022,13:13,Shortfin Mako,139,F,Alive,ID,Wollongong,Coledale Beach,2022-04-26T13:13:00Z,2022,4,SMA,FALSE,TRUE,FALSE,NSW-SMART-Shark-Management-Alert-in-Real-Time-Drumlines-Report-July-2021-June-2022.pdf
26/05/2022,10:03,Smooth Hammerhead,172,F,Alive,ID,Shellharbour - Windang to Minnamurra,Warilla Beach,2022-05-26T10:03:00Z,2022,5,SMH,FALSE,TRUE,FALSE,NSW-SMART-Shark-Management-Alert-in-Real-Time-Drumlines-Report-July-2021-June-2022.pdf
02/06/2022,8:12,Bronze Whaler,276,F,Alive,ID,Shellharbour - Windang to Minnamurra,Warilla Beach,2022-06-02T08:12:00Z,2022,6,BRO,FALSE,TRUE,FALSE,NSW-SMART-Shark-Management-Alert-in-Real-Time-Drumlines-Report-July-2021-June-2022.pdf
10/06/2022,12:12,White Shark,217,M,Alive,"ID, A",Shellharbour - Windang to Minnamurra,Warilla Beach,2022-06-10T12:12:00Z,2022,6,WHI,TRUE,TRUE,TRUE,NSW-SMART-Shark-Management-Alert-in-Real-Time-Drumlines-Report-July-2021-June-2022.pdf
05/04/2022,10:14,Tiger Shark,260,M,Alive,"ID, A",Shellharbour - Windang to Minnamurra,Perkins Beach,2022-04-05T10:14:00Z,2022,4,TIG,TRUE,TRUE,TRUE,NSW-SMART-Shark-Management-Alert-in-Real-Time-Drumlines-Report-July-2021-June-2022.pdf
14/06/2022,9:02,Sevengill Shark,207,M,Alive,ID,Shellharbour - Windang to Minnamurra,Perkins Beach,2022-06-14T09:02:00Z,2022,6,SVG,FALSE,TRUE,FALSE,NSW-SMART-Shark-Management-Alert-in-Real-Time-Drumlines-Report-July-2021-June-2022.pdf
17/06/2022,10:04,Bronze Whaler,260,F,Alive,ID,Shellharbour - Windang to Minnamurra,Perkins Beach,2022-06-17T10:04:00Z,2022,6,BRO,FALSE,TRUE,FALSE,NSW-SMART-Shark-Management-Alert-in-Real-Time-Drumlines-Report-July-2021-June-2022.pdf
22/06/2022,14:14,White Shark,227,F,Alive,"ID, A",Shellharbour - Windang to Minnamurra,Perkins Beach,2022-06-22T14:14:00Z,2022,6,WHI,TRUE,TRUE,TRUE,NSW-SMART-Shark-Management-Alert-in-Real-Time-Drumlines-Report-July-2021-June-2022.pdf
26/03/2022,8:13,Whaler - unidentified,NA,NA,Alive,-,Kiama - Jones Beach to Gerringong,Werri Beach,2022-03-26T08:13:00Z,2022,3,WHL,FALSE,FALSE,FALSE,NSW-SMART-Shark-Management-Alert-in-Real-Time-Drumlines-Report-July-2021-June-2022.pdf
27/03/2022,17:03,Tiger Shark,132,M,Alive,"ID, A",Kiama - Jones Beach to Gerringong,Werri Beach,2022-03-27T17:03:00Z,2022,3,TIG,TRUE,TRUE,TRUE,NSW-SMART-Shark-Management-Alert-in-Real-Time-Drumlines-Report-July-2021-June-2022.pdf
04/04/2022,8:55,Dusky Whaler,148,F,Alive,ID,Kiama - Jones Beach to Gerringong,Werri Beach,2022-04-04T08:55:00Z,2022,4,DUS,FALSE,TRUE,FALSE,NSW-SMART-Shark-Management-Alert-in-Real-Time-Drumlines-Report-July-2021-June-2022.pdf
04/04/2022,14:22,Dusky Whaler,216,M,Alive,ID,Kiama - Jones Beach to Gerringong,Werri Beach,2022-04-04T14:22:00Z,2022,4,DUS,FALSE,TRUE,FALSE,NSW-SMART-Shark-Management-Alert-in-Real-Time-Drumlines-Report-July-2021-June-2022.pdf
01/05/2022,11:35,Dusky Whaler,147,F,Alive,ID,Kiama - Jones Beach to Gerringong,Werri Beach,2022-05-01T11:35:00Z,2022,5,DUS,FALSE,TRUE,FALSE,NSW-SMART-Shark-Management-Alert-in-Real-Time-Drumlines-Report-July-2021-June-2022.pdf
01/05/2022,11:49,Dusky Whaler,200,M,Alive,ID,Kiama - Jones Beach to Gerringong,Werri Beach,2022-05-01T11:49:00Z,2022,5,DUS,FALSE,TRUE,FALSE,NSW-SMART-Shark-Management-Alert-in-Real-Time-Drumlines-Report-July-2021-June-2022.pdf
07/05/2022,13:31,Dusky Whaler,235,F,Alive,ID,Kiama - Jones Beach to Gerringong,Werri Beach,2022-05-07T13:31:00Z,2022,5,DUS,FALSE,TRUE,FALSE,NSW-SMART-Shark-Management-Alert-in-Real-Time-Drumlines-Report-July-2021-June-2022.pdf
10/05/2022,8:57,Dusky Whaler,220,F,Alive,ID,Kiama - Jones Beach to Gerringong,Werri Beach,2022-05-10T08:57:00Z,2022,5,DUS,FALSE,TRUE,FALSE,NSW-SMART-Shark-Management-Alert-in-Real-Time-Drumlines-Report-July-2021-June-2022.pdf
10/05/2022,10:45,White Shark,146,F,Alive,"ID, A",Kiama - Jones Beach to Gerringong,Werri Beach,2022-05-10T10:45:00Z,2022,5,WHI,TRUE,TRUE,TRUE,NSW-SMART-Shark-Management-Alert-in-Real-Time-Drumlines-Report-July-2021-June-2022.pdf
22/05/2022,10:21,Dusky Whaler,153,M,Alive,ID,Kiama - Jones Beach to Gerringong,Werri Beach,2022-05-22T10:21:00Z,2022,5,DUS,FALSE,TRUE,FALSE,NSW-SMART-Shark-Management-Alert-in-Real-Time-Drumlines-Report-July-2021-June-2022.pdf
25/05/2022,12:09,Dusky Whaler,170,F,Alive,ID,Kiama - Jones Beach to Gerringong,Werri Beach,2022-05-25T12:09:00Z,2022,5,DUS,FALSE,TRUE,FALSE,NSW-SMART-Shark-Management-Alert-in-Real-Time-Drumlines-Report-July-2021-June-2022.pdf
25/05/2022,13:30,Dusky Whaler,177,M,Alive,ID,Kiama - Jones Beach to Gerringong,Werri Beach,2022-05-25T13:30:00Z,2022,5,DUS,FALSE,TRUE,FALSE,NSW-SMART-Shark-Management-Alert-in-Real-Time-Drumlines-Report-July-2021-June-2022.pdf
26/05/2022,13:43,Dusky Whaler,210,F,Alive,ID,Kiama - Jones Beach to Gerringong,Werri Beach,2022-05-26T13:43:00Z,2022,5,DUS,FALSE,TRUE,FALSE,NSW-SMART-Shark-Management-Alert-in-Real-Time-Drumlines-Report-July-2021-June-2022.pdf
15/06/2022,9:06,Sevengill Shark,210,M,Alive,ID,Kiama - Jones Beach to Gerringong,Werri Beach,2022-06-15T09:06:00Z,2022,6,SVG,FALSE,TRUE,FALSE,NSW-SMART-Shark-Management-Alert-in-Real-Time-Drumlines-Report-July-2021-June-2022.pdf
17/06/2022,10:25,Bronze Whaler,280,F,Alive,ID,Kiama - Jones Beach to Gerringong,Werri Beach,2022-06-17T10:25:00Z,2022,6,BRO,FALSE,TRUE,FALSE,NSW-SMART-Shark-Management-Alert-in-Real-Time-Drumlines-Report-July-2021-June-2022.pdf
23/06/2022,NA,Shortfin Mako,110,F,Alive,ID,Kiama - Jones Beach to Gerringong,Werri Beach,NA,2022,6,SMA,FALSE,TRUE,FALSE,NSW-SMART-Shark-Management-Alert-in-Real-Time-Drumlines-Report-July-2021-June-2022.pdf
24/06/2022,11:21,Bronze Whaler,211,F,Alive,ID,Kiama - Jones Beach to Gerringong,Werri Beach,2022-06-24T11:21:00Z,2022,6,BRO,FALSE,TRUE,FALSE,NSW-SMART-Shark-Management-Alert-in-Real-Time-Drumlines-Report-July-2021-June-2022.pdf
21/05/2022,10:01,Dusky Whaler,202,F,Alive,ID,Kiama - Jones Beach to Gerringong,Easts Beach,2022-05-21T10:01:00Z,2022,5,DUS,FALSE,TRUE,FALSE,NSW-SMART-Shark-Management-Alert-in-Real-Time-Drumlines-Report-July-2021-June-2022.pdf
21/05/2022,11:31,Dusky Whaler,210,F,Alive,ID,Kiama - Jones Beach to Gerringong,Easts Beach,2022-05-21T11:31:00Z,2022,5,DUS,FALSE,TRUE,FALSE,NSW-SMART-Shark-Management-Alert-in-Real-Time-Drumlines-Report-July-2021-June-2022.pdf
10/06/2022,8:15,Bronze Whaler,240,F,Alive,ID,Kiama - Jones Beach to Gerringong,Easts Beach,2022-06-10T08:15:00Z,2022,6,BRO,FALSE,TRUE,FALSE,NSW-SMART-Shark-Management-Alert-in-Real-Time-Drumlines-Report-July-2021-June-2022.pdf
27/05/2022,NA,Tiger Shark,146,F,Alive,"ID, A",Kiama - Jones Beach to Gerringong,Kendalls Beach,NA,2022,5,TIG,TRUE,TRUE,TRUE,NSW-SMART-Shark-Management-Alert-in-Real-Time-Drumlines-Report-July-2021-June-2022.pdf
16/06/2022,14:00,Dusky Whaler,241,M,Alive,ID,Kiama - Jones Beach to Gerringong,Kendalls Beach,2022-06-16T14:00:00Z,2022,6,DUS,FALSE,TRUE,FALSE,NSW-SMART-Shark-Management-Alert-in-Real-Time-Drumlines-Report-July-2021-June-2022.pdf
17/06/2022,9:49,Bronze Whaler,251,F,Alive,ID,Kiama - Jones Beach to Gerringong,Kendalls Beach,2022-06-17T09:49:00Z,2022,6,BRO,FALSE,TRUE,FALSE,NSW-SMART-Shark-Management-Alert-in-Real-Time-Drumlines-Report-July-2021-June-2022.pdf
29/05/2022,NA,Tiger Shark,147,M,Alive,"ID, A",Kiama - Jones Beach to Gerringong,Surf Beach,NA,2022,5,TIG,TRUE,TRUE,TRUE,NSW-SMART-Shark-Management-Alert-in-Real-Time-Drumlines-Report-July-2021-June-2022.pdf
10/06/2022,15:42,Tiger Shark,206,F,Alive,"ID, A",Kiama - Jones Beach to Gerringong,Surf Beach,2022-06-10T15:42:00Z,2022,6,TIG,TRUE,TRUE,TRUE,NSW-SMART-Shark-Management-Alert-in-Real-Time-Drumlines-Report-July-2021-June-2022.pdf
17/06/2022,8:13,Bronze Whaler,272,M,Alive,ID,Kiama - Jones Beach to Gerringong,Bombo Beach,2022-06-17T08:13:00Z,2022,6,BRO,FALSE,TRUE,FALSE,NSW-SMART-Shark-Management-Alert-in-Real-Time-Drumlines-Report-July-2021-June-2022.pdf
25/05/2022,10:29,Dusky Whaler,220,F,Alive,ID,Kiama - Jones Beach to Gerringong,Jones Beach,2022-05-25T10:29:00Z,2022,5,DUS,FALSE,TRUE,FALSE,NSW-SMART-Shark-Management-Alert-in-Real-Time-Drumlines-Report-July-2021-June-2022.pdf
16/06/2022,8:06,Dusky Whaler,190,F,Alive,ID,Kiama - Jones Beach to Gerringong,Jones Beach,2022-06-16T08:06:00Z,2022,6,DUS,FALSE,TRUE,FALSE,NSW-SMART-Shark-Management-Alert-in-Real-Time-Drumlines-Report-July-2021-June-2022.pdf
12/04/2022,8:25,Dusky Whaler,203,F,Alive,ID,Eurobodalla - Surf Beach to Barlings Beach,Surf Beach,2022-04-12T08:25:00Z,2022,4,DUS,FALSE,TRUE,FALSE,NSW-SMART-Shark-Management-Alert-in-Real-Time-Drumlines-Report-July-2021-June-2022.pdf
13/04/2022,12:08,Bronze Whaler,265,F,Alive,ID,Eurobodalla - Surf Beach to Barlings Beach,Surf Beach,2022-04-13T12:08:00Z,2022,4,BRO,FALSE,TRUE,FALSE,NSW-SMART-Shark-Management-Alert-in-Real-Time-Drumlines-Report-July-2021-June-2022.pdf
30/04/2022,9:48,White Shark,205,F,Alive,"ID, A",Eurobodalla - Surf Beach to Barlings Beach,Surf Beach,2022-04-30T09:48:00Z,2022,4,WHI,TRUE,TRUE,TRUE,NSW-SMART-Shark-Management-Alert-in-Real-Time-Drumlines-Report-July-2021-June-2022.pdf
09/05/2022,10:43,Black/Bull Ray,230,F,Alive,-,Eurobodalla - Surf Beach to Barlings Beach,Surf Beach,2022-05-09T10:43:00Z,2022,5,BLR,FALSE,FALSE,FALSE,NSW-SMART-Shark-Management-Alert-in-Real-Time-Drumlines-Report-July-2021-June-2022.pdf
17/05/2022,12:12,Dusky Whaler,146,F,Alive,ID,Eurobodalla - Surf Beach to Barlings Beach,Surf Beach,2022-05-17T12:12:00Z,2022,5,DUS,FALSE,TRUE,FALSE,NSW-SMART-Shark-Management-Alert-in-Real-Time-Drumlines-Report-July-2021-June-2022.pdf
18/05/2022,11:25,Bronze Whaler,249,F,Alive,ID,Eurobodalla - Surf Beach to Barlings Beach,Surf Beach,2022-05-18T11:25:00Z,2022,5,BRO,FALSE,TRUE,FALSE,NSW-SMART-Shark-Management-Alert-in-Real-Time-Drumlines-Report-July-2021-June-2022.pdf
25/05/2022,10:03,Bronze Whaler,253,F,Alive,ID,Eurobodalla - Surf Beach to Barlings Beach,Surf Beach,2022-05-25T10:03:00Z,2022,5,BRO,FALSE,TRUE,FALSE,NSW-SMART-Shark-Management-Alert-in-Real-Time-Drumlines-Report-July-2021-June-2022.pdf
30/05/2022,7:50,Bronze Whaler,212,F,Alive,ID,Eurobodalla - Surf Beach to Barlings Beach,Surf Beach,2022-05-30T07:50:00Z,2022,5,BRO,FALSE,TRUE,FALSE,NSW-SMART-Shark-Management-Alert-in-Real-Time-Drumlines-Report-July-2021-June-2022.pdf
15/06/2022,13:19,White Shark,239,F,Alive,"ID, A",Eurobodalla - Surf Beach to Barlings Beach,Surf Beach,2022-06-15T13:19:00Z,2022,6,WHI,TRUE,TRUE,TRUE,NSW-SMART-Shark-Management-Alert-in-Real-Time-Drumlines-Report-July-2021-June-2022.pdf
20/06/2022,9:25,Bronze Whaler,201,F,Alive,ID,Eurobodalla - Surf Beach to Barlings Beach,Surf Beach,2022-06-20T09:25:00Z,2022,6,BRO,FALSE,TRUE,FALSE,NSW-SMART-Shark-Management-Alert-in-Real-Time-Drumlines-Report-July-2021-June-2022.pdf
14/06/2022,12:15,Bronze Whaler,275,F,Alive,ID,Eurobodalla - Surf Beach to Barlings Beach,Circuit Beach,2022-06-14T12:15:00Z,2022,6,BRO,FALSE,TRUE,FALSE,NSW-SMART-Shark-Management-Alert-in-Real-Time-Drumlines-Report-July-2021-June-2022.pdf
10/04/2022,13:18,Dusky Whaler,198,F,Alive,ID,Eurobodalla - Surf Beach to Barlings Beach,Lilli Pilli Beach,2022-04-10T13:18:00Z,2022,4,DUS,FALSE,TRUE,FALSE,NSW-SMART-Shark-Management-Alert-in-Real-Time-Drumlines-Report-July-2021-June-2022.pdf
08/05/2022,15:13,Bronze Whaler,257,F,Alive,ID,Eurobodalla - Surf Beach to Barlings Beach,Lilli Pilli Beach,2022-05-08T15:13:00Z,2022,5,BRO,FALSE,TRUE,FALSE,NSW-SMART-Shark-Management-Alert-in-Real-Time-Drumlines-Report-July-2021-June-2022.pdf
11/06/2022,NA,Dusky Whaler,95,M,Alive,ID,Eurobodalla - Surf Beach to Barlings Beach,Lilli Pilli Beach,NA,2022,6,DUS,FALSE,TRUE,FALSE,NSW-SMART-Shark-Management-Alert-in-Real-Time-Drumlines-Report-July-2021-June-2022.pdf
26/06/2022,9:37,Bronze Whaler,266,F,Alive,ID,Eurobodalla - Surf Beach to Barlings Beach,Garden Bay Beach,2022-06-26T09:37:00Z,2022,6,BRO,FALSE,TRUE,FALSE,NSW-SMART-Shark-Management-Alert-in-Real-Time-Drumlines-Report-July-2021-June-2022.pdf
06/05/2022,10:48,Bronze Whaler,NA,M,Alive,-,Eurobodalla - Surf Beach to Barlings Beach,Malua Bay Beach,2022-05-06T10:48:00Z,2022,5,BRO,FALSE,FALSE,FALSE,NSW-SMART-Shark-Management-Alert-in-Real-Time-Drumlines-Report-July-2021-June-2022.pdf
23/05/2022,8:58,Bronze Whaler,267,F,Alive,ID,Eurobodalla - Surf Beach to Barlings Beach,Malua Bay Beach,2022-05-23T08:58:00Z,2022,5,BRO,FALSE,TRUE,FALSE,NSW-SMART-Shark-Management-Alert-in-Real-Time-Drumlines-Report-July-2021-June-2022.pdf
22/04/2022,13:26,Dusky Whaler,212,F,Alive,ID,Eurobodalla - Surf Beach to Barlings Beach,McKenzies Beach,2022-04-22T13:26:00Z,2022,4,DUS,FALSE,TRUE,FALSE,NSW-SMART-Shark-Management-Alert-in-Real-Time-Drumlines-Report-July-2021-June-2022.pdf
01/05/2022,13:20,Dusky Whaler,198,F,Alive,ID,Eurobodalla - Surf Beach to Barlings Beach,McKenzies Beach,2022-05-01T13:20:00Z,2022,5,DUS,FALSE,TRUE,FALSE,NSW-SMART-Shark-Management-Alert-in-Real-Time-Drumlines-Report-July-2021-June-2022.pdf
07/05/2022,8:23,Tiger Shark,220,F,Alive,"ID, A",Eurobodalla - Surf Beach to Barlings Beach,McKenzies Beach,2022-05-07T08:23:00Z,2022,5,TIG,TRUE,TRUE,TRUE,NSW-SMART-Shark-Management-Alert-in-Real-Time-Drumlines-Report-July-2021-June-2022.pdf
19/05/2022,8:07,Bronze Whaler,263,F,Alive,ID,Eurobodalla - Surf Beach to Barlings Beach,McKenzies Beach,2022-05-19T08:07:00Z,2022,5,BRO,FALSE,TRUE,FALSE,NSW-SMART-Shark-Management-Alert-in-Real-Time-Drumlines-Report-July-2021-June-2022.pdf
08/05/2022,8:03,Bronze Whaler,279,F,Alive,ID,Eurobodalla - Surf Beach to Barlings Beach,Rosedale Beach,2022-05-08T08:03:00Z,2022,5,BRO,FALSE,TRUE,FALSE,NSW-SMART-Shark-Management-Alert-in-Real-Time-Drumlines-Report-July-2021-June-2022.pdf
18/05/2022,12:19,Bronze Whaler,248,F,Alive,ID,Eurobodalla - Surf Beach to Barlings Beach,Rosedale Beach,2022-05-18T12:19:00Z,2022,5,BRO,FALSE,TRUE,FALSE,NSW-SMART-Shark-Management-Alert-in-Real-Time-Drumlines-Report-July-2021-June-2022.pdf
24/05/2022,10:56,Dusky Whaler,199,F,Alive,ID,Eurobodalla - Surf Beach to Barlings Beach,Rosedale Beach,2022-05-24T10:56:00Z,2022,5,DUS,FALSE,TRUE,FALSE,NSW-SMART-Shark-Management-Alert-in-Real-Time-Drumlines-Report-July-2021-June-2022.pdf
25/05/2022,9:12,Bronze Whaler,274,F,Alive,ID,Eurobodalla - Surf Beach to Barlings Beach,Rosedale Beach,2022-05-25T09:12:00Z,2022,5,BRO,FALSE,TRUE,FALSE,NSW-SMART-Shark-Management-Alert-in-Real-Time-Drumlines-Report-July-2021-June-2022.pdf
30/05/2022,12:22,Bronze Whaler,208,F,Alive,ID,Eurobodalla - Surf Beach to Barlings Beach,Rosedale Beach,2022-05-30T12:22:00Z,2022,5,BRO,FALSE,TRUE,FALSE,NSW-SMART-Shark-Management-Alert-in-Real-Time-Drumlines-Report-July-2021-June-2022.pdf
19/05/2022,12:37,Dusky Whaler,176,F,Alive,ID,Eurobodalla - Surf Beach to Barlings Beach,Barlings Beach,2022-05-19T12:37:00Z,2022,5,DUS,FALSE,TRUE,FALSE,NSW-SMART-Shark-Management-Alert-in-Real-Time-Drumlines-Report-July-2021-June-2022.pdf
25/05/2022,14:44,Bronze Whaler,182,F,Alive,ID,Eurobodalla - Surf Beach to Barlings Beach,Barlings Beach,2022-05-25T14:44:00Z,2022,5,BRO,FALSE,TRUE,FALSE,NSW-SMART-Shark-Management-Alert-in-Real-Time-Drumlines-Report-July-2021-June-2022.pdf
02/06/2022,10:52,Bronze Whaler,293,F,Alive,ID,Eurobodalla - Surf Beach to Barlings Beach,Barlings Beach,2022-06-02T10:52:00Z,2022,6,BRO,FALSE,TRUE,FALSE,NSW-SMART-Shark-Management-Alert-in-Real-Time-Drumlines-Report-July-2021-June-2022.pdf
02/06/2022,12:41,White Shark,203,M,Alive,"ID, A",Eurobodalla - Surf Beach to Barlings Beach,Barlings Beach,2022-06-02T12:41:00Z,2022,6,WHI,TRUE,TRUE,TRUE,NSW-SMART-Shark-Management-Alert-in-Real-Time-Drumlines-Report-July-2021-June-2022.pdf
14/06/2022,11:44,Bronze Whaler,297,F,Alive,ID,Eurobodalla - Surf Beach to Barlings Beach,Barlings Beach,2022-06-14T11:44:00Z,2022,6,BRO,FALSE,TRUE,FALSE,NSW-SMART-Shark-Management-Alert-in-Real-Time-Drumlines-Report-July-2021-June-2022.pdf
29/06/2022,12:29,Bronze Whaler,NA,NA,Alive,-,Eurobodalla - Surf Beach to Barlings Beach,Barlings Beach,2022-06-29T12:29:00Z,2022,6,BRO,FALSE,FALSE,FALSE,NSW-SMART-Shark-Management-Alert-in-Real-Time-Drumlines-Report-July-2021-June-2022.pdf
24/02/2022,15:46,Tiger Shark,184,F,Alive,"ID, A",Merimbula - Pambula to Tura Head,Pambula Beach,2022-02-24T15:46:00Z,2022,2,TIG,TRUE,TRUE,TRUE,NSW-SMART-Shark-Management-Alert-in-Real-Time-Drumlines-Report-July-2021-June-2022.pdf
06/03/2022,10:33,White Shark,221,M,Alive,"ID, A",Merimbula - Pambula to Tura Head,Pambula Beach,2022-03-06T10:33:00Z,2022,3,WHI,TRUE,TRUE,TRUE,NSW-SMART-Shark-Management-Alert-in-Real-Time-Drumlines-Report-July-2021-June-2022.pdf
15/03/2022,14:08,Bronze Whaler,206,F,Alive,ID,Merimbula - Pambula to Tura Head,Pambula Beach,2022-03-15T14:08:00Z,2022,3,BRO,FALSE,TRUE,FALSE,NSW-SMART-Shark-Management-Alert-in-Real-Time-Drumlines-Report-July-2021-June-2022.pdf
19/03/2022,11:58,White Shark,175,F,Alive,"ID, A",Merimbula - Pambula to Tura Head,Pambula Beach,2022-03-19T11:58:00Z,2022,3,WHI,TRUE,TRUE,TRUE,NSW-SMART-Shark-Management-Alert-in-Real-Time-Drumlines-Report-July-2021-June-2022.pdf
26/03/2022,13:21,White Shark,212,F,Alive,"ID, A",Merimbula - Pambula to Tura Head,Pambula Beach,2022-03-26T13:21:00Z,2022,3,WHI,TRUE,TRUE,TRUE,NSW-SMART-Shark-Management-Alert-in-Real-Time-Drumlines-Report-July-2021-June-2022.pdf
29/04/2022,12:09,White Shark,181,F,Alive,"ID, A",Merimbula - Pambula to Tura Head,Pambula Beach,2022-04-29T12:09:00Z,2022,4,WHI,TRUE,TRUE,TRUE,NSW-SMART-Shark-Management-Alert-in-Real-Time-Drumlines-Report-July-2021-June-2022.pdf
29/04/2022,16:03,White Shark,198,M,Alive,"ID, A",Merimbula - Pambula to Tura Head,Pambula Beach,2022-04-29T16:03:00Z,2022,4,WHI,TRUE,TRUE,TRUE,NSW-SMART-Shark-Management-Alert-in-Real-Time-Drumlines-Report-July-2021-June-2022.pdf
27/02/2022,9:25,White Shark,184,M,Alive,"ID, A",Merimbula - Pambula to Tura Head,"Main Beach,",2022-02-27T09:25:00Z,2022,2,WHI,TRUE,TRUE,TRUE,NSW-SMART-Shark-Management-Alert-in-Real-Time-Drumlines-Report-July-2021-June-2022.pdf
06/03/2022,10:40,Bronze Whaler,245,F,Alive,ID,Merimbula - Pambula to Tura Head,Merimbula,2022-03-06T10:40:00Z,2022,3,BRO,FALSE,TRUE,FALSE,NSW-SMART-Shark-Management-Alert-in-Real-Time-Drumlines-Report-July-2021-June-2022.pdf
22/03/2022,8:27,White Shark,149,M,Alive,"ID, A",Merimbula - Pambula to Tura Head,Merimbula,2022-03-22T08:27:00Z,2022,3,WHI,TRUE,TRUE,TRUE,NSW-SMART-Shark-Management-Alert-in-Real-Time-Drumlines-Report-July-2021-June-2022.pdf
23/03/2022,12:23,Bronze Whaler,265,M,Alive,ID,Merimbula - Pambula to Tura Head,Merimbula,2022-03-23T12:23:00Z,2022,3,BRO,FALSE,TRUE,FALSE,NSW-SMART-Shark-Management-Alert-in-Real-Time-Drumlines-Report-July-2021-June-2022.pdf
28/03/2022,14:55,White Shark,205,F,Alive,"ID, A",Merimbula - Pambula to Tura Head,Merimbula,2022-03-28T14:55:00Z,2022,3,WHI,TRUE,TRUE,TRUE,NSW-SMART-Shark-Management-Alert-in-Real-Time-Drumlines-Report-July-2021-June-2022.pdf
04/04/2022,11:06,White Shark,192,F,Alive,"ID, A",Merimbula - Pambula to Tura Head,Merimbula,2022-04-04T11:06:00Z,2022,4,WHI,TRUE,TRUE,TRUE,NSW-SMART-Shark-Management-Alert-in-Real-Time-Drumlines-Report-July-2021-June-2022.pdf
21/05/2022,12:45,White Shark,210,F,Alive,"ID, A",Merimbula - Pambula to Tura Head,Merimbula,2022-05-21T12:45:00Z,2022,5,WHI,TRUE,TRUE,TRUE,NSW-SMART-Shark-Management-Alert-in-Real-Time-Drumlines-Report-July-2021-June-2022.pdf
16/06/2022,15:06,White Shark,225,F,Alive,"ID, A",Merimbula - Pambula to Tura Head,Merimbula,2022-06-16T15:06:00Z,2022,6,WHI,TRUE,TRUE,TRUE,NSW-SMART-Shark-Management-Alert-in-Real-Time-Drumlines-Report-July-2021-June-2022.pdf
21/02/2022,NA,Tiger Shark,141,F,Alive,"ID, A",Merimbula - Pambula to Tura Head,Short Point,NA,2022,2,TIG,TRUE,TRUE,TRUE,NSW-SMART-Shark-Management-Alert-in-Real-Time-Drumlines-Report-July-2021-June-2022.pdf
20/03/2022,16:14,White Shark,201,F,Alive,"ID, A",Merimbula - Pambula to Tura Head,Short Point,2022-03-20T16:14:00Z,2022,3,WHI,TRUE,TRUE,TRUE,NSW-SMART-Shark-Management-Alert-in-Real-Time-Drumlines-Report-July-2021-June-2022.pdf
11/06/2022,9:36,White Shark,269,M,Alive,"ID, A",Merimbula - Pambula to Tura Head,Short Point,2022-06-11T09:36:00Z,2022,6,WHI,TRUE,TRUE,TRUE,NSW-SMART-Shark-Management-Alert-in-Real-Time-Drumlines-Report-July-2021-June-2022.pdf
15/06/2022,9:25,White Shark,172,M,Alive,"ID, A",Merimbula - Pambula to Tura Head,Short Point,2022-06-15T09:25:00Z,2022,6,WHI,TRUE,TRUE,TRUE,NSW-SMART-Shark-Management-Alert-in-Real-Time-Drumlines-Report-July-2021-June-2022.pdf
19/03/2022,11:45,White Shark,235,F,Alive,"ID, A",Merimbula - Pambula to Tura Head,Tura Beach,2022-03-19T11:45:00Z,2022,3,WHI,TRUE,TRUE,TRUE,NSW-SMART-Shark-Management-Alert-in-Real-Time-Drumlines-Report-July-2021-June-2022.pdf
07/06/2022,8:52,White Shark,250,M,Alive,"ID, A",Merimbula - Pambula to Tura Head,Tura Beach,2022-06-07T08:52:00Z,2022,6,WHI,TRUE,TRUE,TRUE,NSW-SMART-Shark-Management-Alert-in-Real-Time-Drumlines-Report-July-2021-June-2022.pdf
