Date,Time,Species,Size_cm,Sex,Status,Tags,SD_region,Beach,DateTime,Year,Month,Species_Code,Target_Shark,Has_ID_Tag,Has_Acoustic_Tag,Source_PDF
31/07/2022,14:39,White Shark,265,F,Alive,"ID, A",Kingscliff,Hastings Point Beach,2022-07-31T14:39:00Z,2022,7,WHI,TRUE,TRUE,TRUE,NSW-SMART-drumline-report-1-July-2022-30-June-2023.pdf
28/08/2022,11:11,White Shark,282,F,Alive,"ID, A",Kingscliff,Hastings Point Beach,2022-08-28T11:11:00Z,2022,8,WHI,TRUE,TRUE,TRUE,NSW-SMART-drumline-report-1-July-2022-30-June-2023.pdf
1/04/2023,16:33,Tiger Shark,355,F,Alive,"ID, A",Kingscliff,Hastings Point Beach,2023-04-01T16:33:00Z,2023,4,TIG,TRUE,TRUE,TRUE,NSW-SMART-drumline-report-1-July-2022-30-June-2023.pdf
13/07/2022,14:45,White Shark,262,F,Alive,"ID, A",Kingscliff,Cabarita Beach,2022-07-13T14:45:00Z,2022,7,WHI,TRUE,TRUE,TRUE,NSW-SMART-drumline-report-1-July-2022-30-June-2023.pdf
26/08/2022,12:48,Tiger Shark,325,F,Alive,"ID, A",Kingscliff,Cabarita Beach,2022-08-26T12:48:00Z,2022,8,TIG,TRUE,TRUE,TRUE,NSW-SMART-drumline-report-1-July-2022-30-June-2023.pdf
22/11/2022,NA,White Shark,361,F,Alive,"ID, A",Kingscliff,Cabarita Beach,NA,2022,11,WHI,TRUE,TRUE,TRUE,NSW-SMART-drumline-report-1-July-2022-30-June-2023.pdf
11/08/2022,11:43,Tiger Shark,356,F,Alive,"ID, A",Kingscliff,South Kingscliff Beach,2022-08-11T11:43:00Z,2022,8,TIG,TRUE,TRUE,TRUE,NSW-SMART-drumline-report-1-July-2022-30-June-2023.pdf
10/09/2022,10:20,Tiger Shark,333,F,Alive,"ID, A",Kingscliff,South Kingscliff Beach,2022-09-10T10:20:00Z,2022,9,TIG,TRUE,TRUE,TRUE,NSW-SMART-drumline-report-1-July-2022-30-June-2023.pdf
5/10/2022,8:42,Loggerhead Turtle,122,NA,Alive,NA,Kingscliff,South Kingscliff Beach,2022-10-05T08:42:00Z,2022,10,LOG,FALSE,FALSE,FALSE,NSW-SMART-drumline-report-1-July-2022-30-June-2023.pdf
18/10/2022,8:33,White Shark,401,F,Alive,"ID, A",Kingscliff,South Kingscliff Beach,2022-10-18T08:33:00Z,2022,10,WHI,TRUE,TRUE,TRUE,NSW-SMART-drumline-report-1-July-2022-30-June-2023.pdf
12/06/2023,9:28,Mako,326,F,Alive,ID,Kingscliff,South Kingscliff Beach,2023-06-12T09:28:00Z,2023,6,SMA,FALSE,TRUE,FALSE,NSW-SMART-drumline-report-1-July-2022-30-June-2023.pdf
27/07/2022,8:43,Greynurse Shark,257,M,Alive,ID,Ballina to Lennox Head,Lennox Head Beach,2022-07-27T08:43:00Z,2022,7,GRN,FALSE,TRUE,FALSE,NSW-SMART-drumline-report-1-July-2022-30-June-2023.pdf
7/08/2022,13:27,Dusky Whaler,270,M,Alive,ID,Ballina to Lennox Head,Lennox Head Beach,2022-08-07T13:27:00Z,2022,8,DUS,FALSE,TRUE,FALSE,NSW-SMART-drumline-report-1-July-2022-30-June-2023.pdf
23/08/2022,10:01,White Shark,262,F,Alive,"ID, A",Ballina to Lennox Head,Lennox Head Beach,2022-08-23T10:01:00Z,2022,8,WHI,TRUE,TRUE,TRUE,NSW-SMART-drumline-report-1-July-2022-30-June-2023.pdf
26/08/2022,14:15,White Shark,209,F,Alive,"ID, A",Ballina to Lennox Head,Lennox Head Beach,2022-08-26T14:15:00Z,2022,8,WHI,TRUE,TRUE,TRUE,NSW-SMART-drumline-report-1-July-2022-30-June-2023.pdf
11/09/2022,9:06,Dusky Whaler,380,F,Alive,NA,Ballina to Lennox Head,Lennox Head Beach,2022-09-11T09:06:00Z,2022,9,DUS,FALSE,FALSE,FALSE,NSW-SMART-drumline-report-1-July-2022-30-June-2023.pdf
15/09/2022,9:13,Dusky Whaler,355,F,Alive,ID,Ballina to Lennox Head,Lennox Head Beach,2022-09-15T09:13:00Z,2022,9,DUS,FALSE,TRUE,FALSE,NSW-SMART-drumline-report-1-July-2022-30-June-2023.pdf
25/09/2022,12:03,White Shark,220,NA,Alive,NA,Ballina to Lennox Head,Lennox Head Beach,2022-09-25T12:03:00Z,2022,9,WHI,TRUE,FALSE,FALSE,NSW-SMART-drumline-report-1-July-2022-30-June-2023.pdf
19/10/2022,13:04,Common Blacktip,110,NA,Alive,NA,Ballina to Lennox Head,Lennox Head Beach,2022-10-19T13:04:00Z,2022,10,CBT,FALSE,FALSE,FALSE,NSW-SMART-drumline-report-1-July-2022-30-June-2023.pdf
7/01/2023,8:09,Bull Shark,203,M,Alive,"ID, A",Ballina to Lennox Head,Lennox Head Beach,2023-01-07T08:09:00Z,2023,1,BUL,TRUE,TRUE,TRUE,NSW-SMART-drumline-report-1-July-2022-30-June-2023.pdf
6/11/2022,7:30,Scalloped Hammerhead,175,F,Alive,ID,Ballina to Lennox Head,Lennox Headland,2022-11-06T07:30:00Z,2022,11,SCH,FALSE,TRUE,FALSE,NSW-SMART-drumline-report-1-July-2022-30-June-2023.pdf
25/01/2023,7:48,Bull Shark,179,M,Alive,"ID, A",Ballina to Lennox Head,Lennox Headland,2023-01-25T07:48:00Z,2023,1,BUL,TRUE,TRUE,TRUE,NSW-SMART-drumline-report-1-July-2022-30-June-2023.pdf
5/07/2022,NA,Smooth Hammerhead,165,M,Alive,ID,Ballina to Lennox Head,Boulders Beach,NA,2022,7,SMH,FALSE,TRUE,FALSE,NSW-SMART-drumline-report-1-July-2022-30-June-2023.pdf
19/09/2022,12:21,Dusky Whaler,235,F,Alive,ID,Ballina to Lennox Head,Boulders Beach,2022-09-19T12:21:00Z,2022,9,DUS,FALSE,TRUE,FALSE,NSW-SMART-drumline-report-1-July-2022-30-June-2023.pdf
21/12/2022,12:51,Smooth Hammerhead,272,F,Alive,ID,Ballina to Lennox Head,Boulders Beach,2022-12-21T12:51:00Z,2022,12,SMH,FALSE,TRUE,FALSE,NSW-SMART-drumline-report-1-July-2022-30-June-2023.pdf
11/08/2022,8:36,Tiger Shark,344,F,Alive,"ID, A",Ballina to Lennox Head,Sharpes Beach,2022-08-11T08:36:00Z,2022,8,TIG,TRUE,TRUE,TRUE,NSW-SMART-drumline-report-1-July-2022-30-June-2023.pdf
7/09/2022,9:26,Sandbar Whaler,189,F,Alive,ID,Ballina to Lennox Head,Sharpes Beach,2022-09-07T09:26:00Z,2022,9,SAN,FALSE,TRUE,FALSE,NSW-SMART-drumline-report-1-July-2022-30-June-2023.pdf
15/09/2022,9:43,Bronze Whaler,269,F,Alive,ID,Ballina to Lennox Head,Sharpes Beach,2022-09-15T09:43:00Z,2022,9,BRO,FALSE,TRUE,FALSE,NSW-SMART-drumline-report-1-July-2022-30-June-2023.pdf
25/09/2022,8:54,Dusky Whaler,290,M,Alive,ID,Ballina to Lennox Head,Sharpes Beach,2022-09-25T08:54:00Z,2022,9,DUS,FALSE,TRUE,FALSE,NSW-SMART-drumline-report-1-July-2022-30-June-2023.pdf
28/09/2022,10:51,White Shark,207,M,Alive,"ID, A",Ballina to Lennox Head,Sharpes Beach,2022-09-28T10:51:00Z,2022,9,WHI,TRUE,TRUE,TRUE,NSW-SMART-drumline-report-1-July-2022-30-June-2023.pdf
15/10/2022,11:12,Sandbar Whaler,195,F,Alive,ID,Ballina to Lennox Head,Sharpes Beach,2022-10-15T11:12:00Z,2022,10,SAN,FALSE,TRUE,FALSE,NSW-SMART-drumline-report-1-July-2022-30-June-2023.pdf
28/10/2022,16:25,Common Blacktip,161,F,Alive,ID,Ballina to Lennox Head,Sharpes Beach,2022-10-28T16:25:00Z,2022,10,CBT,FALSE,TRUE,FALSE,NSW-SMART-drumline-report-1-July-2022-30-June-2023.pdf
8/11/2022,9:30,Smooth Hammerhead,179,F,Alive,ID,Ballina to Lennox Head,Sharpes Beach,2022-11-08T09:30:00Z,2022,11,SMH,FALSE,TRUE,FALSE,NSW-SMART-drumline-report-1-July-2022-30-June-2023.pdf
7/01/2023,7:15,Sandbar Whaler,140,F,Alive,ID,Ballina to Lennox Head,Sharpes Beach,2023-01-07T07:15:00Z,2023,1,SAN,FALSE,TRUE,FALSE,NSW-SMART-drumline-report-1-July-2022-30-June-2023.pdf
25/02/2023,NA,Tiger Shark,380,F,Alive,"ID, A",Ballina to Lennox Head,Sharpes Beach,NA,2023,2,TIG,TRUE,TRUE,TRUE,NSW-SMART-drumline-report-1-July-2022-30-June-2023.pdf
8/04/2023,13:57,Common Blacktip,224,F,Alive,ID,Ballina to Lennox Head,Sharpes Beach,2023-04-08T13:57:00Z,2023,4,CBT,FALSE,TRUE,FALSE,NSW-SMART-drumline-report-1-July-2022-30-June-2023.pdf
18/07/2022,10:58,White Shark,241,F,Alive,"ID, A",Ballina to Lennox Head,Angels Beach,2022-07-18T10:58:00Z,2022,7,WHI,TRUE,TRUE,TRUE,NSW-SMART-drumline-report-1-July-2022-30-June-2023.pdf
12/09/2022,12:01,Queensland Groper,200,NA,Alive,ID,Ballina to Lennox Head,Angels Beach,2022-09-12T12:01:00Z,2022,9,QGR,FALSE,TRUE,FALSE,NSW-SMART-drumline-report-1-July-2022-30-June-2023.pdf
6/10/2022,14:37,Greynurse Shark,263,F,Alive,ID,Ballina to Lennox Head,Angels Beach,2022-10-06T14:37:00Z,2022,10,GRN,FALSE,TRUE,FALSE,NSW-SMART-drumline-report-1-July-2022-30-June-2023.pdf
19/10/2022,14:13,White Shark,311,M,Alive,"ID, A",Ballina to Lennox Head,Angels Beach,2022-10-19T14:13:00Z,2022,10,WHI,TRUE,TRUE,TRUE,NSW-SMART-drumline-report-1-July-2022-30-June-2023.pdf
21/11/2022,13:37,Tiger Shark,228,F,Alive,"ID, A",Ballina to Lennox Head,Angels Beach,2022-11-21T13:37:00Z,2022,11,TIG,TRUE,TRUE,TRUE,NSW-SMART-drumline-report-1-July-2022-30-June-2023.pdf
2/09/2022,07:40,White Shark,220,M,Alive,"ID, A",Ballina to Lennox Head,Shelly Beach,2022-09-02T07:40:00Z,2022,9,WHI,TRUE,TRUE,TRUE,NSW-SMART-drumline-report-1-July-2022-30-June-2023.pdf
25/09/2022,13:27,White Shark,216,F,Alive,"ID, A",Ballina to Lennox Head,Lighthouse Beach,2022-09-25T13:27:00Z,2022,9,WHI,TRUE,TRUE,TRUE,NSW-SMART-drumline-report-1-July-2022-30-June-2023.pdf
7/01/2023,12:34,Bull Shark,206,M,Alive,"ID, A",Ballina to Lennox Head,Lighthouse Beach,2023-01-07T12:34:00Z,2023,1,BUL,TRUE,TRUE,TRUE,NSW-SMART-drumline-report-1-July-2022-30-June-2023.pdf
26/08/2022,10:17,White Shark,222,F,Alive,"ID, A",Ballina to Lennox Head,South Ballina Beach,2022-08-26T10:17:00Z,2022,8,WHI,TRUE,TRUE,TRUE,NSW-SMART-drumline-report-1-July-2022-30-June-2023.pdf
26/08/2022,10:25,White Shark,239,F,Alive,"ID, A",Ballina to Lennox Head,South Ballina Beach,2022-08-26T10:25:00Z,2022,8,WHI,TRUE,TRUE,TRUE,NSW-SMART-drumline-report-1-July-2022-30-June-2023.pdf
15/09/2022,NA,White Shark,250,M,Alive,"ID, A",Ballina to Lennox Head,South Ballina Beach,NA,2022,9,WHI,TRUE,TRUE,TRUE,NSW-SMART-drumline-report-1-July-2022-30-June-2023.pdf
20/09/2022,12:07,White Shark,271,F,Alive,"ID, A",Ballina to Lennox Head,South Ballina Beach,2022-09-20T12:07:00Z,2022,9,WHI,TRUE,TRUE,TRUE,NSW-SMART-drumline-report-1-July-2022-30-June-2023.pdf
4/10/2022,10:40,Greynurse Shark,292,F,Alive,ID,Ballina to Lennox Head,South Ballina Beach,2022-10-04T10:40:00Z,2022,10,GRN,FALSE,TRUE,FALSE,NSW-SMART-drumline-report-1-July-2022-30-June-2023.pdf
17/10/2022,11:07,White Shark,201,F,Alive,"ID, A",Ballina to Lennox Head,South Ballina Beach,2022-10-17T11:07:00Z,2022,10,WHI,TRUE,TRUE,TRUE,NSW-SMART-drumline-report-1-July-2022-30-June-2023.pdf
21/11/2022,8:16,White Shark,233,M,Alive,"ID, A",Ballina to Lennox Head,South Ballina Beach,2022-11-21T08:16:00Z,2022,11,WHI,TRUE,TRUE,TRUE,NSW-SMART-drumline-report-1-July-2022-30-June-2023.pdf
5/12/2022,7:46,Scalloped Hammerhead,185,F,Alive,ID,Ballina to Lennox Head,South Ballina Beach,2022-12-05T07:46:00Z,2022,12,SCH,FALSE,TRUE,FALSE,NSW-SMART-drumline-report-1-July-2022-30-June-2023.pdf
16/12/2022,7:52,White Shark,298,F,Alive,"ID, A",Ballina to Lennox Head,South Ballina Beach,2022-12-16T07:52:00Z,2022,12,WHI,TRUE,TRUE,TRUE,NSW-SMART-drumline-report-1-July-2022-30-June-2023.pdf
17/03/2023,9:53,Tiger Shark,275,F,Alive,"ID, A",Ballina to Lennox Head,South Ballina Beach,2023-03-17T09:53:00Z,2023,3,TIG,TRUE,TRUE,TRUE,NSW-SMART-drumline-report-1-July-2022-30-June-2023.pdf
8/05/2023,9:24,Smooth Hammerhead,160,F,Alive,ID,Ballina to Lennox Head,South Ballina Beach,2023-05-08T09:24:00Z,2023,5,SMH,FALSE,TRUE,FALSE,NSW-SMART-drumline-report-1-July-2022-30-June-2023.pdf
21/05/2023,10:38,Common Blacktip,141,F,Alive,ID,Ballina to Lennox Head,South Ballina Beach,2023-05-21T10:38:00Z,2023,5,CBT,FALSE,TRUE,FALSE,NSW-SMART-drumline-report-1-July-2022-30-June-2023.pdf
13/07/2022,8:21,White Shark,206,F,Alive,"ID, A",Evans Head,Joggly Point,2022-07-13T08:21:00Z,2022,7,WHI,TRUE,TRUE,TRUE,NSW-SMART-drumline-report-1-July-2022-30-June-2023.pdf
26/07/2022,10:05,Sandbar Whaler,205,F,Alive,ID,Evans Head,Joggly Point,2022-07-26T10:05:00Z,2022,7,SAN,FALSE,TRUE,FALSE,NSW-SMART-drumline-report-1-July-2022-30-June-2023.pdf
5/08/2022,10:56,White Shark,204,F,Alive,"ID, A",Evans Head,Joggly Point,2022-08-05T10:56:00Z,2022,8,WHI,TRUE,TRUE,TRUE,NSW-SMART-drumline-report-1-July-2022-30-June-2023.pdf
13/08/2022,11:04,White Shark,194,F,Alive,"ID, A",Evans Head,Joggly Point,2022-08-13T11:04:00Z,2022,8,WHI,TRUE,TRUE,TRUE,NSW-SMART-drumline-report-1-July-2022-30-June-2023.pdf
15/08/2022,15:12,Greynurse Shark,253,F,Alive,ID,Evans Head,Joggly Point,2022-08-15T15:12:00Z,2022,8,GRN,FALSE,TRUE,FALSE,NSW-SMART-drumline-report-1-July-2022-30-June-2023.pdf
8/09/2022,11:28,White Shark,199,F,Alive,"ID, A",Evans Head,Joggly Point,2022-09-08T11:28:00Z,2022,9,WHI,TRUE,TRUE,TRUE,NSW-SMART-drumline-report-1-July-2022-30-June-2023.pdf
20/09/2022,7:29,White Shark,247,M,Alive,"ID, A",Evans Head,Joggly Point,2022-09-20T07:29:00Z,2022,9,WHI,TRUE,TRUE,TRUE,NSW-SMART-drumline-report-1-July-2022-30-June-2023.pdf
21/09/2022,7:30,Greynurse Shark,226,M,Alive,ID,Evans Head,Joggly Point,2022-09-21T07:30:00Z,2022,9,GRN,FALSE,TRUE,FALSE,NSW-SMART-drumline-report-1-July-2022-30-June-2023.pdf
24/09/2022,10:06,White Shark,286,F,Alive,"ID, A",Evans Head,Joggly Point,2022-09-24T10:06:00Z,2022,9,WHI,TRUE,TRUE,TRUE,NSW-SMART-drumline-report-1-July-2022-30-June-2023.pdf
2/10/2022,13:48,Dusky Whaler,225,F,Alive,ID,Evans Head,Joggly Point,2022-10-02T13:48:00Z,2022,10,DUS,FALSE,TRUE,FALSE,NSW-SMART-drumline-report-1-July-2022-30-June-2023.pdf
4/10/2022,14:52,White Shark,191,M,Alive,"ID, A",Evans Head,Joggly Point,2022-10-04T14:52:00Z,2022,10,WHI,TRUE,TRUE,TRUE,NSW-SMART-drumline-report-1-July-2022-30-June-2023.pdf
8/10/2022,9:50,White Shark,249,M,Alive,"ID, A",Evans Head,Joggly Point,2022-10-08T09:50:00Z,2022,10,WHI,TRUE,TRUE,TRUE,NSW-SMART-drumline-report-1-July-2022-30-June-2023.pdf
15/10/2022,9:14,White Shark,214,M,Alive,"ID, A",Evans Head,Joggly Point,2022-10-15T09:14:00Z,2022,10,WHI,TRUE,TRUE,TRUE,NSW-SMART-drumline-report-1-July-2022-30-June-2023.pdf
6/11/2022,10:57,Sandbar Whaler,121,F,Alive,ID,Evans Head,Joggly Point,2022-11-06T10:57:00Z,2022,11,SAN,FALSE,TRUE,FALSE,NSW-SMART-drumline-report-1-July-2022-30-June-2023.pdf
12/11/2022,8:56,Dusky Whaler,308,M,Alive,ID,Evans Head,Joggly Point,2022-11-12T08:56:00Z,2022,11,DUS,FALSE,TRUE,FALSE,NSW-SMART-drumline-report-1-July-2022-30-June-2023.pdf
21/11/2022,15:33,Common Blacktip,164,F,Alive,ID,Evans Head,Joggly Point,2022-11-21T15:33:00Z,2022,11,CBT,FALSE,TRUE,FALSE,NSW-SMART-drumline-report-1-July-2022-30-June-2023.pdf
28/11/2022,9:42,Scalloped Hammerhead,158,M,Alive,ID,Evans Head,Joggly Point,2022-11-28T09:42:00Z,2022,11,SCH,FALSE,TRUE,FALSE,NSW-SMART-drumline-report-1-July-2022-30-June-2023.pdf
6/12/2022,10:34,Bull Shark,213,M,Alive,"ID, A",Evans Head,Joggly Point,2022-12-06T10:34:00Z,2022,12,BUL,TRUE,TRUE,TRUE,NSW-SMART-drumline-report-1-July-2022-30-June-2023.pdf
13/12/2022,7:59,Sandbar Whaler,138,F,Alive,ID,Evans Head,Joggly Point,2022-12-13T07:59:00Z,2022,12,SAN,FALSE,TRUE,FALSE,NSW-SMART-drumline-report-1-July-2022-30-June-2023.pdf
24/01/2023,15:18,Common Blacktip,126,F,Alive,ID,Evans Head,Joggly Point,2023-01-24T15:18:00Z,2023,1,CBT,FALSE,TRUE,FALSE,NSW-SMART-drumline-report-1-July-2022-30-June-2023.pdf
16/02/2023,13:37,Bull Shark,199,M,Alive,"ID, A",Evans Head,Joggly Point,2023-02-16T13:37:00Z,2023,2,BUL,TRUE,TRUE,TRUE,NSW-SMART-drumline-report-1-July-2022-30-June-2023.pdf
19/02/2023,10:15,Tiger Shark,214,M,Alive,"ID, A",Evans Head,Joggly Point,2023-02-19T10:15:00Z,2023,2,TIG,TRUE,TRUE,TRUE,NSW-SMART-drumline-report-1-July-2022-30-June-2023.pdf
21/02/2023,9:43,Common Blacktip,171,M,Alive,ID,Evans Head,Joggly Point,2023-02-21T09:43:00Z,2023,2,CBT,FALSE,TRUE,FALSE,NSW-SMART-drumline-report-1-July-2022-30-June-2023.pdf
26/02/2023,12:57,Tiger Shark,324,F,Alive,"ID, A",Evans Head,Joggly Point,2023-02-26T12:57:00Z,2023,2,TIG,TRUE,TRUE,TRUE,NSW-SMART-drumline-report-1-July-2022-30-June-2023.pdf
18/07/2022,14:15,White Shark,189,F,Alive,"ID, A",Evans Head,Shark Bay,2022-07-18T14:15:00Z,2022,7,WHI,TRUE,TRUE,TRUE,NSW-SMART-drumline-report-1-July-2022-30-June-2023.pdf
7/12/2022,9:25,Sandbar Whaler,142,F,Alive,ID,Evans Head,Shark Bay,2022-12-07T09:25:00Z,2022,12,SAN,FALSE,TRUE,FALSE,NSW-SMART-drumline-report-1-July-2022-30-June-2023.pdf
26/06/2023,9:40,Greynurse Shark,264,M,Alive,ID,Evans Head,Shark Bay,2023-06-26T09:40:00Z,2023,6,GRN,FALSE,TRUE,FALSE,NSW-SMART-drumline-report-1-July-2022-30-June-2023.pdf
12/07/2022,7:07,White Shark,300,NA,Alive,NA,Evans Head,Main Beach,2022-07-12T07:07:00Z,2022,7,WHI,TRUE,FALSE,FALSE,NSW-SMART-drumline-report-1-July-2022-30-June-2023.pdf
13/07/2022,9:45,White Shark,238,F,Alive,"ID, A",Evans Head,Main Beach,2022-07-13T09:45:00Z,2022,7,WHI,TRUE,TRUE,TRUE,NSW-SMART-drumline-report-1-July-2022-30-June-2023.pdf
13/07/2022,11:03,White Shark,238,F,Alive,"ID, A",Evans Head,Main Beach,2022-07-13T11:03:00Z,2022,7,WHI,TRUE,TRUE,TRUE,NSW-SMART-drumline-report-1-July-2022-30-June-2023.pdf
16/07/2022,15:18,White Shark,203,F,Alive,"ID, A",Evans Head,Main Beach,2022-07-16T15:18:00Z,2022,7,WHI,TRUE,TRUE,TRUE,NSW-SMART-drumline-report-1-July-2022-30-June-2023.pdf
25/07/2022,15:00,White Shark,234,M,Alive,"ID, A",Evans Head,Main Beach,2022-07-25T15:00:00Z,2022,7,WHI,TRUE,TRUE,TRUE,NSW-SMART-drumline-report-1-July-2022-30-June-2023.pdf
25/07/2022,15:56,Greynurse Shark,269,F,Alive,ID,Evans Head,Main Beach,2022-07-25T15:56:00Z,2022,7,GRN,FALSE,TRUE,FALSE,NSW-SMART-drumline-report-1-July-2022-30-June-2023.pdf
2/08/2022,13:12,Sandbar Whaler,139,F,Alive,ID,Evans Head,Main Beach,2022-08-02T13:12:00Z,2022,8,SAN,FALSE,TRUE,FALSE,NSW-SMART-drumline-report-1-July-2022-30-June-2023.pdf
6/09/2022,9:18,White Shark,231,M,Alive,"ID, A",Evans Head,Main Beach,2022-09-06T09:18:00Z,2022,9,WHI,TRUE,TRUE,TRUE,NSW-SMART-drumline-report-1-July-2022-30-June-2023.pdf
11/09/2022,8:44,White Shark,179,F,Alive,"ID, A",Evans Head,Main Beach,2022-09-11T08:44:00Z,2022,9,WHI,TRUE,TRUE,TRUE,NSW-SMART-drumline-report-1-July-2022-30-June-2023.pdf
19/09/2022,13:36,Bronze Whaler,279,M,Alive,ID,Evans Head,Main Beach,2022-09-19T13:36:00Z,2022,9,BRO,FALSE,TRUE,FALSE,NSW-SMART-drumline-report-1-July-2022-30-June-2023.pdf
20/09/2022,9:42,Bronze Whaler,279,F,Alive,ID,Evans Head,Main Beach,2022-09-20T09:42:00Z,2022,9,BRO,FALSE,TRUE,FALSE,NSW-SMART-drumline-report-1-July-2022-30-June-2023.pdf
2/10/2022,11:59,White Shark,269,F,Alive,"ID, A",Evans Head,Main Beach,2022-10-02T11:59:00Z,2022,10,WHI,TRUE,TRUE,TRUE,NSW-SMART-drumline-report-1-July-2022-30-June-2023.pdf
4/10/2022,14:43,Greynurse Shark,290,F,Alive,ID,Evans Head,Main Beach,2022-10-04T14:43:00Z,2022,10,GRN,FALSE,TRUE,FALSE,NSW-SMART-drumline-report-1-July-2022-30-June-2023.pdf
7/10/2022,11:16,White Shark,162,F,Alive,"ID, A",Evans Head,Main Beach,2022-10-07T11:16:00Z,2022,10,WHI,TRUE,TRUE,TRUE,NSW-SMART-drumline-report-1-July-2022-30-June-2023.pdf
15/10/2022,7:15,White Shark,292,F,Alive,"ID, A",Evans Head,Main Beach,2022-10-15T07:15:00Z,2022,10,WHI,TRUE,TRUE,TRUE,NSW-SMART-drumline-report-1-July-2022-30-June-2023.pdf
17/10/2022,9:44,Smooth Hammerhead,200,NA,Alive,NA,Evans Head,Main Beach,2022-10-17T09:44:00Z,2022,10,SMH,FALSE,FALSE,FALSE,NSW-SMART-drumline-report-1-July-2022-30-June-2023.pdf
20/10/2022,11:11,Sandbar Whaler,198,F,Alive,ID,Evans Head,Main Beach,2022-10-20T11:11:00Z,2022,10,SAN,FALSE,TRUE,FALSE,NSW-SMART-drumline-report-1-July-2022-30-June-2023.pdf
10/11/2022,NA,Sandbar Whaler,124,F,Alive,ID,Evans Head,Main Beach,NA,2022,11,SAN,FALSE,TRUE,FALSE,NSW-SMART-drumline-report-1-July-2022-30-June-2023.pdf
11/11/2022,7:50,White Shark,261,F,Alive,"ID, A",Evans Head,Main Beach,2022-11-11T07:50:00Z,2022,11,WHI,TRUE,TRUE,TRUE,NSW-SMART-drumline-report-1-July-2022-30-June-2023.pdf
20/11/2022,13:55,White Shark,269,M,Alive,"ID, A",Evans Head,Main Beach,2022-11-20T13:55:00Z,2022,11,WHI,TRUE,TRUE,TRUE,NSW-SMART-drumline-report-1-July-2022-30-June-2023.pdf
26/11/2022,11:22,White Shark,258,M,Alive,"ID, A",Evans Head,Main Beach,2022-11-26T11:22:00Z,2022,11,WHI,TRUE,TRUE,TRUE,NSW-SMART-drumline-report-1-July-2022-30-June-2023.pdf
6/12/2022,15:10,Sandbar Whaler,140,F,Alive,ID,Evans Head,Main Beach,2022-12-06T15:10:00Z,2022,12,SAN,FALSE,TRUE,FALSE,NSW-SMART-drumline-report-1-July-2022-30-June-2023.pdf
13/12/2022,7:33,Sandbar Whaler,146,M,Alive,ID,Evans Head,Main Beach,2022-12-13T07:33:00Z,2022,12,SAN,FALSE,TRUE,FALSE,NSW-SMART-drumline-report-1-July-2022-30-June-2023.pdf
13/12/2022,11:33,Sandbar Whaler,135,F,Alive,ID,Evans Head,Main Beach,2022-12-13T11:33:00Z,2022,12,SAN,FALSE,TRUE,FALSE,NSW-SMART-drumline-report-1-July-2022-30-June-2023.pdf
14/12/2022,NA,Sandbar Whaler,123,F,Alive,ID,Evans Head,Main Beach,NA,2022,12,SAN,FALSE,TRUE,FALSE,NSW-SMART-drumline-report-1-July-2022-30-June-2023.pdf
24/12/2022,NA,Common Blacktip,171,F,Alive,ID,Evans Head,Main Beach,NA,2022,12,CBT,FALSE,TRUE,FALSE,NSW-SMART-drumline-report-1-July-2022-30-June-2023.pdf
5/01/2023,9:00,Common Blacktip,171,F,Alive,ID,Evans Head,Main Beach,2023-01-05T09:00:00Z,2023,1,CBT,FALSE,TRUE,FALSE,NSW-SMART-drumline-report-1-July-2022-30-June-2023.pdf
19/01/2023,7:06,Common Blacktip,123,F,Alive,ID,Evans Head,Main Beach,2023-01-19T07:06:00Z,2023,1,CBT,FALSE,TRUE,FALSE,NSW-SMART-drumline-report-1-July-2022-30-June-2023.pdf
2/02/2023,NA,Common Blacktip,153,M,Alive,ID,Evans Head,Main Beach,NA,2023,2,CBT,FALSE,TRUE,FALSE,NSW-SMART-drumline-report-1-July-2022-30-June-2023.pdf
3/03/2023,NA,Mako,370,F,Alive,ID,Evans Head,Main Beach,NA,2023,3,SMA,FALSE,TRUE,FALSE,NSW-SMART-drumline-report-1-July-2022-30-June-2023.pdf
29/03/2023,11:16,Bull Shark,193,M,Alive,"ID, A",Evans Head,Main Beach,2023-03-29T11:16:00Z,2023,3,BUL,TRUE,TRUE,TRUE,NSW-SMART-drumline-report-1-July-2022-30-June-2023.pdf
4/04/2023,8:25,Tiger Shark,201,F,Alive,"ID, A",Evans Head,Main Beach,2023-04-04T08:25:00Z,2023,4,TIG,TRUE,TRUE,TRUE,NSW-SMART-drumline-report-1-July-2022-30-June-2023.pdf
1/05/2023,10:32,Common Blacktip,132,M,Alive,ID,Evans Head,Main Beach,2023-05-01T10:32:00Z,2023,5,CBT,FALSE,TRUE,FALSE,NSW-SMART-drumline-report-1-July-2022-30-June-2023.pdf
25/06/2023,9:47,White Shark,223,F,Alive,"ID, A",Evans Head,Main Beach,2023-06-25T09:47:00Z,2023,6,WHI,TRUE,TRUE,TRUE,NSW-SMART-drumline-report-1-July-2022-30-June-2023.pdf
9/07/2022,10:17,White Shark,220,F,Alive,"ID, A",Evans Head,Airforce Beach,2022-07-09T10:17:00Z,2022,7,WHI,TRUE,TRUE,TRUE,NSW-SMART-drumline-report-1-July-2022-30-June-2023.pdf
13/07/2022,10:10,White Shark,262,M,Alive,"ID, A",Evans Head,Airforce Beach,2022-07-13T10:10:00Z,2022,7,WHI,TRUE,TRUE,TRUE,NSW-SMART-drumline-report-1-July-2022-30-June-2023.pdf
13/07/2022,12:18,White Shark,284,F,Alive,"ID, A",Evans Head,Airforce Beach,2022-07-13T12:18:00Z,2022,7,WHI,TRUE,TRUE,TRUE,NSW-SMART-drumline-report-1-July-2022-30-June-2023.pdf
13/07/2022,14:13,White Shark,242,F,Alive,"ID, A",Evans Head,Airforce Beach,2022-07-13T14:13:00Z,2022,7,WHI,TRUE,TRUE,TRUE,NSW-SMART-drumline-report-1-July-2022-30-June-2023.pdf
17/07/2022,9:18,White Shark,200,M,Alive,"ID, A",Evans Head,Airforce Beach,2022-07-17T09:18:00Z,2022,7,WHI,TRUE,TRUE,TRUE,NSW-SMART-drumline-report-1-July-2022-30-June-2023.pdf
27/07/2022,10:22,Bull Shark,199,F,Alive,"ID, A",Evans Head,Airforce Beach,2022-07-27T10:22:00Z,2022,7,BUL,TRUE,TRUE,TRUE,NSW-SMART-drumline-report-1-July-2022-30-June-2023.pdf
27/07/2022,11:07,Sandbar Whaler,146,F,Alive,ID,Evans Head,Airforce Beach,2022-07-27T11:07:00Z,2022,7,SAN,FALSE,TRUE,FALSE,NSW-SMART-drumline-report-1-July-2022-30-June-2023.pdf
1/08/2022,11:14,White Shark,261,M,Alive,"ID, A",Evans Head,Airforce Beach,2022-08-01T11:14:00Z,2022,8,WHI,TRUE,TRUE,TRUE,NSW-SMART-drumline-report-1-July-2022-30-June-2023.pdf
12/08/2022,8:22,White Shark,171,F,Alive,"ID, A",Evans Head,Airforce Beach,2022-08-12T08:22:00Z,2022,8,WHI,TRUE,TRUE,TRUE,NSW-SMART-drumline-report-1-July-2022-30-June-2023.pdf
12/08/2022,10:55,Tiger Shark,372,F,Alive,"ID, A",Evans Head,Airforce Beach,2022-08-12T10:55:00Z,2022,8,TIG,TRUE,TRUE,TRUE,NSW-SMART-drumline-report-1-July-2022-30-June-2023.pdf
1/09/2022,11:26,Greynurse Shark,257,F,Alive,ID,Evans Head,Airforce Beach,2022-09-01T11:26:00Z,2022,9,GRN,FALSE,TRUE,FALSE,NSW-SMART-drumline-report-1-July-2022-30-June-2023.pdf
1/09/2022,13:57,White Shark,218,F,Alive,"ID, A",Evans Head,Airforce Beach,2022-09-01T13:57:00Z,2022,9,WHI,TRUE,TRUE,TRUE,NSW-SMART-drumline-report-1-July-2022-30-June-2023.pdf
6/09/2022,13:31,White Shark,241,M,Alive,"ID, A",Evans Head,Airforce Beach,2022-09-06T13:31:00Z,2022,9,WHI,TRUE,TRUE,TRUE,NSW-SMART-drumline-report-1-July-2022-30-June-2023.pdf
7/09/2022,12:17,White Shark,273,F,Alive,"ID, A",Evans Head,Airforce Beach,2022-09-07T12:17:00Z,2022,9,WHI,TRUE,TRUE,TRUE,NSW-SMART-drumline-report-1-July-2022-30-June-2023.pdf
17/09/2022,8:33,White Shark,195,F,Alive,"ID, A",Evans Head,Airforce Beach,2022-09-17T08:33:00Z,2022,9,WHI,TRUE,TRUE,TRUE,NSW-SMART-drumline-report-1-July-2022-30-June-2023.pdf
19/09/2022,11:12,Common Blacktip,220,NA,Alive,NA,Evans Head,Airforce Beach,2022-09-19T11:12:00Z,2022,9,CBT,FALSE,FALSE,FALSE,NSW-SMART-drumline-report-1-July-2022-30-June-2023.pdf
25/09/2022,15:12,White Shark,284,M,Alive,"ID, A",Evans Head,Airforce Beach,2022-09-25T15:12:00Z,2022,9,WHI,TRUE,TRUE,TRUE,NSW-SMART-drumline-report-1-July-2022-30-June-2023.pdf
26/09/2022,12:14,White Shark,235,F,Alive,"ID, A",Evans Head,Airforce Beach,2022-09-26T12:14:00Z,2022,9,WHI,TRUE,TRUE,TRUE,NSW-SMART-drumline-report-1-July-2022-30-June-2023.pdf
3/10/2022,15:23,Greynurse Shark,265,F,Alive,ID,Evans Head,Airforce Beach,2022-10-03T15:23:00Z,2022,10,GRN,FALSE,TRUE,FALSE,NSW-SMART-drumline-report-1-July-2022-30-June-2023.pdf
5/10/2022,8:56,White Shark,158,F,Alive,"ID, A",Evans Head,Airforce Beach,2022-10-05T08:56:00Z,2022,10,WHI,TRUE,TRUE,TRUE,NSW-SMART-drumline-report-1-July-2022-30-June-2023.pdf
14/12/2022,12:50,Sandbar Whaler,133,M,Alive,ID,Evans Head,Airforce Beach,2022-12-14T12:50:00Z,2022,12,SAN,FALSE,TRUE,FALSE,NSW-SMART-drumline-report-1-July-2022-30-June-2023.pdf
28/12/2022,10:39,Common Blacktip,158,M,Alive,ID,Evans Head,Airforce Beach,2022-12-28T10:39:00Z,2022,12,CBT,FALSE,TRUE,FALSE,NSW-SMART-drumline-report-1-July-2022-30-June-2023.pdf
16/01/2023,14:27,Bull Shark,190,M,Alive,"ID, A",Evans Head,Airforce Beach,2023-01-16T14:27:00Z,2023,1,BUL,TRUE,TRUE,TRUE,NSW-SMART-drumline-report-1-July-2022-30-June-2023.pdf
18/01/2023,17:04,Scalloped Hammerhead,267,M,Alive,ID,Evans Head,Airforce Beach,2023-01-18T17:04:00Z,2023,1,SCH,FALSE,TRUE,FALSE,NSW-SMART-drumline-report-1-July-2022-30-June-2023.pdf
23/01/2023,11:22,Common Blacktip,152,M,Alive,ID,Evans Head,Airforce Beach,2023-01-23T11:22:00Z,2023,1,CBT,FALSE,TRUE,FALSE,NSW-SMART-drumline-report-1-July-2022-30-June-2023.pdf
3/02/2023,13:13,Tiger Shark,193,F,Alive,"ID, A",Evans Head,Airforce Beach,2023-02-03T13:13:00Z,2023,2,TIG,TRUE,TRUE,TRUE,NSW-SMART-drumline-report-1-July-2022-30-June-2023.pdf
16/02/2023,17:57,Tiger Shark,245,F,Alive,"ID, A",Evans Head,Airforce Beach,2023-02-16T17:57:00Z,2023,2,TIG,TRUE,TRUE,TRUE,NSW-SMART-drumline-report-1-July-2022-30-June-2023.pdf
1/05/2023,13:26,Sandbar Whaler,149,F,Alive,ID,Evans Head,Airforce Beach,2023-05-01T13:26:00Z,2023,5,SAN,FALSE,TRUE,FALSE,NSW-SMART-drumline-report-1-July-2022-30-June-2023.pdf
15/07/2022,12:34,White Shark,311,F,Alive,"ID, A",Yamba - Iluka Bluff to Angourie Point,Angourie Back Beach,2022-07-15T12:34:00Z,2022,7,WHI,TRUE,TRUE,TRUE,NSW-SMART-drumline-report-1-July-2022-30-June-2023.pdf
25/08/2022,10:27,Dusky Whaler,269,M,Alive,ID,Yamba - Iluka Bluff to Angourie Point,Angourie Back Beach,2022-08-25T10:27:00Z,2022,8,DUS,FALSE,TRUE,FALSE,NSW-SMART-drumline-report-1-July-2022-30-June-2023.pdf
26/08/2022,15:18,White Shark,259,F,Alive,"ID, A",Yamba - Iluka Bluff to Angourie Point,Angourie Back Beach,2022-08-26T15:18:00Z,2022,8,WHI,TRUE,TRUE,TRUE,NSW-SMART-drumline-report-1-July-2022-30-June-2023.pdf
2/09/2022,10:36,White Shark,226,M,Alive,"ID, A",Yamba - Iluka Bluff to Angourie Point,Angourie Back Beach,2022-09-02T10:36:00Z,2022,9,WHI,TRUE,TRUE,TRUE,NSW-SMART-drumline-report-1-July-2022-30-June-2023.pdf
10/09/2022,13:43,White Shark,240,F,Alive,"ID, A",Yamba - Iluka Bluff to Angourie Point,Angourie Back Beach,2022-09-10T13:43:00Z,2022,9,WHI,TRUE,TRUE,TRUE,NSW-SMART-drumline-report-1-July-2022-30-June-2023.pdf
5/10/2022,NA,Sandbar Whaler,103,F,Dead,NA,Yamba - Iluka Bluff to Angourie Point,Angourie Back Beach,NA,2022,10,SAN,FALSE,FALSE,FALSE,NSW-SMART-drumline-report-1-July-2022-30-June-2023.pdf
29/10/2022,15:12,Sandbar Whaler,108,F,Alive,ID,Yamba - Iluka Bluff to Angourie Point,Angourie Back Beach,2022-10-29T15:12:00Z,2022,10,SAN,FALSE,TRUE,FALSE,NSW-SMART-drumline-report-1-July-2022-30-June-2023.pdf
10/11/2022,13:18,Sandbar Whaler,120,F,Alive,ID,Yamba - Iluka Bluff to Angourie Point,Angourie Back Beach,2022-11-10T13:18:00Z,2022,11,SAN,FALSE,TRUE,FALSE,NSW-SMART-drumline-report-1-July-2022-30-June-2023.pdf
16/11/2022,7:23,White Shark,225,M,Alive,"ID, A",Yamba - Iluka Bluff to Angourie Point,Angourie Back Beach,2022-11-16T07:23:00Z,2022,11,WHI,TRUE,TRUE,TRUE,NSW-SMART-drumline-report-1-July-2022-30-June-2023.pdf
22/11/2022,16:36,Sandbar Whaler,101,F,Alive,ID,Yamba - Iluka Bluff to Angourie Point,Angourie Back Beach,2022-11-22T16:36:00Z,2022,11,SAN,FALSE,TRUE,FALSE,NSW-SMART-drumline-report-1-July-2022-30-June-2023.pdf
24/11/2022,10:33,Scalloped Hammerhead,152,F,Alive,ID,Yamba - Iluka Bluff to Angourie Point,Angourie Back Beach,2022-11-24T10:33:00Z,2022,11,SCH,FALSE,TRUE,FALSE,NSW-SMART-drumline-report-1-July-2022-30-June-2023.pdf
9/03/2023,15:48,Bull Shark,187,F,Alive,"ID, A",Yamba - Iluka Bluff to Angourie Point,Angourie Back Beach,2023-03-09T15:48:00Z,2023,3,BUL,TRUE,TRUE,TRUE,NSW-SMART-drumline-report-1-July-2022-30-June-2023.pdf
1/05/2023,8:38,Bull Shark,175,M,Alive,"ID, A",Yamba - Iluka Bluff to Angourie Point,Angourie Back Beach,2023-05-01T08:38:00Z,2023,5,BUL,TRUE,TRUE,TRUE,NSW-SMART-drumline-report-1-July-2022-30-June-2023.pdf
5/05/2023,9:57,Sandbar Whaler,132,M,Alive,ID,Yamba - Iluka Bluff to Angourie Point,Angourie Back Beach,2023-05-05T09:57:00Z,2023,5,SAN,FALSE,TRUE,FALSE,NSW-SMART-drumline-report-1-July-2022-30-June-2023.pdf
15/07/2022,8:40,White Shark,243,M,Alive,"ID, A",Yamba - Iluka Bluff to Angourie Point,Angourie Point,2022-07-15T08:40:00Z,2022,7,WHI,TRUE,TRUE,TRUE,NSW-SMART-drumline-report-1-July-2022-30-June-2023.pdf
25/08/2022,9:09,Bronze Whaler,301,F,Alive,ID,Yamba - Iluka Bluff to Angourie Point,Angourie Point,2022-08-25T09:09:00Z,2022,8,BRO,FALSE,TRUE,FALSE,NSW-SMART-drumline-report-1-July-2022-30-June-2023.pdf
26/10/2022,11:17,White Shark,313,F,Alive,"ID, A",Yamba - Iluka Bluff to Angourie Point,Angourie Point,2022-10-26T11:17:00Z,2022,10,WHI,TRUE,TRUE,TRUE,NSW-SMART-drumline-report-1-July-2022-30-June-2023.pdf
11/11/2022,9:41,Smooth Hammerhead,153,M,Alive,ID,Yamba - Iluka Bluff to Angourie Point,Angourie Point,2022-11-11T09:41:00Z,2022,11,SMH,FALSE,TRUE,FALSE,NSW-SMART-drumline-report-1-July-2022-30-June-2023.pdf
10/01/2023,11:51,Tiger Shark,200,F,Alive,"ID, A",Yamba - Iluka Bluff to Angourie Point,Angourie Point,2023-01-10T11:51:00Z,2023,1,TIG,TRUE,TRUE,TRUE,NSW-SMART-drumline-report-1-July-2022-30-June-2023.pdf
11/04/2023,8:35,Bull Shark,182,M,Alive,"ID, A",Yamba - Iluka Bluff to Angourie Point,Angourie Point,2023-04-11T08:35:00Z,2023,4,BUL,TRUE,TRUE,TRUE,NSW-SMART-drumline-report-1-July-2022-30-June-2023.pdf
3/05/2023,11:02,Sandbar Whaler,152,M,Alive,ID,Yamba - Iluka Bluff to Angourie Point,Angourie Point,2023-05-03T11:02:00Z,2023,5,SAN,FALSE,TRUE,FALSE,NSW-SMART-drumline-report-1-July-2022-30-June-2023.pdf
13/05/2023,9:20,Smooth Hammerhead,172,M,Alive,ID,Yamba - Iluka Bluff to Angourie Point,Angourie Point,2023-05-13T09:20:00Z,2023,5,SMH,FALSE,TRUE,FALSE,NSW-SMART-drumline-report-1-July-2022-30-June-2023.pdf
16/05/2023,11:24,Smooth Hammerhead,110,NA,Alive,NA,Yamba - Iluka Bluff to Angourie Point,Angourie Point,2023-05-16T11:24:00Z,2023,5,SMH,FALSE,FALSE,FALSE,NSW-SMART-drumline-report-1-July-2022-30-June-2023.pdf
12/07/2022,13:34,White Shark,300,NA,Alive,NA,Yamba - Iluka Bluff to Angourie Point,Spooky Beach,2022-07-12T13:34:00Z,2022,7,WHI,TRUE,FALSE,FALSE,NSW-SMART-drumline-report-1-July-2022-30-June-2023.pdf
15/07/2022,8:04,White Shark,264,F,Alive,"ID, A",Yamba - Iluka Bluff to Angourie Point,Spooky Beach,2022-07-15T08:04:00Z,2022,7,WHI,TRUE,TRUE,TRUE,NSW-SMART-drumline-report-1-July-2022-30-June-2023.pdf
29/07/2022,12:37,White Shark,245,F,Alive,"ID, A",Yamba - Iluka Bluff to Angourie Point,Spooky Beach,2022-07-29T12:37:00Z,2022,7,WHI,TRUE,TRUE,TRUE,NSW-SMART-drumline-report-1-July-2022-30-June-2023.pdf
15/08/2022,13:37,Mako,183,F,Alive,ID,Yamba - Iluka Bluff to Angourie Point,Spooky Beach,2022-08-15T13:37:00Z,2022,8,SMA,FALSE,TRUE,FALSE,NSW-SMART-drumline-report-1-July-2022-30-June-2023.pdf
4/02/2023,8:32,Great Hammerhead,385,F,Alive,ID,Yamba - Iluka Bluff to Angourie Point,Spooky Beach,2023-02-04T08:32:00Z,2023,2,GHH,FALSE,TRUE,FALSE,NSW-SMART-drumline-report-1-July-2022-30-June-2023.pdf
16/02/2023,11:21,Tiger Shark,245,F,Alive,"ID, A",Yamba - Iluka Bluff to Angourie Point,Spooky Beach,2023-02-16T11:21:00Z,2023,2,TIG,TRUE,TRUE,TRUE,NSW-SMART-drumline-report-1-July-2022-30-June-2023.pdf
17/07/2022,8:57,White Shark,192,F,Alive,"ID, A",Yamba - Iluka Bluff to Angourie Point,Green Point,2022-07-17T08:57:00Z,2022,7,WHI,TRUE,TRUE,TRUE,NSW-SMART-drumline-report-1-July-2022-30-June-2023.pdf
3/08/2022,8:58,White Shark,188,F,Alive,"ID, A",Yamba - Iluka Bluff to Angourie Point,Green Point,2022-08-03T08:58:00Z,2022,8,WHI,TRUE,TRUE,TRUE,NSW-SMART-drumline-report-1-July-2022-30-June-2023.pdf
29/08/2022,14:44,White Shark,266,F,Alive,"ID, A",Yamba - Iluka Bluff to Angourie Point,Green Point,2022-08-29T14:44:00Z,2022,8,WHI,TRUE,TRUE,TRUE,NSW-SMART-drumline-report-1-July-2022-30-June-2023.pdf
20/05/2023,14:42,White Shark,255,M,Alive,"ID, A",Yamba - Iluka Bluff to Angourie Point,Green Point,2023-05-20T14:42:00Z,2023,5,WHI,TRUE,TRUE,TRUE,NSW-SMART-drumline-report-1-July-2022-30-June-2023.pdf
7/07/2022,14:10,White Shark,263,M,Alive,"ID, A",Yamba - Iluka Bluff to Angourie Point,Pippi Beach,2022-07-07T14:10:00Z,2022,7,WHI,TRUE,TRUE,TRUE,NSW-SMART-drumline-report-1-July-2022-30-June-2023.pdf
10/07/2022,13:48,White Shark,190,F,Alive,"ID, A",Yamba - Iluka Bluff to Angourie Point,Pippi Beach,2022-07-10T13:48:00Z,2022,7,WHI,TRUE,TRUE,TRUE,NSW-SMART-drumline-report-1-July-2022-30-June-2023.pdf
15/07/2022,8:16,White Shark,212,F,Alive,"ID, A",Yamba - Iluka Bluff to Angourie Point,Pippi Beach,2022-07-15T08:16:00Z,2022,7,WHI,TRUE,TRUE,TRUE,NSW-SMART-drumline-report-1-July-2022-30-June-2023.pdf
25/07/2022,14:59,White Shark,229,F,Alive,"ID, A",Yamba - Iluka Bluff to Angourie Point,Pippi Beach,2022-07-25T14:59:00Z,2022,7,WHI,TRUE,TRUE,TRUE,NSW-SMART-drumline-report-1-July-2022-30-June-2023.pdf
28/07/2022,9:24,White Shark,218,M,Alive,"ID, A",Yamba - Iluka Bluff to Angourie Point,Pippi Beach,2022-07-28T09:24:00Z,2022,7,WHI,TRUE,TRUE,TRUE,NSW-SMART-drumline-report-1-July-2022-30-June-2023.pdf
28/07/2022,13:40,White Shark,231,F,Alive,"ID, A",Yamba - Iluka Bluff to Angourie Point,Pippi Beach,2022-07-28T13:40:00Z,2022,7,WHI,TRUE,TRUE,TRUE,NSW-SMART-drumline-report-1-July-2022-30-June-2023.pdf
5/08/2022,9:43,White Shark,150,NA,Alive,NA,Yamba - Iluka Bluff to Angourie Point,Pippi Beach,2022-08-05T09:43:00Z,2022,8,WHI,TRUE,FALSE,FALSE,NSW-SMART-drumline-report-1-July-2022-30-June-2023.pdf
5/08/2022,NA,Sandbar Whaler,90,F,Alive,ID,Yamba - Iluka Bluff to Angourie Point,Pippi Beach,NA,2022,8,SAN,FALSE,TRUE,FALSE,NSW-SMART-drumline-report-1-July-2022-30-June-2023.pdf
30/08/2022,13:35,White Shark,220,M,Alive,ID,Yamba - Iluka Bluff to Angourie Point,Pippi Beach,2022-08-30T13:35:00Z,2022,8,WHI,TRUE,TRUE,FALSE,NSW-SMART-drumline-report-1-July-2022-30-June-2023.pdf
1/09/2022,NA,Sandbar Whaler,103,M,Alive,ID,Yamba - Iluka Bluff to Angourie Point,Pippi Beach,NA,2022,9,SAN,FALSE,TRUE,FALSE,NSW-SMART-drumline-report-1-July-2022-30-June-2023.pdf
8/09/2022,9:20,White Shark,233,M,Alive,"ID, A",Yamba - Iluka Bluff to Angourie Point,Pippi Beach,2022-09-08T09:20:00Z,2022,9,WHI,TRUE,TRUE,TRUE,NSW-SMART-drumline-report-1-July-2022-30-June-2023.pdf
17/10/2022,15:03,Sandbar Whaler,105,M,Dead,NA,Yamba - Iluka Bluff to Angourie Point,Pippi Beach,2022-10-17T15:03:00Z,2022,10,SAN,FALSE,FALSE,FALSE,NSW-SMART-drumline-report-1-July-2022-30-June-2023.pdf
19/10/2022,8:38,Dusky Whaler,187,M,Alive,ID,Yamba - Iluka Bluff to Angourie Point,Pippi Beach,2022-10-19T08:38:00Z,2022,10,DUS,FALSE,TRUE,FALSE,NSW-SMART-drumline-report-1-July-2022-30-June-2023.pdf
20/10/2022,7:50,White Shark,225,F,Alive,"ID, A",Yamba - Iluka Bluff to Angourie Point,Pippi Beach,2022-10-20T07:50:00Z,2022,10,WHI,TRUE,TRUE,TRUE,NSW-SMART-drumline-report-1-July-2022-30-June-2023.pdf
23/11/2022,9:03,Scalloped Hammerhead,184,F,Alive,ID,Yamba - Iluka Bluff to Angourie Point,Pippi Beach,2022-11-23T09:03:00Z,2022,11,SCH,FALSE,TRUE,FALSE,NSW-SMART-drumline-report-1-July-2022-30-June-2023.pdf
5/12/2022,16:12,Bull Shark,175,F,Alive,"ID, A",Yamba - Iluka Bluff to Angourie Point,Pippi Beach,2022-12-05T16:12:00Z,2022,12,BUL,TRUE,TRUE,TRUE,NSW-SMART-drumline-report-1-July-2022-30-June-2023.pdf
10/02/2023,8:32,Bull Shark,186,F,Alive,"ID, A",Yamba - Iluka Bluff to Angourie Point,Pippi Beach,2023-02-10T08:32:00Z,2023,2,BUL,TRUE,TRUE,TRUE,NSW-SMART-drumline-report-1-July-2022-30-June-2023.pdf
2/03/2023,13:28,White Shark,295,F,Alive,"ID, A",Yamba - Iluka Bluff to Angourie Point,Pippi Beach,2023-03-02T13:28:00Z,2023,3,WHI,TRUE,TRUE,TRUE,NSW-SMART-drumline-report-1-July-2022-30-June-2023.pdf
25/03/2023,15:08,Common Blacktip,160,M,Alive,ID,Yamba - Iluka Bluff to Angourie Point,Pippi Beach,2023-03-25T15:08:00Z,2023,3,CBT,FALSE,TRUE,FALSE,NSW-SMART-drumline-report-1-July-2022-30-June-2023.pdf
30/03/2023,16:27,Unidentified whaler,150,NA,Alive,NA,Yamba - Iluka Bluff to Angourie Point,Pippi Beach,2023-03-30T16:27:00Z,2023,3,WHL,FALSE,FALSE,FALSE,NSW-SMART-drumline-report-1-July-2022-30-June-2023.pdf
26/04/2023,8:30,Bull Shark,182,M,Alive,"ID, A",Yamba - Iluka Bluff to Angourie Point,Pippi Beach,2023-04-26T08:30:00Z,2023,4,BUL,TRUE,TRUE,TRUE,NSW-SMART-drumline-report-1-July-2022-30-June-2023.pdf
8/06/2023,11:33,White Shark,226,F,Alive,"ID, A",Yamba - Iluka Bluff to Angourie Point,Pippi Beach,2023-06-08T11:33:00Z,2023,6,WHI,TRUE,TRUE,TRUE,NSW-SMART-drumline-report-1-July-2022-30-June-2023.pdf
8/07/2022,10:01,White Shark,295,M,Alive,"ID, A",Yamba - Iluka Bluff to Angourie Point,"Main Beach, Yamba",2022-07-08T10:01:00Z,2022,7,WHI,TRUE,TRUE,TRUE,NSW-SMART-drumline-report-1-July-2022-30-June-2023.pdf
10/01/2023,12:24,Bull Shark,182,F,Alive,"ID, A",Yamba - Iluka Bluff to Angourie Point,"Main Beach, Yamba",2023-01-10T12:24:00Z,2023,1,BUL,TRUE,TRUE,TRUE,NSW-SMART-drumline-report-1-July-2022-30-June-2023.pdf
20/03/2023,11:13,Bull Shark,176,M,Alive,"ID, A",Yamba - Iluka Bluff to Angourie Point,"Main Beach, Yamba",2023-03-20T11:13:00Z,2023,3,BUL,TRUE,TRUE,TRUE,NSW-SMART-drumline-report-1-July-2022-30-June-2023.pdf
29/04/2023,8:37,Bull Shark,175,F,Alive,"ID, A",Yamba - Iluka Bluff to Angourie Point,"Main Beach, Yamba",2023-04-29T08:37:00Z,2023,4,BUL,TRUE,TRUE,TRUE,NSW-SMART-drumline-report-1-July-2022-30-June-2023.pdf
2/07/2022,10:09,White Shark,218,M,Alive,"ID, A",Yamba - Iluka Bluff to Angourie Point,Iluka Beach,2022-07-02T10:09:00Z,2022,7,WHI,TRUE,TRUE,TRUE,NSW-SMART-drumline-report-1-July-2022-30-June-2023.pdf
4/07/2022,13:38,White Shark,270,F,Alive,"ID, A",Yamba - Iluka Bluff to Angourie Point,Iluka Beach,2022-07-04T13:38:00Z,2022,7,WHI,TRUE,TRUE,TRUE,NSW-SMART-drumline-report-1-July-2022-30-June-2023.pdf
10/07/2022,9:22,White Shark,310,F,Alive,"ID, A",Yamba - Iluka Bluff to Angourie Point,Iluka Beach,2022-07-10T09:22:00Z,2022,7,WHI,TRUE,TRUE,TRUE,NSW-SMART-drumline-report-1-July-2022-30-June-2023.pdf
13/07/2022,12:20,White Shark,223,F,Alive,"ID, A",Yamba - Iluka Bluff to Angourie Point,Iluka Beach,2022-07-13T12:20:00Z,2022,7,WHI,TRUE,TRUE,TRUE,NSW-SMART-drumline-report-1-July-2022-30-June-2023.pdf
13/07/2022,12:57,White Shark,262,M,Alive,"ID, A",Yamba - Iluka Bluff to Angourie Point,Iluka Beach,2022-07-13T12:57:00Z,2022,7,WHI,TRUE,TRUE,TRUE,NSW-SMART-drumline-report-1-July-2022-30-June-2023.pdf
24/08/2022,13:14,White Shark,234,F,Alive,"ID, A",Yamba - Iluka Bluff to Angourie Point,Iluka Beach,2022-08-24T13:14:00Z,2022,8,WHI,TRUE,TRUE,TRUE,NSW-SMART-drumline-report-1-July-2022-30-June-2023.pdf
13/09/2022,13:50,Unidentified Whaler,200,F,Alive,NA,Yamba - Iluka Bluff to Angourie Point,Iluka Beach,2022-09-13T13:50:00Z,2022,9,WHL,FALSE,FALSE,FALSE,NSW-SMART-drumline-report-1-July-2022-30-June-2023.pdf
19/10/2022,10:15,White Shark,240,F,Alive,"ID, A",Yamba - Iluka Bluff to Angourie Point,Iluka Beach,2022-10-19T10:15:00Z,2022,10,WHI,TRUE,TRUE,TRUE,NSW-SMART-drumline-report-1-July-2022-30-June-2023.pdf
19/10/2022,14:13,White Shark,221,F,Alive,"ID, A",Yamba - Iluka Bluff to Angourie Point,Iluka Beach,2022-10-19T14:13:00Z,2022,10,WHI,TRUE,TRUE,TRUE,NSW-SMART-drumline-report-1-July-2022-30-June-2023.pdf
16/11/2022,10:47,Dusky Whaler,160,M,Alive,ID,Yamba - Iluka Bluff to Angourie Point,Iluka Beach,2022-11-16T10:47:00Z,2022,11,DUS,FALSE,TRUE,FALSE,NSW-SMART-drumline-report-1-July-2022-30-June-2023.pdf
23/11/2022,10:29,Bull Shark,290,F,Alive,"ID, A",Yamba - Iluka Bluff to Angourie Point,Iluka Beach,2022-11-23T10:29:00Z,2022,11,BUL,TRUE,TRUE,TRUE,NSW-SMART-drumline-report-1-July-2022-30-June-2023.pdf
5/12/2022,10:00,Bull Shark,183,F,Alive,"ID, A",Yamba - Iluka Bluff to Angourie Point,Iluka Beach,2022-12-05T10:00:00Z,2022,12,BUL,TRUE,TRUE,TRUE,NSW-SMART-drumline-report-1-July-2022-30-June-2023.pdf
27/12/2022,8:36,White Shark,310,F,Alive,"ID, A",Yamba - Iluka Bluff to Angourie Point,Iluka Beach,2022-12-27T08:36:00Z,2022,12,WHI,TRUE,TRUE,TRUE,NSW-SMART-drumline-report-1-July-2022-30-June-2023.pdf
9/01/2023,13:56,Scalloped Hammerhead,170,M,Alive,ID,Yamba - Iluka Bluff to Angourie Point,Iluka Beach,2023-01-09T13:56:00Z,2023,1,SCH,FALSE,TRUE,FALSE,NSW-SMART-drumline-report-1-July-2022-30-June-2023.pdf
27/01/2023,8:10,Bull Shark,172,F,Alive,"ID, A",Yamba - Iluka Bluff to Angourie Point,Iluka Beach,2023-01-27T08:10:00Z,2023,1,BUL,TRUE,TRUE,TRUE,NSW-SMART-drumline-report-1-July-2022-30-June-2023.pdf
28/01/2023,14:26,Dusky Whaler,210,F,Alive,"ID, A",Yamba - Iluka Bluff to Angourie Point,Iluka Beach,2023-01-28T14:26:00Z,2023,1,DUS,FALSE,TRUE,TRUE,NSW-SMART-drumline-report-1-July-2022-30-June-2023.pdf
18/02/2023,13:54,Great Hammerhead,350,F,Alive,ID,Yamba - Iluka Bluff to Angourie Point,Iluka Beach,2023-02-18T13:54:00Z,2023,2,GHH,FALSE,TRUE,FALSE,NSW-SMART-drumline-report-1-July-2022-30-June-2023.pdf
26/02/2023,13:56,Bull Shark,162,F,Alive,"ID, A",Yamba - Iluka Bluff to Angourie Point,Iluka Beach,2023-02-26T13:56:00Z,2023,2,BUL,TRUE,TRUE,TRUE,NSW-SMART-drumline-report-1-July-2022-30-June-2023.pdf
17/03/2023,9:18,Bull Shark,190,F,Alive,"ID, A",Yamba - Iluka Bluff to Angourie Point,Iluka Beach,2023-03-17T09:18:00Z,2023,3,BUL,TRUE,TRUE,TRUE,NSW-SMART-drumline-report-1-July-2022-30-June-2023.pdf
31/03/2023,9:16,Bull Shark,195,F,Alive,"ID, A",Yamba - Iluka Bluff to Angourie Point,Iluka Beach,2023-03-31T09:16:00Z,2023,3,BUL,TRUE,TRUE,TRUE,NSW-SMART-drumline-report-1-July-2022-30-June-2023.pdf
2/05/2023,11:30,White Shark,274,F,Alive,"ID, A",Yamba - Iluka Bluff to Angourie Point,Iluka Beach,2023-05-02T11:30:00Z,2023,5,WHI,TRUE,TRUE,TRUE,NSW-SMART-drumline-report-1-July-2022-30-June-2023.pdf
3/05/2023,7:35,Sandbar Whaler,148,M,Alive,ID,Yamba - Iluka Bluff to Angourie Point,Iluka Beach,2023-05-03T07:35:00Z,2023,5,SAN,FALSE,TRUE,FALSE,NSW-SMART-drumline-report-1-July-2022-30-June-2023.pdf
23/06/2023,8:44,White Shark,195,F,Alive,"ID, A",Yamba - Iluka Bluff to Angourie Point,Iluka Beach,2023-06-23T08:44:00Z,2023,6,WHI,TRUE,TRUE,TRUE,NSW-SMART-drumline-report-1-July-2022-30-June-2023.pdf
2/07/2022,13:05,White Shark,186,F,Alive,"ID, A",Coffs Harbour - Coffs Harbour to Sawtell,Sawtell Headland/beach,2022-07-02T13:05:00Z,2022,7,WHI,TRUE,TRUE,TRUE,NSW-SMART-drumline-report-1-July-2022-30-June-2023.pdf
5/07/2022,12:40,White Shark,280,F,Alive,"ID, A",Coffs Harbour - Coffs Harbour to Sawtell,Sawtell Headland/beach,2022-07-05T12:40:00Z,2022,7,WHI,TRUE,TRUE,TRUE,NSW-SMART-drumline-report-1-July-2022-30-June-2023.pdf
19/07/2022,10:51,White Shark,216,M,Alive,"ID, A",Coffs Harbour - Coffs Harbour to Sawtell,Sawtell Headland/beach,2022-07-19T10:51:00Z,2022,7,WHI,TRUE,TRUE,TRUE,NSW-SMART-drumline-report-1-July-2022-30-June-2023.pdf
25/07/2022,8:34,White Shark,225,F,Alive,"ID, A",Coffs Harbour - Coffs Harbour to Sawtell,Sawtell Headland/beach,2022-07-25T08:34:00Z,2022,7,WHI,TRUE,TRUE,TRUE,NSW-SMART-drumline-report-1-July-2022-30-June-2023.pdf
25/07/2022,8:50,Common Blacktip,296,F,Alive,ID,Coffs Harbour - Coffs Harbour to Sawtell,Sawtell Headland/beach,2022-07-25T08:50:00Z,2022,7,CBT,FALSE,TRUE,FALSE,NSW-SMART-drumline-report-1-July-2022-30-June-2023.pdf
3/08/2022,8:25,White Shark,215,M,Alive,"ID, A",Coffs Harbour - Coffs Harbour to Sawtell,Sawtell Headland/beach,2022-08-03T08:25:00Z,2022,8,WHI,TRUE,TRUE,TRUE,NSW-SMART-drumline-report-1-July-2022-30-June-2023.pdf
6/08/2022,NA,Dusky Whaler,134,F,Alive,ID,Coffs Harbour - Coffs Harbour to Sawtell,Sawtell Headland/beach,NA,2022,8,DUS,FALSE,TRUE,FALSE,NSW-SMART-drumline-report-1-July-2022-30-June-2023.pdf
11/08/2022,14:35,White Shark,230,F,Alive,"ID, A",Coffs Harbour - Coffs Harbour to Sawtell,Sawtell Headland/beach,2022-08-11T14:35:00Z,2022,8,WHI,TRUE,TRUE,TRUE,NSW-SMART-drumline-report-1-July-2022-30-June-2023.pdf
18/08/2022,7:42,White Shark,232,M,Alive,"ID, A",Coffs Harbour - Coffs Harbour to Sawtell,Sawtell Headland/beach,2022-08-18T07:42:00Z,2022,8,WHI,TRUE,TRUE,TRUE,NSW-SMART-drumline-report-1-July-2022-30-June-2023.pdf
21/08/2022,10:51,Bronze Whaler,236,F,Alive,ID,Coffs Harbour - Coffs Harbour to Sawtell,Sawtell Headland/beach,2022-08-21T10:51:00Z,2022,8,BRO,FALSE,TRUE,FALSE,NSW-SMART-drumline-report-1-July-2022-30-June-2023.pdf
27/08/2022,13:56,White Shark,164,F,Alive,"ID, A",Coffs Harbour - Coffs Harbour to Sawtell,Sawtell Headland/beach,2022-08-27T13:56:00Z,2022,8,WHI,TRUE,TRUE,TRUE,NSW-SMART-drumline-report-1-July-2022-30-June-2023.pdf
30/08/2022,8:04,White Shark,228,M,Alive,"ID, A",Coffs Harbour - Coffs Harbour to Sawtell,Sawtell Headland/beach,2022-08-30T08:04:00Z,2022,8,WHI,TRUE,TRUE,TRUE,NSW-SMART-drumline-report-1-July-2022-30-June-2023.pdf
30/08/2022,8:43,White Shark,205,F,Alive,"ID, A",Coffs Harbour - Coffs Harbour to Sawtell,Sawtell Headland/beach,2022-08-30T08:43:00Z,2022,8,WHI,TRUE,TRUE,TRUE,NSW-SMART-drumline-report-1-July-2022-30-June-2023.pdf
30/08/2022,10:32,White Shark,182,F,Alive,"ID, A",Coffs Harbour - Coffs Harbour to Sawtell,Sawtell Headland/beach,2022-08-30T10:32:00Z,2022,8,WHI,TRUE,TRUE,TRUE,NSW-SMART-drumline-report-1-July-2022-30-June-2023.pdf
31/08/2022,12:51,White Shark,242,F,Alive,"ID, A",Coffs Harbour - Coffs Harbour to Sawtell,Sawtell Headland/beach,2022-08-31T12:51:00Z,2022,8,WHI,TRUE,TRUE,TRUE,NSW-SMART-drumline-report-1-July-2022-30-June-2023.pdf
31/08/2022,12:57,White Shark,212,M,Alive,"ID, A",Coffs Harbour - Coffs Harbour to Sawtell,Sawtell Headland/beach,2022-08-31T12:57:00Z,2022,8,WHI,TRUE,TRUE,TRUE,NSW-SMART-drumline-report-1-July-2022-30-June-2023.pdf
8/09/2022,10:19,Bronze Whaler,275,M,Alive,ID,Coffs Harbour - Coffs Harbour to Sawtell,Sawtell Headland/beach,2022-09-08T10:19:00Z,2022,9,BRO,FALSE,TRUE,FALSE,NSW-SMART-drumline-report-1-July-2022-30-June-2023.pdf
9/09/2022,8:53,Bronze Whaler,248,M,Alive,ID,Coffs Harbour - Coffs Harbour to Sawtell,Sawtell Headland/beach,2022-09-09T08:53:00Z,2022,9,BRO,FALSE,TRUE,FALSE,NSW-SMART-drumline-report-1-July-2022-30-June-2023.pdf
9/09/2022,10:38,White Shark,227,M,Alive,"ID, A",Coffs Harbour - Coffs Harbour to Sawtell,Sawtell Headland/beach,2022-09-09T10:38:00Z,2022,9,WHI,TRUE,TRUE,TRUE,NSW-SMART-drumline-report-1-July-2022-30-June-2023.pdf
10/09/2022,9:17,White Shark,245,M,Alive,"ID, A",Coffs Harbour - Coffs Harbour to Sawtell,Sawtell Headland/beach,2022-09-10T09:17:00Z,2022,9,WHI,TRUE,TRUE,TRUE,NSW-SMART-drumline-report-1-July-2022-30-June-2023.pdf
14/09/2022,14:19,Bronze Whaler,255,F,Alive,ID,Coffs Harbour - Coffs Harbour to Sawtell,Sawtell Headland/beach,2022-09-14T14:19:00Z,2022,9,BRO,FALSE,TRUE,FALSE,NSW-SMART-drumline-report-1-July-2022-30-June-2023.pdf
18/09/2022,14:30,Dusky Whaler,148,M,Alive,ID,Coffs Harbour - Coffs Harbour to Sawtell,Sawtell Headland/beach,2022-09-18T14:30:00Z,2022,9,DUS,FALSE,TRUE,FALSE,NSW-SMART-drumline-report-1-July-2022-30-June-2023.pdf
19/09/2022,10:54,Unidentified Whaler,250,NA,Alive,NA,Coffs Harbour - Coffs Harbour to Sawtell,Sawtell Headland/beach,2022-09-19T10:54:00Z,2022,9,WHL,FALSE,FALSE,FALSE,NSW-SMART-drumline-report-1-July-2022-30-June-2023.pdf
3/10/2022,9:55,Unidentified Whaler,280,NA,Alive,NA,Coffs Harbour - Coffs Harbour to Sawtell,Sawtell Headland/beach,2022-10-03T09:55:00Z,2022,10,WHL,FALSE,FALSE,FALSE,NSW-SMART-drumline-report-1-July-2022-30-June-2023.pdf
3/10/2022,13:19,White Shark,189,F,Alive,"ID, A",Coffs Harbour - Coffs Harbour to Sawtell,Sawtell Headland/beach,2022-10-03T13:19:00Z,2022,10,WHI,TRUE,TRUE,TRUE,NSW-SMART-drumline-report-1-July-2022-30-June-2023.pdf
16/10/2022,9:40,White Shark,214,M,Alive,"ID, A",Coffs Harbour - Coffs Harbour to Sawtell,Sawtell Headland/beach,2022-10-16T09:40:00Z,2022,10,WHI,TRUE,TRUE,TRUE,NSW-SMART-drumline-report-1-July-2022-30-June-2023.pdf
16/10/2022,11:14,Tiger Shark,227,F,Alive,"ID, A",Coffs Harbour - Coffs Harbour to Sawtell,Sawtell Headland/beach,2022-10-16T11:14:00Z,2022,10,TIG,TRUE,TRUE,TRUE,NSW-SMART-drumline-report-1-July-2022-30-June-2023.pdf
16/10/2022,12:32,Bronze Whaler,290,NA,Alive,NA,Coffs Harbour - Coffs Harbour to Sawtell,Sawtell Headland/beach,2022-10-16T12:32:00Z,2022,10,BRO,FALSE,FALSE,FALSE,NSW-SMART-drumline-report-1-July-2022-30-June-2023.pdf
17/10/2022,16:25,White Shark,187,F,Alive,"ID, A",Coffs Harbour - Coffs Harbour to Sawtell,Sawtell Headland/beach,2022-10-17T16:25:00Z,2022,10,WHI,TRUE,TRUE,TRUE,NSW-SMART-drumline-report-1-July-2022-30-June-2023.pdf
2/11/2022,8:27,White Shark,181,F,Alive,"ID, A",Coffs Harbour - Coffs Harbour to Sawtell,Sawtell Headland/beach,2022-11-02T08:27:00Z,2022,11,WHI,TRUE,TRUE,TRUE,NSW-SMART-drumline-report-1-July-2022-30-June-2023.pdf
3/11/2022,13:08,Bronze Whaler,281,M,Alive,ID,Coffs Harbour - Coffs Harbour to Sawtell,Sawtell Headland/beach,2022-11-03T13:08:00Z,2022,11,BRO,FALSE,TRUE,FALSE,NSW-SMART-drumline-report-1-July-2022-30-June-2023.pdf
8/11/2022,15:52,Smooth Hammerhead,167,F,Alive,ID,Coffs Harbour - Coffs Harbour to Sawtell,Sawtell Headland/beach,2022-11-08T15:52:00Z,2022,11,SMH,FALSE,TRUE,FALSE,NSW-SMART-drumline-report-1-July-2022-30-June-2023.pdf
9/11/2022,12:58,Bronze Whaler,259,M,Alive,ID,Coffs Harbour - Coffs Harbour to Sawtell,Sawtell Headland/beach,2022-11-09T12:58:00Z,2022,11,BRO,FALSE,TRUE,FALSE,NSW-SMART-drumline-report-1-July-2022-30-June-2023.pdf
23/11/2022,10:38,Smooth Hammerhead,187,F,Alive,ID,Coffs Harbour - Coffs Harbour to Sawtell,Sawtell Headland/beach,2022-11-23T10:38:00Z,2022,11,SMH,FALSE,TRUE,FALSE,NSW-SMART-drumline-report-1-July-2022-30-June-2023.pdf
5/12/2022,NA,Dusky Whaler,107,F,Dead,NA,Coffs Harbour - Coffs Harbour to Sawtell,Sawtell Headland/beach,NA,2022,12,DUS,FALSE,FALSE,FALSE,NSW-SMART-drumline-report-1-July-2022-30-June-2023.pdf
8/12/2022,NA,Mako,81,F,Alive,ID,Coffs Harbour - Coffs Harbour to Sawtell,Sawtell Headland/beach,NA,2022,12,SMA,FALSE,TRUE,FALSE,NSW-SMART-drumline-report-1-July-2022-30-June-2023.pdf
13/12/2022,8:27,Tiger Shark,378,M,Alive,"ID, A",Coffs Harbour - Coffs Harbour to Sawtell,Sawtell Headland/beach,2022-12-13T08:27:00Z,2022,12,TIG,TRUE,TRUE,TRUE,NSW-SMART-drumline-report-1-July-2022-30-June-2023.pdf
15/12/2022,10:06,Great Hammerhead,328,M,Alive,ID,Coffs Harbour - Coffs Harbour to Sawtell,Sawtell Headland/beach,2022-12-15T10:06:00Z,2022,12,GHH,FALSE,TRUE,FALSE,NSW-SMART-drumline-report-1-July-2022-30-June-2023.pdf
28/12/2022,17:09,Tiger Shark,253,F,Alive,"ID, A",Coffs Harbour - Coffs Harbour to Sawtell,Sawtell Headland/beach,2022-12-28T17:09:00Z,2022,12,TIG,TRUE,TRUE,TRUE,NSW-SMART-drumline-report-1-July-2022-30-June-2023.pdf
11/01/2023,10:52,Common Blacktip,190,M,Alive,ID,Coffs Harbour - Coffs Harbour to Sawtell,Sawtell Headland/beach,2023-01-11T10:52:00Z,2023,1,CBT,FALSE,TRUE,FALSE,NSW-SMART-drumline-report-1-July-2022-30-June-2023.pdf
16/01/2023,12:33,Tiger Shark,199,F,Alive,"ID, A",Coffs Harbour - Coffs Harbour to Sawtell,Sawtell Headland/beach,2023-01-16T12:33:00Z,2023,1,TIG,TRUE,TRUE,TRUE,NSW-SMART-drumline-report-1-July-2022-30-June-2023.pdf
18/01/2023,15:06,Tiger Shark,139,M,Alive,"ID, A",Coffs Harbour - Coffs Harbour to Sawtell,Sawtell Headland/beach,2023-01-18T15:06:00Z,2023,1,TIG,TRUE,TRUE,TRUE,NSW-SMART-drumline-report-1-July-2022-30-June-2023.pdf
31/01/2023,16:31,Tiger Shark,272,F,Alive,"ID, A",Coffs Harbour - Coffs Harbour to Sawtell,Sawtell Headland/beach,2023-01-31T16:31:00Z,2023,1,TIG,TRUE,TRUE,TRUE,NSW-SMART-drumline-report-1-July-2022-30-June-2023.pdf
5/02/2023,9:57,Tiger Shark,230,F,Alive,"ID, A",Coffs Harbour - Coffs Harbour to Sawtell,Sawtell Headland/beach,2023-02-05T09:57:00Z,2023,2,TIG,TRUE,TRUE,TRUE,NSW-SMART-drumline-report-1-July-2022-30-June-2023.pdf
9/02/2023,11:30,Tiger Shark,255,F,Alive,"ID, A",Coffs Harbour - Coffs Harbour to Sawtell,Sawtell Headland/beach,2023-02-09T11:30:00Z,2023,2,TIG,TRUE,TRUE,TRUE,NSW-SMART-drumline-report-1-July-2022-30-June-2023.pdf
22/02/2023,8:24,Tiger Shark,264,F,Alive,"ID, A",Coffs Harbour - Coffs Harbour to Sawtell,Sawtell Headland/beach,2023-02-22T08:24:00Z,2023,2,TIG,TRUE,TRUE,TRUE,NSW-SMART-drumline-report-1-July-2022-30-June-2023.pdf
23/03/2023,10:26,Tiger Shark,274,M,Alive,"ID, A",Coffs Harbour - Coffs Harbour to Sawtell,Sawtell Headland/beach,2023-03-23T10:26:00Z,2023,3,TIG,TRUE,TRUE,TRUE,NSW-SMART-drumline-report-1-July-2022-30-June-2023.pdf
10/04/2023,10:38,Dusky Whaler,267,F,Alive,ID,Coffs Harbour - Coffs Harbour to Sawtell,Sawtell Headland/beach,2023-04-10T10:38:00Z,2023,4,DUS,FALSE,TRUE,FALSE,NSW-SMART-drumline-report-1-July-2022-30-June-2023.pdf
28/05/2023,14:11,Tiger Shark,172,F,Alive,"ID, A",Coffs Harbour - Coffs Harbour to Sawtell,Sawtell Headland/beach,2023-05-28T14:11:00Z,2023,5,TIG,TRUE,TRUE,TRUE,NSW-SMART-drumline-report-1-July-2022-30-June-2023.pdf
31/05/2023,14:36,Dusky Whaler,246,F,Alive,ID,Coffs Harbour - Coffs Harbour to Sawtell,Sawtell Headland/beach,2023-05-31T14:36:00Z,2023,5,DUS,FALSE,TRUE,FALSE,NSW-SMART-drumline-report-1-July-2022-30-June-2023.pdf
1/07/2022,14:32,White Shark,295,M,Alive,"ID, A",Coffs Harbour - Coffs Harbour to Sawtell,Boambee Beach,2022-07-01T14:32:00Z,2022,7,WHI,TRUE,TRUE,TRUE,NSW-SMART-drumline-report-1-July-2022-30-June-2023.pdf
2/07/2022,10:05,Bronze Whaler,271,M,Alive,ID,Coffs Harbour - Coffs Harbour to Sawtell,Boambee Beach,2022-07-02T10:05:00Z,2022,7,BRO,FALSE,TRUE,FALSE,NSW-SMART-drumline-report-1-July-2022-30-June-2023.pdf
8/07/2022,12:47,White Shark,247,M,Alive,"ID, A",Coffs Harbour - Coffs Harbour to Sawtell,Boambee Beach,2022-07-08T12:47:00Z,2022,7,WHI,TRUE,TRUE,TRUE,NSW-SMART-drumline-report-1-July-2022-30-June-2023.pdf
10/07/2022,9:33,White Shark,273,F,Alive,"ID, A",Coffs Harbour - Coffs Harbour to Sawtell,Boambee Beach,2022-07-10T09:33:00Z,2022,7,WHI,TRUE,TRUE,TRUE,NSW-SMART-drumline-report-1-July-2022-30-June-2023.pdf
12/07/2022,10:01,White Shark,259,F,Alive,"ID, A",Coffs Harbour - Coffs Harbour to Sawtell,Boambee Beach,2022-07-12T10:01:00Z,2022,7,WHI,TRUE,TRUE,TRUE,NSW-SMART-drumline-report-1-July-2022-30-June-2023.pdf
19/07/2022,8:22,Bronze Whaler,252,M,Alive,ID,Coffs Harbour - Coffs Harbour to Sawtell,Boambee Beach,2022-07-19T08:22:00Z,2022,7,BRO,FALSE,TRUE,FALSE,NSW-SMART-drumline-report-1-July-2022-30-June-2023.pdf
29/07/2022,10:10,Bronze Whaler,254,F,Alive,ID,Coffs Harbour - Coffs Harbour to Sawtell,Boambee Beach,2022-07-29T10:10:00Z,2022,7,BRO,FALSE,TRUE,FALSE,NSW-SMART-drumline-report-1-July-2022-30-June-2023.pdf
1/08/2022,10:24,Unidentified Whaler,350,NA,Alive,NA,Coffs Harbour - Coffs Harbour to Sawtell,Boambee Beach,2022-08-01T10:24:00Z,2022,8,WHL,FALSE,FALSE,FALSE,NSW-SMART-drumline-report-1-July-2022-30-June-2023.pdf
3/08/2022,14:48,Tiger Shark,237,M,Alive,"ID, A",Coffs Harbour - Coffs Harbour to Sawtell,Boambee Beach,2022-08-03T14:48:00Z,2022,8,TIG,TRUE,TRUE,TRUE,NSW-SMART-drumline-report-1-July-2022-30-June-2023.pdf
6/08/2022,13:19,Bronze Whaler,271,F,Alive,ID,Coffs Harbour - Coffs Harbour to Sawtell,Boambee Beach,2022-08-06T13:19:00Z,2022,8,BRO,FALSE,TRUE,FALSE,NSW-SMART-drumline-report-1-July-2022-30-June-2023.pdf
11/08/2022,10:56,White Shark,211,F,Alive,"ID, A",Coffs Harbour - Coffs Harbour to Sawtell,Boambee Beach,2022-08-11T10:56:00Z,2022,8,WHI,TRUE,TRUE,TRUE,NSW-SMART-drumline-report-1-July-2022-30-June-2023.pdf
16/08/2022,8:42,Bronze Whaler,251,F,Alive,ID,Coffs Harbour - Coffs Harbour to Sawtell,Boambee Beach,2022-08-16T08:42:00Z,2022,8,BRO,FALSE,TRUE,FALSE,NSW-SMART-drumline-report-1-July-2022-30-June-2023.pdf
18/08/2022,10:35,Bronze Whaler,240,F,Alive,ID,Coffs Harbour - Coffs Harbour to Sawtell,Boambee Beach,2022-08-18T10:35:00Z,2022,8,BRO,FALSE,TRUE,FALSE,NSW-SMART-drumline-report-1-July-2022-30-June-2023.pdf
21/08/2022,9:57,White Shark,221,F,Alive,"ID, A",Coffs Harbour - Coffs Harbour to Sawtell,Boambee Beach,2022-08-21T09:57:00Z,2022,8,WHI,TRUE,TRUE,TRUE,NSW-SMART-drumline-report-1-July-2022-30-June-2023.pdf
26/08/2022,7:54,White Shark,331,F,Alive,"ID, A",Coffs Harbour - Coffs Harbour to Sawtell,Boambee Beach,2022-08-26T07:54:00Z,2022,8,WHI,TRUE,TRUE,TRUE,NSW-SMART-drumline-report-1-July-2022-30-June-2023.pdf
26/08/2022,10:06,White Shark,217,M,Alive,"ID, A",Coffs Harbour - Coffs Harbour to Sawtell,Boambee Beach,2022-08-26T10:06:00Z,2022,8,WHI,TRUE,TRUE,TRUE,NSW-SMART-drumline-report-1-July-2022-30-June-2023.pdf
9/09/2022,10:02,Bronze Whaler,291,F,Alive,ID,Coffs Harbour - Coffs Harbour to Sawtell,Boambee Beach,2022-09-09T10:02:00Z,2022,9,BRO,FALSE,TRUE,FALSE,NSW-SMART-drumline-report-1-July-2022-30-June-2023.pdf
12/09/2022,11:45,White Shark,216,M,Alive,"ID, A",Coffs Harbour - Coffs Harbour to Sawtell,Boambee Beach,2022-09-12T11:45:00Z,2022,9,WHI,TRUE,TRUE,TRUE,NSW-SMART-drumline-report-1-July-2022-30-June-2023.pdf
25/09/2022,14:07,Dusky Whaler,181,M,Alive,ID,Coffs Harbour - Coffs Harbour to Sawtell,Boambee Beach,2022-09-25T14:07:00Z,2022,9,DUS,FALSE,TRUE,FALSE,NSW-SMART-drumline-report-1-July-2022-30-June-2023.pdf
3/10/2022,8:45,Unidentified Whaler,250,NA,Alive,NA,Coffs Harbour - Coffs Harbour to Sawtell,Boambee Beach,2022-10-03T08:45:00Z,2022,10,WHL,FALSE,FALSE,FALSE,NSW-SMART-drumline-report-1-July-2022-30-June-2023.pdf
6/10/2022,11:31,Bronze Whaler,270,M,Alive,ID,Coffs Harbour - Coffs Harbour to Sawtell,Boambee Beach,2022-10-06T11:31:00Z,2022,10,BRO,FALSE,TRUE,FALSE,NSW-SMART-drumline-report-1-July-2022-30-June-2023.pdf
7/10/2022,8:17,White Shark,208,F,Alive,"ID, A",Coffs Harbour - Coffs Harbour to Sawtell,Boambee Beach,2022-10-07T08:17:00Z,2022,10,WHI,TRUE,TRUE,TRUE,NSW-SMART-drumline-report-1-July-2022-30-June-2023.pdf
15/10/2022,13:37,Bronze Whaler,278,M,Alive,ID,Coffs Harbour - Coffs Harbour to Sawtell,Boambee Beach,2022-10-15T13:37:00Z,2022,10,BRO,FALSE,TRUE,FALSE,NSW-SMART-drumline-report-1-July-2022-30-June-2023.pdf
16/10/2022,9:25,Bronze Whaler,275,M,Alive,ID,Coffs Harbour - Coffs Harbour to Sawtell,Boambee Beach,2022-10-16T09:25:00Z,2022,10,BRO,FALSE,TRUE,FALSE,NSW-SMART-drumline-report-1-July-2022-30-June-2023.pdf
17/10/2022,10:52,Dusky Whaler,157,F,Alive,ID,Coffs Harbour - Coffs Harbour to Sawtell,Boambee Beach,2022-10-17T10:52:00Z,2022,10,DUS,FALSE,TRUE,FALSE,NSW-SMART-drumline-report-1-July-2022-30-June-2023.pdf
17/10/2022,13:21,Dusky Whaler,173,M,Alive,ID,Coffs Harbour - Coffs Harbour to Sawtell,Boambee Beach,2022-10-17T13:21:00Z,2022,10,DUS,FALSE,TRUE,FALSE,NSW-SMART-drumline-report-1-July-2022-30-June-2023.pdf
30/10/2022,9:34,Dusky Whaler,155,F,Alive,ID,Coffs Harbour - Coffs Harbour to Sawtell,Boambee Beach,2022-10-30T09:34:00Z,2022,10,DUS,FALSE,TRUE,FALSE,NSW-SMART-drumline-report-1-July-2022-30-June-2023.pdf
22/11/2022,9:07,Scalloped Hammerhead,155,F,Alive,ID,Coffs Harbour - Coffs Harbour to Sawtell,Boambee Beach,2022-11-22T09:07:00Z,2022,11,SCH,FALSE,TRUE,FALSE,NSW-SMART-drumline-report-1-July-2022-30-June-2023.pdf
29/11/2022,15:12,Tiger Shark,167,F,Alive,"ID, A",Coffs Harbour - Coffs Harbour to Sawtell,Boambee Beach,2022-11-29T15:12:00Z,2022,11,TIG,TRUE,TRUE,TRUE,NSW-SMART-drumline-report-1-July-2022-30-June-2023.pdf
17/01/2023,12:50,Tiger Shark,222,F,Alive,"ID, A",Coffs Harbour - Coffs Harbour to Sawtell,Boambee Beach,2023-01-17T12:50:00Z,2023,1,TIG,TRUE,TRUE,TRUE,NSW-SMART-drumline-report-1-July-2022-30-June-2023.pdf
16/02/2023,17:45,Tiger Shark,340,F,Alive,"ID, A",Coffs Harbour - Coffs Harbour to Sawtell,Boambee Beach,2023-02-16T17:45:00Z,2023,2,TIG,TRUE,TRUE,TRUE,NSW-SMART-drumline-report-1-July-2022-30-June-2023.pdf
2/03/2023,10:18,Tiger Shark,230,F,Alive,"ID, A",Coffs Harbour - Coffs Harbour to Sawtell,Boambee Beach,2023-03-02T10:18:00Z,2023,3,TIG,TRUE,TRUE,TRUE,NSW-SMART-drumline-report-1-July-2022-30-June-2023.pdf
24/03/2023,8:20,White Shark,244,M,Alive,"ID, A",Coffs Harbour - Coffs Harbour to Sawtell,Boambee Beach,2023-03-24T08:20:00Z,2023,3,WHI,TRUE,TRUE,TRUE,NSW-SMART-drumline-report-1-July-2022-30-June-2023.pdf
25/03/2023,15:08,Tiger Shark,248,F,Alive,"ID, A",Coffs Harbour - Coffs Harbour to Sawtell,Boambee Beach,2023-03-25T15:08:00Z,2023,3,TIG,TRUE,TRUE,TRUE,NSW-SMART-drumline-report-1-July-2022-30-June-2023.pdf
11/04/2023,8:42,Tiger Shark,249,F,Alive,"ID, A",Coffs Harbour - Coffs Harbour to Sawtell,Boambee Beach,2023-04-11T08:42:00Z,2023,4,TIG,TRUE,TRUE,TRUE,NSW-SMART-drumline-report-1-July-2022-30-June-2023.pdf
5/05/2023,8:15,Tiger Shark,201,F,Alive,"ID, A",Coffs Harbour - Coffs Harbour to Sawtell,Boambee Beach,2023-05-05T08:15:00Z,2023,5,TIG,TRUE,TRUE,TRUE,NSW-SMART-drumline-report-1-July-2022-30-June-2023.pdf
20/05/2023,10:06,Common Blacktip,145,F,Alive,ID,Coffs Harbour - Coffs Harbour to Sawtell,Boambee Beach,2023-05-20T10:06:00Z,2023,5,CBT,FALSE,TRUE,FALSE,NSW-SMART-drumline-report-1-July-2022-30-June-2023.pdf
22/06/2023,12:29,Tiger Shark,244,F,Alive,"ID, A",Coffs Harbour - Coffs Harbour to Sawtell,Boambee Beach,2023-06-22T12:29:00Z,2023,6,TIG,TRUE,TRUE,TRUE,NSW-SMART-drumline-report-1-July-2022-30-June-2023.pdf
1/07/2022,15:28,Dusky Whaler,152,M,Alive,ID,Coffs Harbour - Coffs Harbour to Sawtell,Park Beach,2022-07-01T15:28:00Z,2022,7,DUS,FALSE,TRUE,FALSE,NSW-SMART-drumline-report-1-July-2022-30-June-2023.pdf
9/07/2022,12:44,Sandbar Whaler,194,F,Alive,ID,Coffs Harbour - Coffs Harbour to Sawtell,Park Beach,2022-07-09T12:44:00Z,2022,7,SAN,FALSE,TRUE,FALSE,NSW-SMART-drumline-report-1-July-2022-30-June-2023.pdf
11/08/2022,9:52,Bronze Whaler,281,F,Alive,ID,Coffs Harbour - Coffs Harbour to Sawtell,Park Beach,2022-08-11T09:52:00Z,2022,8,BRO,FALSE,TRUE,FALSE,NSW-SMART-drumline-report-1-July-2022-30-June-2023.pdf
11/08/2022,12:20,White Shark,232,F,Alive,"ID, A",Coffs Harbour - Coffs Harbour to Sawtell,Park Beach,2022-08-11T12:20:00Z,2022,8,WHI,TRUE,TRUE,TRUE,NSW-SMART-drumline-report-1-July-2022-30-June-2023.pdf
11/08/2022,13:28,Greynurse Shark,280,NA,Alive,NA,Coffs Harbour - Coffs Harbour to Sawtell,Park Beach,2022-08-11T13:28:00Z,2022,8,GRN,FALSE,FALSE,FALSE,NSW-SMART-drumline-report-1-July-2022-30-June-2023.pdf
16/08/2022,14:26,Bronze Whaler,257,F,Alive,ID,Coffs Harbour - Coffs Harbour to Sawtell,Park Beach,2022-08-16T14:26:00Z,2022,8,BRO,FALSE,TRUE,FALSE,NSW-SMART-drumline-report-1-July-2022-30-June-2023.pdf
19/08/2022,7:29,White Shark,212,F,Alive,"ID, A",Coffs Harbour - Coffs Harbour to Sawtell,Park Beach,2022-08-19T07:29:00Z,2022,8,WHI,TRUE,TRUE,TRUE,NSW-SMART-drumline-report-1-July-2022-30-June-2023.pdf
19/08/2022,14:06,Bronze Whaler,257,F,Alive,ID,Coffs Harbour - Coffs Harbour to Sawtell,Park Beach,2022-08-19T14:06:00Z,2022,8,BRO,FALSE,TRUE,FALSE,NSW-SMART-drumline-report-1-July-2022-30-June-2023.pdf
20/08/2022,9:32,Unidentified Whaler,250,NA,Alive,NA,Coffs Harbour - Coffs Harbour to Sawtell,Park Beach,2022-08-20T09:32:00Z,2022,8,WHL,FALSE,FALSE,FALSE,NSW-SMART-drumline-report-1-July-2022-30-June-2023.pdf
26/08/2022,14:50,White Shark,196,M,Alive,"ID, A",Coffs Harbour - Coffs Harbour to Sawtell,Park Beach,2022-08-26T14:50:00Z,2022,8,WHI,TRUE,TRUE,TRUE,NSW-SMART-drumline-report-1-July-2022-30-June-2023.pdf
2/09/2022,13:31,Bronze Whaler,266,F,Alive,ID,Coffs Harbour - Coffs Harbour to Sawtell,Park Beach,2022-09-02T13:31:00Z,2022,9,BRO,FALSE,TRUE,FALSE,NSW-SMART-drumline-report-1-July-2022-30-June-2023.pdf
7/09/2022,15:38,Sandbar Whaler,210,F,Alive,ID,Coffs Harbour - Coffs Harbour to Sawtell,Park Beach,2022-09-07T15:38:00Z,2022,9,SAN,FALSE,TRUE,FALSE,NSW-SMART-drumline-report-1-July-2022-30-June-2023.pdf
13/09/2022,15:31,White Shark,219,F,Alive,"ID, A",Coffs Harbour - Coffs Harbour to Sawtell,Park Beach,2022-09-13T15:31:00Z,2022,9,WHI,TRUE,TRUE,TRUE,NSW-SMART-drumline-report-1-July-2022-30-June-2023.pdf
19/09/2022,13:34,White Shark,218,F,Alive,"ID, A",Coffs Harbour - Coffs Harbour to Sawtell,Park Beach,2022-09-19T13:34:00Z,2022,9,WHI,TRUE,TRUE,TRUE,NSW-SMART-drumline-report-1-July-2022-30-June-2023.pdf
24/09/2022,12:01,White Shark,199,F,Alive,"ID, A",Coffs Harbour - Coffs Harbour to Sawtell,Park Beach,2022-09-24T12:01:00Z,2022,9,WHI,TRUE,TRUE,TRUE,NSW-SMART-drumline-report-1-July-2022-30-June-2023.pdf
29/09/2022,15:18,White Shark,167,F,Alive,"ID, A",Coffs Harbour - Coffs Harbour to Sawtell,Park Beach,2022-09-29T15:18:00Z,2022,9,WHI,TRUE,TRUE,TRUE,NSW-SMART-drumline-report-1-July-2022-30-June-2023.pdf
6/10/2022,8:24,Bronze Whaler,259,F,Alive,ID,Coffs Harbour - Coffs Harbour to Sawtell,Park Beach,2022-10-06T08:24:00Z,2022,10,BRO,FALSE,TRUE,FALSE,NSW-SMART-drumline-report-1-July-2022-30-June-2023.pdf
10/10/2022,12:15,White Shark,231,M,Alive,"ID, A",Coffs Harbour - Coffs Harbour to Sawtell,Park Beach,2022-10-10T12:15:00Z,2022,10,WHI,TRUE,TRUE,TRUE,NSW-SMART-drumline-report-1-July-2022-30-June-2023.pdf
11/10/2022,13:43,White Shark,196,F,Alive,"ID, A",Coffs Harbour - Coffs Harbour to Sawtell,Park Beach,2022-10-11T13:43:00Z,2022,10,WHI,TRUE,TRUE,TRUE,NSW-SMART-drumline-report-1-July-2022-30-June-2023.pdf
12/10/2022,16:09,Dusky Whaler,163,F,Alive,ID,Coffs Harbour - Coffs Harbour to Sawtell,Park Beach,2022-10-12T16:09:00Z,2022,10,DUS,FALSE,TRUE,FALSE,NSW-SMART-drumline-report-1-July-2022-30-June-2023.pdf
13/10/2022,10:18,Dusky Whaler,183,F,Alive,ID,Coffs Harbour - Coffs Harbour to Sawtell,Park Beach,2022-10-13T10:18:00Z,2022,10,DUS,FALSE,TRUE,FALSE,NSW-SMART-drumline-report-1-July-2022-30-June-2023.pdf
15/10/2022,7:53,Unidentified Whaler,230,NA,Alive,NA,Coffs Harbour - Coffs Harbour to Sawtell,Park Beach,2022-10-15T07:53:00Z,2022,10,WHL,FALSE,FALSE,FALSE,NSW-SMART-drumline-report-1-July-2022-30-June-2023.pdf
15/10/2022,8:52,White Shark,262,F,Alive,"ID, A",Coffs Harbour - Coffs Harbour to Sawtell,Park Beach,2022-10-15T08:52:00Z,2022,10,WHI,TRUE,TRUE,TRUE,NSW-SMART-drumline-report-1-July-2022-30-June-2023.pdf
15/10/2022,9:03,Bronze Whaler,270,M,Alive,ID,Coffs Harbour - Coffs Harbour to Sawtell,Park Beach,2022-10-15T09:03:00Z,2022,10,BRO,FALSE,TRUE,FALSE,NSW-SMART-drumline-report-1-July-2022-30-June-2023.pdf
15/10/2022,15:05,White Shark,226,M,Alive,"ID, A",Coffs Harbour - Coffs Harbour to Sawtell,Park Beach,2022-10-15T15:05:00Z,2022,10,WHI,TRUE,TRUE,TRUE,NSW-SMART-drumline-report-1-July-2022-30-June-2023.pdf
25/10/2022,9:26,Bronze Whaler,268,M,Alive,ID,Coffs Harbour - Coffs Harbour to Sawtell,Park Beach,2022-10-25T09:26:00Z,2022,10,BRO,FALSE,TRUE,FALSE,NSW-SMART-drumline-report-1-July-2022-30-June-2023.pdf
25/10/2022,11:21,Greynurse Shark,253,F,Alive,ID,Coffs Harbour - Coffs Harbour to Sawtell,Park Beach,2022-10-25T11:21:00Z,2022,10,GRN,FALSE,TRUE,FALSE,NSW-SMART-drumline-report-1-July-2022-30-June-2023.pdf
28/10/2022,10:30,Dusky Whaler,125,F,Alive,ID,Coffs Harbour - Coffs Harbour to Sawtell,Park Beach,2022-10-28T10:30:00Z,2022,10,DUS,FALSE,TRUE,FALSE,NSW-SMART-drumline-report-1-July-2022-30-June-2023.pdf
29/10/2022,15:18,Dusky Whaler,162,F,Alive,ID,Coffs Harbour - Coffs Harbour to Sawtell,Park Beach,2022-10-29T15:18:00Z,2022,10,DUS,FALSE,TRUE,FALSE,NSW-SMART-drumline-report-1-July-2022-30-June-2023.pdf
1/11/2022,NA,Dusky Whaler,105,M,Dead,ID,Coffs Harbour - Coffs Harbour to Sawtell,Park Beach,NA,2022,11,DUS,FALSE,TRUE,FALSE,NSW-SMART-drumline-report-1-July-2022-30-June-2023.pdf
5/11/2022,11:09,Greynurse Shark,275,F,Alive,ID,Coffs Harbour - Coffs Harbour to Sawtell,Park Beach,2022-11-05T11:09:00Z,2022,11,GRN,FALSE,TRUE,FALSE,NSW-SMART-drumline-report-1-July-2022-30-June-2023.pdf
5/11/2022,17:31,Dusky Whaler,140,F,Alive,ID,Coffs Harbour - Coffs Harbour to Sawtell,Park Beach,2022-11-05T17:31:00Z,2022,11,DUS,FALSE,TRUE,FALSE,NSW-SMART-drumline-report-1-July-2022-30-June-2023.pdf
8/11/2022,14:46,Dusky Whaler,154,M,Alive,ID,Coffs Harbour - Coffs Harbour to Sawtell,Park Beach,2022-11-08T14:46:00Z,2022,11,DUS,FALSE,TRUE,FALSE,NSW-SMART-drumline-report-1-July-2022-30-June-2023.pdf
10/11/2022,16:06,Dusky Whaler,134,M,Alive,ID,Coffs Harbour - Coffs Harbour to Sawtell,Park Beach,2022-11-10T16:06:00Z,2022,11,DUS,FALSE,TRUE,FALSE,NSW-SMART-drumline-report-1-July-2022-30-June-2023.pdf
5/12/2022,15:58,Dusky Whaler,234,F,Alive,ID,Coffs Harbour - Coffs Harbour to Sawtell,Park Beach,2022-12-05T15:58:00Z,2022,12,DUS,FALSE,TRUE,FALSE,NSW-SMART-drumline-report-1-July-2022-30-June-2023.pdf
14/12/2022,15:15,Bull Shark,197,F,Alive,"ID, A",Coffs Harbour - Coffs Harbour to Sawtell,Park Beach,2022-12-14T15:15:00Z,2022,12,BUL,TRUE,TRUE,TRUE,NSW-SMART-drumline-report-1-July-2022-30-June-2023.pdf
22/12/2022,12:49,Tiger Shark,349,M,Alive,"ID, A",Coffs Harbour - Coffs Harbour to Sawtell,Park Beach,2022-12-22T12:49:00Z,2022,12,TIG,TRUE,TRUE,TRUE,NSW-SMART-drumline-report-1-July-2022-30-June-2023.pdf
1/03/2023,18:06,Tiger Shark,232,F,Alive,"ID, A",Coffs Harbour - Coffs Harbour to Sawtell,Park Beach,2023-03-01T18:06:00Z,2023,3,TIG,TRUE,TRUE,TRUE,NSW-SMART-drumline-report-1-July-2022-30-June-2023.pdf
13/04/2023,9:31,Greynurse Shark,281,F,Alive,ID,Coffs Harbour - Coffs Harbour to Sawtell,Park Beach,2023-04-13T09:31:00Z,2023,4,GRN,FALSE,TRUE,FALSE,NSW-SMART-drumline-report-1-July-2022-30-June-2023.pdf
5/05/2023,15:35,Greynurse Shark,283,F,Alive,ID,Coffs Harbour - Coffs Harbour to Sawtell,Park Beach,2023-05-05T15:35:00Z,2023,5,GRN,FALSE,TRUE,FALSE,NSW-SMART-drumline-report-1-July-2022-30-June-2023.pdf
12/05/2023,8:56,Greynurse Shark,272,F,Alive,ID,Coffs Harbour - Coffs Harbour to Sawtell,Park Beach,2023-05-12T08:56:00Z,2023,5,GRN,FALSE,TRUE,FALSE,NSW-SMART-drumline-report-1-July-2022-30-June-2023.pdf
22/05/2023,15:36,Greynurse Shark,269,F,Alive,ID,Coffs Harbour - Coffs Harbour to Sawtell,Park Beach,2023-05-22T15:36:00Z,2023,5,GRN,FALSE,TRUE,FALSE,NSW-SMART-drumline-report-1-July-2022-30-June-2023.pdf
13/06/2023,9:10,Greynurse Shark,271,F,Alive,ID,Coffs Harbour - Coffs Harbour to Sawtell,Park Beach,2023-06-13T09:10:00Z,2023,6,GRN,FALSE,TRUE,FALSE,NSW-SMART-drumline-report-1-July-2022-30-June-2023.pdf
15/06/2023,9:36,Tiger Shark,156,F,Alive,"ID, A",Coffs Harbour - Coffs Harbour to Sawtell,Park Beach,2023-06-15T09:36:00Z,2023,6,TIG,TRUE,TRUE,TRUE,NSW-SMART-drumline-report-1-July-2022-30-June-2023.pdf
19/06/2023,14:27,Tiger Shark,154,F,Alive,"ID, A",Coffs Harbour - Coffs Harbour to Sawtell,Park Beach,2023-06-19T14:27:00Z,2023,6,TIG,TRUE,TRUE,TRUE,NSW-SMART-drumline-report-1-July-2022-30-June-2023.pdf
17/07/2022,10:43,White Shark,206,F,Alive,"ID, A",Coffs Harbour - Coffs Harbour to Sawtell,Diggers Beach,2022-07-17T10:43:00Z,2022,7,WHI,TRUE,TRUE,TRUE,NSW-SMART-drumline-report-1-July-2022-30-June-2023.pdf
19/07/2022,11:45,Tiger Shark,230,F,Alive,"ID, A",Coffs Harbour - Coffs Harbour to Sawtell,Diggers Beach,2022-07-19T11:45:00Z,2022,7,TIG,TRUE,TRUE,TRUE,NSW-SMART-drumline-report-1-July-2022-30-June-2023.pdf
25/07/2022,15:51,Unidentified Whaler,NA,NA,Alive,NA,Coffs Harbour - Coffs Harbour to Sawtell,Diggers Beach,2022-07-25T15:51:00Z,2022,7,WHL,FALSE,FALSE,FALSE,NSW-SMART-drumline-report-1-July-2022-30-June-2023.pdf
25/08/2022,12:40,Bronze Whaler,267,F,Alive,ID,Coffs Harbour - Coffs Harbour to Sawtell,Diggers Beach,2022-08-25T12:40:00Z,2022,8,BRO,FALSE,TRUE,FALSE,NSW-SMART-drumline-report-1-July-2022-30-June-2023.pdf
28/08/2022,14:37,White Shark,193,M,Alive,"ID, A",Coffs Harbour - Coffs Harbour to Sawtell,Diggers Beach,2022-08-28T14:37:00Z,2022,8,WHI,TRUE,TRUE,TRUE,NSW-SMART-drumline-report-1-July-2022-30-June-2023.pdf
31/08/2022,8:24,Greynurse Shark,283,F,Alive,ID,Coffs Harbour - Coffs Harbour to Sawtell,Diggers Beach,2022-08-31T08:24:00Z,2022,8,GRN,FALSE,TRUE,FALSE,NSW-SMART-drumline-report-1-July-2022-30-June-2023.pdf
11/09/2022,9:48,Bronze Whaler,277,M,Alive,ID,Coffs Harbour - Coffs Harbour to Sawtell,Diggers Beach,2022-09-11T09:48:00Z,2022,9,BRO,FALSE,TRUE,FALSE,NSW-SMART-drumline-report-1-July-2022-30-June-2023.pdf
19/09/2022,9:04,Sandbar Whaler,206,F,Alive,ID,Coffs Harbour - Coffs Harbour to Sawtell,Diggers Beach,2022-09-19T09:04:00Z,2022,9,SAN,FALSE,TRUE,FALSE,NSW-SMART-drumline-report-1-July-2022-30-June-2023.pdf
6/10/2022,9:07,Bronze Whaler,280,F,Alive,ID,Coffs Harbour - Coffs Harbour to Sawtell,Diggers Beach,2022-10-06T09:07:00Z,2022,10,BRO,FALSE,TRUE,FALSE,NSW-SMART-drumline-report-1-July-2022-30-June-2023.pdf
10/10/2022,7:32,White Shark,260,M,Alive,"ID, A",Coffs Harbour - Coffs Harbour to Sawtell,Diggers Beach,2022-10-10T07:32:00Z,2022,10,WHI,TRUE,TRUE,TRUE,NSW-SMART-drumline-report-1-July-2022-30-June-2023.pdf
20/10/2022,10:03,Bronze Whaler,280,M,Alive,ID,Coffs Harbour - Coffs Harbour to Sawtell,Diggers Beach,2022-10-20T10:03:00Z,2022,10,BRO,FALSE,TRUE,FALSE,NSW-SMART-drumline-report-1-July-2022-30-June-2023.pdf
25/10/2022,8:54,Bronze Whaler,248,M,Alive,ID,Coffs Harbour - Coffs Harbour to Sawtell,Diggers Beach,2022-10-25T08:54:00Z,2022,10,BRO,FALSE,TRUE,FALSE,NSW-SMART-drumline-report-1-July-2022-30-June-2023.pdf
28/10/2022,7:49,White Shark,193,M,Alive,"ID, A",Coffs Harbour - Coffs Harbour to Sawtell,Diggers Beach,2022-10-28T07:49:00Z,2022,10,WHI,TRUE,TRUE,TRUE,NSW-SMART-drumline-report-1-July-2022-30-June-2023.pdf
30/10/2022,8:40,Bronze Whaler,280,M,Alive,ID,Coffs Harbour - Coffs Harbour to Sawtell,Diggers Beach,2022-10-30T08:40:00Z,2022,10,BRO,FALSE,TRUE,FALSE,NSW-SMART-drumline-report-1-July-2022-30-June-2023.pdf
21/11/2022,9:49,Tiger Shark,247,F,Alive,"ID, A",Coffs Harbour - Coffs Harbour to Sawtell,Diggers Beach,2022-11-21T09:49:00Z,2022,11,TIG,TRUE,TRUE,TRUE,NSW-SMART-drumline-report-1-July-2022-30-June-2023.pdf
23/11/2022,12:32,White Shark,317,M,Alive,"ID, A",Coffs Harbour - Coffs Harbour to Sawtell,Diggers Beach,2022-11-23T12:32:00Z,2022,11,WHI,TRUE,TRUE,TRUE,NSW-SMART-drumline-report-1-July-2022-30-June-2023.pdf
25/11/2022,12:28,Bull Shark,165,F,Alive,"ID, A",Coffs Harbour - Coffs Harbour to Sawtell,Diggers Beach,2022-11-25T12:28:00Z,2022,11,BUL,TRUE,TRUE,TRUE,NSW-SMART-drumline-report-1-July-2022-30-June-2023.pdf
6/12/2022,15:22,Dusky Whaler,198,F,Alive,ID,Coffs Harbour - Coffs Harbour to Sawtell,Diggers Beach,2022-12-06T15:22:00Z,2022,12,DUS,FALSE,TRUE,FALSE,NSW-SMART-drumline-report-1-July-2022-30-June-2023.pdf
24/12/2022,15:27,Tiger Shark,251,F,Alive,"ID, A",Coffs Harbour - Coffs Harbour to Sawtell,Diggers Beach,2022-12-24T15:27:00Z,2022,12,TIG,TRUE,TRUE,TRUE,NSW-SMART-drumline-report-1-July-2022-30-June-2023.pdf
12/01/2023,17:28,Common Blacktip,171,M,Alive,ID,Coffs Harbour - Coffs Harbour to Sawtell,Diggers Beach,2023-01-12T17:28:00Z,2023,1,CBT,FALSE,TRUE,FALSE,NSW-SMART-drumline-report-1-July-2022-30-June-2023.pdf
15/01/2023,9:05,Common Blacktip,170,F,Alive,ID,Coffs Harbour - Coffs Harbour to Sawtell,Diggers Beach,2023-01-15T09:05:00Z,2023,1,CBT,FALSE,TRUE,FALSE,NSW-SMART-drumline-report-1-July-2022-30-June-2023.pdf
1/07/2022,10:21,White Shark,221,F,Alive,"ID, A",Port Macquarie  Port Macquarie to Tacking Point,Lighthouse Beach,2022-07-01T10:21:00Z,2022,7,WHI,TRUE,TRUE,TRUE,NSW-SMART-drumline-report-1-July-2022-30-June-2023.pdf
4/07/2022,9:49,White Shark,253,F,Alive,"ID, A",Port Macquarie  Port Macquarie to Tacking Point,Lighthouse Beach,2022-07-04T09:49:00Z,2022,7,WHI,TRUE,TRUE,TRUE,NSW-SMART-drumline-report-1-July-2022-30-June-2023.pdf
4/07/2022,12:15,White Shark,280,F,Alive,"ID, A",Port Macquarie  Port Macquarie to Tacking Point,Lighthouse Beach,2022-07-04T12:15:00Z,2022,7,WHI,TRUE,TRUE,TRUE,NSW-SMART-drumline-report-1-July-2022-30-June-2023.pdf
4/07/2022,13:15,White Shark,281,F,Alive,"ID, A",Port Macquarie  Port Macquarie to Tacking Point,Lighthouse Beach,2022-07-04T13:15:00Z,2022,7,WHI,TRUE,TRUE,TRUE,NSW-SMART-drumline-report-1-July-2022-30-June-2023.pdf
20/07/2022,10:52,White Shark,239,M,Alive,"ID, A",Port Macquarie  Port Macquarie to Tacking Point,Lighthouse Beach,2022-07-20T10:52:00Z,2022,7,WHI,TRUE,TRUE,TRUE,NSW-SMART-drumline-report-1-July-2022-30-June-2023.pdf
26/07/2022,12:14,White Shark,326,M,Alive,"ID, A",Port Macquarie  Port Macquarie to Tacking Point,Lighthouse Beach,2022-07-26T12:14:00Z,2022,7,WHI,TRUE,TRUE,TRUE,NSW-SMART-drumline-report-1-July-2022-30-June-2023.pdf
29/07/2022,9:16,White Shark,249,M,Alive,"ID, A",Port Macquarie  Port Macquarie to Tacking Point,Lighthouse Beach,2022-07-29T09:16:00Z,2022,7,WHI,TRUE,TRUE,TRUE,NSW-SMART-drumline-report-1-July-2022-30-June-2023.pdf
31/07/2022,14:56,White Shark,211,M,Alive,"ID, A",Port Macquarie  Port Macquarie to Tacking Point,Lighthouse Beach,2022-07-31T14:56:00Z,2022,7,WHI,TRUE,TRUE,TRUE,NSW-SMART-drumline-report-1-July-2022-30-June-2023.pdf
1/08/2022,15:01,White Shark,202,F,Alive,"ID, A",Port Macquarie  Port Macquarie to Tacking Point,Lighthouse Beach,2022-08-01T15:01:00Z,2022,8,WHI,TRUE,TRUE,TRUE,NSW-SMART-drumline-report-1-July-2022-30-June-2023.pdf
3/08/2022,14:54,White Shark,199,M,Alive,"ID, A",Port Macquarie  Port Macquarie to Tacking Point,Lighthouse Beach,2022-08-03T14:54:00Z,2022,8,WHI,TRUE,TRUE,TRUE,NSW-SMART-drumline-report-1-July-2022-30-June-2023.pdf
6/08/2022,14:49,White Shark,282,F,Alive,"ID, A",Port Macquarie  Port Macquarie to Tacking Point,Lighthouse Beach,2022-08-06T14:49:00Z,2022,8,WHI,TRUE,TRUE,TRUE,NSW-SMART-drumline-report-1-July-2022-30-June-2023.pdf
11/08/2022,12:57,White Shark,227,F,Alive,"ID, A",Port Macquarie  Port Macquarie to Tacking Point,Lighthouse Beach,2022-08-11T12:57:00Z,2022,8,WHI,TRUE,TRUE,TRUE,NSW-SMART-drumline-report-1-July-2022-30-June-2023.pdf
12/08/2022,8:26,Bronze Whaler,274,M,Alive,ID,Port Macquarie  Port Macquarie to Tacking Point,Lighthouse Beach,2022-08-12T08:26:00Z,2022,8,BRO,FALSE,TRUE,FALSE,NSW-SMART-drumline-report-1-July-2022-30-June-2023.pdf
13/08/2022,11:32,White Shark,234,F,Alive,"ID, A",Port Macquarie  Port Macquarie to Tacking Point,Lighthouse Beach,2022-08-13T11:32:00Z,2022,8,WHI,TRUE,TRUE,TRUE,NSW-SMART-drumline-report-1-July-2022-30-June-2023.pdf
15/08/2022,14:00,White Shark,373,F,Alive,"ID, A",Port Macquarie  Port Macquarie to Tacking Point,Lighthouse Beach,2022-08-15T14:00:00Z,2022,8,WHI,TRUE,TRUE,TRUE,NSW-SMART-drumline-report-1-July-2022-30-June-2023.pdf
27/08/2022,8:45,White Shark,NA,NA,Alive,NA,Port Macquarie  Port Macquarie to Tacking Point,Lighthouse Beach,2022-08-27T08:45:00Z,2022,8,WHI,TRUE,FALSE,FALSE,NSW-SMART-drumline-report-1-July-2022-30-June-2023.pdf
2/09/2022,8:51,Bronze Whaler,253,M,Alive,ID,Port Macquarie  Port Macquarie to Tacking Point,Lighthouse Beach,2022-09-02T08:51:00Z,2022,9,BRO,FALSE,TRUE,FALSE,NSW-SMART-drumline-report-1-July-2022-30-June-2023.pdf
2/09/2022,11:16,White Shark,229,M,Alive,"ID, A",Port Macquarie  Port Macquarie to Tacking Point,Lighthouse Beach,2022-09-02T11:16:00Z,2022,9,WHI,TRUE,TRUE,TRUE,NSW-SMART-drumline-report-1-July-2022-30-June-2023.pdf
2/09/2022,15:29,Bronze Whaler,269,M,Alive,ID,Port Macquarie  Port Macquarie to Tacking Point,Lighthouse Beach,2022-09-02T15:29:00Z,2022,9,BRO,FALSE,TRUE,FALSE,NSW-SMART-drumline-report-1-July-2022-30-June-2023.pdf
12/09/2022,9:07,White Shark,317,M,Alive,"ID, A",Port Macquarie  Port Macquarie to Tacking Point,Lighthouse Beach,2022-09-12T09:07:00Z,2022,9,WHI,TRUE,TRUE,TRUE,NSW-SMART-drumline-report-1-July-2022-30-June-2023.pdf
16/09/2022,8:04,White Shark,287,F,Alive,"ID, A",Port Macquarie  Port Macquarie to Tacking Point,Lighthouse Beach,2022-09-16T08:04:00Z,2022,9,WHI,TRUE,TRUE,TRUE,NSW-SMART-drumline-report-1-July-2022-30-June-2023.pdf
16/09/2022,10:11,White Shark,200,NA,Alive,NA,Port Macquarie  Port Macquarie to Tacking Point,Lighthouse Beach,2022-09-16T10:11:00Z,2022,9,WHI,TRUE,FALSE,FALSE,NSW-SMART-drumline-report-1-July-2022-30-June-2023.pdf
19/09/2022,8:16,White Shark,288,F,Alive,"ID, A",Port Macquarie  Port Macquarie to Tacking Point,Lighthouse Beach,2022-09-19T08:16:00Z,2022,9,WHI,TRUE,TRUE,TRUE,NSW-SMART-drumline-report-1-July-2022-30-June-2023.pdf
25/09/2022,10:29,Bronze Whaler,239,M,Alive,ID,Port Macquarie  Port Macquarie to Tacking Point,Lighthouse Beach,2022-09-25T10:29:00Z,2022,9,BRO,FALSE,TRUE,FALSE,NSW-SMART-drumline-report-1-July-2022-30-June-2023.pdf
25/09/2022,12:18,White Shark,254,M,Alive,"ID, A",Port Macquarie  Port Macquarie to Tacking Point,Lighthouse Beach,2022-09-25T12:18:00Z,2022,9,WHI,TRUE,TRUE,TRUE,NSW-SMART-drumline-report-1-July-2022-30-June-2023.pdf
26/09/2022,7:49,White Shark,172,F,Alive,"ID, A",Port Macquarie  Port Macquarie to Tacking Point,Lighthouse Beach,2022-09-26T07:49:00Z,2022,9,WHI,TRUE,TRUE,TRUE,NSW-SMART-drumline-report-1-July-2022-30-June-2023.pdf
3/10/2022,13:31,Bronze Whaler,248,M,Alive,ID,Port Macquarie  Port Macquarie to Tacking Point,Lighthouse Beach,2022-10-03T13:31:00Z,2022,10,BRO,FALSE,TRUE,FALSE,NSW-SMART-drumline-report-1-July-2022-30-June-2023.pdf
19/10/2022,14:08,Dusky Whaler,273,F,Alive,ID,Port Macquarie  Port Macquarie to Tacking Point,Lighthouse Beach,2022-10-19T14:08:00Z,2022,10,DUS,FALSE,TRUE,FALSE,NSW-SMART-drumline-report-1-July-2022-30-June-2023.pdf
29/10/2022,9:23,White Shark,232,M,Alive,"ID, A",Port Macquarie  Port Macquarie to Tacking Point,Lighthouse Beach,2022-10-29T09:23:00Z,2022,10,WHI,TRUE,TRUE,TRUE,NSW-SMART-drumline-report-1-July-2022-30-June-2023.pdf
8/11/2022,10:06,White Shark,328,F,Alive,"ID, A",Port Macquarie  Port Macquarie to Tacking Point,Lighthouse Beach,2022-11-08T10:06:00Z,2022,11,WHI,TRUE,TRUE,TRUE,NSW-SMART-drumline-report-1-July-2022-30-June-2023.pdf
21/11/2022,10:56,Tiger Shark,155,M,Alive,"ID, A",Port Macquarie  Port Macquarie to Tacking Point,Lighthouse Beach,2022-11-21T10:56:00Z,2022,11,TIG,TRUE,TRUE,TRUE,NSW-SMART-drumline-report-1-July-2022-30-June-2023.pdf
23/11/2022,15:53,Bronze Whaler,251,M,Alive,ID,Port Macquarie  Port Macquarie to Tacking Point,Lighthouse Beach,2022-11-23T15:53:00Z,2022,11,BRO,FALSE,TRUE,FALSE,NSW-SMART-drumline-report-1-July-2022-30-June-2023.pdf
7/12/2022,13:43,Tiger Shark,194,F,Alive,"ID, A",Port Macquarie  Port Macquarie to Tacking Point,Lighthouse Beach,2022-12-07T13:43:00Z,2022,12,TIG,TRUE,TRUE,TRUE,NSW-SMART-drumline-report-1-July-2022-30-June-2023.pdf
1/02/2023,11:57,Bull Shark,216,F,Alive,"ID, A",Port Macquarie  Port Macquarie to Tacking Point,Lighthouse Beach,2023-02-01T11:57:00Z,2023,2,BUL,TRUE,TRUE,TRUE,NSW-SMART-drumline-report-1-July-2022-30-June-2023.pdf
7/02/2023,12:31,Tiger Shark,207,M,Alive,"ID, A",Port Macquarie  Port Macquarie to Tacking Point,Lighthouse Beach,2023-02-07T12:31:00Z,2023,2,TIG,TRUE,TRUE,TRUE,NSW-SMART-drumline-report-1-July-2022-30-June-2023.pdf
7/02/2023,NA,Tiger Shark,153,F,Dead,NA,Port Macquarie  Port Macquarie to Tacking Point,Lighthouse Beach,NA,2023,2,TIG,TRUE,FALSE,FALSE,NSW-SMART-drumline-report-1-July-2022-30-June-2023.pdf
1/03/2023,8:43,Tiger Shark,191,F,Alive,"ID, A",Port Macquarie  Port Macquarie to Tacking Point,Lighthouse Beach,2023-03-01T08:43:00Z,2023,3,TIG,TRUE,TRUE,TRUE,NSW-SMART-drumline-report-1-July-2022-30-June-2023.pdf
16/03/2023,12:43,Great Hammerhead,427,F,Alive,ID,Port Macquarie  Port Macquarie to Tacking Point,Lighthouse Beach,2023-03-16T12:43:00Z,2023,3,GHH,FALSE,TRUE,FALSE,NSW-SMART-drumline-report-1-July-2022-30-June-2023.pdf
3/04/2023,10:17,White Shark,293,M,Alive,"ID, A",Port Macquarie  Port Macquarie to Tacking Point,Lighthouse Beach,2023-04-03T10:17:00Z,2023,4,WHI,TRUE,TRUE,TRUE,NSW-SMART-drumline-report-1-July-2022-30-June-2023.pdf
12/05/2023,11:54,Greynurse Shark,264,F,Alive,ID,Port Macquarie  Port Macquarie to Tacking Point,Lighthouse Beach,2023-05-12T11:54:00Z,2023,5,GRN,FALSE,TRUE,FALSE,NSW-SMART-drumline-report-1-July-2022-30-June-2023.pdf
2/06/2023,8:38,White Shark,223,F,Alive,"ID, A",Port Macquarie  Port Macquarie to Tacking Point,Lighthouse Beach,2023-06-02T08:38:00Z,2023,6,WHI,TRUE,TRUE,TRUE,NSW-SMART-drumline-report-1-July-2022-30-June-2023.pdf
2/06/2023,14:34,White Shark,251,F,Alive,"ID, A",Port Macquarie  Port Macquarie to Tacking Point,Lighthouse Beach,2023-06-02T14:34:00Z,2023,6,WHI,TRUE,TRUE,TRUE,NSW-SMART-drumline-report-1-July-2022-30-June-2023.pdf
9/06/2023,8:07,White Shark,228,F,Alive,"ID, A",Port Macquarie  Port Macquarie to Tacking Point,Lighthouse Beach,2023-06-09T08:07:00Z,2023,6,WHI,TRUE,TRUE,TRUE,NSW-SMART-drumline-report-1-July-2022-30-June-2023.pdf
9/06/2023,13:52,White Shark,218,F,Alive,"ID, A",Port Macquarie  Port Macquarie to Tacking Point,Lighthouse Beach,2023-06-09T13:52:00Z,2023,6,WHI,TRUE,TRUE,TRUE,NSW-SMART-drumline-report-1-July-2022-30-June-2023.pdf
15/06/2023,10:38,White Shark,247,F,Alive,"ID, A",Port Macquarie  Port Macquarie to Tacking Point,Lighthouse Beach,2023-06-15T10:38:00Z,2023,6,WHI,TRUE,TRUE,TRUE,NSW-SMART-drumline-report-1-July-2022-30-June-2023.pdf
20/06/2023,9:24,White Shark,211,F,Alive,"ID, A",Port Macquarie  Port Macquarie to Tacking Point,Lighthouse Beach,2023-06-20T09:24:00Z,2023,6,WHI,TRUE,TRUE,TRUE,NSW-SMART-drumline-report-1-July-2022-30-June-2023.pdf
25/06/2023,NA,Tiger Shark,148,F,Alive,"ID, A",Port Macquarie  Port Macquarie to Tacking Point,Lighthouse Beach,NA,2023,6,TIG,TRUE,TRUE,TRUE,NSW-SMART-drumline-report-1-July-2022-30-June-2023.pdf
4/07/2022,10:55,Bronze Whaler,255,M,Alive,ID,Port Macquarie  Port Macquarie to Tacking Point,Miners Beach,2022-07-04T10:55:00Z,2022,7,BRO,FALSE,TRUE,FALSE,NSW-SMART-drumline-report-1-July-2022-30-June-2023.pdf
15/08/2022,9:16,White Shark,207,F,Alive,"ID, A",Port Macquarie  Port Macquarie to Tacking Point,Miners Beach,2022-08-15T09:16:00Z,2022,8,WHI,TRUE,TRUE,TRUE,NSW-SMART-drumline-report-1-July-2022-30-June-2023.pdf
21/08/2022,9:57,White Shark,273,F,Alive,"ID, A",Port Macquarie  Port Macquarie to Tacking Point,Miners Beach,2022-08-21T09:57:00Z,2022,8,WHI,TRUE,TRUE,TRUE,NSW-SMART-drumline-report-1-July-2022-30-June-2023.pdf
29/08/2022,11:18,White Shark,277,F,Alive,"ID, A",Port Macquarie  Port Macquarie to Tacking Point,Miners Beach,2022-08-29T11:18:00Z,2022,8,WHI,TRUE,TRUE,TRUE,NSW-SMART-drumline-report-1-July-2022-30-June-2023.pdf
31/08/2022,12:01,White Shark,188,F,Alive,"ID, A",Port Macquarie  Port Macquarie to Tacking Point,Miners Beach,2022-08-31T12:01:00Z,2022,8,WHI,TRUE,TRUE,TRUE,NSW-SMART-drumline-report-1-July-2022-30-June-2023.pdf
7/10/2022,9:07,Tiger Shark,271,M,Alive,"ID, A",Port Macquarie  Port Macquarie to Tacking Point,Miners Beach,2022-10-07T09:07:00Z,2022,10,TIG,TRUE,TRUE,TRUE,NSW-SMART-drumline-report-1-July-2022-30-June-2023.pdf
13/10/2022,12:12,Dusky Whaler,158,M,Alive,ID,Port Macquarie  Port Macquarie to Tacking Point,Miners Beach,2022-10-13T12:12:00Z,2022,10,DUS,FALSE,TRUE,FALSE,NSW-SMART-drumline-report-1-July-2022-30-June-2023.pdf
30/10/2022,14:51,White Shark,245,F,Alive,"ID, A",Port Macquarie  Port Macquarie to Tacking Point,Miners Beach,2022-10-30T14:51:00Z,2022,10,WHI,TRUE,TRUE,TRUE,NSW-SMART-drumline-report-1-July-2022-30-June-2023.pdf
8/12/2022,11:48,Smooth Hammerhead,166,F,Alive,ID,Port Macquarie  Port Macquarie to Tacking Point,Miners Beach,2022-12-08T11:48:00Z,2022,12,SMH,FALSE,TRUE,FALSE,NSW-SMART-drumline-report-1-July-2022-30-June-2023.pdf
13/12/2022,9:41,White Shark,231,F,Alive,"ID, A",Port Macquarie  Port Macquarie to Tacking Point,Miners Beach,2022-12-13T09:41:00Z,2022,12,WHI,TRUE,TRUE,TRUE,NSW-SMART-drumline-report-1-July-2022-30-June-2023.pdf
9/06/2023,13:06,White Shark,331,F,Alive,"ID, A",Port Macquarie  Port Macquarie to Tacking Point,Miners Beach,2023-06-09T13:06:00Z,2023,6,WHI,TRUE,TRUE,TRUE,NSW-SMART-drumline-report-1-July-2022-30-June-2023.pdf
21/06/2023,8:54,White Shark,253,F,Alive,"ID, A",Port Macquarie  Port Macquarie to Tacking Point,Miners Beach,2023-06-21T08:54:00Z,2023,6,WHI,TRUE,TRUE,TRUE,NSW-SMART-drumline-report-1-July-2022-30-June-2023.pdf
24/06/2023,11:55,White Shark,213,F,Alive,"ID, A",Port Macquarie  Port Macquarie to Tacking Point,Miners Beach,2023-06-24T11:55:00Z,2023,6,WHI,TRUE,TRUE,TRUE,NSW-SMART-drumline-report-1-July-2022-30-June-2023.pdf
20/07/2022,12:39,Bronze Whaler,274,F,Alive,ID,Port Macquarie  Port Macquarie to Tacking Point,Shelly Beach,2022-07-20T12:39:00Z,2022,7,BRO,FALSE,TRUE,FALSE,NSW-SMART-drumline-report-1-July-2022-30-June-2023.pdf
30/07/2022,11:33,White Shark,267,M,Alive,"ID, A",Port Macquarie  Port Macquarie to Tacking Point,Shelly Beach,2022-07-30T11:33:00Z,2022,7,WHI,TRUE,TRUE,TRUE,NSW-SMART-drumline-report-1-July-2022-30-June-2023.pdf
10/09/2022,9:05,White Shark,226,M,Alive,"ID, A",Port Macquarie  Port Macquarie to Tacking Point,Shelly Beach,2022-09-10T09:05:00Z,2022,9,WHI,TRUE,TRUE,TRUE,NSW-SMART-drumline-report-1-July-2022-30-June-2023.pdf
20/09/2022,9:49,Tiger Shark,400,NA,Alive,NA,Port Macquarie  Port Macquarie to Tacking Point,Shelly Beach,2022-09-20T09:49:00Z,2022,9,TIG,TRUE,FALSE,FALSE,NSW-SMART-drumline-report-1-July-2022-30-June-2023.pdf
25/09/2022,9:08,White Shark,185,F,Alive,"ID, A",Port Macquarie  Port Macquarie to Tacking Point,Shelly Beach,2022-09-25T09:08:00Z,2022,9,WHI,TRUE,TRUE,TRUE,NSW-SMART-drumline-report-1-July-2022-30-June-2023.pdf
7/11/2022,13:03,Dusky Whaler,137,F,Alive,ID,Port Macquarie  Port Macquarie to Tacking Point,Shelly Beach,2022-11-07T13:03:00Z,2022,11,DUS,FALSE,TRUE,FALSE,NSW-SMART-drumline-report-1-July-2022-30-June-2023.pdf
14/12/2022,11:01,Tiger Shark,245,F,Alive,"ID, A",Port Macquarie  Port Macquarie to Tacking Point,Shelly Beach,2022-12-14T11:01:00Z,2022,12,TIG,TRUE,TRUE,TRUE,NSW-SMART-drumline-report-1-July-2022-30-June-2023.pdf
26/12/2022,16:28,Tiger Shark,178,M,Alive,"ID, A",Port Macquarie  Port Macquarie to Tacking Point,Shelly Beach,2022-12-26T16:28:00Z,2022,12,TIG,TRUE,TRUE,TRUE,NSW-SMART-drumline-report-1-July-2022-30-June-2023.pdf
25/02/2023,14:14,White Shark,253,F,Alive,"ID, A",Port Macquarie  Port Macquarie to Tacking Point,Shelly Beach,2023-02-25T14:14:00Z,2023,2,WHI,TRUE,TRUE,TRUE,NSW-SMART-drumline-report-1-July-2022-30-June-2023.pdf
12/06/2023,7:50,Tiger Shark,172,F,Alive,"ID, A",Port Macquarie  Port Macquarie to Tacking Point,Shelly Beach,2023-06-12T07:50:00Z,2023,6,TIG,TRUE,TRUE,TRUE,NSW-SMART-drumline-report-1-July-2022-30-June-2023.pdf
16/07/2022,10:25,White Shark,300,M,Alive,"ID, A",Port Macquarie  Port Macquarie to Tacking Point,Nobbys Beach,2022-07-16T10:25:00Z,2022,7,WHI,TRUE,TRUE,TRUE,NSW-SMART-drumline-report-1-July-2022-30-June-2023.pdf
27/09/2022,11:30,White Shark,197,M,Alive,"ID, A",Port Macquarie  Port Macquarie to Tacking Point,Nobbys Beach,2022-09-27T11:30:00Z,2022,9,WHI,TRUE,TRUE,TRUE,NSW-SMART-drumline-report-1-July-2022-30-June-2023.pdf
12/11/2022,14:23,White Shark,192,M,Alive,"ID, A",Port Macquarie  Port Macquarie to Tacking Point,Nobbys Beach,2022-11-12T14:23:00Z,2022,11,WHI,TRUE,TRUE,TRUE,NSW-SMART-drumline-report-1-July-2022-30-June-2023.pdf
8/12/2022,10:57,White Shark,296,F,Alive,"ID, A",Port Macquarie  Port Macquarie to Tacking Point,Nobbys Beach,2022-12-08T10:57:00Z,2022,12,WHI,TRUE,TRUE,TRUE,NSW-SMART-drumline-report-1-July-2022-30-June-2023.pdf
17/03/2023,8:37,Bull Shark,182,M,Alive,"ID, A",Port Macquarie  Port Macquarie to Tacking Point,Nobbys Beach,2023-03-17T08:37:00Z,2023,3,BUL,TRUE,TRUE,TRUE,NSW-SMART-drumline-report-1-July-2022-30-June-2023.pdf
26/08/2022,10:57,White Shark,229,F,Alive,"ID, A",Port Macquarie  Port Macquarie to Tacking Point,Flynns Beach,2022-08-26T10:57:00Z,2022,8,WHI,TRUE,TRUE,TRUE,NSW-SMART-drumline-report-1-July-2022-30-June-2023.pdf
19/09/2022,10:07,Bronze Whaler,246,M,Alive,ID,Port Macquarie  Port Macquarie to Tacking Point,Flynns Beach,2022-09-19T10:07:00Z,2022,9,BRO,FALSE,TRUE,FALSE,NSW-SMART-drumline-report-1-July-2022-30-June-2023.pdf
10/10/2022,11:32,White Shark,363,F,Alive,"ID, A",Port Macquarie  Port Macquarie to Tacking Point,Flynns Beach,2022-10-10T11:32:00Z,2022,10,WHI,TRUE,TRUE,TRUE,NSW-SMART-drumline-report-1-July-2022-30-June-2023.pdf
19/10/2022,NA,White Shark,245,M,Alive,"ID, A",Port Macquarie  Port Macquarie to Tacking Point,Flynns Beach,NA,2022,10,WHI,TRUE,TRUE,TRUE,NSW-SMART-drumline-report-1-July-2022-30-June-2023.pdf
15/11/2022,16:09,White Shark,262,M,Alive,"ID, A",Port Macquarie  Port Macquarie to Tacking Point,Flynns Beach,2022-11-15T16:09:00Z,2022,11,WHI,TRUE,TRUE,TRUE,NSW-SMART-drumline-report-1-July-2022-30-June-2023.pdf
7/12/2022,8:37,Bronze Whaler,272,M,Alive,ID,Port Macquarie  Port Macquarie to Tacking Point,Flynns Beach,2022-12-07T08:37:00Z,2022,12,BRO,FALSE,TRUE,FALSE,NSW-SMART-drumline-report-1-July-2022-30-June-2023.pdf
5/05/2023,9:33,Greynurse Shark,NA,F,Alive,NA,Port Macquarie  Port Macquarie to Tacking Point,Flynns Beach,2023-05-05T09:33:00Z,2023,5,GRN,FALSE,FALSE,FALSE,NSW-SMART-drumline-report-1-July-2022-30-June-2023.pdf
27/07/2022,9:52,White Shark,179,F,Alive,"ID, A",Port Macquarie  Port Macquarie to Tacking Point,Rocky Beach,2022-07-27T09:52:00Z,2022,7,WHI,TRUE,TRUE,TRUE,NSW-SMART-drumline-report-1-July-2022-30-June-2023.pdf
31/08/2022,12:49,White Shark,186,M,Alive,"ID, A",Port Macquarie  Port Macquarie to Tacking Point,Rocky Beach,2022-08-31T12:49:00Z,2022,8,WHI,TRUE,TRUE,TRUE,NSW-SMART-drumline-report-1-July-2022-30-June-2023.pdf
2/09/2022,14:42,Tiger Shark,242,F,Alive,"ID, A",Port Macquarie  Port Macquarie to Tacking Point,Rocky Beach,2022-09-02T14:42:00Z,2022,9,TIG,TRUE,TRUE,TRUE,NSW-SMART-drumline-report-1-July-2022-30-June-2023.pdf
10/10/2022,15:15,White Shark,328,F,Alive,"ID, A",Port Macquarie  Port Macquarie to Tacking Point,Rocky Beach,2022-10-10T15:15:00Z,2022,10,WHI,TRUE,TRUE,TRUE,NSW-SMART-drumline-report-1-July-2022-30-June-2023.pdf
24/11/2022,11:58,White Shark,250,NA,Alive,NA,Port Macquarie  Port Macquarie to Tacking Point,Rocky Beach,2022-11-24T11:58:00Z,2022,11,WHI,TRUE,FALSE,FALSE,NSW-SMART-drumline-report-1-July-2022-30-June-2023.pdf
27/12/2022,15:36,Tiger Shark,352,M,Alive,"ID, A",Port Macquarie  Port Macquarie to Tacking Point,Rocky Beach,2022-12-27T15:36:00Z,2022,12,TIG,TRUE,TRUE,TRUE,NSW-SMART-drumline-report-1-July-2022-30-June-2023.pdf
16/06/2023,NA,White Shark,241,F,Dead,NA,Port Macquarie  Port Macquarie to Tacking Point,Rocky Beach,NA,2023,6,WHI,TRUE,FALSE,FALSE,NSW-SMART-drumline-report-1-July-2022-30-June-2023.pdf
4/10/2022,13:42,White Shark,232,M,Alive,"ID, A",Port Macquarie  Port Macquarie to Tacking Point,Oxley Beach,2022-10-04T13:42:00Z,2022,10,WHI,TRUE,TRUE,TRUE,NSW-SMART-drumline-report-1-July-2022-30-June-2023.pdf
4/10/2022,17:24,White Shark,158,F,Alive,"ID, A",Port Macquarie  Port Macquarie to Tacking Point,Oxley Beach,2022-10-04T17:24:00Z,2022,10,WHI,TRUE,TRUE,TRUE,NSW-SMART-drumline-report-1-July-2022-30-June-2023.pdf
2/06/2023,13:01,Greynurse Shark,255,F,Alive,ID,Port Macquarie  Port Macquarie to Tacking Point,Oxley Beach,2023-06-02T13:01:00Z,2023,6,GRN,FALSE,TRUE,FALSE,NSW-SMART-drumline-report-1-July-2022-30-June-2023.pdf
8/06/2023,8:13,White Shark,243,F,Alive,"ID, A",Port Macquarie  Port Macquarie to Tacking Point,Oxley Beach,2023-06-08T08:13:00Z,2023,6,WHI,TRUE,TRUE,TRUE,NSW-SMART-drumline-report-1-July-2022-30-June-2023.pdf
28/07/2022,8:09,White Shark,177,M,Alive,"ID, A",Port Macquarie  Port Macquarie to Tacking Point,North Shore Beach,2022-07-28T08:09:00Z,2022,7,WHI,TRUE,TRUE,TRUE,NSW-SMART-drumline-report-1-July-2022-30-June-2023.pdf
3/08/2022,12:54,White Shark,230,F,Alive,"ID, A",Port Macquarie  Port Macquarie to Tacking Point,North Shore Beach,2022-08-03T12:54:00Z,2022,8,WHI,TRUE,TRUE,TRUE,NSW-SMART-drumline-report-1-July-2022-30-June-2023.pdf
18/08/2022,12:18,White Shark,207,M,Alive,"ID, A",Port Macquarie  Port Macquarie to Tacking Point,North Shore Beach,2022-08-18T12:18:00Z,2022,8,WHI,TRUE,TRUE,TRUE,NSW-SMART-drumline-report-1-July-2022-30-June-2023.pdf
26/08/2022,8:24,White Shark,235,F,Alive,"ID, A",Port Macquarie  Port Macquarie to Tacking Point,North Shore Beach,2022-08-26T08:24:00Z,2022,8,WHI,TRUE,TRUE,TRUE,NSW-SMART-drumline-report-1-July-2022-30-June-2023.pdf
28/08/2022,15:33,White Shark,188,F,Alive,"ID, A",Port Macquarie  Port Macquarie to Tacking Point,North Shore Beach,2022-08-28T15:33:00Z,2022,8,WHI,TRUE,TRUE,TRUE,NSW-SMART-drumline-report-1-July-2022-30-June-2023.pdf
29/08/2022,9:04,White Shark,225,M,Alive,"ID, A",Port Macquarie  Port Macquarie to Tacking Point,North Shore Beach,2022-08-29T09:04:00Z,2022,8,WHI,TRUE,TRUE,TRUE,NSW-SMART-drumline-report-1-July-2022-30-June-2023.pdf
31/08/2022,9:35,White Shark,257,M,Alive,"ID, A",Port Macquarie  Port Macquarie to Tacking Point,North Shore Beach,2022-08-31T09:35:00Z,2022,8,WHI,TRUE,TRUE,TRUE,NSW-SMART-drumline-report-1-July-2022-30-June-2023.pdf
2/09/2022,16:15,White Shark,211,M,Alive,"ID, A",Port Macquarie  Port Macquarie to Tacking Point,North Shore Beach,2022-09-02T16:15:00Z,2022,9,WHI,TRUE,TRUE,TRUE,NSW-SMART-drumline-report-1-July-2022-30-June-2023.pdf
7/09/2022,8:51,White Shark,218,F,Alive,"ID, A",Port Macquarie  Port Macquarie to Tacking Point,North Shore Beach,2022-09-07T08:51:00Z,2022,9,WHI,TRUE,TRUE,TRUE,NSW-SMART-drumline-report-1-July-2022-30-June-2023.pdf
7/09/2022,13:02,Bronze Whaler,238,M,Alive,ID,Port Macquarie  Port Macquarie to Tacking Point,North Shore Beach,2022-09-07T13:02:00Z,2022,9,BRO,FALSE,TRUE,FALSE,NSW-SMART-drumline-report-1-July-2022-30-June-2023.pdf
8/09/2022,8:23,Bronze Whaler,288,f,Alive,ID,Port Macquarie  Port Macquarie to Tacking Point,North Shore Beach,2022-09-08T08:23:00Z,2022,9,BRO,FALSE,TRUE,FALSE,NSW-SMART-drumline-report-1-July-2022-30-June-2023.pdf
12/09/2022,9:55,White Shark,222,M,Alive,"ID, A",Port Macquarie  Port Macquarie to Tacking Point,North Shore Beach,2022-09-12T09:55:00Z,2022,9,WHI,TRUE,TRUE,TRUE,NSW-SMART-drumline-report-1-July-2022-30-June-2023.pdf
18/09/2022,12:47,White Shark,281,F,Alive,"ID, A",Port Macquarie  Port Macquarie to Tacking Point,North Shore Beach,2022-09-18T12:47:00Z,2022,9,WHI,TRUE,TRUE,TRUE,NSW-SMART-drumline-report-1-July-2022-30-June-2023.pdf
18/09/2022,15:30,White Shark,208,M,Alive,"ID, A",Port Macquarie  Port Macquarie to Tacking Point,North Shore Beach,2022-09-18T15:30:00Z,2022,9,WHI,TRUE,TRUE,TRUE,NSW-SMART-drumline-report-1-July-2022-30-June-2023.pdf
19/09/2022,12:00,Bronze Whaler,275,M,Alive,ID,Port Macquarie  Port Macquarie to Tacking Point,North Shore Beach,2022-09-19T12:00:00Z,2022,9,BRO,FALSE,TRUE,FALSE,NSW-SMART-drumline-report-1-July-2022-30-June-2023.pdf
26/09/2022,7:25,White Shark,193,F,Alive,"ID, A",Port Macquarie  Port Macquarie to Tacking Point,North Shore Beach,2022-09-26T07:25:00Z,2022,9,WHI,TRUE,TRUE,TRUE,NSW-SMART-drumline-report-1-July-2022-30-June-2023.pdf
27/09/2022,10:27,White Shark,228,F,Alive,"ID, A",Port Macquarie  Port Macquarie to Tacking Point,North Shore Beach,2022-09-27T10:27:00Z,2022,9,WHI,TRUE,TRUE,TRUE,NSW-SMART-drumline-report-1-July-2022-30-June-2023.pdf
27/09/2022,15:40,Bronze Whaler,214,M,Alive,ID,Port Macquarie  Port Macquarie to Tacking Point,North Shore Beach,2022-09-27T15:40:00Z,2022,9,BRO,FALSE,TRUE,FALSE,NSW-SMART-drumline-report-1-July-2022-30-June-2023.pdf
2/10/2022,7:30,White Shark,233,F,Alive,"ID, A",Port Macquarie  Port Macquarie to Tacking Point,North Shore Beach,2022-10-02T07:30:00Z,2022,10,WHI,TRUE,TRUE,TRUE,NSW-SMART-drumline-report-1-July-2022-30-June-2023.pdf
4/10/2022,15:57,Bronze Whaler,278,F,Alive,ID,Port Macquarie  Port Macquarie to Tacking Point,North Shore Beach,2022-10-04T15:57:00Z,2022,10,BRO,FALSE,TRUE,FALSE,NSW-SMART-drumline-report-1-July-2022-30-June-2023.pdf
5/10/2022,10:57,White Shark,224,M,Alive,"ID, A",Port Macquarie  Port Macquarie to Tacking Point,North Shore Beach,2022-10-05T10:57:00Z,2022,10,WHI,TRUE,TRUE,TRUE,NSW-SMART-drumline-report-1-July-2022-30-June-2023.pdf
28/10/2022,11:19,Bronze Whaler,253,M,Alive,ID,Port Macquarie  Port Macquarie to Tacking Point,North Shore Beach,2022-10-28T11:19:00Z,2022,10,BRO,FALSE,TRUE,FALSE,NSW-SMART-drumline-report-1-July-2022-30-June-2023.pdf
28/10/2022,14:00,Bronze Whaler,283,M,Alive,ID,Port Macquarie  Port Macquarie to Tacking Point,North Shore Beach,2022-10-28T14:00:00Z,2022,10,BRO,FALSE,TRUE,FALSE,NSW-SMART-drumline-report-1-July-2022-30-June-2023.pdf
10/11/2022,13:15,Dusky Whaler,236,M,Alive,ID,Port Macquarie  Port Macquarie to Tacking Point,North Shore Beach,2022-11-10T13:15:00Z,2022,11,DUS,FALSE,TRUE,FALSE,NSW-SMART-drumline-report-1-July-2022-30-June-2023.pdf
10/11/2022,13:30,Bronze Whaler,238,M,Alive,ID,Port Macquarie  Port Macquarie to Tacking Point,North Shore Beach,2022-11-10T13:30:00Z,2022,11,BRO,FALSE,TRUE,FALSE,NSW-SMART-drumline-report-1-July-2022-30-June-2023.pdf
29/11/2022,NA,Tiger Shark,156,M,Alive,"ID, A",Port Macquarie  Port Macquarie to Tacking Point,North Shore Beach,NA,2022,11,TIG,TRUE,TRUE,TRUE,NSW-SMART-drumline-report-1-July-2022-30-June-2023.pdf
18/02/2023,9:41,Bull Shark,201,F,Alive,"ID, A",Port Macquarie  Port Macquarie to Tacking Point,North Shore Beach,2023-02-18T09:41:00Z,2023,2,BUL,TRUE,TRUE,TRUE,NSW-SMART-drumline-report-1-July-2022-30-June-2023.pdf
20/02/2023,12:58,Tiger Shark,305,M,Alive,"ID, A",Port Macquarie  Port Macquarie to Tacking Point,North Shore Beach,2023-02-20T12:58:00Z,2023,2,TIG,TRUE,TRUE,TRUE,NSW-SMART-drumline-report-1-July-2022-30-June-2023.pdf
27/03/2023,9:48,Common Blacktip,155,M,Alive,ID,Port Macquarie  Port Macquarie to Tacking Point,North Shore Beach,2023-03-27T09:48:00Z,2023,3,CBT,FALSE,TRUE,FALSE,NSW-SMART-drumline-report-1-July-2022-30-June-2023.pdf
31/03/2023,9:07,White Shark,279,M,Alive,"ID, A",Port Macquarie  Port Macquarie to Tacking Point,North Shore Beach,2023-03-31T09:07:00Z,2023,3,WHI,TRUE,TRUE,TRUE,NSW-SMART-drumline-report-1-July-2022-30-June-2023.pdf
4/05/2023,NA,Greynurse Shark,282,F,Alive,ID,Port Macquarie  Port Macquarie to Tacking Point,North Shore Beach,NA,2023,5,GRN,FALSE,TRUE,FALSE,NSW-SMART-drumline-report-1-July-2022-30-June-2023.pdf
6/06/2023,12:56,White Shark,214,M,Alive,"ID, A",Port Macquarie  Port Macquarie to Tacking Point,North Shore Beach,2023-06-06T12:56:00Z,2023,6,WHI,TRUE,TRUE,TRUE,NSW-SMART-drumline-report-1-July-2022-30-June-2023.pdf
9/06/2023,10:25,Greynurse Shark,277,F,Alive,ID,Port Macquarie  Port Macquarie to Tacking Point,North Shore Beach,2023-06-09T10:25:00Z,2023,6,GRN,FALSE,TRUE,FALSE,NSW-SMART-drumline-report-1-July-2022-30-June-2023.pdf
9/06/2023,14:18,Tiger Shark,347,M,Alive,"ID, A",Port Macquarie  Port Macquarie to Tacking Point,North Shore Beach,2023-06-09T14:18:00Z,2023,6,TIG,TRUE,TRUE,TRUE,NSW-SMART-drumline-report-1-July-2022-30-June-2023.pdf
26/06/2023,14:34,White Shark,237,F,Alive,"ID, A",Port Macquarie  Port Macquarie to Tacking Point,North Shore Beach,2023-06-26T14:34:00Z,2023,6,WHI,TRUE,TRUE,TRUE,NSW-SMART-drumline-report-1-July-2022-30-June-2023.pdf
30/07/2022,15:09,White Shark,207,F,Alive,"ID, A",Port Macquarie  Port Macquarie to Tacking Point,Tuncurry Beach,2022-07-30T15:09:00Z,2022,7,WHI,TRUE,TRUE,TRUE,NSW-SMART-drumline-report-1-July-2022-30-June-2023.pdf
6/08/2022,7:51,White Shark,221,F,Alive,"ID, A",Port Macquarie  Port Macquarie to Tacking Point,Tuncurry Beach,2022-08-06T07:51:00Z,2022,8,WHI,TRUE,TRUE,TRUE,NSW-SMART-drumline-report-1-July-2022-30-June-2023.pdf
18/08/2022,12:06,White Shark,239,M,Alive,"ID, A",Port Macquarie  Port Macquarie to Tacking Point,Tuncurry Beach,2022-08-18T12:06:00Z,2022,8,WHI,TRUE,TRUE,TRUE,NSW-SMART-drumline-report-1-July-2022-30-June-2023.pdf
3/10/2022,7:36,White Shark,238,F,Alive,"ID, A",Port Macquarie  Port Macquarie to Tacking Point,Tuncurry Beach,2022-10-03T07:36:00Z,2022,10,WHI,TRUE,TRUE,TRUE,NSW-SMART-drumline-report-1-July-2022-30-June-2023.pdf
26/10/2022,9:00,White Shark,266,F,Alive,"ID, A",Port Macquarie  Port Macquarie to Tacking Point,Tuncurry Beach,2022-10-26T09:00:00Z,2022,10,WHI,TRUE,TRUE,TRUE,NSW-SMART-drumline-report-1-July-2022-30-June-2023.pdf
28/10/2022,9:45,White Shark,288,F,Alive,"ID, A",Port Macquarie  Port Macquarie to Tacking Point,Tuncurry Beach,2022-10-28T09:45:00Z,2022,10,WHI,TRUE,TRUE,TRUE,NSW-SMART-drumline-report-1-July-2022-30-June-2023.pdf
1/12/2022,NA,Tiger Shark,223,F,Alive,"ID, A",Port Macquarie  Port Macquarie to Tacking Point,Tuncurry Beach,NA,2022,12,TIG,TRUE,TRUE,TRUE,NSW-SMART-drumline-report-1-July-2022-30-June-2023.pdf
18/01/2023,11:04,Bull Shark,216,F,Alive,"ID, A",Port Macquarie  Port Macquarie to Tacking Point,Tuncurry Beach,2023-01-18T11:04:00Z,2023,1,BUL,TRUE,TRUE,TRUE,NSW-SMART-drumline-report-1-July-2022-30-June-2023.pdf
2/04/2023,13:48,White Shark,244,M,Alive,"ID, A",Port Macquarie  Port Macquarie to Tacking Point,Tuncurry Beach,2023-04-02T13:48:00Z,2023,4,WHI,TRUE,TRUE,TRUE,NSW-SMART-drumline-report-1-July-2022-30-June-2023.pdf
18/05/2023,11:55,White Shark,254,F,Alive,"ID, A",Port Macquarie  Port Macquarie to Tacking Point,Tuncurry Beach,2023-05-18T11:55:00Z,2023,5,WHI,TRUE,TRUE,TRUE,NSW-SMART-drumline-report-1-July-2022-30-June-2023.pdf
24/05/2023,10:25,White Shark,235,F,Alive,"ID, A",Port Macquarie  Port Macquarie to Tacking Point,Tuncurry Beach,2023-05-24T10:25:00Z,2023,5,WHI,TRUE,TRUE,TRUE,NSW-SMART-drumline-report-1-July-2022-30-June-2023.pdf
25/05/2023,8:43,White Shark,303,F,Alive,"ID, A",Port Macquarie  Port Macquarie to Tacking Point,Tuncurry Beach,2023-05-25T08:43:00Z,2023,5,WHI,TRUE,TRUE,TRUE,NSW-SMART-drumline-report-1-July-2022-30-June-2023.pdf
27/05/2023,9:17,White Shark,281,F,Alive,"ID, A",Port Macquarie  Port Macquarie to Tacking Point,Tuncurry Beach,2023-05-27T09:17:00Z,2023,5,WHI,TRUE,TRUE,TRUE,NSW-SMART-drumline-report-1-July-2022-30-June-2023.pdf
2/06/2023,12:21,White Shark,265,F,Alive,"ID, A",Port Macquarie  Port Macquarie to Tacking Point,Tuncurry Beach,2023-06-02T12:21:00Z,2023,6,WHI,TRUE,TRUE,TRUE,NSW-SMART-drumline-report-1-July-2022-30-June-2023.pdf
18/06/2023,7:28,White Shark,248,F,Alive,"ID, A",Port Macquarie  Port Macquarie to Tacking Point,Tuncurry Beach,2023-06-18T07:28:00Z,2023,6,WHI,TRUE,TRUE,TRUE,NSW-SMART-drumline-report-1-July-2022-30-June-2023.pdf
26/06/2023,15:36,White Shark,257,F,Alive,"ID, A",Port Macquarie  Port Macquarie to Tacking Point,Tuncurry Beach,2023-06-26T15:36:00Z,2023,6,WHI,TRUE,TRUE,TRUE,NSW-SMART-drumline-report-1-July-2022-30-June-2023.pdf
28/06/2023,15:07,White Shark,254,M,Alive,"ID, A",Port Macquarie  Port Macquarie to Tacking Point,Tuncurry Beach,2023-06-28T15:07:00Z,2023,6,WHI,TRUE,TRUE,TRUE,NSW-SMART-drumline-report-1-July-2022-30-June-2023.pdf
13/08/2022,11:36,White Shark,159,F,Alive,"ID, A",Port Macquarie  Port Macquarie to Tacking Point,"Main Beach, Forster",2022-08-13T11:36:00Z,2022,8,WHI,TRUE,TRUE,TRUE,NSW-SMART-drumline-report-1-July-2022-30-June-2023.pdf
20/08/2022,14:03,White Shark,271,F,Alive,"ID, A",Port Macquarie  Port Macquarie to Tacking Point,"Main Beach, Forster",2022-08-20T14:03:00Z,2022,8,WHI,TRUE,TRUE,TRUE,NSW-SMART-drumline-report-1-July-2022-30-June-2023.pdf
25/08/2022,11:07,White Shark,201,F,Alive,"ID, A",Port Macquarie  Port Macquarie to Tacking Point,"Main Beach, Forster",2022-08-25T11:07:00Z,2022,8,WHI,TRUE,TRUE,TRUE,NSW-SMART-drumline-report-1-July-2022-30-June-2023.pdf
31/08/2022,13:58,White Shark,208,F,Alive,"ID, A",Port Macquarie  Port Macquarie to Tacking Point,"Main Beach, Forster",2022-08-31T13:58:00Z,2022,8,WHI,TRUE,TRUE,TRUE,NSW-SMART-drumline-report-1-July-2022-30-June-2023.pdf
16/09/2022,12:51,White Shark,206,F,Alive,"ID, A",Port Macquarie  Port Macquarie to Tacking Point,"Main Beach, Forster",2022-09-16T12:51:00Z,2022,9,WHI,TRUE,TRUE,TRUE,NSW-SMART-drumline-report-1-July-2022-30-June-2023.pdf
20/09/2022,7:57,White Shark,280,F,Alive,NA,Port Macquarie  Port Macquarie to Tacking Point,"Main Beach, Forster",2022-09-20T07:57:00Z,2022,9,WHI,TRUE,FALSE,FALSE,NSW-SMART-drumline-report-1-July-2022-30-June-2023.pdf
20/09/2022,10:43,White Shark,221,F,Alive,"ID, A",Port Macquarie  Port Macquarie to Tacking Point,"Main Beach, Forster",2022-09-20T10:43:00Z,2022,9,WHI,TRUE,TRUE,TRUE,NSW-SMART-drumline-report-1-July-2022-30-June-2023.pdf
26/09/2022,8:03,White Shark,246,F,Alive,"ID, A",Port Macquarie  Port Macquarie to Tacking Point,"Main Beach, Forster",2022-09-26T08:03:00Z,2022,9,WHI,TRUE,TRUE,TRUE,NSW-SMART-drumline-report-1-July-2022-30-June-2023.pdf
29/09/2022,7:18,White Shark,283,F,Alive,"ID, A",Port Macquarie  Port Macquarie to Tacking Point,"Main Beach, Forster",2022-09-29T07:18:00Z,2022,9,WHI,TRUE,TRUE,TRUE,NSW-SMART-drumline-report-1-July-2022-30-June-2023.pdf
29/09/2022,13:24,White Shark,193,F,Alive,"ID, A",Port Macquarie  Port Macquarie to Tacking Point,"Main Beach, Forster",2022-09-29T13:24:00Z,2022,9,WHI,TRUE,TRUE,TRUE,NSW-SMART-drumline-report-1-July-2022-30-June-2023.pdf
15/10/2022,10:54,White Shark,161,F,Alive,"ID, A",Port Macquarie  Port Macquarie to Tacking Point,"Main Beach, Forster",2022-10-15T10:54:00Z,2022,10,WHI,TRUE,TRUE,TRUE,NSW-SMART-drumline-report-1-July-2022-30-June-2023.pdf
10/11/2022,18:00,Bronze Whaler,266,F,Alive,ID,Port Macquarie  Port Macquarie to Tacking Point,"Main Beach, Forster",2022-11-10T18:00:00Z,2022,11,BRO,FALSE,TRUE,FALSE,NSW-SMART-drumline-report-1-July-2022-30-June-2023.pdf
30/11/2022,11:31,White Shark,205,F,Alive,"ID, A",Port Macquarie  Port Macquarie to Tacking Point,"Main Beach, Forster",2022-11-30T11:31:00Z,2022,11,WHI,TRUE,TRUE,TRUE,NSW-SMART-drumline-report-1-July-2022-30-June-2023.pdf
10/12/2022,17:55,Bronze Whaler,221,M,Alive,ID,Port Macquarie  Port Macquarie to Tacking Point,"Main Beach, Forster",2022-12-10T17:55:00Z,2022,12,BRO,FALSE,TRUE,FALSE,NSW-SMART-drumline-report-1-July-2022-30-June-2023.pdf
23/12/2022,15:33,Greynurse Shark,263,F,Alive,ID,Port Macquarie  Port Macquarie to Tacking Point,"Main Beach, Forster",2022-12-23T15:33:00Z,2022,12,GRN,FALSE,TRUE,FALSE,NSW-SMART-drumline-report-1-July-2022-30-June-2023.pdf
28/12/2022,7:57,White Shark,207,F,Alive,"ID, A",Port Macquarie  Port Macquarie to Tacking Point,"Main Beach, Forster",2022-12-28T07:57:00Z,2022,12,WHI,TRUE,TRUE,TRUE,NSW-SMART-drumline-report-1-July-2022-30-June-2023.pdf
9/01/2023,NA,Greynurse Shark,296,F,Alive,ID,Port Macquarie  Port Macquarie to Tacking Point,"Main Beach, Forster",NA,2023,1,GRN,FALSE,TRUE,FALSE,NSW-SMART-drumline-report-1-July-2022-30-June-2023.pdf
2/04/2023,8:09,Greynurse Shark,280,F,Alive,ID,Port Macquarie  Port Macquarie to Tacking Point,"Main Beach, Forster",2023-04-02T08:09:00Z,2023,4,GRN,FALSE,TRUE,FALSE,NSW-SMART-drumline-report-1-July-2022-30-June-2023.pdf
19/04/2023,7:19,Greynurse Shark,263,F,Alive,ID,Port Macquarie  Port Macquarie to Tacking Point,"Main Beach, Forster",2023-04-19T07:19:00Z,2023,4,GRN,FALSE,TRUE,FALSE,NSW-SMART-drumline-report-1-July-2022-30-June-2023.pdf
20/05/2023,9:14,White Shark,192,F,Alive,"ID, A",Port Macquarie  Port Macquarie to Tacking Point,"Main Beach, Forster",2023-05-20T09:14:00Z,2023,5,WHI,TRUE,TRUE,TRUE,NSW-SMART-drumline-report-1-July-2022-30-June-2023.pdf
23/05/2023,11:24,White Shark,196,F,Alive,"ID, A",Port Macquarie  Port Macquarie to Tacking Point,"Main Beach, Forster",2023-05-23T11:24:00Z,2023,5,WHI,TRUE,TRUE,TRUE,NSW-SMART-drumline-report-1-July-2022-30-June-2023.pdf
6/06/2023,11:00,White Shark,256,F,Alive,"ID, A",Port Macquarie  Port Macquarie to Tacking Point,"Main Beach, Forster",2023-06-06T11:00:00Z,2023,6,WHI,TRUE,TRUE,TRUE,NSW-SMART-drumline-report-1-July-2022-30-June-2023.pdf
7/06/2023,13:16,White Shark,231,F,Alive,"ID, A",Port Macquarie  Port Macquarie to Tacking Point,"Main Beach, Forster",2023-06-07T13:16:00Z,2023,6,WHI,TRUE,TRUE,TRUE,NSW-SMART-drumline-report-1-July-2022-30-June-2023.pdf
27/06/2023,8:04,White Shark,246,F,Alive,"ID, A",Port Macquarie  Port Macquarie to Tacking Point,"Main Beach, Forster",2023-06-27T08:04:00Z,2023,6,WHI,TRUE,TRUE,TRUE,NSW-SMART-drumline-report-1-July-2022-30-June-2023.pdf
15/07/2022,8:10,White Shark,246,F,Alive,"ID, A",Port Macquarie  Port Macquarie to Tacking Point,Pebbly Beach,2022-07-15T08:10:00Z,2022,7,WHI,TRUE,TRUE,TRUE,NSW-SMART-drumline-report-1-July-2022-30-June-2023.pdf
15/07/2022,13:10,White Shark,253,M,Alive,"ID, A",Port Macquarie  Port Macquarie to Tacking Point,Pebbly Beach,2022-07-15T13:10:00Z,2022,7,WHI,TRUE,TRUE,TRUE,NSW-SMART-drumline-report-1-July-2022-30-June-2023.pdf
4/08/2022,14:21,White Shark,222,M,Alive,"ID, A",Port Macquarie  Port Macquarie to Tacking Point,Pebbly Beach,2022-08-04T14:21:00Z,2022,8,WHI,TRUE,TRUE,TRUE,NSW-SMART-drumline-report-1-July-2022-30-June-2023.pdf
18/10/2022,10:21,White Shark,246,F,Alive,"ID, A",Port Macquarie  Port Macquarie to Tacking Point,Pebbly Beach,2022-10-18T10:21:00Z,2022,10,WHI,TRUE,TRUE,TRUE,NSW-SMART-drumline-report-1-July-2022-30-June-2023.pdf
19/10/2022,9:48,White Shark,253,F,Alive,"ID, A",Port Macquarie  Port Macquarie to Tacking Point,Pebbly Beach,2022-10-19T09:48:00Z,2022,10,WHI,TRUE,TRUE,TRUE,NSW-SMART-drumline-report-1-July-2022-30-June-2023.pdf
22/03/2023,7:37,White Shark,249,F,Alive,"ID, A",Port Macquarie  Port Macquarie to Tacking Point,Pebbly Beach,2023-03-22T07:37:00Z,2023,3,WHI,TRUE,TRUE,TRUE,NSW-SMART-drumline-report-1-July-2022-30-June-2023.pdf
31/05/2023,9:29,White Shark,255,F,Alive,"ID, A",Port Macquarie  Port Macquarie to Tacking Point,Pebbly Beach,2023-05-31T09:29:00Z,2023,5,WHI,TRUE,TRUE,TRUE,NSW-SMART-drumline-report-1-July-2022-30-June-2023.pdf
18/07/2022,9:30,White Shark,259,M,Alive,"ID, A",Port Macquarie  Port Macquarie to Tacking Point,One Mile Beach,2022-07-18T09:30:00Z,2022,7,WHI,TRUE,TRUE,TRUE,NSW-SMART-drumline-report-1-July-2022-30-June-2023.pdf
25/07/2022,11:15,Bronze Whaler,239,F,Alive,ID,Port Macquarie  Port Macquarie to Tacking Point,One Mile Beach,2022-07-25T11:15:00Z,2022,7,BRO,FALSE,TRUE,FALSE,NSW-SMART-drumline-report-1-July-2022-30-June-2023.pdf
25/07/2022,11:45,Bronze Whaler,253,F,Alive,ID,Port Macquarie  Port Macquarie to Tacking Point,One Mile Beach,2022-07-25T11:45:00Z,2022,7,BRO,FALSE,TRUE,FALSE,NSW-SMART-drumline-report-1-July-2022-30-June-2023.pdf
30/07/2022,10:32,Dusky Whaler,329,F,Alive,ID,Port Macquarie  Port Macquarie to Tacking Point,One Mile Beach,2022-07-30T10:32:00Z,2022,7,DUS,FALSE,TRUE,FALSE,NSW-SMART-drumline-report-1-July-2022-30-June-2023.pdf
2/09/2022,11:06,White Shark,234,M,Alive,"ID, A",Port Macquarie  Port Macquarie to Tacking Point,One Mile Beach,2022-09-02T11:06:00Z,2022,9,WHI,TRUE,TRUE,TRUE,NSW-SMART-drumline-report-1-July-2022-30-June-2023.pdf
6/09/2022,9:57,White Shark,282,F,Alive,"ID, A",Port Macquarie  Port Macquarie to Tacking Point,One Mile Beach,2022-09-06T09:57:00Z,2022,9,WHI,TRUE,TRUE,TRUE,NSW-SMART-drumline-report-1-July-2022-30-June-2023.pdf
10/09/2022,10:00,White Shark,291,M,Alive,"ID, A",Port Macquarie  Port Macquarie to Tacking Point,One Mile Beach,2022-09-10T10:00:00Z,2022,9,WHI,TRUE,TRUE,TRUE,NSW-SMART-drumline-report-1-July-2022-30-June-2023.pdf
11/09/2022,14:30,Bronze Whaler,281,F,Alive,ID,Port Macquarie  Port Macquarie to Tacking Point,One Mile Beach,2022-09-11T14:30:00Z,2022,9,BRO,FALSE,TRUE,FALSE,NSW-SMART-drumline-report-1-July-2022-30-June-2023.pdf
26/09/2022,14:02,Bronze Whaler,245,M,Alive,ID,Port Macquarie  Port Macquarie to Tacking Point,One Mile Beach,2022-09-26T14:02:00Z,2022,9,BRO,FALSE,TRUE,FALSE,NSW-SMART-drumline-report-1-July-2022-30-June-2023.pdf
20/01/2023,9:55,White Shark,315,M,Alive,"ID, A",Port Macquarie  Port Macquarie to Tacking Point,One Mile Beach,2023-01-20T09:55:00Z,2023,1,WHI,TRUE,TRUE,TRUE,NSW-SMART-drumline-report-1-July-2022-30-June-2023.pdf
10/05/2023,10:25,White Shark,245,F,Alive,"ID, A",Port Macquarie  Port Macquarie to Tacking Point,One Mile Beach,2023-05-10T10:25:00Z,2023,5,WHI,TRUE,TRUE,TRUE,NSW-SMART-drumline-report-1-July-2022-30-June-2023.pdf
14/06/2023,9:57,White Shark,260,F,Alive,"ID, A",Port Macquarie  Port Macquarie to Tacking Point,One Mile Beach,2023-06-14T09:57:00Z,2023,6,WHI,TRUE,TRUE,TRUE,NSW-SMART-drumline-report-1-July-2022-30-June-2023.pdf
21/06/2023,9:36,White Shark,269,M,Alive,"ID, A",Port Macquarie  Port Macquarie to Tacking Point,One Mile Beach,2023-06-21T09:36:00Z,2023,6,WHI,TRUE,TRUE,TRUE,NSW-SMART-drumline-report-1-July-2022-30-June-2023.pdf
26/06/2023,11:41,White Shark,295,M,Alive,"ID, A",Port Macquarie  Port Macquarie to Tacking Point,One Mile Beach,2023-06-26T11:41:00Z,2023,6,WHI,TRUE,TRUE,TRUE,NSW-SMART-drumline-report-1-July-2022-30-June-2023.pdf
18/07/2022,13:48,White Shark,256,F,Alive,"ID, A",Port Macquarie  Port Macquarie to Tacking Point,Burgess Beach,2022-07-18T13:48:00Z,2022,7,WHI,TRUE,TRUE,TRUE,NSW-SMART-drumline-report-1-July-2022-30-June-2023.pdf
8/08/2022,14:12,Tiger Shark,400,NA,Alive,NA,Port Macquarie  Port Macquarie to Tacking Point,Burgess Beach,2022-08-08T14:12:00Z,2022,8,TIG,TRUE,FALSE,FALSE,NSW-SMART-drumline-report-1-July-2022-30-June-2023.pdf
12/08/2022,9:18,White Shark,277,F,Alive,"ID, A",Port Macquarie  Port Macquarie to Tacking Point,Burgess Beach,2022-08-12T09:18:00Z,2022,8,WHI,TRUE,TRUE,TRUE,NSW-SMART-drumline-report-1-July-2022-30-June-2023.pdf
24/01/2023,11:40,White Shark,348,F,Alive,"ID, A",Port Macquarie  Port Macquarie to Tacking Point,Burgess Beach,2023-01-24T11:40:00Z,2023,1,WHI,TRUE,TRUE,TRUE,NSW-SMART-drumline-report-1-July-2022-30-June-2023.pdf
30/04/2023,14:12,White Shark,248,F,Alive,"ID, A",Port Macquarie  Port Macquarie to Tacking Point,Burgess Beach,2023-04-30T14:12:00Z,2023,4,WHI,TRUE,TRUE,TRUE,NSW-SMART-drumline-report-1-July-2022-30-June-2023.pdf
28/06/2023,9:10,White Shark,279,F,Alive,"ID, A",Port Macquarie  Port Macquarie to Tacking Point,Burgess Beach,2023-06-28T09:10:00Z,2023,6,WHI,TRUE,TRUE,TRUE,NSW-SMART-drumline-report-1-July-2022-30-June-2023.pdf
22/08/2022,9:52,White Shark,277,F,Alive,"ID, A",Port Macquarie  Port Macquarie to Tacking Point,Seven Mile Beach,2022-08-22T09:52:00Z,2022,8,WHI,TRUE,TRUE,TRUE,NSW-SMART-drumline-report-1-July-2022-30-June-2023.pdf
2/03/2023,10:44,Dusky Whaler,322,M,Alive,ID,Port Macquarie  Port Macquarie to Tacking Point,Seven Mile Beach,2023-03-02T10:44:00Z,2023,3,DUS,FALSE,TRUE,FALSE,NSW-SMART-drumline-report-1-July-2022-30-June-2023.pdf
8/03/2023,13:24,Bronze Whaler,326,F,Alive,ID,Port Macquarie  Port Macquarie to Tacking Point,Seven Mile Beach,2023-03-08T13:24:00Z,2023,3,BRO,FALSE,TRUE,FALSE,NSW-SMART-drumline-report-1-July-2022-30-June-2023.pdf
25/07/2022,9:41,Dusky Whaler,254,F,Alive,ID,Newcastle - Stockton to Redhead,Stockton Beach,2022-07-25T09:41:00Z,2022,7,DUS,FALSE,TRUE,FALSE,NSW-SMART-drumline-report-1-July-2022-30-June-2023.pdf
26/07/2022,11:12,White Shark,199,M,Alive,"ID, A",Newcastle - Stockton to Redhead,Stockton Beach,2022-07-26T11:12:00Z,2022,7,WHI,TRUE,TRUE,TRUE,NSW-SMART-drumline-report-1-July-2022-30-June-2023.pdf
26/07/2022,15:15,Dusky Whaler,219,F,Alive,ID,Newcastle - Stockton to Redhead,Stockton Beach,2022-07-26T15:15:00Z,2022,7,DUS,FALSE,TRUE,FALSE,NSW-SMART-drumline-report-1-July-2022-30-June-2023.pdf
4/10/2022,17:48,White Shark,261,M,Alive,"ID, A",Newcastle - Stockton to Redhead,Stockton Beach,2022-10-04T17:48:00Z,2022,10,WHI,TRUE,TRUE,TRUE,NSW-SMART-drumline-report-1-July-2022-30-June-2023.pdf
3/03/2023,16:57,Smooth Hammerhead,128,F,Alive,ID,Newcastle - Stockton to Redhead,Stockton Beach,2023-03-03T16:57:00Z,2023,3,SMH,FALSE,TRUE,FALSE,NSW-SMART-drumline-report-1-July-2022-30-June-2023.pdf
3/03/2023,NA,Common Blacktip,96,F,Alive,ID,Newcastle - Stockton to Redhead,Stockton Beach,NA,2023,3,CBT,FALSE,TRUE,FALSE,NSW-SMART-drumline-report-1-July-2022-30-June-2023.pdf
6/03/2023,NA,Dusky Whaler,108,M,Alive,ID,Newcastle - Stockton to Redhead,Stockton Beach,NA,2023,3,DUS,FALSE,TRUE,FALSE,NSW-SMART-drumline-report-1-July-2022-30-June-2023.pdf
11/03/2023,NA,Dusky Whaler,112,F,Alive,ID,Newcastle - Stockton to Redhead,Stockton Beach,NA,2023,3,DUS,FALSE,TRUE,FALSE,NSW-SMART-drumline-report-1-July-2022-30-June-2023.pdf
22/03/2023,6:46,Dusky Whaler,106,F,Alive,ID,Newcastle - Stockton to Redhead,Stockton Beach,2023-03-22T06:46:00Z,2023,3,DUS,FALSE,TRUE,FALSE,NSW-SMART-drumline-report-1-July-2022-30-June-2023.pdf
30/04/2023,NA,Dusky Whaler,113,F,Alive,ID,Newcastle - Stockton to Redhead,Stockton Beach,NA,2023,4,DUS,FALSE,TRUE,FALSE,NSW-SMART-drumline-report-1-July-2022-30-June-2023.pdf
10/06/2023,7:07,White Shark,211,F,Alive,ID,Newcastle - Stockton to Redhead,Stockton Beach,2023-06-10T07:07:00Z,2023,6,WHI,TRUE,TRUE,FALSE,NSW-SMART-drumline-report-1-July-2022-30-June-2023.pdf
4/08/2022,14:58,Bronze Whaler,281,F,Alive,ID,Newcastle - Stockton to Redhead,Nobbys Beach,2022-08-04T14:58:00Z,2022,8,BRO,FALSE,TRUE,FALSE,NSW-SMART-drumline-report-1-July-2022-30-June-2023.pdf
17/01/2023,9:24,Tiger Shark,160,F,Alive,"ID, A",Newcastle - Stockton to Redhead,Nobbys Beach,2023-01-17T09:24:00Z,2023,1,TIG,TRUE,TRUE,TRUE,NSW-SMART-drumline-report-1-July-2022-30-June-2023.pdf
16/03/2023,NA,Dusky Whaler,119,F,Alive,ID,Newcastle - Stockton to Redhead,Nobbys Beach,NA,2023,3,DUS,FALSE,TRUE,FALSE,NSW-SMART-drumline-report-1-July-2022-30-June-2023.pdf
16/03/2023,18:05,Dusky Whaler,115,F,Alive,ID,Newcastle - Stockton to Redhead,Nobbys Beach,2023-03-16T18:05:00Z,2023,3,DUS,FALSE,TRUE,FALSE,NSW-SMART-drumline-report-1-July-2022-30-June-2023.pdf
1/01/2023,NA,Dusky Whaler,99,F,Alive,ID,Newcastle - Stockton to Redhead,Newcastle Beach,NA,2023,1,DUS,FALSE,TRUE,FALSE,NSW-SMART-drumline-report-1-July-2022-30-June-2023.pdf
23/03/2023,11:29,Dusky Whaler,121,F,Alive,ID,Newcastle - Stockton to Redhead,Newcastle Beach,2023-03-23T11:29:00Z,2023,3,DUS,FALSE,TRUE,FALSE,NSW-SMART-drumline-report-1-July-2022-30-June-2023.pdf
23/03/2023,14:07,Dusky Whaler,107,F,Alive,ID,Newcastle - Stockton to Redhead,Newcastle Beach,2023-03-23T14:07:00Z,2023,3,DUS,FALSE,TRUE,FALSE,NSW-SMART-drumline-report-1-July-2022-30-June-2023.pdf
25/04/2023,9:04,Dusky Whaler,137,F,Alive,ID,Newcastle - Stockton to Redhead,Newcastle Beach,2023-04-25T09:04:00Z,2023,4,DUS,FALSE,TRUE,FALSE,NSW-SMART-drumline-report-1-July-2022-30-June-2023.pdf
2/06/2023,9:54,Mako,281,M,Alive,ID,Newcastle - Stockton to Redhead,Newcastle Beach,2023-06-02T09:54:00Z,2023,6,SMA,FALSE,TRUE,FALSE,NSW-SMART-drumline-report-1-July-2022-30-June-2023.pdf
18/07/2022,8:39,Dusky Whaler,284,F,Alive,ID,Newcastle - Stockton to Redhead,Bar Beach,2022-07-18T08:39:00Z,2022,7,DUS,FALSE,TRUE,FALSE,NSW-SMART-drumline-report-1-July-2022-30-June-2023.pdf
29/08/2022,12:42,White Shark,253,F,Alive,"ID, A",Newcastle - Stockton to Redhead,Bar Beach,2022-08-29T12:42:00Z,2022,8,WHI,TRUE,TRUE,TRUE,NSW-SMART-drumline-report-1-July-2022-30-June-2023.pdf
11/12/2022,NA,Dusky Whaler,128,F,Alive,ID,Newcastle - Stockton to Redhead,Bar Beach,NA,2022,12,DUS,FALSE,TRUE,FALSE,NSW-SMART-drumline-report-1-July-2022-30-June-2023.pdf
27/07/2022,11:45,Dusky Whaler,249,F,Alive,"ID, A",Newcastle - Stockton to Redhead,Merewether Beach,2022-07-27T11:45:00Z,2022,7,DUS,FALSE,TRUE,TRUE,NSW-SMART-drumline-report-1-July-2022-30-June-2023.pdf
25/08/2022,9:36,Dusky Whaler,262,F,Alive,ID,Newcastle - Stockton to Redhead,Merewether Beach,2022-08-25T09:36:00Z,2022,8,DUS,FALSE,TRUE,FALSE,NSW-SMART-drumline-report-1-July-2022-30-June-2023.pdf
15/03/2023,NA,Dusky Whaler,104,F,Alive,ID,Newcastle - Stockton to Redhead,Merewether Beach,NA,2023,3,DUS,FALSE,TRUE,FALSE,NSW-SMART-drumline-report-1-July-2022-30-June-2023.pdf
7/06/2023,NA,Dusky Whaler,121,F,Alive,ID,Newcastle - Stockton to Redhead,Merewether Beach,NA,2023,6,DUS,FALSE,TRUE,FALSE,NSW-SMART-drumline-report-1-July-2022-30-June-2023.pdf
12/07/2022,11:26,White Shark,208,M,Alive,"ID, A",Newcastle - Stockton to Redhead,Dudley Beach,2022-07-12T11:26:00Z,2022,7,WHI,TRUE,TRUE,TRUE,NSW-SMART-drumline-report-1-July-2022-30-June-2023.pdf
18/07/2022,9:30,Dusky Whaler,243,F,Alive,ID,Newcastle - Stockton to Redhead,Dudley Beach,2022-07-18T09:30:00Z,2022,7,DUS,FALSE,TRUE,FALSE,NSW-SMART-drumline-report-1-July-2022-30-June-2023.pdf
30/07/2022,9:16,Dusky Whaler,266,M,Alive,ID,Newcastle - Stockton to Redhead,Dudley Beach,2022-07-30T09:16:00Z,2022,7,DUS,FALSE,TRUE,FALSE,NSW-SMART-drumline-report-1-July-2022-30-June-2023.pdf
2/10/2022,17:12,Dusky Whaler,110,F,Alive,ID,Newcastle - Stockton to Redhead,Dudley Beach,2022-10-02T17:12:00Z,2022,10,DUS,FALSE,TRUE,FALSE,NSW-SMART-drumline-report-1-July-2022-30-June-2023.pdf
30/10/2022,14:54,Smooth Hammerhead,153,F,Alive,ID,Newcastle - Stockton to Redhead,Dudley Beach,2022-10-30T14:54:00Z,2022,10,SMH,FALSE,TRUE,FALSE,NSW-SMART-drumline-report-1-July-2022-30-June-2023.pdf
18/01/2023,NA,Tiger Shark,129,F,Alive,"ID, A",Newcastle - Stockton to Redhead,Dudley Beach,NA,2023,1,TIG,TRUE,TRUE,TRUE,NSW-SMART-drumline-report-1-July-2022-30-June-2023.pdf
19/03/2023,NA,Dusky Whaler,127,F,Alive,ID,Newcastle - Stockton to Redhead,Dudley Beach,NA,2023,3,DUS,FALSE,TRUE,FALSE,NSW-SMART-drumline-report-1-July-2022-30-June-2023.pdf
27/07/2022,9:02,White Shark,210,210,Alive,"ID, A",Newcastle - Stockton to Redhead,Redhead Beach,2022-07-27T09:02:00Z,2022,7,WHI,TRUE,TRUE,TRUE,NSW-SMART-drumline-report-1-July-2022-30-June-2023.pdf
18/10/2022,10:45,White Shark,199,199,Alive,"ID, A",Newcastle - Stockton to Redhead,Redhead Beach,2022-10-18T10:45:00Z,2022,10,WHI,TRUE,TRUE,TRUE,NSW-SMART-drumline-report-1-July-2022-30-June-2023.pdf
30/10/2022,15:43,Dusky Whaler,199,199,Alive,ID,Newcastle - Stockton to Redhead,Redhead Beach,2022-10-30T15:43:00Z,2022,10,DUS,FALSE,TRUE,FALSE,NSW-SMART-drumline-report-1-July-2022-30-June-2023.pdf
27/12/2022,11:18,Tiger Shark,174,174,Alive,"ID, A",Newcastle - Stockton to Redhead,Redhead Beach,2022-12-27T11:18:00Z,2022,12,TIG,TRUE,TRUE,TRUE,NSW-SMART-drumline-report-1-July-2022-30-June-2023.pdf
4/01/2023,12:23,Tiger Shark,184,184,Alive,"ID, A",Newcastle - Stockton to Redhead,Redhead Beach,2023-01-04T12:23:00Z,2023,1,TIG,TRUE,TRUE,TRUE,NSW-SMART-drumline-report-1-July-2022-30-June-2023.pdf
31/05/2023,8:53,Bronze Whaler,267,267,Alive,ID,Newcastle - Stockton to Redhead,Redhead Beach,2023-05-31T08:53:00Z,2023,5,BRO,FALSE,TRUE,FALSE,NSW-SMART-drumline-report-1-July-2022-30-June-2023.pdf
6/06/2023,10:14,White Shark,221,221,Alive,"ID, A",Newcastle - Stockton to Redhead,Redhead Beach,2023-06-06T10:14:00Z,2023,6,WHI,TRUE,TRUE,TRUE,NSW-SMART-drumline-report-1-July-2022-30-June-2023.pdf
27/08/2022,9:05,Bronze Whaler,234,F,Alive,ID,Lake Macquarie -Blacksmiths to Frazer Park,Frazer Beach,2022-08-27T09:05:00Z,2022,8,BRO,FALSE,TRUE,FALSE,NSW-SMART-drumline-report-1-July-2022-30-June-2023.pdf
16/09/2022,7:18,Thresher Shark,280,M,Alive,ID,Lake Macquarie -Blacksmiths to Frazer Park,Frazer Beach,2022-09-16T07:18:00Z,2022,9,THR,FALSE,TRUE,FALSE,NSW-SMART-drumline-report-1-July-2022-30-June-2023.pdf
25/09/2022,10:21,White Shark,310,M,Alive,"ID, A",Lake Macquarie -Blacksmiths to Frazer Park,Frazer Beach,2022-09-25T10:21:00Z,2022,9,WHI,TRUE,TRUE,TRUE,NSW-SMART-drumline-report-1-July-2022-30-June-2023.pdf
23/11/2022,9:26,Dusky Whaler,137,M,Alive,ID,Lake Macquarie -Blacksmiths to Frazer Park,Frazer Beach,2022-11-23T09:26:00Z,2022,11,DUS,FALSE,TRUE,FALSE,NSW-SMART-drumline-report-1-July-2022-30-June-2023.pdf
14/12/2022,10:51,Dusky Whaler,153,F,Alive,ID,Lake Macquarie -Blacksmiths to Frazer Park,Frazer Beach,2022-12-14T10:51:00Z,2022,12,DUS,FALSE,TRUE,FALSE,NSW-SMART-drumline-report-1-July-2022-30-June-2023.pdf
23/01/2023,14:36,Smooth Hammerhead,135,M,Alive,ID,Lake Macquarie -Blacksmiths to Frazer Park,Frazer Beach,2023-01-23T14:36:00Z,2023,1,SMH,FALSE,TRUE,FALSE,NSW-SMART-drumline-report-1-July-2022-30-June-2023.pdf
8/02/2023,12:00,Dusky Whaler,168,F,Alive,ID,Lake Macquarie -Blacksmiths to Frazer Park,Frazer Beach,2023-02-08T12:00:00Z,2023,2,DUS,FALSE,TRUE,FALSE,NSW-SMART-drumline-report-1-July-2022-30-June-2023.pdf
15/02/2023,9:05,Dusky Whaler,145,F,Alive,ID,Lake Macquarie -Blacksmiths to Frazer Park,Frazer Beach,2023-02-15T09:05:00Z,2023,2,DUS,FALSE,TRUE,FALSE,NSW-SMART-drumline-report-1-July-2022-30-June-2023.pdf
19/02/2023,16:35,Dusky Whaler,159,M,Alive,ID,Lake Macquarie -Blacksmiths to Frazer Park,Frazer Beach,2023-02-19T16:35:00Z,2023,2,DUS,FALSE,TRUE,FALSE,NSW-SMART-drumline-report-1-July-2022-30-June-2023.pdf
21/02/2023,11:21,Tiger Shark,142,F,Alive,"ID, A",Lake Macquarie -Blacksmiths to Frazer Park,Frazer Beach,2023-02-21T11:21:00Z,2023,2,TIG,TRUE,TRUE,TRUE,NSW-SMART-drumline-report-1-July-2022-30-June-2023.pdf
25/02/2023,9:51,Dusky Whaler,124,F,Alive,ID,Lake Macquarie -Blacksmiths to Frazer Park,Frazer Beach,2023-02-25T09:51:00Z,2023,2,DUS,FALSE,TRUE,FALSE,NSW-SMART-drumline-report-1-July-2022-30-June-2023.pdf
28/02/2023,10:43,Dusky Whaler,127,F,Alive,ID,Lake Macquarie -Blacksmiths to Frazer Park,Frazer Beach,2023-02-28T10:43:00Z,2023,2,DUS,FALSE,TRUE,FALSE,NSW-SMART-drumline-report-1-July-2022-30-June-2023.pdf
2/03/2023,9:31,Dusky Whaler,NA,NA,Alive,ID,Lake Macquarie -Blacksmiths to Frazer Park,Frazer Beach,2023-03-02T09:31:00Z,2023,3,DUS,FALSE,TRUE,FALSE,NSW-SMART-drumline-report-1-July-2022-30-June-2023.pdf
3/03/2023,15:15,Dusky Whaler,136,F,Alive,ID,Lake Macquarie -Blacksmiths to Frazer Park,Frazer Beach,2023-03-03T15:15:00Z,2023,3,DUS,FALSE,TRUE,FALSE,NSW-SMART-drumline-report-1-July-2022-30-June-2023.pdf
27/04/2023,9:03,Smooth Hammerhead,126,F,Alive,ID,Lake Macquarie -Blacksmiths to Frazer Park,Frazer Beach,2023-04-27T09:03:00Z,2023,4,SMH,FALSE,TRUE,FALSE,NSW-SMART-drumline-report-1-July-2022-30-June-2023.pdf
11/05/2023,11:16,Dusky Whaler,133,M,Alive,ID,Lake Macquarie -Blacksmiths to Frazer Park,Frazer Beach,2023-05-11T11:16:00Z,2023,5,DUS,FALSE,TRUE,FALSE,NSW-SMART-drumline-report-1-July-2022-30-June-2023.pdf
23/05/2023,NA,Dusky Whaler,107,M,Alive,ID,Lake Macquarie -Blacksmiths to Frazer Park,Frazer Beach,NA,2023,5,DUS,FALSE,TRUE,FALSE,NSW-SMART-drumline-report-1-July-2022-30-June-2023.pdf
21/06/2023,11:12,Bronze Whaler,301,F,Alive,ID,Lake Macquarie -Blacksmiths to Frazer Park,Frazer Beach,2023-06-21T11:12:00Z,2023,6,BRO,FALSE,TRUE,FALSE,NSW-SMART-drumline-report-1-July-2022-30-June-2023.pdf
23/06/2023,13:29,Dusky Whaler,254,F,Alive,ID,Lake Macquarie -Blacksmiths to Frazer Park,Frazer Beach,2023-06-23T13:29:00Z,2023,6,DUS,FALSE,TRUE,FALSE,NSW-SMART-drumline-report-1-July-2022-30-June-2023.pdf
16/07/2022,11:43,Bronze Whaler,286,M,Alive,ID,Lake Macquarie -Blacksmiths to Frazer Park,Ghosties Beach,2022-07-16T11:43:00Z,2022,7,BRO,FALSE,TRUE,FALSE,NSW-SMART-drumline-report-1-July-2022-30-June-2023.pdf
17/07/2022,11:28,Bronze Whaler,257,F,Alive,ID,Lake Macquarie -Blacksmiths to Frazer Park,Ghosties Beach,2022-07-17T11:28:00Z,2022,7,BRO,FALSE,TRUE,FALSE,NSW-SMART-drumline-report-1-July-2022-30-June-2023.pdf
24/07/2022,10:24,Bronze Whaler,284,F,Alive,ID,Lake Macquarie -Blacksmiths to Frazer Park,Ghosties Beach,2022-07-24T10:24:00Z,2022,7,BRO,FALSE,TRUE,FALSE,NSW-SMART-drumline-report-1-July-2022-30-June-2023.pdf
26/07/2022,8:37,Bronze Whaler,283,F,Alive,ID,Lake Macquarie -Blacksmiths to Frazer Park,Ghosties Beach,2022-07-26T08:37:00Z,2022,7,BRO,FALSE,TRUE,FALSE,NSW-SMART-drumline-report-1-July-2022-30-June-2023.pdf
8/08/2022,11:30,Dusky Whaler,145,M,Alive,ID,Lake Macquarie -Blacksmiths to Frazer Park,Ghosties Beach,2022-08-08T11:30:00Z,2022,8,DUS,FALSE,TRUE,FALSE,NSW-SMART-drumline-report-1-July-2022-30-June-2023.pdf
29/11/2022,10:21,Dusky Whaler,121,M,Alive,ID,Lake Macquarie -Blacksmiths to Frazer Park,Ghosties Beach,2022-11-29T10:21:00Z,2022,11,DUS,FALSE,TRUE,FALSE,NSW-SMART-drumline-report-1-July-2022-30-June-2023.pdf
13/12/2022,7:45,Dusky Whaler,138,M,Alive,ID,Lake Macquarie -Blacksmiths to Frazer Park,Ghosties Beach,2022-12-13T07:45:00Z,2022,12,DUS,FALSE,TRUE,FALSE,NSW-SMART-drumline-report-1-July-2022-30-June-2023.pdf
14/12/2022,11:58,Dusky Whaler,147,F,Alive,ID,Lake Macquarie -Blacksmiths to Frazer Park,Ghosties Beach,2022-12-14T11:58:00Z,2022,12,DUS,FALSE,TRUE,FALSE,NSW-SMART-drumline-report-1-July-2022-30-June-2023.pdf
14/12/2022,13:12,Dusky Whaler,153,F,Alive,ID,Lake Macquarie -Blacksmiths to Frazer Park,Ghosties Beach,2022-12-14T13:12:00Z,2022,12,DUS,FALSE,TRUE,FALSE,NSW-SMART-drumline-report-1-July-2022-30-June-2023.pdf
3/02/2023,NA,Snapper,33,NA,Dead,NA,Lake Macquarie -Blacksmiths to Frazer Park,Ghosties Beach,NA,2023,2,SNP,FALSE,FALSE,FALSE,NSW-SMART-drumline-report-1-July-2022-30-June-2023.pdf
6/02/2023,NA,Snapper,54,NA,Dead,NA,Lake Macquarie -Blacksmiths to Frazer Park,Ghosties Beach,NA,2023,2,SNP,FALSE,FALSE,FALSE,NSW-SMART-drumline-report-1-July-2022-30-June-2023.pdf
16/02/2023,13:53,Dusky Whaler,181,M,Alive,ID,Lake Macquarie -Blacksmiths to Frazer Park,Ghosties Beach,2023-02-16T13:53:00Z,2023,2,DUS,FALSE,TRUE,FALSE,NSW-SMART-drumline-report-1-July-2022-30-June-2023.pdf
19/02/2023,8:30,Dusky Whaler,164,M,Alive,ID,Lake Macquarie -Blacksmiths to Frazer Park,Ghosties Beach,2023-02-19T08:30:00Z,2023,2,DUS,FALSE,TRUE,FALSE,NSW-SMART-drumline-report-1-July-2022-30-June-2023.pdf
19/02/2023,10:18,Dusky Whaler,158,F,Alive,ID,Lake Macquarie -Blacksmiths to Frazer Park,Ghosties Beach,2023-02-19T10:18:00Z,2023,2,DUS,FALSE,TRUE,FALSE,NSW-SMART-drumline-report-1-July-2022-30-June-2023.pdf
19/02/2023,16:00,Dusky Whaler,147,F,Alive,ID,Lake Macquarie -Blacksmiths to Frazer Park,Ghosties Beach,2023-02-19T16:00:00Z,2023,2,DUS,FALSE,TRUE,FALSE,NSW-SMART-drumline-report-1-July-2022-30-June-2023.pdf
19/02/2023,17:31,Dusky Whaler,141,M,Alive,ID,Lake Macquarie -Blacksmiths to Frazer Park,Ghosties Beach,2023-02-19T17:31:00Z,2023,2,DUS,FALSE,TRUE,FALSE,NSW-SMART-drumline-report-1-July-2022-30-June-2023.pdf
18/03/2023,7:30,Dusky Whaler,118,F,Alive,ID,Lake Macquarie -Blacksmiths to Frazer Park,Ghosties Beach,2023-03-18T07:30:00Z,2023,3,DUS,FALSE,TRUE,FALSE,NSW-SMART-drumline-report-1-July-2022-30-June-2023.pdf
29/04/2023,8:42,Dusky Whaler,129,M,Alive,ID,Lake Macquarie -Blacksmiths to Frazer Park,Ghosties Beach,2023-04-29T08:42:00Z,2023,4,DUS,FALSE,TRUE,FALSE,NSW-SMART-drumline-report-1-July-2022-30-June-2023.pdf
26/07/2022,13:51,Bronze Whaler,250,NA,Alive,NA,Lake Macquarie -Blacksmiths to Frazer Park,Moonee Beach,2022-07-26T13:51:00Z,2022,7,BRO,FALSE,FALSE,FALSE,NSW-SMART-drumline-report-1-July-2022-30-June-2023.pdf
7/08/2022,NA,Dusky Whaler,140,F,Alive,ID,Lake Macquarie -Blacksmiths to Frazer Park,Moonee Beach,NA,2022,8,DUS,FALSE,TRUE,FALSE,NSW-SMART-drumline-report-1-July-2022-30-June-2023.pdf
21/08/2022,12:15,Dusky Whaler,148,F,Alive,ID,Lake Macquarie -Blacksmiths to Frazer Park,Moonee Beach,2022-08-21T12:15:00Z,2022,8,DUS,FALSE,TRUE,FALSE,NSW-SMART-drumline-report-1-July-2022-30-June-2023.pdf
21/12/2022,14:15,Dusky Whaler,139,M,Alive,ID,Lake Macquarie -Blacksmiths to Frazer Park,Moonee Beach,2022-12-21T14:15:00Z,2022,12,DUS,FALSE,TRUE,FALSE,NSW-SMART-drumline-report-1-July-2022-30-June-2023.pdf
23/01/2023,14:37,Dusky Whaler,128,M,Alive,ID,Lake Macquarie -Blacksmiths to Frazer Park,Moonee Beach,2023-01-23T14:37:00Z,2023,1,DUS,FALSE,TRUE,FALSE,NSW-SMART-drumline-report-1-July-2022-30-June-2023.pdf
3/02/2023,8:37,Dusky Whaler,152,F,Alive,ID,Lake Macquarie -Blacksmiths to Frazer Park,Moonee Beach,2023-02-03T08:37:00Z,2023,2,DUS,FALSE,TRUE,FALSE,NSW-SMART-drumline-report-1-July-2022-30-June-2023.pdf
15/02/2023,15:42,Dusky Whaler,175,M,Alive,ID,Lake Macquarie -Blacksmiths to Frazer Park,Moonee Beach,2023-02-15T15:42:00Z,2023,2,DUS,FALSE,TRUE,FALSE,NSW-SMART-drumline-report-1-July-2022-30-June-2023.pdf
16/02/2023,13:37,Dusky Whaler,138,F,Alive,ID,Lake Macquarie -Blacksmiths to Frazer Park,Moonee Beach,2023-02-16T13:37:00Z,2023,2,DUS,FALSE,TRUE,FALSE,NSW-SMART-drumline-report-1-July-2022-30-June-2023.pdf
18/02/2023,8:36,Dusky Whaler,136,M,Alive,ID,Lake Macquarie -Blacksmiths to Frazer Park,Moonee Beach,2023-02-18T08:36:00Z,2023,2,DUS,FALSE,TRUE,FALSE,NSW-SMART-drumline-report-1-July-2022-30-June-2023.pdf
18/02/2023,12:57,Dusky Whaler,147,F,Alive,ID,Lake Macquarie -Blacksmiths to Frazer Park,Moonee Beach,2023-02-18T12:57:00Z,2023,2,DUS,FALSE,TRUE,FALSE,NSW-SMART-drumline-report-1-July-2022-30-June-2023.pdf
6/03/2023,14:54,Dusky Whaler,135,F,Alive,ID,Lake Macquarie -Blacksmiths to Frazer Park,Moonee Beach,2023-03-06T14:54:00Z,2023,3,DUS,FALSE,TRUE,FALSE,NSW-SMART-drumline-report-1-July-2022-30-June-2023.pdf
16/03/2023,15:06,Dusky Whaler,144,F,Alive,ID,Lake Macquarie -Blacksmiths to Frazer Park,Moonee Beach,2023-03-16T15:06:00Z,2023,3,DUS,FALSE,TRUE,FALSE,NSW-SMART-drumline-report-1-July-2022-30-June-2023.pdf
25/03/2023,11:56,Dusky Whaler,162,F,Alive,ID,Lake Macquarie -Blacksmiths to Frazer Park,Moonee Beach,2023-03-25T11:56:00Z,2023,3,DUS,FALSE,TRUE,FALSE,NSW-SMART-drumline-report-1-July-2022-30-June-2023.pdf
22/05/2023,10:48,Dusky Whaler,123,M,Alive,ID,Lake Macquarie -Blacksmiths to Frazer Park,Moonee Beach,2023-05-22T10:48:00Z,2023,5,DUS,FALSE,TRUE,FALSE,NSW-SMART-drumline-report-1-July-2022-30-June-2023.pdf
24/05/2023,15:01,Bronze Whaler,232,M,Alive,ID,Lake Macquarie -Blacksmiths to Frazer Park,Moonee Beach,2023-05-24T15:01:00Z,2023,5,BRO,FALSE,TRUE,FALSE,NSW-SMART-drumline-report-1-July-2022-30-June-2023.pdf
18/07/2022,10:29,White Shark,194,F,Alive,"ID, A",Lake Macquarie -Blacksmiths to Frazer Park,Middle Camp Beach,2022-07-18T10:29:00Z,2022,7,WHI,TRUE,TRUE,TRUE,NSW-SMART-drumline-report-1-July-2022-30-June-2023.pdf
31/08/2022,10:30,White Shark,165,M,Alive,"ID, A",Lake Macquarie -Blacksmiths to Frazer Park,Middle Camp Beach,2022-08-31T10:30:00Z,2022,8,WHI,TRUE,TRUE,TRUE,NSW-SMART-drumline-report-1-July-2022-30-June-2023.pdf
24/11/2022,16:12,White Shark,179,F,Alive,"ID, A",Lake Macquarie -Blacksmiths to Frazer Park,Middle Camp Beach,2022-11-24T16:12:00Z,2022,11,WHI,TRUE,TRUE,TRUE,NSW-SMART-drumline-report-1-July-2022-30-June-2023.pdf
14/12/2022,10:06,Smooth Hammerhead,173,M,Alive,ID,Lake Macquarie -Blacksmiths to Frazer Park,Middle Camp Beach,2022-12-14T10:06:00Z,2022,12,SMH,FALSE,TRUE,FALSE,NSW-SMART-drumline-report-1-July-2022-30-June-2023.pdf
29/01/2023,8:21,Tiger Shark,149,F,Alive,"ID, A",Lake Macquarie -Blacksmiths to Frazer Park,Middle Camp Beach,2023-01-29T08:21:00Z,2023,1,TIG,TRUE,TRUE,TRUE,NSW-SMART-drumline-report-1-July-2022-30-June-2023.pdf
7/02/2023,14:27,Dusky Whaler,139,M,Alive,ID,Lake Macquarie -Blacksmiths to Frazer Park,Middle Camp Beach,2023-02-07T14:27:00Z,2023,2,DUS,FALSE,TRUE,FALSE,NSW-SMART-drumline-report-1-July-2022-30-June-2023.pdf
16/02/2023,NA,Dusky Whaler,122,F,Alive,ID,Lake Macquarie -Blacksmiths to Frazer Park,Middle Camp Beach,NA,2023,2,DUS,FALSE,TRUE,FALSE,NSW-SMART-drumline-report-1-July-2022-30-June-2023.pdf
25/02/2023,NA,Dusky Whaler,111,M,Alive,ID,Lake Macquarie -Blacksmiths to Frazer Park,Middle Camp Beach,NA,2023,2,DUS,FALSE,TRUE,FALSE,NSW-SMART-drumline-report-1-July-2022-30-June-2023.pdf
15/03/2023,9:30,Dusky Whaler,157,M,Alive,ID,Lake Macquarie -Blacksmiths to Frazer Park,Middle Camp Beach,2023-03-15T09:30:00Z,2023,3,DUS,FALSE,TRUE,FALSE,NSW-SMART-drumline-report-1-July-2022-30-June-2023.pdf
14/05/2023,9:39,Dusky Whaler,129,F,Alive,ID,Lake Macquarie -Blacksmiths to Frazer Park,Middle Camp Beach,2023-05-14T09:39:00Z,2023,5,DUS,FALSE,TRUE,FALSE,NSW-SMART-drumline-report-1-July-2022-30-June-2023.pdf
31/05/2023,13:54,Greynurse Shark,258,F,Alive,ID,Lake Macquarie -Blacksmiths to Frazer Park,Middle Camp Beach,2023-05-31T13:54:00Z,2023,5,GRN,FALSE,TRUE,FALSE,NSW-SMART-drumline-report-1-July-2022-30-June-2023.pdf
17/07/2022,9:47,White Shark,232,F,Alive,"ID, A",Lake Macquarie -Blacksmiths to Frazer Park,Caves Beach,2022-07-17T09:47:00Z,2022,7,WHI,TRUE,TRUE,TRUE,NSW-SMART-drumline-report-1-July-2022-30-June-2023.pdf
17/07/2022,13:27,Bronze Whaler,298,F,Alive,ID,Lake Macquarie -Blacksmiths to Frazer Park,Caves Beach,2022-07-17T13:27:00Z,2022,7,BRO,FALSE,TRUE,FALSE,NSW-SMART-drumline-report-1-July-2022-30-June-2023.pdf
18/07/2022,14:14,Dusky Whaler,133,M,Alive,ID,Lake Macquarie -Blacksmiths to Frazer Park,Caves Beach,2022-07-18T14:14:00Z,2022,7,DUS,FALSE,TRUE,FALSE,NSW-SMART-drumline-report-1-July-2022-30-June-2023.pdf
25/07/2022,14:19,Bronze Whaler,241,M,Alive,ID,Lake Macquarie -Blacksmiths to Frazer Park,Caves Beach,2022-07-25T14:19:00Z,2022,7,BRO,FALSE,TRUE,FALSE,NSW-SMART-drumline-report-1-July-2022-30-June-2023.pdf
27/07/2022,9:42,Bronze Whaler,250,NA,Alive,NA,Lake Macquarie -Blacksmiths to Frazer Park,Caves Beach,2022-07-27T09:42:00Z,2022,7,BRO,FALSE,FALSE,FALSE,NSW-SMART-drumline-report-1-July-2022-30-June-2023.pdf
30/07/2022,9:35,Bronze Whaler,278,F,Alive,ID,Lake Macquarie -Blacksmiths to Frazer Park,Caves Beach,2022-07-30T09:35:00Z,2022,7,BRO,FALSE,TRUE,FALSE,NSW-SMART-drumline-report-1-July-2022-30-June-2023.pdf
10/08/2022,10:18,Dusky Whaler,277,F,Alive,ID,Lake Macquarie -Blacksmiths to Frazer Park,Caves Beach,2022-08-10T10:18:00Z,2022,8,DUS,FALSE,TRUE,FALSE,NSW-SMART-drumline-report-1-July-2022-30-June-2023.pdf
13/08/2022,9:02,Dusky Whaler,136,M,Alive,ID,Lake Macquarie -Blacksmiths to Frazer Park,Caves Beach,2022-08-13T09:02:00Z,2022,8,DUS,FALSE,TRUE,FALSE,NSW-SMART-drumline-report-1-July-2022-30-June-2023.pdf
25/08/2022,11:17,White Shark,185,M,Alive,"ID, A",Lake Macquarie -Blacksmiths to Frazer Park,Caves Beach,2022-08-25T11:17:00Z,2022,8,WHI,TRUE,TRUE,TRUE,NSW-SMART-drumline-report-1-July-2022-30-June-2023.pdf
12/09/2022,12:17,Black Ray,210,NA,Alive,ID,Lake Macquarie -Blacksmiths to Frazer Park,Caves Beach,2022-09-12T12:17:00Z,2022,9,BLR,FALSE,TRUE,FALSE,NSW-SMART-drumline-report-1-July-2022-30-June-2023.pdf
13/09/2022,8:39,Dusky Whaler,100,NA,Alive,NA,Lake Macquarie -Blacksmiths to Frazer Park,Caves Beach,2022-09-13T08:39:00Z,2022,9,DUS,FALSE,FALSE,FALSE,NSW-SMART-drumline-report-1-July-2022-30-June-2023.pdf
20/10/2022,7:32,Dusky Whaler,162,F,Alive,ID,Lake Macquarie -Blacksmiths to Frazer Park,Caves Beach,2022-10-20T07:32:00Z,2022,10,DUS,FALSE,TRUE,FALSE,NSW-SMART-drumline-report-1-July-2022-30-June-2023.pdf
2/11/2022,NA,Dusky Whaler,117,F,Dead,ID,Lake Macquarie -Blacksmiths to Frazer Park,Caves Beach,NA,2022,11,DUS,FALSE,TRUE,FALSE,NSW-SMART-drumline-report-1-July-2022-30-June-2023.pdf
20/11/2022,10:18,Tiger Shark,300,NA,Alive,NA,Lake Macquarie -Blacksmiths to Frazer Park,Caves Beach,2022-11-20T10:18:00Z,2022,11,TIG,TRUE,FALSE,FALSE,NSW-SMART-drumline-report-1-July-2022-30-June-2023.pdf
24/11/2022,NA,Dusky Whaler,102,M,Dead,ID,Lake Macquarie -Blacksmiths to Frazer Park,Caves Beach,NA,2022,11,DUS,FALSE,TRUE,FALSE,NSW-SMART-drumline-report-1-July-2022-30-June-2023.pdf
10/12/2022,8:27,Dusky Whaler,109,M,Alive,ID,Lake Macquarie -Blacksmiths to Frazer Park,Caves Beach,2022-12-10T08:27:00Z,2022,12,DUS,FALSE,TRUE,FALSE,NSW-SMART-drumline-report-1-July-2022-30-June-2023.pdf
27/12/2022,NA,Dusky Whaler,105,M,Alive,ID,Lake Macquarie -Blacksmiths to Frazer Park,Caves Beach,NA,2022,12,DUS,FALSE,TRUE,FALSE,NSW-SMART-drumline-report-1-July-2022-30-June-2023.pdf
18/01/2023,NA,Dusky Whaler,102,M,Alive,ID,Lake Macquarie -Blacksmiths to Frazer Park,Caves Beach,NA,2023,1,DUS,FALSE,TRUE,FALSE,NSW-SMART-drumline-report-1-July-2022-30-June-2023.pdf
25/01/2023,NA,Dusky Whaler,113,M,Dead,ID,Lake Macquarie -Blacksmiths to Frazer Park,Caves Beach,NA,2023,1,DUS,FALSE,TRUE,FALSE,NSW-SMART-drumline-report-1-July-2022-30-June-2023.pdf
28/01/2023,NA,Dusky Whaler,113,F,Dead,ID,Lake Macquarie -Blacksmiths to Frazer Park,Caves Beach,NA,2023,1,DUS,FALSE,TRUE,FALSE,NSW-SMART-drumline-report-1-July-2022-30-June-2023.pdf
29/01/2023,7:09,Dusky Whaler,150,F,Alive,ID,Lake Macquarie -Blacksmiths to Frazer Park,Caves Beach,2023-01-29T07:09:00Z,2023,1,DUS,FALSE,TRUE,FALSE,NSW-SMART-drumline-report-1-July-2022-30-June-2023.pdf
30/01/2023,10:30,Dusky Whaler,99,M,Alive,ID,Lake Macquarie -Blacksmiths to Frazer Park,Caves Beach,2023-01-30T10:30:00Z,2023,1,DUS,FALSE,TRUE,FALSE,NSW-SMART-drumline-report-1-July-2022-30-June-2023.pdf
5/02/2023,NA,Dusky Whaler,106,F,Dead,ID,Lake Macquarie -Blacksmiths to Frazer Park,Caves Beach,NA,2023,2,DUS,FALSE,TRUE,FALSE,NSW-SMART-drumline-report-1-July-2022-30-June-2023.pdf
6/02/2023,12:38,Dusky Whaler,148,F,Alive,ID,Lake Macquarie -Blacksmiths to Frazer Park,Caves Beach,2023-02-06T12:38:00Z,2023,2,DUS,FALSE,TRUE,FALSE,NSW-SMART-drumline-report-1-July-2022-30-June-2023.pdf
9/02/2023,NA,Dusky Whaler,112,F,Alive,ID,Lake Macquarie -Blacksmiths to Frazer Park,Caves Beach,NA,2023,2,DUS,FALSE,TRUE,FALSE,NSW-SMART-drumline-report-1-July-2022-30-June-2023.pdf
10/02/2023,14:06,Dusky Whaler,135,M,Alive,ID,Lake Macquarie -Blacksmiths to Frazer Park,Caves Beach,2023-02-10T14:06:00Z,2023,2,DUS,FALSE,TRUE,FALSE,NSW-SMART-drumline-report-1-July-2022-30-June-2023.pdf
15/02/2023,8:09,Dusky Whaler,140,M,Alive,ID,Lake Macquarie -Blacksmiths to Frazer Park,Caves Beach,2023-02-15T08:09:00Z,2023,2,DUS,FALSE,TRUE,FALSE,NSW-SMART-drumline-report-1-July-2022-30-June-2023.pdf
15/02/2023,12:18,Dusky Whaler,114,F,Alive,ID,Lake Macquarie -Blacksmiths to Frazer Park,Caves Beach,2023-02-15T12:18:00Z,2023,2,DUS,FALSE,TRUE,FALSE,NSW-SMART-drumline-report-1-July-2022-30-June-2023.pdf
27/02/2023,NA,Dusky Whaler,109,F,Alive,ID,Lake Macquarie -Blacksmiths to Frazer Park,Caves Beach,NA,2023,2,DUS,FALSE,TRUE,FALSE,NSW-SMART-drumline-report-1-July-2022-30-June-2023.pdf
3/03/2023,NA,Dusky Whaler,123,M,Alive,ID,Lake Macquarie -Blacksmiths to Frazer Park,Caves Beach,NA,2023,3,DUS,FALSE,TRUE,FALSE,NSW-SMART-drumline-report-1-July-2022-30-June-2023.pdf
8/03/2023,15:12,Dusky Whaler,144,M,Alive,ID,Lake Macquarie -Blacksmiths to Frazer Park,Caves Beach,2023-03-08T15:12:00Z,2023,3,DUS,FALSE,TRUE,FALSE,NSW-SMART-drumline-report-1-July-2022-30-June-2023.pdf
18/03/2023,NA,Dusky Whaler,119,M,Alive,ID,Lake Macquarie -Blacksmiths to Frazer Park,Caves Beach,NA,2023,3,DUS,FALSE,TRUE,FALSE,NSW-SMART-drumline-report-1-July-2022-30-June-2023.pdf
22/03/2023,12:03,Dusky Whaler,131,M,Alive,ID,Lake Macquarie -Blacksmiths to Frazer Park,Caves Beach,2023-03-22T12:03:00Z,2023,3,DUS,FALSE,TRUE,FALSE,NSW-SMART-drumline-report-1-July-2022-30-June-2023.pdf
30/03/2023,NA,Dusky Whaler,118,M,Dead,ID,Lake Macquarie -Blacksmiths to Frazer Park,Caves Beach,NA,2023,3,DUS,FALSE,TRUE,FALSE,NSW-SMART-drumline-report-1-July-2022-30-June-2023.pdf
31/03/2023,NA,Dusky Whaler,133,M,Alive,ID,Lake Macquarie -Blacksmiths to Frazer Park,Caves Beach,NA,2023,3,DUS,FALSE,TRUE,FALSE,NSW-SMART-drumline-report-1-July-2022-30-June-2023.pdf
23/04/2023,NA,Dusky Whaler,114,M,Alive,ID,Lake Macquarie -Blacksmiths to Frazer Park,Caves Beach,NA,2023,4,DUS,FALSE,TRUE,FALSE,NSW-SMART-drumline-report-1-July-2022-30-June-2023.pdf
27/04/2023,11:33,Dusky Whaler,117,F,Alive,ID,Lake Macquarie -Blacksmiths to Frazer Park,Caves Beach,2023-04-27T11:33:00Z,2023,4,DUS,FALSE,TRUE,FALSE,NSW-SMART-drumline-report-1-July-2022-30-June-2023.pdf
27/04/2023,NA,Dusky Whaler,113,M,Alive,ID,Lake Macquarie -Blacksmiths to Frazer Park,Caves Beach,NA,2023,4,DUS,FALSE,TRUE,FALSE,NSW-SMART-drumline-report-1-July-2022-30-June-2023.pdf
6/05/2023,NA,Dusky Whaler,111,M,Dead,ID,Lake Macquarie -Blacksmiths to Frazer Park,Caves Beach,NA,2023,5,DUS,FALSE,TRUE,FALSE,NSW-SMART-drumline-report-1-July-2022-30-June-2023.pdf
12/05/2023,NA,Dusky Whaler,107,M,Alive,ID,Lake Macquarie -Blacksmiths to Frazer Park,Caves Beach,NA,2023,5,DUS,FALSE,TRUE,FALSE,NSW-SMART-drumline-report-1-July-2022-30-June-2023.pdf
12/05/2023,NA,Dusky Whaler,108,M,Alive,ID,Lake Macquarie -Blacksmiths to Frazer Park,Caves Beach,NA,2023,5,DUS,FALSE,TRUE,FALSE,NSW-SMART-drumline-report-1-July-2022-30-June-2023.pdf
19/05/2023,12:07,Dusky Whaler,111,F,Alive,ID,Lake Macquarie -Blacksmiths to Frazer Park,Caves Beach,2023-05-19T12:07:00Z,2023,5,DUS,FALSE,TRUE,FALSE,NSW-SMART-drumline-report-1-July-2022-30-June-2023.pdf
27/05/2023,14:18,White Shark,197,F,Alive,"ID, A",Lake Macquarie -Blacksmiths to Frazer Park,Caves Beach,2023-05-27T14:18:00Z,2023,5,WHI,TRUE,TRUE,TRUE,NSW-SMART-drumline-report-1-July-2022-30-June-2023.pdf
12/06/2023,12:51,Dusky Whaler,113,M,Alive,ID,Lake Macquarie -Blacksmiths to Frazer Park,Caves Beach,2023-06-12T12:51:00Z,2023,6,DUS,FALSE,TRUE,FALSE,NSW-SMART-drumline-report-1-July-2022-30-June-2023.pdf
18/07/2022,7:52,White Shark,252,F,Alive,"ID,A",Lake Macquarie -Blacksmiths to Frazer Park,Hams Beach,2022-07-18T07:52:00Z,2022,7,WHI,TRUE,TRUE,TRUE,NSW-SMART-drumline-report-1-July-2022-30-June-2023.pdf
30/07/2022,13:54,Bronze Whaler,200,NA,Alive,ID,Lake Macquarie -Blacksmiths to Frazer Park,Hams Beach,2022-07-30T13:54:00Z,2022,7,BRO,FALSE,TRUE,FALSE,NSW-SMART-drumline-report-1-July-2022-30-June-2023.pdf
25/08/2022,12:40,White Shark,203,M,Alive,"ID, A",Lake Macquarie -Blacksmiths to Frazer Park,Hams Beach,2022-08-25T12:40:00Z,2022,8,WHI,TRUE,TRUE,TRUE,NSW-SMART-drumline-report-1-July-2022-30-June-2023.pdf
31/08/2022,11:18,White Shark,202,F,Alive,"ID, A",Lake Macquarie -Blacksmiths to Frazer Park,Hams Beach,2022-08-31T11:18:00Z,2022,8,WHI,TRUE,TRUE,TRUE,NSW-SMART-drumline-report-1-July-2022-30-June-2023.pdf
7/09/2022,8:23,Bronze Whaler,254,F,Alive,ID,Lake Macquarie -Blacksmiths to Frazer Park,Hams Beach,2022-09-07T08:23:00Z,2022,9,BRO,FALSE,TRUE,FALSE,NSW-SMART-drumline-report-1-July-2022-30-June-2023.pdf
10/09/2022,7:28,White Shark,192,M,Alive,"ID, A",Lake Macquarie -Blacksmiths to Frazer Park,Hams Beach,2022-09-10T07:28:00Z,2022,9,WHI,TRUE,TRUE,TRUE,NSW-SMART-drumline-report-1-July-2022-30-June-2023.pdf
24/11/2022,16:22,Dusky Whaler,141,M,Alive,ID,Lake Macquarie -Blacksmiths to Frazer Park,Hams Beach,2022-11-24T16:22:00Z,2022,11,DUS,FALSE,TRUE,FALSE,NSW-SMART-drumline-report-1-July-2022-30-June-2023.pdf
30/11/2022,8:51,Dusky Whaler,129,M,Alive,ID,Lake Macquarie -Blacksmiths to Frazer Park,Hams Beach,2022-11-30T08:51:00Z,2022,11,DUS,FALSE,TRUE,FALSE,NSW-SMART-drumline-report-1-July-2022-30-June-2023.pdf
27/12/2022,7:14,Dusky Whaler,129,M,Alive,ID,Lake Macquarie -Blacksmiths to Frazer Park,Hams Beach,2022-12-27T07:14:00Z,2022,12,DUS,FALSE,TRUE,FALSE,NSW-SMART-drumline-report-1-July-2022-30-June-2023.pdf
1/01/2023,11:28,Dusky Whaler,123,F,Alive,ID,Lake Macquarie -Blacksmiths to Frazer Park,Hams Beach,2023-01-01T11:28:00Z,2023,1,DUS,FALSE,TRUE,FALSE,NSW-SMART-drumline-report-1-July-2022-30-June-2023.pdf
16/02/2023,NA,Dusky Whaler,99,M,Alive,ID,Lake Macquarie -Blacksmiths to Frazer Park,Hams Beach,NA,2023,2,DUS,FALSE,TRUE,FALSE,NSW-SMART-drumline-report-1-July-2022-30-June-2023.pdf
26/03/2023,7:16,Dusky Whaler,131,F,Alive,ID,Lake Macquarie -Blacksmiths to Frazer Park,Hams Beach,2023-03-26T07:16:00Z,2023,3,DUS,FALSE,TRUE,FALSE,NSW-SMART-drumline-report-1-July-2022-30-June-2023.pdf
9/04/2023,10:09,Dusky Whaler,100,NA,Alive,ID,Lake Macquarie -Blacksmiths to Frazer Park,Hams Beach,2023-04-09T10:09:00Z,2023,4,DUS,FALSE,TRUE,FALSE,NSW-SMART-drumline-report-1-July-2022-30-June-2023.pdf
12/07/2022,10:36,White Shark,333,F,Alive,"ID, A",Lake Macquarie -Blacksmiths to Frazer Park,Blacksmiths Beach,2022-07-12T10:36:00Z,2022,7,WHI,TRUE,TRUE,TRUE,NSW-SMART-drumline-report-1-July-2022-30-June-2023.pdf
17/07/2022,9:06,White Shark,281,F,Alive,"ID, A",Lake Macquarie -Blacksmiths to Frazer Park,Blacksmiths Beach,2022-07-17T09:06:00Z,2022,7,WHI,TRUE,TRUE,TRUE,NSW-SMART-drumline-report-1-July-2022-30-June-2023.pdf
24/07/2022,11:33,White Shark,199,F,Alive,"ID, A",Lake Macquarie -Blacksmiths to Frazer Park,Blacksmiths Beach,2022-07-24T11:33:00Z,2022,7,WHI,TRUE,TRUE,TRUE,NSW-SMART-drumline-report-1-July-2022-30-June-2023.pdf
25/07/2022,14:45,White Shark,173,M,Alive,"ID, A",Lake Macquarie -Blacksmiths to Frazer Park,Blacksmiths Beach,2022-07-25T14:45:00Z,2022,7,WHI,TRUE,TRUE,TRUE,NSW-SMART-drumline-report-1-July-2022-30-June-2023.pdf
12/08/2022,8:34,White Shark,203,M,Alive,"ID, A",Lake Macquarie -Blacksmiths to Frazer Park,Blacksmiths Beach,2022-08-12T08:34:00Z,2022,8,WHI,TRUE,TRUE,TRUE,NSW-SMART-drumline-report-1-July-2022-30-June-2023.pdf
14/08/2022,9:30,White Shark,220,M,Alive,"ID, A",Lake Macquarie -Blacksmiths to Frazer Park,Blacksmiths Beach,2022-08-14T09:30:00Z,2022,8,WHI,TRUE,TRUE,TRUE,NSW-SMART-drumline-report-1-July-2022-30-June-2023.pdf
30/08/2022,12:46,White Shark,247,M,Alive,"ID, A",Lake Macquarie -Blacksmiths to Frazer Park,Blacksmiths Beach,2022-08-30T12:46:00Z,2022,8,WHI,TRUE,TRUE,TRUE,NSW-SMART-drumline-report-1-July-2022-30-June-2023.pdf
2/09/2022,11:53,White Shark,179,M,Alive,"ID, A",Lake Macquarie -Blacksmiths to Frazer Park,Blacksmiths Beach,2022-09-02T11:53:00Z,2022,9,WHI,TRUE,TRUE,TRUE,NSW-SMART-drumline-report-1-July-2022-30-June-2023.pdf
10/09/2022,9:09,White Shark,171,M,Alive,"ID, A",Lake Macquarie -Blacksmiths to Frazer Park,Blacksmiths Beach,2022-09-10T09:09:00Z,2022,9,WHI,TRUE,TRUE,TRUE,NSW-SMART-drumline-report-1-July-2022-30-June-2023.pdf
10/09/2022,10:40,White Shark,203,F,Alive,"ID, A",Lake Macquarie -Blacksmiths to Frazer Park,Blacksmiths Beach,2022-09-10T10:40:00Z,2022,9,WHI,TRUE,TRUE,TRUE,NSW-SMART-drumline-report-1-July-2022-30-June-2023.pdf
10/10/2022,10:39,Bronze Whaler,250,NA,Alive,NA,Lake Macquarie -Blacksmiths to Frazer Park,Blacksmiths Beach,2022-10-10T10:39:00Z,2022,10,BRO,FALSE,FALSE,FALSE,NSW-SMART-drumline-report-1-July-2022-30-June-2023.pdf
2/11/2022,16:21,White Shark,175,F,Alive,"ID, A",Lake Macquarie -Blacksmiths to Frazer Park,Blacksmiths Beach,2022-11-02T16:21:00Z,2022,11,WHI,TRUE,TRUE,TRUE,NSW-SMART-drumline-report-1-July-2022-30-June-2023.pdf
16/11/2022,8:15,White Shark,174,M,Alive,"ID, A",Lake Macquarie -Blacksmiths to Frazer Park,Blacksmiths Beach,2022-11-16T08:15:00Z,2022,11,WHI,TRUE,TRUE,TRUE,NSW-SMART-drumline-report-1-July-2022-30-June-2023.pdf
23/11/2022,10:21,Dusky Whaler,268,F,Alive,ID,Lake Macquarie -Blacksmiths to Frazer Park,Blacksmiths Beach,2022-11-23T10:21:00Z,2022,11,DUS,FALSE,TRUE,FALSE,NSW-SMART-drumline-report-1-July-2022-30-June-2023.pdf
11/01/2023,15:02,White Shark,256,F,Alive,"ID, A",Lake Macquarie -Blacksmiths to Frazer Park,Blacksmiths Beach,2023-01-11T15:02:00Z,2023,1,WHI,TRUE,TRUE,TRUE,NSW-SMART-drumline-report-1-July-2022-30-June-2023.pdf
15/01/2023,10:36,Tiger Shark,183,F,Alive,"ID, A",Lake Macquarie -Blacksmiths to Frazer Park,Blacksmiths Beach,2023-01-15T10:36:00Z,2023,1,TIG,TRUE,TRUE,TRUE,NSW-SMART-drumline-report-1-July-2022-30-June-2023.pdf
18/01/2023,13:31,Tiger Shark,170,M,Alive,"ID, A",Lake Macquarie -Blacksmiths to Frazer Park,Blacksmiths Beach,2023-01-18T13:31:00Z,2023,1,TIG,TRUE,TRUE,TRUE,NSW-SMART-drumline-report-1-July-2022-30-June-2023.pdf
7/02/2023,NA,Dusky Whaler,94,F,Alive,ID,Lake Macquarie -Blacksmiths to Frazer Park,Blacksmiths Beach,NA,2023,2,DUS,FALSE,TRUE,FALSE,NSW-SMART-drumline-report-1-July-2022-30-June-2023.pdf
9/04/2023,NA,Dusky Whaler,123,M,Alive,ID,Lake Macquarie -Blacksmiths to Frazer Park,Blacksmiths Beach,NA,2023,4,DUS,FALSE,TRUE,FALSE,NSW-SMART-drumline-report-1-July-2022-30-June-2023.pdf
26/04/2023,NA,Unidentified whaler,90,NA,Alive,NA,Lake Macquarie -Blacksmiths to Frazer Park,Blacksmiths Beach,NA,2023,4,WHL,FALSE,FALSE,FALSE,NSW-SMART-drumline-report-1-July-2022-30-June-2023.pdf
27/05/2023,10:01,Greynurse Shark,242,M,Alive,ID,Lake Macquarie -Blacksmiths to Frazer Park,Blacksmiths Beach,2023-05-27T10:01:00Z,2023,5,GRN,FALSE,TRUE,FALSE,NSW-SMART-drumline-report-1-July-2022-30-June-2023.pdf
12/07/2022,NA,Bronze Whaler,209,F,Alive,ID,Central Coast North,Crackneck Point,NA,2022,7,BRO,FALSE,TRUE,FALSE,NSW-SMART-drumline-report-1-July-2022-30-June-2023.pdf
18/07/2022,13:48,Bronze Whaler,220,F,Alive,ID,Central Coast North,Crackneck Point,2022-07-18T13:48:00Z,2022,7,BRO,FALSE,TRUE,FALSE,NSW-SMART-drumline-report-1-July-2022-30-June-2023.pdf
26/08/2022,9:02,Bronze Whaler,250,F,Alive,ID,Central Coast North,Crackneck Point,2022-08-26T09:02:00Z,2022,8,BRO,FALSE,TRUE,FALSE,NSW-SMART-drumline-report-1-July-2022-30-June-2023.pdf
8/10/2022,8:18,Bronze Whaler,222,M,Alive,ID,Central Coast North,Crackneck Point,2022-10-08T08:18:00Z,2022,10,BRO,FALSE,TRUE,FALSE,NSW-SMART-drumline-report-1-July-2022-30-June-2023.pdf
14/12/2022,8:19,Mako,152,M,Alive,ID,Central Coast North,Crackneck Point,2022-12-14T08:19:00Z,2022,12,SMA,FALSE,TRUE,FALSE,NSW-SMART-drumline-report-1-July-2022-30-June-2023.pdf
23/12/2022,16:25,Mako,145,M,Alive,ID,Central Coast North,Crackneck Point,2022-12-23T16:25:00Z,2022,12,SMA,FALSE,TRUE,FALSE,NSW-SMART-drumline-report-1-July-2022-30-June-2023.pdf
25/12/2022,10:40,Dusky Whaler,204,M,Alive,ID,Central Coast North,Crackneck Point,2022-12-25T10:40:00Z,2022,12,DUS,FALSE,TRUE,FALSE,NSW-SMART-drumline-report-1-July-2022-30-June-2023.pdf
13/01/2023,9:36,Smooth Hammerhead,176,M,Alive,ID,Central Coast North,Crackneck Point,2023-01-13T09:36:00Z,2023,1,SMH,FALSE,TRUE,FALSE,NSW-SMART-drumline-report-1-July-2022-30-June-2023.pdf
24/01/2023,10:28,Dusky Whaler,165,M,Alive,ID,Central Coast North,Crackneck Point,2023-01-24T10:28:00Z,2023,1,DUS,FALSE,TRUE,FALSE,NSW-SMART-drumline-report-1-July-2022-30-June-2023.pdf
26/01/2023,16:08,Dusky Whaler,190,F,Alive,ID,Central Coast North,Crackneck Point,2023-01-26T16:08:00Z,2023,1,DUS,FALSE,TRUE,FALSE,NSW-SMART-drumline-report-1-July-2022-30-June-2023.pdf
30/01/2023,10:27,Dusky Whaler,158,M,Alive,ID,Central Coast North,Crackneck Point,2023-01-30T10:27:00Z,2023,1,DUS,FALSE,TRUE,FALSE,NSW-SMART-drumline-report-1-July-2022-30-June-2023.pdf
2/02/2023,12:48,Dusky Whaler,157,F,Alive,ID,Central Coast North,Crackneck Point,2023-02-02T12:48:00Z,2023,2,DUS,FALSE,TRUE,FALSE,NSW-SMART-drumline-report-1-July-2022-30-June-2023.pdf
15/02/2023,9:36,Dusky Whaler,193,F,Alive,ID,Central Coast North,Crackneck Point,2023-02-15T09:36:00Z,2023,2,DUS,FALSE,TRUE,FALSE,NSW-SMART-drumline-report-1-July-2022-30-June-2023.pdf
17/02/2023,11:37,Dusky Whaler,165,M,Alive,ID,Central Coast North,Crackneck Point,2023-02-17T11:37:00Z,2023,2,DUS,FALSE,TRUE,FALSE,NSW-SMART-drumline-report-1-July-2022-30-June-2023.pdf
20/02/2023,8:23,Scalloped Hammerhead,277,F,Alive,ID,Central Coast North,Crackneck Point,2023-02-20T08:23:00Z,2023,2,SCH,FALSE,TRUE,FALSE,NSW-SMART-drumline-report-1-July-2022-30-June-2023.pdf
27/03/2023,14:58,Dusky Whaler,184,F,Alive,ID,Central Coast North,Crackneck Point,2023-03-27T14:58:00Z,2023,3,DUS,FALSE,TRUE,FALSE,NSW-SMART-drumline-report-1-July-2022-30-June-2023.pdf
1/04/2023,9:16,Dusky Whaler,182,M,Alive,ID,Central Coast North,Crackneck Point,2023-04-01T09:16:00Z,2023,4,DUS,FALSE,TRUE,FALSE,NSW-SMART-drumline-report-1-July-2022-30-June-2023.pdf
8/04/2023,8:34,Dusky Whaler,203,F,Alive,ID,Central Coast North,Crackneck Point,2023-04-08T08:34:00Z,2023,4,DUS,FALSE,TRUE,FALSE,NSW-SMART-drumline-report-1-July-2022-30-June-2023.pdf
18/04/2023,8:20,Unidentified whaler,160,NA,Alive,NA,Central Coast North,Crackneck Point,2023-04-18T08:20:00Z,2023,4,WHL,FALSE,FALSE,FALSE,NSW-SMART-drumline-report-1-July-2022-30-June-2023.pdf
30/04/2023,10:06,Mako,129,F,Alive,ID,Central Coast North,Crackneck Point,2023-04-30T10:06:00Z,2023,4,SMA,FALSE,TRUE,FALSE,NSW-SMART-drumline-report-1-July-2022-30-June-2023.pdf
1/07/2022,10:42,Dusky Whaler,152,F,Alive,ID,Central Coast North,Shelly Beach,2022-07-01T10:42:00Z,2022,7,DUS,FALSE,TRUE,FALSE,NSW-SMART-drumline-report-1-July-2022-30-June-2023.pdf
15/08/2022,7:11,Bronze Whaler,218,F,Alive,ID,Central Coast North,Shelly Beach,2022-08-15T07:11:00Z,2022,8,BRO,FALSE,TRUE,FALSE,NSW-SMART-drumline-report-1-July-2022-30-June-2023.pdf
18/08/2022,9:01,Bronze Whaler,254,F,Alive,ID,Central Coast North,Shelly Beach,2022-08-18T09:01:00Z,2022,8,BRO,FALSE,TRUE,FALSE,NSW-SMART-drumline-report-1-July-2022-30-June-2023.pdf
2/09/2022,8:44,White Shark,274,M,Alive,ID,Central Coast North,Shelly Beach,2022-09-02T08:44:00Z,2022,9,WHI,TRUE,TRUE,FALSE,NSW-SMART-drumline-report-1-July-2022-30-June-2023.pdf
7/09/2022,9:24,Bronze Whaler,250,F,Alive,ID,Central Coast North,Shelly Beach,2022-09-07T09:24:00Z,2022,9,BRO,FALSE,TRUE,FALSE,NSW-SMART-drumline-report-1-July-2022-30-June-2023.pdf
24/09/2022,9:37,Thresher Shark,333,F,Alive,ID,Central Coast North,Shelly Beach,2022-09-24T09:37:00Z,2022,9,THR,FALSE,TRUE,FALSE,NSW-SMART-drumline-report-1-July-2022-30-June-2023.pdf
25/09/2022,8:25,Bronze Whaler,262,F,Alive,ID,Central Coast North,Shelly Beach,2022-09-25T08:25:00Z,2022,9,BRO,FALSE,TRUE,FALSE,NSW-SMART-drumline-report-1-July-2022-30-June-2023.pdf
9/11/2022,17:03,Mako,157,M,Alive,ID,Central Coast North,Shelly Beach,2022-11-09T17:03:00Z,2022,11,SMA,FALSE,TRUE,FALSE,NSW-SMART-drumline-report-1-July-2022-30-June-2023.pdf
19/11/2022,10:09,Bronze Whaler,277,F,Alive,ID,Central Coast North,Shelly Beach,2022-11-19T10:09:00Z,2022,11,BRO,FALSE,TRUE,FALSE,NSW-SMART-drumline-report-1-July-2022-30-June-2023.pdf
30/12/2022,9:42,Dusky Whaler,174,F,Alive,ID,Central Coast North,Shelly Beach,2022-12-30T09:42:00Z,2022,12,DUS,FALSE,TRUE,FALSE,NSW-SMART-drumline-report-1-July-2022-30-June-2023.pdf
7/02/2023,15:05,Dusky Whaler,166,F,Alive,ID,Central Coast North,Shelly Beach,2023-02-07T15:05:00Z,2023,2,DUS,FALSE,TRUE,FALSE,NSW-SMART-drumline-report-1-July-2022-30-June-2023.pdf
11/02/2023,14:35,Dusky Whaler,183,M,Alive,ID,Central Coast North,Shelly Beach,2023-02-11T14:35:00Z,2023,2,DUS,FALSE,TRUE,FALSE,NSW-SMART-drumline-report-1-July-2022-30-June-2023.pdf
16/02/2023,9:56,Dusky Whaler,136,M,Alive,ID,Central Coast North,Shelly Beach,2023-02-16T09:56:00Z,2023,2,DUS,FALSE,TRUE,FALSE,NSW-SMART-drumline-report-1-July-2022-30-June-2023.pdf
9/03/2023,12:57,Dusky Whaler,179,M,Alive,ID,Central Coast North,Shelly Beach,2023-03-09T12:57:00Z,2023,3,DUS,FALSE,TRUE,FALSE,NSW-SMART-drumline-report-1-July-2022-30-June-2023.pdf
30/03/2023,13:34,Dusky Whaler,149,F,Alive,ID,Central Coast North,Shelly Beach,2023-03-30T13:34:00Z,2023,3,DUS,FALSE,TRUE,FALSE,NSW-SMART-drumline-report-1-July-2022-30-June-2023.pdf
15/04/2023,NA,Dusky Whaler,193,F,Dead,ID,Central Coast North,Shelly Beach,NA,2023,4,DUS,FALSE,TRUE,FALSE,NSW-SMART-drumline-report-1-July-2022-30-June-2023.pdf
13/05/2023,8:41,Dusky Whaler,134,F,Alive,ID,Central Coast North,Shelly Beach,2023-05-13T08:41:00Z,2023,5,DUS,FALSE,TRUE,FALSE,NSW-SMART-drumline-report-1-July-2022-30-June-2023.pdf
15/05/2023,NA,Dusky Whaler,99,M,Dead,ID,Central Coast North,Shelly Beach,NA,2023,5,DUS,FALSE,TRUE,FALSE,NSW-SMART-drumline-report-1-July-2022-30-June-2023.pdf
11/06/2023,13:44,Unidentified Whaler,100,NA,Alive,ID,Central Coast North,Shelly Beach,2023-06-11T13:44:00Z,2023,6,WHL,FALSE,TRUE,FALSE,NSW-SMART-drumline-report-1-July-2022-30-June-2023.pdf
13/06/2023,8:19,Bronze Whaler,269,F,Alive,ID,Central Coast North,Shelly Beach,2023-06-13T08:19:00Z,2023,6,BRO,FALSE,TRUE,FALSE,NSW-SMART-drumline-report-1-July-2022-30-June-2023.pdf
18/06/2023,11:48,Bronze Whaler,230,NA,Alive,ID,Central Coast North,Shelly Beach,2023-06-18T11:48:00Z,2023,6,BRO,FALSE,TRUE,FALSE,NSW-SMART-drumline-report-1-July-2022-30-June-2023.pdf
12/07/2022,7:46,Bronze Whaler,271,F,Alive,ID,Central Coast North,Toowoon Bay,2022-07-12T07:46:00Z,2022,7,BRO,FALSE,TRUE,FALSE,NSW-SMART-drumline-report-1-July-2022-30-June-2023.pdf
2/08/2022,11:43,Bronze Whaler,243,F,Alive,ID,Central Coast North,Toowoon Bay,2022-08-02T11:43:00Z,2022,8,BRO,FALSE,TRUE,FALSE,NSW-SMART-drumline-report-1-July-2022-30-June-2023.pdf
16/08/2022,9:54,Bronze Whaler,246,M,Alive,ID,Central Coast North,Toowoon Bay,2022-08-16T09:54:00Z,2022,8,BRO,FALSE,TRUE,FALSE,NSW-SMART-drumline-report-1-July-2022-30-June-2023.pdf
25/08/2022,8:00,Bronze Whaler,266,F,Alive,ID,Central Coast North,Toowoon Bay,2022-08-25T08:00:00Z,2022,8,BRO,FALSE,TRUE,FALSE,NSW-SMART-drumline-report-1-July-2022-30-June-2023.pdf
7/09/2022,8:51,Bronze Whaler,242,F,Alive,ID,Central Coast North,Toowoon Bay,2022-09-07T08:51:00Z,2022,9,BRO,FALSE,TRUE,FALSE,NSW-SMART-drumline-report-1-July-2022-30-June-2023.pdf
10/09/2022,12:45,Bronze Whaler,249,F,Alive,ID,Central Coast North,Toowoon Bay,2022-09-10T12:45:00Z,2022,9,BRO,FALSE,TRUE,FALSE,NSW-SMART-drumline-report-1-July-2022-30-June-2023.pdf
18/09/2022,13:58,Dusky Whaler,174,M,Alive,ID,Central Coast North,Toowoon Bay,2022-09-18T13:58:00Z,2022,9,DUS,FALSE,TRUE,FALSE,NSW-SMART-drumline-report-1-July-2022-30-June-2023.pdf
30/12/2022,11:56,Dusky Whaler,169,M,Alive,ID,Central Coast North,Toowoon Bay,2022-12-30T11:56:00Z,2022,12,DUS,FALSE,TRUE,FALSE,NSW-SMART-drumline-report-1-July-2022-30-June-2023.pdf
7/02/2023,8:06,Dusky Whaler,135,F,Alive,ID,Central Coast North,Toowoon Bay,2023-02-07T08:06:00Z,2023,2,DUS,FALSE,TRUE,FALSE,NSW-SMART-drumline-report-1-July-2022-30-June-2023.pdf
28/02/2023,13:50,Dusky Whaler,155,F,Alive,ID,Central Coast North,Toowoon Bay,2023-02-28T13:50:00Z,2023,2,DUS,FALSE,TRUE,FALSE,NSW-SMART-drumline-report-1-July-2022-30-June-2023.pdf
28/02/2023,16:28,Dusky Whaler,183,M,Alive,ID,Central Coast North,Toowoon Bay,2023-02-28T16:28:00Z,2023,2,DUS,FALSE,TRUE,FALSE,NSW-SMART-drumline-report-1-July-2022-30-June-2023.pdf
18/07/2022,9:11,Bronze Whaler,230,F,Alive,ID,Central Coast North,The Entrance Beach,2022-07-18T09:11:00Z,2022,7,BRO,FALSE,TRUE,FALSE,NSW-SMART-drumline-report-1-July-2022-30-June-2023.pdf
8/08/2022,12:44,Bronze Whaler,272,F,Alive,ID,Central Coast North,The Entrance Beach,2022-08-08T12:44:00Z,2022,8,BRO,FALSE,TRUE,FALSE,NSW-SMART-drumline-report-1-July-2022-30-June-2023.pdf
14/08/2022,10:25,Tiger Shark,159,F,Alive,"ID, A",Central Coast North,The Entrance Beach,2022-08-14T10:25:00Z,2022,8,TIG,TRUE,TRUE,TRUE,NSW-SMART-drumline-report-1-July-2022-30-June-2023.pdf
23/08/2022,NA,Dusky Whaler,124,M,Alive,ID,Central Coast North,The Entrance Beach,NA,2022,8,DUS,FALSE,TRUE,FALSE,NSW-SMART-drumline-report-1-July-2022-30-June-2023.pdf
20/09/2022,9:49,Bronze Whaler,244,M,Alive,ID,Central Coast North,The Entrance Beach,2022-09-20T09:49:00Z,2022,9,BRO,FALSE,TRUE,FALSE,NSW-SMART-drumline-report-1-July-2022-30-June-2023.pdf
20/09/2022,15:58,Dusky Whaler,149,M,Alive,ID,Central Coast North,The Entrance Beach,2022-09-20T15:58:00Z,2022,9,DUS,FALSE,TRUE,FALSE,NSW-SMART-drumline-report-1-July-2022-30-June-2023.pdf
2/11/2022,9:08,Smooth Hammerhead,180,M,Alive,ID,Central Coast North,The Entrance Beach,2022-11-02T09:08:00Z,2022,11,SMH,FALSE,TRUE,FALSE,NSW-SMART-drumline-report-1-July-2022-30-June-2023.pdf
27/11/2022,13:04,Bronze Whaler,261,F,Alive,ID,Central Coast North,The Entrance Beach,2022-11-27T13:04:00Z,2022,11,BRO,FALSE,TRUE,FALSE,NSW-SMART-drumline-report-1-July-2022-30-June-2023.pdf
3/01/2023,12:58,Mako,130,F,Alive,ID,Central Coast North,The Entrance Beach,2023-01-03T12:58:00Z,2023,1,SMA,FALSE,TRUE,FALSE,NSW-SMART-drumline-report-1-July-2022-30-June-2023.pdf
14/01/2023,8:21,Smooth Hammerhead,141,M,Alive,ID,Central Coast North,The Entrance Beach,2023-01-14T08:21:00Z,2023,1,SMH,FALSE,TRUE,FALSE,NSW-SMART-drumline-report-1-July-2022-30-June-2023.pdf
16/01/2023,9:33,Tiger Shark,153,F,Alive,"ID, A",Central Coast North,The Entrance Beach,2023-01-16T09:33:00Z,2023,1,TIG,TRUE,TRUE,TRUE,NSW-SMART-drumline-report-1-July-2022-30-June-2023.pdf
18/01/2023,NA,Dusky Whaler,110,M,Alive,ID,Central Coast North,The Entrance Beach,NA,2023,1,DUS,FALSE,TRUE,FALSE,NSW-SMART-drumline-report-1-July-2022-30-June-2023.pdf
3/02/2023,12:18,Dusky Whaler,159,M,Alive,ID,Central Coast North,The Entrance Beach,2023-02-03T12:18:00Z,2023,2,DUS,FALSE,TRUE,FALSE,NSW-SMART-drumline-report-1-July-2022-30-June-2023.pdf
10/02/2023,16:16,Dusky Whaler,207,F,Alive,ID,Central Coast North,The Entrance Beach,2023-02-10T16:16:00Z,2023,2,DUS,FALSE,TRUE,FALSE,NSW-SMART-drumline-report-1-July-2022-30-June-2023.pdf
15/02/2023,NA,Dusky Whaler,125,M,Dead,NA,Central Coast North,The Entrance Beach,NA,2023,2,DUS,FALSE,FALSE,FALSE,NSW-SMART-drumline-report-1-July-2022-30-June-2023.pdf
20/02/2023,7:24,Dusky Whaler,185,F,Alive,ID,Central Coast North,The Entrance Beach,2023-02-20T07:24:00Z,2023,2,DUS,FALSE,TRUE,FALSE,NSW-SMART-drumline-report-1-July-2022-30-June-2023.pdf
28/02/2023,15:10,Dusky Whaler,187,M,Alive,ID,Central Coast North,The Entrance Beach,2023-02-28T15:10:00Z,2023,2,DUS,FALSE,TRUE,FALSE,NSW-SMART-drumline-report-1-July-2022-30-June-2023.pdf
15/04/2023,14:02,Dusky Whaler,198,F,Alive,ID,Central Coast North,The Entrance Beach,2023-04-15T14:02:00Z,2023,4,DUS,FALSE,TRUE,FALSE,NSW-SMART-drumline-report-1-July-2022-30-June-2023.pdf
26/04/2023,12:17,Dusky Whaler,172,M,Alive,ID,Central Coast North,The Entrance Beach,2023-04-26T12:17:00Z,2023,4,DUS,FALSE,TRUE,FALSE,NSW-SMART-drumline-report-1-July-2022-30-June-2023.pdf
4/05/2023,10:46,Dusky Whaler,136,F,Alive,ID,Central Coast North,The Entrance Beach,2023-05-04T10:46:00Z,2023,5,DUS,FALSE,TRUE,FALSE,NSW-SMART-drumline-report-1-July-2022-30-June-2023.pdf
7/05/2023,12:49,Tiger Shark,167,M,Alive,"ID, A",Central Coast North,The Entrance Beach,2023-05-07T12:49:00Z,2023,5,TIG,TRUE,TRUE,TRUE,NSW-SMART-drumline-report-1-July-2022-30-June-2023.pdf
21/05/2023,NA,Dusky Whaler,101,F,Alive,ID,Central Coast North,The Entrance Beach,NA,2023,5,DUS,FALSE,TRUE,FALSE,NSW-SMART-drumline-report-1-July-2022-30-June-2023.pdf
23/05/2023,14:49,Bronze Whaler,230,F,Alive,ID,Central Coast North,The Entrance Beach,2023-05-23T14:49:00Z,2023,5,BRO,FALSE,TRUE,FALSE,NSW-SMART-drumline-report-1-July-2022-30-June-2023.pdf
28/05/2023,8:26,Bronze Whaler,277,F,Alive,ID,Central Coast North,The Entrance Beach,2023-05-28T08:26:00Z,2023,5,BRO,FALSE,TRUE,FALSE,NSW-SMART-drumline-report-1-July-2022-30-June-2023.pdf
13/06/2023,12:31,Bronze Whaler,245,F,Alive,ID,Central Coast North,The Entrance Beach,2023-06-13T12:31:00Z,2023,6,BRO,FALSE,TRUE,FALSE,NSW-SMART-drumline-report-1-July-2022-30-June-2023.pdf
16/06/2023,12:18,Bronze Whaler,277,F,Alive,ID,Central Coast North,The Entrance Beach,2023-06-16T12:18:00Z,2023,6,BRO,FALSE,TRUE,FALSE,NSW-SMART-drumline-report-1-July-2022-30-June-2023.pdf
18/06/2023,9:38,Bronze Whaler,271,F,Alive,ID,Central Coast North,The Entrance Beach,2023-06-18T09:38:00Z,2023,6,BRO,FALSE,TRUE,FALSE,NSW-SMART-drumline-report-1-July-2022-30-June-2023.pdf
21/06/2023,9:47,Bronze Whaler,280,F,Alive,ID,Central Coast North,The Entrance Beach,2023-06-21T09:47:00Z,2023,6,BRO,FALSE,TRUE,FALSE,NSW-SMART-drumline-report-1-July-2022-30-June-2023.pdf
27/06/2023,12:53,White Shark,258,M,Alive,"ID, A",Central Coast North,The Entrance Beach,2023-06-27T12:53:00Z,2023,6,WHI,TRUE,TRUE,TRUE,NSW-SMART-drumline-report-1-July-2022-30-June-2023.pdf
13/07/2022,12:25,Bronze Whaler,224,F,Alive,ID,Central Coast North,Pelican Beach,2022-07-13T12:25:00Z,2022,7,BRO,FALSE,TRUE,FALSE,NSW-SMART-drumline-report-1-July-2022-30-June-2023.pdf
18/07/2022,10:57,Bronze Whaler,266,F,Alive,ID,Central Coast North,Pelican Beach,2022-07-18T10:57:00Z,2022,7,BRO,FALSE,TRUE,FALSE,NSW-SMART-drumline-report-1-July-2022-30-June-2023.pdf
27/07/2022,9:42,Bronze Whaler,224,F,Alive,ID,Central Coast North,Pelican Beach,2022-07-27T09:42:00Z,2022,7,BRO,FALSE,TRUE,FALSE,NSW-SMART-drumline-report-1-July-2022-30-June-2023.pdf
6/08/2022,11:51,Dusky Whaler,152,M,Alive,ID,Central Coast North,Pelican Beach,2022-08-06T11:51:00Z,2022,8,DUS,FALSE,TRUE,FALSE,NSW-SMART-drumline-report-1-July-2022-30-June-2023.pdf
14/08/2022,9:35,Dusky Whaler,137,F,Alive,ID,Central Coast North,Pelican Beach,2022-08-14T09:35:00Z,2022,8,DUS,FALSE,TRUE,FALSE,NSW-SMART-drumline-report-1-July-2022-30-June-2023.pdf
18/08/2022,9:35,Bronze Whaler,205,M,Alive,ID,Central Coast North,Pelican Beach,2022-08-18T09:35:00Z,2022,8,BRO,FALSE,TRUE,FALSE,NSW-SMART-drumline-report-1-July-2022-30-June-2023.pdf
20/10/2022,9:38,Dusky Whaler,130,M,Alive,ID,Central Coast North,Pelican Beach,2022-10-20T09:38:00Z,2022,10,DUS,FALSE,TRUE,FALSE,NSW-SMART-drumline-report-1-July-2022-30-June-2023.pdf
28/10/2022,8:27,Dusky Whaler,149,F,Alive,ID,Central Coast North,Pelican Beach,2022-10-28T08:27:00Z,2022,10,DUS,FALSE,TRUE,FALSE,NSW-SMART-drumline-report-1-July-2022-30-June-2023.pdf
29/11/2022,9:18,Mako,132,M,Alive,ID,Central Coast North,Pelican Beach,2022-11-29T09:18:00Z,2022,11,SMA,FALSE,TRUE,FALSE,NSW-SMART-drumline-report-1-July-2022-30-June-2023.pdf
4/12/2022,12:24,Dusky Whaler,138,M,Alive,ID,Central Coast North,Pelican Beach,2022-12-04T12:24:00Z,2022,12,DUS,FALSE,TRUE,FALSE,NSW-SMART-drumline-report-1-July-2022-30-June-2023.pdf
7/12/2022,12:15,Smooth Hammerhead,172,M,Alive,ID,Central Coast North,Pelican Beach,2022-12-07T12:15:00Z,2022,12,SMH,FALSE,TRUE,FALSE,NSW-SMART-drumline-report-1-July-2022-30-June-2023.pdf
21/12/2022,12:25,Dusky Whaler,151,M,Alive,ID,Central Coast North,Pelican Beach,2022-12-21T12:25:00Z,2022,12,DUS,FALSE,TRUE,FALSE,NSW-SMART-drumline-report-1-July-2022-30-June-2023.pdf
15/01/2023,9:05,Dusky Whaler,147,M,Alive,ID,Central Coast North,Pelican Beach,2023-01-15T09:05:00Z,2023,1,DUS,FALSE,TRUE,FALSE,NSW-SMART-drumline-report-1-July-2022-30-June-2023.pdf
5/02/2023,12:56,Smooth Hammerhead,162,F,Alive,ID,Central Coast North,Pelican Beach,2023-02-05T12:56:00Z,2023,2,SMH,FALSE,TRUE,FALSE,NSW-SMART-drumline-report-1-July-2022-30-June-2023.pdf
8/02/2023,15:13,Dusky Whaler,166,F,Alive,ID,Central Coast North,Pelican Beach,2023-02-08T15:13:00Z,2023,2,DUS,FALSE,TRUE,FALSE,NSW-SMART-drumline-report-1-July-2022-30-June-2023.pdf
12/04/2023,10:08,Dusky Whaler,120,M,Alive,ID,Central Coast North,Pelican Beach,2023-04-12T10:08:00Z,2023,4,DUS,FALSE,TRUE,FALSE,NSW-SMART-drumline-report-1-July-2022-30-June-2023.pdf
13/05/2023,10:39,Dusky Whaler,150,M,Alive,ID,Central Coast North,Pelican Beach,2023-05-13T10:39:00Z,2023,5,DUS,FALSE,TRUE,FALSE,NSW-SMART-drumline-report-1-July-2022-30-June-2023.pdf
25/05/2023,14:58,Bronze Whaler,292,F,Alive,ID,Central Coast North,Pelican Beach,2023-05-25T14:58:00Z,2023,5,BRO,FALSE,TRUE,FALSE,NSW-SMART-drumline-report-1-July-2022-30-June-2023.pdf
30/05/2023,11:31,Dusky Whaler,155,F,Alive,ID,Central Coast North,Pelican Beach,2023-05-30T11:31:00Z,2023,5,DUS,FALSE,TRUE,FALSE,NSW-SMART-drumline-report-1-July-2022-30-June-2023.pdf
31/05/2023,NA,Dusky Whaler,120,M,Alive,ID,Central Coast North,Pelican Beach,NA,2023,5,DUS,FALSE,TRUE,FALSE,NSW-SMART-drumline-report-1-July-2022-30-June-2023.pdf
3/06/2023,14:21,Bronze Whaler,247,F,Alive,ID,Central Coast North,Pelican Beach,2023-06-03T14:21:00Z,2023,6,BRO,FALSE,TRUE,FALSE,NSW-SMART-drumline-report-1-July-2022-30-June-2023.pdf
2/07/2022,9:28,Dusky Whaler,161,M,Alive,ID,Central Coast North,Point Beach,2022-07-02T09:28:00Z,2022,7,DUS,FALSE,TRUE,FALSE,NSW-SMART-drumline-report-1-July-2022-30-June-2023.pdf
16/07/2022,NA,Dusky Whaler,128,M,Alive,ID,Central Coast North,Point Beach,NA,2022,7,DUS,FALSE,TRUE,FALSE,NSW-SMART-drumline-report-1-July-2022-30-June-2023.pdf
2/07/2022,10:38,Dusky Whaler,131,F,Alive,ID,Central Coast North,Soldiers Point Beach,2022-07-02T10:38:00Z,2022,7,DUS,FALSE,TRUE,FALSE,NSW-SMART-drumline-report-1-July-2022-30-June-2023.pdf
15/08/2022,8:14,Bronze Whaler,303,F,Alive,ID,Central Coast North,Soldiers Point Beach,2022-08-15T08:14:00Z,2022,8,BRO,FALSE,TRUE,FALSE,NSW-SMART-drumline-report-1-July-2022-30-June-2023.pdf
28/10/2022,NA,Dusky Whaler,127,F,Alive,ID,Central Coast North,Soldiers Point Beach,NA,2022,10,DUS,FALSE,TRUE,FALSE,NSW-SMART-drumline-report-1-July-2022-30-June-2023.pdf
14/12/2022,9:20,Dusky Whaler,176,F,Alive,ID,Central Coast North,Soldiers Point Beach,2022-12-14T09:20:00Z,2022,12,DUS,FALSE,TRUE,FALSE,NSW-SMART-drumline-report-1-July-2022-30-June-2023.pdf
16/01/2023,12:00,Dusky Whaler,162,F,Alive,ID,Central Coast North,Soldiers Point Beach,2023-01-16T12:00:00Z,2023,1,DUS,FALSE,TRUE,FALSE,NSW-SMART-drumline-report-1-July-2022-30-June-2023.pdf
21/01/2023,9:41,Smooth Hammerhead,153,F,Alive,ID,Central Coast North,Soldiers Point Beach,2023-01-21T09:41:00Z,2023,1,SMH,FALSE,TRUE,FALSE,NSW-SMART-drumline-report-1-July-2022-30-June-2023.pdf
30/01/2023,12:25,Dusky Whaler,131,M,Alive,ID,Central Coast North,Soldiers Point Beach,2023-01-30T12:25:00Z,2023,1,DUS,FALSE,TRUE,FALSE,NSW-SMART-drumline-report-1-July-2022-30-June-2023.pdf
12/02/2023,9:27,Dusky Whaler,133,M,Alive,ID,Central Coast North,Soldiers Point Beach,2023-02-12T09:27:00Z,2023,2,DUS,FALSE,TRUE,FALSE,NSW-SMART-drumline-report-1-July-2022-30-June-2023.pdf
25/02/2023,10:49,Dusky Whaler,131,F,Alive,ID,Central Coast North,Soldiers Point Beach,2023-02-25T10:49:00Z,2023,2,DUS,FALSE,TRUE,FALSE,NSW-SMART-drumline-report-1-July-2022-30-June-2023.pdf
3/03/2023,15:33,Dusky Whaler,166,F,Alive,ID,Central Coast North,Soldiers Point Beach,2023-03-03T15:33:00Z,2023,3,DUS,FALSE,TRUE,FALSE,NSW-SMART-drumline-report-1-July-2022-30-June-2023.pdf
7/03/2023,9:59,Tiger Shark,212,F,Alive,"ID, A",Central Coast North,Soldiers Point Beach,2023-03-07T09:59:00Z,2023,3,TIG,TRUE,TRUE,TRUE,NSW-SMART-drumline-report-1-July-2022-30-June-2023.pdf
19/03/2023,10:46,Dusky Whaler,137,M,Alive,ID,Central Coast North,Soldiers Point Beach,2023-03-19T10:46:00Z,2023,3,DUS,FALSE,TRUE,FALSE,NSW-SMART-drumline-report-1-July-2022-30-June-2023.pdf
15/04/2023,10:06,Dusky Whaler,158,M,Alive,ID,Central Coast North,Soldiers Point Beach,2023-04-15T10:06:00Z,2023,4,DUS,FALSE,TRUE,FALSE,NSW-SMART-drumline-report-1-July-2022-30-June-2023.pdf
20/05/2023,14:56,Bronze Whaler,279,F,Alive,ID,Central Coast North,Soldiers Point Beach,2023-05-20T14:56:00Z,2023,5,BRO,FALSE,TRUE,FALSE,NSW-SMART-drumline-report-1-July-2022-30-June-2023.pdf
29/06/2023,10:48,Bronze Whaler,275,F,Alive,ID,Central Coast North,Soldiers Point Beach,2023-06-29T10:48:00Z,2023,6,BRO,FALSE,TRUE,FALSE,NSW-SMART-drumline-report-1-July-2022-30-June-2023.pdf
3/08/2022,9:01,Bronze Whaler,262,F,Alive,ID,Central Coast North,Pebbly Beach,2022-08-03T09:01:00Z,2022,8,BRO,FALSE,TRUE,FALSE,NSW-SMART-drumline-report-1-July-2022-30-June-2023.pdf
3/08/2022,11:51,Bronze Whaler,262,F,Alive,ID,Central Coast North,Pebbly Beach,2022-08-03T11:51:00Z,2022,8,BRO,FALSE,TRUE,FALSE,NSW-SMART-drumline-report-1-July-2022-30-June-2023.pdf
6/02/2023,9:42,Dusky Whaler,136,M,Alive,ID,Central Coast North,Pebbly Beach,2023-02-06T09:42:00Z,2023,2,DUS,FALSE,TRUE,FALSE,NSW-SMART-drumline-report-1-July-2022-30-June-2023.pdf
6/02/2023,13:34,Dusky Whaler,137,F,Alive,ID,Central Coast North,Pebbly Beach,2023-02-06T13:34:00Z,2023,2,DUS,FALSE,TRUE,FALSE,NSW-SMART-drumline-report-1-July-2022-30-June-2023.pdf
4/03/2023,10:40,Dusky Whaler,164,F,Alive,ID,Central Coast North,Pebbly Beach,2023-03-04T10:40:00Z,2023,3,DUS,FALSE,TRUE,FALSE,NSW-SMART-drumline-report-1-July-2022-30-June-2023.pdf
2/10/2022,16:04,Dusky Whaler,141,F,Alive,ID,Central Coast South - Forresters to MacMasters,MacMasters Beach,2022-10-02T16:04:00Z,2022,10,DUS,FALSE,TRUE,FALSE,NSW-SMART-drumline-report-1-July-2022-30-June-2023.pdf
21/11/2022,9:45,Dusky Whaler,146,F,Alive,ID,Central Coast South - Forresters to MacMasters,MacMasters Beach,2022-11-21T09:45:00Z,2022,11,DUS,FALSE,TRUE,FALSE,NSW-SMART-drumline-report-1-July-2022-30-June-2023.pdf
13/12/2022,15:33,Dusky Whaler,162,F,Alive,ID,Central Coast South - Forresters to MacMasters,MacMasters Beach,2022-12-13T15:33:00Z,2022,12,DUS,FALSE,TRUE,FALSE,NSW-SMART-drumline-report-1-July-2022-30-June-2023.pdf
14/12/2022,12:02,Dusky Whaler,153,F,Alive,ID,Central Coast South - Forresters to MacMasters,MacMasters Beach,2022-12-14T12:02:00Z,2022,12,DUS,FALSE,TRUE,FALSE,NSW-SMART-drumline-report-1-July-2022-30-June-2023.pdf
3/01/2023,10:34,Dusky Whaler,162,M,Alive,ID,Central Coast South - Forresters to MacMasters,MacMasters Beach,2023-01-03T10:34:00Z,2023,1,DUS,FALSE,TRUE,FALSE,NSW-SMART-drumline-report-1-July-2022-30-June-2023.pdf
10/01/2023,8:19,Tiger Shark,206,M,Alive,"ID, A",Central Coast South - Forresters to MacMasters,MacMasters Beach,2023-01-10T08:19:00Z,2023,1,TIG,TRUE,TRUE,TRUE,NSW-SMART-drumline-report-1-July-2022-30-June-2023.pdf
16/01/2023,15:32,Dusky Whaler,203,F,Alive,ID,Central Coast South - Forresters to MacMasters,MacMasters Beach,2023-01-16T15:32:00Z,2023,1,DUS,FALSE,TRUE,FALSE,NSW-SMART-drumline-report-1-July-2022-30-June-2023.pdf
18/01/2023,12:47,Dusky Whaler,192,F,Alive,ID,Central Coast South - Forresters to MacMasters,MacMasters Beach,2023-01-18T12:47:00Z,2023,1,DUS,FALSE,TRUE,FALSE,NSW-SMART-drumline-report-1-July-2022-30-June-2023.pdf
30/01/2023,13:18,Dusky Whaler,125,M,Alive,ID,Central Coast South - Forresters to MacMasters,MacMasters Beach,2023-01-30T13:18:00Z,2023,1,DUS,FALSE,TRUE,FALSE,NSW-SMART-drumline-report-1-July-2022-30-June-2023.pdf
2/02/2023,10:00,Dusky Whaler,125,F,Alive,ID,Central Coast South - Forresters to MacMasters,MacMasters Beach,2023-02-02T10:00:00Z,2023,2,DUS,FALSE,TRUE,FALSE,NSW-SMART-drumline-report-1-July-2022-30-June-2023.pdf
21/02/2023,11:53,Dusky Whaler,135,M,Alive,ID,Central Coast South - Forresters to MacMasters,MacMasters Beach,2023-02-21T11:53:00Z,2023,2,DUS,FALSE,TRUE,FALSE,NSW-SMART-drumline-report-1-July-2022-30-June-2023.pdf
24/02/2023,8:48,Dusky Whaler,153,F,Alive,ID,Central Coast South - Forresters to MacMasters,MacMasters Beach,2023-02-24T08:48:00Z,2023,2,DUS,FALSE,TRUE,FALSE,NSW-SMART-drumline-report-1-July-2022-30-June-2023.pdf
28/02/2023,9:11,Dusky Whaler,125,M,Alive,ID,Central Coast South - Forresters to MacMasters,MacMasters Beach,2023-02-28T09:11:00Z,2023,2,DUS,FALSE,TRUE,FALSE,NSW-SMART-drumline-report-1-July-2022-30-June-2023.pdf
2/03/2023,11:17,Dusky Whaler,139,M,Alive,ID,Central Coast South - Forresters to MacMasters,MacMasters Beach,2023-03-02T11:17:00Z,2023,3,DUS,FALSE,TRUE,FALSE,NSW-SMART-drumline-report-1-July-2022-30-June-2023.pdf
30/03/2023,13:50,Dusky Whaler,164,M,Alive,ID,Central Coast South - Forresters to MacMasters,MacMasters Beach,2023-03-30T13:50:00Z,2023,3,DUS,FALSE,TRUE,FALSE,NSW-SMART-drumline-report-1-July-2022-30-June-2023.pdf
23/05/2023,11:15,Dusky Whaler,153,M,Alive,ID,Central Coast South - Forresters to MacMasters,MacMasters Beach,2023-05-23T11:15:00Z,2023,5,DUS,FALSE,TRUE,FALSE,NSW-SMART-drumline-report-1-July-2022-30-June-2023.pdf
25/05/2023,10:01,Dusky Whaler,156,F,Alive,ID,Central Coast South - Forresters to MacMasters,MacMasters Beach,2023-05-25T10:01:00Z,2023,5,DUS,FALSE,TRUE,FALSE,NSW-SMART-drumline-report-1-July-2022-30-June-2023.pdf
16/07/2022,9:06,Dusky Whaler,176,F,Alive,ID,Central Coast South - Forresters to MacMasters,Copacabana Beach,2022-07-16T09:06:00Z,2022,7,DUS,FALSE,TRUE,FALSE,NSW-SMART-drumline-report-1-July-2022-30-June-2023.pdf
24/07/2022,8:41,Dusky Whaler,152,M,Alive,ID,Central Coast South - Forresters to MacMasters,Copacabana Beach,2022-07-24T08:41:00Z,2022,7,DUS,FALSE,TRUE,FALSE,NSW-SMART-drumline-report-1-July-2022-30-June-2023.pdf
1/02/2023,13:59,Dusky Whaler,151,M,Alive,ID,Central Coast South - Forresters to MacMasters,Copacabana Beach,2023-02-01T13:59:00Z,2023,2,DUS,FALSE,TRUE,FALSE,NSW-SMART-drumline-report-1-July-2022-30-June-2023.pdf
11/09/2022,9:06,Dusky Whaler,151,M,Alive,ID,Central Coast South - Forresters to MacMasters,Avoca Beach,2022-09-11T09:06:00Z,2022,9,DUS,FALSE,TRUE,FALSE,NSW-SMART-drumline-report-1-July-2022-30-June-2023.pdf
2/10/2022,10:26,Bronze Whaler,210,F,Alive,ID,Central Coast South - Forresters to MacMasters,Avoca Beach,2022-10-02T10:26:00Z,2022,10,BRO,FALSE,TRUE,FALSE,NSW-SMART-drumline-report-1-July-2022-30-June-2023.pdf
22/12/2022,8:28,Dusky Whaler,209,F,Alive,ID,Central Coast South - Forresters to MacMasters,Avoca Beach,2022-12-22T08:28:00Z,2022,12,DUS,FALSE,TRUE,FALSE,NSW-SMART-drumline-report-1-July-2022-30-June-2023.pdf
23/12/2022,10:55,Mako,187,F,Alive,ID,Central Coast South - Forresters to MacMasters,Avoca Beach,2022-12-23T10:55:00Z,2022,12,SMA,FALSE,TRUE,FALSE,NSW-SMART-drumline-report-1-July-2022-30-June-2023.pdf
27/12/2022,11:49,Dusky Whaler,165,M,Alive,ID,Central Coast South - Forresters to MacMasters,Avoca Beach,2022-12-27T11:49:00Z,2022,12,DUS,FALSE,TRUE,FALSE,NSW-SMART-drumline-report-1-July-2022-30-June-2023.pdf
9/01/2023,9:51,Dusky Whaler,164,F,Alive,ID,Central Coast South - Forresters to MacMasters,Avoca Beach,2023-01-09T09:51:00Z,2023,1,DUS,FALSE,TRUE,FALSE,NSW-SMART-drumline-report-1-July-2022-30-June-2023.pdf
4/05/2023,8:38,Mako,120,F,Alive,ID,Central Coast South - Forresters to MacMasters,Avoca Beach,2023-05-04T08:38:00Z,2023,5,SMA,FALSE,TRUE,FALSE,NSW-SMART-drumline-report-1-July-2022-30-June-2023.pdf
15/07/2022,10:02,White Shark,236,F,Alive,"ID, A",Central Coast South - Forresters to MacMasters,North Avoca Beach,2022-07-15T10:02:00Z,2022,7,WHI,TRUE,TRUE,TRUE,NSW-SMART-drumline-report-1-July-2022-30-June-2023.pdf
27/11/2022,15:00,White Shark,287,F,Alive,"ID, A",Central Coast South - Forresters to MacMasters,North Avoca Beach,2022-11-27T15:00:00Z,2022,11,WHI,TRUE,TRUE,TRUE,NSW-SMART-drumline-report-1-July-2022-30-June-2023.pdf
21/12/2022,16:44,Dusky Whaler,155,M,Alive,ID,Central Coast South - Forresters to MacMasters,North Avoca Beach,2022-12-21T16:44:00Z,2022,12,DUS,FALSE,TRUE,FALSE,NSW-SMART-drumline-report-1-July-2022-30-June-2023.pdf
22/12/2022,13:15,Dusky Whaler,185,F,Alive,ID,Central Coast South - Forresters to MacMasters,North Avoca Beach,2022-12-22T13:15:00Z,2022,12,DUS,FALSE,TRUE,FALSE,NSW-SMART-drumline-report-1-July-2022-30-June-2023.pdf
27/12/2022,13:17,Dusky Whaler,157,M,Alive,ID,Central Coast South - Forresters to MacMasters,North Avoca Beach,2022-12-27T13:17:00Z,2022,12,DUS,FALSE,TRUE,FALSE,NSW-SMART-drumline-report-1-July-2022-30-June-2023.pdf
17/02/2023,NA,Dusky Whaler,128,M,Alive,ID,Central Coast South - Forresters to MacMasters,North Avoca Beach,NA,2023,2,DUS,FALSE,TRUE,FALSE,NSW-SMART-drumline-report-1-July-2022-30-June-2023.pdf
27/07/2022,9:41,Bronze Whaler,262,F,Alive,ID,Central Coast South - Forresters to MacMasters,Terrigal Beach,2022-07-27T09:41:00Z,2022,7,BRO,FALSE,TRUE,FALSE,NSW-SMART-drumline-report-1-July-2022-30-June-2023.pdf
30/07/2022,13:16,Bronze Whaler,259,F,Alive,ID,Central Coast South - Forresters to MacMasters,Terrigal Beach,2022-07-30T13:16:00Z,2022,7,BRO,FALSE,TRUE,FALSE,NSW-SMART-drumline-report-1-July-2022-30-June-2023.pdf
20/08/2022,7:59,White Shark,242,M,Alive,"ID, A",Central Coast South - Forresters to MacMasters,Terrigal Beach,2022-08-20T07:59:00Z,2022,8,WHI,TRUE,TRUE,TRUE,NSW-SMART-drumline-report-1-July-2022-30-June-2023.pdf
12/09/2022,14:58,Dusky Whaler,157,F,Alive,ID,Central Coast South - Forresters to MacMasters,Terrigal Beach,2022-09-12T14:58:00Z,2022,9,DUS,FALSE,TRUE,FALSE,NSW-SMART-drumline-report-1-July-2022-30-June-2023.pdf
4/10/2022,11:08,Dusky Whaler,122,F,Alive,ID,Central Coast South - Forresters to MacMasters,Terrigal Beach,2022-10-04T11:08:00Z,2022,10,DUS,FALSE,TRUE,FALSE,NSW-SMART-drumline-report-1-July-2022-30-June-2023.pdf
13/11/2022,11:04,White Shark,178,M,Alive,"ID, A",Central Coast South - Forresters to MacMasters,Terrigal Beach,2022-11-13T11:04:00Z,2022,11,WHI,TRUE,TRUE,TRUE,NSW-SMART-drumline-report-1-July-2022-30-June-2023.pdf
16/11/2022,13:27,Dusky Whaler,123,M,Alive,ID,Central Coast South - Forresters to MacMasters,Terrigal Beach,2022-11-16T13:27:00Z,2022,11,DUS,FALSE,TRUE,FALSE,NSW-SMART-drumline-report-1-July-2022-30-June-2023.pdf
16/01/2023,15:28,Tiger Shark,173,F,Alive,"ID, A",Central Coast South - Forresters to MacMasters,Terrigal Beach,2023-01-16T15:28:00Z,2023,1,TIG,TRUE,TRUE,TRUE,NSW-SMART-drumline-report-1-July-2022-30-June-2023.pdf
18/07/2022,14:47,Bronze Whaler,192,F,Alive,ID,Central Coast South - Forresters to MacMasters,Wamberal Beach,2022-07-18T14:47:00Z,2022,7,BRO,FALSE,TRUE,FALSE,NSW-SMART-drumline-report-1-July-2022-30-June-2023.pdf
4/08/2022,8:26,Bronze Whaler,242,F,Alive,ID,Central Coast South - Forresters to MacMasters,Wamberal Beach,2022-08-04T08:26:00Z,2022,8,BRO,FALSE,TRUE,FALSE,NSW-SMART-drumline-report-1-July-2022-30-June-2023.pdf
18/10/2022,9:52,Dusky Whaler,122,M,Alive,ID,Central Coast South - Forresters to MacMasters,Wamberal Beach,2022-10-18T09:52:00Z,2022,10,DUS,FALSE,TRUE,FALSE,NSW-SMART-drumline-report-1-July-2022-30-June-2023.pdf
10/11/2022,13:39,Mako,155,F,Alive,ID,Central Coast South - Forresters to MacMasters,Wamberal Beach,2022-11-10T13:39:00Z,2022,11,SMA,FALSE,TRUE,FALSE,NSW-SMART-drumline-report-1-July-2022-30-June-2023.pdf
30/11/2022,13:15,Dusky Whaler,161,F,Alive,ID,Central Coast South - Forresters to MacMasters,Wamberal Beach,2022-11-30T13:15:00Z,2022,11,DUS,FALSE,TRUE,FALSE,NSW-SMART-drumline-report-1-July-2022-30-June-2023.pdf
13/12/2022,13:23,Mako,145,F,Alive,ID,Central Coast South - Forresters to MacMasters,Wamberal Beach,2022-12-13T13:23:00Z,2022,12,SMA,FALSE,TRUE,FALSE,NSW-SMART-drumline-report-1-July-2022-30-June-2023.pdf
14/12/2022,14:02,Mako,157,F,Alive,ID,Central Coast South - Forresters to MacMasters,Wamberal Beach,2022-12-14T14:02:00Z,2022,12,SMA,FALSE,TRUE,FALSE,NSW-SMART-drumline-report-1-July-2022-30-June-2023.pdf
16/01/2023,14:34,Dusky Whaler,102,F,Alive,ID,Central Coast South - Forresters to MacMasters,Wamberal Beach,2023-01-16T14:34:00Z,2023,1,DUS,FALSE,TRUE,FALSE,NSW-SMART-drumline-report-1-July-2022-30-June-2023.pdf
19/02/2023,11:53,Tiger Shark,123,F,Alive,"ID, A",Central Coast South - Forresters to MacMasters,Wamberal Beach,2023-02-19T11:53:00Z,2023,2,TIG,TRUE,TRUE,TRUE,NSW-SMART-drumline-report-1-July-2022-30-June-2023.pdf
9/03/2023,12:33,Tiger Shark,132,M,Alive,"ID, A",Central Coast South - Forresters to MacMasters,Wamberal Beach,2023-03-09T12:33:00Z,2023,3,TIG,TRUE,TRUE,TRUE,NSW-SMART-drumline-report-1-July-2022-30-June-2023.pdf
12/04/2023,11:33,Bronze Whaler,254,F,Alive,ID,Central Coast South - Forresters to MacMasters,Wamberal Beach,2023-04-12T11:33:00Z,2023,4,BRO,FALSE,TRUE,FALSE,NSW-SMART-drumline-report-1-July-2022-30-June-2023.pdf
15/06/2023,10:59,Bronze Whaler,288,F,Alive,ID,Central Coast South - Forresters to MacMasters,Wamberal Beach,2023-06-15T10:59:00Z,2023,6,BRO,FALSE,TRUE,FALSE,NSW-SMART-drumline-report-1-July-2022-30-June-2023.pdf
27/07/2022,9:06,Bronze Whaler,191,F,Alive,ID,Central Coast South - Forresters to MacMasters,Forresters Beach,2022-07-27T09:06:00Z,2022,7,BRO,FALSE,TRUE,FALSE,NSW-SMART-drumline-report-1-July-2022-30-June-2023.pdf
22/08/2022,9:08,Bronze Whaler,244,F,Alive,ID,Central Coast South - Forresters to MacMasters,Forresters Beach,2022-08-22T09:08:00Z,2022,8,BRO,FALSE,TRUE,FALSE,NSW-SMART-drumline-report-1-July-2022-30-June-2023.pdf
29/01/2023,10:04,Dusky Whaler,95,M,Alive,ID,Central Coast South - Forresters to MacMasters,Forresters Beach,2023-01-29T10:04:00Z,2023,1,DUS,FALSE,TRUE,FALSE,NSW-SMART-drumline-report-1-July-2022-30-June-2023.pdf
5/02/2023,13:16,Dusky Whaler,125,M,Alive,ID,Central Coast South - Forresters to MacMasters,Forresters Beach,2023-02-05T13:16:00Z,2023,2,DUS,FALSE,TRUE,FALSE,NSW-SMART-drumline-report-1-July-2022-30-June-2023.pdf
15/06/2023,10:08,Bronze Whaler,288,F,Alive,ID,Central Coast South - Forresters to MacMasters,Forresters Beach,2023-06-15T10:08:00Z,2023,6,BRO,FALSE,TRUE,FALSE,NSW-SMART-drumline-report-1-July-2022-30-June-2023.pdf
15/06/2023,11:21,White Shark,232,M,Alive,"ID, A",Central Coast South - Forresters to MacMasters,Forresters Beach,2023-06-15T11:21:00Z,2023,6,WHI,TRUE,TRUE,TRUE,NSW-SMART-drumline-report-1-July-2022-30-June-2023.pdf
26/07/2022,13:48,Dusky Whaler,135,M,Alive,ID,Barrenjoey - Barrenjoey to Warriewood,Palm Beach,2022-07-26T13:48:00Z,2022,7,DUS,FALSE,TRUE,FALSE,NSW-SMART-drumline-report-1-July-2022-30-June-2023.pdf
30/07/2022,11:06,Bronze Whaler,263,F,Alive,ID,Barrenjoey - Barrenjoey to Warriewood,Palm Beach,2022-07-30T11:06:00Z,2022,7,BRO,FALSE,TRUE,FALSE,NSW-SMART-drumline-report-1-July-2022-30-June-2023.pdf
25/11/2022,10:00,Smooth Hammerhead,147,F,Alive,ID,Barrenjoey - Barrenjoey to Warriewood,Palm Beach,2022-11-25T10:00:00Z,2022,11,SMH,FALSE,TRUE,FALSE,NSW-SMART-drumline-report-1-July-2022-30-June-2023.pdf
30/12/2022,18:50,Mako,172,M,Alive,ID,Barrenjoey - Barrenjoey to Warriewood,Palm Beach,2022-12-30T18:50:00Z,2022,12,SMA,FALSE,TRUE,FALSE,NSW-SMART-drumline-report-1-July-2022-30-June-2023.pdf
16/01/2023,17:47,Tiger Shark,169,F,Alive,"ID, A",Barrenjoey - Barrenjoey to Warriewood,Palm Beach,2023-01-16T17:47:00Z,2023,1,TIG,TRUE,TRUE,TRUE,NSW-SMART-drumline-report-1-July-2022-30-June-2023.pdf
15/07/2022,11:36,Bronze Whaler,240,F,Alive,ID,Barrenjoey - Barrenjoey to Warriewood,Whale Beach,2022-07-15T11:36:00Z,2022,7,BRO,FALSE,TRUE,FALSE,NSW-SMART-drumline-report-1-July-2022-30-June-2023.pdf
24/07/2022,12:15,Bronze Whaler,205,F,Alive,ID,Barrenjoey - Barrenjoey to Warriewood,Whale Beach,2022-07-24T12:15:00Z,2022,7,BRO,FALSE,TRUE,FALSE,NSW-SMART-drumline-report-1-July-2022-30-June-2023.pdf
30/07/2022,10:51,Bronze Whaler,278,F,Alive,ID,Barrenjoey - Barrenjoey to Warriewood,Whale Beach,2022-07-30T10:51:00Z,2022,7,BRO,FALSE,TRUE,FALSE,NSW-SMART-drumline-report-1-July-2022-30-June-2023.pdf
10/01/2023,9:40,Mako,149,F,Alive,ID,Barrenjoey - Barrenjoey to Warriewood,Whale Beach,2023-01-10T09:40:00Z,2023,1,SMA,FALSE,TRUE,FALSE,NSW-SMART-drumline-report-1-July-2022-30-June-2023.pdf
13/01/2023,12:41,Tiger Shark,214,M,Alive,"ID, A",Barrenjoey - Barrenjoey to Warriewood,Whale Beach,2023-01-13T12:41:00Z,2023,1,TIG,TRUE,TRUE,TRUE,NSW-SMART-drumline-report-1-July-2022-30-June-2023.pdf
15/01/2023,13:01,Tiger Shark,184,F,Alive,"ID, A",Barrenjoey - Barrenjoey to Warriewood,Whale Beach,2023-01-15T13:01:00Z,2023,1,TIG,TRUE,TRUE,TRUE,NSW-SMART-drumline-report-1-July-2022-30-June-2023.pdf
8/02/2023,16:02,Black Marlin,215,M,Alive,ID,Barrenjoey - Barrenjoey to Warriewood,Whale Beach,2023-02-08T16:02:00Z,2023,2,BKM,FALSE,TRUE,FALSE,NSW-SMART-drumline-report-1-July-2022-30-June-2023.pdf
23/04/2023,13:58,Tiger Shark,203,F,Alive,"ID, A",Barrenjoey - Barrenjoey to Warriewood,Whale Beach,2023-04-23T13:58:00Z,2023,4,TIG,TRUE,TRUE,TRUE,NSW-SMART-drumline-report-1-July-2022-30-June-2023.pdf
28/07/2022,11:30,Dusky Whaler,152,M,Alive,ID,Barrenjoey - Barrenjoey to Warriewood,Avalon Beach,2022-07-28T11:30:00Z,2022,7,DUS,FALSE,TRUE,FALSE,NSW-SMART-drumline-report-1-July-2022-30-June-2023.pdf
30/07/2022,9:10,Bronze Whaler,273,F,Alive,ID,Barrenjoey - Barrenjoey to Warriewood,Avalon Beach,2022-07-30T09:10:00Z,2022,7,BRO,FALSE,TRUE,FALSE,NSW-SMART-drumline-report-1-July-2022-30-June-2023.pdf
23/08/2022,9:09,Bronze Whaler,256,F,Alive,ID,Barrenjoey - Barrenjoey to Warriewood,Avalon Beach,2022-08-23T09:09:00Z,2022,8,BRO,FALSE,TRUE,FALSE,NSW-SMART-drumline-report-1-July-2022-30-June-2023.pdf
16/10/2022,13:41,Mako,117,F,Alive,ID,Barrenjoey - Barrenjoey to Warriewood,Avalon Beach,2022-10-16T13:41:00Z,2022,10,SMA,FALSE,TRUE,FALSE,NSW-SMART-drumline-report-1-July-2022-30-June-2023.pdf
10/11/2022,10:09,Mako,149,F,Alive,ID,Barrenjoey - Barrenjoey to Warriewood,Avalon Beach,2022-11-10T10:09:00Z,2022,11,SMA,FALSE,TRUE,FALSE,NSW-SMART-drumline-report-1-July-2022-30-June-2023.pdf
21/11/2022,11:27,Mako,154,M,Alive,ID,Barrenjoey - Barrenjoey to Warriewood,Avalon Beach,2022-11-21T11:27:00Z,2022,11,SMA,FALSE,TRUE,FALSE,NSW-SMART-drumline-report-1-July-2022-30-June-2023.pdf
23/11/2022,NA,Dusky Whaler,113,M,Alive,ID,Barrenjoey - Barrenjoey to Warriewood,Avalon Beach,NA,2022,11,DUS,FALSE,TRUE,FALSE,NSW-SMART-drumline-report-1-July-2022-30-June-2023.pdf
25/11/2022,12:28,Dusky Whaler,146,F,Alive,ID,Barrenjoey - Barrenjoey to Warriewood,Avalon Beach,2022-11-25T12:28:00Z,2022,11,DUS,FALSE,TRUE,FALSE,NSW-SMART-drumline-report-1-July-2022-30-June-2023.pdf
30/12/2022,9:32,Dusky Whaler,127,M,Alive,ID,Barrenjoey - Barrenjoey to Warriewood,Avalon Beach,2022-12-30T09:32:00Z,2022,12,DUS,FALSE,TRUE,FALSE,NSW-SMART-drumline-report-1-July-2022-30-June-2023.pdf
2/03/2023,18:03,Dusky Whaler,130,F,Alive,ID,Barrenjoey - Barrenjoey to Warriewood,Avalon Beach,2023-03-02T18:03:00Z,2023,3,DUS,FALSE,TRUE,FALSE,NSW-SMART-drumline-report-1-July-2022-30-June-2023.pdf
15/03/2023,16:20,Dusky Whaler,156,F,Alive,ID,Barrenjoey - Barrenjoey to Warriewood,Avalon Beach,2023-03-15T16:20:00Z,2023,3,DUS,FALSE,TRUE,FALSE,NSW-SMART-drumline-report-1-July-2022-30-June-2023.pdf
1/12/2022,8:12,Dusky Whaler,164,M,Alive,ID,Barrenjoey - Barrenjoey to Warriewood,Bilgola Beach,2022-12-01T08:12:00Z,2022,12,DUS,FALSE,TRUE,FALSE,NSW-SMART-drumline-report-1-July-2022-30-June-2023.pdf
5/08/2022,13:27,Bronze Whaler,265,F,Alive,ID,Barrenjoey - Barrenjoey to Warriewood,Newport Beach,2022-08-05T13:27:00Z,2022,8,BRO,FALSE,TRUE,FALSE,NSW-SMART-drumline-report-1-July-2022-30-June-2023.pdf
25/08/2022,8:37,Bronze Whaler,237,M,Alive,ID,Barrenjoey - Barrenjoey to Warriewood,Newport Beach,2022-08-25T08:37:00Z,2022,8,BRO,FALSE,TRUE,FALSE,NSW-SMART-drumline-report-1-July-2022-30-June-2023.pdf
4/10/2022,NA,Dusky Whaler,126,M,Alive,ID,Barrenjoey - Barrenjoey to Warriewood,Newport Beach,NA,2022,10,DUS,FALSE,TRUE,FALSE,NSW-SMART-drumline-report-1-July-2022-30-June-2023.pdf
25/07/2022,9:00,Dusky Whaler,108,F,Alive,ID,Barrenjoey - Barrenjoey to Warriewood,Bungan Beach,2022-07-25T09:00:00Z,2022,7,DUS,FALSE,TRUE,FALSE,NSW-SMART-drumline-report-1-July-2022-30-June-2023.pdf
31/03/2023,9:58,Tiger Shark,158,F,Alive,"ID, A",Barrenjoey - Barrenjoey to Warriewood,Bungan Beach,2023-03-31T09:58:00Z,2023,3,TIG,TRUE,TRUE,TRUE,NSW-SMART-drumline-report-1-July-2022-30-June-2023.pdf
12/06/2023,11:44,Bronze Whaler,254,F,Alive,ID,Barrenjoey - Barrenjoey to Warriewood,Bungan Beach,2023-06-12T11:44:00Z,2023,6,BRO,FALSE,TRUE,FALSE,NSW-SMART-drumline-report-1-July-2022-30-June-2023.pdf
23/08/2022,11:31,Bronze Whaler,235,F,Alive,ID,Barrenjoey - Barrenjoey to Warriewood,Mona Vale Beach,2022-08-23T11:31:00Z,2022,8,BRO,FALSE,TRUE,FALSE,NSW-SMART-drumline-report-1-July-2022-30-June-2023.pdf
13/09/2022,9:03,Sevengill Shark,201,M,Alive,ID,Barrenjoey - Barrenjoey to Warriewood,Mona Vale Beach,2022-09-13T09:03:00Z,2022,9,SVG,FALSE,TRUE,FALSE,NSW-SMART-drumline-report-1-July-2022-30-June-2023.pdf
8/11/2022,NA,Dusky Whaler,107,M,Alive,ID,Barrenjoey - Barrenjoey to Warriewood,Mona Vale Beach,NA,2022,11,DUS,FALSE,TRUE,FALSE,NSW-SMART-drumline-report-1-July-2022-30-June-2023.pdf
10/12/2022,14:20,Dusky Whaler,NA,NA,Alive,NA,Barrenjoey - Barrenjoey to Warriewood,Mona Vale Beach,2022-12-10T14:20:00Z,2022,12,DUS,FALSE,FALSE,FALSE,NSW-SMART-drumline-report-1-July-2022-30-June-2023.pdf
4/02/2023,NA,Tiger Shark,148,F,Alive,"ID, A",Barrenjoey - Barrenjoey to Warriewood,Mona Vale Beach,NA,2023,2,TIG,TRUE,TRUE,TRUE,NSW-SMART-drumline-report-1-July-2022-30-June-2023.pdf
9/03/2023,NA,Dusky Whaler,180,F,Alive,ID,Barrenjoey - Barrenjoey to Warriewood,Mona Vale Beach,NA,2023,3,DUS,FALSE,TRUE,FALSE,NSW-SMART-drumline-report-1-July-2022-30-June-2023.pdf
19/03/2023,NA,Tiger Shark,130,F,Alive,"ID, A",Barrenjoey - Barrenjoey to Warriewood,Mona Vale Beach,NA,2023,3,TIG,TRUE,TRUE,TRUE,NSW-SMART-drumline-report-1-July-2022-30-June-2023.pdf
28/06/2023,14:06,Bronze Whaler,253,F,Alive,ID,Barrenjoey - Barrenjoey to Warriewood,Mona Vale Beach,2023-06-28T14:06:00Z,2023,6,BRO,FALSE,TRUE,FALSE,NSW-SMART-drumline-report-1-July-2022-30-June-2023.pdf
1/12/2022,NA,Dusky Whaler,126,F,Alive,ID,Barrenjoey - Barrenjoey to Warriewood,Warriewood Beach,NA,2022,12,DUS,FALSE,TRUE,FALSE,NSW-SMART-drumline-report-1-July-2022-30-June-2023.pdf
22/12/2022,13:20,Dusky Whaler,132,F,Alive,ID,Barrenjoey - Barrenjoey to Warriewood,Warriewood Beach,2022-12-22T13:20:00Z,2022,12,DUS,FALSE,TRUE,FALSE,NSW-SMART-drumline-report-1-July-2022-30-June-2023.pdf
16/02/2023,11:14,Dusky Whaler,173,M,Alive,ID,Barrenjoey - Barrenjoey to Warriewood,Warriewood Beach,2023-02-16T11:14:00Z,2023,2,DUS,FALSE,TRUE,FALSE,NSW-SMART-drumline-report-1-July-2022-30-June-2023.pdf
17/02/2023,14:14,Dusky Whaler,150,F,Alive,ID,Barrenjoey - Barrenjoey to Warriewood,Warriewood Beach,2023-02-17T14:14:00Z,2023,2,DUS,FALSE,TRUE,FALSE,NSW-SMART-drumline-report-1-July-2022-30-June-2023.pdf
10/03/2023,9:23,Dusky Whaler,131,F,Alive,ID,Barrenjoey - Barrenjoey to Warriewood,Warriewood Beach,2023-03-10T09:23:00Z,2023,3,DUS,FALSE,TRUE,FALSE,NSW-SMART-drumline-report-1-July-2022-30-June-2023.pdf
11/03/2023,10:43,Dusky Whaler,160,F,Alive,ID,Barrenjoey - Barrenjoey to Warriewood,Warriewood Beach,2023-03-11T10:43:00Z,2023,3,DUS,FALSE,TRUE,FALSE,NSW-SMART-drumline-report-1-July-2022-30-June-2023.pdf
22/03/2023,8:49,Dusky Whaler,139,F,Alive,ID,Barrenjoey - Barrenjoey to Warriewood,Warriewood Beach,2023-03-22T08:49:00Z,2023,3,DUS,FALSE,TRUE,FALSE,NSW-SMART-drumline-report-1-July-2022-30-June-2023.pdf
26/03/2023,11:44,Dusky Whaler,134,M,Alive,ID,Barrenjoey - Barrenjoey to Warriewood,Warriewood Beach,2023-03-26T11:44:00Z,2023,3,DUS,FALSE,TRUE,FALSE,NSW-SMART-drumline-report-1-July-2022-30-June-2023.pdf
22/11/2022,12:50,Mako,315,F,Alive,ID,Manly - Manly to Turimetta,Fairy Bower Beach,2022-11-22T12:50:00Z,2022,11,SMA,FALSE,TRUE,FALSE,NSW-SMART-drumline-report-1-July-2022-30-June-2023.pdf
24/11/2022,10:36,Dusky Whaler,152,M,Alive,ID,Manly - Manly to Turimetta,Manly Beach,2022-11-24T10:36:00Z,2022,11,DUS,FALSE,TRUE,FALSE,NSW-SMART-drumline-report-1-July-2022-30-June-2023.pdf
24/11/2022,15:06,Dusky Whaler,141,M,Alive,ID,Manly - Manly to Turimetta,North Steyne Beach,2022-11-24T15:06:00Z,2022,11,DUS,FALSE,TRUE,FALSE,NSW-SMART-drumline-report-1-July-2022-30-June-2023.pdf
4/02/2023,10:39,Scalloped Hammerhead,276,F,Alive,ID,Manly - Manly to Turimetta,North Steyne Beach,2023-02-04T10:39:00Z,2023,2,SCH,FALSE,TRUE,FALSE,NSW-SMART-drumline-report-1-July-2022-30-June-2023.pdf
15/02/2023,15:09,Dusky Whaler,190,M,Alive,ID,Manly - Manly to Turimetta,North Steyne Beach,2023-02-15T15:09:00Z,2023,2,DUS,FALSE,TRUE,FALSE,NSW-SMART-drumline-report-1-July-2022-30-June-2023.pdf
5/04/2023,13:38,Dusky Whaler,172,M,Alive,ID,Manly - Manly to Turimetta,North Steyne Beach,2023-04-05T13:38:00Z,2023,4,DUS,FALSE,TRUE,FALSE,NSW-SMART-drumline-report-1-July-2022-30-June-2023.pdf
15/07/2022,13:21,Bronze Whaler,283,F,Alive,ID,Manly - Manly to Turimetta,Queenscliff Beach,2022-07-15T13:21:00Z,2022,7,BRO,FALSE,TRUE,FALSE,NSW-SMART-drumline-report-1-July-2022-30-June-2023.pdf
11/01/2023,10:49,Mako,170,F,Alive,ID,Manly - Manly to Turimetta,Queenscliff Beach,2023-01-11T10:49:00Z,2023,1,SMA,FALSE,TRUE,FALSE,NSW-SMART-drumline-report-1-July-2022-30-June-2023.pdf
15/01/2023,13:37,Tiger Shark,195,F,Alive,"ID, A",Manly - Manly to Turimetta,Queenscliff Beach,2023-01-15T13:37:00Z,2023,1,TIG,TRUE,TRUE,TRUE,NSW-SMART-drumline-report-1-July-2022-30-June-2023.pdf
15/11/2022,8:12,Dusky Whaler,162,F,Alive,ID,Manly - Manly to Turimetta,Freshwater Beach,2022-11-15T08:12:00Z,2022,11,DUS,FALSE,TRUE,FALSE,NSW-SMART-drumline-report-1-July-2022-30-June-2023.pdf
26/07/2022,10:28,Dusky Whaler,154,M,Alive,ID,Manly - Manly to Turimetta,South Curl Curl Beach,2022-07-26T10:28:00Z,2022,7,DUS,FALSE,TRUE,FALSE,NSW-SMART-drumline-report-1-July-2022-30-June-2023.pdf
11/09/2022,7:42,Bronze Whaler,300,F,Alive,ID,Manly - Manly to Turimetta,South Curl Curl Beach,2022-09-11T07:42:00Z,2022,9,BRO,FALSE,TRUE,FALSE,NSW-SMART-drumline-report-1-July-2022-30-June-2023.pdf
28/10/2022,11:48,Dusky Whaler,139,F,Alive,ID,Manly - Manly to Turimetta,South Curl Curl Beach,2022-10-28T11:48:00Z,2022,10,DUS,FALSE,TRUE,FALSE,NSW-SMART-drumline-report-1-July-2022-30-June-2023.pdf
8/01/2023,12:15,Smooth Hammerhead,198,F,Alive,ID,Manly - Manly to Turimetta,South Curl Curl Beach,2023-01-08T12:15:00Z,2023,1,SMH,FALSE,TRUE,FALSE,NSW-SMART-drumline-report-1-July-2022-30-June-2023.pdf
15/07/2022,9:09,Bronze Whaler,220,F,Alive,ID,Manly - Manly to Turimetta,Curl Curl Beach,2022-07-15T09:09:00Z,2022,7,BRO,FALSE,TRUE,FALSE,NSW-SMART-drumline-report-1-July-2022-30-June-2023.pdf
25/10/2022,13:53,Dusky Whaler,162,M,Alive,ID,Manly - Manly to Turimetta,Curl Curl Beach,2022-10-25T13:53:00Z,2022,10,DUS,FALSE,TRUE,FALSE,NSW-SMART-drumline-report-1-July-2022-30-June-2023.pdf
24/01/2023,9:21,Smooth Hammerhead,171,M,Alive,ID,Manly - Manly to Turimetta,Curl Curl Beach,2023-01-24T09:21:00Z,2023,1,SMH,FALSE,TRUE,FALSE,NSW-SMART-drumline-report-1-July-2022-30-June-2023.pdf
23/04/2023,9:33,Tiger Shark,206,M,Alive,"ID, A",Manly - Manly to Turimetta,Curl Curl Beach,2023-04-23T09:33:00Z,2023,4,TIG,TRUE,TRUE,TRUE,NSW-SMART-drumline-report-1-July-2022-30-June-2023.pdf
8/07/2022,8:54,Sevengill Shark,213,M,Alive,ID,Manly - Manly to Turimetta,Dee Why Beach,2022-07-08T08:54:00Z,2022,7,SVG,FALSE,TRUE,FALSE,NSW-SMART-drumline-report-1-July-2022-30-June-2023.pdf
9/07/2022,11:24,Sevengill Shark,220,F,Alive,ID,Manly - Manly to Turimetta,Dee Why Beach,2022-07-09T11:24:00Z,2022,7,SVG,FALSE,TRUE,FALSE,NSW-SMART-drumline-report-1-July-2022-30-June-2023.pdf
12/07/2022,NA,Sevengill Shark,190,M,Alive,ID,Manly - Manly to Turimetta,Dee Why Beach,NA,2022,7,SVG,FALSE,TRUE,FALSE,NSW-SMART-drumline-report-1-July-2022-30-June-2023.pdf
6/08/2022,8:13,Dusky Whaler,128,M,Alive,ID,Manly - Manly to Turimetta,Dee Why Beach,2022-08-06T08:13:00Z,2022,8,DUS,FALSE,TRUE,FALSE,NSW-SMART-drumline-report-1-July-2022-30-June-2023.pdf
10/08/2022,10:15,Bronze Whaler,293,F,Alive,ID,Manly - Manly to Turimetta,Dee Why Beach,2022-08-10T10:15:00Z,2022,8,BRO,FALSE,TRUE,FALSE,NSW-SMART-drumline-report-1-July-2022-30-June-2023.pdf
19/08/2022,13:49,Bronze Whaler,236,F,Alive,ID,Manly - Manly to Turimetta,Dee Why Beach,2022-08-19T13:49:00Z,2022,8,BRO,FALSE,TRUE,FALSE,NSW-SMART-drumline-report-1-July-2022-30-June-2023.pdf
4/10/2022,10:39,Bronze Whaler,257,F,Alive,ID,Manly - Manly to Turimetta,Dee Why Beach,2022-10-04T10:39:00Z,2022,10,BRO,FALSE,TRUE,FALSE,NSW-SMART-drumline-report-1-July-2022-30-June-2023.pdf
7/11/2022,12:48,Dusky Whaler,133,F,Alive,ID,Manly - Manly to Turimetta,Dee Why Beach,2022-11-07T12:48:00Z,2022,11,DUS,FALSE,TRUE,FALSE,NSW-SMART-drumline-report-1-July-2022-30-June-2023.pdf
8/11/2022,16:54,Dusky Whaler,141,F,Alive,ID,Manly - Manly to Turimetta,Dee Why Beach,2022-11-08T16:54:00Z,2022,11,DUS,FALSE,TRUE,FALSE,NSW-SMART-drumline-report-1-July-2022-30-June-2023.pdf
21/11/2022,10:18,Bronze Whaler,252,F,Alive,ID,Manly - Manly to Turimetta,Dee Why Beach,2022-11-21T10:18:00Z,2022,11,BRO,FALSE,TRUE,FALSE,NSW-SMART-drumline-report-1-July-2022-30-June-2023.pdf
22/01/2023,13:00,Dusky Whaler,162,F,Alive,ID,Manly - Manly to Turimetta,Dee Why Beach,2023-01-22T13:00:00Z,2023,1,DUS,FALSE,TRUE,FALSE,NSW-SMART-drumline-report-1-July-2022-30-June-2023.pdf
25/01/2023,16:51,Tiger Shark,301,F,Alive,"ID, A",Manly - Manly to Turimetta,Dee Why Beach,2023-01-25T16:51:00Z,2023,1,TIG,TRUE,TRUE,TRUE,NSW-SMART-drumline-report-1-July-2022-30-June-2023.pdf
12/02/2023,12:20,Dusky Whaler,170,F,Alive,ID,Manly - Manly to Turimetta,Dee Why Beach,2023-02-12T12:20:00Z,2023,2,DUS,FALSE,TRUE,FALSE,NSW-SMART-drumline-report-1-July-2022-30-June-2023.pdf
4/03/2023,9:50,Dusky Whaler,165,F,Alive,ID,Manly - Manly to Turimetta,Dee Why Beach,2023-03-04T09:50:00Z,2023,3,DUS,FALSE,TRUE,FALSE,NSW-SMART-drumline-report-1-July-2022-30-June-2023.pdf
5/03/2023,11:09,Dusky Whaler,178,M,Alive,ID,Manly - Manly to Turimetta,Dee Why Beach,2023-03-05T11:09:00Z,2023,3,DUS,FALSE,TRUE,FALSE,NSW-SMART-drumline-report-1-July-2022-30-June-2023.pdf
15/03/2023,8:46,Dusky Whaler,160,M,Alive,ID,Manly - Manly to Turimetta,Dee Why Beach,2023-03-15T08:46:00Z,2023,3,DUS,FALSE,TRUE,FALSE,NSW-SMART-drumline-report-1-July-2022-30-June-2023.pdf
26/03/2023,15:44,Tiger Shark,163,M,Alive,"ID, A",Manly - Manly to Turimetta,Dee Why Beach,2023-03-26T15:44:00Z,2023,3,TIG,TRUE,TRUE,TRUE,NSW-SMART-drumline-report-1-July-2022-30-June-2023.pdf
28/03/2023,10:28,Dusky Whaler,153,M,Alive,ID,Manly - Manly to Turimetta,Dee Why Beach,2023-03-28T10:28:00Z,2023,3,DUS,FALSE,TRUE,FALSE,NSW-SMART-drumline-report-1-July-2022-30-June-2023.pdf
20/07/2022,8:07,Bronze Whaler,240,F,Alive,ID,Manly - Manly to Turimetta,Long Reef Beach,2022-07-20T08:07:00Z,2022,7,BRO,FALSE,TRUE,FALSE,NSW-SMART-drumline-report-1-July-2022-30-June-2023.pdf
15/02/2023,17:19,Dusky Whaler,125,NA,Dead,NA,Manly - Manly to Turimetta,Long Reef Beach,2023-02-15T17:19:00Z,2023,2,DUS,FALSE,FALSE,FALSE,NSW-SMART-drumline-report-1-July-2022-30-June-2023.pdf
4/03/2023,11:25,Dusky Whaler,130,M,Alive,ID,Manly - Manly to Turimetta,Long Reef Beach,2023-03-04T11:25:00Z,2023,3,DUS,FALSE,TRUE,FALSE,NSW-SMART-drumline-report-1-July-2022-30-June-2023.pdf
16/03/2023,14:06,Dusky Whaler,162,F,Alive,ID,Manly - Manly to Turimetta,Long Reef Beach,2023-03-16T14:06:00Z,2023,3,DUS,FALSE,TRUE,FALSE,NSW-SMART-drumline-report-1-July-2022-30-June-2023.pdf
3/10/2022,9:18,Tiger Shark,316,F,Alive,"ID, A",Manly - Manly to Turimetta,Collaroy Beach,2022-10-03T09:18:00Z,2022,10,TIG,TRUE,TRUE,TRUE,NSW-SMART-drumline-report-1-July-2022-30-June-2023.pdf
3/10/2022,13:27,White Shark,189,F,Alive,"ID, A",Manly - Manly to Turimetta,Collaroy Beach,2022-10-03T13:27:00Z,2022,10,WHI,TRUE,TRUE,TRUE,NSW-SMART-drumline-report-1-July-2022-30-June-2023.pdf
23/03/2023,13:07,Tiger Shark,176,M,Alive,"ID, A",Manly - Manly to Turimetta,South Narrabeen Beach,2023-03-23T13:07:00Z,2023,3,TIG,TRUE,TRUE,TRUE,NSW-SMART-drumline-report-1-July-2022-30-June-2023.pdf
8/07/2022,8:51,Bronze Whaler,298,F,Alive,ID,Bondi - Bondi to Little Bay,Little Bay Beach,2022-07-08T08:51:00Z,2022,7,BRO,FALSE,TRUE,FALSE,NSW-SMART-drumline-report-1-July-2022-30-June-2023.pdf
20/07/2022,11:13,Bronze Whaler,299,F,Alive,ID,Bondi - Bondi to Little Bay,Little Bay Beach,2022-07-20T11:13:00Z,2022,7,BRO,FALSE,TRUE,FALSE,NSW-SMART-drumline-report-1-July-2022-30-June-2023.pdf
23/07/2022,8:48,Bronze Whaler,255,F,Alive,ID,Bondi - Bondi to Little Bay,Little Bay Beach,2022-07-23T08:48:00Z,2022,7,BRO,FALSE,TRUE,FALSE,NSW-SMART-drumline-report-1-July-2022-30-June-2023.pdf
24/07/2022,9:09,White Shark,210,F,Alive,"ID, A",Bondi - Bondi to Little Bay,Malabar Beach,2022-07-24T09:09:00Z,2022,7,WHI,TRUE,TRUE,TRUE,NSW-SMART-drumline-report-1-July-2022-30-June-2023.pdf
12/08/2022,9:30,Bronze Whaler,285,F,Alive,ID,Bondi - Bondi to Little Bay,Malabar Beach,2022-08-12T09:30:00Z,2022,8,BRO,FALSE,TRUE,FALSE,NSW-SMART-drumline-report-1-July-2022-30-June-2023.pdf
16/09/2022,10:42,Bronze Whaler,294,F,Alive,ID,Bondi - Bondi to Little Bay,Malabar Beach,2022-09-16T10:42:00Z,2022,9,BRO,FALSE,TRUE,FALSE,NSW-SMART-drumline-report-1-July-2022-30-June-2023.pdf
18/10/2022,13:13,Mako,161,M,Alive,ID,Bondi - Bondi to Little Bay,Malabar Beach,2022-10-18T13:13:00Z,2022,10,SMA,FALSE,TRUE,FALSE,NSW-SMART-drumline-report-1-July-2022-30-June-2023.pdf
8/07/2022,8:15,Bronze Whaler,298,F,Alive,ID,Bondi - Bondi to Little Bay,Maroubra Beach,2022-07-08T08:15:00Z,2022,7,BRO,FALSE,TRUE,FALSE,NSW-SMART-drumline-report-1-July-2022-30-June-2023.pdf
12/08/2022,12:12,Mako,255,F,Alive,ID,Bondi - Bondi to Little Bay,Maroubra Beach,2022-08-12T12:12:00Z,2022,8,SMA,FALSE,TRUE,FALSE,NSW-SMART-drumline-report-1-July-2022-30-June-2023.pdf
15/12/2022,9:38,Scalloped Hammerhead,178,M,Alive,ID,Bondi - Bondi to Little Bay,Maroubra Beach,2022-12-15T09:38:00Z,2022,12,SCH,FALSE,TRUE,FALSE,NSW-SMART-drumline-report-1-July-2022-30-June-2023.pdf
18/01/2023,8:22,Dusky Whaler,150,M,Alive,ID,Bondi - Bondi to Little Bay,Maroubra Beach,2023-01-18T08:22:00Z,2023,1,DUS,FALSE,TRUE,FALSE,NSW-SMART-drumline-report-1-July-2022-30-June-2023.pdf
26/01/2023,11:51,Dusky Whaler,121,M,Alive,ID,Bondi - Bondi to Little Bay,Maroubra Beach,2023-01-26T11:51:00Z,2023,1,DUS,FALSE,TRUE,FALSE,NSW-SMART-drumline-report-1-July-2022-30-June-2023.pdf
3/02/2023,8:29,Dusky Whaler,140,F,Alive,ID,Bondi - Bondi to Little Bay,Maroubra Beach,2023-02-03T08:29:00Z,2023,2,DUS,FALSE,TRUE,FALSE,NSW-SMART-drumline-report-1-July-2022-30-June-2023.pdf
16/02/2023,8:46,Dusky Whaler,136,M,Alive,ID,Bondi - Bondi to Little Bay,Maroubra Beach,2023-02-16T08:46:00Z,2023,2,DUS,FALSE,TRUE,FALSE,NSW-SMART-drumline-report-1-July-2022-30-June-2023.pdf
20/02/2023,10:56,Dusky Whaler,130,F,Alive,ID,Bondi - Bondi to Little Bay,Maroubra Beach,2023-02-20T10:56:00Z,2023,2,DUS,FALSE,TRUE,FALSE,NSW-SMART-drumline-report-1-July-2022-30-June-2023.pdf
16/03/2023,10:31,Dusky Whaler,142,M,Alive,ID,Bondi - Bondi to Little Bay,Maroubra Beach,2023-03-16T10:31:00Z,2023,3,DUS,FALSE,TRUE,FALSE,NSW-SMART-drumline-report-1-July-2022-30-June-2023.pdf
14/08/2022,9:18,Tiger Shark,365,F,Alive,"ID, A",Bondi - Bondi to Little Bay,Coogee Beach,2022-08-14T09:18:00Z,2022,8,TIG,TRUE,TRUE,TRUE,NSW-SMART-drumline-report-1-July-2022-30-June-2023.pdf
30/11/2022,10:12,Dusky Whaler,151,M,Alive,ID,Bondi - Bondi to Little Bay,Coogee Beach,2022-11-30T10:12:00Z,2022,11,DUS,FALSE,TRUE,FALSE,NSW-SMART-drumline-report-1-July-2022-30-June-2023.pdf
3/02/2023,8:48,Dusky Whaler,143,M,Alive,ID,Bondi - Bondi to Little Bay,Coogee Beach,2023-02-03T08:48:00Z,2023,2,DUS,FALSE,TRUE,FALSE,NSW-SMART-drumline-report-1-July-2022-30-June-2023.pdf
7/02/2023,8:12,Dusky Whaler,153,F,Alive,ID,Bondi - Bondi to Little Bay,Coogee Beach,2023-02-07T08:12:00Z,2023,2,DUS,FALSE,TRUE,FALSE,NSW-SMART-drumline-report-1-July-2022-30-June-2023.pdf
7/02/2023,17:31,Dusky Whaler,179,M,Alive,ID,Bondi - Bondi to Little Bay,Coogee Beach,2023-02-07T17:31:00Z,2023,2,DUS,FALSE,TRUE,FALSE,NSW-SMART-drumline-report-1-July-2022-30-June-2023.pdf
18/02/2023,11:56,Dusky Whaler,180,F,Alive,ID,Bondi - Bondi to Little Bay,Coogee Beach,2023-02-18T11:56:00Z,2023,2,DUS,FALSE,TRUE,FALSE,NSW-SMART-drumline-report-1-July-2022-30-June-2023.pdf
25/02/2023,10:03,Dusky Whaler,143,F,Alive,ID,Bondi - Bondi to Little Bay,Coogee Beach,2023-02-25T10:03:00Z,2023,2,DUS,FALSE,TRUE,FALSE,NSW-SMART-drumline-report-1-July-2022-30-June-2023.pdf
5/04/2023,10:28,Dusky Whaler,139,F,Alive,ID,Bondi - Bondi to Little Bay,Coogee Beach,2023-04-05T10:28:00Z,2023,4,DUS,FALSE,TRUE,FALSE,NSW-SMART-drumline-report-1-July-2022-30-June-2023.pdf
13/05/2023,8:30,Dusky Whaler,148,F,Alive,ID,Bondi - Bondi to Little Bay,Coogee Beach,2023-05-13T08:30:00Z,2023,5,DUS,FALSE,TRUE,FALSE,NSW-SMART-drumline-report-1-July-2022-30-June-2023.pdf
10/11/2022,8:21,White Shark,207,M,Alive,"ID, A",Bondi - Bondi to Little Bay,Bronte Beach,2022-11-10T08:21:00Z,2022,11,WHI,TRUE,TRUE,TRUE,NSW-SMART-drumline-report-1-July-2022-30-June-2023.pdf
28/12/2022,10:15,Tiger Shark,366,M,Alive,"ID, A",Bondi - Bondi to Little Bay,Bronte Beach,2022-12-28T10:15:00Z,2022,12,TIG,TRUE,TRUE,TRUE,NSW-SMART-drumline-report-1-July-2022-30-June-2023.pdf
4/02/2023,17:18,Black Marlin,330,NA,Alive,ID,Bondi - Bondi to Little Bay,Bronte Beach,2023-02-04T17:18:00Z,2023,2,BKM,FALSE,TRUE,FALSE,NSW-SMART-drumline-report-1-July-2022-30-June-2023.pdf
26/02/2023,9:45,Tiger Shark,187,M,Alive,"ID, A",Bondi - Bondi to Little Bay,Bronte Beach,2023-02-26T09:45:00Z,2023,2,TIG,TRUE,TRUE,TRUE,NSW-SMART-drumline-report-1-July-2022-30-June-2023.pdf
14/08/2022,14:18,Tiger Shark,256,F,Alive,"ID, A",Bondi - Bondi to Little Bay,Tamarama Beach,2022-08-14T14:18:00Z,2022,8,TIG,TRUE,TRUE,TRUE,NSW-SMART-drumline-report-1-July-2022-30-June-2023.pdf
21/12/2022,14:22,Mako,200,M,Alive,ID,Bondi - Bondi to Little Bay,Tamarama Beach,2022-12-21T14:22:00Z,2022,12,SMA,FALSE,TRUE,FALSE,NSW-SMART-drumline-report-1-July-2022-30-June-2023.pdf
11/01/2023,14:38,Tiger Shark,188,M,Alive,"ID, A",Bondi - Bondi to Little Bay,Tamarama Beach,2023-01-11T14:38:00Z,2023,1,TIG,TRUE,TRUE,TRUE,NSW-SMART-drumline-report-1-July-2022-30-June-2023.pdf
17/01/2023,8:40,Tiger Shark,190,F,Alive,"ID, A",Bondi - Bondi to Little Bay,Tamarama Beach,2023-01-17T08:40:00Z,2023,1,TIG,TRUE,TRUE,TRUE,NSW-SMART-drumline-report-1-July-2022-30-June-2023.pdf
12/05/2023,9:03,Dusky Whaler,165,M,Alive,ID,Bondi - Bondi to Little Bay,Tamarama Beach,2023-05-12T09:03:00Z,2023,5,DUS,FALSE,TRUE,FALSE,NSW-SMART-drumline-report-1-July-2022-30-June-2023.pdf
14/05/2023,12:24,Dusky Whaler,169,M,Alive,ID,Bondi - Bondi to Little Bay,Tamarama Beach,2023-05-14T12:24:00Z,2023,5,DUS,FALSE,TRUE,FALSE,NSW-SMART-drumline-report-1-July-2022-30-June-2023.pdf
8/07/2022,10:18,Bronze Whaler,250,F,Alive,ID,Bondi - Bondi to Little Bay,Bondi Beach,2022-07-08T10:18:00Z,2022,7,BRO,FALSE,TRUE,FALSE,NSW-SMART-drumline-report-1-July-2022-30-June-2023.pdf
27/07/2022,10:27,Black Ray,190,NA,Alive,NA,Bondi - Bondi to Little Bay,Bondi Beach,2022-07-27T10:27:00Z,2022,7,BLR,FALSE,FALSE,FALSE,NSW-SMART-drumline-report-1-July-2022-30-June-2023.pdf
16/09/2022,10:48,White Shark,151,F,Alive,"ID, A",Bondi - Bondi to Little Bay,Bondi Beach,2022-09-16T10:48:00Z,2022,9,WHI,TRUE,TRUE,TRUE,NSW-SMART-drumline-report-1-July-2022-30-June-2023.pdf
31/12/2022,8:15,Smooth Hammerhead,176,F,Alive,ID,Bondi - Bondi to Little Bay,Bondi Beach,2022-12-31T08:15:00Z,2022,12,SMH,FALSE,TRUE,FALSE,NSW-SMART-drumline-report-1-July-2022-30-June-2023.pdf
10/01/2023,10:33,Tiger Shark,218,F,Alive,"ID, A",Bondi - Bondi to Little Bay,Bondi Beach,2023-01-10T10:33:00Z,2023,1,TIG,TRUE,TRUE,TRUE,NSW-SMART-drumline-report-1-July-2022-30-June-2023.pdf
9/03/2023,11:57,Dusky Whaler,142,F,Alive,ID,Bondi - Bondi to Little Bay,Bondi Beach,2023-03-09T11:57:00Z,2023,3,DUS,FALSE,TRUE,FALSE,NSW-SMART-drumline-report-1-July-2022-30-June-2023.pdf
30/04/2023,9:02,Dusky Whaler,190,NA,Alive,NA,Bondi - Bondi to Little Bay,Bondi Beach,2023-04-30T09:02:00Z,2023,4,DUS,FALSE,FALSE,FALSE,NSW-SMART-drumline-report-1-July-2022-30-June-2023.pdf
30/04/2023,14:29,Dusky Whaler,152,F,Alive,ID,Bondi - Bondi to Little Bay,Bondi Beach,2023-04-30T14:29:00Z,2023,4,DUS,FALSE,TRUE,FALSE,NSW-SMART-drumline-report-1-July-2022-30-June-2023.pdf
12/05/2023,NA,Dusky Whaler,130,M,Alive,ID,Bondi - Bondi to Little Bay,Bondi Beach,NA,2023,5,DUS,FALSE,TRUE,FALSE,NSW-SMART-drumline-report-1-July-2022-30-June-2023.pdf
1/07/2022,13:37,Black Ray,150,NA,Alive,NA,Sutherland,Oak Park Beach,2022-07-01T13:37:00Z,2022,7,BLR,FALSE,FALSE,FALSE,NSW-SMART-drumline-report-1-July-2022-30-June-2023.pdf
1/07/2022,14:52,Bronze Whaler,270,F,Alive,ID,Sutherland,Oak Park Beach,2022-07-01T14:52:00Z,2022,7,BRO,FALSE,TRUE,FALSE,NSW-SMART-drumline-report-1-July-2022-30-June-2023.pdf
7/07/2022,NA,Dusky Whaler,131,F,Alive,ID,Sutherland,Oak Park Beach,NA,2022,7,DUS,FALSE,TRUE,FALSE,NSW-SMART-drumline-report-1-July-2022-30-June-2023.pdf
19/07/2022,14:00,Bronze Whaler,302,F,Alive,ID,Sutherland,Oak Park Beach,2022-07-19T14:00:00Z,2022,7,BRO,FALSE,TRUE,FALSE,NSW-SMART-drumline-report-1-July-2022-30-June-2023.pdf
25/07/2022,8:56,Bronze Whaler,259,F,Alive,ID,Sutherland,Oak Park Beach,2022-07-25T08:56:00Z,2022,7,BRO,FALSE,TRUE,FALSE,NSW-SMART-drumline-report-1-July-2022-30-June-2023.pdf
27/07/2022,NA,Dusky Whaler,120,M,Alive,ID,Sutherland,Oak Park Beach,NA,2022,7,DUS,FALSE,TRUE,FALSE,NSW-SMART-drumline-report-1-July-2022-30-June-2023.pdf
29/07/2022,14:51,Bronze Whaler,281,F,Alive,ID,Sutherland,Oak Park Beach,2022-07-29T14:51:00Z,2022,7,BRO,FALSE,TRUE,FALSE,NSW-SMART-drumline-report-1-July-2022-30-June-2023.pdf
22/08/2022,8:48,Bronze Whaler,258,F,Alive,ID,Sutherland,Oak Park Beach,2022-08-22T08:48:00Z,2022,8,BRO,FALSE,TRUE,FALSE,NSW-SMART-drumline-report-1-July-2022-30-June-2023.pdf
23/08/2022,6:53,Bronze Whaler,288,F,Alive,ID,Sutherland,Oak Park Beach,2022-08-23T06:53:00Z,2022,8,BRO,FALSE,TRUE,FALSE,NSW-SMART-drumline-report-1-July-2022-30-June-2023.pdf
27/08/2022,12:48,Bronze Whaler,266,F,Alive,ID,Sutherland,Oak Park Beach,2022-08-27T12:48:00Z,2022,8,BRO,FALSE,TRUE,FALSE,NSW-SMART-drumline-report-1-July-2022-30-June-2023.pdf
1/09/2022,10:51,Bronze Whaler,270,F,Alive,ID,Sutherland,Oak Park Beach,2022-09-01T10:51:00Z,2022,9,BRO,FALSE,TRUE,FALSE,NSW-SMART-drumline-report-1-July-2022-30-June-2023.pdf
6/09/2022,11:45,Bronze Whaler,275,F,Alive,ID,Sutherland,Oak Park Beach,2022-09-06T11:45:00Z,2022,9,BRO,FALSE,TRUE,FALSE,NSW-SMART-drumline-report-1-July-2022-30-June-2023.pdf
8/10/2022,11:08,Bronze Whaler,244,F,Alive,ID,Sutherland,Oak Park Beach,2022-10-08T11:08:00Z,2022,10,BRO,FALSE,TRUE,FALSE,NSW-SMART-drumline-report-1-July-2022-30-June-2023.pdf
13/11/2022,11:27,White Shark,269,M,Alive,"ID, A",Sutherland,Oak Park Beach,2022-11-13T11:27:00Z,2022,11,WHI,TRUE,TRUE,TRUE,NSW-SMART-drumline-report-1-July-2022-30-June-2023.pdf
15/12/2022,7:03,Black Ray,150,F,Alive,NA,Sutherland,Oak Park Beach,2022-12-15T07:03:00Z,2022,12,BLR,FALSE,FALSE,FALSE,NSW-SMART-drumline-report-1-July-2022-30-June-2023.pdf
25/12/2022,13:06,Tiger Shark,202,F,Alive,"ID, A",Sutherland,Oak Park Beach,2022-12-25T13:06:00Z,2022,12,TIG,TRUE,TRUE,TRUE,NSW-SMART-drumline-report-1-July-2022-30-June-2023.pdf
15/03/2023,NA,Dusky Whaler,139,M,Dead,NA,Sutherland,Oak Park Beach,NA,2023,3,DUS,FALSE,FALSE,FALSE,NSW-SMART-drumline-report-1-July-2022-30-June-2023.pdf
8/07/2022,NA,Sevengill Shark,210,M,Alive,ID,Sutherland,Shark Island,NA,2022,7,SVG,FALSE,TRUE,FALSE,NSW-SMART-drumline-report-1-July-2022-30-June-2023.pdf
16/07/2022,14:28,White Shark,204,M,Alive,"ID, A",Sutherland,Shark Island,2022-07-16T14:28:00Z,2022,7,WHI,TRUE,TRUE,TRUE,NSW-SMART-drumline-report-1-July-2022-30-June-2023.pdf
27/07/2022,8:32,Bronze Whaler,250,F,Alive,ID,Sutherland,Shark Island,2022-07-27T08:32:00Z,2022,7,BRO,FALSE,TRUE,FALSE,NSW-SMART-drumline-report-1-July-2022-30-June-2023.pdf
29/07/2022,8:43,Bronze Whaler,222,F,Alive,ID,Sutherland,Shark Island,2022-07-29T08:43:00Z,2022,7,BRO,FALSE,TRUE,FALSE,NSW-SMART-drumline-report-1-July-2022-30-June-2023.pdf
1/08/2022,13:29,Bronze Whaler,274,F,Alive,ID,Sutherland,Shark Island,2022-08-01T13:29:00Z,2022,8,BRO,FALSE,TRUE,FALSE,NSW-SMART-drumline-report-1-July-2022-30-June-2023.pdf
2/08/2022,NA,Snapper,32,NA,Alive,NA,Sutherland,Shark Island,NA,2022,8,SNP,FALSE,FALSE,FALSE,NSW-SMART-drumline-report-1-July-2022-30-June-2023.pdf
11/08/2022,9:49,Bronze Whaler,198,F,Alive,ID,Sutherland,Shark Island,2022-08-11T09:49:00Z,2022,8,BRO,FALSE,TRUE,FALSE,NSW-SMART-drumline-report-1-July-2022-30-June-2023.pdf
21/08/2022,7:47,Bronze Whaler,264,F,Alive,ID,Sutherland,Shark Island,2022-08-21T07:47:00Z,2022,8,BRO,FALSE,TRUE,FALSE,NSW-SMART-drumline-report-1-July-2022-30-June-2023.pdf
5/09/2022,12:36,Bronze Whaler,170,M,Alive,ID,Sutherland,Shark Island,2022-09-05T12:36:00Z,2022,9,BRO,FALSE,TRUE,FALSE,NSW-SMART-drumline-report-1-July-2022-30-June-2023.pdf
9/09/2022,12:03,Black Ray,120,F,Alive,NA,Sutherland,Shark Island,2022-09-09T12:03:00Z,2022,9,BLR,FALSE,FALSE,FALSE,NSW-SMART-drumline-report-1-July-2022-30-June-2023.pdf
12/09/2022,12:00,Bronze Whaler,272,F,Alive,ID,Sutherland,Shark Island,2022-09-12T12:00:00Z,2022,9,BRO,FALSE,TRUE,FALSE,NSW-SMART-drumline-report-1-July-2022-30-June-2023.pdf
5/10/2022,13:48,Bronze Whaler,249,F,Alive,ID,Sutherland,Shark Island,2022-10-05T13:48:00Z,2022,10,BRO,FALSE,TRUE,FALSE,NSW-SMART-drumline-report-1-July-2022-30-June-2023.pdf
26/11/2022,NA,Dusky Whaler,101,M,Alive,ID,Sutherland,Shark Island,NA,2022,11,DUS,FALSE,TRUE,FALSE,NSW-SMART-drumline-report-1-July-2022-30-June-2023.pdf
27/12/2022,NA,Snapper,37,NA,Dead,NA,Sutherland,Shark Island,NA,2022,12,SNP,FALSE,FALSE,FALSE,NSW-SMART-drumline-report-1-July-2022-30-June-2023.pdf
4/01/2023,18:01,Gummy Shark,166,F,Alive,ID,Sutherland,Shark Island,2023-01-04T18:01:00Z,2023,1,GUM,FALSE,TRUE,FALSE,NSW-SMART-drumline-report-1-July-2022-30-June-2023.pdf
14/01/2023,9:56,Tiger Shark,200,NA,Alive,NA,Sutherland,Shark Island,2023-01-14T09:56:00Z,2023,1,TIG,TRUE,FALSE,FALSE,NSW-SMART-drumline-report-1-July-2022-30-June-2023.pdf
16/01/2023,NA,Dusky Whaler,108,F,Alive,ID,Sutherland,Shark Island,NA,2023,1,DUS,FALSE,TRUE,FALSE,NSW-SMART-drumline-report-1-July-2022-30-June-2023.pdf
8/02/2023,11:09,Tiger Shark,180,NA,Alive,NA,Sutherland,Shark Island,2023-02-08T11:09:00Z,2023,2,TIG,TRUE,FALSE,FALSE,NSW-SMART-drumline-report-1-July-2022-30-June-2023.pdf
17/02/2023,NA,Dusky Whaler,102,M,Alive,ID,Sutherland,Shark Island,NA,2023,2,DUS,FALSE,TRUE,FALSE,NSW-SMART-drumline-report-1-July-2022-30-June-2023.pdf
20/02/2023,NA,Tiger Shark,146,F,Alive,"ID, A",Sutherland,Shark Island,NA,2023,2,TIG,TRUE,TRUE,TRUE,NSW-SMART-drumline-report-1-July-2022-30-June-2023.pdf
25/02/2023,NA,Dusky Whaler,112,F,Dead,NA,Sutherland,Shark Island,NA,2023,2,DUS,FALSE,FALSE,FALSE,NSW-SMART-drumline-report-1-July-2022-30-June-2023.pdf
3/03/2023,18:05,Dusky Whaler,102,M,Dead,NA,Sutherland,Shark Island,2023-03-03T18:05:00Z,2023,3,DUS,FALSE,FALSE,FALSE,NSW-SMART-drumline-report-1-July-2022-30-June-2023.pdf
8/03/2023,NA,Dusky Whaler,101,M,Alive,ID,Sutherland,Shark Island,NA,2023,3,DUS,FALSE,TRUE,FALSE,NSW-SMART-drumline-report-1-July-2022-30-June-2023.pdf
2/05/2023,NA,Dusky Whaler,124,M,Alive,ID,Sutherland,Shark Island,NA,2023,5,DUS,FALSE,TRUE,FALSE,NSW-SMART-drumline-report-1-July-2022-30-June-2023.pdf
26/07/2022,10:22,Bronze Whaler,278,F,Alive,ID,Sutherland,South Cronulla Beach,2022-07-26T10:22:00Z,2022,7,BRO,FALSE,TRUE,FALSE,NSW-SMART-drumline-report-1-July-2022-30-June-2023.pdf
3/08/2022,13:13,Bronze Whaler,248,F,Alive,ID,Sutherland,South Cronulla Beach,2022-08-03T13:13:00Z,2022,8,BRO,FALSE,TRUE,FALSE,NSW-SMART-drumline-report-1-July-2022-30-June-2023.pdf
6/08/2022,12:15,Bronze Whaler,277,F,Alive,ID,Sutherland,South Cronulla Beach,2022-08-06T12:15:00Z,2022,8,BRO,FALSE,TRUE,FALSE,NSW-SMART-drumline-report-1-July-2022-30-June-2023.pdf
9/08/2022,11:16,Bronze Whaler,278,F,Alive,ID,Sutherland,South Cronulla Beach,2022-08-09T11:16:00Z,2022,8,BRO,FALSE,TRUE,FALSE,NSW-SMART-drumline-report-1-July-2022-30-June-2023.pdf
23/08/2022,12:43,Bronze Whaler,282,F,Alive,ID,Sutherland,South Cronulla Beach,2022-08-23T12:43:00Z,2022,8,BRO,FALSE,TRUE,FALSE,NSW-SMART-drumline-report-1-July-2022-30-June-2023.pdf
26/11/2022,NA,Dusky Whaler,99,M,Alive,ID,Sutherland,South Cronulla Beach,NA,2022,11,DUS,FALSE,TRUE,FALSE,NSW-SMART-drumline-report-1-July-2022-30-June-2023.pdf
16/01/2023,18:12,Smooth Hammerhead,150,M,Alive,ID,Sutherland,South Cronulla Beach,2023-01-16T18:12:00Z,2023,1,SMH,FALSE,TRUE,FALSE,NSW-SMART-drumline-report-1-July-2022-30-June-2023.pdf
24/01/2023,17:45,Tiger Shark,156,F,Alive,"ID, A",Sutherland,South Cronulla Beach,2023-01-24T17:45:00Z,2023,1,TIG,TRUE,TRUE,TRUE,NSW-SMART-drumline-report-1-July-2022-30-June-2023.pdf
6/09/2022,14:40,Bronze Whaler,277,M,Alive,ID,Sutherland,Elouera Beach,2022-09-06T14:40:00Z,2022,9,BRO,FALSE,TRUE,FALSE,NSW-SMART-drumline-report-1-July-2022-30-June-2023.pdf
4/02/2023,7:33,Black Marlin,340,NA,Dead,NA,Sutherland,Elouera Beach,2023-02-04T07:33:00Z,2023,2,BKM,FALSE,FALSE,FALSE,NSW-SMART-drumline-report-1-July-2022-30-June-2023.pdf
19/05/2023,11:45,Bronze Whaler,296,F,Alive,ID,Sutherland,Elouera Beach,2023-05-19T11:45:00Z,2023,5,BRO,FALSE,TRUE,FALSE,NSW-SMART-drumline-report-1-July-2022-30-June-2023.pdf
7/07/2022,9:31,Bronze Whaler,258,M,Alive,ID,Sutherland,Wanda Beach,2022-07-07T09:31:00Z,2022,7,BRO,FALSE,TRUE,FALSE,NSW-SMART-drumline-report-1-July-2022-30-June-2023.pdf
8/07/2022,10:15,Bronze Whaler,294,F,Alive,ID,Sutherland,Wanda Beach,2022-07-08T10:15:00Z,2022,7,BRO,FALSE,TRUE,FALSE,NSW-SMART-drumline-report-1-July-2022-30-June-2023.pdf
13/07/2022,7:56,Bronze Whaler,256,F,Alive,ID,Sutherland,Wanda Beach,2022-07-13T07:56:00Z,2022,7,BRO,FALSE,TRUE,FALSE,NSW-SMART-drumline-report-1-July-2022-30-June-2023.pdf
19/07/2022,13:00,Bronze Whaler,278,F,Alive,ID,Sutherland,Wanda Beach,2022-07-19T13:00:00Z,2022,7,BRO,FALSE,TRUE,FALSE,NSW-SMART-drumline-report-1-July-2022-30-June-2023.pdf
27/07/2022,11:22,Bronze Whaler,268,F,Alive,ID,Sutherland,Wanda Beach,2022-07-27T11:22:00Z,2022,7,BRO,FALSE,TRUE,FALSE,NSW-SMART-drumline-report-1-July-2022-30-June-2023.pdf
29/07/2022,12:38,Bronze Whaler,256,F,Alive,ID,Sutherland,Wanda Beach,2022-07-29T12:38:00Z,2022,7,BRO,FALSE,TRUE,FALSE,NSW-SMART-drumline-report-1-July-2022-30-June-2023.pdf
5/08/2022,13:13,Bronze Whaler,313,F,Alive,ID,Sutherland,Wanda Beach,2022-08-05T13:13:00Z,2022,8,BRO,FALSE,TRUE,FALSE,NSW-SMART-drumline-report-1-July-2022-30-June-2023.pdf
8/08/2022,9:55,Bronze Whaler,234,F,Alive,ID,Sutherland,Wanda Beach,2022-08-08T09:55:00Z,2022,8,BRO,FALSE,TRUE,FALSE,NSW-SMART-drumline-report-1-July-2022-30-June-2023.pdf
8/08/2022,13:05,Bronze Whaler,254,F,Alive,ID,Sutherland,Wanda Beach,2022-08-08T13:05:00Z,2022,8,BRO,FALSE,TRUE,FALSE,NSW-SMART-drumline-report-1-July-2022-30-June-2023.pdf
28/08/2022,8:26,Bronze Whaler,278,F,Alive,ID,Sutherland,Wanda Beach,2022-08-28T08:26:00Z,2022,8,BRO,FALSE,TRUE,FALSE,NSW-SMART-drumline-report-1-July-2022-30-June-2023.pdf
11/09/2022,9:23,Bronze Whaler,279,F,Alive,ID,Sutherland,Wanda Beach,2022-09-11T09:23:00Z,2022,9,BRO,FALSE,TRUE,FALSE,NSW-SMART-drumline-report-1-July-2022-30-June-2023.pdf
16/09/2022,15:50,Bronze Whaler,242,F,Alive,ID,Sutherland,Wanda Beach,2022-09-16T15:50:00Z,2022,9,BRO,FALSE,TRUE,FALSE,NSW-SMART-drumline-report-1-July-2022-30-June-2023.pdf
24/09/2022,12:39,Bronze Whaler,268,F,Alive,ID,Sutherland,Wanda Beach,2022-09-24T12:39:00Z,2022,9,BRO,FALSE,TRUE,FALSE,NSW-SMART-drumline-report-1-July-2022-30-June-2023.pdf
11/10/2022,16:48,Bronze Whaler,290,F,Alive,ID,Sutherland,Wanda Beach,2022-10-11T16:48:00Z,2022,10,BRO,FALSE,TRUE,FALSE,NSW-SMART-drumline-report-1-July-2022-30-June-2023.pdf
14/10/2022,14:39,Bronze Whaler,286,F,Alive,ID,Sutherland,Wanda Beach,2022-10-14T14:39:00Z,2022,10,BRO,FALSE,TRUE,FALSE,NSW-SMART-drumline-report-1-July-2022-30-June-2023.pdf
29/11/2022,15:15,Tailor,45,NA,Alive,NA,Sutherland,Wanda Beach,2022-11-29T15:15:00Z,2022,11,TLR,FALSE,FALSE,FALSE,NSW-SMART-drumline-report-1-July-2022-30-June-2023.pdf
5/12/2022,NA,Dusky Whaler,100,M,Dead,NA,Sutherland,Wanda Beach,NA,2022,12,DUS,FALSE,FALSE,FALSE,NSW-SMART-drumline-report-1-July-2022-30-June-2023.pdf
15/01/2023,8:45,Tiger Shark,172,F,Alive,"ID, A",Sutherland,Wanda Beach,2023-01-15T08:45:00Z,2023,1,TIG,TRUE,TRUE,TRUE,NSW-SMART-drumline-report-1-July-2022-30-June-2023.pdf
17/01/2023,7:29,Smooth Hammerhead,163,M,Alive,ID,Sutherland,Wanda Beach,2023-01-17T07:29:00Z,2023,1,SMH,FALSE,TRUE,FALSE,NSW-SMART-drumline-report-1-July-2022-30-June-2023.pdf
1/02/2023,13:19,Tiger Shark,224,F,Alive,"ID, A",Sutherland,Wanda Beach,2023-02-01T13:19:00Z,2023,2,TIG,TRUE,TRUE,TRUE,NSW-SMART-drumline-report-1-July-2022-30-June-2023.pdf
19/02/2023,12:12,Dusky Whaler,107,F,Alive,ID,Sutherland,Wanda Beach,2023-02-19T12:12:00Z,2023,2,DUS,FALSE,TRUE,FALSE,NSW-SMART-drumline-report-1-July-2022-30-June-2023.pdf
5/03/2023,16:38,Dusky Whaler,100,F,Alive,ID,Sutherland,Wanda Beach,2023-03-05T16:38:00Z,2023,3,DUS,FALSE,TRUE,FALSE,NSW-SMART-drumline-report-1-July-2022-30-June-2023.pdf
14/03/2023,7:33,Smooth Hammerhead,133,M,Alive,ID,Sutherland,Wanda Beach,2023-03-14T07:33:00Z,2023,3,SMH,FALSE,TRUE,FALSE,NSW-SMART-drumline-report-1-July-2022-30-June-2023.pdf
22/03/2023,7:07,Dusky Whaler,120,M,Alive,ID,Sutherland,Wanda Beach,2023-03-22T07:07:00Z,2023,3,DUS,FALSE,TRUE,FALSE,NSW-SMART-drumline-report-1-July-2022-30-June-2023.pdf
1/04/2023,8:32,Tiger Shark,144,M,Alive,"ID, A",Sutherland,Wanda Beach,2023-04-01T08:32:00Z,2023,4,TIG,TRUE,TRUE,TRUE,NSW-SMART-drumline-report-1-July-2022-30-June-2023.pdf
7/05/2023,14:39,Dusky Whaler,102,M,Alive,ID,Sutherland,Wanda Beach,2023-05-07T14:39:00Z,2023,5,DUS,FALSE,TRUE,FALSE,NSW-SMART-drumline-report-1-July-2022-30-June-2023.pdf
8/07/2022,14:26,Bronze Whaler,276,F,Alive,ID,Wollongong,Wollongong Beach,2022-07-08T14:26:00Z,2022,7,BRO,FALSE,TRUE,FALSE,NSW-SMART-drumline-report-1-July-2022-30-June-2023.pdf
12/07/2022,10:36,Bronze Whaler,271,F,Alive,ID,Wollongong,Wollongong Beach,2022-07-12T10:36:00Z,2022,7,BRO,FALSE,TRUE,FALSE,NSW-SMART-drumline-report-1-July-2022-30-June-2023.pdf
13/07/2022,11:29,Bronze Whaler,277,F,Alive,ID,Wollongong,Wollongong Beach,2022-07-13T11:29:00Z,2022,7,BRO,FALSE,TRUE,FALSE,NSW-SMART-drumline-report-1-July-2022-30-June-2023.pdf
12/09/2022,7:41,Bronze Whaler,260,M,Alive,ID,Wollongong,Wollongong Beach,2022-09-12T07:41:00Z,2022,9,BRO,FALSE,TRUE,FALSE,NSW-SMART-drumline-report-1-July-2022-30-June-2023.pdf
15/04/2023,NA,Snapper,58,NA,Dead,NA,Wollongong,Wollongong Beach,NA,2023,4,SNP,FALSE,FALSE,FALSE,NSW-SMART-drumline-report-1-July-2022-30-June-2023.pdf
6/08/2022,13:36,Bronze Whaler,297,F,Alive,ID,Wollongong,North Wollongong,2022-08-06T13:36:00Z,2022,8,BRO,FALSE,TRUE,FALSE,NSW-SMART-drumline-report-1-July-2022-30-June-2023.pdf
11/05/2023,NA,Snapper,60,NA,Dead,NA,Wollongong,Beach,NA,2023,5,SNP,FALSE,FALSE,FALSE,NSW-SMART-drumline-report-1-July-2022-30-June-2023.pdf
3/02/2023,NA,Smooth Hammerhead,130,M,Dead,NA,Wollongong,Puckeys Beach,NA,2023,2,SMH,FALSE,FALSE,FALSE,NSW-SMART-drumline-report-1-July-2022-30-June-2023.pdf
22/05/2023,NA,Dusky Whaler,109,F,Alive,ID,Wollongong,Puckeys Beach,NA,2023,5,DUS,FALSE,TRUE,FALSE,NSW-SMART-drumline-report-1-July-2022-30-June-2023.pdf
15/07/2022,7:32,Bronze Whaler,228,F,Alive,ID,Wollongong,Towradgi Beach,2022-07-15T07:32:00Z,2022,7,BRO,FALSE,TRUE,FALSE,NSW-SMART-drumline-report-1-July-2022-30-June-2023.pdf
3/02/2023,NA,Dusky Whaler,122,F,Dead,NA,Wollongong,Towradgi Beach,NA,2023,2,DUS,FALSE,FALSE,FALSE,NSW-SMART-drumline-report-1-July-2022-30-June-2023.pdf
15/07/2022,8:34,Bronze Whaler,276,F,Alive,ID,Wollongong,Corrimal Beach,2022-07-15T08:34:00Z,2022,7,BRO,FALSE,TRUE,FALSE,NSW-SMART-drumline-report-1-July-2022-30-June-2023.pdf
18/07/2022,13:25,Black Ray,150,NA,Alive,NA,Wollongong,Corrimal Beach,2022-07-18T13:25:00Z,2022,7,BLR,FALSE,FALSE,FALSE,NSW-SMART-drumline-report-1-July-2022-30-June-2023.pdf
2/08/2022,7:48,Dusky Whaler,272,F,Alive,ID,Wollongong,Corrimal Beach,2022-08-02T07:48:00Z,2022,8,DUS,FALSE,TRUE,FALSE,NSW-SMART-drumline-report-1-July-2022-30-June-2023.pdf
9/01/2023,16:42,Dusky Whaler,141,M,Alive,ID,Wollongong,Corrimal Beach,2023-01-09T16:42:00Z,2023,1,DUS,FALSE,TRUE,FALSE,NSW-SMART-drumline-report-1-July-2022-30-June-2023.pdf
25/01/2023,16:44,Dusky Whaler,105,F,Alive,ID,Wollongong,Corrimal Beach,2023-01-25T16:44:00Z,2023,1,DUS,FALSE,TRUE,FALSE,NSW-SMART-drumline-report-1-July-2022-30-June-2023.pdf
6/02/2023,NA,Dusky Whaler,114,F,Alive,ID,Wollongong,Corrimal Beach,NA,2023,2,DUS,FALSE,TRUE,FALSE,NSW-SMART-drumline-report-1-July-2022-30-June-2023.pdf
28/02/2023,16:09,Dusky Whaler,105,F,Alive,ID,Wollongong,Corrimal Beach,2023-02-28T16:09:00Z,2023,2,DUS,FALSE,TRUE,FALSE,NSW-SMART-drumline-report-1-July-2022-30-June-2023.pdf
4/04/2023,NA,Dusky Whaler,126,F,Alive,ID,Wollongong,Corrimal Beach,NA,2023,4,DUS,FALSE,TRUE,FALSE,NSW-SMART-drumline-report-1-July-2022-30-June-2023.pdf
10/09/2022,7:44,Sevengill Shark,213,M,Alive,ID,Wollongong,Bellambi Beach,2022-09-10T07:44:00Z,2022,9,SVG,FALSE,TRUE,FALSE,NSW-SMART-drumline-report-1-July-2022-30-June-2023.pdf
11/09/2022,7:55,Black Ray,130,NA,Alive,NA,Wollongong,Bellambi Beach,2022-09-11T07:55:00Z,2022,9,BLR,FALSE,FALSE,FALSE,NSW-SMART-drumline-report-1-July-2022-30-June-2023.pdf
9/07/2022,14:05,Bronze Whaler,218,M,Alive,ID,Wollongong,Bulli Beach,2022-07-09T14:05:00Z,2022,7,BRO,FALSE,TRUE,FALSE,NSW-SMART-drumline-report-1-July-2022-30-June-2023.pdf
17/08/2022,8:42,Black Ray,100,NA,Alive,NA,Wollongong,Bulli Beach,2022-08-17T08:42:00Z,2022,8,BLR,FALSE,FALSE,FALSE,NSW-SMART-drumline-report-1-July-2022-30-June-2023.pdf
16/09/2022,8:58,Sevengill Shark,210,M,Alive,ID,Wollongong,Bulli Beach,2022-09-16T08:58:00Z,2022,9,SVG,FALSE,TRUE,FALSE,NSW-SMART-drumline-report-1-July-2022-30-June-2023.pdf
2/10/2022,7:56,Dusky Whaler,293,F,Alive,ID,Wollongong,Bulli Beach,2022-10-02T07:56:00Z,2022,10,DUS,FALSE,TRUE,FALSE,NSW-SMART-drumline-report-1-July-2022-30-June-2023.pdf
11/10/2022,7:45,Dusky Whaler,222,F,Alive,ID,Wollongong,Bulli Beach,2022-10-11T07:45:00Z,2022,10,DUS,FALSE,TRUE,FALSE,NSW-SMART-drumline-report-1-July-2022-30-June-2023.pdf
21/02/2023,8:30,Unidentified whaler,250,NA,Alive,NA,Wollongong,Bulli Beach,2023-02-21T08:30:00Z,2023,2,WHL,FALSE,FALSE,FALSE,NSW-SMART-drumline-report-1-July-2022-30-June-2023.pdf
30/03/2023,6:51,Dusky Whaler,138,M,Alive,ID,Wollongong,Bulli Beach,2023-03-30T06:51:00Z,2023,3,DUS,FALSE,TRUE,FALSE,NSW-SMART-drumline-report-1-July-2022-30-June-2023.pdf
8/04/2023,8:41,Dusky Whaler,142,M,Alive,ID,Wollongong,Bulli Beach,2023-04-08T08:41:00Z,2023,4,DUS,FALSE,TRUE,FALSE,NSW-SMART-drumline-report-1-July-2022-30-June-2023.pdf
15/07/2022,9:25,Black Ray,170,NA,Alive,NA,Wollongong,Sandon Point Beach,2022-07-15T09:25:00Z,2022,7,BLR,FALSE,FALSE,FALSE,NSW-SMART-drumline-report-1-July-2022-30-June-2023.pdf
15/08/2022,8:36,Dusky Whaler,296,F,Alive,ID,Wollongong,Sandon Point Beach,2022-08-15T08:36:00Z,2022,8,DUS,FALSE,TRUE,FALSE,NSW-SMART-drumline-report-1-July-2022-30-June-2023.pdf
19/08/2022,12:02,Bronze Whaler,215,F,Alive,ID,Wollongong,Sandon Point Beach,2022-08-19T12:02:00Z,2022,8,BRO,FALSE,TRUE,FALSE,NSW-SMART-drumline-report-1-July-2022-30-June-2023.pdf
21/08/2022,9:49,Bronze Whaler,265,F,Alive,ID,Wollongong,Sandon Point Beach,2022-08-21T09:49:00Z,2022,8,BRO,FALSE,TRUE,FALSE,NSW-SMART-drumline-report-1-July-2022-30-June-2023.pdf
25/12/2022,NA,Snapper,51,NA,Dead,NA,Wollongong,Sandon Point Beach,NA,2022,12,SNP,FALSE,FALSE,FALSE,NSW-SMART-drumline-report-1-July-2022-30-June-2023.pdf
10/06/2023,8:51,Black Ray,210,F,Alive,NA,Wollongong,Sandon Point Beach,2023-06-10T08:51:00Z,2023,6,BLR,FALSE,FALSE,FALSE,NSW-SMART-drumline-report-1-July-2022-30-June-2023.pdf
13/07/2022,NA,Sevengill Shark,225,M,Alive,ID,Wollongong,Thirroul Beach,NA,2022,7,SVG,FALSE,TRUE,FALSE,NSW-SMART-drumline-report-1-July-2022-30-June-2023.pdf
24/07/2022,8:41,Bronze Whaler,296,F,Alive,ID,Wollongong,Thirroul Beach,2022-07-24T08:41:00Z,2022,7,BRO,FALSE,TRUE,FALSE,NSW-SMART-drumline-report-1-July-2022-30-June-2023.pdf
31/07/2022,10:41,Dusky Whaler,244,F,Alive,ID,Wollongong,Thirroul Beach,2022-07-31T10:41:00Z,2022,7,DUS,FALSE,TRUE,FALSE,NSW-SMART-drumline-report-1-July-2022-30-June-2023.pdf
11/08/2022,10:21,Dusky Whaler,290,F,Alive,ID,Wollongong,Thirroul Beach,2022-08-11T10:21:00Z,2022,8,DUS,FALSE,TRUE,FALSE,NSW-SMART-drumline-report-1-July-2022-30-June-2023.pdf
26/08/2022,11:51,Dusky Whaler,261,F,Alive,ID,Wollongong,Thirroul Beach,2022-08-26T11:51:00Z,2022,8,DUS,FALSE,TRUE,FALSE,NSW-SMART-drumline-report-1-July-2022-30-June-2023.pdf
16/02/2023,NA,Dusky Whaler,95,M,Alive,ID,Wollongong,Thirroul Beach,NA,2023,2,DUS,FALSE,TRUE,FALSE,NSW-SMART-drumline-report-1-July-2022-30-June-2023.pdf
31/03/2023,11:31,Dusky Whaler,129,F,Alive,ID,Wollongong,Thirroul Beach,2023-03-31T11:31:00Z,2023,3,DUS,FALSE,TRUE,FALSE,NSW-SMART-drumline-report-1-July-2022-30-June-2023.pdf
3/04/2023,10:03,Dusky Whaler,120,F,Alive,ID,Wollongong,Thirroul Beach,2023-04-03T10:03:00Z,2023,4,DUS,FALSE,TRUE,FALSE,NSW-SMART-drumline-report-1-July-2022-30-June-2023.pdf
6/04/2023,7:32,Dusky Whaler,107,M,Alive,ID,Wollongong,Thirroul Beach,2023-04-06T07:32:00Z,2023,4,DUS,FALSE,TRUE,FALSE,NSW-SMART-drumline-report-1-July-2022-30-June-2023.pdf
8/04/2023,7:55,Dusky Whaler,107,M,Alive,ID,Wollongong,Thirroul Beach,2023-04-08T07:55:00Z,2023,4,DUS,FALSE,TRUE,FALSE,NSW-SMART-drumline-report-1-July-2022-30-June-2023.pdf
22/04/2023,NA,Dusky Whaler,107,M,Alive,ID,Wollongong,Thirroul Beach,NA,2023,4,DUS,FALSE,TRUE,FALSE,NSW-SMART-drumline-report-1-July-2022-30-June-2023.pdf
29/05/2023,11:19,Bronze Whaler,204,F,Alive,ID,Wollongong,Thirroul Beach,2023-05-29T11:19:00Z,2023,5,BRO,FALSE,TRUE,FALSE,NSW-SMART-drumline-report-1-July-2022-30-June-2023.pdf
12/07/2022,8:22,Sevengill Shark,207,F,Alive,ID,Wollongong,Austinmer Beach,2022-07-12T08:22:00Z,2022,7,SVG,FALSE,TRUE,FALSE,NSW-SMART-drumline-report-1-July-2022-30-June-2023.pdf
2/08/2022,8:55,Bronze Whaler,277,F,Alive,ID,Wollongong,Austinmer Beach,2022-08-02T08:55:00Z,2022,8,BRO,FALSE,TRUE,FALSE,NSW-SMART-drumline-report-1-July-2022-30-June-2023.pdf
17/08/2022,7:47,Bronze Whaler,296,F,Alive,ID,Wollongong,Austinmer Beach,2022-08-17T07:47:00Z,2022,8,BRO,FALSE,TRUE,FALSE,NSW-SMART-drumline-report-1-July-2022-30-June-2023.pdf
13/08/2022,12:21,Bronze Whaler,285,F,Alive,ID,Wollongong,Little Austinmer Beach,2022-08-13T12:21:00Z,2022,8,BRO,FALSE,TRUE,FALSE,NSW-SMART-drumline-report-1-July-2022-30-June-2023.pdf
21/08/2022,10:18,Bronze Whaler,276,F,Alive,ID,Wollongong,Little Austinmer Beach,2022-08-21T10:18:00Z,2022,8,BRO,FALSE,TRUE,FALSE,NSW-SMART-drumline-report-1-July-2022-30-June-2023.pdf
7/03/2023,11:55,Dusky Whaler,110,F,Alive,ID,Wollongong,Little Austinmer Beach,2023-03-07T11:55:00Z,2023,3,DUS,FALSE,TRUE,FALSE,NSW-SMART-drumline-report-1-July-2022-30-June-2023.pdf
12/07/2022,8:47,Bronze Whaler,285,F,Alive,ID,Wollongong,Sharky Beach,2022-07-12T08:47:00Z,2022,7,BRO,FALSE,TRUE,FALSE,NSW-SMART-drumline-report-1-July-2022-30-June-2023.pdf
2/08/2022,9:06,Bronze Whaler,257,F,Alive,ID,Wollongong,Sharky Beach,2022-08-02T09:06:00Z,2022,8,BRO,FALSE,TRUE,FALSE,NSW-SMART-drumline-report-1-July-2022-30-June-2023.pdf
16/08/2022,11:23,Dusky Whaler,270,F,Alive,ID,Wollongong,Coledale Beach,2022-08-16T11:23:00Z,2022,8,DUS,FALSE,TRUE,FALSE,NSW-SMART-drumline-report-1-July-2022-30-June-2023.pdf
20/08/2022,NA,Bronze Whaler,290,F,Alive,ID,Wollongong,Coledale Beach,NA,2022,8,BRO,FALSE,TRUE,FALSE,NSW-SMART-drumline-report-1-July-2022-30-June-2023.pdf
29/10/2022,16:26,Black Ray,150,NA,Alive,NA,Wollongong,Coledale Beach,2022-10-29T16:26:00Z,2022,10,BLR,FALSE,FALSE,FALSE,NSW-SMART-drumline-report-1-July-2022-30-June-2023.pdf
10/12/2022,12:03,Dusky Whaler,153,M,Alive,ID,Shellharbour - Windang to Minnamurra,Minnamurra Beach,2022-12-10T12:03:00Z,2022,12,DUS,FALSE,TRUE,FALSE,NSW-SMART-drumline-report-1-July-2022-30-June-2023.pdf
9/01/2023,9:28,Smooth Hammerhead,149,F,Alive,ID,Shellharbour - Windang to Minnamurra,Minnamurra Beach,2023-01-09T09:28:00Z,2023,1,SMH,FALSE,TRUE,FALSE,NSW-SMART-drumline-report-1-July-2022-30-June-2023.pdf
20/08/2022,11:08,Bronze Whaler,297,F,Alive,ID,Shellharbour - Windang to Minnamurra,Killalea Beach,2022-08-20T11:08:00Z,2022,8,BRO,FALSE,TRUE,FALSE,NSW-SMART-drumline-report-1-July-2022-30-June-2023.pdf
10/12/2022,15:28,White Shark,193,M,Alive,"ID, A",Shellharbour - Windang to Minnamurra,Killalea Beach,2022-12-10T15:28:00Z,2022,12,WHI,TRUE,TRUE,TRUE,NSW-SMART-drumline-report-1-July-2022-30-June-2023.pdf
12/01/2023,11:26,Tiger Shark,181,M,Alive,"ID, A",Shellharbour - Windang to Minnamurra,Killalea Beach,2023-01-12T11:26:00Z,2023,1,TIG,TRUE,TRUE,TRUE,NSW-SMART-drumline-report-1-July-2022-30-June-2023.pdf
15/09/2022,7:44,Sevengill Shark,210,F,Alive,ID,Shellharbour - Windang to Minnamurra,South Beach,2022-09-15T07:44:00Z,2022,9,SVG,FALSE,TRUE,FALSE,NSW-SMART-drumline-report-1-July-2022-30-June-2023.pdf
22/12/2022,12:45,Smooth Hammerhead,240,NA,Alive,NA,Shellharbour - Windang to Minnamurra,South Beach,2022-12-22T12:45:00Z,2022,12,SMH,FALSE,FALSE,FALSE,NSW-SMART-drumline-report-1-July-2022-30-June-2023.pdf
26/01/2023,9:24,Tiger Shark,179,F,Alive,"ID, A",Shellharbour - Windang to Minnamurra,South Beach,2023-01-26T09:24:00Z,2023,1,TIG,TRUE,TRUE,TRUE,NSW-SMART-drumline-report-1-July-2022-30-June-2023.pdf
16/07/2022,9:01,White Shark,212,F,Alive,"ID, A",Shellharbour - Windang to Minnamurra,North Beach,2022-07-16T09:01:00Z,2022,7,WHI,TRUE,TRUE,TRUE,NSW-SMART-drumline-report-1-July-2022-30-June-2023.pdf
15/08/2022,8:10,Bronze Whaler,211,F,Alive,ID,Shellharbour - Windang to Minnamurra,North Beach,2022-08-15T08:10:00Z,2022,8,BRO,FALSE,TRUE,FALSE,NSW-SMART-drumline-report-1-July-2022-30-June-2023.pdf
27/08/2022,10:09,Bronze Whaler,213,F,Alive,ID,Shellharbour - Windang to Minnamurra,North Beach,2022-08-27T10:09:00Z,2022,8,BRO,FALSE,TRUE,FALSE,NSW-SMART-drumline-report-1-July-2022-30-June-2023.pdf
28/11/2022,15:04,Bronze Whaler,268,M,Alive,ID,Shellharbour - Windang to Minnamurra,North Beach,2022-11-28T15:04:00Z,2022,11,BRO,FALSE,TRUE,FALSE,NSW-SMART-drumline-report-1-July-2022-30-June-2023.pdf
1/02/2023,11:32,Tiger Shark,150,M,Alive,"ID, A",Shellharbour - Windang to Minnamurra,North Beach,2023-02-01T11:32:00Z,2023,2,TIG,TRUE,TRUE,TRUE,NSW-SMART-drumline-report-1-July-2022-30-June-2023.pdf
7/09/2022,10:26,Bronze Whaler,260,F,Alive,ID,Shellharbour - Windang to Minnamurra,Warilla Beach,2022-09-07T10:26:00Z,2022,9,BRO,FALSE,TRUE,FALSE,NSW-SMART-drumline-report-1-July-2022-30-June-2023.pdf
10/09/2022,9:21,Bronze Whaler,265,F,Alive,ID,Shellharbour - Windang to Minnamurra,Warilla Beach,2022-09-10T09:21:00Z,2022,9,BRO,FALSE,TRUE,FALSE,NSW-SMART-drumline-report-1-July-2022-30-June-2023.pdf
11/09/2022,12:40,Bronze Whaler,273,F,Alive,ID,Shellharbour - Windang to Minnamurra,Warilla Beach,2022-09-11T12:40:00Z,2022,9,BRO,FALSE,TRUE,FALSE,NSW-SMART-drumline-report-1-July-2022-30-June-2023.pdf
10/10/2022,10:54,Bronze Whaler,272,F,Alive,ID,Shellharbour - Windang to Minnamurra,Warilla Beach,2022-10-10T10:54:00Z,2022,10,BRO,FALSE,TRUE,FALSE,NSW-SMART-drumline-report-1-July-2022-30-June-2023.pdf
10/10/2022,15:57,Bronze Whaler,284,F,Alive,ID,Shellharbour - Windang to Minnamurra,Warilla Beach,2022-10-10T15:57:00Z,2022,10,BRO,FALSE,TRUE,FALSE,NSW-SMART-drumline-report-1-July-2022-30-June-2023.pdf
12/10/2022,11:33,White Shark,178,F,Alive,"ID, A",Shellharbour - Windang to Minnamurra,Warilla Beach,2022-10-12T11:33:00Z,2022,10,WHI,TRUE,TRUE,TRUE,NSW-SMART-drumline-report-1-July-2022-30-June-2023.pdf
5/11/2022,13:36,Bronze Whaler,257,F,Alive,ID,Shellharbour - Windang to Minnamurra,Warilla Beach,2022-11-05T13:36:00Z,2022,11,BRO,FALSE,TRUE,FALSE,NSW-SMART-drumline-report-1-July-2022-30-June-2023.pdf
20/07/2022,12:55,Unidentified whaler,250,NA,Alive,NA,Shellharbour - Windang to Minnamurra,Perkins Beach,2022-07-20T12:55:00Z,2022,7,WHL,FALSE,FALSE,FALSE,NSW-SMART-drumline-report-1-July-2022-30-June-2023.pdf
1/08/2022,8:47,Bronze Whaler,273,F,Alive,ID,Shellharbour - Windang to Minnamurra,Perkins Beach,2022-08-01T08:47:00Z,2022,8,BRO,FALSE,TRUE,FALSE,NSW-SMART-drumline-report-1-July-2022-30-June-2023.pdf
12/09/2022,8:06,Bronze Whaler,231,F,Alive,ID,Shellharbour - Windang to Minnamurra,Perkins Beach,2022-09-12T08:06:00Z,2022,9,BRO,FALSE,TRUE,FALSE,NSW-SMART-drumline-report-1-July-2022-30-June-2023.pdf
15/09/2022,12:29,Bronze Whaler,208,F,Alive,ID,Shellharbour - Windang to Minnamurra,Perkins Beach,2022-09-15T12:29:00Z,2022,9,BRO,FALSE,TRUE,FALSE,NSW-SMART-drumline-report-1-July-2022-30-June-2023.pdf
15/09/2022,12:46,Bronze Whaler,262,F,Alive,ID,Shellharbour - Windang to Minnamurra,Perkins Beach,2022-09-15T12:46:00Z,2022,9,BRO,FALSE,TRUE,FALSE,NSW-SMART-drumline-report-1-July-2022-30-June-2023.pdf
11/01/2023,14:11,Tiger Shark,378,F,Alive,"ID, A",Shellharbour - Windang to Minnamurra,Perkins Beach,2023-01-11T14:11:00Z,2023,1,TIG,TRUE,TRUE,TRUE,NSW-SMART-drumline-report-1-July-2022-30-June-2023.pdf
17/06/2023,9:08,White Shark,202,M,Alive,"ID, A",Shellharbour - Windang to Minnamurra,Perkins Beach,2023-06-17T09:08:00Z,2023,6,WHI,TRUE,TRUE,TRUE,NSW-SMART-drumline-report-1-July-2022-30-June-2023.pdf
9/07/2022,12:39,Bronze Whaler,271,F,Alive,ID,Kiama - Jones Beach to Gerringong,Werri Beach,2022-07-09T12:39:00Z,2022,7,BRO,FALSE,TRUE,FALSE,NSW-SMART-drumline-report-1-July-2022-30-June-2023.pdf
12/07/2022,13:42,Bronze Whaler,290,F,Alive,ID,Kiama - Jones Beach to Gerringong,Werri Beach,2022-07-12T13:42:00Z,2022,7,BRO,FALSE,TRUE,FALSE,NSW-SMART-drumline-report-1-July-2022-30-June-2023.pdf
16/07/2022,10:45,Bronze Whaler,251,M,Alive,ID,Kiama - Jones Beach to Gerringong,Werri Beach,2022-07-16T10:45:00Z,2022,7,BRO,FALSE,TRUE,FALSE,NSW-SMART-drumline-report-1-July-2022-30-June-2023.pdf
28/07/2022,13:09,Bronze Whaler,245,M,Alive,ID,Kiama - Jones Beach to Gerringong,Werri Beach,2022-07-28T13:09:00Z,2022,7,BRO,FALSE,TRUE,FALSE,NSW-SMART-drumline-report-1-July-2022-30-June-2023.pdf
1/08/2022,10:45,Bronze Whaler,215,F,Alive,ID,Kiama - Jones Beach to Gerringong,Werri Beach,2022-08-01T10:45:00Z,2022,8,BRO,FALSE,TRUE,FALSE,NSW-SMART-drumline-report-1-July-2022-30-June-2023.pdf
1/08/2022,15:12,White Shark,241,F,Alive,"ID, A",Kiama - Jones Beach to Gerringong,Werri Beach,2022-08-01T15:12:00Z,2022,8,WHI,TRUE,TRUE,TRUE,NSW-SMART-drumline-report-1-July-2022-30-June-2023.pdf
11/08/2022,11:25,Thresher Shark,279,M,Alive,ID,Kiama - Jones Beach to Gerringong,Werri Beach,2022-08-11T11:25:00Z,2022,8,THR,FALSE,TRUE,FALSE,NSW-SMART-drumline-report-1-July-2022-30-June-2023.pdf
12/08/2022,11:27,Smooth Hammerhead,149,F,Alive,ID,Kiama - Jones Beach to Gerringong,Werri Beach,2022-08-12T11:27:00Z,2022,8,SMH,FALSE,TRUE,FALSE,NSW-SMART-drumline-report-1-July-2022-30-June-2023.pdf
14/08/2022,11:21,Bronze Whaler,179,F,Alive,ID,Kiama - Jones Beach to Gerringong,Werri Beach,2022-08-14T11:21:00Z,2022,8,BRO,FALSE,TRUE,FALSE,NSW-SMART-drumline-report-1-July-2022-30-June-2023.pdf
14/08/2022,13:11,White Shark,158,M,Alive,"ID, A",Kiama - Jones Beach to Gerringong,Werri Beach,2022-08-14T13:11:00Z,2022,8,WHI,TRUE,TRUE,TRUE,NSW-SMART-drumline-report-1-July-2022-30-June-2023.pdf
16/08/2022,11:12,Bronze Whaler,303,F,Alive,ID,Kiama - Jones Beach to Gerringong,Werri Beach,2022-08-16T11:12:00Z,2022,8,BRO,FALSE,TRUE,FALSE,NSW-SMART-drumline-report-1-July-2022-30-June-2023.pdf
17/08/2022,11:09,Bronze Whaler,180,F,Alive,ID,Kiama - Jones Beach to Gerringong,Werri Beach,2022-08-17T11:09:00Z,2022,8,BRO,FALSE,TRUE,FALSE,NSW-SMART-drumline-report-1-July-2022-30-June-2023.pdf
25/08/2022,9:54,Bronze Whaler,287,F,Alive,ID,Kiama - Jones Beach to Gerringong,Werri Beach,2022-08-25T09:54:00Z,2022,8,BRO,FALSE,TRUE,FALSE,NSW-SMART-drumline-report-1-July-2022-30-June-2023.pdf
29/08/2022,11:04,Bronze Whaler,288,F,Alive,ID,Kiama - Jones Beach to Gerringong,Werri Beach,2022-08-29T11:04:00Z,2022,8,BRO,FALSE,TRUE,FALSE,NSW-SMART-drumline-report-1-July-2022-30-June-2023.pdf
15/09/2022,10:48,Bronze Whaler,251,F,Alive,ID,Kiama - Jones Beach to Gerringong,Werri Beach,2022-09-15T10:48:00Z,2022,9,BRO,FALSE,TRUE,FALSE,NSW-SMART-drumline-report-1-July-2022-30-June-2023.pdf
29/10/2022,10:03,Bronze Whaler,220,M,Alive,ID,Kiama - Jones Beach to Gerringong,Werri Beach,2022-10-29T10:03:00Z,2022,10,BRO,FALSE,TRUE,FALSE,NSW-SMART-drumline-report-1-July-2022-30-June-2023.pdf
4/11/2022,12:25,Bronze Whaler,190,M,Alive,ID,Kiama - Jones Beach to Gerringong,Werri Beach,2022-11-04T12:25:00Z,2022,11,BRO,FALSE,TRUE,FALSE,NSW-SMART-drumline-report-1-July-2022-30-June-2023.pdf
21/12/2022,16:09,Bronze Whaler,262,M,Alive,ID,Kiama - Jones Beach to Gerringong,Werri Beach,2022-12-21T16:09:00Z,2022,12,BRO,FALSE,TRUE,FALSE,NSW-SMART-drumline-report-1-July-2022-30-June-2023.pdf
16/01/2023,10:29,Tiger Shark,179,M,Alive,"ID, A",Kiama - Jones Beach to Gerringong,Werri Beach,2023-01-16T10:29:00Z,2023,1,TIG,TRUE,TRUE,TRUE,NSW-SMART-drumline-report-1-July-2022-30-June-2023.pdf
17/01/2023,14:34,Dusky Whaler,159,M,Alive,ID,Kiama - Jones Beach to Gerringong,Werri Beach,2023-01-17T14:34:00Z,2023,1,DUS,FALSE,TRUE,FALSE,NSW-SMART-drumline-report-1-July-2022-30-June-2023.pdf
4/03/2023,9:26,Tiger Shark,141,M,Alive,"ID, A",Kiama - Jones Beach to Gerringong,Werri Beach,2023-03-04T09:26:00Z,2023,3,TIG,TRUE,TRUE,TRUE,NSW-SMART-drumline-report-1-July-2022-30-June-2023.pdf
26/04/2023,7:39,Mako,114,F,Alive,ID,Kiama - Jones Beach to Gerringong,Werri Beach,2023-04-26T07:39:00Z,2023,4,SMA,FALSE,TRUE,FALSE,NSW-SMART-drumline-report-1-July-2022-30-June-2023.pdf
11/05/2023,14:36,Black Ray,160,F,Alive,NA,Kiama - Jones Beach to Gerringong,Werri Beach,2023-05-11T14:36:00Z,2023,5,BLR,FALSE,FALSE,FALSE,NSW-SMART-drumline-report-1-July-2022-30-June-2023.pdf
12/05/2023,9:53,Dusky Whaler,178,M,Alive,ID,Kiama - Jones Beach to Gerringong,Werri Beach,2023-05-12T09:53:00Z,2023,5,DUS,FALSE,TRUE,FALSE,NSW-SMART-drumline-report-1-July-2022-30-June-2023.pdf
24/05/2023,14:29,Dusky Whaler,120,F,Alive,ID,Kiama - Jones Beach to Gerringong,Werri Beach,2023-05-24T14:29:00Z,2023,5,DUS,FALSE,TRUE,FALSE,NSW-SMART-drumline-report-1-July-2022-30-June-2023.pdf
15/06/2023,8:54,White Shark,223,F,Alive,"ID, A",Kiama - Jones Beach to Gerringong,Werri Beach,2023-06-15T08:54:00Z,2023,6,WHI,TRUE,TRUE,TRUE,NSW-SMART-drumline-report-1-July-2022-30-June-2023.pdf
22/06/2023,9:21,White Shark,275,M,Alive,"ID, A",Kiama - Jones Beach to Gerringong,Werri Beach,2023-06-22T09:21:00Z,2023,6,WHI,TRUE,TRUE,TRUE,NSW-SMART-drumline-report-1-July-2022-30-June-2023.pdf
12/07/2022,9:09,Sevengill Shark,200,M,Alive,ID,Kiama - Jones Beach to Gerringong,Easts Beach,2022-07-12T09:09:00Z,2022,7,SVG,FALSE,TRUE,FALSE,NSW-SMART-drumline-report-1-July-2022-30-June-2023.pdf
21/07/2022,9:01,Bronze Whaler,179,M,Alive,ID,Kiama - Jones Beach to Gerringong,Easts Beach,2022-07-21T09:01:00Z,2022,7,BRO,FALSE,TRUE,FALSE,NSW-SMART-drumline-report-1-July-2022-30-June-2023.pdf
24/04/2023,10:47,Dusky Whaler,107,M,Alive,ID,Kiama - Jones Beach to Gerringong,Easts Beach,2023-04-24T10:47:00Z,2023,4,DUS,FALSE,TRUE,FALSE,NSW-SMART-drumline-report-1-July-2022-30-June-2023.pdf
7/09/2022,15:25,White Shark,251,F,Alive,ID,Kiama - Jones Beach to Gerringong,Kendalls Beach,2022-09-07T15:25:00Z,2022,9,WHI,TRUE,TRUE,FALSE,NSW-SMART-drumline-report-1-July-2022-30-June-2023.pdf
12/07/2022,14:30,Bronze Whaler,260,F,Alive,ID,Kiama - Jones Beach to Gerringong,Surf Beach,2022-07-12T14:30:00Z,2022,7,BRO,FALSE,TRUE,FALSE,NSW-SMART-drumline-report-1-July-2022-30-June-2023.pdf
17/08/2022,9:30,Black Ray,160,F,Alive,NA,Kiama - Jones Beach to Gerringong,Surf Beach,2022-08-17T09:30:00Z,2022,8,BLR,FALSE,FALSE,FALSE,NSW-SMART-drumline-report-1-July-2022-30-June-2023.pdf
12/07/2022,11:54,Bronze Whaler,240,F,Alive,ID,Kiama - Jones Beach to Gerringong,Bombo Beach,2022-07-12T11:54:00Z,2022,7,BRO,FALSE,TRUE,FALSE,NSW-SMART-drumline-report-1-July-2022-30-June-2023.pdf
15/07/2022,9:24,Dusky Whaler,270,F,Alive,ID,Kiama - Jones Beach to Gerringong,Bombo Beach,2022-07-15T09:24:00Z,2022,7,DUS,FALSE,TRUE,FALSE,NSW-SMART-drumline-report-1-July-2022-30-June-2023.pdf
20/07/2022,13:15,Unidentified whaler,210,NA,Alive,NA,Kiama - Jones Beach to Gerringong,Bombo Beach,2022-07-20T13:15:00Z,2022,7,WHL,FALSE,FALSE,FALSE,NSW-SMART-drumline-report-1-July-2022-30-June-2023.pdf
8/08/2022,9:07,Bronze Whaler,299,F,Alive,ID,Kiama - Jones Beach to Gerringong,Bombo Beach,2022-08-08T09:07:00Z,2022,8,BRO,FALSE,TRUE,FALSE,NSW-SMART-drumline-report-1-July-2022-30-June-2023.pdf
24/07/2022,10:27,Bronze Whaler,282,F,Alive,ID,Kiama - Jones Beach to Gerringong,Jones Beach,2022-07-24T10:27:00Z,2022,7,BRO,FALSE,TRUE,FALSE,NSW-SMART-drumline-report-1-July-2022-30-June-2023.pdf
25/07/2022,10:36,Bronze Whaler,256,F,Alive,ID,Kiama - Jones Beach to Gerringong,Jones Beach,2022-07-25T10:36:00Z,2022,7,BRO,FALSE,TRUE,FALSE,NSW-SMART-drumline-report-1-July-2022-30-June-2023.pdf
25/09/2022,10:43,Bronze Whaler,201,F,Alive,ID,Kiama - Jones Beach to Gerringong,Jones Beach,2022-09-25T10:43:00Z,2022,9,BRO,FALSE,TRUE,FALSE,NSW-SMART-drumline-report-1-July-2022-30-June-2023.pdf
2/10/2022,NA,Dusky Whaler,153,M,Dead,NA,Kiama - Jones Beach to Gerringong,Jones Beach,NA,2022,10,DUS,FALSE,FALSE,FALSE,NSW-SMART-drumline-report-1-July-2022-30-June-2023.pdf
18/09/2022,NA,Bronze Whaler,262,F,Alive,ID,Eurobodalla - Surf Beach to Barlings Beach,Surf Beach,NA,2022,9,BRO,FALSE,TRUE,FALSE,NSW-SMART-drumline-report-1-July-2022-30-June-2023.pdf
18/11/2022,7:48,Sevengill Shark,221,M,Alive,ID,Eurobodalla - Surf Beach to Barlings Beach,Surf Beach,2022-11-18T07:48:00Z,2022,11,SVG,FALSE,TRUE,FALSE,NSW-SMART-drumline-report-1-July-2022-30-June-2023.pdf
7/12/2022,13:21,Bronze Whaler,198,M,Alive,ID,Eurobodalla - Surf Beach to Barlings Beach,Surf Beach,2022-12-07T13:21:00Z,2022,12,BRO,FALSE,TRUE,FALSE,NSW-SMART-drumline-report-1-July-2022-30-June-2023.pdf
12/01/2023,9:58,Dusky Whaler,206,F,Alive,ID,Eurobodalla - Surf Beach to Barlings Beach,Surf Beach,2023-01-12T09:58:00Z,2023,1,DUS,FALSE,TRUE,FALSE,NSW-SMART-drumline-report-1-July-2022-30-June-2023.pdf
17/01/2023,12:25,Dusky Whaler,209,F,Alive,ID,Eurobodalla - Surf Beach to Barlings Beach,Surf Beach,2023-01-17T12:25:00Z,2023,1,DUS,FALSE,TRUE,FALSE,NSW-SMART-drumline-report-1-July-2022-30-June-2023.pdf
15/04/2023,6:58,Smooth Hammerhead,161,M,Alive,ID,Eurobodalla - Surf Beach to Barlings Beach,Surf Beach,2023-04-15T06:58:00Z,2023,4,SMH,FALSE,TRUE,FALSE,NSW-SMART-drumline-report-1-July-2022-30-June-2023.pdf
4/05/2023,7:31,Bronze Whaler,293,F,Alive,ID,Eurobodalla - Surf Beach to Barlings Beach,Surf Beach,2023-05-04T07:31:00Z,2023,5,BRO,FALSE,TRUE,FALSE,NSW-SMART-drumline-report-1-July-2022-30-June-2023.pdf
12/05/2023,NA,Mako,96,F,Alive,ID,Eurobodalla - Surf Beach to Barlings Beach,Surf Beach,NA,2023,5,SMA,FALSE,TRUE,FALSE,NSW-SMART-drumline-report-1-July-2022-30-June-2023.pdf
13/06/2023,NA,Sevengill Shark,157,M,Alive,ID,Eurobodalla - Surf Beach to Barlings Beach,Surf Beach,NA,2023,6,SVG,FALSE,TRUE,FALSE,NSW-SMART-drumline-report-1-July-2022-30-June-2023.pdf
29/07/2022,12:03,Bronze Whaler,309,F,Alive,ID,Eurobodalla - Surf Beach to Barlings Beach,Circuit Beach,2022-07-29T12:03:00Z,2022,7,BRO,FALSE,TRUE,FALSE,NSW-SMART-drumline-report-1-July-2022-30-June-2023.pdf
19/09/2022,16:17,Mako,224,F,Alive,ID,Eurobodalla - Surf Beach to Barlings Beach,Circuit Beach,2022-09-19T16:17:00Z,2022,9,SMA,FALSE,TRUE,FALSE,NSW-SMART-drumline-report-1-July-2022-30-June-2023.pdf
22/11/2022,7:33,Smooth Hammerhead,189,F,Alive,ID,Eurobodalla - Surf Beach to Barlings Beach,Circuit Beach,2022-11-22T07:33:00Z,2022,11,SMH,FALSE,TRUE,FALSE,NSW-SMART-drumline-report-1-July-2022-30-June-2023.pdf
2/12/2022,16:58,Bronze Whaler,217,F,Alive,ID,Eurobodalla - Surf Beach to Barlings Beach,Circuit Beach,2022-12-02T16:58:00Z,2022,12,BRO,FALSE,TRUE,FALSE,NSW-SMART-drumline-report-1-July-2022-30-June-2023.pdf
21/12/2022,18:00,Bronze Whaler,280,NA,Alive,NA,Eurobodalla - Surf Beach to Barlings Beach,Circuit Beach,2022-12-21T18:00:00Z,2022,12,BRO,FALSE,FALSE,FALSE,NSW-SMART-drumline-report-1-July-2022-30-June-2023.pdf
13/01/2023,8:30,Bronze Whaler,251,M,Alive,ID,Eurobodalla - Surf Beach to Barlings Beach,Circuit Beach,2023-01-13T08:30:00Z,2023,1,BRO,FALSE,TRUE,FALSE,NSW-SMART-drumline-report-1-July-2022-30-June-2023.pdf
12/07/2022,11:39,Unidentified whaler,260,NA,Alive,NA,Eurobodalla - Surf Beach to Barlings Beach,Lilli Pilli Beach,2022-07-12T11:39:00Z,2022,7,WHL,FALSE,FALSE,FALSE,NSW-SMART-drumline-report-1-July-2022-30-June-2023.pdf
29/10/2022,8:40,School Shark,163,F,Alive,ID,Eurobodalla - Surf Beach to Barlings Beach,Lilli Pilli Beach,2022-10-29T08:40:00Z,2022,10,SCL,FALSE,TRUE,FALSE,NSW-SMART-drumline-report-1-July-2022-30-June-2023.pdf
31/05/2023,8:31,Bronze Whaler,272,F,Alive,ID,Eurobodalla - Surf Beach to Barlings Beach,Lilli Pilli Beach,2023-05-31T08:31:00Z,2023,5,BRO,FALSE,TRUE,FALSE,NSW-SMART-drumline-report-1-July-2022-30-June-2023.pdf
13/06/2023,9:54,Bronze Whaler,257,F,Alive,ID,Eurobodalla - Surf Beach to Barlings Beach,Lilli Pilli Beach,2023-06-13T09:54:00Z,2023,6,BRO,FALSE,TRUE,FALSE,NSW-SMART-drumline-report-1-July-2022-30-June-2023.pdf
30/07/2022,10:02,Bronze Whaler,299,F,Alive,ID,Eurobodalla - Surf Beach to Barlings Beach,Garden Bay Beach,2022-07-30T10:02:00Z,2022,7,BRO,FALSE,TRUE,FALSE,NSW-SMART-drumline-report-1-July-2022-30-June-2023.pdf
31/08/2022,10:23,Bronze Whaler,266,F,Alive,ID,Eurobodalla - Surf Beach to Barlings Beach,Garden Bay Beach,2022-08-31T10:23:00Z,2022,8,BRO,FALSE,TRUE,FALSE,NSW-SMART-drumline-report-1-July-2022-30-June-2023.pdf
18/09/2022,9:04,Bronze Whaler,271,F,Alive,ID,Eurobodalla - Surf Beach to Barlings Beach,Garden Bay Beach,2022-09-18T09:04:00Z,2022,9,BRO,FALSE,TRUE,FALSE,NSW-SMART-drumline-report-1-July-2022-30-June-2023.pdf
4/02/2023,9:40,Tiger Shark,155,F,Alive,ID,Eurobodalla - Surf Beach to Barlings Beach,Garden Bay Beach,2023-02-04T09:40:00Z,2023,2,TIG,TRUE,TRUE,FALSE,NSW-SMART-drumline-report-1-July-2022-30-June-2023.pdf
20/02/2023,10:32,Dusky Whaler,238,F,Alive,ID,Eurobodalla - Surf Beach to Barlings Beach,Garden Bay Beach,2023-02-20T10:32:00Z,2023,2,DUS,FALSE,TRUE,FALSE,NSW-SMART-drumline-report-1-July-2022-30-June-2023.pdf
15/06/2023,9:52,Bronze Whaler,257,F,Alive,ID,Eurobodalla - Surf Beach to Barlings Beach,Garden Bay Beach,2023-06-15T09:52:00Z,2023,6,BRO,FALSE,TRUE,FALSE,NSW-SMART-drumline-report-1-July-2022-30-June-2023.pdf
21/07/2022,7:50,Blue Shark,210,F,Alive,ID,Eurobodalla - Surf Beach to Barlings Beach,Malua Bay Beach,2022-07-21T07:50:00Z,2022,7,BLU,FALSE,TRUE,FALSE,NSW-SMART-drumline-report-1-July-2022-30-June-2023.pdf
17/09/2022,12:21,Bronze Whaler,254,M,Alive,ID,Eurobodalla - Surf Beach to Barlings Beach,Malua Bay Beach,2022-09-17T12:21:00Z,2022,9,BRO,FALSE,TRUE,FALSE,NSW-SMART-drumline-report-1-July-2022-30-June-2023.pdf
27/09/2022,14:33,Bronze Whaler,262,M,Alive,ID,Eurobodalla - Surf Beach to Barlings Beach,Malua Bay Beach,2022-09-27T14:33:00Z,2022,9,BRO,FALSE,TRUE,FALSE,NSW-SMART-drumline-report-1-July-2022-30-June-2023.pdf
17/10/2022,14:05,School Shark,154,F,Alive,ID,Eurobodalla - Surf Beach to Barlings Beach,Malua Bay Beach,2022-10-17T14:05:00Z,2022,10,SCL,FALSE,TRUE,FALSE,NSW-SMART-drumline-report-1-July-2022-30-June-2023.pdf
24/07/2022,11:25,Bronze Whaler,320,F,Alive,ID,Eurobodalla - Surf Beach to Barlings Beach,McKenzies Beach,2022-07-24T11:25:00Z,2022,7,BRO,FALSE,TRUE,FALSE,NSW-SMART-drumline-report-1-July-2022-30-June-2023.pdf
29/01/2023,15:31,Bronze Whaler,298,F,Alive,ID,Eurobodalla - Surf Beach to Barlings Beach,McKenzies Beach,2023-01-29T15:31:00Z,2023,1,BRO,FALSE,TRUE,FALSE,NSW-SMART-drumline-report-1-July-2022-30-June-2023.pdf
1/02/2023,17:58,Dusky Whaler,165,F,Alive,ID,Eurobodalla - Surf Beach to Barlings Beach,McKenzies Beach,2023-02-01T17:58:00Z,2023,2,DUS,FALSE,TRUE,FALSE,NSW-SMART-drumline-report-1-July-2022-30-June-2023.pdf
5/02/2023,8:59,Smooth Hammerhead,184,F,Alive,ID,Eurobodalla - Surf Beach to Barlings Beach,McKenzies Beach,2023-02-05T08:59:00Z,2023,2,SMH,FALSE,TRUE,FALSE,NSW-SMART-drumline-report-1-July-2022-30-June-2023.pdf
5/02/2023,13:00,Dusky Whaler,185,M,Alive,ID,Eurobodalla - Surf Beach to Barlings Beach,McKenzies Beach,2023-02-05T13:00:00Z,2023,2,DUS,FALSE,TRUE,FALSE,NSW-SMART-drumline-report-1-July-2022-30-June-2023.pdf
8/02/2023,9:35,Smooth Hammerhead,159,M,Alive,ID,Eurobodalla - Surf Beach to Barlings Beach,McKenzies Beach,2023-02-08T09:35:00Z,2023,2,SMH,FALSE,TRUE,FALSE,NSW-SMART-drumline-report-1-July-2022-30-June-2023.pdf
27/02/2023,8:41,Bronze Whaler,252,M,Alive,ID,Eurobodalla - Surf Beach to Barlings Beach,McKenzies Beach,2023-02-27T08:41:00Z,2023,2,BRO,FALSE,TRUE,FALSE,NSW-SMART-drumline-report-1-July-2022-30-June-2023.pdf
28/02/2023,16:38,Mako,128,F,Alive,ID,Eurobodalla - Surf Beach to Barlings Beach,McKenzies Beach,2023-02-28T16:38:00Z,2023,2,SMA,FALSE,TRUE,FALSE,NSW-SMART-drumline-report-1-July-2022-30-June-2023.pdf
9/03/2023,9:18,Smooth Hammerhead,168,F,Alive,ID,Eurobodalla - Surf Beach to Barlings Beach,McKenzies Beach,2023-03-09T09:18:00Z,2023,3,SMH,FALSE,TRUE,FALSE,NSW-SMART-drumline-report-1-July-2022-30-June-2023.pdf
12/04/2023,10:57,Dusky Whaler,226,F,Alive,ID,Eurobodalla - Surf Beach to Barlings Beach,McKenzies Beach,2023-04-12T10:57:00Z,2023,4,DUS,FALSE,TRUE,FALSE,NSW-SMART-drumline-report-1-July-2022-30-June-2023.pdf
25/04/2023,8:45,Smooth Hammerhead,181,F,Alive,ID,Eurobodalla - Surf Beach to Barlings Beach,McKenzies Beach,2023-04-25T08:45:00Z,2023,4,SMH,FALSE,TRUE,FALSE,NSW-SMART-drumline-report-1-July-2022-30-June-2023.pdf
12/07/2022,9:19,Bronze Whaler,214,F,Alive,ID,Eurobodalla - Surf Beach to Barlings Beach,Rosedale Beach,2022-07-12T09:19:00Z,2022,7,BRO,FALSE,TRUE,FALSE,NSW-SMART-drumline-report-1-July-2022-30-June-2023.pdf
28/07/2022,11:39,Bronze Whaler,291,F,Alive,ID,Eurobodalla - Surf Beach to Barlings Beach,Rosedale Beach,2022-07-28T11:39:00Z,2022,7,BRO,FALSE,TRUE,FALSE,NSW-SMART-drumline-report-1-July-2022-30-June-2023.pdf
15/10/2022,13:30,Bronze Whaler,282,F,Alive,ID,Eurobodalla - Surf Beach to Barlings Beach,Rosedale Beach,2022-10-15T13:30:00Z,2022,10,BRO,FALSE,TRUE,FALSE,NSW-SMART-drumline-report-1-July-2022-30-June-2023.pdf
23/10/2022,8:22,Bronze Whaler,191,F,Alive,ID,Eurobodalla - Surf Beach to Barlings Beach,Rosedale Beach,2022-10-23T08:22:00Z,2022,10,BRO,FALSE,TRUE,FALSE,NSW-SMART-drumline-report-1-July-2022-30-June-2023.pdf
30/10/2022,14:08,Bronze Whaler,249,F,Alive,ID,Eurobodalla - Surf Beach to Barlings Beach,Rosedale Beach,2022-10-30T14:08:00Z,2022,10,BRO,FALSE,TRUE,FALSE,NSW-SMART-drumline-report-1-July-2022-30-June-2023.pdf
16/11/2022,16:13,Bronze Whaler,253,F,Alive,ID,Eurobodalla - Surf Beach to Barlings Beach,Rosedale Beach,2022-11-16T16:13:00Z,2022,11,BRO,FALSE,TRUE,FALSE,NSW-SMART-drumline-report-1-July-2022-30-June-2023.pdf
11/01/2023,16:27,Smooth Hammerhead,246,F,Alive,ID,Eurobodalla - Surf Beach to Barlings Beach,Rosedale Beach,2023-01-11T16:27:00Z,2023,1,SMH,FALSE,TRUE,FALSE,NSW-SMART-drumline-report-1-July-2022-30-June-2023.pdf
16/01/2023,8:06,Dusky Whaler,222,M,Alive,ID,Eurobodalla - Surf Beach to Barlings Beach,Rosedale Beach,2023-01-16T08:06:00Z,2023,1,DUS,FALSE,TRUE,FALSE,NSW-SMART-drumline-report-1-July-2022-30-June-2023.pdf
25/01/2023,16:43,Dusky Whaler,211,F,Alive,ID,Eurobodalla - Surf Beach to Barlings Beach,Rosedale Beach,2023-01-25T16:43:00Z,2023,1,DUS,FALSE,TRUE,FALSE,NSW-SMART-drumline-report-1-July-2022-30-June-2023.pdf
28/02/2023,11:37,Dusky Whaler,199,F,Alive,ID,Eurobodalla - Surf Beach to Barlings Beach,Rosedale Beach,2023-02-28T11:37:00Z,2023,2,DUS,FALSE,TRUE,FALSE,NSW-SMART-drumline-report-1-July-2022-30-June-2023.pdf
10/03/2023,7:43,Smooth Hammerhead,154,M,Alive,ID,Eurobodalla - Surf Beach to Barlings Beach,Rosedale Beach,2023-03-10T07:43:00Z,2023,3,SMH,FALSE,TRUE,FALSE,NSW-SMART-drumline-report-1-July-2022-30-June-2023.pdf
14/03/2023,8:28,Smooth Hammerhead,160,F,Alive,ID,Eurobodalla - Surf Beach to Barlings Beach,Rosedale Beach,2023-03-14T08:28:00Z,2023,3,SMH,FALSE,TRUE,FALSE,NSW-SMART-drumline-report-1-July-2022-30-June-2023.pdf
16/03/2023,15:17,Dusky Whaler,223,F,Alive,ID,Eurobodalla - Surf Beach to Barlings Beach,Rosedale Beach,2023-03-16T15:17:00Z,2023,3,DUS,FALSE,TRUE,FALSE,NSW-SMART-drumline-report-1-July-2022-30-June-2023.pdf
24/04/2023,15:38,Bronze Whaler,257,M,Alive,ID,Eurobodalla - Surf Beach to Barlings Beach,Rosedale Beach,2023-04-24T15:38:00Z,2023,4,BRO,FALSE,TRUE,FALSE,NSW-SMART-drumline-report-1-July-2022-30-June-2023.pdf
12/05/2023,14:00,Mako,245,M,Alive,ID,Eurobodalla - Surf Beach to Barlings Beach,Rosedale Beach,2023-05-12T14:00:00Z,2023,5,SMA,FALSE,TRUE,FALSE,NSW-SMART-drumline-report-1-July-2022-30-June-2023.pdf
28/06/2023,NA,Tiger Shark,161,F,Alive,"ID, A",Eurobodalla - Surf Beach to Barlings Beach,Rosedale Beach,NA,2023,6,TIG,TRUE,TRUE,TRUE,NSW-SMART-drumline-report-1-July-2022-30-June-2023.pdf
21/07/2022,8:30,Bronze Whaler,278,F,Alive,ID,Eurobodalla - Surf Beach to Barlings Beach,Burrewarra Point,2022-07-21T08:30:00Z,2022,7,BRO,FALSE,TRUE,FALSE,NSW-SMART-drumline-report-1-July-2022-30-June-2023.pdf
26/11/2022,11:28,Smooth Hammerhead,258,F,Alive,ID,Eurobodalla - Surf Beach to Barlings Beach,Burrewarra Point,2022-11-26T11:28:00Z,2022,11,SMH,FALSE,TRUE,FALSE,NSW-SMART-drumline-report-1-July-2022-30-June-2023.pdf
6/05/2023,13:22,Dusky Whaler,218,M,Alive,ID,Eurobodalla - Surf Beach to Barlings Beach,Burrewarra Point,2023-05-06T13:22:00Z,2023,5,DUS,FALSE,TRUE,FALSE,NSW-SMART-drumline-report-1-July-2022-30-June-2023.pdf
10/05/2023,10:58,Bronze Whaler,155,M,Alive,ID,Eurobodalla - Surf Beach to Barlings Beach,Burrewarra Point,2023-05-10T10:58:00Z,2023,5,BRO,FALSE,TRUE,FALSE,NSW-SMART-drumline-report-1-July-2022-30-June-2023.pdf
12/07/2022,11:31,Bronze Whaler,255,F,Alive,ID,Eurobodalla - Surf Beach to Barlings Beach,Barlings Beach,2022-07-12T11:31:00Z,2022,7,BRO,FALSE,TRUE,FALSE,NSW-SMART-drumline-report-1-July-2022-30-June-2023.pdf
13/07/2022,8:44,Bronze Whaler,273,F,Alive,ID,Eurobodalla - Surf Beach to Barlings Beach,Barlings Beach,2022-07-13T08:44:00Z,2022,7,BRO,FALSE,TRUE,FALSE,NSW-SMART-drumline-report-1-July-2022-30-June-2023.pdf
21/07/2022,10:12,Bronze Whaler,288,F,Alive,ID,Eurobodalla - Surf Beach to Barlings Beach,Barlings Beach,2022-07-21T10:12:00Z,2022,7,BRO,FALSE,TRUE,FALSE,NSW-SMART-drumline-report-1-July-2022-30-June-2023.pdf
2/08/2022,10:20,Bronze Whaler,277,F,Alive,ID,Eurobodalla - Surf Beach to Barlings Beach,Barlings Beach,2022-08-02T10:20:00Z,2022,8,BRO,FALSE,TRUE,FALSE,NSW-SMART-drumline-report-1-July-2022-30-June-2023.pdf
17/09/2022,8:26,Bronze Whaler,298,F,Alive,ID,Eurobodalla - Surf Beach to Barlings Beach,Barlings Beach,2022-09-17T08:26:00Z,2022,9,BRO,FALSE,TRUE,FALSE,NSW-SMART-drumline-report-1-July-2022-30-June-2023.pdf
19/10/2022,13:04,Bronze Whaler,292,F,Alive,ID,Eurobodalla - Surf Beach to Barlings Beach,Barlings Beach,2022-10-19T13:04:00Z,2022,10,BRO,FALSE,TRUE,FALSE,NSW-SMART-drumline-report-1-July-2022-30-June-2023.pdf
4/11/2022,12:41,Bronze Whaler,291,F,Alive,ID,Eurobodalla - Surf Beach to Barlings Beach,Barlings Beach,2022-11-04T12:41:00Z,2022,11,BRO,FALSE,TRUE,FALSE,NSW-SMART-drumline-report-1-July-2022-30-June-2023.pdf
16/11/2022,17:16,Bronze Whaler,225,F,Alive,ID,Eurobodalla - Surf Beach to Barlings Beach,Barlings Beach,2022-11-16T17:16:00Z,2022,11,BRO,FALSE,TRUE,FALSE,NSW-SMART-drumline-report-1-July-2022-30-June-2023.pdf
24/11/2022,10:21,Bronze Whaler,166,F,Alive,ID,Eurobodalla - Surf Beach to Barlings Beach,Barlings Beach,2022-11-24T10:21:00Z,2022,11,BRO,FALSE,TRUE,FALSE,NSW-SMART-drumline-report-1-July-2022-30-June-2023.pdf
2/12/2022,17:41,Bronze Whaler,163,F,Alive,ID,Eurobodalla - Surf Beach to Barlings Beach,Barlings Beach,2022-12-02T17:41:00Z,2022,12,BRO,FALSE,TRUE,FALSE,NSW-SMART-drumline-report-1-July-2022-30-June-2023.pdf
3/12/2022,NA,Mako,112,F,Dead,NA,Eurobodalla - Surf Beach to Barlings Beach,Barlings Beach,NA,2022,12,SMA,FALSE,FALSE,FALSE,NSW-SMART-drumline-report-1-July-2022-30-June-2023.pdf
7/12/2022,12:55,Smooth Hammerhead,187,M,Alive,ID,Eurobodalla - Surf Beach to Barlings Beach,Barlings Beach,2022-12-07T12:55:00Z,2022,12,SMH,FALSE,TRUE,FALSE,NSW-SMART-drumline-report-1-July-2022-30-June-2023.pdf
10/12/2022,NA,Dusky Whaler,142,F,Alive,ID,Eurobodalla - Surf Beach to Barlings Beach,Barlings Beach,NA,2022,12,DUS,FALSE,TRUE,FALSE,NSW-SMART-drumline-report-1-July-2022-30-June-2023.pdf
14/12/2022,13:48,Bronze Whaler,188,F,Alive,ID,Eurobodalla - Surf Beach to Barlings Beach,Barlings Beach,2022-12-14T13:48:00Z,2022,12,BRO,FALSE,TRUE,FALSE,NSW-SMART-drumline-report-1-July-2022-30-June-2023.pdf
1/01/2023,NA,Dusky Whaler,101,M,Alive,ID,Eurobodalla - Surf Beach to Barlings Beach,Barlings Beach,NA,2023,1,DUS,FALSE,TRUE,FALSE,NSW-SMART-drumline-report-1-July-2022-30-June-2023.pdf
8/01/2023,11:59,Common Blacktip,227,M,Alive,ID,Eurobodalla - Surf Beach to Barlings Beach,Barlings Beach,2023-01-08T11:59:00Z,2023,1,CBT,FALSE,TRUE,FALSE,NSW-SMART-drumline-report-1-July-2022-30-June-2023.pdf
8/01/2023,14:08,Dusky Whaler,213,F,Alive,ID,Eurobodalla - Surf Beach to Barlings Beach,Barlings Beach,2023-01-08T14:08:00Z,2023,1,DUS,FALSE,TRUE,FALSE,NSW-SMART-drumline-report-1-July-2022-30-June-2023.pdf
16/01/2023,11:08,Smooth Hammerhead,179,F,Alive,ID,Eurobodalla - Surf Beach to Barlings Beach,Barlings Beach,2023-01-16T11:08:00Z,2023,1,SMH,FALSE,TRUE,FALSE,NSW-SMART-drumline-report-1-July-2022-30-June-2023.pdf
17/01/2023,10:12,Bronze Whaler,206,F,Alive,ID,Eurobodalla - Surf Beach to Barlings Beach,Barlings Beach,2023-01-17T10:12:00Z,2023,1,BRO,FALSE,TRUE,FALSE,NSW-SMART-drumline-report-1-July-2022-30-June-2023.pdf
2/02/2023,8:44,Smooth Hammerhead,158,M,Alive,ID,Eurobodalla - Surf Beach to Barlings Beach,Barlings Beach,2023-02-02T08:44:00Z,2023,2,SMH,FALSE,TRUE,FALSE,NSW-SMART-drumline-report-1-July-2022-30-June-2023.pdf
5/02/2023,17:44,Dusky Whaler,213,F,Alive,ID,Eurobodalla - Surf Beach to Barlings Beach,Barlings Beach,2023-02-05T17:44:00Z,2023,2,DUS,FALSE,TRUE,FALSE,NSW-SMART-drumline-report-1-July-2022-30-June-2023.pdf
8/02/2023,11:17,Tiger Shark,198,F,Alive,"ID, A",Eurobodalla - Surf Beach to Barlings Beach,Barlings Beach,2023-02-08T11:17:00Z,2023,2,TIG,TRUE,TRUE,TRUE,NSW-SMART-drumline-report-1-July-2022-30-June-2023.pdf
8/02/2023,11:55,Smooth Hammerhead,158,M,Alive,ID,Eurobodalla - Surf Beach to Barlings Beach,Barlings Beach,2023-02-08T11:55:00Z,2023,2,SMH,FALSE,TRUE,FALSE,NSW-SMART-drumline-report-1-July-2022-30-June-2023.pdf
23/03/2023,10:48,Smooth Hammerhead,170,M,Alive,ID,Eurobodalla - Surf Beach to Barlings Beach,Barlings Beach,2023-03-23T10:48:00Z,2023,3,SMH,FALSE,TRUE,FALSE,NSW-SMART-drumline-report-1-July-2022-30-June-2023.pdf
6/04/2023,13:32,Bronze Whaler,273,M,Alive,ID,Eurobodalla - Surf Beach to Barlings Beach,Barlings Beach,2023-04-06T13:32:00Z,2023,4,BRO,FALSE,TRUE,FALSE,NSW-SMART-drumline-report-1-July-2022-30-June-2023.pdf
17/04/2023,10:34,Smooth Hammerhead,151,M,Alive,ID,Eurobodalla - Surf Beach to Barlings Beach,Barlings Beach,2023-04-17T10:34:00Z,2023,4,SMH,FALSE,TRUE,FALSE,NSW-SMART-drumline-report-1-July-2022-30-June-2023.pdf
4/05/2023,15:08,Bronze Whaler,238,F,Alive,ID,Eurobodalla - Surf Beach to Barlings Beach,Barlings Beach,2023-05-04T15:08:00Z,2023,5,BRO,FALSE,TRUE,FALSE,NSW-SMART-drumline-report-1-July-2022-30-June-2023.pdf
31/05/2023,11:29,White Shark,228,F,Alive,"ID, A",Eurobodalla - Surf Beach to Barlings Beach,Barlings Beach,2023-05-31T11:29:00Z,2023,5,WHI,TRUE,TRUE,TRUE,NSW-SMART-drumline-report-1-July-2022-30-June-2023.pdf
2/06/2023,13:54,Bronze Whaler,293,F,Alive,ID,Eurobodalla - Surf Beach to Barlings Beach,Barlings Beach,2023-06-02T13:54:00Z,2023,6,BRO,FALSE,TRUE,FALSE,NSW-SMART-drumline-report-1-July-2022-30-June-2023.pdf
5/06/2023,13:04,White Shark,208,M,Alive,"ID, A",Eurobodalla - Surf Beach to Barlings Beach,Barlings Beach,2023-06-05T13:04:00Z,2023,6,WHI,TRUE,TRUE,TRUE,NSW-SMART-drumline-report-1-July-2022-30-June-2023.pdf
16/06/2023,12:46,White Shark,211,M,Alive,"ID, A",Eurobodalla - Surf Beach to Barlings Beach,Barlings Beach,2023-06-16T12:46:00Z,2023,6,WHI,TRUE,TRUE,TRUE,NSW-SMART-drumline-report-1-July-2022-30-June-2023.pdf
18/08/2022,12:12,Mako,400,NA,Alive,NA,Merimbula - Pambula to Tura Head,Pambula Beach,2022-08-18T12:12:00Z,2022,8,SMA,FALSE,FALSE,FALSE,NSW-SMART-drumline-report-1-July-2022-30-June-2023.pdf
21/08/2022,8:45,White Shark,207,M,Alive,"ID, A",Merimbula - Pambula to Tura Head,Pambula Beach,2022-08-21T08:45:00Z,2022,8,WHI,TRUE,TRUE,TRUE,NSW-SMART-drumline-report-1-July-2022-30-June-2023.pdf
15/09/2022,8:27,Thresher Shark,192,F,Alive,ID,Merimbula - Pambula to Tura Head,Pambula Beach,2022-09-15T08:27:00Z,2022,9,THR,FALSE,TRUE,FALSE,NSW-SMART-drumline-report-1-July-2022-30-June-2023.pdf
7/11/2022,10:03,Bronze Whaler,300,M,Alive,ID,Merimbula - Pambula to Tura Head,Pambula Beach,2022-11-07T10:03:00Z,2022,11,BRO,FALSE,TRUE,FALSE,NSW-SMART-drumline-report-1-July-2022-30-June-2023.pdf
21/11/2022,14:30,Bronze Whaler,250,F,Alive,ID,Merimbula - Pambula to Tura Head,Pambula Beach,2022-11-21T14:30:00Z,2022,11,BRO,FALSE,TRUE,FALSE,NSW-SMART-drumline-report-1-July-2022-30-June-2023.pdf
5/12/2022,12:57,Bronze Whaler,188,M,Alive,ID,Merimbula - Pambula to Tura Head,Pambula Beach,2022-12-05T12:57:00Z,2022,12,BRO,FALSE,TRUE,FALSE,NSW-SMART-drumline-report-1-July-2022-30-June-2023.pdf
7/12/2022,17:30,Bronze Whaler,273,F,Alive,ID,Merimbula - Pambula to Tura Head,Pambula Beach,2022-12-07T17:30:00Z,2022,12,BRO,FALSE,TRUE,FALSE,NSW-SMART-drumline-report-1-July-2022-30-June-2023.pdf
9/12/2022,9:45,Bronze Whaler,242,M,Alive,ID,Merimbula - Pambula to Tura Head,Pambula Beach,2022-12-09T09:45:00Z,2022,12,BRO,FALSE,TRUE,FALSE,NSW-SMART-drumline-report-1-July-2022-30-June-2023.pdf
29/12/2022,13:10,White Shark,311,M,Alive,"ID, A",Merimbula - Pambula to Tura Head,Pambula Beach,2022-12-29T13:10:00Z,2022,12,WHI,TRUE,TRUE,TRUE,NSW-SMART-drumline-report-1-July-2022-30-June-2023.pdf
30/12/2022,18:33,Bronze Whaler,206,M,Alive,ID,Merimbula - Pambula to Tura Head,Pambula Beach,2022-12-30T18:33:00Z,2022,12,BRO,FALSE,TRUE,FALSE,NSW-SMART-drumline-report-1-July-2022-30-June-2023.pdf
16/01/2023,8:16,Bronze Whaler,280,NA,Alive,ID,Merimbula - Pambula to Tura Head,Pambula Beach,2023-01-16T08:16:00Z,2023,1,BRO,FALSE,TRUE,FALSE,NSW-SMART-drumline-report-1-July-2022-30-June-2023.pdf
21/01/2023,15:13,Bronze Whaler,269,M,Alive,ID,Merimbula - Pambula to Tura Head,Pambula Beach,2023-01-21T15:13:00Z,2023,1,BRO,FALSE,TRUE,FALSE,NSW-SMART-drumline-report-1-July-2022-30-June-2023.pdf
25/01/2023,14:09,Bronze Whaler,287,M,Alive,ID,Merimbula - Pambula to Tura Head,Pambula Beach,2023-01-25T14:09:00Z,2023,1,BRO,FALSE,TRUE,FALSE,NSW-SMART-drumline-report-1-July-2022-30-June-2023.pdf
31/01/2023,9:59,White Shark,166,M,Alive,"ID, A",Merimbula - Pambula to Tura Head,Pambula Beach,2023-01-31T09:59:00Z,2023,1,WHI,TRUE,TRUE,TRUE,NSW-SMART-drumline-report-1-July-2022-30-June-2023.pdf
3/02/2023,11:02,Smooth Hammerhead,154,M,Alive,ID,Merimbula - Pambula to Tura Head,Pambula Beach,2023-02-03T11:02:00Z,2023,2,SMH,FALSE,TRUE,FALSE,NSW-SMART-drumline-report-1-July-2022-30-June-2023.pdf
3/02/2023,12:24,Tiger Shark,148,F,Alive,"ID, A",Merimbula - Pambula to Tura Head,Pambula Beach,2023-02-03T12:24:00Z,2023,2,TIG,TRUE,TRUE,TRUE,NSW-SMART-drumline-report-1-July-2022-30-June-2023.pdf
23/02/2023,11:20,White Shark,212,F,Alive,"ID, A",Merimbula - Pambula to Tura Head,Pambula Beach,2023-02-23T11:20:00Z,2023,2,WHI,TRUE,TRUE,TRUE,NSW-SMART-drumline-report-1-July-2022-30-June-2023.pdf
27/02/2023,8:10,Smooth Hammerhead,176,F,Alive,ID,Merimbula - Pambula to Tura Head,Pambula Beach,2023-02-27T08:10:00Z,2023,2,SMH,FALSE,TRUE,FALSE,NSW-SMART-drumline-report-1-July-2022-30-June-2023.pdf
28/02/2023,8:42,White Shark,132,F,Alive,"ID, A",Merimbula - Pambula to Tura Head,Pambula Beach,2023-02-28T08:42:00Z,2023,2,WHI,TRUE,TRUE,TRUE,NSW-SMART-drumline-report-1-July-2022-30-June-2023.pdf
26/03/2023,10:54,Smooth Hammerhead,147,M,Alive,ID,Merimbula - Pambula to Tura Head,Pambula Beach,2023-03-26T10:54:00Z,2023,3,SMH,FALSE,TRUE,FALSE,NSW-SMART-drumline-report-1-July-2022-30-June-2023.pdf
1/04/2023,9:32,Mako,247,F,Alive,ID,Merimbula - Pambula to Tura Head,Pambula Beach,2023-04-01T09:32:00Z,2023,4,SMA,FALSE,TRUE,FALSE,NSW-SMART-drumline-report-1-July-2022-30-June-2023.pdf
25/04/2023,15:08,Tiger Shark,400,F,Alive,NA,Merimbula - Pambula to Tura Head,Pambula Beach,2023-04-25T15:08:00Z,2023,4,TIG,TRUE,FALSE,FALSE,NSW-SMART-drumline-report-1-July-2022-30-June-2023.pdf
3/05/2023,9:07,White Shark,212,F,Alive,"ID, A",Merimbula - Pambula to Tura Head,Pambula Beach,2023-05-03T09:07:00Z,2023,5,WHI,TRUE,TRUE,TRUE,NSW-SMART-drumline-report-1-July-2022-30-June-2023.pdf
30/05/2023,23:49,Mako,248,F,Alive,ID,Merimbula - Pambula to Tura Head,Pambula Beach,2023-05-30T23:49:00Z,2023,5,SMA,FALSE,TRUE,FALSE,NSW-SMART-drumline-report-1-July-2022-30-June-2023.pdf
16/09/2022,7:25,Thresher Shark,178,F,Alive,ID,Merimbula - Pambula to Tura Head,"Main Beach, Merimbula",2022-09-16T07:25:00Z,2022,9,THR,FALSE,TRUE,FALSE,NSW-SMART-drumline-report-1-July-2022-30-June-2023.pdf
25/11/2022,10:21,Bronze Whaler,214,F,Alive,ID,Merimbula - Pambula to Tura Head,"Main Beach, Merimbula",2022-11-25T10:21:00Z,2022,11,BRO,FALSE,TRUE,FALSE,NSW-SMART-drumline-report-1-July-2022-30-June-2023.pdf
5/12/2022,14:33,Bronze Whaler,238,M,Alive,ID,Merimbula - Pambula to Tura Head,"Main Beach, Merimbula",2022-12-05T14:33:00Z,2022,12,BRO,FALSE,TRUE,FALSE,NSW-SMART-drumline-report-1-July-2022-30-June-2023.pdf
12/01/2023,8:43,Bronze Whaler,286,M,Alive,ID,Merimbula - Pambula to Tura Head,"Main Beach, Merimbula",2023-01-12T08:43:00Z,2023,1,BRO,FALSE,TRUE,FALSE,NSW-SMART-drumline-report-1-July-2022-30-June-2023.pdf
22/01/2023,18:23,White Shark,209,F,Alive,"ID, A",Merimbula - Pambula to Tura Head,"Main Beach, Merimbula",2023-01-22T18:23:00Z,2023,1,WHI,TRUE,TRUE,TRUE,NSW-SMART-drumline-report-1-July-2022-30-June-2023.pdf
10/02/2023,9:57,Smooth Hammerhead,165,F,Alive,ID,Merimbula - Pambula to Tura Head,"Main Beach, Merimbula",2023-02-10T09:57:00Z,2023,2,SMH,FALSE,TRUE,FALSE,NSW-SMART-drumline-report-1-July-2022-30-June-2023.pdf
26/02/2023,NA,Tiger Shark,130,F,Alive,"ID, A",Merimbula - Pambula to Tura Head,"Main Beach, Merimbula",NA,2023,2,TIG,TRUE,TRUE,TRUE,NSW-SMART-drumline-report-1-July-2022-30-June-2023.pdf
21/04/2023,13:43,White Shark,216,M,Alive,"ID, A",Merimbula - Pambula to Tura Head,"Main Beach, Merimbula",2023-04-21T13:43:00Z,2023,4,WHI,TRUE,TRUE,TRUE,NSW-SMART-drumline-report-1-July-2022-30-June-2023.pdf
29/04/2023,7:29,White Shark,225,M,Alive,"ID, A",Merimbula - Pambula to Tura Head,"Main Beach, Merimbula",2023-04-29T07:29:00Z,2023,4,WHI,TRUE,TRUE,TRUE,NSW-SMART-drumline-report-1-July-2022-30-June-2023.pdf
29/04/2023,10:38,White Shark,198,M,Alive,"ID, A",Merimbula - Pambula to Tura Head,"Main Beach, Merimbula",2023-04-29T10:38:00Z,2023,4,WHI,TRUE,TRUE,TRUE,NSW-SMART-drumline-report-1-July-2022-30-June-2023.pdf
17/06/2023,14:39,Seal,170,NA,Alive,NA,Merimbula - Pambula to Tura Head,"Main Beach, Merimbula",2023-06-17T14:39:00Z,2023,6,SEL,FALSE,FALSE,FALSE,NSW-SMART-drumline-report-1-July-2022-30-June-2023.pdf
1/12/2022,12:42,Bronze Whaler,260,M,Alive,ID,Merimbula - Pambula to Tura Head,Middle Beach,2022-12-01T12:42:00Z,2022,12,BRO,FALSE,TRUE,FALSE,NSW-SMART-drumline-report-1-July-2022-30-June-2023.pdf
11/12/2022,9:32,Bronze Whaler,NA,M,Alive,NA,Merimbula - Pambula to Tura Head,Middle Beach,2022-12-11T09:32:00Z,2022,12,BRO,FALSE,FALSE,FALSE,NSW-SMART-drumline-report-1-July-2022-30-June-2023.pdf
14/05/2023,9:51,Bronze Whaler,229,F,Alive,ID,Merimbula - Pambula to Tura Head,Middle Beach,2023-05-14T09:51:00Z,2023,5,BRO,FALSE,TRUE,FALSE,NSW-SMART-drumline-report-1-July-2022-30-June-2023.pdf
12/07/2022,10:30,Bronze Whaler,284,F,Alive,ID,Merimbula - Pambula to Tura Head,Short Point,2022-07-12T10:30:00Z,2022,7,BRO,FALSE,TRUE,FALSE,NSW-SMART-drumline-report-1-July-2022-30-June-2023.pdf
17/09/2022,14:45,White Shark,285,F,Alive,"ID, A",Merimbula - Pambula to Tura Head,Short Point,2022-09-17T14:45:00Z,2022,9,WHI,TRUE,TRUE,TRUE,NSW-SMART-drumline-report-1-July-2022-30-June-2023.pdf
2/10/2022,15:09,Thresher Shark,200,NA,Alive,NA,Merimbula - Pambula to Tura Head,Short Point,2022-10-02T15:09:00Z,2022,10,THR,FALSE,FALSE,FALSE,NSW-SMART-drumline-report-1-July-2022-30-June-2023.pdf
4/10/2022,12:11,Bronze Whaler,216,F,Alive,ID,Merimbula - Pambula to Tura Head,Short Point,2022-10-04T12:11:00Z,2022,10,BRO,FALSE,TRUE,FALSE,NSW-SMART-drumline-report-1-July-2022-30-June-2023.pdf
11/11/2022,9:30,Bronze Whaler,220,F,Alive,ID,Merimbula - Pambula to Tura Head,Short Point,2022-11-11T09:30:00Z,2022,11,BRO,FALSE,TRUE,FALSE,NSW-SMART-drumline-report-1-July-2022-30-June-2023.pdf
15/11/2022,16:13,Bronze Whaler,263,F,Alive,ID,Merimbula - Pambula to Tura Head,Short Point,2022-11-15T16:13:00Z,2022,11,BRO,FALSE,TRUE,FALSE,NSW-SMART-drumline-report-1-July-2022-30-June-2023.pdf
23/11/2022,9:04,Bronze Whaler,182,F,Alive,ID,Merimbula - Pambula to Tura Head,Short Point,2022-11-23T09:04:00Z,2022,11,BRO,FALSE,TRUE,FALSE,NSW-SMART-drumline-report-1-July-2022-30-June-2023.pdf
1/12/2022,12:36,Bronze Whaler,237,M,Alive,ID,Merimbula - Pambula to Tura Head,Short Point,2022-12-01T12:36:00Z,2022,12,BRO,FALSE,TRUE,FALSE,NSW-SMART-drumline-report-1-July-2022-30-June-2023.pdf
24/01/2023,9:12,Smooth Hammerhead,178,M,Alive,ID,Merimbula - Pambula to Tura Head,Short Point,2023-01-24T09:12:00Z,2023,1,SMH,FALSE,TRUE,FALSE,NSW-SMART-drumline-report-1-July-2022-30-June-2023.pdf
3/02/2023,10:03,Smooth Hammerhead,202,F,Alive,ID,Merimbula - Pambula to Tura Head,Short Point,2023-02-03T10:03:00Z,2023,2,SMH,FALSE,TRUE,FALSE,NSW-SMART-drumline-report-1-July-2022-30-June-2023.pdf
5/02/2023,11:39,Tiger Shark,262,F,Alive,"ID, A",Merimbula - Pambula to Tura Head,Short Point,2023-02-05T11:39:00Z,2023,2,TIG,TRUE,TRUE,TRUE,NSW-SMART-drumline-report-1-July-2022-30-June-2023.pdf
8/02/2023,11:46,Mako,149,F,Alive,ID,Merimbula - Pambula to Tura Head,Short Point,2023-02-08T11:46:00Z,2023,2,SMA,FALSE,TRUE,FALSE,NSW-SMART-drumline-report-1-July-2022-30-June-2023.pdf
13/02/2023,12:59,Smooth Hammerhead,160,M,Alive,ID,Merimbula - Pambula to Tura Head,Short Point,2023-02-13T12:59:00Z,2023,2,SMH,FALSE,TRUE,FALSE,NSW-SMART-drumline-report-1-July-2022-30-June-2023.pdf
16/02/2023,10:37,Bronze Whaler,277,M,Alive,ID,Merimbula - Pambula to Tura Head,Short Point,2023-02-16T10:37:00Z,2023,2,BRO,FALSE,TRUE,FALSE,NSW-SMART-drumline-report-1-July-2022-30-June-2023.pdf
27/02/2023,13:49,Bronze Whaler,208,M,Alive,ID,Merimbula - Pambula to Tura Head,Short Point,2023-02-27T13:49:00Z,2023,2,BRO,FALSE,TRUE,FALSE,NSW-SMART-drumline-report-1-July-2022-30-June-2023.pdf
24/03/2023,16:45,White Shark,214,F,Alive,"ID, A",Merimbula - Pambula to Tura Head,Short Point,2023-03-24T16:45:00Z,2023,3,WHI,TRUE,TRUE,TRUE,NSW-SMART-drumline-report-1-July-2022-30-June-2023.pdf
26/03/2023,10:37,Tiger Shark,169,M,Alive,"ID, A",Merimbula - Pambula to Tura Head,Short Point,2023-03-26T10:37:00Z,2023,3,TIG,TRUE,TRUE,TRUE,NSW-SMART-drumline-report-1-July-2022-30-June-2023.pdf
30/03/2023,13:41,Dusky Whaler,174,F,Alive,ID,Merimbula - Pambula to Tura Head,Short Point,2023-03-30T13:41:00Z,2023,3,DUS,FALSE,TRUE,FALSE,NSW-SMART-drumline-report-1-July-2022-30-June-2023.pdf
5/04/2023,11:45,Mako,124,M,Alive,ID,Merimbula - Pambula to Tura Head,Short Point,2023-04-05T11:45:00Z,2023,4,SMA,FALSE,TRUE,FALSE,NSW-SMART-drumline-report-1-July-2022-30-June-2023.pdf
22/05/2023,14:43,White Shark,203,F,Alive,"ID, A",Merimbula - Pambula to Tura Head,Short Point,2023-05-22T14:43:00Z,2023,5,WHI,TRUE,TRUE,TRUE,NSW-SMART-drumline-report-1-July-2022-30-June-2023.pdf
4/06/2023,12:53,White Shark,125,F,Alive,"ID, A",Merimbula - Pambula to Tura Head,Short Point,2023-06-04T12:53:00Z,2023,6,WHI,TRUE,TRUE,TRUE,NSW-SMART-drumline-report-1-July-2022-30-June-2023.pdf
29/11/2022,10:03,Bronze Whaler,241,F,Alive,ID,Merimbula - Pambula to Tura Head,Tura Beach,2022-11-29T10:03:00Z,2022,11,BRO,FALSE,TRUE,FALSE,NSW-SMART-drumline-report-1-July-2022-30-June-2023.pdf
5/12/2022,15:15,White Shark,188,M,Alive,"ID, A",Merimbula - Pambula to Tura Head,Tura Beach,2022-12-05T15:15:00Z,2022,12,WHI,TRUE,TRUE,TRUE,NSW-SMART-drumline-report-1-July-2022-30-June-2023.pdf
16/01/2023,13:43,Bronze Whaler,236,F,Alive,ID,Merimbula - Pambula to Tura Head,Tura Beach,2023-01-16T13:43:00Z,2023,1,BRO,FALSE,TRUE,FALSE,NSW-SMART-drumline-report-1-July-2022-30-June-2023.pdf
23/01/2023,14:41,Bronze Whaler,283,M,Alive,ID,Merimbula - Pambula to Tura Head,Tura Beach,2023-01-23T14:41:00Z,2023,1,BRO,FALSE,TRUE,FALSE,NSW-SMART-drumline-report-1-July-2022-30-June-2023.pdf
3/02/2023,13:41,Tiger Shark,140,M,Alive,"ID, A",Merimbula - Pambula to Tura Head,Tura Beach,2023-02-03T13:41:00Z,2023,2,TIG,TRUE,TRUE,TRUE,NSW-SMART-drumline-report-1-July-2022-30-June-2023.pdf
17/02/2023,9:19,Mako,209,F,Alive,ID,Merimbula - Pambula to Tura Head,Tura Beach,2023-02-17T09:19:00Z,2023,2,SMA,FALSE,TRUE,FALSE,NSW-SMART-drumline-report-1-July-2022-30-June-2023.pdf
