Date,Time,Species,Size_cm,Sex,Status,Tags,SD_region,Beach,DateTime,Year,Month,Species_Code,Target_Shark,Has_ID_Tag,Has_Acoustic_Tag,Source_PDF
29/07/2023,13:23,White Shark,334,M,Alive,"ID, A",Ballina,Angels Beach,2023-07-29T13:23:00Z,2023,7,WHI,TRUE,TRUE,TRUE,2023-24-NSW-SMART-drumline-annual-report.pdf
15/12/2023,8:45,Tiger Shark,218,F,Alive,"ID, A",Ballina,Angels Beach,2023-12-15T08:45:00Z,2023,12,TIG,TRUE,TRUE,TRUE,2023-24-NSW-SMART-drumline-annual-report.pdf
4/01/2024,7:27,Common Blacktip,181,M,Alive,ID,Ballina,Angels Beach,2024-01-04T07:27:00Z,2024,1,CBT,FALSE,TRUE,FALSE,2023-24-NSW-SMART-drumline-annual-report.pdf
7/01/2024,12:59,Common Blacktip,NA,NA,Dead,NA,Ballina,Angels Beach,2024-01-07T12:59:00Z,2024,1,CBT,FALSE,FALSE,FALSE,2023-24-NSW-SMART-drumline-annual-report.pdf
28/01/2024,16:43,Great Hammerhead,280,NA,Alive,NA,Ballina,Angels Beach,2024-01-28T16:43:00Z,2024,1,GHH,FALSE,FALSE,FALSE,2023-24-NSW-SMART-drumline-annual-report.pdf
29/07/2023,11:07,White Shark,305,M,Alive,"ID, A",Ballina,Boulders Beach,2023-07-29T11:07:00Z,2023,7,WHI,TRUE,TRUE,TRUE,2023-24-NSW-SMART-drumline-annual-report.pdf
13/09/2023,10:10,Silky Whaler,330,F,Alive,ID,Ballina,Boulders Beach,2023-09-13T10:10:00Z,2023,9,UNK,FALSE,TRUE,FALSE,2023-24-NSW-SMART-drumline-annual-report.pdf
28/11/2023,NA,Smooth Hammerhead,153,M,Alive,ID,Ballina,Boulders Beach,NA,2023,11,SMH,FALSE,TRUE,FALSE,2023-24-NSW-SMART-drumline-annual-report.pdf
24/12/2023,9:24,Smooth Hammerhead,179,M,Alive,ID,Ballina,Boulders Beach,2023-12-24T09:24:00Z,2023,12,SMH,FALSE,TRUE,FALSE,2023-24-NSW-SMART-drumline-annual-report.pdf
8/04/2024,14:33,Common Blacktip,136,F,Alive,ID,Ballina,Boulders Beach,2024-04-08T14:33:00Z,2024,4,CBT,FALSE,TRUE,FALSE,2023-24-NSW-SMART-drumline-annual-report.pdf
6/06/2024,10:23,Tiger Shark,258,F,Alive,"ID, A",Ballina,Boulders Beach,2024-06-06T10:23:00Z,2024,6,TIG,TRUE,TRUE,TRUE,2023-24-NSW-SMART-drumline-annual-report.pdf
23/06/2024,10:39,Tiger Shark,173,M,Alive,"ID, A",Ballina,Boulders Beach,2024-06-23T10:39:00Z,2024,6,TIG,TRUE,TRUE,TRUE,2023-24-NSW-SMART-drumline-annual-report.pdf
5/08/2023,7:23,Greynurse Shark,233,M,Alive,ID,Ballina,Lennox Headland,2023-08-05T07:23:00Z,2023,8,GRN,FALSE,TRUE,FALSE,2023-24-NSW-SMART-drumline-annual-report.pdf
5/08/2023,11:45,Dusky Whaler,308,F,Alive,ID,Ballina,Lennox Headland,2023-08-05T11:45:00Z,2023,8,DUS,FALSE,TRUE,FALSE,2023-24-NSW-SMART-drumline-annual-report.pdf
8/12/2023,7:36,Shortfin Mako Shark,335,F,Alive,ID,Ballina,Lennox Headland,2023-12-08T07:36:00Z,2023,12,SMA,FALSE,TRUE,FALSE,2023-24-NSW-SMART-drumline-annual-report.pdf
12/12/2023,9:03,Smooth Hammerhead,177,M,Alive,ID,Ballina,Lennox Headland,2023-12-12T09:03:00Z,2023,12,SMH,FALSE,TRUE,FALSE,2023-24-NSW-SMART-drumline-annual-report.pdf
30/07/2023,7:08,White Shark,263,F,Alive,"ID, A",Ballina,Lighthouse Beach,2023-07-30T07:08:00Z,2023,7,WHI,TRUE,TRUE,TRUE,2023-24-NSW-SMART-drumline-annual-report.pdf
25/08/2023,11:45,White Shark,189,F,Alive,"ID, A",Ballina,Lighthouse Beach,2023-08-25T11:45:00Z,2023,8,WHI,TRUE,TRUE,TRUE,2023-24-NSW-SMART-drumline-annual-report.pdf
5/12/2023,7:10,White Shark,227,F,Alive,"ID, A",Ballina,Lighthouse Beach,2023-12-05T07:10:00Z,2023,12,WHI,TRUE,TRUE,TRUE,2023-24-NSW-SMART-drumline-annual-report.pdf
2/02/2024,8:12,Bull Shark,204,M,Alive,"ID, A",Ballina,Lighthouse Beach,2024-02-02T08:12:00Z,2024,2,BUL,TRUE,TRUE,TRUE,2023-24-NSW-SMART-drumline-annual-report.pdf
19/03/2024,12:14,Bull Shark,242,F,Alive,"ID, A",Ballina,Lighthouse Beach,2024-03-19T12:14:00Z,2024,3,BUL,TRUE,TRUE,TRUE,2023-24-NSW-SMART-drumline-annual-report.pdf
28/04/2024,6:37,Bull Shark,216,F,Alive,"ID, A",Ballina,Lighthouse Beach,2024-04-28T06:37:00Z,2024,4,BUL,TRUE,TRUE,TRUE,2023-24-NSW-SMART-drumline-annual-report.pdf
6/07/2023,12:44,Bull Shark,280,F,Alive,"ID, A",Ballina,Main Beach,2023-07-06T12:44:00Z,2023,7,BUL,TRUE,TRUE,TRUE,2023-24-NSW-SMART-drumline-annual-report.pdf
7/07/2023,14:52,Dusky Whaler,282,M,Alive,ID,Ballina,Main Beach,2023-07-07T14:52:00Z,2023,7,DUS,FALSE,TRUE,FALSE,2023-24-NSW-SMART-drumline-annual-report.pdf
12/07/2023,8:52,Shortfin Mako Shark,186,M,Alive,ID,Ballina,Main Beach,2023-07-12T08:52:00Z,2023,7,SMA,FALSE,TRUE,FALSE,2023-24-NSW-SMART-drumline-annual-report.pdf
9/08/2023,11:58,Smooth Hammerhead,168,F,Alive,ID,Ballina,Main Beach,2023-08-09T11:58:00Z,2023,8,SMH,FALSE,TRUE,FALSE,2023-24-NSW-SMART-drumline-annual-report.pdf
18/08/2023,14:12,Greynurse Shark,249,M,Alive,ID,Ballina,Main Beach,2023-08-18T14:12:00Z,2023,8,GRN,FALSE,TRUE,FALSE,2023-24-NSW-SMART-drumline-annual-report.pdf
27/08/2023,14:45,White Shark,280,F,Alive,"ID, A",Ballina,Main Beach,2023-08-27T14:45:00Z,2023,8,WHI,TRUE,TRUE,TRUE,2023-24-NSW-SMART-drumline-annual-report.pdf
1/09/2023,15:07,Bronze Whaler,267,M,Alive,ID,Ballina,Main Beach,2023-09-01T15:07:00Z,2023,9,BRO,FALSE,TRUE,FALSE,2023-24-NSW-SMART-drumline-annual-report.pdf
13/09/2023,13:38,Bronze Whaler,263,M,Alive,ID,Ballina,Main Beach,2023-09-13T13:38:00Z,2023,9,BRO,FALSE,TRUE,FALSE,2023-24-NSW-SMART-drumline-annual-report.pdf
10/10/2023,11:56,Common Blacktip,162,F,Alive,ID,Ballina,Main Beach,2023-10-10T11:56:00Z,2023,10,CBT,FALSE,TRUE,FALSE,2023-24-NSW-SMART-drumline-annual-report.pdf
23/11/2023,7:47,Shortfin Mako Shark,279,F,Alive,ID,Ballina,Main Beach,2023-11-23T07:47:00Z,2023,11,SMA,FALSE,TRUE,FALSE,2023-24-NSW-SMART-drumline-annual-report.pdf
28/11/2023,10:44,White Shark,223,F,Alive,"ID, A",Ballina,Main Beach,2023-11-28T10:44:00Z,2023,11,WHI,TRUE,TRUE,TRUE,2023-24-NSW-SMART-drumline-annual-report.pdf
18/01/2024,14:25,Common Blacktip,160,F,Alive,ID,Ballina,Main Beach,2024-01-18T14:25:00Z,2024,1,CBT,FALSE,TRUE,FALSE,2023-24-NSW-SMART-drumline-annual-report.pdf
15/02/2024,7:12,Bull Shark,182,F,Alive,"ID, A",Ballina,Main Beach,2024-02-15T07:12:00Z,2024,2,BUL,TRUE,TRUE,TRUE,2023-24-NSW-SMART-drumline-annual-report.pdf
18/03/2024,12:17,Common Blacktip,174,F,Alive,ID,Ballina,Main Beach,2024-03-18T12:17:00Z,2024,3,CBT,FALSE,TRUE,FALSE,2023-24-NSW-SMART-drumline-annual-report.pdf
20/03/2024,13:21,Common Blacktip,157,F,Alive,ID,Ballina,Main Beach,2024-03-20T13:21:00Z,2024,3,CBT,FALSE,TRUE,FALSE,2023-24-NSW-SMART-drumline-annual-report.pdf
20/03/2024,14:05,Common Blacktip,178,F,Alive,ID,Ballina,Main Beach,2024-03-20T14:05:00Z,2024,3,CBT,FALSE,TRUE,FALSE,2023-24-NSW-SMART-drumline-annual-report.pdf
27/03/2024,8:22,Smooth Hammerhead,209,F,Alive,ID,Ballina,Main Beach,2024-03-27T08:22:00Z,2024,3,SMH,FALSE,TRUE,FALSE,2023-24-NSW-SMART-drumline-annual-report.pdf
31/05/2024,7:17,Common Blacktip,168,F,Alive,ID,Ballina,Main Beach,2024-05-31T07:17:00Z,2024,5,CBT,FALSE,TRUE,FALSE,2023-24-NSW-SMART-drumline-annual-report.pdf
14/07/2023,NA,Tiger Shark,205,M,Alive,"ID, A",Ballina,Sharpes Beach,NA,2023,7,TIG,TRUE,TRUE,TRUE,2023-24-NSW-SMART-drumline-annual-report.pdf
27/07/2023,11:24,Smooth Hammerhead,180,F,Alive,ID,Ballina,Sharpes Beach,2023-07-27T11:24:00Z,2023,7,SMH,FALSE,TRUE,FALSE,2023-24-NSW-SMART-drumline-annual-report.pdf
28/07/2023,14:36,Common Blacktip,289,F,Alive,ID,Ballina,Sharpes Beach,2023-07-28T14:36:00Z,2023,7,CBT,FALSE,TRUE,FALSE,2023-24-NSW-SMART-drumline-annual-report.pdf
14/08/2023,12:37,Dusky Whaler,231,M,Alive,ID,Ballina,Sharpes Beach,2023-08-14T12:37:00Z,2023,8,DUS,FALSE,TRUE,FALSE,2023-24-NSW-SMART-drumline-annual-report.pdf
16/08/2023,7:32,Smooth Hammerhead,198,F,Alive,ID,Ballina,Sharpes Beach,2023-08-16T07:32:00Z,2023,8,SMH,FALSE,TRUE,FALSE,2023-24-NSW-SMART-drumline-annual-report.pdf
28/08/2023,11:15,Smooth Hammerhead,169,F,Alive,ID,Ballina,Sharpes Beach,2023-08-28T11:15:00Z,2023,8,SMH,FALSE,TRUE,FALSE,2023-24-NSW-SMART-drumline-annual-report.pdf
9/09/2023,7:54,Tiger Shark,305,F,Alive,"ID, A",Ballina,Sharpes Beach,2023-09-09T07:54:00Z,2023,9,TIG,TRUE,TRUE,TRUE,2023-24-NSW-SMART-drumline-annual-report.pdf
12/09/2023,12:04,White Shark,171,F,Alive,"ID, A",Ballina,Sharpes Beach,2023-09-12T12:04:00Z,2023,9,WHI,TRUE,TRUE,TRUE,2023-24-NSW-SMART-drumline-annual-report.pdf
12/09/2023,13:52,White Shark,203,M,Alive,"ID, A",Ballina,Sharpes Beach,2023-09-12T13:52:00Z,2023,9,WHI,TRUE,TRUE,TRUE,2023-24-NSW-SMART-drumline-annual-report.pdf
19/09/2023,8:24,Smooth Hammerhead,180,M,Alive,ID,Ballina,Sharpes Beach,2023-09-19T08:24:00Z,2023,9,SMH,FALSE,TRUE,FALSE,2023-24-NSW-SMART-drumline-annual-report.pdf
5/10/2023,13:01,White Shark,282,F,Alive,"ID, A",Ballina,Sharpes Beach,2023-10-05T13:01:00Z,2023,10,WHI,TRUE,TRUE,TRUE,2023-24-NSW-SMART-drumline-annual-report.pdf
9/10/2023,15:34,Smooth Hammerhead,170,M,Dead,NA,Ballina,Sharpes Beach,2023-10-09T15:34:00Z,2023,10,SMH,FALSE,FALSE,FALSE,2023-24-NSW-SMART-drumline-annual-report.pdf
6/11/2023,13:33,Greynurse Shark,261,M,Alive,ID,Ballina,Sharpes Beach,2023-11-06T13:33:00Z,2023,11,GRN,FALSE,TRUE,FALSE,2023-24-NSW-SMART-drumline-annual-report.pdf
16/11/2023,9:22,Tiger Shark,237,F,Alive,"ID, A",Ballina,Sharpes Beach,2023-11-16T09:22:00Z,2023,11,TIG,TRUE,TRUE,TRUE,2023-24-NSW-SMART-drumline-annual-report.pdf
19/11/2023,7:24,Smooth Hammerhead,164,M,Alive,ID,Ballina,Sharpes Beach,2023-11-19T07:24:00Z,2023,11,SMH,FALSE,TRUE,FALSE,2023-24-NSW-SMART-drumline-annual-report.pdf
23/11/2023,6:27,White Shark,248,M,Alive,"ID, A",Ballina,Sharpes Beach,2023-11-23T06:27:00Z,2023,11,WHI,TRUE,TRUE,TRUE,2023-24-NSW-SMART-drumline-annual-report.pdf
25/12/2023,8:18,Smooth Hammerhead,173,M,Alive,ID,Ballina,Sharpes Beach,2023-12-25T08:18:00Z,2023,12,SMH,FALSE,TRUE,FALSE,2023-24-NSW-SMART-drumline-annual-report.pdf
29/12/2023,10:00,Common Blacktip,142,F,Alive,ID,Ballina,Sharpes Beach,2023-12-29T10:00:00Z,2023,12,CBT,FALSE,TRUE,FALSE,2023-24-NSW-SMART-drumline-annual-report.pdf
16/02/2024,11:23,Common Blacktip,139,M,Alive,ID,Ballina,Sharpes Beach,2024-02-16T11:23:00Z,2024,2,CBT,FALSE,TRUE,FALSE,2023-24-NSW-SMART-drumline-annual-report.pdf
15/04/2024,7:27,Sandbar Whaler,148,M,Alive,ID,Ballina,Sharpes Beach,2024-04-15T07:27:00Z,2024,4,SAN,FALSE,TRUE,FALSE,2023-24-NSW-SMART-drumline-annual-report.pdf
4/05/2024,14:33,Common Blacktip,189,F,Alive,ID,Ballina,Sharpes Beach,2024-05-04T14:33:00Z,2024,5,CBT,FALSE,TRUE,FALSE,2023-24-NSW-SMART-drumline-annual-report.pdf
31/05/2024,8:01,White Shark,218,M,Alive,"ID, A",Ballina,Sharpes Beach,2024-05-31T08:01:00Z,2024,5,WHI,TRUE,TRUE,TRUE,2023-24-NSW-SMART-drumline-annual-report.pdf
30/06/2024,8:37,White Shark,309,M,Alive,"ID, A",Ballina,Sharpes Beach,2024-06-30T08:37:00Z,2024,6,WHI,TRUE,TRUE,TRUE,2023-24-NSW-SMART-drumline-annual-report.pdf
3/07/2023,11:10,Tiger Shark,267,M,Alive,"ID, A",Ballina,Shelly Beach,2023-07-03T11:10:00Z,2023,7,TIG,TRUE,TRUE,TRUE,2023-24-NSW-SMART-drumline-annual-report.pdf
26/07/2023,12:58,Tiger Shark,303,F,Alive,"ID, A",Ballina,Shelly Beach,2023-07-26T12:58:00Z,2023,7,TIG,TRUE,TRUE,TRUE,2023-24-NSW-SMART-drumline-annual-report.pdf
17/09/2023,8:24,Bronze Whaler,278,F,Alive,ID,Ballina,Shelly Beach,2023-09-17T08:24:00Z,2023,9,BRO,FALSE,TRUE,FALSE,2023-24-NSW-SMART-drumline-annual-report.pdf
28/11/2023,8:36,White Shark,225,F,Alive,"ID, A",Ballina,Shelly Beach,2023-11-28T08:36:00Z,2023,11,WHI,TRUE,TRUE,TRUE,2023-24-NSW-SMART-drumline-annual-report.pdf
7/01/2024,10:06,Common Blacktip,168,F,Alive,ID,Ballina,Shelly Beach,2024-01-07T10:06:00Z,2024,1,CBT,FALSE,TRUE,FALSE,2023-24-NSW-SMART-drumline-annual-report.pdf
22/01/2024,7:45,Common Blacktip,212,M,Alive,ID,Ballina,Shelly Beach,2024-01-22T07:45:00Z,2024,1,CBT,FALSE,TRUE,FALSE,2023-24-NSW-SMART-drumline-annual-report.pdf
25/03/2024,14:57,Tiger Shark,204,F,Alive,"ID, A",Ballina,Shelly Beach,2024-03-25T14:57:00Z,2024,3,TIG,TRUE,TRUE,TRUE,2023-24-NSW-SMART-drumline-annual-report.pdf
9/04/2024,10:39,Bull Shark,198,M,Alive,"ID, A",Ballina,Shelly Beach,2024-04-09T10:39:00Z,2024,4,BUL,TRUE,TRUE,TRUE,2023-24-NSW-SMART-drumline-annual-report.pdf
17/04/2024,14:25,Common Blacktip,139,F,Alive,ID,Ballina,Shelly Beach,2024-04-17T14:25:00Z,2024,4,CBT,FALSE,TRUE,FALSE,2023-24-NSW-SMART-drumline-annual-report.pdf
2/06/2024,7:07,Tiger Shark,338,F,Alive,"ID, A",Ballina,Shelly Beach,2024-06-02T07:07:00Z,2024,6,TIG,TRUE,TRUE,TRUE,2023-24-NSW-SMART-drumline-annual-report.pdf
5/07/2023,7:33,White Shark,329,M,Alive,"ID, A",Ballina,South Ballina Beach,2023-07-05T07:33:00Z,2023,7,WHI,TRUE,TRUE,TRUE,2023-24-NSW-SMART-drumline-annual-report.pdf
12/07/2023,8:52,Common Blacktip,273,M,Alive,ID,Ballina,South Ballina Beach,2023-07-12T08:52:00Z,2023,7,CBT,FALSE,TRUE,FALSE,2023-24-NSW-SMART-drumline-annual-report.pdf
12/07/2023,14:29,White Shark,233,F,Alive,"ID, A",Ballina,South Ballina Beach,2023-07-12T14:29:00Z,2023,7,WHI,TRUE,TRUE,TRUE,2023-24-NSW-SMART-drumline-annual-report.pdf
4/08/2023,15:17,Smooth Hammerhead,159,F,Alive,ID,Ballina,South Ballina Beach,2023-08-04T15:17:00Z,2023,8,SMH,FALSE,TRUE,FALSE,2023-24-NSW-SMART-drumline-annual-report.pdf
30/08/2023,14:15,Bronze Whaler,287,M,Alive,ID,Ballina,South Ballina Beach,2023-08-30T14:15:00Z,2023,8,BRO,FALSE,TRUE,FALSE,2023-24-NSW-SMART-drumline-annual-report.pdf
25/09/2023,12:19,Smooth Hammerhead,171,F,Alive,ID,Ballina,South Ballina Beach,2023-09-25T12:19:00Z,2023,9,SMH,FALSE,TRUE,FALSE,2023-24-NSW-SMART-drumline-annual-report.pdf
15/10/2023,17:49,White Shark,228,M,Alive,"ID, A",Ballina,South Ballina Beach,2023-10-15T17:49:00Z,2023,10,WHI,TRUE,TRUE,TRUE,2023-24-NSW-SMART-drumline-annual-report.pdf
24/11/2023,12:22,Smooth Hammerhead,172,M,Alive,ID,Ballina,South Ballina Beach,2023-11-24T12:22:00Z,2023,11,SMH,FALSE,TRUE,FALSE,2023-24-NSW-SMART-drumline-annual-report.pdf
11/12/2023,9:54,Scalloped Hammerhead,157,F,Alive,ID,Ballina,South Ballina Beach,2023-12-11T09:54:00Z,2023,12,SCH,FALSE,TRUE,FALSE,2023-24-NSW-SMART-drumline-annual-report.pdf
18/01/2024,11:15,Bull Shark,208,M,Alive,"ID, A",Ballina,South Ballina Beach,2024-01-18T11:15:00Z,2024,1,BUL,TRUE,TRUE,TRUE,2023-24-NSW-SMART-drumline-annual-report.pdf
18/02/2024,9:00,Bull Shark,166,M,Alive,"ID, A",Ballina,South Ballina Beach,2024-02-18T09:00:00Z,2024,2,BUL,TRUE,TRUE,TRUE,2023-24-NSW-SMART-drumline-annual-report.pdf
6/06/2024,12:24,Smooth Hammerhead,196,F,Alive,ID,Ballina,South Ballina Beach,2024-06-06T12:24:00Z,2024,6,SMH,FALSE,TRUE,FALSE,2023-24-NSW-SMART-drumline-annual-report.pdf
27/07/2023,7:39,Bronze Whaler,254,F,Alive,ID,Barrenjoey,Avalon Beach,2023-07-27T07:39:00Z,2023,7,BRO,FALSE,TRUE,FALSE,2023-24-NSW-SMART-drumline-annual-report.pdf
29/07/2023,9:59,Shortfin Mako Shark,142,F,Alive,ID,Barrenjoey,Avalon Beach,2023-07-29T09:59:00Z,2023,7,SMA,FALSE,TRUE,FALSE,2023-24-NSW-SMART-drumline-annual-report.pdf
9/11/2023,12:33,Shortfin Mako Shark,150,M,Alive,ID,Barrenjoey,Avalon Beach,2023-11-09T12:33:00Z,2023,11,SMA,FALSE,TRUE,FALSE,2023-24-NSW-SMART-drumline-annual-report.pdf
9/03/2024,14:40,Tiger Shark,240,NA,Alive,NA,Barrenjoey,Avalon Beach,2024-03-09T14:40:00Z,2024,3,TIG,TRUE,FALSE,FALSE,2023-24-NSW-SMART-drumline-annual-report.pdf
12/04/2024,9:28,Dusky Whaler,130,F,Alive,ID,Barrenjoey,Avalon Beach,2024-04-12T09:28:00Z,2024,4,DUS,FALSE,TRUE,FALSE,2023-24-NSW-SMART-drumline-annual-report.pdf
22/04/2024,14:26,Dusky Whaler,140,M,Alive,ID,Barrenjoey,Avalon Beach,2024-04-22T14:26:00Z,2024,4,DUS,FALSE,TRUE,FALSE,2023-24-NSW-SMART-drumline-annual-report.pdf
27/04/2024,10:24,Dusky Whaler,130,M,Alive,ID,Barrenjoey,Avalon Beach,2024-04-27T10:24:00Z,2024,4,DUS,FALSE,TRUE,FALSE,2023-24-NSW-SMART-drumline-annual-report.pdf
12/05/2024,13:13,Dusky Whaler,138,F,Alive,ID,Barrenjoey,Avalon Beach,2024-05-12T13:13:00Z,2024,5,DUS,FALSE,TRUE,FALSE,2023-24-NSW-SMART-drumline-annual-report.pdf
3/06/2024,9:53,Bronze Whaler,213,F,Alive,ID,Barrenjoey,Avalon Beach,2024-06-03T09:53:00Z,2024,6,BRO,FALSE,TRUE,FALSE,2023-24-NSW-SMART-drumline-annual-report.pdf
18/06/2024,11:19,Dusky Whaler,136,M,Alive,ID,Barrenjoey,Avalon Beach,2024-06-18T11:19:00Z,2024,6,DUS,FALSE,TRUE,FALSE,2023-24-NSW-SMART-drumline-annual-report.pdf
28/06/2024,12:47,White Shark,233,F,Alive,"ID, A",Barrenjoey,Avalon Beach,2024-06-28T12:47:00Z,2024,6,WHI,TRUE,TRUE,TRUE,2023-24-NSW-SMART-drumline-annual-report.pdf
16/04/2024,9:19,Dusky Whaler,136,F,Alive,ID,Barrenjoey,Bilgola Beach,2024-04-16T09:19:00Z,2024,4,DUS,FALSE,TRUE,FALSE,2023-24-NSW-SMART-drumline-annual-report.pdf
17/04/2024,10:52,Dusky Whaler,159,F,Alive,ID,Barrenjoey,Bilgola Beach,2024-04-17T10:52:00Z,2024,4,DUS,FALSE,TRUE,FALSE,2023-24-NSW-SMART-drumline-annual-report.pdf
8/05/2024,10:01,Dusky Whaler,140,M,Alive,ID,Barrenjoey,Bilgola Beach,2024-05-08T10:01:00Z,2024,5,DUS,FALSE,TRUE,FALSE,2023-24-NSW-SMART-drumline-annual-report.pdf
18/06/2024,11:41,Bronze Whaler,253,F,Alive,ID,Barrenjoey,Bilgola Beach,2024-06-18T11:41:00Z,2024,6,BRO,FALSE,TRUE,FALSE,2023-24-NSW-SMART-drumline-annual-report.pdf
29/06/2024,14:06,Tiger Shark,163,F,Alive,"ID, A",Barrenjoey,Bilgola Beach,2024-06-29T14:06:00Z,2024,6,TIG,TRUE,TRUE,TRUE,2023-24-NSW-SMART-drumline-annual-report.pdf
15/10/2023,14:05,Bronze Whaler,271,F,Alive,ID,Barrenjoey,Bungan Beach,2023-10-15T14:05:00Z,2023,10,BRO,FALSE,TRUE,FALSE,2023-24-NSW-SMART-drumline-annual-report.pdf
26/12/2023,8:06,Dusky Whaler,124,F,Alive,ID,Barrenjoey,Bungan Beach,2023-12-26T08:06:00Z,2023,12,DUS,FALSE,TRUE,FALSE,2023-24-NSW-SMART-drumline-annual-report.pdf
14/02/2024,10:33,Dusky Whaler,132,F,Alive,ID,Barrenjoey,Bungan Beach,2024-02-14T10:33:00Z,2024,2,DUS,FALSE,TRUE,FALSE,2023-24-NSW-SMART-drumline-annual-report.pdf
11/03/2024,12:45,Dusky Whaler,116,F,Alive,ID,Barrenjoey,Bungan Beach,2024-03-11T12:45:00Z,2024,3,DUS,FALSE,TRUE,FALSE,2023-24-NSW-SMART-drumline-annual-report.pdf
7/04/2024,9:37,Dusky Whaler,130,F,Alive,ID,Barrenjoey,Bungan Beach,2024-04-07T09:37:00Z,2024,4,DUS,FALSE,TRUE,FALSE,2023-24-NSW-SMART-drumline-annual-report.pdf
14/04/2024,12:12,Dusky Whaler,128,F,Alive,ID,Barrenjoey,Bungan Beach,2024-04-14T12:12:00Z,2024,4,DUS,FALSE,TRUE,FALSE,2023-24-NSW-SMART-drumline-annual-report.pdf
15/04/2024,12:43,Dusky Whaler,136,M,Alive,ID,Barrenjoey,Bungan Beach,2024-04-15T12:43:00Z,2024,4,DUS,FALSE,TRUE,FALSE,2023-24-NSW-SMART-drumline-annual-report.pdf
31/07/2023,12:22,Bronze Whaler,248,M,Alive,ID,Barrenjoey,Mona Vale Beach,2023-07-31T12:22:00Z,2023,7,BRO,FALSE,TRUE,FALSE,2023-24-NSW-SMART-drumline-annual-report.pdf
13/08/2023,13:42,Bronze Whaler,276,F,Alive,ID,Barrenjoey,Mona Vale Beach,2023-08-13T13:42:00Z,2023,8,BRO,FALSE,TRUE,FALSE,2023-24-NSW-SMART-drumline-annual-report.pdf
18/01/2024,8:03,Dusky Whaler,152,F,Alive,ID,Barrenjoey,Mona Vale Beach,2024-01-18T08:03:00Z,2024,1,DUS,FALSE,TRUE,FALSE,2023-24-NSW-SMART-drumline-annual-report.pdf
21/01/2024,14:16,Dusky Whaler,137,M,Alive,ID,Barrenjoey,Mona Vale Beach,2024-01-21T14:16:00Z,2024,1,DUS,FALSE,TRUE,FALSE,2023-24-NSW-SMART-drumline-annual-report.pdf
5/02/2024,10:06,Dusky Whaler,124,M,Alive,ID,Barrenjoey,Mona Vale Beach,2024-02-05T10:06:00Z,2024,2,DUS,FALSE,TRUE,FALSE,2023-24-NSW-SMART-drumline-annual-report.pdf
22/02/2024,14:54,Dusky Whaler,155,M,Alive,ID,Barrenjoey,Mona Vale Beach,2024-02-22T14:54:00Z,2024,2,DUS,FALSE,TRUE,FALSE,2023-24-NSW-SMART-drumline-annual-report.pdf
19/03/2024,13:29,Dusky Whaler,177,F,Alive,ID,Barrenjoey,Mona Vale Beach,2024-03-19T13:29:00Z,2024,3,DUS,FALSE,TRUE,FALSE,2023-24-NSW-SMART-drumline-annual-report.pdf
1/04/2024,11:39,Dusky Whaler,126,F,Alive,ID,Barrenjoey,Mona Vale Beach,2024-04-01T11:39:00Z,2024,4,DUS,FALSE,TRUE,FALSE,2023-24-NSW-SMART-drumline-annual-report.pdf
16/04/2024,8:56,Dusky Whaler,129,F,Alive,ID,Barrenjoey,Mona Vale Beach,2024-04-16T08:56:00Z,2024,4,DUS,FALSE,TRUE,FALSE,2023-24-NSW-SMART-drumline-annual-report.pdf
29/04/2024,10:26,Dusky Whaler,138,M,Alive,ID,Barrenjoey,Mona Vale Beach,2024-04-29T10:26:00Z,2024,4,DUS,FALSE,TRUE,FALSE,2023-24-NSW-SMART-drumline-annual-report.pdf
9/05/2024,14:13,Dusky Whaler,139,F,Alive,ID,Barrenjoey,Mona Vale Beach,2024-05-09T14:13:00Z,2024,5,DUS,FALSE,TRUE,FALSE,2023-24-NSW-SMART-drumline-annual-report.pdf
20/09/2023,7:48,Bronze Whaler,268,F,Alive,ID,Barrenjoey,Newport Beach,2023-09-20T07:48:00Z,2023,9,BRO,FALSE,TRUE,FALSE,2023-24-NSW-SMART-drumline-annual-report.pdf
17/01/2024,7:14,Dusky Whaler,122,M,Alive,ID,Barrenjoey,Newport Beach,2024-01-17T07:14:00Z,2024,1,DUS,FALSE,TRUE,FALSE,2023-24-NSW-SMART-drumline-annual-report.pdf
24/04/2024,7:33,Dusky Whaler,133,F,Alive,ID,Barrenjoey,Newport Beach,2024-04-24T07:33:00Z,2024,4,DUS,FALSE,TRUE,FALSE,2023-24-NSW-SMART-drumline-annual-report.pdf
29/04/2024,7:29,Dusky Whaler,144,M,Alive,ID,Barrenjoey,Newport Beach,2024-04-29T07:29:00Z,2024,4,DUS,FALSE,TRUE,FALSE,2023-24-NSW-SMART-drumline-annual-report.pdf
26/07/2023,14:27,Tiger Shark,350,NA,Alive,NA,Barrenjoey,Palm Beach,2023-07-26T14:27:00Z,2023,7,TIG,TRUE,FALSE,FALSE,2023-24-NSW-SMART-drumline-annual-report.pdf
10/09/2023,13:21,Thresher Shark,285,M,Alive,ID,Barrenjoey,Palm Beach,2023-09-10T13:21:00Z,2023,9,THR,FALSE,TRUE,FALSE,2023-24-NSW-SMART-drumline-annual-report.pdf
2/10/2023,NA,Shortfin Mako Shark,196,M,Alive,ID,Barrenjoey,Palm Beach,NA,2023,10,SMA,FALSE,TRUE,FALSE,2023-24-NSW-SMART-drumline-annual-report.pdf
13/10/2023,8:16,White Shark,226,F,Alive,"ID, A",Barrenjoey,Palm Beach,2023-10-13T08:16:00Z,2023,10,WHI,TRUE,TRUE,TRUE,2023-24-NSW-SMART-drumline-annual-report.pdf
2/11/2023,14:21,Dusky Whaler,158,M,Alive,ID,Barrenjoey,Palm Beach,2023-11-02T14:21:00Z,2023,11,DUS,FALSE,TRUE,FALSE,2023-24-NSW-SMART-drumline-annual-report.pdf
31/01/2024,9:57,Tiger Shark,135,F,Alive,"ID, A",Barrenjoey,Palm Beach,2024-01-31T09:57:00Z,2024,1,TIG,TRUE,TRUE,TRUE,2023-24-NSW-SMART-drumline-annual-report.pdf
5/03/2024,17:15,Dusky Whaler,132,F,Alive,ID,Barrenjoey,Palm Beach,2024-03-05T17:15:00Z,2024,3,DUS,FALSE,TRUE,FALSE,2023-24-NSW-SMART-drumline-annual-report.pdf
29/04/2024,NA,Dusky Whaler,109,F,Alive,ID,Barrenjoey,Palm Beach,NA,2024,4,DUS,FALSE,TRUE,FALSE,2023-24-NSW-SMART-drumline-annual-report.pdf
8/06/2024,NA,Shortfin Mako Shark,131,M,Alive,ID,Barrenjoey,Palm Beach,NA,2024,6,SMA,FALSE,TRUE,FALSE,2023-24-NSW-SMART-drumline-annual-report.pdf
15/10/2023,15:30,Bronze Whaler,234,F,Alive,ID,Barrenjoey,Warriewood Beach,2023-10-15T15:30:00Z,2023,10,BRO,FALSE,TRUE,FALSE,2023-24-NSW-SMART-drumline-annual-report.pdf
26/12/2023,10:34,Dusky Whaler,123,F,Alive,ID,Barrenjoey,Warriewood Beach,2023-12-26T10:34:00Z,2023,12,DUS,FALSE,TRUE,FALSE,2023-24-NSW-SMART-drumline-annual-report.pdf
29/12/2023,14:32,Dusky Whaler,116,M,Alive,ID,Barrenjoey,Warriewood Beach,2023-12-29T14:32:00Z,2023,12,DUS,FALSE,TRUE,FALSE,2023-24-NSW-SMART-drumline-annual-report.pdf
6/01/2024,7:24,Dusky Whaler,120,M,Alive,ID,Barrenjoey,Warriewood Beach,2024-01-06T07:24:00Z,2024,1,DUS,FALSE,TRUE,FALSE,2023-24-NSW-SMART-drumline-annual-report.pdf
9/01/2024,8:44,Dusky Whaler,121,M,Alive,ID,Barrenjoey,Warriewood Beach,2024-01-09T08:44:00Z,2024,1,DUS,FALSE,TRUE,FALSE,2023-24-NSW-SMART-drumline-annual-report.pdf
19/01/2024,7:58,Dusky Whaler,113,F,Alive,ID,Barrenjoey,Warriewood Beach,2024-01-19T07:58:00Z,2024,1,DUS,FALSE,TRUE,FALSE,2023-24-NSW-SMART-drumline-annual-report.pdf
12/02/2024,7:33,Dusky Whaler,119,F,Alive,ID,Barrenjoey,Warriewood Beach,2024-02-12T07:33:00Z,2024,2,DUS,FALSE,TRUE,FALSE,2023-24-NSW-SMART-drumline-annual-report.pdf
21/02/2024,9:04,Dusky Whaler,164,F,Alive,ID,Barrenjoey,Warriewood Beach,2024-02-21T09:04:00Z,2024,2,DUS,FALSE,TRUE,FALSE,2023-24-NSW-SMART-drumline-annual-report.pdf
8/04/2024,10:18,Dusky Whaler,129,F,Alive,ID,Barrenjoey,Warriewood Beach,2024-04-08T10:18:00Z,2024,4,DUS,FALSE,TRUE,FALSE,2023-24-NSW-SMART-drumline-annual-report.pdf
1/07/2023,13:11,Bronze Whaler,278,F,Alive,ID,Barrenjoey,Whale Beach,2023-07-01T13:11:00Z,2023,7,BRO,FALSE,TRUE,FALSE,2023-24-NSW-SMART-drumline-annual-report.pdf
8/04/2024,9:17,Dusky Whaler,136,F,Alive,ID,Barrenjoey,Whale Beach,2024-04-08T09:17:00Z,2024,4,DUS,FALSE,TRUE,FALSE,2023-24-NSW-SMART-drumline-annual-report.pdf
12/04/2024,11:29,Dusky Whaler,137,F,Alive,ID,Barrenjoey,Whale Beach,2024-04-12T11:29:00Z,2024,4,DUS,FALSE,TRUE,FALSE,2023-24-NSW-SMART-drumline-annual-report.pdf
28/04/2024,9:57,Dusky Whaler,128,M,Alive,ID,Barrenjoey,Whale Beach,2024-04-28T09:57:00Z,2024,4,DUS,FALSE,TRUE,FALSE,2023-24-NSW-SMART-drumline-annual-report.pdf
25/07/2023,8:01,Bronze Whaler,218,M,Alive,ID,Central Coast North,Bateau Bay,2023-07-25T08:01:00Z,2023,7,BRO,FALSE,TRUE,FALSE,2023-24-NSW-SMART-drumline-annual-report.pdf
2/08/2023,14:39,Dusky Whaler,156,M,Alive,ID,Central Coast North,Bateau Bay,2023-08-02T14:39:00Z,2023,8,DUS,FALSE,TRUE,FALSE,2023-24-NSW-SMART-drumline-annual-report.pdf
15/08/2023,NA,Broadnose shark,209,M,Alive,ID,Central Coast North,Bateau Bay,NA,2023,8,UNK,FALSE,TRUE,FALSE,2023-24-NSW-SMART-drumline-annual-report.pdf
28/08/2023,14:20,Bronze Whaler,238,F,Alive,ID,Central Coast North,Bateau Bay,2023-08-28T14:20:00Z,2023,8,BRO,FALSE,TRUE,FALSE,2023-24-NSW-SMART-drumline-annual-report.pdf
21/01/2024,7:47,Dusky Whaler,163,M,Alive,ID,Central Coast North,Bateau Bay,2024-01-21T07:47:00Z,2024,1,DUS,FALSE,TRUE,FALSE,2023-24-NSW-SMART-drumline-annual-report.pdf
24/01/2024,6:15,Dusky Whaler,217,M,Alive,ID,Central Coast North,Bateau Bay,2024-01-24T06:15:00Z,2024,1,DUS,FALSE,TRUE,FALSE,2023-24-NSW-SMART-drumline-annual-report.pdf
14/03/2024,13:36,Dusky Whaler,176,M,Alive,ID,Central Coast North,Bateau Bay,2024-03-14T13:36:00Z,2024,3,DUS,FALSE,TRUE,FALSE,2023-24-NSW-SMART-drumline-annual-report.pdf
19/04/2024,6:28,Dusky Whaler,204,F,Alive,ID,Central Coast North,Bateau Bay,2024-04-19T06:28:00Z,2024,4,DUS,FALSE,TRUE,FALSE,2023-24-NSW-SMART-drumline-annual-report.pdf
19/04/2024,7:41,Dusky Whaler,191,F,Alive,ID,Central Coast North,Bateau Bay,2024-04-19T07:41:00Z,2024,4,DUS,FALSE,TRUE,FALSE,2023-24-NSW-SMART-drumline-annual-report.pdf
8/05/2024,6:41,Dusky Whaler,169,M,Alive,ID,Central Coast North,Bateau Bay,2024-05-08T06:41:00Z,2024,5,DUS,FALSE,TRUE,FALSE,2023-24-NSW-SMART-drumline-annual-report.pdf
20/07/2023,12:16,Shortfin Mako Shark,165,M,Alive,ID,Central Coast North,Crackneck Point,2023-07-20T12:16:00Z,2023,7,SMA,FALSE,TRUE,FALSE,2023-24-NSW-SMART-drumline-annual-report.pdf
4/08/2023,9:32,Bronze Whaler,288,F,Alive,ID,Central Coast North,Crackneck Point,2023-08-04T09:32:00Z,2023,8,BRO,FALSE,TRUE,FALSE,2023-24-NSW-SMART-drumline-annual-report.pdf
13/08/2023,12:08,White Shark,232,M,Alive,"ID, A",Central Coast North,Crackneck Point,2023-08-13T12:08:00Z,2023,8,WHI,TRUE,TRUE,TRUE,2023-24-NSW-SMART-drumline-annual-report.pdf
20/08/2023,11:28,Shortfin Mako Shark,161,M,Alive,ID,Central Coast North,Crackneck Point,2023-08-20T11:28:00Z,2023,8,SMA,FALSE,TRUE,FALSE,2023-24-NSW-SMART-drumline-annual-report.pdf
12/09/2023,16:14,Shortfin Mako Shark,145,F,Alive,ID,Central Coast North,Crackneck Point,2023-09-12T16:14:00Z,2023,9,SMA,FALSE,TRUE,FALSE,2023-24-NSW-SMART-drumline-annual-report.pdf
24/10/2023,10:14,Dusky Whaler,139,M,Alive,ID,Central Coast North,Crackneck Point,2023-10-24T10:14:00Z,2023,10,DUS,FALSE,TRUE,FALSE,2023-24-NSW-SMART-drumline-annual-report.pdf
27/11/2023,8:59,Dusky Whaler,190,M,Alive,ID,Central Coast North,Crackneck Point,2023-11-27T08:59:00Z,2023,11,DUS,FALSE,TRUE,FALSE,2023-24-NSW-SMART-drumline-annual-report.pdf
9/12/2023,8:54,Dusky Whaler,165,M,Alive,ID,Central Coast North,Crackneck Point,2023-12-09T08:54:00Z,2023,12,DUS,FALSE,TRUE,FALSE,2023-24-NSW-SMART-drumline-annual-report.pdf
26/12/2023,8:47,Dusky Whaler,195,F,Alive,ID,Central Coast North,Crackneck Point,2023-12-26T08:47:00Z,2023,12,DUS,FALSE,TRUE,FALSE,2023-24-NSW-SMART-drumline-annual-report.pdf
3/01/2024,10:44,Smooth Hammerhead,174,M,Alive,ID,Central Coast North,Crackneck Point,2024-01-03T10:44:00Z,2024,1,SMH,FALSE,TRUE,FALSE,2023-24-NSW-SMART-drumline-annual-report.pdf
10/01/2024,NA,Dusky Whaler,168,F,Alive,ID,Central Coast North,Crackneck Point,NA,2024,1,DUS,FALSE,TRUE,FALSE,2023-24-NSW-SMART-drumline-annual-report.pdf
11/01/2024,NA,Tiger Shark,144,F,Alive,"ID, A",Central Coast North,Crackneck Point,NA,2024,1,TIG,TRUE,TRUE,TRUE,2023-24-NSW-SMART-drumline-annual-report.pdf
27/01/2024,16:15,Dusky Whaler,189,M,Alive,ID,Central Coast North,Crackneck Point,2024-01-27T16:15:00Z,2024,1,DUS,FALSE,TRUE,FALSE,2023-24-NSW-SMART-drumline-annual-report.pdf
12/02/2024,17:59,Dusky Whaler,178,M,Alive,ID,Central Coast North,Crackneck Point,2024-02-12T17:59:00Z,2024,2,DUS,FALSE,TRUE,FALSE,2023-24-NSW-SMART-drumline-annual-report.pdf
26/02/2024,6:47,Dusky Whaler,198,F,Alive,ID,Central Coast North,Crackneck Point,2024-02-26T06:47:00Z,2024,2,DUS,FALSE,TRUE,FALSE,2023-24-NSW-SMART-drumline-annual-report.pdf
6/03/2024,10:42,Dusky Whaler,177,M,Alive,ID,Central Coast North,Crackneck Point,2024-03-06T10:42:00Z,2024,3,DUS,FALSE,TRUE,FALSE,2023-24-NSW-SMART-drumline-annual-report.pdf
13/03/2024,12:19,Dusky Whaler,206,F,Alive,ID,Central Coast North,Crackneck Point,2024-03-13T12:19:00Z,2024,3,DUS,FALSE,TRUE,FALSE,2023-24-NSW-SMART-drumline-annual-report.pdf
14/03/2024,9:36,Dusky Whaler,228,M,Alive,ID,Central Coast North,Crackneck Point,2024-03-14T09:36:00Z,2024,3,DUS,FALSE,TRUE,FALSE,2023-24-NSW-SMART-drumline-annual-report.pdf
27/05/2024,13:06,Dusky Whaler,150,M,Alive,ID,Central Coast North,Crackneck Point,2024-05-27T13:06:00Z,2024,5,DUS,FALSE,TRUE,FALSE,2023-24-NSW-SMART-drumline-annual-report.pdf
27/06/2024,9:19,Dusky Whaler,132,M,Alive,ID,Central Coast North,Crackneck Point,2024-06-27T09:19:00Z,2024,6,DUS,FALSE,TRUE,FALSE,2023-24-NSW-SMART-drumline-annual-report.pdf
21/08/2023,9:51,Bronze Whaler,260,F,Alive,ID,Central Coast North,Pebbly Beach,2023-08-21T09:51:00Z,2023,8,BRO,FALSE,TRUE,FALSE,2023-24-NSW-SMART-drumline-annual-report.pdf
19/06/2024,8:44,Bronze Whaler,279,F,Alive,ID,Central Coast North,Pebbly Beach,2024-06-19T08:44:00Z,2024,6,BRO,FALSE,TRUE,FALSE,2023-24-NSW-SMART-drumline-annual-report.pdf
20/07/2023,9:39,Bronze Whaler,266,F,Alive,ID,Central Coast North,Pelican Beach,2023-07-20T09:39:00Z,2023,7,BRO,FALSE,TRUE,FALSE,2023-24-NSW-SMART-drumline-annual-report.pdf
16/08/2023,7:56,White Shark,198,F,Alive,"ID, A",Central Coast North,Pelican Beach,2023-08-16T07:56:00Z,2023,8,WHI,TRUE,TRUE,TRUE,2023-24-NSW-SMART-drumline-annual-report.pdf
6/10/2023,12:13,Dusky Whaler,104,F,Alive,ID,Central Coast North,Pelican Beach,2023-10-06T12:13:00Z,2023,10,DUS,FALSE,TRUE,FALSE,2023-24-NSW-SMART-drumline-annual-report.pdf
22/11/2023,NA,Smooth Hammerhead,295,F,Dead,NA,Central Coast North,Pelican Beach,NA,2023,11,SMH,FALSE,FALSE,FALSE,2023-24-NSW-SMART-drumline-annual-report.pdf
28/12/2023,13:48,Dusky Whaler,130,M,Alive,ID,Central Coast North,Pelican Beach,2023-12-28T13:48:00Z,2023,12,DUS,FALSE,TRUE,FALSE,2023-24-NSW-SMART-drumline-annual-report.pdf
12/01/2024,13:59,Bronze Whaler,251,M,Alive,ID,Central Coast North,Pelican Beach,2024-01-12T13:59:00Z,2024,1,BRO,FALSE,TRUE,FALSE,2023-24-NSW-SMART-drumline-annual-report.pdf
20/01/2024,7:09,Shortfin Mako Shark,135,M,Alive,ID,Central Coast North,Pelican Beach,2024-01-20T07:09:00Z,2024,1,SMA,FALSE,TRUE,FALSE,2023-24-NSW-SMART-drumline-annual-report.pdf
21/01/2024,11:40,Dusky Whaler,169,F,Alive,ID,Central Coast North,Pelican Beach,2024-01-21T11:40:00Z,2024,1,DUS,FALSE,TRUE,FALSE,2023-24-NSW-SMART-drumline-annual-report.pdf
5/03/2024,9:24,Dusky Whaler,114,F,Alive,ID,Central Coast North,Pelican Beach,2024-03-05T09:24:00Z,2024,3,DUS,FALSE,TRUE,FALSE,2023-24-NSW-SMART-drumline-annual-report.pdf
6/03/2024,13:39,Dusky Whaler,147,F,Alive,ID,Central Coast North,Pelican Beach,2024-03-06T13:39:00Z,2024,3,DUS,FALSE,TRUE,FALSE,2023-24-NSW-SMART-drumline-annual-report.pdf
16/04/2024,9:58,Bronze Whaler,227,F,Alive,ID,Central Coast North,Pelican Beach,2024-04-16T09:58:00Z,2024,4,BRO,FALSE,TRUE,FALSE,2023-24-NSW-SMART-drumline-annual-report.pdf
17/04/2024,11:09,Dusky Whaler,186,M,Alive,ID,Central Coast North,Pelican Beach,2024-04-17T11:09:00Z,2024,4,DUS,FALSE,TRUE,FALSE,2023-24-NSW-SMART-drumline-annual-report.pdf
18/04/2024,11:17,Smooth Hammerhead,179,M,Alive,ID,Central Coast North,Pelican Beach,2024-04-18T11:17:00Z,2024,4,SMH,FALSE,TRUE,FALSE,2023-24-NSW-SMART-drumline-annual-report.pdf
4/05/2024,13:19,Dusky Whaler,212,F,Alive,ID,Central Coast North,Pelican Beach,2024-05-04T13:19:00Z,2024,5,DUS,FALSE,TRUE,FALSE,2023-24-NSW-SMART-drumline-annual-report.pdf
9/06/2024,8:08,Bronze Whaler,253,M,Alive,ID,Central Coast North,Pelican Beach,2024-06-09T08:08:00Z,2024,6,BRO,FALSE,TRUE,FALSE,2023-24-NSW-SMART-drumline-annual-report.pdf
4/08/2023,13:29,Bronze Whaler,269,F,Alive,ID,Central Coast North,Point Beach,2023-08-04T13:29:00Z,2023,8,BRO,FALSE,TRUE,FALSE,2023-24-NSW-SMART-drumline-annual-report.pdf
2/11/2023,7:47,Dusky Whaler,129,M,Alive,ID,Central Coast North,Point Beach,2023-11-02T07:47:00Z,2023,11,DUS,FALSE,TRUE,FALSE,2023-24-NSW-SMART-drumline-annual-report.pdf
16/11/2023,9:05,Shortfin Mako Shark,110,F,Alive,ID,Central Coast North,Point Beach,2023-11-16T09:05:00Z,2023,11,SMA,FALSE,TRUE,FALSE,2023-24-NSW-SMART-drumline-annual-report.pdf
26/12/2023,17:09,Dusky Whaler,131,M,Alive,ID,Central Coast North,Point Beach,2023-12-26T17:09:00Z,2023,12,DUS,FALSE,TRUE,FALSE,2023-24-NSW-SMART-drumline-annual-report.pdf
3/01/2024,NA,Dusky Whaler,181,M,Alive,ID,Central Coast North,Point Beach,NA,2024,1,DUS,FALSE,TRUE,FALSE,2023-24-NSW-SMART-drumline-annual-report.pdf
10/01/2024,11:04,Tiger Shark,144,M,Alive,"ID, A",Central Coast North,Point Beach,2024-01-10T11:04:00Z,2024,1,TIG,TRUE,TRUE,TRUE,2023-24-NSW-SMART-drumline-annual-report.pdf
12/02/2024,15:44,Dusky Whaler,161,F,Alive,ID,Central Coast North,Point Beach,2024-02-12T15:44:00Z,2024,2,DUS,FALSE,TRUE,FALSE,2023-24-NSW-SMART-drumline-annual-report.pdf
17/02/2024,16:08,Dusky Whaler,148,F,Alive,ID,Central Coast North,Point Beach,2024-02-17T16:08:00Z,2024,2,DUS,FALSE,TRUE,FALSE,2023-24-NSW-SMART-drumline-annual-report.pdf
13/03/2024,11:47,Dusky Whaler,171,F,Alive,ID,Central Coast North,Point Beach,2024-03-13T11:47:00Z,2024,3,DUS,FALSE,TRUE,FALSE,2023-24-NSW-SMART-drumline-annual-report.pdf
18/03/2024,13:00,Dusky Whaler,153,M,Alive,ID,Central Coast North,Point Beach,2024-03-18T13:00:00Z,2024,3,DUS,FALSE,TRUE,FALSE,2023-24-NSW-SMART-drumline-annual-report.pdf
27/05/2024,12:55,White Shark,236,M,Alive,"ID, A",Central Coast North,Point Beach,2024-05-27T12:55:00Z,2024,5,WHI,TRUE,TRUE,TRUE,2023-24-NSW-SMART-drumline-annual-report.pdf
7/06/2024,13:28,Bronze Whaler,249,F,Alive,ID,Central Coast North,Point Beach,2024-06-07T13:28:00Z,2024,6,BRO,FALSE,TRUE,FALSE,2023-24-NSW-SMART-drumline-annual-report.pdf
24/06/2024,8:54,Bronze Whaler,270,F,Alive,ID,Central Coast North,Point Beach,2024-06-24T08:54:00Z,2024,6,BRO,FALSE,TRUE,FALSE,2023-24-NSW-SMART-drumline-annual-report.pdf
15/07/2023,10:43,Bronze Whaler,301,F,Alive,ID,Central Coast North,Shelly Beach,2023-07-15T10:43:00Z,2023,7,BRO,FALSE,TRUE,FALSE,2023-24-NSW-SMART-drumline-annual-report.pdf
2/10/2023,9:12,White Shark,198,F,Alive,"ID, A",Central Coast North,Shelly Beach,2023-10-02T09:12:00Z,2023,10,WHI,TRUE,TRUE,TRUE,2023-24-NSW-SMART-drumline-annual-report.pdf
5/02/2024,9:06,Dusky Whaler,137,M,Alive,ID,Central Coast North,Shelly Beach,2024-02-05T09:06:00Z,2024,2,DUS,FALSE,TRUE,FALSE,2023-24-NSW-SMART-drumline-annual-report.pdf
8/04/2024,7:57,Dusky Whaler,147,F,Alive,ID,Central Coast North,Shelly Beach,2024-04-08T07:57:00Z,2024,4,DUS,FALSE,TRUE,FALSE,2023-24-NSW-SMART-drumline-annual-report.pdf
13/04/2024,NA,Dusky Whaler,163,M,Alive,ID,Central Coast North,Shelly Beach,NA,2024,4,DUS,FALSE,TRUE,FALSE,2023-24-NSW-SMART-drumline-annual-report.pdf
21/07/2023,8:51,Dusky Whaler,189,M,Alive,ID,Central Coast North,Soldiers Point Beach,2023-07-21T08:51:00Z,2023,7,DUS,FALSE,TRUE,FALSE,2023-24-NSW-SMART-drumline-annual-report.pdf
21/07/2023,12:24,Bronze Whaler,249,F,Alive,ID,Central Coast North,Soldiers Point Beach,2023-07-21T12:24:00Z,2023,7,BRO,FALSE,TRUE,FALSE,2023-24-NSW-SMART-drumline-annual-report.pdf
8/08/2023,9:01,Shortfin Mako Shark,130,M,Alive,ID,Central Coast North,Soldiers Point Beach,2023-08-08T09:01:00Z,2023,8,SMA,FALSE,TRUE,FALSE,2023-24-NSW-SMART-drumline-annual-report.pdf
29/08/2023,8:55,Shortfin Mako Shark,124,M,Alive,ID,Central Coast North,Soldiers Point Beach,2023-08-29T08:55:00Z,2023,8,SMA,FALSE,TRUE,FALSE,2023-24-NSW-SMART-drumline-annual-report.pdf
9/09/2023,10:38,Bronze Whaler,293,F,Alive,ID,Central Coast North,Soldiers Point Beach,2023-09-09T10:38:00Z,2023,9,BRO,FALSE,TRUE,FALSE,2023-24-NSW-SMART-drumline-annual-report.pdf
16/10/2023,8:46,Shortfin Mako Shark,154,M,Alive,ID,Central Coast North,Soldiers Point Beach,2023-10-16T08:46:00Z,2023,10,SMA,FALSE,TRUE,FALSE,2023-24-NSW-SMART-drumline-annual-report.pdf
8/11/2023,11:49,Dusky Whaler,164,M,Alive,ID,Central Coast North,Soldiers Point Beach,2023-11-08T11:49:00Z,2023,11,DUS,FALSE,TRUE,FALSE,2023-24-NSW-SMART-drumline-annual-report.pdf
22/11/2023,7:38,Bronze Whaler,255,M,Alive,ID,Central Coast North,Soldiers Point Beach,2023-11-22T07:38:00Z,2023,11,BRO,FALSE,TRUE,FALSE,2023-24-NSW-SMART-drumline-annual-report.pdf
4/02/2024,8:10,Dusky Whaler,142,F,Alive,ID,Central Coast North,Soldiers Point Beach,2024-02-04T08:10:00Z,2024,2,DUS,FALSE,TRUE,FALSE,2023-24-NSW-SMART-drumline-annual-report.pdf
20/02/2024,12:06,Dusky Whaler,129,F,Alive,ID,Central Coast North,Soldiers Point Beach,2024-02-20T12:06:00Z,2024,2,DUS,FALSE,TRUE,FALSE,2023-24-NSW-SMART-drumline-annual-report.pdf
7/03/2024,12:08,Dusky Whaler,167,F,Alive,ID,Central Coast North,Soldiers Point Beach,2024-03-07T12:08:00Z,2024,3,DUS,FALSE,TRUE,FALSE,2023-24-NSW-SMART-drumline-annual-report.pdf
22/03/2024,14:55,Dusky Whaler,145,M,Alive,ID,Central Coast North,Soldiers Point Beach,2024-03-22T14:55:00Z,2024,3,DUS,FALSE,TRUE,FALSE,2023-24-NSW-SMART-drumline-annual-report.pdf
29/03/2024,14:33,Dusky Whaler,137,M,Alive,ID,Central Coast North,Soldiers Point Beach,2024-03-29T14:33:00Z,2024,3,DUS,FALSE,TRUE,FALSE,2023-24-NSW-SMART-drumline-annual-report.pdf
3/04/2024,14:44,Dusky Whaler,141,F,Alive,ID,Central Coast North,Soldiers Point Beach,2024-04-03T14:44:00Z,2024,4,DUS,FALSE,TRUE,FALSE,2023-24-NSW-SMART-drumline-annual-report.pdf
7/04/2024,15:07,Dusky Whaler,170,F,Alive,ID,Central Coast North,Soldiers Point Beach,2024-04-07T15:07:00Z,2024,4,DUS,FALSE,TRUE,FALSE,2023-24-NSW-SMART-drumline-annual-report.pdf
28/04/2024,14:10,Dusky Whaler,155,M,Alive,ID,Central Coast North,Soldiers Point Beach,2024-04-28T14:10:00Z,2024,4,DUS,FALSE,TRUE,FALSE,2023-24-NSW-SMART-drumline-annual-report.pdf
28/07/2023,10:51,Bronze Whaler,269,F,Alive,ID,Central Coast North,The Entrance Beach,2023-07-28T10:51:00Z,2023,7,BRO,FALSE,TRUE,FALSE,2023-24-NSW-SMART-drumline-annual-report.pdf
23/10/2023,NA,Bronze Whaler,275,M,Dead,NA,Central Coast North,The Entrance Beach,NA,2023,10,BRO,FALSE,FALSE,FALSE,2023-24-NSW-SMART-drumline-annual-report.pdf
6/11/2023,14:50,Smooth Hammerhead,145,M,Alive,ID,Central Coast North,The Entrance Beach,2023-11-06T14:50:00Z,2023,11,SMH,FALSE,TRUE,FALSE,2023-24-NSW-SMART-drumline-annual-report.pdf
8/11/2023,10:30,Bronze Whaler,211,F,Alive,ID,Central Coast North,The Entrance Beach,2023-11-08T10:30:00Z,2023,11,BRO,FALSE,TRUE,FALSE,2023-24-NSW-SMART-drumline-annual-report.pdf
28/11/2023,NA,Dusky Whaler,110,M,Alive,ID,Central Coast North,The Entrance Beach,NA,2023,11,DUS,FALSE,TRUE,FALSE,2023-24-NSW-SMART-drumline-annual-report.pdf
29/12/2023,8:02,Smooth Hammerhead,170,M,Alive,ID,Central Coast North,The Entrance Beach,2023-12-29T08:02:00Z,2023,12,SMH,FALSE,TRUE,FALSE,2023-24-NSW-SMART-drumline-annual-report.pdf
3/01/2024,11:16,Shortfin Mako Shark,121,M,Alive,ID,Central Coast North,The Entrance Beach,2024-01-03T11:16:00Z,2024,1,SMA,FALSE,TRUE,FALSE,2023-24-NSW-SMART-drumline-annual-report.pdf
13/01/2024,15:40,Dusky Whaler,199,M,Alive,ID,Central Coast North,The Entrance Beach,2024-01-13T15:40:00Z,2024,1,DUS,FALSE,TRUE,FALSE,2023-24-NSW-SMART-drumline-annual-report.pdf
20/01/2024,12:28,Dusky Whaler,141,F,Alive,ID,Central Coast North,The Entrance Beach,2024-01-20T12:28:00Z,2024,1,DUS,FALSE,TRUE,FALSE,2023-24-NSW-SMART-drumline-annual-report.pdf
21/01/2024,15:09,Shortfin Mako Shark,119,M,Alive,ID,Central Coast North,The Entrance Beach,2024-01-21T15:09:00Z,2024,1,SMA,FALSE,TRUE,FALSE,2023-24-NSW-SMART-drumline-annual-report.pdf
12/02/2024,12:25,Dusky Whaler,108,M,Alive,ID,Central Coast North,The Entrance Beach,2024-02-12T12:25:00Z,2024,2,DUS,FALSE,TRUE,FALSE,2023-24-NSW-SMART-drumline-annual-report.pdf
12/02/2024,16:47,Smooth Hammerhead,167,M,Alive,ID,Central Coast North,The Entrance Beach,2024-02-12T16:47:00Z,2024,2,SMH,FALSE,TRUE,FALSE,2023-24-NSW-SMART-drumline-annual-report.pdf
13/02/2024,9:12,Dusky Whaler,199,M,Alive,ID,Central Coast North,The Entrance Beach,2024-02-13T09:12:00Z,2024,2,DUS,FALSE,TRUE,FALSE,2023-24-NSW-SMART-drumline-annual-report.pdf
15/02/2024,16:25,Dusky Whaler,187,F,Alive,ID,Central Coast North,The Entrance Beach,2024-02-15T16:25:00Z,2024,2,DUS,FALSE,TRUE,FALSE,2023-24-NSW-SMART-drumline-annual-report.pdf
17/02/2024,10:41,Smooth Hammerhead,174,M,Alive,ID,Central Coast North,The Entrance Beach,2024-02-17T10:41:00Z,2024,2,SMH,FALSE,TRUE,FALSE,2023-24-NSW-SMART-drumline-annual-report.pdf
7/03/2024,14:37,Dusky Whaler,129,M,Alive,ID,Central Coast North,The Entrance Beach,2024-03-07T14:37:00Z,2024,3,DUS,FALSE,TRUE,FALSE,2023-24-NSW-SMART-drumline-annual-report.pdf
12/03/2024,9:21,Dusky Whaler,152,F,Alive,ID,Central Coast North,The Entrance Beach,2024-03-12T09:21:00Z,2024,3,DUS,FALSE,TRUE,FALSE,2023-24-NSW-SMART-drumline-annual-report.pdf
12/03/2024,14:58,Dusky Whaler,237,F,Alive,ID,Central Coast North,The Entrance Beach,2024-03-12T14:58:00Z,2024,3,DUS,FALSE,TRUE,FALSE,2023-24-NSW-SMART-drumline-annual-report.pdf
14/03/2024,12:03,Dusky Whaler,191,F,Alive,ID,Central Coast North,The Entrance Beach,2024-03-14T12:03:00Z,2024,3,DUS,FALSE,TRUE,FALSE,2023-24-NSW-SMART-drumline-annual-report.pdf
23/03/2024,9:45,Dusky Whaler,176,F,Alive,ID,Central Coast North,The Entrance Beach,2024-03-23T09:45:00Z,2024,3,DUS,FALSE,TRUE,FALSE,2023-24-NSW-SMART-drumline-annual-report.pdf
23/03/2024,11:18,Dusky Whaler,151,F,Alive,ID,Central Coast North,The Entrance Beach,2024-03-23T11:18:00Z,2024,3,DUS,FALSE,TRUE,FALSE,2023-24-NSW-SMART-drumline-annual-report.pdf
9/04/2024,9:47,Dusky Whaler,139,M,Alive,ID,Central Coast North,The Entrance Beach,2024-04-09T09:47:00Z,2024,4,DUS,FALSE,TRUE,FALSE,2023-24-NSW-SMART-drumline-annual-report.pdf
13/04/2024,13:50,Dusky Whaler,183,F,Alive,ID,Central Coast North,The Entrance Beach,2024-04-13T13:50:00Z,2024,4,DUS,FALSE,TRUE,FALSE,2023-24-NSW-SMART-drumline-annual-report.pdf
28/04/2024,9:28,Dusky Whaler,138,F,Alive,ID,Central Coast North,The Entrance Beach,2024-04-28T09:28:00Z,2024,4,DUS,FALSE,TRUE,FALSE,2023-24-NSW-SMART-drumline-annual-report.pdf
29/04/2024,8:37,Smooth Hammerhead,160,F,Alive,ID,Central Coast North,The Entrance Beach,2024-04-29T08:37:00Z,2024,4,SMH,FALSE,TRUE,FALSE,2023-24-NSW-SMART-drumline-annual-report.pdf
4/05/2024,8:37,Dusky Whaler,163,F,Alive,ID,Central Coast North,The Entrance Beach,2024-05-04T08:37:00Z,2024,5,DUS,FALSE,TRUE,FALSE,2023-24-NSW-SMART-drumline-annual-report.pdf
5/05/2024,8:48,Dusky Whaler,189,F,Alive,ID,Central Coast North,The Entrance Beach,2024-05-05T08:48:00Z,2024,5,DUS,FALSE,TRUE,FALSE,2023-24-NSW-SMART-drumline-annual-report.pdf
24/05/2024,9:38,Dusky Whaler,141,F,Alive,ID,Central Coast North,The Entrance Beach,2024-05-24T09:38:00Z,2024,5,DUS,FALSE,TRUE,FALSE,2023-24-NSW-SMART-drumline-annual-report.pdf
24/05/2024,12:34,Dusky Whaler,131,M,Alive,ID,Central Coast North,The Entrance Beach,2024-05-24T12:34:00Z,2024,5,DUS,FALSE,TRUE,FALSE,2023-24-NSW-SMART-drumline-annual-report.pdf
30/05/2024,9:12,White Shark,196,F,Alive,"ID, A",Central Coast North,The Entrance Beach,2024-05-30T09:12:00Z,2024,5,WHI,TRUE,TRUE,TRUE,2023-24-NSW-SMART-drumline-annual-report.pdf
14/06/2024,9:29,Dusky Whaler,145,M,Alive,ID,Central Coast North,The Entrance Beach,2024-06-14T09:29:00Z,2024,6,DUS,FALSE,TRUE,FALSE,2023-24-NSW-SMART-drumline-annual-report.pdf
27/06/2024,11:56,White Shark,278,M,Alive,"ID, A",Central Coast North,The Entrance Beach,2024-06-27T11:56:00Z,2024,6,WHI,TRUE,TRUE,TRUE,2023-24-NSW-SMART-drumline-annual-report.pdf
27/06/2024,12:19,Bronze Whaler,289,F,Alive,ID,Central Coast North,The Entrance Beach,2024-06-27T12:19:00Z,2024,6,BRO,FALSE,TRUE,FALSE,2023-24-NSW-SMART-drumline-annual-report.pdf
4/08/2023,NA,Bronze Whaler,230,F,Dead,NA,Central Coast North,Toowoon Bay,NA,2023,8,BRO,FALSE,FALSE,FALSE,2023-24-NSW-SMART-drumline-annual-report.pdf
5/02/2024,14:34,Dusky Whaler,185,F,Alive,ID,Central Coast North,Toowoon Bay,2024-02-05T14:34:00Z,2024,2,DUS,FALSE,TRUE,FALSE,2023-24-NSW-SMART-drumline-annual-report.pdf
20/06/2024,8:39,Bronze Whaler,246,F,Alive,ID,Central Coast North,Toowoon Bay,2024-06-20T08:39:00Z,2024,6,BRO,FALSE,TRUE,FALSE,2023-24-NSW-SMART-drumline-annual-report.pdf
9/07/2023,9:31,Bronze Whaler,213,F,Alive,ID,Central Coast South,Avoca Beach,2023-07-09T09:31:00Z,2023,7,BRO,FALSE,TRUE,FALSE,2023-24-NSW-SMART-drumline-annual-report.pdf
17/09/2023,11:32,Bronze Whaler,233,F,Alive,ID,Central Coast South,Avoca Beach,2023-09-17T11:32:00Z,2023,9,BRO,FALSE,TRUE,FALSE,2023-24-NSW-SMART-drumline-annual-report.pdf
28/09/2023,13:35,Dusky Whaler,167,M,Alive,ID,Central Coast South,Avoca Beach,2023-09-28T13:35:00Z,2023,9,DUS,FALSE,TRUE,FALSE,2023-24-NSW-SMART-drumline-annual-report.pdf
4/11/2023,16:49,Dusky Whaler,144,F,Alive,ID,Central Coast South,Avoca Beach,2023-11-04T16:49:00Z,2023,11,DUS,FALSE,TRUE,FALSE,2023-24-NSW-SMART-drumline-annual-report.pdf
14/11/2023,12:21,Dusky Whaler,164,M,Alive,ID,Central Coast South,Avoca Beach,2023-11-14T12:21:00Z,2023,11,DUS,FALSE,TRUE,FALSE,2023-24-NSW-SMART-drumline-annual-report.pdf
21/11/2023,6:17,Shortfin Mako Shark,157,F,Alive,ID,Central Coast South,Avoca Beach,2023-11-21T06:17:00Z,2023,11,SMA,FALSE,TRUE,FALSE,2023-24-NSW-SMART-drumline-annual-report.pdf
3/02/2024,10:29,Dusky Whaler,145,F,Alive,ID,Central Coast South,Avoca Beach,2024-02-03T10:29:00Z,2024,2,DUS,FALSE,TRUE,FALSE,2023-24-NSW-SMART-drumline-annual-report.pdf
5/03/2024,9:25,Dusky Whaler,173,M,Alive,ID,Central Coast South,Avoca Beach,2024-03-05T09:25:00Z,2024,3,DUS,FALSE,TRUE,FALSE,2023-24-NSW-SMART-drumline-annual-report.pdf
5/03/2024,16:56,Dusky Whaler,202,M,Alive,ID,Central Coast South,Avoca Beach,2024-03-05T16:56:00Z,2024,3,DUS,FALSE,TRUE,FALSE,2023-24-NSW-SMART-drumline-annual-report.pdf
13/03/2024,9:07,Dusky Whaler,151,M,Alive,ID,Central Coast South,Avoca Beach,2024-03-13T09:07:00Z,2024,3,DUS,FALSE,TRUE,FALSE,2023-24-NSW-SMART-drumline-annual-report.pdf
24/03/2024,16:49,Smooth Hammerhead,138,M,Alive,ID,Central Coast South,Avoca Beach,2024-03-24T16:49:00Z,2024,3,SMH,FALSE,TRUE,FALSE,2023-24-NSW-SMART-drumline-annual-report.pdf
25/03/2024,8:09,Dusky Whaler,151,F,Alive,ID,Central Coast South,Avoca Beach,2024-03-25T08:09:00Z,2024,3,DUS,FALSE,TRUE,FALSE,2023-24-NSW-SMART-drumline-annual-report.pdf
5/05/2024,7:54,Dusky Whaler,145,F,Alive,ID,Central Coast South,Avoca Beach,2024-05-05T07:54:00Z,2024,5,DUS,FALSE,TRUE,FALSE,2023-24-NSW-SMART-drumline-annual-report.pdf
7/09/2023,8:00,Bronze Whaler,235,F,Alive,ID,Central Coast South,Copacabana Beach,2023-09-07T08:00:00Z,2023,9,BRO,FALSE,TRUE,FALSE,2023-24-NSW-SMART-drumline-annual-report.pdf
3/02/2024,9:22,Dusky Whaler,167,M,Alive,ID,Central Coast South,Forresters Beach,2024-02-03T09:22:00Z,2024,2,DUS,FALSE,TRUE,FALSE,2023-24-NSW-SMART-drumline-annual-report.pdf
17/02/2024,8:54,Dusky Whaler,124,M,Alive,ID,Central Coast South,Forresters Beach,2024-02-17T08:54:00Z,2024,2,DUS,FALSE,TRUE,FALSE,2023-24-NSW-SMART-drumline-annual-report.pdf
7/04/2024,9:38,Dusky Whaler,124,F,Alive,ID,Central Coast South,Forresters Beach,2024-04-07T09:38:00Z,2024,4,DUS,FALSE,TRUE,FALSE,2023-24-NSW-SMART-drumline-annual-report.pdf
7/04/2024,14:20,Dusky Whaler,186,F,Alive,ID,Central Coast South,Forresters Beach,2024-04-07T14:20:00Z,2024,4,DUS,FALSE,TRUE,FALSE,2023-24-NSW-SMART-drumline-annual-report.pdf
25/08/2023,12:14,Tiger Shark,366,F,Alive,"ID, A",Central Coast South,Macmasters Beach,2023-08-25T12:14:00Z,2023,8,TIG,TRUE,TRUE,TRUE,2023-24-NSW-SMART-drumline-annual-report.pdf
24/11/2023,14:48,Dusky Whaler,130,F,Alive,ID,Central Coast South,Macmasters Beach,2023-11-24T14:48:00Z,2023,11,DUS,FALSE,TRUE,FALSE,2023-24-NSW-SMART-drumline-annual-report.pdf
25/12/2023,7:06,Dusky Whaler,142,F,Alive,ID,Central Coast South,Macmasters Beach,2023-12-25T07:06:00Z,2023,12,DUS,FALSE,TRUE,FALSE,2023-24-NSW-SMART-drumline-annual-report.pdf
11/01/2024,14:03,Dusky Whaler,185,M,Alive,ID,Central Coast South,Macmasters Beach,2024-01-11T14:03:00Z,2024,1,DUS,FALSE,TRUE,FALSE,2023-24-NSW-SMART-drumline-annual-report.pdf
24/01/2024,10:41,Dusky Whaler,157,F,Alive,ID,Central Coast South,Macmasters Beach,2024-01-24T10:41:00Z,2024,1,DUS,FALSE,TRUE,FALSE,2023-24-NSW-SMART-drumline-annual-report.pdf
3/02/2024,9:04,Dusky Whaler,115,F,Alive,ID,Central Coast South,Macmasters Beach,2024-02-03T09:04:00Z,2024,2,DUS,FALSE,TRUE,FALSE,2023-24-NSW-SMART-drumline-annual-report.pdf
12/02/2024,12:50,Dusky Whaler,130,F,Alive,ID,Central Coast South,Macmasters Beach,2024-02-12T12:50:00Z,2024,2,DUS,FALSE,TRUE,FALSE,2023-24-NSW-SMART-drumline-annual-report.pdf
15/02/2024,9:29,Dusky Whaler,137,F,Alive,ID,Central Coast South,Macmasters Beach,2024-02-15T09:29:00Z,2024,2,DUS,FALSE,TRUE,FALSE,2023-24-NSW-SMART-drumline-annual-report.pdf
5/03/2024,12:18,Dusky Whaler,156,M,Alive,ID,Central Coast South,Macmasters Beach,2024-03-05T12:18:00Z,2024,3,DUS,FALSE,TRUE,FALSE,2023-24-NSW-SMART-drumline-annual-report.pdf
5/03/2024,15:35,Dusky Whaler,159,F,Alive,ID,Central Coast South,Macmasters Beach,2024-03-05T15:35:00Z,2024,3,DUS,FALSE,TRUE,FALSE,2023-24-NSW-SMART-drumline-annual-report.pdf
7/04/2024,7:36,Dusky Whaler,165,F,Alive,ID,Central Coast South,Macmasters Beach,2024-04-07T07:36:00Z,2024,4,DUS,FALSE,TRUE,FALSE,2023-24-NSW-SMART-drumline-annual-report.pdf
7/04/2024,15:03,Dusky Whaler,139,F,Alive,ID,Central Coast South,Macmasters Beach,2024-04-07T15:03:00Z,2024,4,DUS,FALSE,TRUE,FALSE,2023-24-NSW-SMART-drumline-annual-report.pdf
18/04/2024,8:48,Dusky Whaler,169,F,Alive,ID,Central Coast South,Macmasters Beach,2024-04-18T08:48:00Z,2024,4,DUS,FALSE,TRUE,FALSE,2023-24-NSW-SMART-drumline-annual-report.pdf
19/04/2024,9:23,Dusky Whaler,130,M,Alive,ID,Central Coast South,Macmasters Beach,2024-04-19T09:23:00Z,2024,4,DUS,FALSE,TRUE,FALSE,2023-24-NSW-SMART-drumline-annual-report.pdf
29/04/2024,9:43,Dusky Whaler,151,M,Alive,ID,Central Coast South,Macmasters Beach,2024-04-29T09:43:00Z,2024,4,DUS,FALSE,TRUE,FALSE,2023-24-NSW-SMART-drumline-annual-report.pdf
9/05/2024,12:21,Dusky Whaler,174,M,Alive,ID,Central Coast South,Macmasters Beach,2024-05-09T12:21:00Z,2024,5,DUS,FALSE,TRUE,FALSE,2023-24-NSW-SMART-drumline-annual-report.pdf
22/10/2023,10:05,White Shark,200,F,Alive,"ID, A",Central Coast South,North Avoca Beach,2023-10-22T10:05:00Z,2023,10,WHI,TRUE,TRUE,TRUE,2023-24-NSW-SMART-drumline-annual-report.pdf
2/11/2023,15:46,Dusky Whaler,122,M,Alive,ID,Central Coast South,North Avoca Beach,2023-11-02T15:46:00Z,2023,11,DUS,FALSE,TRUE,FALSE,2023-24-NSW-SMART-drumline-annual-report.pdf
7/12/2023,12:43,Dusky Whaler,129,M,Alive,ID,Central Coast South,North Avoca Beach,2023-12-07T12:43:00Z,2023,12,DUS,FALSE,TRUE,FALSE,2023-24-NSW-SMART-drumline-annual-report.pdf
12/05/2024,NA,Tailor,49,NA,Alive,NA,Central Coast South,North Avoca Beach,NA,2024,5,TLR,FALSE,FALSE,FALSE,2023-24-NSW-SMART-drumline-annual-report.pdf
28/05/2024,NA,Dusky Whaler,138,M,Alive,ID,Central Coast South,North Avoca Beach,NA,2024,5,DUS,FALSE,TRUE,FALSE,2023-24-NSW-SMART-drumline-annual-report.pdf
29/05/2024,14:30,Dusky Whaler,132,M,Alive,ID,Central Coast South,North Avoca Beach,2024-05-29T14:30:00Z,2024,5,DUS,FALSE,TRUE,FALSE,2023-24-NSW-SMART-drumline-annual-report.pdf
27/07/2023,8:59,Bronze Whaler,259,F,Alive,ID,Central Coast South,Terrigal Beach,2023-07-27T08:59:00Z,2023,7,BRO,FALSE,TRUE,FALSE,2023-24-NSW-SMART-drumline-annual-report.pdf
25/08/2023,NA,Dusky Whaler,123,F,Alive,ID,Central Coast South,Terrigal Beach,NA,2023,8,DUS,FALSE,TRUE,FALSE,2023-24-NSW-SMART-drumline-annual-report.pdf
6/09/2023,14:16,Bronze Whaler,262,F,Alive,ID,Central Coast South,Terrigal Beach,2023-09-06T14:16:00Z,2023,9,BRO,FALSE,TRUE,FALSE,2023-24-NSW-SMART-drumline-annual-report.pdf
9/10/2023,13:02,Shortfin Mako Shark,199,M,Alive,ID,Central Coast South,Terrigal Beach,2023-10-09T13:02:00Z,2023,10,SMA,FALSE,TRUE,FALSE,2023-24-NSW-SMART-drumline-annual-report.pdf
8/11/2023,10:41,Dusky Whaler,124,M,Alive,ID,Central Coast South,Terrigal Beach,2023-11-08T10:41:00Z,2023,11,DUS,FALSE,TRUE,FALSE,2023-24-NSW-SMART-drumline-annual-report.pdf
18/01/2024,NA,Tiger Shark,149,F,Alive,"ID, A",Central Coast South,Terrigal Beach,NA,2024,1,TIG,TRUE,TRUE,TRUE,2023-24-NSW-SMART-drumline-annual-report.pdf
3/02/2024,11:11,Dusky Whaler,165,M,Alive,ID,Central Coast South,Terrigal Beach,2024-02-03T11:11:00Z,2024,2,DUS,FALSE,TRUE,FALSE,2023-24-NSW-SMART-drumline-annual-report.pdf
13/04/2024,13:38,Dusky Whaler,179,F,Alive,ID,Central Coast South,Terrigal Beach,2024-04-13T13:38:00Z,2024,4,DUS,FALSE,TRUE,FALSE,2023-24-NSW-SMART-drumline-annual-report.pdf
19/04/2024,12:43,Dusky Whaler,133,M,Alive,ID,Central Coast South,Terrigal Beach,2024-04-19T12:43:00Z,2024,4,DUS,FALSE,TRUE,FALSE,2023-24-NSW-SMART-drumline-annual-report.pdf
30/05/2024,12:53,Dusky Whaler,151,F,Alive,ID,Central Coast South,Terrigal Beach,2024-05-30T12:53:00Z,2024,5,DUS,FALSE,TRUE,FALSE,2023-24-NSW-SMART-drumline-annual-report.pdf
20/06/2024,9:18,Dusky Whaler,130,M,Alive,ID,Central Coast South,Terrigal Beach,2024-06-20T09:18:00Z,2024,6,DUS,FALSE,TRUE,FALSE,2023-24-NSW-SMART-drumline-annual-report.pdf
11/07/2023,11:13,Dusky Whaler,138,F,Alive,ID,Central Coast South,Wamberal Beach,2023-07-11T11:13:00Z,2023,7,DUS,FALSE,TRUE,FALSE,2023-24-NSW-SMART-drumline-annual-report.pdf
30/08/2023,8:13,Shortfin Mako Shark,148,M,Alive,ID,Central Coast South,Wamberal Beach,2023-08-30T08:13:00Z,2023,8,SMA,FALSE,TRUE,FALSE,2023-24-NSW-SMART-drumline-annual-report.pdf
1/11/2023,10:16,Dusky Whaler,106,M,Alive,ID,Central Coast South,Wamberal Beach,2023-11-01T10:16:00Z,2023,11,DUS,FALSE,TRUE,FALSE,2023-24-NSW-SMART-drumline-annual-report.pdf
3/11/2023,13:27,Dusky Whaler,155,M,Alive,ID,Central Coast South,Wamberal Beach,2023-11-03T13:27:00Z,2023,11,DUS,FALSE,TRUE,FALSE,2023-24-NSW-SMART-drumline-annual-report.pdf
7/11/2023,7:24,Dusky Whaler,148,F,Alive,ID,Central Coast South,Wamberal Beach,2023-11-07T07:24:00Z,2023,11,DUS,FALSE,TRUE,FALSE,2023-24-NSW-SMART-drumline-annual-report.pdf
10/11/2023,13:21,Shortfin Mako Shark,148,M,Alive,ID,Central Coast South,Wamberal Beach,2023-11-10T13:21:00Z,2023,11,SMA,FALSE,TRUE,FALSE,2023-24-NSW-SMART-drumline-annual-report.pdf
20/11/2023,13:41,Dusky Whaler,132,F,Alive,ID,Central Coast South,Wamberal Beach,2023-11-20T13:41:00Z,2023,11,DUS,FALSE,TRUE,FALSE,2023-24-NSW-SMART-drumline-annual-report.pdf
30/11/2023,10:39,Dusky Whaler,119,F,Alive,ID,Central Coast South,Wamberal Beach,2023-11-30T10:39:00Z,2023,11,DUS,FALSE,TRUE,FALSE,2023-24-NSW-SMART-drumline-annual-report.pdf
24/12/2023,7:50,Dusky Whaler,127,F,Alive,ID,Central Coast South,Wamberal Beach,2023-12-24T07:50:00Z,2023,12,DUS,FALSE,TRUE,FALSE,2023-24-NSW-SMART-drumline-annual-report.pdf
3/01/2024,10:36,Dusky Whaler,123,F,Alive,ID,Central Coast South,Wamberal Beach,2024-01-03T10:36:00Z,2024,1,DUS,FALSE,TRUE,FALSE,2023-24-NSW-SMART-drumline-annual-report.pdf
9/05/2024,12:39,Dusky Whaler,151,F,Alive,ID,Central Coast South,Wamberal Beach,2024-05-09T12:39:00Z,2024,5,DUS,FALSE,TRUE,FALSE,2023-24-NSW-SMART-drumline-annual-report.pdf
27/05/2024,8:29,Dusky Whaler,130,M,Alive,ID,Central Coast South,Wamberal Beach,2024-05-27T08:29:00Z,2024,5,DUS,FALSE,TRUE,FALSE,2023-24-NSW-SMART-drumline-annual-report.pdf
18/06/2024,NA,Dusky Whaler,NA,NA,Dead,NA,Central Coast South,Wamberal Beach,NA,2024,6,DUS,FALSE,FALSE,FALSE,2023-24-NSW-SMART-drumline-annual-report.pdf
18/06/2024,NA,Bull Shark,300,NA,Alive,NA,Central Coast South,Wamberal Beach,NA,2024,6,BUL,TRUE,FALSE,FALSE,2023-24-NSW-SMART-drumline-annual-report.pdf
3/07/2023,13:55,Scalloped Hammerhead,256,F,Alive,ID,Coffs Harbour,Boambee Beach,2023-07-03T13:55:00Z,2023,7,SCH,FALSE,TRUE,FALSE,2023-24-NSW-SMART-drumline-annual-report.pdf
11/07/2023,8:26,Dusky Whaler,131,F,Alive,ID,Coffs Harbour,Boambee Beach,2023-07-11T08:26:00Z,2023,7,DUS,FALSE,TRUE,FALSE,2023-24-NSW-SMART-drumline-annual-report.pdf
11/07/2023,15:37,White Shark,222,F,Alive,"ID, A",Coffs Harbour,Boambee Beach,2023-07-11T15:37:00Z,2023,7,WHI,TRUE,TRUE,TRUE,2023-24-NSW-SMART-drumline-annual-report.pdf
14/07/2023,12:56,White Shark,192,F,Alive,"ID, A",Coffs Harbour,Boambee Beach,2023-07-14T12:56:00Z,2023,7,WHI,TRUE,TRUE,TRUE,2023-24-NSW-SMART-drumline-annual-report.pdf
25/07/2023,10:36,Shortfin Mako Shark,152,F,Alive,ID,Coffs Harbour,Boambee Beach,2023-07-25T10:36:00Z,2023,7,SMA,FALSE,TRUE,FALSE,2023-24-NSW-SMART-drumline-annual-report.pdf
29/07/2023,12:10,White Shark,199,F,Alive,"ID, A",Coffs Harbour,Boambee Beach,2023-07-29T12:10:00Z,2023,7,WHI,TRUE,TRUE,TRUE,2023-24-NSW-SMART-drumline-annual-report.pdf
6/08/2023,13:30,Bronze Whaler,275,F,Alive,ID,Coffs Harbour,Boambee Beach,2023-08-06T13:30:00Z,2023,8,BRO,FALSE,TRUE,FALSE,2023-24-NSW-SMART-drumline-annual-report.pdf
12/08/2023,12:49,Bronze Whaler,272,F,Alive,ID,Coffs Harbour,Boambee Beach,2023-08-12T12:49:00Z,2023,8,BRO,FALSE,TRUE,FALSE,2023-24-NSW-SMART-drumline-annual-report.pdf
30/08/2023,14:38,Bronze Whaler,269,M,Alive,ID,Coffs Harbour,Boambee Beach,2023-08-30T14:38:00Z,2023,8,BRO,FALSE,TRUE,FALSE,2023-24-NSW-SMART-drumline-annual-report.pdf
5/09/2023,10:34,White Shark,284,F,Alive,"ID, A",Coffs Harbour,Boambee Beach,2023-09-05T10:34:00Z,2023,9,WHI,TRUE,TRUE,TRUE,2023-24-NSW-SMART-drumline-annual-report.pdf
21/09/2023,8:39,White Shark,331,M,Alive,"ID, A",Coffs Harbour,Boambee Beach,2023-09-21T08:39:00Z,2023,9,WHI,TRUE,TRUE,TRUE,2023-24-NSW-SMART-drumline-annual-report.pdf
23/09/2023,13:21,White Shark,259,F,Alive,"ID, A",Coffs Harbour,Boambee Beach,2023-09-23T13:21:00Z,2023,9,WHI,TRUE,TRUE,TRUE,2023-24-NSW-SMART-drumline-annual-report.pdf
24/09/2023,11:10,White Shark,317,F,Alive,"ID, A",Coffs Harbour,Boambee Beach,2023-09-24T11:10:00Z,2023,9,WHI,TRUE,TRUE,TRUE,2023-24-NSW-SMART-drumline-annual-report.pdf
26/09/2023,12:38,Bronze Whaler,273,M,Alive,ID,Coffs Harbour,Boambee Beach,2023-09-26T12:38:00Z,2023,9,BRO,FALSE,TRUE,FALSE,2023-24-NSW-SMART-drumline-annual-report.pdf
19/10/2023,13:13,White Shark,348,F,Alive,"ID, A",Coffs Harbour,Boambee Beach,2023-10-19T13:13:00Z,2023,10,WHI,TRUE,TRUE,TRUE,2023-24-NSW-SMART-drumline-annual-report.pdf
29/10/2023,14:30,Bronze Whaler,282,M,Alive,ID,Coffs Harbour,Boambee Beach,2023-10-29T14:30:00Z,2023,10,BRO,FALSE,TRUE,FALSE,2023-24-NSW-SMART-drumline-annual-report.pdf
3/12/2023,17:50,Dusky Whaler,160,F,Alive,ID,Coffs Harbour,Boambee Beach,2023-12-03T17:50:00Z,2023,12,DUS,FALSE,TRUE,FALSE,2023-24-NSW-SMART-drumline-annual-report.pdf
2/01/2024,9:03,Tiger Shark,290,M,Alive,"ID, A",Coffs Harbour,Boambee Beach,2024-01-02T09:03:00Z,2024,1,TIG,TRUE,TRUE,TRUE,2023-24-NSW-SMART-drumline-annual-report.pdf
10/02/2024,10:23,Tiger Shark,83,NA,Dead,NA,Coffs Harbour,Boambee Beach,2024-02-10T10:23:00Z,2024,2,TIG,TRUE,FALSE,FALSE,2023-24-NSW-SMART-drumline-annual-report.pdf
27/02/2024,8:26,Tiger Shark,207,F,Alive,"ID, A",Coffs Harbour,Boambee Beach,2024-02-27T08:26:00Z,2024,2,TIG,TRUE,TRUE,TRUE,2023-24-NSW-SMART-drumline-annual-report.pdf
27/04/2024,9:35,Scalloped Hammerhead,157,F,Alive,ID,Coffs Harbour,Boambee Beach,2024-04-27T09:35:00Z,2024,4,SCH,FALSE,TRUE,FALSE,2023-24-NSW-SMART-drumline-annual-report.pdf
23/05/2024,11:09,Greynurse Shark,263,F,Alive,ID,Coffs Harbour,Boambee Beach,2024-05-23T11:09:00Z,2024,5,GRN,FALSE,TRUE,FALSE,2023-24-NSW-SMART-drumline-annual-report.pdf
8/06/2024,11:01,Tiger Shark,282,F,Alive,"ID, A",Coffs Harbour,Boambee Beach,2024-06-08T11:01:00Z,2024,6,TIG,TRUE,TRUE,TRUE,2023-24-NSW-SMART-drumline-annual-report.pdf
10/06/2024,12:18,Tiger Shark,269,F,Alive,"ID, A",Coffs Harbour,Boambee Beach,2024-06-10T12:18:00Z,2024,6,TIG,TRUE,TRUE,TRUE,2023-24-NSW-SMART-drumline-annual-report.pdf
7/11/2023,13:44,White Shark,221,M,Alive,"ID, A",Coffs Harbour,Boambee Beach,2023-11-07T13:44:00Z,2023,11,WHI,TRUE,TRUE,TRUE,2023-24-NSW-SMART-drumline-annual-report.pdf
19/08/2023,8:34,Bronze Whaler,295,F,Alive,ID,Coffs Harbour,Boambee Headland,2023-08-19T08:34:00Z,2023,8,BRO,FALSE,TRUE,FALSE,2023-24-NSW-SMART-drumline-annual-report.pdf
29/08/2023,8:40,Bronze Whaler,288,F,Alive,ID,Coffs Harbour,Boambee Headland,2023-08-29T08:40:00Z,2023,8,BRO,FALSE,TRUE,FALSE,2023-24-NSW-SMART-drumline-annual-report.pdf
19/10/2023,8:25,Smooth Hammerhead,161,F,Dead,NA,Coffs Harbour,Boambee Headland,2023-10-19T08:25:00Z,2023,10,SMH,FALSE,FALSE,FALSE,2023-24-NSW-SMART-drumline-annual-report.pdf
24/06/2024,9:52,Tiger Shark,199,F,Alive,"ID, A",Coffs Harbour,Boambee Headland,2024-06-24T09:52:00Z,2024,6,TIG,TRUE,TRUE,TRUE,2023-24-NSW-SMART-drumline-annual-report.pdf
6/07/2023,8:57,Dusky Whaler,135,F,Alive,ID,Coffs Harbour,Diggers Beach,2023-07-06T08:57:00Z,2023,7,DUS,FALSE,TRUE,FALSE,2023-24-NSW-SMART-drumline-annual-report.pdf
9/07/2023,10:25,Common Blacktip,270,F,Alive,ID,Coffs Harbour,Diggers Beach,2023-07-09T10:25:00Z,2023,7,CBT,FALSE,TRUE,FALSE,2023-24-NSW-SMART-drumline-annual-report.pdf
14/07/2023,9:06,Bronze Whaler,247,NA,Alive,ID,Coffs Harbour,Diggers Beach,2023-07-14T09:06:00Z,2023,7,BRO,FALSE,TRUE,FALSE,2023-24-NSW-SMART-drumline-annual-report.pdf
4/08/2023,13:51,Dusky Whaler,144,F,Alive,ID,Coffs Harbour,Diggers Beach,2023-08-04T13:51:00Z,2023,8,DUS,FALSE,TRUE,FALSE,2023-24-NSW-SMART-drumline-annual-report.pdf
23/08/2023,16:03,White Shark,173,F,Alive,"ID, A",Coffs Harbour,Diggers Beach,2023-08-23T16:03:00Z,2023,8,WHI,TRUE,TRUE,TRUE,2023-24-NSW-SMART-drumline-annual-report.pdf
24/08/2023,10:14,Dusky Whaler,144,F,Alive,ID,Coffs Harbour,Diggers Beach,2023-08-24T10:14:00Z,2023,8,DUS,FALSE,TRUE,FALSE,2023-24-NSW-SMART-drumline-annual-report.pdf
1/09/2023,8:34,Bronze Whaler,277,F,Alive,ID,Coffs Harbour,Diggers Beach,2023-09-01T08:34:00Z,2023,9,BRO,FALSE,TRUE,FALSE,2023-24-NSW-SMART-drumline-annual-report.pdf
11/09/2023,16:09,Bronze Whaler,261,M,Alive,ID,Coffs Harbour,Diggers Beach,2023-09-11T16:09:00Z,2023,9,BRO,FALSE,TRUE,FALSE,2023-24-NSW-SMART-drumline-annual-report.pdf
15/09/2023,7:47,White Shark,203,M,Alive,"ID, A",Coffs Harbour,Diggers Beach,2023-09-15T07:47:00Z,2023,9,WHI,TRUE,TRUE,TRUE,2023-24-NSW-SMART-drumline-annual-report.pdf
23/09/2023,15:12,White Shark,289,M,Alive,"ID, A",Coffs Harbour,Diggers Beach,2023-09-23T15:12:00Z,2023,9,WHI,TRUE,TRUE,TRUE,2023-24-NSW-SMART-drumline-annual-report.pdf
25/09/2023,9:49,Bronze Whaler,269,M,Alive,ID,Coffs Harbour,Diggers Beach,2023-09-25T09:49:00Z,2023,9,BRO,FALSE,TRUE,FALSE,2023-24-NSW-SMART-drumline-annual-report.pdf
28/09/2023,15:40,Scalloped Hammerhead,195,M,Alive,ID,Coffs Harbour,Diggers Beach,2023-09-28T15:40:00Z,2023,9,SCH,FALSE,TRUE,FALSE,2023-24-NSW-SMART-drumline-annual-report.pdf
2/10/2023,10:36,White Shark,321,F,Alive,"ID, A",Coffs Harbour,Diggers Beach,2023-10-02T10:36:00Z,2023,10,WHI,TRUE,TRUE,TRUE,2023-24-NSW-SMART-drumline-annual-report.pdf
5/10/2023,13:52,Bronze Whaler,273,M,Alive,ID,Coffs Harbour,Diggers Beach,2023-10-05T13:52:00Z,2023,10,BRO,FALSE,TRUE,FALSE,2023-24-NSW-SMART-drumline-annual-report.pdf
15/10/2023,7:24,Greynurse Shark,276,F,Alive,ID,Coffs Harbour,Diggers Beach,2023-10-15T07:24:00Z,2023,10,GRN,FALSE,TRUE,FALSE,2023-24-NSW-SMART-drumline-annual-report.pdf
23/10/2023,12:41,Bronze Whaler,273,F,Alive,ID,Coffs Harbour,Diggers Beach,2023-10-23T12:41:00Z,2023,10,BRO,FALSE,TRUE,FALSE,2023-24-NSW-SMART-drumline-annual-report.pdf
22/02/2024,18:22,Common Blacktip,146,F,Alive,ID,Coffs Harbour,Diggers Beach,2024-02-22T18:22:00Z,2024,2,CBT,FALSE,TRUE,FALSE,2023-24-NSW-SMART-drumline-annual-report.pdf
30/06/2024,8:46,Tiger Shark,172,M,Alive,"ID, A",Coffs Harbour,Diggers Beach,2024-06-30T08:46:00Z,2024,6,TIG,TRUE,TRUE,TRUE,2023-24-NSW-SMART-drumline-annual-report.pdf
15/07/2023,8:15,Smooth Hammerhead,130,NA,Alive,NA,Coffs Harbour,Park Beach,2023-07-15T08:15:00Z,2023,7,SMH,FALSE,FALSE,FALSE,2023-24-NSW-SMART-drumline-annual-report.pdf
19/08/2023,14:23,White Shark,239,F,Alive,"ID, A",Coffs Harbour,Park Beach,2023-08-19T14:23:00Z,2023,8,WHI,TRUE,TRUE,TRUE,2023-24-NSW-SMART-drumline-annual-report.pdf
29/08/2023,14:50,White Shark,195,F,Alive,"ID, A",Coffs Harbour,Park Beach,2023-08-29T14:50:00Z,2023,8,WHI,TRUE,TRUE,TRUE,2023-24-NSW-SMART-drumline-annual-report.pdf
16/09/2023,11:46,White Shark,207,M,Alive,"ID, A",Coffs Harbour,Park Beach,2023-09-16T11:46:00Z,2023,9,WHI,TRUE,TRUE,TRUE,2023-24-NSW-SMART-drumline-annual-report.pdf
17/09/2023,9:24,Greynurse Shark,295,F,Alive,ID,Coffs Harbour,Park Beach,2023-09-17T09:24:00Z,2023,9,GRN,FALSE,TRUE,FALSE,2023-24-NSW-SMART-drumline-annual-report.pdf
26/09/2023,14:56,White Shark,248,F,Alive,"ID, A",Coffs Harbour,Park Beach,2023-09-26T14:56:00Z,2023,9,WHI,TRUE,TRUE,TRUE,2023-24-NSW-SMART-drumline-annual-report.pdf
27/09/2023,10:58,White Shark,239,M,Alive,"ID, A",Coffs Harbour,Park Beach,2023-09-27T10:58:00Z,2023,9,WHI,TRUE,TRUE,TRUE,2023-24-NSW-SMART-drumline-annual-report.pdf
28/09/2023,9:12,Smooth Hammerhead,159,F,Alive,ID,Coffs Harbour,Park Beach,2023-09-28T09:12:00Z,2023,9,SMH,FALSE,TRUE,FALSE,2023-24-NSW-SMART-drumline-annual-report.pdf
23/10/2023,10:36,Smooth Hammerhead,187,F,Alive,ID,Coffs Harbour,Park Beach,2023-10-23T10:36:00Z,2023,10,SMH,FALSE,TRUE,FALSE,2023-24-NSW-SMART-drumline-annual-report.pdf
7/11/2023,12:40,Dusky Whaler,114,M,Alive,ID,Coffs Harbour,Park Beach,2023-11-07T12:40:00Z,2023,11,DUS,FALSE,TRUE,FALSE,2023-24-NSW-SMART-drumline-annual-report.pdf
18/11/2023,14:34,Dusky Whaler,114,M,Alive,ID,Coffs Harbour,Park Beach,2023-11-18T14:34:00Z,2023,11,DUS,FALSE,TRUE,FALSE,2023-24-NSW-SMART-drumline-annual-report.pdf
10/05/2024,15:31,White Shark,263,F,Alive,"ID, A",Coffs Harbour,Park Beach,2024-05-10T15:31:00Z,2024,5,WHI,TRUE,TRUE,TRUE,2023-24-NSW-SMART-drumline-annual-report.pdf
13/05/2024,12:33,White Shark,272,F,Alive,"ID, A",Coffs Harbour,Park Beach,2024-05-13T12:33:00Z,2024,5,WHI,TRUE,TRUE,TRUE,2023-24-NSW-SMART-drumline-annual-report.pdf
16/05/2024,13:55,Greynurse Shark,271,F,Alive,ID,Coffs Harbour,Park Beach,2024-05-16T13:55:00Z,2024,5,GRN,FALSE,TRUE,FALSE,2023-24-NSW-SMART-drumline-annual-report.pdf
2/06/2024,12:52,White Shark,229,M,Alive,"ID, A",Coffs Harbour,Park Beach,2024-06-02T12:52:00Z,2024,6,WHI,TRUE,TRUE,TRUE,2023-24-NSW-SMART-drumline-annual-report.pdf
3/06/2024,12:11,Greynurse Shark,270,F,Alive,ID,Coffs Harbour,Park Beach,2024-06-03T12:11:00Z,2024,6,GRN,FALSE,TRUE,FALSE,2023-24-NSW-SMART-drumline-annual-report.pdf
26/06/2024,13:20,Greynurse Shark,264,F,Alive,ID,Coffs Harbour,Park Beach,2024-06-26T13:20:00Z,2024,6,GRN,FALSE,TRUE,FALSE,2023-24-NSW-SMART-drumline-annual-report.pdf
4/08/2023,10:01,Dusky Whaler,159,F,Alive,ID,Coffs Harbour,Sawtell Beach,2023-08-04T10:01:00Z,2023,8,DUS,FALSE,TRUE,FALSE,2023-24-NSW-SMART-drumline-annual-report.pdf
12/09/2023,15:11,White Shark,258,M,Alive,"ID, A",Coffs Harbour,Sawtell Beach,2023-09-12T15:11:00Z,2023,9,WHI,TRUE,TRUE,TRUE,2023-24-NSW-SMART-drumline-annual-report.pdf
13/09/2023,15:00,Dusky Whaler,146,F,Alive,ID,Coffs Harbour,Sawtell Beach,2023-09-13T15:00:00Z,2023,9,DUS,FALSE,TRUE,FALSE,2023-24-NSW-SMART-drumline-annual-report.pdf
24/09/2023,9:43,Dusky Whaler,202,M,Alive,ID,Coffs Harbour,Sawtell Beach,2023-09-24T09:43:00Z,2023,9,DUS,FALSE,TRUE,FALSE,2023-24-NSW-SMART-drumline-annual-report.pdf
19/10/2023,11:04,Dusky Whaler,139,F,Alive,ID,Coffs Harbour,Sawtell Beach,2023-10-19T11:04:00Z,2023,10,DUS,FALSE,TRUE,FALSE,2023-24-NSW-SMART-drumline-annual-report.pdf
2/11/2023,12:44,Dusky Whaler,127,M,Alive,ID,Coffs Harbour,Sawtell Beach,2023-11-02T12:44:00Z,2023,11,DUS,FALSE,TRUE,FALSE,2023-24-NSW-SMART-drumline-annual-report.pdf
14/02/2024,13:20,Common Blacktip,167,F,Alive,ID,Coffs Harbour,Sawtell Beach,2024-02-14T13:20:00Z,2024,2,CBT,FALSE,TRUE,FALSE,2023-24-NSW-SMART-drumline-annual-report.pdf
13/05/2024,11:00,Tiger Shark,222,F,Alive,"ID, A",Coffs Harbour,Sawtell Beach,2024-05-13T11:00:00Z,2024,5,TIG,TRUE,TRUE,TRUE,2023-24-NSW-SMART-drumline-annual-report.pdf
8/06/2024,14:33,Tiger Shark,170,F,Alive,"ID, A",Coffs Harbour,Sawtell Beach,2024-06-08T14:33:00Z,2024,6,TIG,TRUE,TRUE,TRUE,2023-24-NSW-SMART-drumline-annual-report.pdf
11/06/2024,11:55,Tiger Shark,309,F,Alive,"ID, A",Coffs Harbour,Sawtell Beach,2024-06-11T11:55:00Z,2024,6,TIG,TRUE,TRUE,TRUE,2023-24-NSW-SMART-drumline-annual-report.pdf
29/06/2024,9:51,Tiger Shark,231,F,Alive,"ID, A",Coffs Harbour,Sawtell Beach,2024-06-29T09:51:00Z,2024,6,TIG,TRUE,TRUE,TRUE,2023-24-NSW-SMART-drumline-annual-report.pdf
7/07/2023,8:19,Dusky Whaler,174,F,Alive,ID,Coffs Harbour,Sawtell Headland,2023-07-07T08:19:00Z,2023,7,DUS,FALSE,TRUE,FALSE,2023-24-NSW-SMART-drumline-annual-report.pdf
20/08/2023,9:12,Bronze Whaler,290,F,Alive,ID,Coffs Harbour,Sawtell Headland,2023-08-20T09:12:00Z,2023,8,BRO,FALSE,TRUE,FALSE,2023-24-NSW-SMART-drumline-annual-report.pdf
6/09/2023,13:30,Tiger Shark,231,F,Alive,"ID, A",Coffs Harbour,Sawtell Headland,2023-09-06T13:30:00Z,2023,9,TIG,TRUE,TRUE,TRUE,2023-24-NSW-SMART-drumline-annual-report.pdf
9/09/2023,11:08,White Shark,257,M,Alive,"ID, A",Coffs Harbour,Sawtell Headland,2023-09-09T11:08:00Z,2023,9,WHI,TRUE,TRUE,TRUE,2023-24-NSW-SMART-drumline-annual-report.pdf
10/09/2023,8:29,White Shark,222,F,Alive,"ID, A",Coffs Harbour,Sawtell Headland,2023-09-10T08:29:00Z,2023,9,WHI,TRUE,TRUE,TRUE,2023-24-NSW-SMART-drumline-annual-report.pdf
10/09/2023,13:04,White Shark,209,F,Alive,"ID, A",Coffs Harbour,Sawtell Headland,2023-09-10T13:04:00Z,2023,9,WHI,TRUE,TRUE,TRUE,2023-24-NSW-SMART-drumline-annual-report.pdf
16/10/2023,11:53,Smooth Hammerhead,194,F,Alive,ID,Coffs Harbour,Sawtell Headland,2023-10-16T11:53:00Z,2023,10,SMH,FALSE,TRUE,FALSE,2023-24-NSW-SMART-drumline-annual-report.pdf
20/12/2023,7:02,White Shark,205,F,Alive,"ID, A",Coffs Harbour,Sawtell Headland,2023-12-20T07:02:00Z,2023,12,WHI,TRUE,TRUE,TRUE,2023-24-NSW-SMART-drumline-annual-report.pdf
20/12/2023,9:18,White Shark,266,F,Alive,"ID, A",Coffs Harbour,Sawtell Headland,2023-12-20T09:18:00Z,2023,12,WHI,TRUE,TRUE,TRUE,2023-24-NSW-SMART-drumline-annual-report.pdf
21/01/2024,10:37,White Shark,319,M,Alive,"ID, A",Coffs Harbour,Sawtell Headland,2024-01-21T10:37:00Z,2024,1,WHI,TRUE,TRUE,TRUE,2023-24-NSW-SMART-drumline-annual-report.pdf
16/05/2024,11:18,Tiger Shark,294,F,Alive,"ID, A",Coffs Harbour,Sawtell Headland,2024-05-16T11:18:00Z,2024,5,TIG,TRUE,TRUE,TRUE,2023-24-NSW-SMART-drumline-annual-report.pdf
25/05/2024,12:47,Tiger Shark,151,M,Alive,"ID, A",Coffs Harbour,Sawtell Headland,2024-05-25T12:47:00Z,2024,5,TIG,TRUE,TRUE,TRUE,2023-24-NSW-SMART-drumline-annual-report.pdf
29/06/2024,10:18,Tiger Shark,384,F,Alive,"ID, A",Coffs Harbour,Sawtell Headland,2024-06-29T10:18:00Z,2024,6,TIG,TRUE,TRUE,TRUE,2023-24-NSW-SMART-drumline-annual-report.pdf
17/09/2023,10:45,Bronze Whaler,228,F,Alive,ID,Eurobodalla,Barlings Beach,2023-09-17T10:45:00Z,2023,9,BRO,FALSE,TRUE,FALSE,2023-24-NSW-SMART-drumline-annual-report.pdf
1/02/2024,10:02,Tiger Shark,329,F,Alive,"ID, A",Eurobodalla,Barlings Beach,2024-02-01T10:02:00Z,2024,2,TIG,TRUE,TRUE,TRUE,2023-24-NSW-SMART-drumline-annual-report.pdf
15/05/2024,14:07,Bronze Whaler,266,M,Alive,ID,Eurobodalla,Barlings Beach,2024-05-15T14:07:00Z,2024,5,BRO,FALSE,TRUE,FALSE,2023-24-NSW-SMART-drumline-annual-report.pdf
20/05/2024,11:37,White Shark,225,F,Alive,"ID, A",Eurobodalla,Barlings Beach,2024-05-20T11:37:00Z,2024,5,WHI,TRUE,TRUE,TRUE,2023-24-NSW-SMART-drumline-annual-report.pdf
22/05/2024,10:55,White Shark,183,F,Alive,"ID, A",Eurobodalla,Barlings Beach,2024-05-22T10:55:00Z,2024,5,WHI,TRUE,TRUE,TRUE,2023-24-NSW-SMART-drumline-annual-report.pdf
24/08/2023,13:01,White Shark,192,F,Alive,"ID, A",Eurobodalla,Broulee Beach,2023-08-24T13:01:00Z,2023,8,WHI,TRUE,TRUE,TRUE,2023-24-NSW-SMART-drumline-annual-report.pdf
11/09/2023,14:26,Bronze Whaler,209,M,Alive,ID,Eurobodalla,Broulee Beach,2023-09-11T14:26:00Z,2023,9,BRO,FALSE,TRUE,FALSE,2023-24-NSW-SMART-drumline-annual-report.pdf
14/09/2023,15:19,White Shark,222,M,Alive,"ID, A",Eurobodalla,Broulee Beach,2023-09-14T15:19:00Z,2023,9,WHI,TRUE,TRUE,TRUE,2023-24-NSW-SMART-drumline-annual-report.pdf
7/10/2023,13:26,Bronze Whaler,205,F,Alive,ID,Eurobodalla,Broulee Beach,2023-10-07T13:26:00Z,2023,10,BRO,FALSE,TRUE,FALSE,2023-24-NSW-SMART-drumline-annual-report.pdf
9/11/2023,14:24,Bronze Whaler,284,F,Alive,ID,Eurobodalla,Broulee Beach,2023-11-09T14:24:00Z,2023,11,BRO,FALSE,TRUE,FALSE,2023-24-NSW-SMART-drumline-annual-report.pdf
15/12/2023,NA,Bronze Whaler,188,F,Alive,ID,Eurobodalla,Broulee Beach,NA,2023,12,BRO,FALSE,TRUE,FALSE,2023-24-NSW-SMART-drumline-annual-report.pdf
21/01/2024,9:03,Dusky Whaler,252,M,Alive,ID,Eurobodalla,Broulee Beach,2024-01-21T09:03:00Z,2024,1,DUS,FALSE,TRUE,FALSE,2023-24-NSW-SMART-drumline-annual-report.pdf
31/01/2024,9:27,Shortfin Mako Shark,111,M,Alive,ID,Eurobodalla,Broulee Beach,2024-01-31T09:27:00Z,2024,1,SMA,FALSE,TRUE,FALSE,2023-24-NSW-SMART-drumline-annual-report.pdf
15/02/2024,13:23,Smooth Hammerhead,170,F,Alive,ID,Eurobodalla,Broulee Beach,2024-02-15T13:23:00Z,2024,2,SMH,FALSE,TRUE,FALSE,2023-24-NSW-SMART-drumline-annual-report.pdf
13/03/2024,8:02,Smooth Hammerhead,149,F,Alive,ID,Eurobodalla,Broulee Beach,2024-03-13T08:02:00Z,2024,3,SMH,FALSE,TRUE,FALSE,2023-24-NSW-SMART-drumline-annual-report.pdf
1/05/2024,9:09,White Shark,182,F,Alive,"ID, A",Eurobodalla,Broulee Beach,2024-05-01T09:09:00Z,2024,5,WHI,TRUE,TRUE,TRUE,2023-24-NSW-SMART-drumline-annual-report.pdf
19/06/2024,9:15,Smooth Hammerhead,286,F,Alive,ID,Eurobodalla,Broulee Beach,2024-06-19T09:15:00Z,2024,6,SMH,FALSE,TRUE,FALSE,2023-24-NSW-SMART-drumline-annual-report.pdf
7/10/2023,9:50,Bronze Whaler,225,F,Alive,ID,Eurobodalla,Burrewarra Point,2023-10-07T09:50:00Z,2023,10,BRO,FALSE,TRUE,FALSE,2023-24-NSW-SMART-drumline-annual-report.pdf
1/11/2023,NA,Broadnose shark,114,M,Alive,ID,Eurobodalla,Burrewarra Point,NA,2023,11,UNK,FALSE,TRUE,FALSE,2023-24-NSW-SMART-drumline-annual-report.pdf
14/11/2023,16:29,Bronze Whaler,205,F,Alive,ID,Eurobodalla,Burrewarra Point,2023-11-14T16:29:00Z,2023,11,BRO,FALSE,TRUE,FALSE,2023-24-NSW-SMART-drumline-annual-report.pdf
14/04/2024,NA,Dusky Whaler,97,F,Alive,ID,Eurobodalla,Burrewarra Point,NA,2024,4,DUS,FALSE,TRUE,FALSE,2023-24-NSW-SMART-drumline-annual-report.pdf
5/06/2024,10:29,Bronze Whaler,271,F,Alive,ID,Eurobodalla,Burrewarra Point,2024-06-05T10:29:00Z,2024,6,BRO,FALSE,TRUE,FALSE,2023-24-NSW-SMART-drumline-annual-report.pdf
28/06/2024,11:19,Smooth Hammerhead,145,M,Alive,ID,Eurobodalla,Burrewarra Point,2024-06-28T11:19:00Z,2024,6,SMH,FALSE,TRUE,FALSE,2023-24-NSW-SMART-drumline-annual-report.pdf
17/08/2023,8:01,Bronze Whaler,268,F,Alive,ID,Eurobodalla,Garden Bay Beach,2023-08-17T08:01:00Z,2023,8,BRO,FALSE,TRUE,FALSE,2023-24-NSW-SMART-drumline-annual-report.pdf
24/09/2023,11:55,Bronze Whaler,263,F,Alive,ID,Eurobodalla,Garden Bay Beach,2023-09-24T11:55:00Z,2023,9,BRO,FALSE,TRUE,FALSE,2023-24-NSW-SMART-drumline-annual-report.pdf
10/10/2023,11:17,Bronze Whaler,249,M,Alive,ID,Eurobodalla,Garden Bay Beach,2023-10-10T11:17:00Z,2023,10,BRO,FALSE,TRUE,FALSE,2023-24-NSW-SMART-drumline-annual-report.pdf
1/11/2023,11:10,Bronze Whaler,258,F,Alive,ID,Eurobodalla,Garden Bay Beach,2023-11-01T11:10:00Z,2023,11,BRO,FALSE,TRUE,FALSE,2023-24-NSW-SMART-drumline-annual-report.pdf
3/05/2024,12:45,Bronze Whaler,259,M,Alive,ID,Eurobodalla,Garden Bay Beach,2024-05-03T12:45:00Z,2024,5,BRO,FALSE,TRUE,FALSE,2023-24-NSW-SMART-drumline-annual-report.pdf
26/06/2024,8:09,School Shark,171,F,Alive,ID,Eurobodalla,Garden Bay Beach,2024-06-26T08:09:00Z,2024,6,UNK,FALSE,TRUE,FALSE,2023-24-NSW-SMART-drumline-annual-report.pdf
23/09/2023,12:12,Bronze Whaler,271,M,Alive,ID,Eurobodalla,Lilli Pilli Beach,2023-09-23T12:12:00Z,2023,9,BRO,FALSE,TRUE,FALSE,2023-24-NSW-SMART-drumline-annual-report.pdf
24/09/2023,8:28,Bronze Whaler,248,F,Alive,ID,Eurobodalla,Lilli Pilli Beach,2023-09-24T08:28:00Z,2023,9,BRO,FALSE,TRUE,FALSE,2023-24-NSW-SMART-drumline-annual-report.pdf
22/08/2023,7:37,Bronze Whaler,267,M,Alive,ID,Eurobodalla,Malua Bay Beach,2023-08-22T07:37:00Z,2023,8,BRO,FALSE,TRUE,FALSE,2023-24-NSW-SMART-drumline-annual-report.pdf
27/09/2023,6:52,Bronze Whaler,252,F,Alive,ID,Eurobodalla,Malua Bay Beach,2023-09-27T06:52:00Z,2023,9,BRO,FALSE,TRUE,FALSE,2023-24-NSW-SMART-drumline-annual-report.pdf
17/04/2024,9:03,Bronze Whaler,272,F,Alive,ID,Eurobodalla,Malua Bay Beach,2024-04-17T09:03:00Z,2024,4,BRO,FALSE,TRUE,FALSE,2023-24-NSW-SMART-drumline-annual-report.pdf
16/09/2023,NA,Shortfin Mako Shark,189,M,Alive,ID,Eurobodalla,McKenzies Beach,NA,2023,9,SMA,FALSE,TRUE,FALSE,2023-24-NSW-SMART-drumline-annual-report.pdf
29/10/2023,12:53,White Shark,201,M,Alive,"ID, A",Eurobodalla,McKenzies Beach,2023-10-29T12:53:00Z,2023,10,WHI,TRUE,TRUE,TRUE,2023-24-NSW-SMART-drumline-annual-report.pdf
14/11/2023,10:33,White Shark,326,M,Alive,"ID, A",Eurobodalla,McKenzies Beach,2023-11-14T10:33:00Z,2023,11,WHI,TRUE,TRUE,TRUE,2023-24-NSW-SMART-drumline-annual-report.pdf
16/01/2024,7:43,Smooth Hammerhead,189,M,Alive,ID,Eurobodalla,McKenzies Beach,2024-01-16T07:43:00Z,2024,1,SMH,FALSE,TRUE,FALSE,2023-24-NSW-SMART-drumline-annual-report.pdf
23/01/2024,12:49,Dusky Whaler,198,M,Alive,ID,Eurobodalla,McKenzies Beach,2024-01-23T12:49:00Z,2024,1,DUS,FALSE,TRUE,FALSE,2023-24-NSW-SMART-drumline-annual-report.pdf
2/02/2024,10:16,Bronze Whaler,269,M,Alive,ID,Eurobodalla,McKenzies Beach,2024-02-02T10:16:00Z,2024,2,BRO,FALSE,TRUE,FALSE,2023-24-NSW-SMART-drumline-annual-report.pdf
9/06/2024,13:15,Bronze Whaler,221,F,Alive,ID,Eurobodalla,McKenzies Beach,2024-06-09T13:15:00Z,2024,6,BRO,FALSE,TRUE,FALSE,2023-24-NSW-SMART-drumline-annual-report.pdf
2/08/2023,9:35,White Shark,284,M,Alive,"ID, A",Eurobodalla,Rosedale Beach,2023-08-02T09:35:00Z,2023,8,WHI,TRUE,TRUE,TRUE,2023-24-NSW-SMART-drumline-annual-report.pdf
13/09/2023,10:08,Bronze Whaler,280,NA,Alive,NA,Eurobodalla,Rosedale Beach,2023-09-13T10:08:00Z,2023,9,BRO,FALSE,FALSE,FALSE,2023-24-NSW-SMART-drumline-annual-report.pdf
16/09/2023,12:10,White Shark,224,F,Alive,"ID, A",Eurobodalla,Rosedale Beach,2023-09-16T12:10:00Z,2023,9,WHI,TRUE,TRUE,TRUE,2023-24-NSW-SMART-drumline-annual-report.pdf
23/09/2023,8:27,Bronze Whaler,282,F,Alive,ID,Eurobodalla,Rosedale Beach,2023-09-23T08:27:00Z,2023,9,BRO,FALSE,TRUE,FALSE,2023-24-NSW-SMART-drumline-annual-report.pdf
27/09/2023,15:30,Bronze Whaler,261,M,Alive,ID,Eurobodalla,Rosedale Beach,2023-09-27T15:30:00Z,2023,9,BRO,FALSE,TRUE,FALSE,2023-24-NSW-SMART-drumline-annual-report.pdf
7/12/2023,12:01,Smooth Hammerhead,271,F,Alive,ID,Eurobodalla,Rosedale Beach,2023-12-07T12:01:00Z,2023,12,SMH,FALSE,TRUE,FALSE,2023-24-NSW-SMART-drumline-annual-report.pdf
26/12/2023,8:23,Dusky Whaler,205,M,Alive,ID,Eurobodalla,Rosedale Beach,2023-12-26T08:23:00Z,2023,12,DUS,FALSE,TRUE,FALSE,2023-24-NSW-SMART-drumline-annual-report.pdf
2/02/2024,8:25,Dusky Whaler,195,F,Alive,ID,Eurobodalla,Rosedale Beach,2024-02-02T08:25:00Z,2024,2,DUS,FALSE,TRUE,FALSE,2023-24-NSW-SMART-drumline-annual-report.pdf
3/02/2024,10:13,Dusky Whaler,205,F,Alive,ID,Eurobodalla,Rosedale Beach,2024-02-03T10:13:00Z,2024,2,DUS,FALSE,TRUE,FALSE,2023-24-NSW-SMART-drumline-annual-report.pdf
3/03/2024,10:05,Bronze Whaler,252,M,Alive,ID,Eurobodalla,Rosedale Beach,2024-03-03T10:05:00Z,2024,3,BRO,FALSE,TRUE,FALSE,2023-24-NSW-SMART-drumline-annual-report.pdf
21/03/2024,11:06,Bronze Whaler,270,M,Alive,ID,Eurobodalla,Rosedale Beach,2024-03-21T11:06:00Z,2024,3,BRO,FALSE,TRUE,FALSE,2023-24-NSW-SMART-drumline-annual-report.pdf
8/04/2024,11:30,Dusky Whaler,152,M,Alive,ID,Eurobodalla,Rosedale Beach,2024-04-08T11:30:00Z,2024,4,DUS,FALSE,TRUE,FALSE,2023-24-NSW-SMART-drumline-annual-report.pdf
16/05/2024,15:19,Bronze Whaler,238,F,Alive,ID,Eurobodalla,Rosedale Beach,2024-05-16T15:19:00Z,2024,5,BRO,FALSE,TRUE,FALSE,2023-24-NSW-SMART-drumline-annual-report.pdf
14/06/2024,11:43,Shortfin Mako Shark,252,F,Alive,ID,Eurobodalla,Rosedale Beach,2024-06-14T11:43:00Z,2024,6,SMA,FALSE,TRUE,FALSE,2023-24-NSW-SMART-drumline-annual-report.pdf
29/06/2024,11:42,Shortfin Mako Shark,269,F,Alive,ID,Eurobodalla,Rosedale Beach,2024-06-29T11:42:00Z,2024,6,SMA,FALSE,TRUE,FALSE,2023-24-NSW-SMART-drumline-annual-report.pdf
5/07/2023,10:17,Bronze Whaler,226,F,Alive,ID,Eurobodalla,Surf Beach,2023-07-05T10:17:00Z,2023,7,BRO,FALSE,TRUE,FALSE,2023-24-NSW-SMART-drumline-annual-report.pdf
26/07/2023,7:58,Bronze Whaler,274,F,Alive,ID,Eurobodalla,Surf Beach,2023-07-26T07:58:00Z,2023,7,BRO,FALSE,TRUE,FALSE,2023-24-NSW-SMART-drumline-annual-report.pdf
16/09/2023,10:51,Bronze Whaler,278,F,Alive,ID,Eurobodalla,Surf Beach,2023-09-16T10:51:00Z,2023,9,BRO,FALSE,TRUE,FALSE,2023-24-NSW-SMART-drumline-annual-report.pdf
16/09/2023,16:54,Bronze Whaler,202,F,Alive,ID,Eurobodalla,Surf Beach,2023-09-16T16:54:00Z,2023,9,BRO,FALSE,TRUE,FALSE,2023-24-NSW-SMART-drumline-annual-report.pdf
22/09/2023,12:25,Bronze Whaler,267,F,Alive,ID,Eurobodalla,Surf Beach,2023-09-22T12:25:00Z,2023,9,BRO,FALSE,TRUE,FALSE,2023-24-NSW-SMART-drumline-annual-report.pdf
14/10/2023,8:55,Bronze Whaler,244,F,Alive,ID,Eurobodalla,Surf Beach,2023-10-14T08:55:00Z,2023,10,BRO,FALSE,TRUE,FALSE,2023-24-NSW-SMART-drumline-annual-report.pdf
23/10/2023,17:12,Bronze Whaler,257,F,Alive,ID,Eurobodalla,Surf Beach,2023-10-23T17:12:00Z,2023,10,BRO,FALSE,TRUE,FALSE,2023-24-NSW-SMART-drumline-annual-report.pdf
2/11/2023,15:38,Bronze Whaler,224,F,Alive,ID,Eurobodalla,Surf Beach,2023-11-02T15:38:00Z,2023,11,BRO,FALSE,TRUE,FALSE,2023-24-NSW-SMART-drumline-annual-report.pdf
5/11/2023,11:29,Bronze Whaler,228,F,Alive,ID,Eurobodalla,Surf Beach,2023-11-05T11:29:00Z,2023,11,BRO,FALSE,TRUE,FALSE,2023-24-NSW-SMART-drumline-annual-report.pdf
10/11/2023,9:13,Bronze Whaler,253,M,Alive,ID,Eurobodalla,Surf Beach,2023-11-10T09:13:00Z,2023,11,BRO,FALSE,TRUE,FALSE,2023-24-NSW-SMART-drumline-annual-report.pdf
5/01/2024,12:03,Dusky Whaler,252,M,Alive,ID,Eurobodalla,Surf Beach,2024-01-05T12:03:00Z,2024,1,DUS,FALSE,TRUE,FALSE,2023-24-NSW-SMART-drumline-annual-report.pdf
14/01/2024,9:22,Smooth Hammerhead,172,F,Alive,ID,Eurobodalla,Surf Beach,2024-01-14T09:22:00Z,2024,1,SMH,FALSE,TRUE,FALSE,2023-24-NSW-SMART-drumline-annual-report.pdf
23/02/2024,8:32,Smooth Hammerhead,142,M,Alive,ID,Eurobodalla,Surf Beach,2024-02-23T08:32:00Z,2024,2,SMH,FALSE,TRUE,FALSE,2023-24-NSW-SMART-drumline-annual-report.pdf
26/03/2024,8:48,Tiger Shark,188,M,Alive,"ID, A",Eurobodalla,Surf Beach,2024-03-26T08:48:00Z,2024,3,TIG,TRUE,TRUE,TRUE,2023-24-NSW-SMART-drumline-annual-report.pdf
8/04/2024,9:47,Dusky Whaler,226,M,Alive,ID,Eurobodalla,Surf Beach,2024-04-08T09:47:00Z,2024,4,DUS,FALSE,TRUE,FALSE,2023-24-NSW-SMART-drumline-annual-report.pdf
8/04/2024,11:25,Dusky Whaler,337,F,Alive,ID,Eurobodalla,Surf Beach,2024-04-08T11:25:00Z,2024,4,DUS,FALSE,TRUE,FALSE,2023-24-NSW-SMART-drumline-annual-report.pdf
14/05/2024,13:52,Bronze Whaler,271,F,Alive,ID,Eurobodalla,Surf Beach,2024-05-14T13:52:00Z,2024,5,BRO,FALSE,TRUE,FALSE,2023-24-NSW-SMART-drumline-annual-report.pdf
15/05/2024,12:30,Dusky Whaler,211,F,Alive,ID,Eurobodalla,Surf Beach,2024-05-15T12:30:00Z,2024,5,DUS,FALSE,TRUE,FALSE,2023-24-NSW-SMART-drumline-annual-report.pdf
16/05/2024,10:19,Bronze Whaler,271,F,Alive,ID,Eurobodalla,Surf Beach,2024-05-16T10:19:00Z,2024,5,BRO,FALSE,TRUE,FALSE,2023-24-NSW-SMART-drumline-annual-report.pdf
4/06/2024,NA,Dusky Whaler,100,M,Alive,ID,Eurobodalla,Surf Beach,NA,2024,6,DUS,FALSE,TRUE,FALSE,2023-24-NSW-SMART-drumline-annual-report.pdf
13/07/2023,13:18,White Shark,211,M,Alive,"ID, A",Evans Head,Airforce Beach,2023-07-13T13:18:00Z,2023,7,WHI,TRUE,TRUE,TRUE,2023-24-NSW-SMART-drumline-annual-report.pdf
15/07/2023,15:29,White Shark,265,M,Alive,"ID, A",Evans Head,Airforce Beach,2023-07-15T15:29:00Z,2023,7,WHI,TRUE,TRUE,TRUE,2023-24-NSW-SMART-drumline-annual-report.pdf
30/07/2023,15:11,White Shark,245,M,Alive,"ID, A",Evans Head,Airforce Beach,2023-07-30T15:11:00Z,2023,7,WHI,TRUE,TRUE,TRUE,2023-24-NSW-SMART-drumline-annual-report.pdf
11/08/2023,14:22,Dusky Whaler,355,F,Alive,"ID, A",Evans Head,Airforce Beach,2023-08-11T14:22:00Z,2023,8,DUS,FALSE,TRUE,TRUE,2023-24-NSW-SMART-drumline-annual-report.pdf
12/08/2023,9:08,White Shark,249,F,Alive,"ID, A",Evans Head,Airforce Beach,2023-08-12T09:08:00Z,2023,8,WHI,TRUE,TRUE,TRUE,2023-24-NSW-SMART-drumline-annual-report.pdf
21/08/2023,15:00,White Shark,233,F,Alive,"ID, A",Evans Head,Airforce Beach,2023-08-21T15:00:00Z,2023,8,WHI,TRUE,TRUE,TRUE,2023-24-NSW-SMART-drumline-annual-report.pdf
31/08/2023,15:27,White Shark,225,F,Alive,"ID, A",Evans Head,Airforce Beach,2023-08-31T15:27:00Z,2023,8,WHI,TRUE,TRUE,TRUE,2023-24-NSW-SMART-drumline-annual-report.pdf
21/10/2023,7:26,White Shark,221,M,Alive,"ID, A",Evans Head,Airforce Beach,2023-10-21T07:26:00Z,2023,10,WHI,TRUE,TRUE,TRUE,2023-24-NSW-SMART-drumline-annual-report.pdf
2/11/2023,8:22,White Shark,278,F,Alive,"ID, A",Evans Head,Airforce Beach,2023-11-02T08:22:00Z,2023,11,WHI,TRUE,TRUE,TRUE,2023-24-NSW-SMART-drumline-annual-report.pdf
14/11/2023,10:19,White Shark,269,F,Alive,"ID, A",Evans Head,Airforce Beach,2023-11-14T10:19:00Z,2023,11,WHI,TRUE,TRUE,TRUE,2023-24-NSW-SMART-drumline-annual-report.pdf
8/12/2023,NA,Common Blacktip,137,M,Dead,NA,Evans Head,Airforce Beach,NA,2023,12,CBT,FALSE,FALSE,FALSE,2023-24-NSW-SMART-drumline-annual-report.pdf
22/01/2024,10:51,Common Blacktip,129,NA,Dead,NA,Evans Head,Airforce Beach,2024-01-22T10:51:00Z,2024,1,CBT,FALSE,FALSE,FALSE,2023-24-NSW-SMART-drumline-annual-report.pdf
15/02/2024,8:33,Common Blacktip,161,F,Alive,ID,Evans Head,Airforce Beach,2024-02-15T08:33:00Z,2024,2,CBT,FALSE,TRUE,FALSE,2023-24-NSW-SMART-drumline-annual-report.pdf
22/02/2024,12:50,Common Blacktip,140,M,Alive,ID,Evans Head,Airforce Beach,2024-02-22T12:50:00Z,2024,2,CBT,FALSE,TRUE,FALSE,2023-24-NSW-SMART-drumline-annual-report.pdf
3/04/2024,14:10,Common Blacktip,149,M,Alive,ID,Evans Head,Airforce Beach,2024-04-03T14:10:00Z,2024,4,CBT,FALSE,TRUE,FALSE,2023-24-NSW-SMART-drumline-annual-report.pdf
14/04/2024,13:16,Great Hammerhead,313,M,Alive,ID,Evans Head,Airforce Beach,2024-04-14T13:16:00Z,2024,4,GHH,FALSE,TRUE,FALSE,2023-24-NSW-SMART-drumline-annual-report.pdf
30/04/2024,14:15,Sandbar Whaler,230,F,Alive,NA,Evans Head,Airforce Beach,2024-04-30T14:15:00Z,2024,4,SAN,FALSE,FALSE,FALSE,2023-24-NSW-SMART-drumline-annual-report.pdf
29/05/2024,12:24,Tiger Shark,233,F,Alive,"ID, A",Evans Head,Airforce Beach,2024-05-29T12:24:00Z,2024,5,TIG,TRUE,TRUE,TRUE,2023-24-NSW-SMART-drumline-annual-report.pdf
14/07/2023,11:29,White Shark,199,M,Alive,"ID, A",Evans Head,Joggly Point,2023-07-14T11:29:00Z,2023,7,WHI,TRUE,TRUE,TRUE,2023-24-NSW-SMART-drumline-annual-report.pdf
15/07/2023,8:01,White Shark,204,F,Alive,"ID, A",Evans Head,Joggly Point,2023-07-15T08:01:00Z,2023,7,WHI,TRUE,TRUE,TRUE,2023-24-NSW-SMART-drumline-annual-report.pdf
21/08/2023,15:27,White Shark,251,M,Alive,"ID, A",Evans Head,Joggly Point,2023-08-21T15:27:00Z,2023,8,WHI,TRUE,TRUE,TRUE,2023-24-NSW-SMART-drumline-annual-report.pdf
5/09/2023,8:38,White Shark,244,M,Alive,"ID, A",Evans Head,Joggly Point,2023-09-05T08:38:00Z,2023,9,WHI,TRUE,TRUE,TRUE,2023-24-NSW-SMART-drumline-annual-report.pdf
5/09/2023,14:54,White Shark,167,F,Alive,"ID, A",Evans Head,Joggly Point,2023-09-05T14:54:00Z,2023,9,WHI,TRUE,TRUE,TRUE,2023-24-NSW-SMART-drumline-annual-report.pdf
9/09/2023,11:22,White Shark,216,F,Alive,"ID, A",Evans Head,Joggly Point,2023-09-09T11:22:00Z,2023,9,WHI,TRUE,TRUE,TRUE,2023-24-NSW-SMART-drumline-annual-report.pdf
9/09/2023,NA,White Shark,234,M,Alive,"ID, A",Evans Head,Joggly Point,NA,2023,9,WHI,TRUE,TRUE,TRUE,2023-24-NSW-SMART-drumline-annual-report.pdf
13/09/2023,12:40,White Shark,186,F,Alive,"ID, A",Evans Head,Joggly Point,2023-09-13T12:40:00Z,2023,9,WHI,TRUE,TRUE,TRUE,2023-24-NSW-SMART-drumline-annual-report.pdf
5/10/2023,7:26,White Shark,236,M,Alive,"ID, A",Evans Head,Joggly Point,2023-10-05T07:26:00Z,2023,10,WHI,TRUE,TRUE,TRUE,2023-24-NSW-SMART-drumline-annual-report.pdf
3/11/2023,12:43,Scalloped Hammerhead,162,M,Alive,ID,Evans Head,Joggly Point,2023-11-03T12:43:00Z,2023,11,SCH,FALSE,TRUE,FALSE,2023-24-NSW-SMART-drumline-annual-report.pdf
9/11/2023,NA,Loggerhead Turtle,80,NA,Alive,NA,Evans Head,Joggly Point,NA,2023,11,LOG,FALSE,FALSE,FALSE,2023-24-NSW-SMART-drumline-annual-report.pdf
28/11/2023,15:54,White Shark,222,F,Alive,"ID, A",Evans Head,Joggly Point,2023-11-28T15:54:00Z,2023,11,WHI,TRUE,TRUE,TRUE,2023-24-NSW-SMART-drumline-annual-report.pdf
30/11/2023,9:09,White Shark,242,F,Alive,"ID, A",Evans Head,Joggly Point,2023-11-30T09:09:00Z,2023,11,WHI,TRUE,TRUE,TRUE,2023-24-NSW-SMART-drumline-annual-report.pdf
19/01/2024,15:31,Common Blacktip,136,F,Alive,ID,Evans Head,Joggly Point,2024-01-19T15:31:00Z,2024,1,CBT,FALSE,TRUE,FALSE,2023-24-NSW-SMART-drumline-annual-report.pdf
18/02/2024,18:08,Common Blacktip,141,M,Alive,ID,Evans Head,Joggly Point,2024-02-18T18:08:00Z,2024,2,CBT,FALSE,TRUE,FALSE,2023-24-NSW-SMART-drumline-annual-report.pdf
28/02/2024,NA,Loggerhead Turtle,85,NA,Alive,NA,Evans Head,Joggly Point,NA,2024,2,LOG,FALSE,FALSE,FALSE,2023-24-NSW-SMART-drumline-annual-report.pdf
22/03/2024,10:10,Tiger Shark,209,F,Alive,"ID, A",Evans Head,Joggly Point,2024-03-22T10:10:00Z,2024,3,TIG,TRUE,TRUE,TRUE,2023-24-NSW-SMART-drumline-annual-report.pdf
25/06/2024,11:02,Tiger Shark,303,F,Alive,"ID, A",Evans Head,Joggly Point,2024-06-25T11:02:00Z,2024,6,TIG,TRUE,TRUE,TRUE,2023-24-NSW-SMART-drumline-annual-report.pdf
27/07/2023,7:20,White Shark,229,F,Alive,"ID, A",Evans Head,Main Beach line,2023-07-27T07:20:00Z,2023,7,WHI,TRUE,TRUE,TRUE,2023-24-NSW-SMART-drumline-annual-report.pdf
1/08/2023,14:03,White Shark,186,M,Alive,"ID, A",Evans Head,Main Beach line,2023-08-01T14:03:00Z,2023,8,WHI,TRUE,TRUE,TRUE,2023-24-NSW-SMART-drumline-annual-report.pdf
3/08/2023,15:12,White Shark,281,M,Alive,"ID, A",Evans Head,Main Beach line,2023-08-03T15:12:00Z,2023,8,WHI,TRUE,TRUE,TRUE,2023-24-NSW-SMART-drumline-annual-report.pdf
6/08/2023,9:40,White Shark,210,F,Alive,"ID, A",Evans Head,Main Beach line,2023-08-06T09:40:00Z,2023,8,WHI,TRUE,TRUE,TRUE,2023-24-NSW-SMART-drumline-annual-report.pdf
11/08/2023,14:54,White Shark,181,F,Alive,"ID, A",Evans Head,Main Beach line,2023-08-11T14:54:00Z,2023,8,WHI,TRUE,TRUE,TRUE,2023-24-NSW-SMART-drumline-annual-report.pdf
20/08/2023,9:42,Greynurse Shark,290,F,Alive,ID,Evans Head,Main Beach line,2023-08-20T09:42:00Z,2023,8,GRN,FALSE,TRUE,FALSE,2023-24-NSW-SMART-drumline-annual-report.pdf
24/09/2023,8:49,Tiger Shark,194,F,Alive,"ID, A",Evans Head,Main Beach line,2023-09-24T08:49:00Z,2023,9,TIG,TRUE,TRUE,TRUE,2023-24-NSW-SMART-drumline-annual-report.pdf
25/09/2023,14:28,White Shark,223,F,Alive,"ID, A",Evans Head,Main Beach line,2023-09-25T14:28:00Z,2023,9,WHI,TRUE,TRUE,TRUE,2023-24-NSW-SMART-drumline-annual-report.pdf
31/10/2023,7:35,Sandbar Whaler,144,M,Alive,ID,Evans Head,Main Beach line,2023-10-31T07:35:00Z,2023,10,SAN,FALSE,TRUE,FALSE,2023-24-NSW-SMART-drumline-annual-report.pdf
2/11/2023,7:40,Sandbar Whaler,132,M,Alive,ID,Evans Head,Main Beach line,2023-11-02T07:40:00Z,2023,11,SAN,FALSE,TRUE,FALSE,2023-24-NSW-SMART-drumline-annual-report.pdf
2/11/2023,NA,Sandbar Whaler,107,M,Alive,ID,Evans Head,Main Beach line,NA,2023,11,SAN,FALSE,TRUE,FALSE,2023-24-NSW-SMART-drumline-annual-report.pdf
3/11/2023,NA,Sandbar Whaler,122,M,Alive,NA,Evans Head,Main Beach line,NA,2023,11,SAN,FALSE,FALSE,FALSE,2023-24-NSW-SMART-drumline-annual-report.pdf
11/11/2023,NA,White Shark,265,M,Alive,"ID, A",Evans Head,Main Beach line,NA,2023,11,WHI,TRUE,TRUE,TRUE,2023-24-NSW-SMART-drumline-annual-report.pdf
25/12/2023,7:58,White Shark,271,M,Alive,"ID, A",Evans Head,Main Beach line,2023-12-25T07:58:00Z,2023,12,WHI,TRUE,TRUE,TRUE,2023-24-NSW-SMART-drumline-annual-report.pdf
22/02/2024,NA,Common Blacktip,130,M,Dead,NA,Evans Head,Main Beach line,NA,2024,2,CBT,FALSE,FALSE,FALSE,2023-24-NSW-SMART-drumline-annual-report.pdf
24/02/2024,NA,Common Blacktip,NA,NA,Dead,NA,Evans Head,Main Beach line,NA,2024,2,CBT,FALSE,FALSE,FALSE,2023-24-NSW-SMART-drumline-annual-report.pdf
27/02/2024,15:31,Tiger Shark,289,F,Alive,"ID, A",Evans Head,Main Beach line,2024-02-27T15:31:00Z,2024,2,TIG,TRUE,TRUE,TRUE,2023-24-NSW-SMART-drumline-annual-report.pdf
29/04/2024,15:47,White Shark,335,F,Alive,"ID, A",Evans Head,Main Beach line,2024-04-29T15:47:00Z,2024,4,WHI,TRUE,TRUE,TRUE,2023-24-NSW-SMART-drumline-annual-report.pdf
13/06/2024,9:22,White Shark,260,F,Alive,"ID, A",Evans Head,Main Beach line,2024-06-13T09:22:00Z,2024,6,WHI,TRUE,TRUE,TRUE,2023-24-NSW-SMART-drumline-annual-report.pdf
19/06/2024,NA,White Shark,291,M,Alive,"ID, A",Evans Head,Main Beach line,NA,2024,6,WHI,TRUE,TRUE,TRUE,2023-24-NSW-SMART-drumline-annual-report.pdf
24/09/2023,8:09,Greynurse Shark,249,F,Alive,ID,Evans Head,Main Beach,2023-09-24T08:09:00Z,2023,9,GRN,FALSE,TRUE,FALSE,2023-24-NSW-SMART-drumline-annual-report.pdf
11/10/2023,10:42,White Shark,219,M,Alive,"ID, A",Evans Head,Main Beach,2023-10-11T10:42:00Z,2023,10,WHI,TRUE,TRUE,TRUE,2023-24-NSW-SMART-drumline-annual-report.pdf
4/12/2023,10:15,Greynurse Shark,246,F,Alive,ID,Evans Head,Main Beach,2023-12-04T10:15:00Z,2023,12,GRN,FALSE,TRUE,FALSE,2023-24-NSW-SMART-drumline-annual-report.pdf
28/02/2024,NA,Common Blacktip,164,M,Dead,NA,Evans Head,Main Beach,NA,2024,2,CBT,FALSE,FALSE,FALSE,2023-24-NSW-SMART-drumline-annual-report.pdf
11/04/2024,8:51,White Shark,316,M,Alive,"ID, A",Evans Head,Main Beach,2024-04-11T08:51:00Z,2024,4,WHI,TRUE,TRUE,TRUE,2023-24-NSW-SMART-drumline-annual-report.pdf
25/06/2024,11:34,Tiger Shark,309,F,Alive,"ID, A",Evans Head,Main Beach,2024-06-25T11:34:00Z,2024,6,TIG,TRUE,TRUE,TRUE,2023-24-NSW-SMART-drumline-annual-report.pdf
7/07/2023,9:12,Greynurse Shark,253,F,Alive,ID,Evans Head,Shark Bay,2023-07-07T09:12:00Z,2023,7,GRN,FALSE,TRUE,FALSE,2023-24-NSW-SMART-drumline-annual-report.pdf
16/11/2023,9:34,Greynurse Shark,264,F,Alive,ID,Evans Head,Shark Bay,2023-11-16T09:34:00Z,2023,11,GRN,FALSE,TRUE,FALSE,2023-24-NSW-SMART-drumline-annual-report.pdf
28/01/2024,8:53,Lemon Shark,224,M,Alive,ID,Evans Head,Shark Bay,2024-01-28T08:53:00Z,2024,1,UNK,FALSE,TRUE,FALSE,2023-24-NSW-SMART-drumline-annual-report.pdf
25/07/2023,10:41,Bronze Whaler,244,F,Alive,ID,Forster,Burgess Beach,2023-07-25T10:41:00Z,2023,7,BRO,FALSE,TRUE,FALSE,2023-24-NSW-SMART-drumline-annual-report.pdf
28/07/2023,9:10,White Shark,246,M,Alive,"ID, A",Forster,Burgess Beach,2023-07-28T09:10:00Z,2023,7,WHI,TRUE,TRUE,TRUE,2023-24-NSW-SMART-drumline-annual-report.pdf
1/08/2023,13:49,Shortfin Mako Shark,240,F,Alive,ID,Forster,Burgess Beach,2023-08-01T13:49:00Z,2023,8,SMA,FALSE,TRUE,FALSE,2023-24-NSW-SMART-drumline-annual-report.pdf
20/01/2024,13:21,White Shark,260,NA,Alive,NA,Forster,Burgess Beach,2024-01-20T13:21:00Z,2024,1,WHI,TRUE,FALSE,FALSE,2023-24-NSW-SMART-drumline-annual-report.pdf
9/07/2023,12:09,White Shark,264,F,Alive,"ID, A",Forster,Main Beach,2023-07-09T12:09:00Z,2023,7,WHI,TRUE,TRUE,TRUE,2023-24-NSW-SMART-drumline-annual-report.pdf
9/07/2023,NA,White Shark,225,F,Alive,"ID, A",Forster,Main Beach,NA,2023,7,WHI,TRUE,TRUE,TRUE,2023-24-NSW-SMART-drumline-annual-report.pdf
5/09/2023,9:46,White Shark,302,F,Alive,"ID, A",Forster,Main Beach,2023-09-05T09:46:00Z,2023,9,WHI,TRUE,TRUE,TRUE,2023-24-NSW-SMART-drumline-annual-report.pdf
5/09/2023,15:02,White Shark,210,F,Alive,"ID, A",Forster,Main Beach,2023-09-05T15:02:00Z,2023,9,WHI,TRUE,TRUE,TRUE,2023-24-NSW-SMART-drumline-annual-report.pdf
10/09/2023,9:31,White Shark,225,M,Alive,"ID, A",Forster,Main Beach,2023-09-10T09:31:00Z,2023,9,WHI,TRUE,TRUE,TRUE,2023-24-NSW-SMART-drumline-annual-report.pdf
10/09/2023,14:52,White Shark,251,F,Alive,"ID, A",Forster,Main Beach,2023-09-10T14:52:00Z,2023,9,WHI,TRUE,TRUE,TRUE,2023-24-NSW-SMART-drumline-annual-report.pdf
14/09/2023,14:07,White Shark,172,F,Alive,"ID, A",Forster,Main Beach,2023-09-14T14:07:00Z,2023,9,WHI,TRUE,TRUE,TRUE,2023-24-NSW-SMART-drumline-annual-report.pdf
23/09/2023,12:35,White Shark,223,F,Alive,"ID, A",Forster,Main Beach,2023-09-23T12:35:00Z,2023,9,WHI,TRUE,TRUE,TRUE,2023-24-NSW-SMART-drumline-annual-report.pdf
28/09/2023,10:35,White Shark,267,M,Alive,"ID, A",Forster,Main Beach,2023-09-28T10:35:00Z,2023,9,WHI,TRUE,TRUE,TRUE,2023-24-NSW-SMART-drumline-annual-report.pdf
9/10/2023,6:57,White Shark,212,M,Alive,"ID, A",Forster,Main Beach,2023-10-09T06:57:00Z,2023,10,WHI,TRUE,TRUE,TRUE,2023-24-NSW-SMART-drumline-annual-report.pdf
13/11/2023,11:21,Bronze Whaler,268,F,Alive,ID,Forster,Main Beach,2023-11-13T11:21:00Z,2023,11,BRO,FALSE,TRUE,FALSE,2023-24-NSW-SMART-drumline-annual-report.pdf
23/11/2023,11:14,White Shark,244,F,Alive,"ID, A",Forster,Main Beach,2023-11-23T11:14:00Z,2023,11,WHI,TRUE,TRUE,TRUE,2023-24-NSW-SMART-drumline-annual-report.pdf
3/04/2024,9:00,Greynurse Shark,284,F,Alive,ID,Forster,Main Beach,2024-04-03T09:00:00Z,2024,4,GRN,FALSE,TRUE,FALSE,2023-24-NSW-SMART-drumline-annual-report.pdf
3/07/2023,8:57,White Shark,228,M,Alive,"ID, A",Forster,One Mile Beach,2023-07-03T08:57:00Z,2023,7,WHI,TRUE,TRUE,TRUE,2023-24-NSW-SMART-drumline-annual-report.pdf
15/07/2023,7:36,White Shark,232,M,Alive,"ID, A",Forster,One Mile Beach,2023-07-15T07:36:00Z,2023,7,WHI,TRUE,TRUE,TRUE,2023-24-NSW-SMART-drumline-annual-report.pdf
17/07/2023,11:02,White Shark,201,F,Alive,"ID, A",Forster,One Mile Beach,2023-07-17T11:02:00Z,2023,7,WHI,TRUE,TRUE,TRUE,2023-24-NSW-SMART-drumline-annual-report.pdf
21/08/2023,10:07,White Shark,252,M,Alive,"ID, A",Forster,One Mile Beach,2023-08-21T10:07:00Z,2023,8,WHI,TRUE,TRUE,TRUE,2023-24-NSW-SMART-drumline-annual-report.pdf
11/09/2023,13:46,Bronze Whaler,272,F,Alive,ID,Forster,One Mile Beach,2023-09-11T13:46:00Z,2023,9,BRO,FALSE,TRUE,FALSE,2023-24-NSW-SMART-drumline-annual-report.pdf
22/09/2023,10:50,Bronze Whaler,265,F,Alive,ID,Forster,One Mile Beach,2023-09-22T10:50:00Z,2023,9,BRO,FALSE,TRUE,FALSE,2023-24-NSW-SMART-drumline-annual-report.pdf
28/09/2023,15:19,White Shark,238,F,Alive,"ID, A",Forster,One Mile Beach,2023-09-28T15:19:00Z,2023,9,WHI,TRUE,TRUE,TRUE,2023-24-NSW-SMART-drumline-annual-report.pdf
19/10/2023,14:18,Tiger Shark,326,M,Alive,"ID, A",Forster,One Mile Beach,2023-10-19T14:18:00Z,2023,10,TIG,TRUE,TRUE,TRUE,2023-24-NSW-SMART-drumline-annual-report.pdf
3/11/2023,12:29,White Shark,301,M,Alive,"ID, A",Forster,One Mile Beach,2023-11-03T12:29:00Z,2023,11,WHI,TRUE,TRUE,TRUE,2023-24-NSW-SMART-drumline-annual-report.pdf
4/11/2023,NA,White Shark,279,M,Alive,"ID, A",Forster,One Mile Beach,NA,2023,11,WHI,TRUE,TRUE,TRUE,2023-24-NSW-SMART-drumline-annual-report.pdf
26/11/2023,12:36,Bronze Whaler,273,F,Alive,ID,Forster,One Mile Beach,2023-11-26T12:36:00Z,2023,11,BRO,FALSE,TRUE,FALSE,2023-24-NSW-SMART-drumline-annual-report.pdf
18/12/2023,15:00,Loggerhead Turtle,NA,NA,Alive,NA,Forster,One Mile Beach,2023-12-18T15:00:00Z,2023,12,LOG,FALSE,FALSE,FALSE,2023-24-NSW-SMART-drumline-annual-report.pdf
30/01/2024,7:35,Common Blacktip,191,M,Alive,ID,Forster,One Mile Beach,2024-01-30T07:35:00Z,2024,1,CBT,FALSE,TRUE,FALSE,2023-24-NSW-SMART-drumline-annual-report.pdf
12/02/2024,15:12,Tiger Shark,197,F,Alive,"ID, A",Forster,One Mile Beach,2024-02-12T15:12:00Z,2024,2,TIG,TRUE,TRUE,TRUE,2023-24-NSW-SMART-drumline-annual-report.pdf
8/04/2024,13:48,Spinner Shark,122,M,Alive,ID,Forster,One Mile Beach,2024-04-08T13:48:00Z,2024,4,SPN,FALSE,TRUE,FALSE,2023-24-NSW-SMART-drumline-annual-report.pdf
15/05/2024,12:51,White Shark,293,F,Alive,"ID, A",Forster,One Mile Beach,2024-05-15T12:51:00Z,2024,5,WHI,TRUE,TRUE,TRUE,2023-24-NSW-SMART-drumline-annual-report.pdf
22/07/2023,NA,White Shark,251,M,Alive,"ID, A",Forster,Pebbly Beach,NA,2023,7,WHI,TRUE,TRUE,TRUE,2023-24-NSW-SMART-drumline-annual-report.pdf
13/11/2023,9:54,White Shark,263,M,Alive,"ID, A",Forster,Pebbly Beach,2023-11-13T09:54:00Z,2023,11,WHI,TRUE,TRUE,TRUE,2023-24-NSW-SMART-drumline-annual-report.pdf
22/11/2023,9:30,White Shark,229,M,Alive,"ID, A",Forster,Pebbly Beach,2023-11-22T09:30:00Z,2023,11,WHI,TRUE,TRUE,TRUE,2023-24-NSW-SMART-drumline-annual-report.pdf
7/12/2023,9:47,White Shark,306,F,Alive,"ID, A",Forster,Pebbly Beach,2023-12-07T09:47:00Z,2023,12,WHI,TRUE,TRUE,TRUE,2023-24-NSW-SMART-drumline-annual-report.pdf
29/06/2024,NA,White Shark,199,F,Alive,"ID, A",Forster,Pebbly Beach,NA,2024,6,WHI,TRUE,TRUE,TRUE,2023-24-NSW-SMART-drumline-annual-report.pdf
1/07/2023,9:26,White Shark,267,M,Alive,"ID, A",Forster,Tuncurry Beach,2023-07-01T09:26:00Z,2023,7,WHI,TRUE,TRUE,TRUE,2023-24-NSW-SMART-drumline-annual-report.pdf
9/07/2023,10:10,White Shark,218,F,Alive,"ID, A",Forster,Tuncurry Beach,2023-07-09T10:10:00Z,2023,7,WHI,TRUE,TRUE,TRUE,2023-24-NSW-SMART-drumline-annual-report.pdf
9/07/2023,12:01,White Shark,260,F,Alive,"ID, A",Forster,Tuncurry Beach,2023-07-09T12:01:00Z,2023,7,WHI,TRUE,TRUE,TRUE,2023-24-NSW-SMART-drumline-annual-report.pdf
19/07/2023,10:55,White Shark,250,M,Alive,"ID, A",Forster,Tuncurry Beach,2023-07-19T10:55:00Z,2023,7,WHI,TRUE,TRUE,TRUE,2023-24-NSW-SMART-drumline-annual-report.pdf
12/08/2023,11:24,Bronze Whaler,256,F,Alive,ID,Forster,Tuncurry Beach,2023-08-12T11:24:00Z,2023,8,BRO,FALSE,TRUE,FALSE,2023-24-NSW-SMART-drumline-annual-report.pdf
17/08/2023,9:28,White Shark,198,F,Alive,"ID, A",Forster,Tuncurry Beach,2023-08-17T09:28:00Z,2023,8,WHI,TRUE,TRUE,TRUE,2023-24-NSW-SMART-drumline-annual-report.pdf
5/09/2023,13:47,White Shark,264,F,Alive,"ID, A",Forster,Tuncurry Beach,2023-09-05T13:47:00Z,2023,9,WHI,TRUE,TRUE,TRUE,2023-24-NSW-SMART-drumline-annual-report.pdf
12/09/2023,8:29,Bronze Whaler,297,F,Alive,ID,Forster,Tuncurry Beach,2023-09-12T08:29:00Z,2023,9,BRO,FALSE,TRUE,FALSE,2023-24-NSW-SMART-drumline-annual-report.pdf
16/09/2023,10:06,White Shark,221,F,Alive,"ID, A",Forster,Tuncurry Beach,2023-09-16T10:06:00Z,2023,9,WHI,TRUE,TRUE,TRUE,2023-24-NSW-SMART-drumline-annual-report.pdf
22/09/2023,12:20,White Shark,263,F,Alive,"ID, A",Forster,Tuncurry Beach,2023-09-22T12:20:00Z,2023,9,WHI,TRUE,TRUE,TRUE,2023-24-NSW-SMART-drumline-annual-report.pdf
24/09/2023,12:19,White Shark,250,M,Alive,"ID, A",Forster,Tuncurry Beach,2023-09-24T12:19:00Z,2023,9,WHI,TRUE,TRUE,TRUE,2023-24-NSW-SMART-drumline-annual-report.pdf
15/10/2023,10:54,White Shark,236,F,Alive,"ID, A",Forster,Tuncurry Beach,2023-10-15T10:54:00Z,2023,10,WHI,TRUE,TRUE,TRUE,2023-24-NSW-SMART-drumline-annual-report.pdf
19/10/2023,8:00,White Shark,254,F,Alive,"ID, A",Forster,Tuncurry Beach,2023-10-19T08:00:00Z,2023,10,WHI,TRUE,TRUE,TRUE,2023-24-NSW-SMART-drumline-annual-report.pdf
31/10/2023,14:26,White Shark,334,F,Alive,"ID, A",Forster,Tuncurry Beach,2023-10-31T14:26:00Z,2023,10,WHI,TRUE,TRUE,TRUE,2023-24-NSW-SMART-drumline-annual-report.pdf
22/11/2023,14:55,White Shark,315,F,Alive,"ID, A",Forster,Tuncurry Beach,2023-11-22T14:55:00Z,2023,11,WHI,TRUE,TRUE,TRUE,2023-24-NSW-SMART-drumline-annual-report.pdf
27/11/2023,14:04,Bronze Whaler,270,F,Alive,NA,Forster,Tuncurry Beach,2023-11-27T14:04:00Z,2023,11,BRO,FALSE,FALSE,FALSE,2023-24-NSW-SMART-drumline-annual-report.pdf
15/12/2023,NA,White Shark,275,F,Alive,"ID, A",Forster,Tuncurry Beach,NA,2023,12,WHI,TRUE,TRUE,TRUE,2023-24-NSW-SMART-drumline-annual-report.pdf
6/01/2024,6:55,White Shark,263,F,Alive,"ID, A",Forster,Tuncurry Beach,2024-01-06T06:55:00Z,2024,1,WHI,TRUE,TRUE,TRUE,2023-24-NSW-SMART-drumline-annual-report.pdf
30/01/2024,14:43,Common Blacktip,213,M,Alive,ID,Forster,Tuncurry Beach,2024-01-30T14:43:00Z,2024,1,CBT,FALSE,TRUE,FALSE,2023-24-NSW-SMART-drumline-annual-report.pdf
7/03/2024,9:13,Bull Shark,227,F,Alive,"ID, A",Forster,Tuncurry Beach,2024-03-07T09:13:00Z,2024,3,BUL,TRUE,TRUE,TRUE,2023-24-NSW-SMART-drumline-annual-report.pdf
4/04/2024,10:54,Tiger Shark,169,M,Alive,"ID, A",Forster,Tuncurry Beach,2024-04-04T10:54:00Z,2024,4,TIG,TRUE,TRUE,TRUE,2023-24-NSW-SMART-drumline-annual-report.pdf
9/05/2024,14:26,White Shark,247,M,Alive,"ID, A",Forster,Tuncurry Beach,2024-05-09T14:26:00Z,2024,5,WHI,TRUE,TRUE,TRUE,2023-24-NSW-SMART-drumline-annual-report.pdf
30/05/2024,8:18,White Shark,262,F,Alive,"ID, A",Forster,Tuncurry Beach,2024-05-30T08:18:00Z,2024,5,WHI,TRUE,TRUE,TRUE,2023-24-NSW-SMART-drumline-annual-report.pdf
11/06/2024,10:00,White Shark,283,F,Alive,"ID, A",Forster,Tuncurry Beach,2024-06-11T10:00:00Z,2024,6,WHI,TRUE,TRUE,TRUE,2023-24-NSW-SMART-drumline-annual-report.pdf
17/06/2024,8:46,White Shark,252,M,Alive,"ID, A",Forster,Tuncurry Beach,2024-06-17T08:46:00Z,2024,6,WHI,TRUE,TRUE,TRUE,2023-24-NSW-SMART-drumline-annual-report.pdf
25/06/2024,11:37,White Shark,223,M,Alive,"ID, A",Forster,Tuncurry Beach,2024-06-25T11:37:00Z,2024,6,WHI,TRUE,TRUE,TRUE,2023-24-NSW-SMART-drumline-annual-report.pdf
13/10/2023,NA,Shortfin Mako Shark,109,F,Alive,ID,Kiama,Bombo Beach,NA,2023,10,SMA,FALSE,TRUE,FALSE,2023-24-NSW-SMART-drumline-annual-report.pdf
21/11/2023,12:24,Smooth Hammerhead,143,F,Alive,ID,Kiama,Bombo Beach,2023-11-21T12:24:00Z,2023,11,SMH,FALSE,TRUE,FALSE,2023-24-NSW-SMART-drumline-annual-report.pdf
29/12/2023,9:03,Shortfin Mako Shark,99,F,Alive,ID,Kiama,Bombo Beach,2023-12-29T09:03:00Z,2023,12,SMA,FALSE,TRUE,FALSE,2023-24-NSW-SMART-drumline-annual-report.pdf
30/01/2024,8:29,Tiger Shark,233,F,Alive,"ID, A",Kiama,Bombo Beach,2024-01-30T08:29:00Z,2024,1,TIG,TRUE,TRUE,TRUE,2023-24-NSW-SMART-drumline-annual-report.pdf
27/02/2024,11:41,Tiger Shark,198,M,Alive,"ID, A",Kiama,Bombo Beach,2024-02-27T11:41:00Z,2024,2,TIG,TRUE,TRUE,TRUE,2023-24-NSW-SMART-drumline-annual-report.pdf
27/08/2023,11:06,Shortfin Mako Shark,316,M,Alive,ID,Kiama,Easts Beach,2023-08-27T11:06:00Z,2023,8,SMA,FALSE,TRUE,FALSE,2023-24-NSW-SMART-drumline-annual-report.pdf
23/09/2023,13:57,Bronze Whaler,294,F,Alive,ID,Kiama,Easts Beach,2023-09-23T13:57:00Z,2023,9,BRO,FALSE,TRUE,FALSE,2023-24-NSW-SMART-drumline-annual-report.pdf
23/10/2023,10:30,Bronze Whaler,202,M,Alive,ID,Kiama,Easts Beach,2023-10-23T10:30:00Z,2023,10,BRO,FALSE,TRUE,FALSE,2023-24-NSW-SMART-drumline-annual-report.pdf
14/11/2023,10:30,Shortfin Mako Shark,147,F,Alive,ID,Kiama,Easts Beach,2023-11-14T10:30:00Z,2023,11,SMA,FALSE,TRUE,FALSE,2023-24-NSW-SMART-drumline-annual-report.pdf
22/11/2023,8:13,Shortfin Mako Shark,138,M,Alive,ID,Kiama,Easts Beach,2023-11-22T08:13:00Z,2023,11,SMA,FALSE,TRUE,FALSE,2023-24-NSW-SMART-drumline-annual-report.pdf
1/12/2023,11:12,Smooth Hammerhead,210,NA,Alive,NA,Kiama,Easts Beach,2023-12-01T11:12:00Z,2023,12,SMH,FALSE,FALSE,FALSE,2023-24-NSW-SMART-drumline-annual-report.pdf
16/11/2023,9:54,Smooth Hammerhead,171,F,Alive,ID,Kiama,Jones Beach,2023-11-16T09:54:00Z,2023,11,SMH,FALSE,TRUE,FALSE,2023-24-NSW-SMART-drumline-annual-report.pdf
18/01/2024,11:23,Bronze Whaler,249,M,Alive,ID,Kiama,Minnamurra Beach,2024-01-18T11:23:00Z,2024,1,BRO,FALSE,TRUE,FALSE,2023-24-NSW-SMART-drumline-annual-report.pdf
7/05/2024,13:30,White Shark,276,F,Alive,"ID, A",Kiama,Minnamurra Beach,2024-05-07T13:30:00Z,2024,5,WHI,TRUE,TRUE,TRUE,2023-24-NSW-SMART-drumline-annual-report.pdf
4/07/2023,10:57,Tiger Shark,357,F,Alive,"ID, A",Kiama,Werri Beach,2023-07-04T10:57:00Z,2023,7,TIG,TRUE,TRUE,TRUE,2023-24-NSW-SMART-drumline-annual-report.pdf
26/07/2023,15:18,Bronze Whaler,301,F,Alive,ID,Kiama,Werri Beach,2023-07-26T15:18:00Z,2023,7,BRO,FALSE,TRUE,FALSE,2023-24-NSW-SMART-drumline-annual-report.pdf
25/08/2023,9:29,Bronze Whaler,257,F,Alive,ID,Kiama,Werri Beach,2023-08-25T09:29:00Z,2023,8,BRO,FALSE,TRUE,FALSE,2023-24-NSW-SMART-drumline-annual-report.pdf
13/09/2023,14:59,Bronze Whaler,228,F,Alive,ID,Kiama,Werri Beach,2023-09-13T14:59:00Z,2023,9,BRO,FALSE,TRUE,FALSE,2023-24-NSW-SMART-drumline-annual-report.pdf
16/09/2023,8:43,Bronze Whaler,218,M,Alive,ID,Kiama,Werri Beach,2023-09-16T08:43:00Z,2023,9,BRO,FALSE,TRUE,FALSE,2023-24-NSW-SMART-drumline-annual-report.pdf
16/09/2023,11:52,Bronze Whaler,262,M,Alive,ID,Kiama,Werri Beach,2023-09-16T11:52:00Z,2023,9,BRO,FALSE,TRUE,FALSE,2023-24-NSW-SMART-drumline-annual-report.pdf
23/12/2023,8:49,Smooth Hammerhead,256,F,Alive,ID,Kiama,Werri Beach,2023-12-23T08:49:00Z,2023,12,SMH,FALSE,TRUE,FALSE,2023-24-NSW-SMART-drumline-annual-report.pdf
23/01/2024,9:28,Smooth Hammerhead,161,F,Alive,ID,Kiama,Werri Beach,2024-01-23T09:28:00Z,2024,1,SMH,FALSE,TRUE,FALSE,2023-24-NSW-SMART-drumline-annual-report.pdf
11/02/2024,10:55,Dusky Whaler,134,F,Dead,NA,Kiama,Werri Beach,2024-02-11T10:55:00Z,2024,2,DUS,FALSE,FALSE,FALSE,2023-24-NSW-SMART-drumline-annual-report.pdf
25/04/2024,9:28,Dusky Whaler,90,NA,Alive,NA,Kiama,Werri Beach,2024-04-25T09:28:00Z,2024,4,DUS,FALSE,FALSE,FALSE,2023-24-NSW-SMART-drumline-annual-report.pdf
29/06/2024,8:12,Tiger Shark,251,F,Alive,"ID, A",Kingscliff,Cabarita Beach,2024-06-29T08:12:00Z,2024,6,TIG,TRUE,TRUE,TRUE,2023-24-NSW-SMART-drumline-annual-report.pdf
13/08/2023,8:24,Tiger Shark,351,F,Alive,"ID, A",Kingscliff,Cabarita Beach,2023-08-13T08:24:00Z,2023,8,TIG,TRUE,TRUE,TRUE,2023-24-NSW-SMART-drumline-annual-report.pdf
17/09/2023,14:27,Tiger Shark,261,M,Alive,"ID, A",Kingscliff,Cabarita Beach,2023-09-17T14:27:00Z,2023,9,TIG,TRUE,TRUE,TRUE,2023-24-NSW-SMART-drumline-annual-report.pdf
30/09/2023,8:27,Dusky Whaler,304,M,Alive,ID,Kingscliff,Cabarita Beach,2023-09-30T08:27:00Z,2023,9,DUS,FALSE,TRUE,FALSE,2023-24-NSW-SMART-drumline-annual-report.pdf
17/05/2024,8:23,White Shark,341,M,Alive,"ID, A",Kingscliff,Cabarita Beach,2024-05-17T08:23:00Z,2024,5,WHI,TRUE,TRUE,TRUE,2023-24-NSW-SMART-drumline-annual-report.pdf
29/05/2024,8:15,Shortfin Mako Shark,319,F,Alive,ID,Kingscliff,Cabarita Beach,2024-05-29T08:15:00Z,2024,5,SMA,FALSE,TRUE,FALSE,2023-24-NSW-SMART-drumline-annual-report.pdf
17/09/2023,11:33,Tiger Shark,256,F,Alive,"ID, A",Kingscliff,Kingscliff Beach,2023-09-17T11:33:00Z,2023,9,TIG,TRUE,TRUE,TRUE,2023-24-NSW-SMART-drumline-annual-report.pdf
30/06/2024,14:23,Tiger Shark,316,F,Alive,"ID, A",Kingscliff,Kingscliff Beach,2024-06-30T14:23:00Z,2024,6,TIG,TRUE,TRUE,TRUE,2023-24-NSW-SMART-drumline-annual-report.pdf
3/02/2024,14:41,Tiger Shark,218,F,Alive,"ID, A",Kingscliff,South Kingscliff Beach,2024-02-03T14:41:00Z,2024,2,TIG,TRUE,TRUE,TRUE,2023-24-NSW-SMART-drumline-annual-report.pdf
20/06/2024,15:37,Tiger Shark,243,M,Alive,"ID, A",Kingscliff,South Kingscliff Beach,2024-06-20T15:37:00Z,2024,6,TIG,TRUE,TRUE,TRUE,2023-24-NSW-SMART-drumline-annual-report.pdf
3/08/2023,10:34,White Shark,190,M,Alive,"ID, A",Lake Macquarie,Blacksmiths Beach,2023-08-03T10:34:00Z,2023,8,WHI,TRUE,TRUE,TRUE,2023-24-NSW-SMART-drumline-annual-report.pdf
14/08/2023,NA,Dusky Whaler,126,M,Alive,ID,Lake Macquarie,Blacksmiths Beach,NA,2023,8,DUS,FALSE,TRUE,FALSE,2023-24-NSW-SMART-drumline-annual-report.pdf
5/10/2023,NA,Dusky Whaler,131,F,Alive,ID,Lake Macquarie,Blacksmiths Beach,NA,2023,10,DUS,FALSE,TRUE,FALSE,2023-24-NSW-SMART-drumline-annual-report.pdf
14/10/2023,12:10,Greynurse Shark,256,F,Alive,ID,Lake Macquarie,Blacksmiths Beach,2023-10-14T12:10:00Z,2023,10,GRN,FALSE,TRUE,FALSE,2023-24-NSW-SMART-drumline-annual-report.pdf
6/11/2023,9:18,Unidentified Whaler,300,NA,Alive,NA,Lake Macquarie,Blacksmiths Beach,2023-11-06T09:18:00Z,2023,11,UNK,FALSE,FALSE,FALSE,2023-24-NSW-SMART-drumline-annual-report.pdf
20/01/2024,NA,Common Blacktip,129,M,Dead,NA,Lake Macquarie,Blacksmiths Beach,NA,2024,1,CBT,FALSE,FALSE,FALSE,2023-24-NSW-SMART-drumline-annual-report.pdf
21/01/2024,NA,Dusky Whaler,116,M,Alive,ID,Lake Macquarie,Blacksmiths Beach,NA,2024,1,DUS,FALSE,TRUE,FALSE,2023-24-NSW-SMART-drumline-annual-report.pdf
5/03/2024,NA,Dusky Whaler,113,F,Dead,NA,Lake Macquarie,Blacksmiths Beach,NA,2024,3,DUS,FALSE,FALSE,FALSE,2023-24-NSW-SMART-drumline-annual-report.pdf
7/03/2024,NA,Dusky Whaler,125,F,Alive,ID,Lake Macquarie,Blacksmiths Beach,NA,2024,3,DUS,FALSE,TRUE,FALSE,2023-24-NSW-SMART-drumline-annual-report.pdf
26/03/2024,12:43,Tiger Shark,159,F,Alive,"ID, A",Lake Macquarie,Blacksmiths Beach,2024-03-26T12:43:00Z,2024,3,TIG,TRUE,TRUE,TRUE,2023-24-NSW-SMART-drumline-annual-report.pdf
26/06/2024,13:35,Dusky Whaler,203,NA,Dead,NA,Lake Macquarie,Blacksmiths Beach,2024-06-26T13:35:00Z,2024,6,DUS,FALSE,FALSE,FALSE,2023-24-NSW-SMART-drumline-annual-report.pdf
14/08/2023,9:03,White Shark,208,F,Alive,"ID, A",Lake Macquarie,Caves Beach,2023-08-14T09:03:00Z,2023,8,WHI,TRUE,TRUE,TRUE,2023-24-NSW-SMART-drumline-annual-report.pdf
9/09/2023,8:06,Bronze Whaler,288,F,Alive,ID,Lake Macquarie,Caves Beach,2023-09-09T08:06:00Z,2023,9,BRO,FALSE,TRUE,FALSE,2023-24-NSW-SMART-drumline-annual-report.pdf
24/09/2023,11:11,Dusky Whaler,125,F,Alive,ID,Lake Macquarie,Caves Beach,2023-09-24T11:11:00Z,2023,9,DUS,FALSE,TRUE,FALSE,2023-24-NSW-SMART-drumline-annual-report.pdf
24/09/2023,NA,Dusky Whaler,113,F,Alive,ID,Lake Macquarie,Caves Beach,NA,2023,9,DUS,FALSE,TRUE,FALSE,2023-24-NSW-SMART-drumline-annual-report.pdf
29/09/2023,11:24,Dusky Whaler,123,F,Alive,ID,Lake Macquarie,Caves Beach,2023-09-29T11:24:00Z,2023,9,DUS,FALSE,TRUE,FALSE,2023-24-NSW-SMART-drumline-annual-report.pdf
2/11/2023,8:22,Dusky Whaler,166,F,Alive,ID,Lake Macquarie,Caves Beach,2023-11-02T08:22:00Z,2023,11,DUS,FALSE,TRUE,FALSE,2023-24-NSW-SMART-drumline-annual-report.pdf
6/11/2023,15:21,Dusky Whaler,112,F,Alive,ID,Lake Macquarie,Caves Beach,2023-11-06T15:21:00Z,2023,11,DUS,FALSE,TRUE,FALSE,2023-24-NSW-SMART-drumline-annual-report.pdf
8/11/2023,7:57,Dusky Whaler,120,M,Alive,ID,Lake Macquarie,Caves Beach,2023-11-08T07:57:00Z,2023,11,DUS,FALSE,TRUE,FALSE,2023-24-NSW-SMART-drumline-annual-report.pdf
11/01/2024,10:44,Dusky Whaler,138,M,Alive,ID,Lake Macquarie,Caves Beach,2024-01-11T10:44:00Z,2024,1,DUS,FALSE,TRUE,FALSE,2023-24-NSW-SMART-drumline-annual-report.pdf
12/01/2024,8:36,Dusky Whaler,123,M,Alive,ID,Lake Macquarie,Caves Beach,2024-01-12T08:36:00Z,2024,1,DUS,FALSE,TRUE,FALSE,2023-24-NSW-SMART-drumline-annual-report.pdf
13/01/2024,12:21,Dusky Whaler,123,M,Alive,ID,Lake Macquarie,Caves Beach,2024-01-13T12:21:00Z,2024,1,DUS,FALSE,TRUE,FALSE,2023-24-NSW-SMART-drumline-annual-report.pdf
13/01/2024,15:30,Dusky Whaler,129,M,Alive,ID,Lake Macquarie,Caves Beach,2024-01-13T15:30:00Z,2024,1,DUS,FALSE,TRUE,FALSE,2023-24-NSW-SMART-drumline-annual-report.pdf
21/01/2024,11:13,Dusky Whaler,102,F,Alive,ID,Lake Macquarie,Caves Beach,2024-01-21T11:13:00Z,2024,1,DUS,FALSE,TRUE,FALSE,2023-24-NSW-SMART-drumline-annual-report.pdf
21/01/2024,12:36,Dusky Whaler,134,F,Alive,ID,Lake Macquarie,Caves Beach,2024-01-21T12:36:00Z,2024,1,DUS,FALSE,TRUE,FALSE,2023-24-NSW-SMART-drumline-annual-report.pdf
24/01/2024,NA,Dusky Whaler,117,M,Dead,NA,Lake Macquarie,Caves Beach,NA,2024,1,DUS,FALSE,FALSE,FALSE,2023-24-NSW-SMART-drumline-annual-report.pdf
27/01/2024,7:52,Dusky Whaler,122,M,Alive,ID,Lake Macquarie,Caves Beach,2024-01-27T07:52:00Z,2024,1,DUS,FALSE,TRUE,FALSE,2023-24-NSW-SMART-drumline-annual-report.pdf
28/01/2024,NA,Dusky Whaler,114,F,Dead,NA,Lake Macquarie,Caves Beach,NA,2024,1,DUS,FALSE,FALSE,FALSE,2023-24-NSW-SMART-drumline-annual-report.pdf
1/02/2024,NA,Tiger Shark,145,F,Alive,"ID, A",Lake Macquarie,Caves Beach,NA,2024,2,TIG,TRUE,TRUE,TRUE,2023-24-NSW-SMART-drumline-annual-report.pdf
2/02/2024,NA,Dusky Whaler,109,M,Alive,ID,Lake Macquarie,Caves Beach,NA,2024,2,DUS,FALSE,TRUE,FALSE,2023-24-NSW-SMART-drumline-annual-report.pdf
12/02/2024,8:26,Dusky Whaler,129,M,Alive,ID,Lake Macquarie,Caves Beach,2024-02-12T08:26:00Z,2024,2,DUS,FALSE,TRUE,FALSE,2023-24-NSW-SMART-drumline-annual-report.pdf
14/02/2024,NA,Dusky Whaler,113,F,Alive,NA,Lake Macquarie,Caves Beach,NA,2024,2,DUS,FALSE,FALSE,FALSE,2023-24-NSW-SMART-drumline-annual-report.pdf
15/02/2024,9:09,Dusky Whaler,119,F,Alive,ID,Lake Macquarie,Caves Beach,2024-02-15T09:09:00Z,2024,2,DUS,FALSE,TRUE,FALSE,2023-24-NSW-SMART-drumline-annual-report.pdf
16/02/2024,10:19,Dusky Whaler,119,F,Alive,ID,Lake Macquarie,Caves Beach,2024-02-16T10:19:00Z,2024,2,DUS,FALSE,TRUE,FALSE,2023-24-NSW-SMART-drumline-annual-report.pdf
23/02/2024,8:18,Dusky Whaler,109,M,Alive,ID,Lake Macquarie,Caves Beach,2024-02-23T08:18:00Z,2024,2,DUS,FALSE,TRUE,FALSE,2023-24-NSW-SMART-drumline-annual-report.pdf
5/03/2024,9:24,Dusky Whaler,124,M,Alive,ID,Lake Macquarie,Caves Beach,2024-03-05T09:24:00Z,2024,3,DUS,FALSE,TRUE,FALSE,2023-24-NSW-SMART-drumline-annual-report.pdf
13/03/2024,8:38,Dusky Whaler,140,M,Alive,ID,Lake Macquarie,Caves Beach,2024-03-13T08:38:00Z,2024,3,DUS,FALSE,TRUE,FALSE,2023-24-NSW-SMART-drumline-annual-report.pdf
24/03/2024,16:47,Dusky Whaler,139,M,Alive,ID,Lake Macquarie,Caves Beach,2024-03-24T16:47:00Z,2024,3,DUS,FALSE,TRUE,FALSE,2023-24-NSW-SMART-drumline-annual-report.pdf
2/04/2024,NA,Dusky Whaler,125,F,Dead,NA,Lake Macquarie,Caves Beach,NA,2024,4,DUS,FALSE,FALSE,FALSE,2023-24-NSW-SMART-drumline-annual-report.pdf
19/04/2024,14:41,Dusky Whaler,132,M,Alive,ID,Lake Macquarie,Caves Beach,2024-04-19T14:41:00Z,2024,4,DUS,FALSE,TRUE,FALSE,2023-24-NSW-SMART-drumline-annual-report.pdf
19/04/2024,NA,Dusky Whaler,120,M,Dead,NA,Lake Macquarie,Caves Beach,NA,2024,4,DUS,FALSE,FALSE,FALSE,2023-24-NSW-SMART-drumline-annual-report.pdf
22/04/2024,NA,Dusky Whaler,95,M,Alive,ID,Lake Macquarie,Caves Beach,NA,2024,4,DUS,FALSE,TRUE,FALSE,2023-24-NSW-SMART-drumline-annual-report.pdf
24/06/2024,13:45,White Shark,229,M,Alive,"ID, A",Lake Macquarie,Caves Beach,2024-06-24T13:45:00Z,2024,6,WHI,TRUE,TRUE,TRUE,2023-24-NSW-SMART-drumline-annual-report.pdf
10/07/2023,13:03,Bronze Whaler,179,M,Alive,ID,Lake Macquarie,Frazer Beach,2023-07-10T13:03:00Z,2023,7,BRO,FALSE,TRUE,FALSE,2023-24-NSW-SMART-drumline-annual-report.pdf
10/07/2023,13:22,White Shark,370,F,Alive,"ID, A",Lake Macquarie,Frazer Beach,2023-07-10T13:22:00Z,2023,7,WHI,TRUE,TRUE,TRUE,2023-24-NSW-SMART-drumline-annual-report.pdf
4/09/2023,8:56,Bronze Whaler,255,F,Alive,ID,Lake Macquarie,Frazer Beach,2023-09-04T08:56:00Z,2023,9,BRO,FALSE,TRUE,FALSE,2023-24-NSW-SMART-drumline-annual-report.pdf
11/10/2023,NA,Dusky Whaler,118,M,Alive,ID,Lake Macquarie,Frazer Beach,NA,2023,10,DUS,FALSE,TRUE,FALSE,2023-24-NSW-SMART-drumline-annual-report.pdf
16/11/2023,9:59,Dusky Whaler,118,M,Alive,ID,Lake Macquarie,Frazer Beach,2023-11-16T09:59:00Z,2023,11,DUS,FALSE,TRUE,FALSE,2023-24-NSW-SMART-drumline-annual-report.pdf
21/11/2023,7:14,Dusky Whaler,152,F,Alive,ID,Lake Macquarie,Frazer Beach,2023-11-21T07:14:00Z,2023,11,DUS,FALSE,TRUE,FALSE,2023-24-NSW-SMART-drumline-annual-report.pdf
15/12/2023,16:08,Smooth Hammerhead,170,F,Alive,ID,Lake Macquarie,Frazer Beach,2023-12-15T16:08:00Z,2023,12,SMH,FALSE,TRUE,FALSE,2023-24-NSW-SMART-drumline-annual-report.pdf
26/12/2023,10:37,Smooth Hammerhead,164,M,Alive,ID,Lake Macquarie,Frazer Beach,2023-12-26T10:37:00Z,2023,12,SMH,FALSE,TRUE,FALSE,2023-24-NSW-SMART-drumline-annual-report.pdf
3/01/2024,8:23,Dusky Whaler,119,M,Alive,ID,Lake Macquarie,Frazer Beach,2024-01-03T08:23:00Z,2024,1,DUS,FALSE,TRUE,FALSE,2023-24-NSW-SMART-drumline-annual-report.pdf
12/01/2024,14:09,Dusky Whaler,127,M,Alive,ID,Lake Macquarie,Frazer Beach,2024-01-12T14:09:00Z,2024,1,DUS,FALSE,TRUE,FALSE,2023-24-NSW-SMART-drumline-annual-report.pdf
20/01/2024,7:53,Dusky Whaler,166,M,Alive,ID,Lake Macquarie,Frazer Beach,2024-01-20T07:53:00Z,2024,1,DUS,FALSE,TRUE,FALSE,2023-24-NSW-SMART-drumline-annual-report.pdf
5/02/2024,NA,Dusky Whaler,125,M,Dead,NA,Lake Macquarie,Frazer Beach,NA,2024,2,DUS,FALSE,FALSE,FALSE,2023-24-NSW-SMART-drumline-annual-report.pdf
13/02/2024,9:25,Dusky Whaler,203,M,Alive,ID,Lake Macquarie,Frazer Beach,2024-02-13T09:25:00Z,2024,2,DUS,FALSE,TRUE,FALSE,2023-24-NSW-SMART-drumline-annual-report.pdf
14/02/2024,11:32,Dusky Whaler,123,M,Alive,ID,Lake Macquarie,Frazer Beach,2024-02-14T11:32:00Z,2024,2,DUS,FALSE,TRUE,FALSE,2023-24-NSW-SMART-drumline-annual-report.pdf
16/02/2024,12:09,Dusky Whaler,120,NA,Alive,NA,Lake Macquarie,Frazer Beach,2024-02-16T12:09:00Z,2024,2,DUS,FALSE,FALSE,FALSE,2023-24-NSW-SMART-drumline-annual-report.pdf
18/02/2024,14:34,Dusky Whaler,122,F,Alive,ID,Lake Macquarie,Frazer Beach,2024-02-18T14:34:00Z,2024,2,DUS,FALSE,TRUE,FALSE,2023-24-NSW-SMART-drumline-annual-report.pdf
19/02/2024,NA,Dusky Whaler,121,F,Alive,NA,Lake Macquarie,Frazer Beach,NA,2024,2,DUS,FALSE,FALSE,FALSE,2023-24-NSW-SMART-drumline-annual-report.pdf
5/03/2024,16:03,Dusky Whaler,130,M,Alive,ID,Lake Macquarie,Frazer Beach,2024-03-05T16:03:00Z,2024,3,DUS,FALSE,TRUE,FALSE,2023-24-NSW-SMART-drumline-annual-report.pdf
13/03/2024,12:43,Dusky Whaler,110,F,Alive,ID,Lake Macquarie,Frazer Beach,2024-03-13T12:43:00Z,2024,3,DUS,FALSE,TRUE,FALSE,2023-24-NSW-SMART-drumline-annual-report.pdf
12/04/2024,14:50,Dusky Whaler,155,F,Alive,ID,Lake Macquarie,Frazer Beach,2024-04-12T14:50:00Z,2024,4,DUS,FALSE,TRUE,FALSE,2023-24-NSW-SMART-drumline-annual-report.pdf
22/05/2024,NA,Dusky Whaler,143,M,Dead,NA,Lake Macquarie,Frazer Beach,NA,2024,5,DUS,FALSE,FALSE,FALSE,2023-24-NSW-SMART-drumline-annual-report.pdf
24/05/2024,NA,Dusky Whaler,146,F,Dead,NA,Lake Macquarie,Frazer Beach,NA,2024,5,DUS,FALSE,FALSE,FALSE,2023-24-NSW-SMART-drumline-annual-report.pdf
28/06/2024,NA,Dusky Whaler,152,M,Alive,ID,Lake Macquarie,Frazer Beach,NA,2024,6,DUS,FALSE,TRUE,FALSE,2023-24-NSW-SMART-drumline-annual-report.pdf
16/09/2023,7:47,Bronze Whaler,297,F,Alive,ID,Lake Macquarie,Ghosties Beach,2023-09-16T07:47:00Z,2023,9,BRO,FALSE,TRUE,FALSE,2023-24-NSW-SMART-drumline-annual-report.pdf
20/01/2024,8:03,Dusky Whaler,157,M,Alive,ID,Lake Macquarie,Ghosties Beach,2024-01-20T08:03:00Z,2024,1,DUS,FALSE,TRUE,FALSE,2023-24-NSW-SMART-drumline-annual-report.pdf
17/02/2024,7:37,Dusky Whaler,125,F,Alive,ID,Lake Macquarie,Ghosties Beach,2024-02-17T07:37:00Z,2024,2,DUS,FALSE,TRUE,FALSE,2023-24-NSW-SMART-drumline-annual-report.pdf
7/03/2024,7:29,Dusky Whaler,154,M,Alive,ID,Lake Macquarie,Ghosties Beach,2024-03-07T07:29:00Z,2024,3,DUS,FALSE,TRUE,FALSE,2023-24-NSW-SMART-drumline-annual-report.pdf
13/09/2023,10:25,Black Ray,220,NA,Alive,NA,Lake Macquarie,Hams Beach,2023-09-13T10:25:00Z,2023,9,BLR,FALSE,FALSE,FALSE,2023-24-NSW-SMART-drumline-annual-report.pdf
24/09/2023,6:48,Dusky Whaler,118,F,Alive,ID,Lake Macquarie,Hams Beach,2023-09-24T06:48:00Z,2023,9,DUS,FALSE,TRUE,FALSE,2023-24-NSW-SMART-drumline-annual-report.pdf
24/09/2023,NA,Snapper,52,NA,Dead,NA,Lake Macquarie,Hams Beach,NA,2023,9,SNP,FALSE,FALSE,FALSE,2023-24-NSW-SMART-drumline-annual-report.pdf
27/09/2023,NA,Dusky Whaler,105,F,Dead,NA,Lake Macquarie,Hams Beach,NA,2023,9,DUS,FALSE,FALSE,FALSE,2023-24-NSW-SMART-drumline-annual-report.pdf
29/09/2023,NA,Dusky Whaler,109,F,Alive,ID,Lake Macquarie,Hams Beach,NA,2023,9,DUS,FALSE,TRUE,FALSE,2023-24-NSW-SMART-drumline-annual-report.pdf
16/10/2023,NA,Snapper,42,NA,Dead,NA,Lake Macquarie,Hams Beach,NA,2023,10,SNP,FALSE,FALSE,FALSE,2023-24-NSW-SMART-drumline-annual-report.pdf
11/11/2023,NA,Dusky Whaler,126,F,Dead,NA,Lake Macquarie,Hams Beach,NA,2023,11,DUS,FALSE,FALSE,FALSE,2023-24-NSW-SMART-drumline-annual-report.pdf
21/11/2023,NA,Dusky Whaler,121,F,Dead,NA,Lake Macquarie,Hams Beach,NA,2023,11,DUS,FALSE,FALSE,FALSE,2023-24-NSW-SMART-drumline-annual-report.pdf
23/03/2024,NA,Snapper,62,NA,Dead,NA,Lake Macquarie,Hams Beach,NA,2024,3,SNP,FALSE,FALSE,FALSE,2023-24-NSW-SMART-drumline-annual-report.pdf
26/03/2024,NA,Snapper,57,NA,Dead,NA,Lake Macquarie,Hams Beach,NA,2024,3,SNP,FALSE,FALSE,FALSE,2023-24-NSW-SMART-drumline-annual-report.pdf
29/03/2024,NA,Dusky Whaler,113,M,Dead,NA,Lake Macquarie,Hams Beach,NA,2024,3,DUS,FALSE,FALSE,FALSE,2023-24-NSW-SMART-drumline-annual-report.pdf
5/09/2023,9:31,Dusky Whaler,144,M,Alive,ID,Lake Macquarie,Middle Camp Beach,2023-09-05T09:31:00Z,2023,9,DUS,FALSE,TRUE,FALSE,2023-24-NSW-SMART-drumline-annual-report.pdf
18/09/2023,NA,Dusky Whaler,112,M,Alive,ID,Lake Macquarie,Middle Camp Beach,NA,2023,9,DUS,FALSE,TRUE,FALSE,2023-24-NSW-SMART-drumline-annual-report.pdf
21/09/2023,9:18,Shortfin Mako Shark,145,M,Alive,ID,Lake Macquarie,Middle Camp Beach,2023-09-21T09:18:00Z,2023,9,SMA,FALSE,TRUE,FALSE,2023-24-NSW-SMART-drumline-annual-report.pdf
23/09/2023,14:00,White Shark,208,F,Alive,"ID, A",Lake Macquarie,Middle Camp Beach,2023-09-23T14:00:00Z,2023,9,WHI,TRUE,TRUE,TRUE,2023-24-NSW-SMART-drumline-annual-report.pdf
9/10/2023,13:19,Dusky Whaler,106,F,Alive,ID,Lake Macquarie,Middle Camp Beach,2023-10-09T13:19:00Z,2023,10,DUS,FALSE,TRUE,FALSE,2023-24-NSW-SMART-drumline-annual-report.pdf
23/10/2023,NA,Dusky Whaler,109,M,Alive,ID,Lake Macquarie,Middle Camp Beach,NA,2023,10,DUS,FALSE,TRUE,FALSE,2023-24-NSW-SMART-drumline-annual-report.pdf
3/11/2023,15:24,Bronze Whaler,243,F,Alive,ID,Lake Macquarie,Middle Camp Beach,2023-11-03T15:24:00Z,2023,11,BRO,FALSE,TRUE,FALSE,2023-24-NSW-SMART-drumline-annual-report.pdf
7/11/2023,8:11,Dusky Whaler,88,F,Alive,ID,Lake Macquarie,Middle Camp Beach,2023-11-07T08:11:00Z,2023,11,DUS,FALSE,TRUE,FALSE,2023-24-NSW-SMART-drumline-annual-report.pdf
25/12/2023,7:09,Dusky Whaler,129,F,Alive,ID,Lake Macquarie,Middle Camp Beach,2023-12-25T07:09:00Z,2023,12,DUS,FALSE,TRUE,FALSE,2023-24-NSW-SMART-drumline-annual-report.pdf
18/01/2024,11:32,Dusky Whaler,112,M,Alive,ID,Lake Macquarie,Middle Camp Beach,2024-01-18T11:32:00Z,2024,1,DUS,FALSE,TRUE,FALSE,2023-24-NSW-SMART-drumline-annual-report.pdf
19/01/2024,17:09,Dusky Whaler,129,M,Alive,ID,Lake Macquarie,Middle Camp Beach,2024-01-19T17:09:00Z,2024,1,DUS,FALSE,TRUE,FALSE,2023-24-NSW-SMART-drumline-annual-report.pdf
20/01/2024,11:10,Tiger Shark,144,M,Alive,"ID, A",Lake Macquarie,Middle Camp Beach,2024-01-20T11:10:00Z,2024,1,TIG,TRUE,TRUE,TRUE,2023-24-NSW-SMART-drumline-annual-report.pdf
26/01/2024,12:42,Dusky Whaler,142,F,Alive,ID,Lake Macquarie,Middle Camp Beach,2024-01-26T12:42:00Z,2024,1,DUS,FALSE,TRUE,FALSE,2023-24-NSW-SMART-drumline-annual-report.pdf
27/01/2024,10:08,Smooth Hammerhead,166,M,Alive,ID,Lake Macquarie,Middle Camp Beach,2024-01-27T10:08:00Z,2024,1,SMH,FALSE,TRUE,FALSE,2023-24-NSW-SMART-drumline-annual-report.pdf
30/01/2024,12:17,Tiger Shark,144,M,Alive,"ID, A",Lake Macquarie,Middle Camp Beach,2024-01-30T12:17:00Z,2024,1,TIG,TRUE,TRUE,TRUE,2023-24-NSW-SMART-drumline-annual-report.pdf
9/02/2024,12:21,Dusky Whaler,126,M,Alive,ID,Lake Macquarie,Middle Camp Beach,2024-02-09T12:21:00Z,2024,2,DUS,FALSE,TRUE,FALSE,2023-24-NSW-SMART-drumline-annual-report.pdf
15/02/2024,11:48,Dusky Whaler,128,M,Alive,ID,Lake Macquarie,Middle Camp Beach,2024-02-15T11:48:00Z,2024,2,DUS,FALSE,TRUE,FALSE,2023-24-NSW-SMART-drumline-annual-report.pdf
5/03/2024,16:50,Dusky Whaler,119,M,Alive,ID,Lake Macquarie,Middle Camp Beach,2024-03-05T16:50:00Z,2024,3,DUS,FALSE,TRUE,FALSE,2023-24-NSW-SMART-drumline-annual-report.pdf
6/03/2024,13:45,Dusky Whaler,130,F,Alive,ID,Lake Macquarie,Middle Camp Beach,2024-03-06T13:45:00Z,2024,3,DUS,FALSE,TRUE,FALSE,2023-24-NSW-SMART-drumline-annual-report.pdf
13/03/2024,14:32,Dusky Whaler,123,M,Alive,ID,Lake Macquarie,Middle Camp Beach,2024-03-13T14:32:00Z,2024,3,DUS,FALSE,TRUE,FALSE,2023-24-NSW-SMART-drumline-annual-report.pdf
14/03/2024,9:10,Dusky Whaler,127,F,Alive,ID,Lake Macquarie,Middle Camp Beach,2024-03-14T09:10:00Z,2024,3,DUS,FALSE,TRUE,FALSE,2023-24-NSW-SMART-drumline-annual-report.pdf
18/03/2024,12:34,Dusky Whaler,139,M,Alive,ID,Lake Macquarie,Middle Camp Beach,2024-03-18T12:34:00Z,2024,3,DUS,FALSE,TRUE,FALSE,2023-24-NSW-SMART-drumline-annual-report.pdf
14/05/2024,9:16,Dusky Whaler,133,M,Alive,ID,Lake Macquarie,Middle Camp Beach,2024-05-14T09:16:00Z,2024,5,DUS,FALSE,TRUE,FALSE,2023-24-NSW-SMART-drumline-annual-report.pdf
30/05/2024,NA,Dusky Whaler,127,F,Alive,ID,Lake Macquarie,Middle Camp Beach,NA,2024,5,DUS,FALSE,TRUE,FALSE,2023-24-NSW-SMART-drumline-annual-report.pdf
7/06/2024,10:41,Tiger Shark,323,F,Alive,"ID, A",Lake Macquarie,Middle Camp Beach,2024-06-07T10:41:00Z,2024,6,TIG,TRUE,TRUE,TRUE,2023-24-NSW-SMART-drumline-annual-report.pdf
29/06/2024,11:53,White Shark,242,M,Alive,"ID, A",Lake Macquarie,Middle Camp Beach,2024-06-29T11:53:00Z,2024,6,WHI,TRUE,TRUE,TRUE,2023-24-NSW-SMART-drumline-annual-report.pdf
11/07/2023,11:57,Bronze Whaler,254,M,Alive,ID,Lake Macquarie,Moonee Beach,2023-07-11T11:57:00Z,2023,7,BRO,FALSE,TRUE,FALSE,2023-24-NSW-SMART-drumline-annual-report.pdf
13/07/2023,8:04,White Shark,180,NA,Alive,NA,Lake Macquarie,Moonee Beach,2023-07-13T08:04:00Z,2023,7,WHI,TRUE,FALSE,FALSE,2023-24-NSW-SMART-drumline-annual-report.pdf
18/09/2023,9:37,Dusky Whaler,129,M,Alive,ID,Lake Macquarie,Moonee Beach,2023-09-18T09:37:00Z,2023,9,DUS,FALSE,TRUE,FALSE,2023-24-NSW-SMART-drumline-annual-report.pdf
11/01/2024,15:36,Dusky Whaler,134,M,Alive,ID,Lake Macquarie,Moonee Beach,2024-01-11T15:36:00Z,2024,1,DUS,FALSE,TRUE,FALSE,2023-24-NSW-SMART-drumline-annual-report.pdf
18/01/2024,9:44,Dusky Whaler,123,M,Alive,ID,Lake Macquarie,Moonee Beach,2024-01-18T09:44:00Z,2024,1,DUS,FALSE,TRUE,FALSE,2023-24-NSW-SMART-drumline-annual-report.pdf
28/01/2024,11:36,Dusky Whaler,126,M,Alive,ID,Lake Macquarie,Moonee Beach,2024-01-28T11:36:00Z,2024,1,DUS,FALSE,TRUE,FALSE,2023-24-NSW-SMART-drumline-annual-report.pdf
1/02/2024,17:00,Smooth Hammerhead,174,M,Alive,ID,Lake Macquarie,Moonee Beach,2024-02-01T17:00:00Z,2024,2,SMH,FALSE,TRUE,FALSE,2023-24-NSW-SMART-drumline-annual-report.pdf
19/02/2024,10:28,Dusky Whaler,126,F,Alive,ID,Lake Macquarie,Moonee Beach,2024-02-19T10:28:00Z,2024,2,DUS,FALSE,TRUE,FALSE,2023-24-NSW-SMART-drumline-annual-report.pdf
27/02/2024,10:44,Dusky Whaler,123,M,Alive,ID,Lake Macquarie,Moonee Beach,2024-02-27T10:44:00Z,2024,2,DUS,FALSE,TRUE,FALSE,2023-24-NSW-SMART-drumline-annual-report.pdf
6/03/2024,8:18,Dusky Whaler,136,F,Alive,ID,Lake Macquarie,Moonee Beach,2024-03-06T08:18:00Z,2024,3,DUS,FALSE,TRUE,FALSE,2023-24-NSW-SMART-drumline-annual-report.pdf
6/03/2024,9:48,Dusky Whaler,152,M,Alive,ID,Lake Macquarie,Moonee Beach,2024-03-06T09:48:00Z,2024,3,DUS,FALSE,TRUE,FALSE,2023-24-NSW-SMART-drumline-annual-report.pdf
20/03/2024,12:05,Dusky Whaler,141,F,Alive,ID,Lake Macquarie,Moonee Beach,2024-03-20T12:05:00Z,2024,3,DUS,FALSE,TRUE,FALSE,2023-24-NSW-SMART-drumline-annual-report.pdf
23/04/2024,9:13,Dusky Whaler,125,F,Alive,ID,Lake Macquarie,Moonee Beach,2024-04-23T09:13:00Z,2024,4,DUS,FALSE,TRUE,FALSE,2023-24-NSW-SMART-drumline-annual-report.pdf
29/04/2024,9:59,Dusky Whaler,139,M,Alive,ID,Lake Macquarie,Moonee Beach,2024-04-29T09:59:00Z,2024,4,DUS,FALSE,TRUE,FALSE,2023-24-NSW-SMART-drumline-annual-report.pdf
9/06/2024,11:00,White Shark,233,M,Alive,"ID, A",Lake Macquarie,Moonee Beach,2024-06-09T11:00:00Z,2024,6,WHI,TRUE,TRUE,TRUE,2023-24-NSW-SMART-drumline-annual-report.pdf
25/06/2024,NA,Dusky Whaler,139,M,Alive,ID,Lake Macquarie,Moonee Beach,NA,2024,6,DUS,FALSE,TRUE,FALSE,2023-24-NSW-SMART-drumline-annual-report.pdf
22/03/2024,10:21,Tiger Shark,406,F,Alive,"ID, A",Manly,Curl Curl Beach,2024-03-22T10:21:00Z,2024,3,TIG,TRUE,TRUE,TRUE,2023-24-NSW-SMART-drumline-annual-report.pdf
29/04/2024,NA,Tiger Shark,221,F,Alive,"ID, A",Manly,Curl Curl Beach,NA,2024,4,TIG,TRUE,TRUE,TRUE,2023-24-NSW-SMART-drumline-annual-report.pdf
22/02/2024,10:51,Dusky Whaler,126,M,Alive,ID,Manly,Dee Why Beach,2024-02-22T10:51:00Z,2024,2,DUS,FALSE,TRUE,FALSE,2023-24-NSW-SMART-drumline-annual-report.pdf
22/02/2024,12:36,Dusky Whaler,137,F,Alive,ID,Manly,Dee Why Beach,2024-02-22T12:36:00Z,2024,2,DUS,FALSE,TRUE,FALSE,2023-24-NSW-SMART-drumline-annual-report.pdf
6/03/2024,7:20,Dusky Whaler,152,F,Alive,ID,Manly,Dee Why Beach,2024-03-06T07:20:00Z,2024,3,DUS,FALSE,TRUE,FALSE,2023-24-NSW-SMART-drumline-annual-report.pdf
6/03/2024,10:57,Dusky Whaler,124,M,Alive,ID,Manly,Dee Why Beach,2024-03-06T10:57:00Z,2024,3,DUS,FALSE,TRUE,FALSE,2023-24-NSW-SMART-drumline-annual-report.pdf
22/03/2024,13:55,Dusky Whaler,136,F,Alive,ID,Manly,Dee Why Beach,2024-03-22T13:55:00Z,2024,3,DUS,FALSE,TRUE,FALSE,2023-24-NSW-SMART-drumline-annual-report.pdf
27/05/2024,NA,Dusky Whaler,128,F,Alive,ID,Manly,Dee Why Beach,NA,2024,5,DUS,FALSE,TRUE,FALSE,2023-24-NSW-SMART-drumline-annual-report.pdf
11/06/2024,7:49,Smooth Hammerhead,166,F,Alive,ID,Manly,Dee Why Beach,2024-06-11T07:49:00Z,2024,6,SMH,FALSE,TRUE,FALSE,2023-24-NSW-SMART-drumline-annual-report.pdf
10/10/2023,7:11,Dusky Whaler,140,F,Alive,ID,Manly,Fairy Bower Beach,2023-10-10T07:11:00Z,2023,10,DUS,FALSE,TRUE,FALSE,2023-24-NSW-SMART-drumline-annual-report.pdf
28/06/2024,7:17,Bronze Whaler,313,F,Alive,ID,Manly,Freshwater Beach,2024-06-28T07:17:00Z,2024,6,BRO,FALSE,TRUE,FALSE,2023-24-NSW-SMART-drumline-annual-report.pdf
20/08/2023,10:45,Bronze Whaler,293,F,Alive,ID,Manly,Long Reef Beach,2023-08-20T10:45:00Z,2023,8,BRO,FALSE,TRUE,FALSE,2023-24-NSW-SMART-drumline-annual-report.pdf
12/10/2023,10:22,Dusky Whaler,132,F,Alive,ID,Manly,Manly Beach,2023-10-12T10:22:00Z,2023,10,DUS,FALSE,TRUE,FALSE,2023-24-NSW-SMART-drumline-annual-report.pdf
24/12/2023,7:56,Smooth Hammerhead,191,F,Alive,ID,Manly,Narrabeen Beach,2023-12-24T07:56:00Z,2023,12,SMH,FALSE,TRUE,FALSE,2023-24-NSW-SMART-drumline-annual-report.pdf
28/09/2023,10:39,Tiger Shark,380,F,Alive,"ID, A",Manly,North Curl Curl Beach,2023-09-28T10:39:00Z,2023,9,TIG,TRUE,TRUE,TRUE,2023-24-NSW-SMART-drumline-annual-report.pdf
8/04/2024,8:29,Dusky Whaler,131,M,Alive,ID,Manly,North Curl Curl Beach,2024-04-08T08:29:00Z,2024,4,DUS,FALSE,TRUE,FALSE,2023-24-NSW-SMART-drumline-annual-report.pdf
9/05/2024,7:24,Dusky Whaler,131,M,Alive,ID,Manly,North Curl Curl Beach,2024-05-09T07:24:00Z,2024,5,DUS,FALSE,TRUE,FALSE,2023-24-NSW-SMART-drumline-annual-report.pdf
23/02/2024,8:34,Dusky Whaler,131,F,Alive,ID,Manly,North Steyne Beach,2024-02-23T08:34:00Z,2024,2,DUS,FALSE,TRUE,FALSE,2023-24-NSW-SMART-drumline-annual-report.pdf
7/04/2024,NA,Dusky Whaler,132,M,Alive,ID,Manly,North Steyne Beach,NA,2024,4,DUS,FALSE,TRUE,FALSE,2023-24-NSW-SMART-drumline-annual-report.pdf
24/04/2024,NA,Tiger Shark,173,F,Alive,"ID, A",Manly,North Steyne Beach,NA,2024,4,TIG,TRUE,TRUE,TRUE,2023-24-NSW-SMART-drumline-annual-report.pdf
5/05/2024,10:22,Dusky Whaler,142,F,Alive,ID,Manly,North Steyne Beach,2024-05-05T10:22:00Z,2024,5,DUS,FALSE,TRUE,FALSE,2023-24-NSW-SMART-drumline-annual-report.pdf
18/02/2024,17:29,Dusky Whaler,148,M,Alive,ID,Manly,Queenscliff Beach,2024-02-18T17:29:00Z,2024,2,DUS,FALSE,TRUE,FALSE,2023-24-NSW-SMART-drumline-annual-report.pdf
26/02/2024,7:57,Dusky Whaler,128,M,Alive,ID,Manly,Queenscliff Beach,2024-02-26T07:57:00Z,2024,2,DUS,FALSE,TRUE,FALSE,2023-24-NSW-SMART-drumline-annual-report.pdf
8/04/2024,7:11,Dusky Whaler,158,F,Alive,ID,Manly,Queenscliff Beach,2024-04-08T07:11:00Z,2024,4,DUS,FALSE,TRUE,FALSE,2023-24-NSW-SMART-drumline-annual-report.pdf
5/05/2024,NA,Dusky Whaler,132,M,Alive,ID,Manly,Queenscliff Beach,NA,2024,5,DUS,FALSE,TRUE,FALSE,2023-24-NSW-SMART-drumline-annual-report.pdf
22/02/2024,14:20,Tiger Shark,272,F,Alive,"ID, A",Manly,South Curl Curl Beach,2024-02-22T14:20:00Z,2024,2,TIG,TRUE,TRUE,TRUE,2023-24-NSW-SMART-drumline-annual-report.pdf
24/03/2024,NA,Dusky Whaler,130,NA,Alive,NA,Manly,South Curl Curl Beach,NA,2024,3,DUS,FALSE,FALSE,FALSE,2023-24-NSW-SMART-drumline-annual-report.pdf
30/05/2024,NA,Dusky Whaler,128,M,Alive,ID,Manly,South Curl Curl Beach,NA,2024,5,DUS,FALSE,TRUE,FALSE,2023-24-NSW-SMART-drumline-annual-report.pdf
17/04/2024,9:48,Dusky Whaler,160,M,Alive,ID,Manly,South Narrabeen Beach,2024-04-17T09:48:00Z,2024,4,DUS,FALSE,TRUE,FALSE,2023-24-NSW-SMART-drumline-annual-report.pdf
23/12/2023,11:35,Dusky Whaler,119,M,Alive,ID,Manly,Turimetta Beach,2023-12-23T11:35:00Z,2023,12,DUS,FALSE,TRUE,FALSE,2023-24-NSW-SMART-drumline-annual-report.pdf
9/03/2024,11:18,Dusky Whaler,129,M,Alive,ID,Manly,Turimetta Beach,2024-03-09T11:18:00Z,2024,3,DUS,FALSE,TRUE,FALSE,2023-24-NSW-SMART-drumline-annual-report.pdf
19/04/2024,8:08,Dusky Whaler,164,M,Alive,ID,Manly,Turimetta Beach,2024-04-19T08:08:00Z,2024,4,DUS,FALSE,TRUE,FALSE,2023-24-NSW-SMART-drumline-annual-report.pdf
9/05/2024,10:11,Dusky Whaler,139,M,Alive,ID,Manly,Turimetta Beach,2024-05-09T10:11:00Z,2024,5,DUS,FALSE,TRUE,FALSE,2023-24-NSW-SMART-drumline-annual-report.pdf
9/01/2024,12:40,Tiger Shark,310,F,Alive,"ID, A",Manly,Curl Curl,2024-01-09T12:40:00Z,2024,1,TIG,TRUE,TRUE,TRUE,2023-24-NSW-SMART-drumline-annual-report.pdf
9/01/2024,7:19,Tiger Shark,195,F,Alive,"ID, A",Manly,North Curl Curl Beach,2024-01-09T07:19:00Z,2024,1,TIG,TRUE,TRUE,TRUE,2023-24-NSW-SMART-drumline-annual-report.pdf
26/08/2023,12:13,White Shark,256,M,Alive,"ID, A",Merimbula,Main Beach,2023-08-26T12:13:00Z,2023,8,WHI,TRUE,TRUE,TRUE,2023-24-NSW-SMART-drumline-annual-report.pdf
18/02/2024,7:57,Tiger Shark,215,M,Alive,"ID, A",Merimbula,Main Beach,2024-02-18T07:57:00Z,2024,2,TIG,TRUE,TRUE,TRUE,2023-24-NSW-SMART-drumline-annual-report.pdf
25/03/2024,9:19,White Shark,257,M,Alive,"ID, A",Merimbula,Main Beach,2024-03-25T09:19:00Z,2024,3,WHI,TRUE,TRUE,TRUE,2023-24-NSW-SMART-drumline-annual-report.pdf
16/05/2024,9:28,White Shark,171,M,Alive,"ID, A",Merimbula,Main Beach,2024-05-16T09:28:00Z,2024,5,WHI,TRUE,TRUE,TRUE,2023-24-NSW-SMART-drumline-annual-report.pdf
18/05/2024,7:01,White Shark,148,M,Alive,"ID, A",Merimbula,Main Beach,2024-05-18T07:01:00Z,2024,5,WHI,TRUE,TRUE,TRUE,2023-24-NSW-SMART-drumline-annual-report.pdf
27/05/2024,12:29,White Shark,305,F,Alive,"ID, A",Merimbula,Main Beach,2024-05-27T12:29:00Z,2024,5,WHI,TRUE,TRUE,TRUE,2023-24-NSW-SMART-drumline-annual-report.pdf
15/06/2024,8:49,White Shark,149,F,Alive,"ID, A",Merimbula,Main Beach,2024-06-15T08:49:00Z,2024,6,WHI,TRUE,TRUE,TRUE,2023-24-NSW-SMART-drumline-annual-report.pdf
28/06/2024,14:39,White Shark,172,F,Alive,"ID, A",Merimbula,Main Beach,2024-06-28T14:39:00Z,2024,6,WHI,TRUE,TRUE,TRUE,2023-24-NSW-SMART-drumline-annual-report.pdf
15/12/2023,11:14,Bronze Whaler,269,F,Alive,ID,Merimbula,Middle Beach,2023-12-15T11:14:00Z,2023,12,BRO,FALSE,TRUE,FALSE,2023-24-NSW-SMART-drumline-annual-report.pdf
30/03/2024,16:56,Tiger Shark,339,M,Alive,"ID, A",Merimbula,Middle Beach,2024-03-30T16:56:00Z,2024,3,TIG,TRUE,TRUE,TRUE,2023-24-NSW-SMART-drumline-annual-report.pdf
10/04/2024,13:59,Shortfin Mako Shark,224,F,Alive,ID,Merimbula,Middle Beach,2024-04-10T13:59:00Z,2024,4,SMA,FALSE,TRUE,FALSE,2023-24-NSW-SMART-drumline-annual-report.pdf
9/09/2023,7:26,White Shark,246,F,Alive,"ID, A",Merimbula,Pambula Beach,2023-09-09T07:26:00Z,2023,9,WHI,TRUE,TRUE,TRUE,2023-24-NSW-SMART-drumline-annual-report.pdf
14/10/2023,10:47,Blue Shark,206,M,Alive,ID,Merimbula,Pambula Beach,2023-10-14T10:47:00Z,2023,10,UNK,FALSE,TRUE,FALSE,2023-24-NSW-SMART-drumline-annual-report.pdf
22/10/2023,9:35,Bronze Whaler,236,F,Alive,ID,Merimbula,Pambula Beach,2023-10-22T09:35:00Z,2023,10,BRO,FALSE,TRUE,FALSE,2023-24-NSW-SMART-drumline-annual-report.pdf
23/10/2023,13:26,Bronze Whaler,272,F,Alive,ID,Merimbula,Pambula Beach,2023-10-23T13:26:00Z,2023,10,BRO,FALSE,TRUE,FALSE,2023-24-NSW-SMART-drumline-annual-report.pdf
14/12/2023,7:55,White Shark,179,F,Alive,"ID, A",Merimbula,Pambula Beach,2023-12-14T07:55:00Z,2023,12,WHI,TRUE,TRUE,TRUE,2023-24-NSW-SMART-drumline-annual-report.pdf
5/01/2024,8:37,Bronze Whaler,218,F,Alive,ID,Merimbula,Pambula Beach,2024-01-05T08:37:00Z,2024,1,BRO,FALSE,TRUE,FALSE,2023-24-NSW-SMART-drumline-annual-report.pdf
23/01/2024,8:16,Bronze Whaler,214,F,Alive,ID,Merimbula,Pambula Beach,2024-01-23T08:16:00Z,2024,1,BRO,FALSE,TRUE,FALSE,2023-24-NSW-SMART-drumline-annual-report.pdf
8/02/2024,10:42,Tiger Shark,330,M,Alive,"ID, A",Merimbula,Pambula Beach,2024-02-08T10:42:00Z,2024,2,TIG,TRUE,TRUE,TRUE,2023-24-NSW-SMART-drumline-annual-report.pdf
16/04/2024,9:35,Tiger Shark,346,F,Alive,"ID, A",Merimbula,Pambula Beach,2024-04-16T09:35:00Z,2024,4,TIG,TRUE,TRUE,TRUE,2023-24-NSW-SMART-drumline-annual-report.pdf
20/04/2024,11:42,Tiger Shark,363,F,Alive,"ID, A",Merimbula,Pambula Beach,2024-04-20T11:42:00Z,2024,4,TIG,TRUE,TRUE,TRUE,2023-24-NSW-SMART-drumline-annual-report.pdf
22/04/2024,14:50,White Shark,236,F,Alive,"ID, A",Merimbula,Pambula Beach,2024-04-22T14:50:00Z,2024,4,WHI,TRUE,TRUE,TRUE,2023-24-NSW-SMART-drumline-annual-report.pdf
24/04/2024,10:20,Tiger Shark,371,F,Alive,"ID, A",Merimbula,Pambula Beach,2024-04-24T10:20:00Z,2024,4,TIG,TRUE,TRUE,TRUE,2023-24-NSW-SMART-drumline-annual-report.pdf
25/04/2024,16:04,White Shark,272,M,Alive,"ID, A",Merimbula,Pambula Beach,2024-04-25T16:04:00Z,2024,4,WHI,TRUE,TRUE,TRUE,2023-24-NSW-SMART-drumline-annual-report.pdf
10/05/2024,9:12,Bronze Whaler,282,F,Alive,ID,Merimbula,Pambula Beach,2024-05-10T09:12:00Z,2024,5,BRO,FALSE,TRUE,FALSE,2023-24-NSW-SMART-drumline-annual-report.pdf
1/06/2024,10:04,White Shark,198,F,Alive,"ID, A",Merimbula,Pambula Beach,2024-06-01T10:04:00Z,2024,6,WHI,TRUE,TRUE,TRUE,2023-24-NSW-SMART-drumline-annual-report.pdf
14/06/2024,12:11,White Shark,248,F,Alive,"ID, A",Merimbula,Pambula Beach,2024-06-14T12:11:00Z,2024,6,WHI,TRUE,TRUE,TRUE,2023-24-NSW-SMART-drumline-annual-report.pdf
4/08/2023,10:57,Thresher Shark,276,M,Alive,ID,Merimbula,Short Point,2023-08-04T10:57:00Z,2023,8,THR,FALSE,TRUE,FALSE,2023-24-NSW-SMART-drumline-annual-report.pdf
23/08/2023,9:29,Tiger Shark,349,F,Alive,"ID, A",Merimbula,Short Point,2023-08-23T09:29:00Z,2023,8,TIG,TRUE,TRUE,TRUE,2023-24-NSW-SMART-drumline-annual-report.pdf
23/09/2023,15:50,Shortfin Mako Shark,280,F,Alive,ID,Merimbula,Short Point,2023-09-23T15:50:00Z,2023,9,SMA,FALSE,TRUE,FALSE,2023-24-NSW-SMART-drumline-annual-report.pdf
25/09/2023,11:49,Bronze Whaler,296,F,Alive,ID,Merimbula,Short Point,2023-09-25T11:49:00Z,2023,9,BRO,FALSE,TRUE,FALSE,2023-24-NSW-SMART-drumline-annual-report.pdf
21/11/2023,11:31,Bronze Whaler,204,M,Alive,ID,Merimbula,Short Point,2023-11-21T11:31:00Z,2023,11,BRO,FALSE,TRUE,FALSE,2023-24-NSW-SMART-drumline-annual-report.pdf
7/02/2024,9:35,Smooth Hammerhead,164,F,Alive,ID,Merimbula,Short Point,2024-02-07T09:35:00Z,2024,2,SMH,FALSE,TRUE,FALSE,2023-24-NSW-SMART-drumline-annual-report.pdf
14/02/2024,8:53,Bronze Whaler,265,M,Alive,ID,Merimbula,Short Point,2024-02-14T08:53:00Z,2024,2,BRO,FALSE,TRUE,FALSE,2023-24-NSW-SMART-drumline-annual-report.pdf
22/02/2024,NA,Shortfin Mako Shark,120,F,Dead,NA,Merimbula,Short Point,NA,2024,2,SMA,FALSE,FALSE,FALSE,2023-24-NSW-SMART-drumline-annual-report.pdf
6/03/2024,9:15,Black Marlin,297,NA,Alive,ID,Merimbula,Short Point,2024-03-06T09:15:00Z,2024,3,UNK,FALSE,TRUE,FALSE,2023-24-NSW-SMART-drumline-annual-report.pdf
13/04/2024,12:00,White Shark,149,M,Alive,"ID, A",Merimbula,Short Point,2024-04-13T12:00:00Z,2024,4,WHI,TRUE,TRUE,TRUE,2023-24-NSW-SMART-drumline-annual-report.pdf
17/05/2024,13:23,Bronze Whaler,286,M,Alive,ID,Merimbula,Short Point,2024-05-17T13:23:00Z,2024,5,BRO,FALSE,TRUE,FALSE,2023-24-NSW-SMART-drumline-annual-report.pdf
27/06/2024,9:50,White Shark,181,F,Alive,"ID, A",Merimbula,Short Point,2024-06-27T09:50:00Z,2024,6,WHI,TRUE,TRUE,TRUE,2023-24-NSW-SMART-drumline-annual-report.pdf
9/09/2023,10:18,Bronze Whaler,216,F,Alive,ID,Merimbula,Tura Beach,2023-09-09T10:18:00Z,2023,9,BRO,FALSE,TRUE,FALSE,2023-24-NSW-SMART-drumline-annual-report.pdf
9/10/2023,8:18,Shortfin Mako Shark,252,F,Alive,ID,Merimbula,Tura Beach,2023-10-09T08:18:00Z,2023,10,SMA,FALSE,TRUE,FALSE,2023-24-NSW-SMART-drumline-annual-report.pdf
10/10/2023,11:08,Bronze Whaler,246,F,Alive,ID,Merimbula,Tura Beach,2023-10-10T11:08:00Z,2023,10,BRO,FALSE,TRUE,FALSE,2023-24-NSW-SMART-drumline-annual-report.pdf
11/10/2023,11:02,Shortfin Mako Shark,201,M,Alive,ID,Merimbula,Tura Beach,2023-10-11T11:02:00Z,2023,10,SMA,FALSE,TRUE,FALSE,2023-24-NSW-SMART-drumline-annual-report.pdf
9/11/2023,9:28,Bronze Whaler,277,F,Alive,ID,Merimbula,Tura Beach,2023-11-09T09:28:00Z,2023,11,BRO,FALSE,TRUE,FALSE,2023-24-NSW-SMART-drumline-annual-report.pdf
28/12/2023,16:36,White Shark,178,M,Alive,"ID, A",Merimbula,Tura Beach,2023-12-28T16:36:00Z,2023,12,WHI,TRUE,TRUE,TRUE,2023-24-NSW-SMART-drumline-annual-report.pdf
2/02/2024,7:42,Bronze Whaler,208,M,Alive,ID,Merimbula,Tura Beach,2024-02-02T07:42:00Z,2024,2,BRO,FALSE,TRUE,FALSE,2023-24-NSW-SMART-drumline-annual-report.pdf
26/03/2024,12:11,Dusky Whaler,194,M,Alive,ID,Merimbula,Tura Beach,2024-03-26T12:11:00Z,2024,3,DUS,FALSE,TRUE,FALSE,2023-24-NSW-SMART-drumline-annual-report.pdf
31/03/2024,11:00,Tiger Shark,168,M,Alive,"ID, A",Merimbula,Tura Beach,2024-03-31T11:00:00Z,2024,3,TIG,TRUE,TRUE,TRUE,2023-24-NSW-SMART-drumline-annual-report.pdf
27/05/2024,10:50,White Shark,152,F,Alive,"ID, A",Merimbula,Tura Beach,2024-05-27T10:50:00Z,2024,5,WHI,TRUE,TRUE,TRUE,2023-24-NSW-SMART-drumline-annual-report.pdf
9/05/2024,8:16,Spinner Shark,126,M,Alive,ID,Newcastle,Bar Beach,2024-05-09T08:16:00Z,2024,5,SPN,FALSE,TRUE,FALSE,2023-24-NSW-SMART-drumline-annual-report.pdf
21/01/2024,7:24,Dusky Whaler,124,F,Alive,ID,Newcastle,Dudley Beach,2024-01-21T07:24:00Z,2024,1,DUS,FALSE,TRUE,FALSE,2023-24-NSW-SMART-drumline-annual-report.pdf
28/01/2024,15:15,Shortfin Mako Shark,119,F,Alive,ID,Newcastle,Dudley Beach,2024-01-28T15:15:00Z,2024,1,SMA,FALSE,TRUE,FALSE,2023-24-NSW-SMART-drumline-annual-report.pdf
17/02/2024,13:34,Smooth Hammerhead,154,F,Alive,ID,Newcastle,Dudley Beach,2024-02-17T13:34:00Z,2024,2,SMH,FALSE,TRUE,FALSE,2023-24-NSW-SMART-drumline-annual-report.pdf
25/05/2024,10:00,White Shark,227,F,Alive,"ID, A",Newcastle,Dudley Beach,2024-05-25T10:00:00Z,2024,5,WHI,TRUE,TRUE,TRUE,2023-24-NSW-SMART-drumline-annual-report.pdf
29/10/2023,NA,Smooth Hammerhead,134,F,Alive,ID,Newcastle,Glenrock Reserve,NA,2023,10,SMH,FALSE,TRUE,FALSE,2023-24-NSW-SMART-drumline-annual-report.pdf
15/12/2023,7:54,Dusky Whaler,129,F,Alive,ID,Newcastle,Glenrock Reserve,2023-12-15T07:54:00Z,2023,12,DUS,FALSE,TRUE,FALSE,2023-24-NSW-SMART-drumline-annual-report.pdf
6/02/2024,NA,Dusky Whaler,97,M,Alive,ID,Newcastle,Merewether Beach,NA,2024,2,DUS,FALSE,TRUE,FALSE,2023-24-NSW-SMART-drumline-annual-report.pdf
21/06/2024,NA,Dusky Whaler,115,F,Alive,ID,Newcastle,Merewether Beach,NA,2024,6,DUS,FALSE,TRUE,FALSE,2023-24-NSW-SMART-drumline-annual-report.pdf
23/11/2023,6:29,Smooth Hammerhead,155,M,Alive,ID,Newcastle,Newcastle Beach,2023-11-23T06:29:00Z,2023,11,SMH,FALSE,TRUE,FALSE,2023-24-NSW-SMART-drumline-annual-report.pdf
14/02/2024,11:49,Dusky Whaler,116,F,Alive,ID,Newcastle,Newcastle Beach,2024-02-14T11:49:00Z,2024,2,DUS,FALSE,TRUE,FALSE,2023-24-NSW-SMART-drumline-annual-report.pdf
6/03/2024,15:23,Dusky Whaler,128,F,Alive,ID,Newcastle,Newcastle Beach,2024-03-06T15:23:00Z,2024,3,DUS,FALSE,TRUE,FALSE,2023-24-NSW-SMART-drumline-annual-report.pdf
7/03/2024,14:36,Dusky Whaler,104,M,Alive,ID,Newcastle,Newcastle Beach,2024-03-07T14:36:00Z,2024,3,DUS,FALSE,TRUE,FALSE,2023-24-NSW-SMART-drumline-annual-report.pdf
23/03/2024,15:00,Dusky Whaler,115,F,Alive,ID,Newcastle,Newcastle Beach,2024-03-23T15:00:00Z,2024,3,DUS,FALSE,TRUE,FALSE,2023-24-NSW-SMART-drumline-annual-report.pdf
25/03/2024,10:44,Smooth Hammerhead,129,F,Alive,ID,Newcastle,Newcastle Beach,2024-03-25T10:44:00Z,2024,3,SMH,FALSE,TRUE,FALSE,2023-24-NSW-SMART-drumline-annual-report.pdf
8/05/2024,14:14,Dusky Whaler,116,F,Alive,ID,Newcastle,Newcastle Beach,2024-05-08T14:14:00Z,2024,5,DUS,FALSE,TRUE,FALSE,2023-24-NSW-SMART-drumline-annual-report.pdf
31/05/2024,12:08,Dusky Whaler,136,F,Alive,ID,Newcastle,Newcastle Beach,2024-05-31T12:08:00Z,2024,5,DUS,FALSE,TRUE,FALSE,2023-24-NSW-SMART-drumline-annual-report.pdf
30/05/2024,12:51,White Shark,233,M,Alive,"ID, A",Newcastle,Nobbys Beach,2024-05-30T12:51:00Z,2024,5,WHI,TRUE,TRUE,TRUE,2023-24-NSW-SMART-drumline-annual-report.pdf
8/01/2024,9:40,Tiger Shark,187,F,Alive,"ID, A",Newcastle,Redhead Beach,2024-01-08T09:40:00Z,2024,1,TIG,TRUE,TRUE,TRUE,2023-24-NSW-SMART-drumline-annual-report.pdf
15/04/2024,NA,Dusky Whaler,116,M,Alive,ID,Newcastle,Redhead Beach,NA,2024,4,DUS,FALSE,TRUE,FALSE,2023-24-NSW-SMART-drumline-annual-report.pdf
29/04/2024,NA,Dusky Whaler,134,M,Alive,ID,Newcastle,Redhead Beach,NA,2024,4,DUS,FALSE,TRUE,FALSE,2023-24-NSW-SMART-drumline-annual-report.pdf
17/05/2024,8:50,White Shark,221,F,Alive,"ID, A",Newcastle,Redhead Beach,2024-05-17T08:50:00Z,2024,5,WHI,TRUE,TRUE,TRUE,2023-24-NSW-SMART-drumline-annual-report.pdf
14/07/2023,15:55,White Shark,206,M,Alive,"ID, A",Newcastle,Stockton Beach,2023-07-14T15:55:00Z,2023,7,WHI,TRUE,TRUE,TRUE,2023-24-NSW-SMART-drumline-annual-report.pdf
25/07/2023,15:45,White Shark,209,M,Alive,"ID, A",Newcastle,Stockton Beach,2023-07-25T15:45:00Z,2023,7,WHI,TRUE,TRUE,TRUE,2023-24-NSW-SMART-drumline-annual-report.pdf
8/01/2024,7:12,Dusky Whaler,125,F,Alive,ID,Newcastle,Stockton Beach,2024-01-08T07:12:00Z,2024,1,DUS,FALSE,TRUE,FALSE,2023-24-NSW-SMART-drumline-annual-report.pdf
8/01/2024,NA,Dusky Whaler,124,M,Alive,ID,Newcastle,Stockton Beach,NA,2024,1,DUS,FALSE,TRUE,FALSE,2023-24-NSW-SMART-drumline-annual-report.pdf
26/01/2024,NA,Dusky Whaler,114,F,Alive,ID,Newcastle,Stockton Beach,NA,2024,1,DUS,FALSE,TRUE,FALSE,2023-24-NSW-SMART-drumline-annual-report.pdf
6/03/2024,14:59,Dusky Whaler,126,F,Alive,ID,Newcastle,Stockton Beach,2024-03-06T14:59:00Z,2024,3,DUS,FALSE,TRUE,FALSE,2023-24-NSW-SMART-drumline-annual-report.pdf
26/05/2024,12:21,White Shark,248,F,Alive,"ID, A",Newcastle,Stockton Beach,2024-05-26T12:21:00Z,2024,5,WHI,TRUE,TRUE,TRUE,2023-24-NSW-SMART-drumline-annual-report.pdf
30/05/2024,7:07,White Shark,202,M,Alive,"ID, A",Newcastle,Stockton Beach,2024-05-30T07:07:00Z,2024,5,WHI,TRUE,TRUE,TRUE,2023-24-NSW-SMART-drumline-annual-report.pdf
29/06/2024,7:00,White Shark,203,F,Alive,"ID, A",Newcastle,Stockton Beach,2024-06-29T07:00:00Z,2024,6,WHI,TRUE,TRUE,TRUE,2023-24-NSW-SMART-drumline-annual-report.pdf
10/07/2023,8:02,White Shark,285,M,Alive,"ID, A",Port Macquarie,Flynns Beach,2023-07-10T08:02:00Z,2023,7,WHI,TRUE,TRUE,TRUE,2023-24-NSW-SMART-drumline-annual-report.pdf
28/07/2023,11:09,Bronze Whaler,249,M,Alive,ID,Port Macquarie,Flynns Beach,2023-07-28T11:09:00Z,2023,7,BRO,FALSE,TRUE,FALSE,2023-24-NSW-SMART-drumline-annual-report.pdf
21/08/2023,11:19,White Shark,180,NA,Alive,NA,Port Macquarie,Flynns Beach,2023-08-21T11:19:00Z,2023,8,WHI,TRUE,FALSE,FALSE,2023-24-NSW-SMART-drumline-annual-report.pdf
22/08/2023,15:06,Bronze Whaler,281,F,Alive,ID,Port Macquarie,Flynns Beach,2023-08-22T15:06:00Z,2023,8,BRO,FALSE,TRUE,FALSE,2023-24-NSW-SMART-drumline-annual-report.pdf
19/10/2023,9:47,Tiger Shark,180,F,Alive,"ID, A",Port Macquarie,Flynns Beach,2023-10-19T09:47:00Z,2023,10,TIG,TRUE,TRUE,TRUE,2023-24-NSW-SMART-drumline-annual-report.pdf
29/06/2024,9:47,White Shark,281,M,Alive,"ID, A",Port Macquarie,Flynns Beach,2024-06-29T09:47:00Z,2024,6,WHI,TRUE,TRUE,TRUE,2023-24-NSW-SMART-drumline-annual-report.pdf
6/07/2023,12:17,Tiger Shark,376,F,Alive,"ID, A",Port Macquarie,Lighthouse Beach,2023-07-06T12:17:00Z,2023,7,TIG,TRUE,TRUE,TRUE,2023-24-NSW-SMART-drumline-annual-report.pdf
7/07/2023,13:22,White Shark,257,M,Alive,"ID, A",Port Macquarie,Lighthouse Beach,2023-07-07T13:22:00Z,2023,7,WHI,TRUE,TRUE,TRUE,2023-24-NSW-SMART-drumline-annual-report.pdf
11/07/2023,9:56,White Shark,227,F,Alive,"ID, A",Port Macquarie,Lighthouse Beach,2023-07-11T09:56:00Z,2023,7,WHI,TRUE,TRUE,TRUE,2023-24-NSW-SMART-drumline-annual-report.pdf
15/07/2023,11:02,Bronze Whaler,249,M,Alive,ID,Port Macquarie,Lighthouse Beach,2023-07-15T11:02:00Z,2023,7,BRO,FALSE,TRUE,FALSE,2023-24-NSW-SMART-drumline-annual-report.pdf
25/07/2023,11:55,Tiger Shark,162,M,Alive,"ID, A",Port Macquarie,Lighthouse Beach,2023-07-25T11:55:00Z,2023,7,TIG,TRUE,TRUE,TRUE,2023-24-NSW-SMART-drumline-annual-report.pdf
5/08/2023,8:12,White Shark,268,F,Alive,"ID, A",Port Macquarie,Lighthouse Beach,2023-08-05T08:12:00Z,2023,8,WHI,TRUE,TRUE,TRUE,2023-24-NSW-SMART-drumline-annual-report.pdf
8/08/2023,11:32,White Shark,263,M,Alive,"ID, A",Port Macquarie,Lighthouse Beach,2023-08-08T11:32:00Z,2023,8,WHI,TRUE,TRUE,TRUE,2023-24-NSW-SMART-drumline-annual-report.pdf
9/08/2023,10:32,White Shark,208,M,Alive,"ID, A",Port Macquarie,Lighthouse Beach,2023-08-09T10:32:00Z,2023,8,WHI,TRUE,TRUE,TRUE,2023-24-NSW-SMART-drumline-annual-report.pdf
14/08/2023,8:04,White Shark,198,M,Alive,"ID, A",Port Macquarie,Lighthouse Beach,2023-08-14T08:04:00Z,2023,8,WHI,TRUE,TRUE,TRUE,2023-24-NSW-SMART-drumline-annual-report.pdf
17/08/2023,14:16,Bronze Whaler,263,M,Alive,ID,Port Macquarie,Lighthouse Beach,2023-08-17T14:16:00Z,2023,8,BRO,FALSE,TRUE,FALSE,2023-24-NSW-SMART-drumline-annual-report.pdf
18/08/2023,10:52,White Shark,245,M,Alive,"ID, A",Port Macquarie,Lighthouse Beach,2023-08-18T10:52:00Z,2023,8,WHI,TRUE,TRUE,TRUE,2023-24-NSW-SMART-drumline-annual-report.pdf
23/08/2023,10:24,White Shark,203,F,Alive,"ID, A",Port Macquarie,Lighthouse Beach,2023-08-23T10:24:00Z,2023,8,WHI,TRUE,TRUE,TRUE,2023-24-NSW-SMART-drumline-annual-report.pdf
24/08/2023,11:02,White Shark,259,F,Alive,"ID, A",Port Macquarie,Lighthouse Beach,2023-08-24T11:02:00Z,2023,8,WHI,TRUE,TRUE,TRUE,2023-24-NSW-SMART-drumline-annual-report.pdf
25/08/2023,10:39,Bronze Whaler,267,M,Alive,"ID, A",Port Macquarie,Lighthouse Beach,2023-08-25T10:39:00Z,2023,8,BRO,FALSE,TRUE,TRUE,2023-24-NSW-SMART-drumline-annual-report.pdf
29/08/2023,10:30,White Shark,303,M,Alive,"ID, A",Port Macquarie,Lighthouse Beach,2023-08-29T10:30:00Z,2023,8,WHI,TRUE,TRUE,TRUE,2023-24-NSW-SMART-drumline-annual-report.pdf
31/08/2023,NA,Dusky Whaler,191,M,Dead,NA,Port Macquarie,Lighthouse Beach,NA,2023,8,DUS,FALSE,FALSE,FALSE,2023-24-NSW-SMART-drumline-annual-report.pdf
6/09/2023,13:22,White Shark,202,F,Alive,"ID, A",Port Macquarie,Lighthouse Beach,2023-09-06T13:22:00Z,2023,9,WHI,TRUE,TRUE,TRUE,2023-24-NSW-SMART-drumline-annual-report.pdf
13/09/2023,9:35,White Shark,234,M,Alive,"ID, A",Port Macquarie,Lighthouse Beach,2023-09-13T09:35:00Z,2023,9,WHI,TRUE,TRUE,TRUE,2023-24-NSW-SMART-drumline-annual-report.pdf
18/09/2023,9:49,White Shark,284,M,Alive,"ID, A",Port Macquarie,Lighthouse Beach,2023-09-18T09:49:00Z,2023,9,WHI,TRUE,TRUE,TRUE,2023-24-NSW-SMART-drumline-annual-report.pdf
23/09/2023,11:47,White Shark,280,NA,Alive,NA,Port Macquarie,Lighthouse Beach,2023-09-23T11:47:00Z,2023,9,WHI,TRUE,FALSE,FALSE,2023-24-NSW-SMART-drumline-annual-report.pdf
23/09/2023,14:27,Bronze Whaler,297,M,Alive,ID,Port Macquarie,Lighthouse Beach,2023-09-23T14:27:00Z,2023,9,BRO,FALSE,TRUE,FALSE,2023-24-NSW-SMART-drumline-annual-report.pdf
26/09/2023,10:13,White Shark,251,F,Alive,"ID, A",Port Macquarie,Lighthouse Beach,2023-09-26T10:13:00Z,2023,9,WHI,TRUE,TRUE,TRUE,2023-24-NSW-SMART-drumline-annual-report.pdf
30/09/2023,11:18,Shortfin Mako Shark,99,F,Alive,ID,Port Macquarie,Lighthouse Beach,2023-09-30T11:18:00Z,2023,9,SMA,FALSE,TRUE,FALSE,2023-24-NSW-SMART-drumline-annual-report.pdf
30/09/2023,NA,Shortfin Mako Shark,104,F,Alive,ID,Port Macquarie,Lighthouse Beach,NA,2023,9,SMA,FALSE,TRUE,FALSE,2023-24-NSW-SMART-drumline-annual-report.pdf
5/10/2023,14:29,Bronze Whaler,288,M,Alive,ID,Port Macquarie,Lighthouse Beach,2023-10-05T14:29:00Z,2023,10,BRO,FALSE,TRUE,FALSE,2023-24-NSW-SMART-drumline-annual-report.pdf
8/10/2023,11:28,White Shark,271,M,Alive,"ID, A",Port Macquarie,Lighthouse Beach,2023-10-08T11:28:00Z,2023,10,WHI,TRUE,TRUE,TRUE,2023-24-NSW-SMART-drumline-annual-report.pdf
16/10/2023,10:26,Bronze Whaler,280,M,Alive,ID,Port Macquarie,Lighthouse Beach,2023-10-16T10:26:00Z,2023,10,BRO,FALSE,TRUE,FALSE,2023-24-NSW-SMART-drumline-annual-report.pdf
20/10/2023,8:01,White Shark,262,M,Alive,"ID, A",Port Macquarie,Lighthouse Beach,2023-10-20T08:01:00Z,2023,10,WHI,TRUE,TRUE,TRUE,2023-24-NSW-SMART-drumline-annual-report.pdf
23/10/2023,9:44,Smooth Hammerhead,153,M,Alive,ID,Port Macquarie,Lighthouse Beach,2023-10-23T09:44:00Z,2023,10,SMH,FALSE,TRUE,FALSE,2023-24-NSW-SMART-drumline-annual-report.pdf
3/11/2023,11:08,White Shark,243,M,Alive,"ID, A",Port Macquarie,Lighthouse Beach,2023-11-03T11:08:00Z,2023,11,WHI,TRUE,TRUE,TRUE,2023-24-NSW-SMART-drumline-annual-report.pdf
4/11/2023,11:18,Dusky Whaler,156,M,Alive,ID,Port Macquarie,Lighthouse Beach,2023-11-04T11:18:00Z,2023,11,DUS,FALSE,TRUE,FALSE,2023-24-NSW-SMART-drumline-annual-report.pdf
5/12/2023,9:36,White Shark,233,F,Alive,"ID, A",Port Macquarie,Lighthouse Beach,2023-12-05T09:36:00Z,2023,12,WHI,TRUE,TRUE,TRUE,2023-24-NSW-SMART-drumline-annual-report.pdf
12/12/2023,15:51,White Shark,286,M,Alive,"ID, A",Port Macquarie,Lighthouse Beach,2023-12-12T15:51:00Z,2023,12,WHI,TRUE,TRUE,TRUE,2023-24-NSW-SMART-drumline-annual-report.pdf
17/12/2023,12:11,Smooth Hammerhead,172,M,Alive,ID,Port Macquarie,Lighthouse Beach,2023-12-17T12:11:00Z,2023,12,SMH,FALSE,TRUE,FALSE,2023-24-NSW-SMART-drumline-annual-report.pdf
2/01/2024,11:31,Bronze Whaler,282,F,Alive,ID,Port Macquarie,Lighthouse Beach,2024-01-02T11:31:00Z,2024,1,BRO,FALSE,TRUE,FALSE,2023-24-NSW-SMART-drumline-annual-report.pdf
10/01/2024,7:00,Scalloped Hammerhead,239,F,Alive,ID,Port Macquarie,Lighthouse Beach,2024-01-10T07:00:00Z,2024,1,SCH,FALSE,TRUE,FALSE,2023-24-NSW-SMART-drumline-annual-report.pdf
31/01/2024,10:11,Tiger Shark,239,F,Alive,"ID, A",Port Macquarie,Lighthouse Beach,2024-01-31T10:11:00Z,2024,1,TIG,TRUE,TRUE,TRUE,2023-24-NSW-SMART-drumline-annual-report.pdf
9/03/2024,8:43,White Shark,331,M,Alive,"ID, A",Port Macquarie,Lighthouse Beach,2024-03-09T08:43:00Z,2024,3,WHI,TRUE,TRUE,TRUE,2023-24-NSW-SMART-drumline-annual-report.pdf
27/03/2024,13:55,White Shark,265,NA,Alive,NA,Port Macquarie,Lighthouse Beach,2024-03-27T13:55:00Z,2024,3,WHI,TRUE,FALSE,FALSE,2023-24-NSW-SMART-drumline-annual-report.pdf
5/05/2024,14:57,Smooth Hammerhead,NA,NA,Alive,NA,Port Macquarie,Lighthouse Beach,2024-05-05T14:57:00Z,2024,5,SMH,FALSE,FALSE,FALSE,2023-24-NSW-SMART-drumline-annual-report.pdf
8/05/2024,9:45,White Shark,307,M,Alive,"ID, A",Port Macquarie,Lighthouse Beach,2024-05-08T09:45:00Z,2024,5,WHI,TRUE,TRUE,TRUE,2023-24-NSW-SMART-drumline-annual-report.pdf
9/06/2024,8:34,White Shark,331,F,Alive,"ID, A",Port Macquarie,Lighthouse Beach,2024-06-09T08:34:00Z,2024,6,WHI,TRUE,TRUE,TRUE,2023-24-NSW-SMART-drumline-annual-report.pdf
25/09/2023,8:45,Bronze Whaler,268,F,Alive,ID,Port Macquarie,Miners Beach,2023-09-25T08:45:00Z,2023,9,BRO,FALSE,TRUE,FALSE,2023-24-NSW-SMART-drumline-annual-report.pdf
13/08/2023,13:16,White Shark,269,F,Alive,"ID, A",Port Macquarie,Nobbys Beach,2023-08-13T13:16:00Z,2023,8,WHI,TRUE,TRUE,TRUE,2023-24-NSW-SMART-drumline-annual-report.pdf
27/02/2024,10:43,Tiger Shark,196,M,Alive,"ID, A",Port Macquarie,Nobbys Beach,2024-02-27T10:43:00Z,2024,2,TIG,TRUE,TRUE,TRUE,2023-24-NSW-SMART-drumline-annual-report.pdf
28/05/2024,9:44,Tiger Shark,264,F,Alive,"ID, A",Port Macquarie,Nobbys Beach,2024-05-28T09:44:00Z,2024,5,TIG,TRUE,TRUE,TRUE,2023-24-NSW-SMART-drumline-annual-report.pdf
31/07/2023,8:34,White Shark,181,M,Alive,"ID, A",Port Macquarie,North Shore Beach,2023-07-31T08:34:00Z,2023,7,WHI,TRUE,TRUE,TRUE,2023-24-NSW-SMART-drumline-annual-report.pdf
3/08/2023,9:14,Greynurse Shark,266,F,Alive,ID,Port Macquarie,North Shore Beach,2023-08-03T09:14:00Z,2023,8,GRN,FALSE,TRUE,FALSE,2023-24-NSW-SMART-drumline-annual-report.pdf
20/08/2023,12:31,White Shark,296,F,Alive,"ID, A",Port Macquarie,North Shore Beach,2023-08-20T12:31:00Z,2023,8,WHI,TRUE,TRUE,TRUE,2023-24-NSW-SMART-drumline-annual-report.pdf
24/08/2023,10:59,White Shark,196,M,Alive,"ID, A",Port Macquarie,North Shore Beach,2023-08-24T10:59:00Z,2023,8,WHI,TRUE,TRUE,TRUE,2023-24-NSW-SMART-drumline-annual-report.pdf
24/08/2023,12:25,White Shark,168,F,Alive,"ID, A",Port Macquarie,North Shore Beach,2023-08-24T12:25:00Z,2023,8,WHI,TRUE,TRUE,TRUE,2023-24-NSW-SMART-drumline-annual-report.pdf
26/08/2023,11:40,White Shark,169,M,Alive,"ID, A",Port Macquarie,North Shore Beach,2023-08-26T11:40:00Z,2023,8,WHI,TRUE,TRUE,TRUE,2023-24-NSW-SMART-drumline-annual-report.pdf
27/08/2023,13:44,Bronze Whaler,251,M,Alive,ID,Port Macquarie,North Shore Beach,2023-08-27T13:44:00Z,2023,8,BRO,FALSE,TRUE,FALSE,2023-24-NSW-SMART-drumline-annual-report.pdf
28/08/2023,12:37,Greynurse Shark,275,F,Alive,ID,Port Macquarie,North Shore Beach,2023-08-28T12:37:00Z,2023,8,GRN,FALSE,TRUE,FALSE,2023-24-NSW-SMART-drumline-annual-report.pdf
30/08/2023,8:03,Greynurse Shark,244,F,Alive,ID,Port Macquarie,North Shore Beach,2023-08-30T08:03:00Z,2023,8,GRN,FALSE,TRUE,FALSE,2023-24-NSW-SMART-drumline-annual-report.pdf
6/09/2023,12:13,White Shark,161,F,Alive,"ID, A",Port Macquarie,North Shore Beach,2023-09-06T12:13:00Z,2023,9,WHI,TRUE,TRUE,TRUE,2023-24-NSW-SMART-drumline-annual-report.pdf
17/09/2023,8:14,Greynurse Shark,284,F,Alive,ID,Port Macquarie,North Shore Beach,2023-09-17T08:14:00Z,2023,9,GRN,FALSE,TRUE,FALSE,2023-24-NSW-SMART-drumline-annual-report.pdf
18/09/2023,12:24,Bronze Whaler,278,M,Alive,ID,Port Macquarie,North Shore Beach,2023-09-18T12:24:00Z,2023,9,BRO,FALSE,TRUE,FALSE,2023-24-NSW-SMART-drumline-annual-report.pdf
23/09/2023,13:01,White Shark,246,F,Alive,"ID, A",Port Macquarie,North Shore Beach,2023-09-23T13:01:00Z,2023,9,WHI,TRUE,TRUE,TRUE,2023-24-NSW-SMART-drumline-annual-report.pdf
26/09/2023,14:03,White Shark,225,M,Alive,"ID, A",Port Macquarie,North Shore Beach,2023-09-26T14:03:00Z,2023,9,WHI,TRUE,TRUE,TRUE,2023-24-NSW-SMART-drumline-annual-report.pdf
23/10/2023,8:19,Greynurse Shark,279,F,Alive,ID,Port Macquarie,North Shore Beach,2023-10-23T08:19:00Z,2023,10,GRN,FALSE,TRUE,FALSE,2023-24-NSW-SMART-drumline-annual-report.pdf
23/10/2023,10:52,White Shark,275,F,Alive,"ID, A",Port Macquarie,North Shore Beach,2023-10-23T10:52:00Z,2023,10,WHI,TRUE,TRUE,TRUE,2023-24-NSW-SMART-drumline-annual-report.pdf
4/12/2023,13:05,Smooth Hammerhead,130,NA,Alive,NA,Port Macquarie,North Shore Beach,2023-12-04T13:05:00Z,2023,12,SMH,FALSE,FALSE,FALSE,2023-24-NSW-SMART-drumline-annual-report.pdf
12/12/2023,7:18,Greynurse Shark,275,F,Alive,ID,Port Macquarie,North Shore Beach,2023-12-12T07:18:00Z,2023,12,GRN,FALSE,TRUE,FALSE,2023-24-NSW-SMART-drumline-annual-report.pdf
15/12/2023,6:27,White Shark,317,M,Alive,"ID, A",Port Macquarie,North Shore Beach,2023-12-15T06:27:00Z,2023,12,WHI,TRUE,TRUE,TRUE,2023-24-NSW-SMART-drumline-annual-report.pdf
25/12/2023,11:38,Great Hammerhead,269,F,Alive,ID,Port Macquarie,North Shore Beach,2023-12-25T11:38:00Z,2023,12,GHH,FALSE,TRUE,FALSE,2023-24-NSW-SMART-drumline-annual-report.pdf
29/12/2023,NA,Tiger Shark,149,F,Alive,"ID, A",Port Macquarie,North Shore Beach,NA,2023,12,TIG,TRUE,TRUE,TRUE,2023-24-NSW-SMART-drumline-annual-report.pdf
1/02/2024,14:08,White Shark,173,M,Alive,"ID, A",Port Macquarie,North Shore Beach,2024-02-01T14:08:00Z,2024,2,WHI,TRUE,TRUE,TRUE,2023-24-NSW-SMART-drumline-annual-report.pdf
25/03/2024,12:12,White Shark,289,F,Alive,"ID, A",Port Macquarie,North Shore Beach,2024-03-25T12:12:00Z,2024,3,WHI,TRUE,TRUE,TRUE,2023-24-NSW-SMART-drumline-annual-report.pdf
16/05/2024,10:06,Greynurse Shark,275,F,Alive,ID,Port Macquarie,North Shore Beach,2024-05-16T10:06:00Z,2024,5,GRN,FALSE,TRUE,FALSE,2023-24-NSW-SMART-drumline-annual-report.pdf
7/06/2024,7:53,White Shark,276,F,Alive,"ID, A",Port Macquarie,North Shore Beach,2024-06-07T07:53:00Z,2024,6,WHI,TRUE,TRUE,TRUE,2023-24-NSW-SMART-drumline-annual-report.pdf
27/06/2024,10:07,White Shark,236,M,Alive,"ID, A",Port Macquarie,North Shore Beach,2024-06-27T10:07:00Z,2024,6,WHI,TRUE,TRUE,TRUE,2023-24-NSW-SMART-drumline-annual-report.pdf
13/09/2023,12:22,White Shark,203,F,Alive,"ID, A",Port Macquarie,Oxley Beach,2023-09-13T12:22:00Z,2023,9,WHI,TRUE,TRUE,TRUE,2023-24-NSW-SMART-drumline-annual-report.pdf
17/09/2023,11:20,White Shark,278,F,Alive,"ID, A",Port Macquarie,Oxley Beach,2023-09-17T11:20:00Z,2023,9,WHI,TRUE,TRUE,TRUE,2023-24-NSW-SMART-drumline-annual-report.pdf
6/10/2023,12:41,Greynurse Shark,281,F,Alive,ID,Port Macquarie,Oxley Beach,2023-10-06T12:41:00Z,2023,10,GRN,FALSE,TRUE,FALSE,2023-24-NSW-SMART-drumline-annual-report.pdf
9/10/2023,14:02,Bronze Whaler,272,F,Alive,ID,Port Macquarie,Oxley Beach,2023-10-09T14:02:00Z,2023,10,BRO,FALSE,TRUE,FALSE,2023-24-NSW-SMART-drumline-annual-report.pdf
29/04/2024,NA,Greynurse Shark,270,F,Alive,ID,Port Macquarie,Oxley Beach,NA,2024,4,GRN,FALSE,TRUE,FALSE,2023-24-NSW-SMART-drumline-annual-report.pdf
17/07/2023,11:38,White Shark,349,F,Alive,"ID, A",Port Macquarie,Rocky Beach,2023-07-17T11:38:00Z,2023,7,WHI,TRUE,TRUE,TRUE,2023-24-NSW-SMART-drumline-annual-report.pdf
5/08/2023,13:36,White Shark,254,F,Alive,"ID, A",Port Macquarie,Rocky Beach,2023-08-05T13:36:00Z,2023,8,WHI,TRUE,TRUE,TRUE,2023-24-NSW-SMART-drumline-annual-report.pdf
2/11/2023,NA,Dusky Whaler,122,M,Alive,ID,Port Macquarie,Rocky Beach,NA,2023,11,DUS,FALSE,TRUE,FALSE,2023-24-NSW-SMART-drumline-annual-report.pdf
5/07/2023,9:27,White Shark,166,F,Alive,"ID, A",Port Macquarie,Shelly Beach,2023-07-05T09:27:00Z,2023,7,WHI,TRUE,TRUE,TRUE,2023-24-NSW-SMART-drumline-annual-report.pdf
22/08/2023,10:28,White Shark,228,M,Alive,"ID, A",Port Macquarie,Shelly Beach,2023-08-22T10:28:00Z,2023,8,WHI,TRUE,TRUE,TRUE,2023-24-NSW-SMART-drumline-annual-report.pdf
15/10/2023,10:51,White Shark,174,M,Alive,"ID, A",Port Macquarie,Shelly Beach,2023-10-15T10:51:00Z,2023,10,WHI,TRUE,TRUE,TRUE,2023-24-NSW-SMART-drumline-annual-report.pdf
25/11/2023,9:04,Smooth Hammerhead,165,M,Alive,ID,Port Macquarie,Shelly Beach,2023-11-25T09:04:00Z,2023,11,SMH,FALSE,TRUE,FALSE,2023-24-NSW-SMART-drumline-annual-report.pdf
12/12/2023,12:01,Smooth Hammerhead,176,M,Alive,ID,Port Macquarie,Shelly Beach,2023-12-12T12:01:00Z,2023,12,SMH,FALSE,TRUE,FALSE,2023-24-NSW-SMART-drumline-annual-report.pdf
16/12/2023,NA,White Shark,277,M,Alive,"ID, A",Port Macquarie,Shelly Beach,NA,2023,12,WHI,TRUE,TRUE,TRUE,2023-24-NSW-SMART-drumline-annual-report.pdf
17/12/2023,10:34,Smooth Hammerhead,176,M,Alive,ID,Port Macquarie,Shelly Beach,2023-12-17T10:34:00Z,2023,12,SMH,FALSE,TRUE,FALSE,2023-24-NSW-SMART-drumline-annual-report.pdf
5/05/2024,10:29,Smooth Hammerhead,163,M,Alive,ID,Port Macquarie,Shelly Beach,2024-05-05T10:29:00Z,2024,5,SMH,FALSE,TRUE,FALSE,2023-24-NSW-SMART-drumline-annual-report.pdf
6/06/2024,13:31,Smooth Hammerhead,153,M,Alive,NA,Port Macquarie,Shelly Beach,2024-06-06T13:31:00Z,2024,6,SMH,FALSE,FALSE,FALSE,2023-24-NSW-SMART-drumline-annual-report.pdf
18/07/2023,NA,Tiger Shark,165,F,Alive,"ID, A",Shellharbour,Killalea Beach,NA,2023,7,TIG,TRUE,TRUE,TRUE,2023-24-NSW-SMART-drumline-annual-report.pdf
20/08/2023,7:45,Bronze Whaler,275,F,Alive,ID,Shellharbour,Perkins Beach,2023-08-20T07:45:00Z,2023,8,BRO,FALSE,TRUE,FALSE,2023-24-NSW-SMART-drumline-annual-report.pdf
25/08/2023,13:18,Bronze Whaler,281,F,Alive,ID,Shellharbour,Perkins Beach,2023-08-25T13:18:00Z,2023,8,BRO,FALSE,TRUE,FALSE,2023-24-NSW-SMART-drumline-annual-report.pdf
12/09/2023,10:55,White Shark,234,F,Alive,"ID, A",Shellharbour,Perkins Beach,2023-09-12T10:55:00Z,2023,9,WHI,TRUE,TRUE,TRUE,2023-24-NSW-SMART-drumline-annual-report.pdf
3/03/2024,10:51,White Shark,259,F,Alive,"ID, A",Shellharbour,Perkins Beach,2024-03-03T10:51:00Z,2024,3,WHI,TRUE,TRUE,TRUE,2023-24-NSW-SMART-drumline-annual-report.pdf
22/05/2024,14:18,White Shark,182,F,Alive,"ID, A",Shellharbour,Perkins Beach,2024-05-22T14:18:00Z,2024,5,WHI,TRUE,TRUE,TRUE,2023-24-NSW-SMART-drumline-annual-report.pdf
10/06/2024,NA,Dusky Whaler,99,F,Dead,NA,Shellharbour,Perkins Beach,NA,2024,6,DUS,FALSE,FALSE,FALSE,2023-24-NSW-SMART-drumline-annual-report.pdf
6/11/2023,NA,Tiger Shark,152,M,Alive,"ID, A",Shellharbour,Port Kembla Beach,NA,2023,11,TIG,TRUE,TRUE,TRUE,2023-24-NSW-SMART-drumline-annual-report.pdf
8/11/2023,NA,Shortfin Mako Shark,116,M,Alive,ID,Shellharbour,Port Kembla Beach,NA,2023,11,SMA,FALSE,TRUE,FALSE,2023-24-NSW-SMART-drumline-annual-report.pdf
9/11/2023,12:22,Shortfin Mako Shark,134,M,Alive,ID,Shellharbour,Port Kembla Beach,2023-11-09T12:22:00Z,2023,11,SMA,FALSE,TRUE,FALSE,2023-24-NSW-SMART-drumline-annual-report.pdf
10/01/2024,15:09,Shortfin Mako Shark,120,NA,Alive,NA,Shellharbour,Port Kembla Beach,2024-01-10T15:09:00Z,2024,1,SMA,FALSE,FALSE,FALSE,2023-24-NSW-SMART-drumline-annual-report.pdf
18/01/2024,9:06,Tiger Shark,249,F,Alive,"ID, A",Shellharbour,Port Kembla Beach,2024-01-18T09:06:00Z,2024,1,TIG,TRUE,TRUE,TRUE,2023-24-NSW-SMART-drumline-annual-report.pdf
21/02/2024,14:20,Tiger Shark,271,M,Alive,"ID, A",Shellharbour,Port Kembla Beach,2024-02-21T14:20:00Z,2024,2,TIG,TRUE,TRUE,TRUE,2023-24-NSW-SMART-drumline-annual-report.pdf
2/05/2024,10:31,Shortfin Mako Shark,122,F,Alive,ID,Shellharbour,Port Kembla Beach,2024-05-02T10:31:00Z,2024,5,SMA,FALSE,TRUE,FALSE,2023-24-NSW-SMART-drumline-annual-report.pdf
27/06/2024,10:04,Tiger Shark,194,F,Alive,"ID, A",Shellharbour,Port Kembla Beach,2024-06-27T10:04:00Z,2024,6,TIG,TRUE,TRUE,TRUE,2023-24-NSW-SMART-drumline-annual-report.pdf
23/05/2024,NA,Snapper,60,NA,Dead,NA,Shellharbour,South Beach,NA,2024,5,SNP,FALSE,FALSE,FALSE,2023-24-NSW-SMART-drumline-annual-report.pdf
11/08/2023,13:23,Bronze Whaler,278,F,Alive,ID,Shellharbour,Warilla Beach,2023-08-11T13:23:00Z,2023,8,BRO,FALSE,TRUE,FALSE,2023-24-NSW-SMART-drumline-annual-report.pdf
30/08/2023,7:10,Smooth Hammerhead,159,F,Alive,ID,Shellharbour,Warilla Beach,2023-08-30T07:10:00Z,2023,8,SMH,FALSE,TRUE,FALSE,2023-24-NSW-SMART-drumline-annual-report.pdf
12/11/2023,7:25,Smooth Hammerhead,157,M,Alive,ID,Shellharbour,Warilla Beach,2023-11-12T07:25:00Z,2023,11,SMH,FALSE,TRUE,FALSE,2023-24-NSW-SMART-drumline-annual-report.pdf
26/05/2024,11:57,Tiger Shark,272,F,Alive,"ID, A",Shellharbour,Warilla Beach,2024-05-26T11:57:00Z,2024,5,TIG,TRUE,TRUE,TRUE,2023-24-NSW-SMART-drumline-annual-report.pdf
23/06/2024,10:51,Bronze Whaler,255,F,Alive,ID,Shellharbour,Warilla Beach,2024-06-23T10:51:00Z,2024,6,BRO,FALSE,TRUE,FALSE,2023-24-NSW-SMART-drumline-annual-report.pdf
21/11/2023,18:20,Dusky Whaler,125,M,Dead,NA,Sutherland,Oak Park Beach,2023-11-21T18:20:00Z,2023,11,DUS,FALSE,FALSE,FALSE,2023-24-NSW-SMART-drumline-annual-report.pdf
29/08/2023,14:27,Bronze Whaler,277,F,Alive,ID,Sutherland,Shark Island,2023-08-29T14:27:00Z,2023,8,BRO,FALSE,TRUE,FALSE,2023-24-NSW-SMART-drumline-annual-report.pdf
20/11/2023,10:13,Dusky Whaler,114,M,Alive,ID,Sutherland,Shark Island,2023-11-20T10:13:00Z,2023,11,DUS,FALSE,TRUE,FALSE,2023-24-NSW-SMART-drumline-annual-report.pdf
18/01/2024,NA,Dusky Whaler,125,M,Dead,NA,Sutherland,Shark Island,NA,2024,1,DUS,FALSE,FALSE,FALSE,2023-24-NSW-SMART-drumline-annual-report.pdf
19/01/2024,13:00,Dusky Whaler,123,M,Alive,ID,Sutherland,Shark Island,2024-01-19T13:00:00Z,2024,1,DUS,FALSE,TRUE,FALSE,2023-24-NSW-SMART-drumline-annual-report.pdf
27/02/2024,NA,Dusky Whaler,120,NA,Alive,NA,Sutherland,Shark Island,NA,2024,2,DUS,FALSE,FALSE,FALSE,2023-24-NSW-SMART-drumline-annual-report.pdf
7/11/2023,17:43,Shortfin Mako Shark,116,M,Alive,ID,Sutherland,South Cronulla Beach,2023-11-07T17:43:00Z,2023,11,SMA,FALSE,TRUE,FALSE,2023-24-NSW-SMART-drumline-annual-report.pdf
24/12/2023,14:16,Dusky Whaler,104,M,Alive,ID,Sutherland,South Cronulla Beach,2023-12-24T14:16:00Z,2023,12,DUS,FALSE,TRUE,FALSE,2023-24-NSW-SMART-drumline-annual-report.pdf
26/12/2023,7:21,Dusky Whaler,121,M,Alive,ID,Sutherland,South Cronulla Beach,2023-12-26T07:21:00Z,2023,12,DUS,FALSE,TRUE,FALSE,2023-24-NSW-SMART-drumline-annual-report.pdf
31/12/2023,12:50,Dusky Whaler,121,M,Alive,ID,Sutherland,South Cronulla Beach,2023-12-31T12:50:00Z,2023,12,DUS,FALSE,TRUE,FALSE,2023-24-NSW-SMART-drumline-annual-report.pdf
3/01/2024,NA,Dusky Whaler,102,M,Alive,ID,Sutherland,South Cronulla Beach,NA,2024,1,DUS,FALSE,TRUE,FALSE,2023-24-NSW-SMART-drumline-annual-report.pdf
3/02/2024,11:18,Dusky Whaler,123,M,Alive,ID,Sutherland,South Cronulla Beach,2024-02-03T11:18:00Z,2024,2,DUS,FALSE,TRUE,FALSE,2023-24-NSW-SMART-drumline-annual-report.pdf
29/02/2024,NA,Dusky Whaler,114,M,Alive,ID,Sutherland,South Cronulla Beach,NA,2024,2,DUS,FALSE,TRUE,FALSE,2023-24-NSW-SMART-drumline-annual-report.pdf
19/04/2024,9:23,Smooth Hammerhead,148,F,Alive,ID,Sutherland,South Cronulla Beach,2024-04-19T09:23:00Z,2024,4,SMH,FALSE,TRUE,FALSE,2023-24-NSW-SMART-drumline-annual-report.pdf
30/07/2023,9:34,White Shark,200,NA,Alive,NA,Sutherland,Wanda Beach,2023-07-30T09:34:00Z,2023,7,WHI,TRUE,FALSE,FALSE,2023-24-NSW-SMART-drumline-annual-report.pdf
6/11/2023,9:50,Tiger Shark,318,F,Alive,"ID, A",Sutherland,Wanda Beach,2023-11-06T09:50:00Z,2023,11,TIG,TRUE,TRUE,TRUE,2023-24-NSW-SMART-drumline-annual-report.pdf
8/11/2023,13:20,Shortfin Mako Shark,151,F,Alive,ID,Sutherland,Wanda Beach,2023-11-08T13:20:00Z,2023,11,SMA,FALSE,TRUE,FALSE,2023-24-NSW-SMART-drumline-annual-report.pdf
28/12/2023,17:05,Dusky Whaler,120,F,Alive,ID,Sutherland,Wanda Beach,2023-12-28T17:05:00Z,2023,12,DUS,FALSE,TRUE,FALSE,2023-24-NSW-SMART-drumline-annual-report.pdf
25/04/2024,NA,Dusky Whaler,120,M,Dead,NA,Sutherland,Wanda Beach,NA,2024,4,DUS,FALSE,FALSE,FALSE,2023-24-NSW-SMART-drumline-annual-report.pdf
29/04/2024,12:10,Shortfin Mako Shark,140,M,Alive,ID,Sutherland,Wanda Beach,2024-04-29T12:10:00Z,2024,4,SMA,FALSE,TRUE,FALSE,2023-24-NSW-SMART-drumline-annual-report.pdf
10/05/2024,NA,Tailor,37,NA,Dead,NA,Sutherland,Wanda Beach,NA,2024,5,TLR,FALSE,FALSE,FALSE,2023-24-NSW-SMART-drumline-annual-report.pdf
29/08/2023,8:31,Seal,200,NA,Alive,NA,Sydney East,Bondi Beach,2023-08-29T08:31:00Z,2023,8,SEL,FALSE,FALSE,FALSE,2023-24-NSW-SMART-drumline-annual-report.pdf
1/12/2023,6:20,Smooth Hammerhead,158,F,Alive,ID,Sydney East,Bondi Beach,2023-12-01T06:20:00Z,2023,12,SMH,FALSE,TRUE,FALSE,2023-24-NSW-SMART-drumline-annual-report.pdf
14/03/2024,15:25,Dusky Whaler,183,F,Alive,ID,Sydney East,Bondi Beach,2024-03-14T15:25:00Z,2024,3,DUS,FALSE,TRUE,FALSE,2023-24-NSW-SMART-drumline-annual-report.pdf
22/03/2024,8:33,Dusky Whaler,121,F,Alive,ID,Sydney East,Bondi Beach,2024-03-22T08:33:00Z,2024,3,DUS,FALSE,TRUE,FALSE,2023-24-NSW-SMART-drumline-annual-report.pdf
14/04/2024,6:48,Smooth Hammerhead,156,F,Alive,ID,Sydney East,Bondi Beach,2024-04-14T06:48:00Z,2024,4,SMH,FALSE,TRUE,FALSE,2023-24-NSW-SMART-drumline-annual-report.pdf
23/04/2024,13:49,Dusky Whaler,167,M,Alive,ID,Sydney East,Bondi Beach,2024-04-23T13:49:00Z,2024,4,DUS,FALSE,TRUE,FALSE,2023-24-NSW-SMART-drumline-annual-report.pdf
24/06/2024,11:25,White Shark,193,F,Alive,"ID, A",Sydney East,Bondi Beach,2024-06-24T11:25:00Z,2024,6,WHI,TRUE,TRUE,TRUE,2023-24-NSW-SMART-drumline-annual-report.pdf
6/11/2023,9:54,Smooth Hammerhead,189,F,Alive,ID,Sydney East,Bronte Beach,2023-11-06T09:54:00Z,2023,11,SMH,FALSE,TRUE,FALSE,2023-24-NSW-SMART-drumline-annual-report.pdf
1/03/2024,8:40,Dusky Whaler,128,F,Alive,ID,Sydney East,Bronte Beach,2024-03-01T08:40:00Z,2024,3,DUS,FALSE,TRUE,FALSE,2023-24-NSW-SMART-drumline-annual-report.pdf
18/04/2024,7:06,Dusky Whaler,148,F,Alive,ID,Sydney East,Clovelly Beach,2024-04-18T07:06:00Z,2024,4,DUS,FALSE,TRUE,FALSE,2023-24-NSW-SMART-drumline-annual-report.pdf
18/04/2024,12:25,Dusky Whaler,138,F,Alive,ID,Sydney East,Clovelly Beach,2024-04-18T12:25:00Z,2024,4,DUS,FALSE,TRUE,FALSE,2023-24-NSW-SMART-drumline-annual-report.pdf
24/10/2023,11:15,Dusky Whaler,131,M,Alive,ID,Sydney East,Coogee Beach,2023-10-24T11:15:00Z,2023,10,DUS,FALSE,TRUE,FALSE,2023-24-NSW-SMART-drumline-annual-report.pdf
14/03/2024,NA,Dusky Whaler,129,M,Alive,ID,Sydney East,Coogee Beach,NA,2024,3,DUS,FALSE,TRUE,FALSE,2023-24-NSW-SMART-drumline-annual-report.pdf
12/04/2024,7:18,Dusky Whaler,131,M,Alive,ID,Sydney East,Coogee Beach,2024-04-12T07:18:00Z,2024,4,DUS,FALSE,TRUE,FALSE,2023-24-NSW-SMART-drumline-annual-report.pdf
18/04/2024,6:36,Dusky Whaler,125,F,Alive,ID,Sydney East,Coogee Beach,2024-04-18T06:36:00Z,2024,4,DUS,FALSE,TRUE,FALSE,2023-24-NSW-SMART-drumline-annual-report.pdf
12/05/2024,7:39,Dusky Whaler,148,F,Alive,ID,Sydney East,Coogee Beach,2024-05-12T07:39:00Z,2024,5,DUS,FALSE,TRUE,FALSE,2023-24-NSW-SMART-drumline-annual-report.pdf
6/06/2024,8:36,Tiger Shark,375,F,Alive,"ID, A",Sydney East,Coogee Beach,2024-06-06T08:36:00Z,2024,6,TIG,TRUE,TRUE,TRUE,2023-24-NSW-SMART-drumline-annual-report.pdf
23/04/2024,8:11,Dusky Whaler,142,F,Alive,ID,Sydney East,Malabar Beach,2024-04-23T08:11:00Z,2024,4,DUS,FALSE,TRUE,FALSE,2023-24-NSW-SMART-drumline-annual-report.pdf
19/10/2023,14:22,Dusky Whaler,156,F,Alive,ID,Sydney East,Maroubra Beach,2023-10-19T14:22:00Z,2023,10,DUS,FALSE,TRUE,FALSE,2023-24-NSW-SMART-drumline-annual-report.pdf
20/01/2024,8:27,Tiger Shark,195,M,Alive,"ID, A",Sydney East,Maroubra Beach,2024-01-20T08:27:00Z,2024,1,TIG,TRUE,TRUE,TRUE,2023-24-NSW-SMART-drumline-annual-report.pdf
23/02/2024,12:54,Dusky Whaler,159,F,Alive,ID,Sydney East,Maroubra Beach,2024-02-23T12:54:00Z,2024,2,DUS,FALSE,TRUE,FALSE,2023-24-NSW-SMART-drumline-annual-report.pdf
26/02/2024,11:20,Tiger Shark,245,F,Alive,"ID, A",Sydney East,Maroubra Beach,2024-02-26T11:20:00Z,2024,2,TIG,TRUE,TRUE,TRUE,2023-24-NSW-SMART-drumline-annual-report.pdf
24/03/2024,8:01,Tiger Shark,274,M,Alive,"ID, A",Sydney East,Maroubra Beach,2024-03-24T08:01:00Z,2024,3,TIG,TRUE,TRUE,TRUE,2023-24-NSW-SMART-drumline-annual-report.pdf
25/03/2024,9:39,Tiger Shark,300,NA,Alive,NA,Sydney East,Maroubra Beach,2024-03-25T09:39:00Z,2024,3,TIG,TRUE,FALSE,FALSE,2023-24-NSW-SMART-drumline-annual-report.pdf
5/06/2024,8:55,Smooth Hammerhead,186,F,Alive,ID,Sydney East,Maroubra Beach,2024-06-05T08:55:00Z,2024,6,SMH,FALSE,TRUE,FALSE,2023-24-NSW-SMART-drumline-annual-report.pdf
25/07/2023,14:10,Bronze Whaler,285,F,Alive,ID,Sydney East,Tamarama Beach,2023-07-25T14:10:00Z,2023,7,BRO,FALSE,TRUE,FALSE,2023-24-NSW-SMART-drumline-annual-report.pdf
29/09/2023,14:16,Bronze Whaler,247,M,Alive,ID,Sydney East,Tamarama Beach,2023-09-29T14:16:00Z,2023,9,BRO,FALSE,TRUE,FALSE,2023-24-NSW-SMART-drumline-annual-report.pdf
9/11/2023,8:50,Shortfin Mako Shark,169,F,Alive,ID,Sydney East,Tamarama Beach,2023-11-09T08:50:00Z,2023,11,SMA,FALSE,TRUE,FALSE,2023-24-NSW-SMART-drumline-annual-report.pdf
9/03/2024,7:45,Smooth Hammerhead,181,F,Alive,ID,Sydney East,Tamarama Beach,2024-03-09T07:45:00Z,2024,3,SMH,FALSE,TRUE,FALSE,2023-24-NSW-SMART-drumline-annual-report.pdf
9/03/2024,16:13,Dusky Whaler,131,F,Alive,ID,Sydney East,Tamarama Beach,2024-03-09T16:13:00Z,2024,3,DUS,FALSE,TRUE,FALSE,2023-24-NSW-SMART-drumline-annual-report.pdf
10/03/2024,10:56,Dusky Whaler,102,M,Alive,ID,Sydney East,Tamarama Beach,2024-03-10T10:56:00Z,2024,3,DUS,FALSE,TRUE,FALSE,2023-24-NSW-SMART-drumline-annual-report.pdf
24/03/2024,9:53,Dusky Whaler,131,F,Alive,ID,Sydney East,Tamarama Beach,2024-03-24T09:53:00Z,2024,3,DUS,FALSE,TRUE,FALSE,2023-24-NSW-SMART-drumline-annual-report.pdf
18/04/2024,8:19,Tiger Shark,166,F,Alive,"ID, A",Sydney East,Tamarama Beach,2024-04-18T08:19:00Z,2024,4,TIG,TRUE,TRUE,TRUE,2023-24-NSW-SMART-drumline-annual-report.pdf
24/05/2024,11:06,Tiger Shark,270,F,Alive,"ID, A",Sydney East,Tamarama Beach,2024-05-24T11:06:00Z,2024,5,TIG,TRUE,TRUE,TRUE,2023-24-NSW-SMART-drumline-annual-report.pdf
25/06/2024,11:10,Tiger Shark,277,F,Alive,"ID, A",Sydney East,Tamarama Beach,2024-06-25T11:10:00Z,2024,6,TIG,TRUE,TRUE,TRUE,2023-24-NSW-SMART-drumline-annual-report.pdf
3/02/2024,8:17,Dusky Whaler,128,M,Alive,ID,Wollongong,Bellambi Beach,2024-02-03T08:17:00Z,2024,2,DUS,FALSE,TRUE,FALSE,2023-24-NSW-SMART-drumline-annual-report.pdf
27/07/2023,10:16,Unidentified Whaler,260,NA,Alive,NA,Wollongong,Bulli Beach,2023-07-27T10:16:00Z,2023,7,UNK,FALSE,FALSE,FALSE,2023-24-NSW-SMART-drumline-annual-report.pdf
30/11/2023,18:07,Black Ray,155,F,Alive,NA,Wollongong,Bulli Beach,2023-11-30T18:07:00Z,2023,11,BLR,FALSE,FALSE,FALSE,2023-24-NSW-SMART-drumline-annual-report.pdf
31/01/2024,NA,Dusky Whaler,133,F,Dead,NA,Wollongong,Bulli Beach,NA,2024,1,DUS,FALSE,FALSE,FALSE,2023-24-NSW-SMART-drumline-annual-report.pdf
3/03/2024,NA,Dusky Whaler,134,M,Alive,ID,Wollongong,Bulli Beach,NA,2024,3,DUS,FALSE,TRUE,FALSE,2023-24-NSW-SMART-drumline-annual-report.pdf
13/04/2024,NA,Dusky Whaler,106,M,Alive,ID,Wollongong,Bulli Beach,NA,2024,4,DUS,FALSE,TRUE,FALSE,2023-24-NSW-SMART-drumline-annual-report.pdf
8/08/2023,9:35,Bronze Whaler,268,F,Alive,ID,Wollongong,Coledale Beach,2023-08-08T09:35:00Z,2023,8,BRO,FALSE,TRUE,FALSE,2023-24-NSW-SMART-drumline-annual-report.pdf
25/08/2023,9:59,White Shark,170,F,Alive,"ID, A",Wollongong,Corrimal Beach,2023-08-25T09:59:00Z,2023,8,WHI,TRUE,TRUE,TRUE,2023-24-NSW-SMART-drumline-annual-report.pdf
13/10/2023,8:08,Bronze Whaler,229,F,Alive,ID,Wollongong,Corrimal Beach,2023-10-13T08:08:00Z,2023,10,BRO,FALSE,TRUE,FALSE,2023-24-NSW-SMART-drumline-annual-report.pdf
23/10/2023,6:55,Dusky Whaler,143,M,Alive,ID,Wollongong,Corrimal Beach,2023-10-23T06:55:00Z,2023,10,DUS,FALSE,TRUE,FALSE,2023-24-NSW-SMART-drumline-annual-report.pdf
28/12/2023,11:29,Dusky Whaler,127,F,Alive,ID,Wollongong,Corrimal Beach,2023-12-28T11:29:00Z,2023,12,DUS,FALSE,TRUE,FALSE,2023-24-NSW-SMART-drumline-annual-report.pdf
18/01/2024,11:28,Dusky Whaler,149,M,Alive,ID,Wollongong,Corrimal Beach,2024-01-18T11:28:00Z,2024,1,DUS,FALSE,TRUE,FALSE,2023-24-NSW-SMART-drumline-annual-report.pdf
16/04/2024,NA,Dusky Whaler,120,F,Alive,ID,Wollongong,Corrimal Beach,NA,2024,4,DUS,FALSE,TRUE,FALSE,2023-24-NSW-SMART-drumline-annual-report.pdf
22/05/2024,11:56,Bronze Whaler,244,F,Alive,ID,Wollongong,Corrimal Beach,2024-05-22T11:56:00Z,2024,5,BRO,FALSE,TRUE,FALSE,2023-24-NSW-SMART-drumline-annual-report.pdf
4/06/2024,11:54,Bronze Whaler,250,F,Alive,NA,Wollongong,Corrimal Beach,2024-06-04T11:54:00Z,2024,6,BRO,FALSE,FALSE,FALSE,2023-24-NSW-SMART-drumline-annual-report.pdf
13/09/2023,15:11,Black Ray,150,NA,Alive,NA,Wollongong,Little Austinmer Beach,2023-09-13T15:11:00Z,2023,9,BLR,FALSE,FALSE,FALSE,2023-24-NSW-SMART-drumline-annual-report.pdf
15/10/2023,7:02,Dusky Whaler,119,F,Alive,ID,Wollongong,Little Austinmer Beach,2023-10-15T07:02:00Z,2023,10,DUS,FALSE,TRUE,FALSE,2023-24-NSW-SMART-drumline-annual-report.pdf
5/02/2024,NA,Dusky Whaler,110,F,Dead,NA,Wollongong,Little Austinmer Beach,NA,2024,2,DUS,FALSE,FALSE,FALSE,2023-24-NSW-SMART-drumline-annual-report.pdf
3/03/2024,7:47,Smooth Hammerhead,144,M,Alive,ID,Wollongong,Puckeys Beach,2024-03-03T07:47:00Z,2024,3,SMH,FALSE,TRUE,FALSE,2023-24-NSW-SMART-drumline-annual-report.pdf
14/03/2024,7:24,Smooth Hammerhead,163,M,Alive,ID,Wollongong,Puckeys Beach,2024-03-14T07:24:00Z,2024,3,SMH,FALSE,TRUE,FALSE,2023-24-NSW-SMART-drumline-annual-report.pdf
10/06/2024,9:26,Dusky Whaler,251,F,Alive,ID,Wollongong,Puckeys Beach,2024-06-10T09:26:00Z,2024,6,DUS,FALSE,TRUE,FALSE,2023-24-NSW-SMART-drumline-annual-report.pdf
8/10/2023,8:29,Black Ray,130,M,Alive,NA,Wollongong,Sandon Point Beach,2023-10-08T08:29:00Z,2023,10,BLR,FALSE,FALSE,FALSE,2023-24-NSW-SMART-drumline-annual-report.pdf
4/08/2023,8:11,Bronze Whaler,281,F,Alive,ID,Wollongong,Sharky Beach,2023-08-04T08:11:00Z,2023,8,BRO,FALSE,TRUE,FALSE,2023-24-NSW-SMART-drumline-annual-report.pdf
12/04/2024,8:15,Dusky Whaler,134,F,Alive,ID,Wollongong,Sharky Beach,2024-04-12T08:15:00Z,2024,4,DUS,FALSE,TRUE,FALSE,2023-24-NSW-SMART-drumline-annual-report.pdf
8/04/2024,7:14,Dusky Whaler,138,F,Alive,ID,Wollongong,Thirroul Beach,2024-04-08T07:14:00Z,2024,4,DUS,FALSE,TRUE,FALSE,2023-24-NSW-SMART-drumline-annual-report.pdf
9/05/2024,8:26,Dusky Whaler,129,M,Alive,ID,Wollongong,Thirroul Beach,2024-05-09T08:26:00Z,2024,5,DUS,FALSE,TRUE,FALSE,2023-24-NSW-SMART-drumline-annual-report.pdf
9/07/2023,13:41,Dusky Whaler,285,M,Alive,ID,Wollongong,Wollongong Beach,2023-07-09T13:41:00Z,2023,7,DUS,FALSE,TRUE,FALSE,2023-24-NSW-SMART-drumline-annual-report.pdf
27/08/2023,NA,Shortfin Mako Shark,102,F,Alive,ID,Wollongong,Wollongong Beach,NA,2023,8,SMA,FALSE,TRUE,FALSE,2023-24-NSW-SMART-drumline-annual-report.pdf
8/09/2023,8:47,Bronze Whaler,285,F,Alive,ID,Wollongong,Wollongong Beach,2023-09-08T08:47:00Z,2023,9,BRO,FALSE,TRUE,FALSE,2023-24-NSW-SMART-drumline-annual-report.pdf
30/12/2023,16:35,Snapper,52,NA,Dead,NA,Wollongong,Wollongong Beach,2023-12-30T16:35:00Z,2023,12,SNP,FALSE,FALSE,FALSE,2023-24-NSW-SMART-drumline-annual-report.pdf
26/01/2024,7:22,Smooth Hammerhead,217,F,Alive,ID,Wollongong,Wollongong Beach,2024-01-26T07:22:00Z,2024,1,SMH,FALSE,TRUE,FALSE,2023-24-NSW-SMART-drumline-annual-report.pdf
12/09/2023,11:23,White Shark,245,F,Alive,"ID, A",Yamba,Angourie Backbeach,2023-09-12T11:23:00Z,2023,9,WHI,TRUE,TRUE,TRUE,2023-24-NSW-SMART-drumline-annual-report.pdf
14/09/2023,8:10,White Shark,201,F,Alive,"ID, A",Yamba,Angourie Backbeach,2023-09-14T08:10:00Z,2023,9,WHI,TRUE,TRUE,TRUE,2023-24-NSW-SMART-drumline-annual-report.pdf
23/02/2024,9:26,Sandbar Whaler,106,M,Alive,ID,Yamba,Angourie Backbeach,2024-02-23T09:26:00Z,2024,2,SAN,FALSE,TRUE,FALSE,2023-24-NSW-SMART-drumline-annual-report.pdf
6/03/2024,17:15,Manta Ray,250,NA,Alive,NA,Yamba,Angourie Backbeach,2024-03-06T17:15:00Z,2024,3,MAN,FALSE,FALSE,FALSE,2023-24-NSW-SMART-drumline-annual-report.pdf
8/04/2024,10:06,Common Blacktip,146,M,Alive,ID,Yamba,Angourie Backbeach,2024-04-08T10:06:00Z,2024,4,CBT,FALSE,TRUE,FALSE,2023-24-NSW-SMART-drumline-annual-report.pdf
31/05/2024,8:43,Sandbar Whaler,135,M,Alive,ID,Yamba,Angourie Backbeach,2024-05-31T08:43:00Z,2024,5,SAN,FALSE,TRUE,FALSE,2023-24-NSW-SMART-drumline-annual-report.pdf
7/06/2024,13:24,White Shark,268,F,Alive,"ID, A",Yamba,Angourie Backbeach,2024-06-07T13:24:00Z,2024,6,WHI,TRUE,TRUE,TRUE,2023-24-NSW-SMART-drumline-annual-report.pdf
27/06/2024,11:53,White Shark,279,M,Alive,"ID, A",Yamba,Angourie Backbeach,2024-06-27T11:53:00Z,2024,6,WHI,TRUE,TRUE,TRUE,2023-24-NSW-SMART-drumline-annual-report.pdf
17/07/2023,10:18,White Shark,244,M,Alive,"ID, A",Yamba,Angourie Point,2023-07-17T10:18:00Z,2023,7,WHI,TRUE,TRUE,TRUE,2023-24-NSW-SMART-drumline-annual-report.pdf
27/07/2023,9:03,Tiger Shark,322,F,Alive,"ID, A",Yamba,Angourie Point,2023-07-27T09:03:00Z,2023,7,TIG,TRUE,TRUE,TRUE,2023-24-NSW-SMART-drumline-annual-report.pdf
28/07/2023,9:32,Tiger Shark,344,F,Alive,"ID, A",Yamba,Angourie Point,2023-07-28T09:32:00Z,2023,7,TIG,TRUE,TRUE,TRUE,2023-24-NSW-SMART-drumline-annual-report.pdf
24/08/2023,9:52,White Shark,211,M,Alive,"ID, A",Yamba,Angourie Point,2023-08-24T09:52:00Z,2023,8,WHI,TRUE,TRUE,TRUE,2023-24-NSW-SMART-drumline-annual-report.pdf
2/09/2023,8:55,Smooth Hammerhead,170,F,Alive,ID,Yamba,Angourie Point,2023-09-02T08:55:00Z,2023,9,SMH,FALSE,TRUE,FALSE,2023-24-NSW-SMART-drumline-annual-report.pdf
14/09/2023,13:04,White Shark,254,F,Alive,"ID, A",Yamba,Angourie Point,2023-09-14T13:04:00Z,2023,9,WHI,TRUE,TRUE,TRUE,2023-24-NSW-SMART-drumline-annual-report.pdf
17/09/2023,9:20,White Shark,254,M,Alive,"ID, A",Yamba,Angourie Point,2023-09-17T09:20:00Z,2023,9,WHI,TRUE,TRUE,TRUE,2023-24-NSW-SMART-drumline-annual-report.pdf
28/09/2023,11:48,White Shark,235,F,Alive,"ID, A",Yamba,Angourie Point,2023-09-28T11:48:00Z,2023,9,WHI,TRUE,TRUE,TRUE,2023-24-NSW-SMART-drumline-annual-report.pdf
21/12/2023,7:01,Smooth Hammerhead,162,M,Alive,ID,Yamba,Angourie Point,2023-12-21T07:01:00Z,2023,12,SMH,FALSE,TRUE,FALSE,2023-24-NSW-SMART-drumline-annual-report.pdf
31/12/2023,12:17,Manta Ray,350,NA,Alive,NA,Yamba,Angourie Point,2023-12-31T12:17:00Z,2023,12,MAN,FALSE,FALSE,FALSE,2023-24-NSW-SMART-drumline-annual-report.pdf
1/02/2024,14:44,Bull Shark,197,M,Alive,"ID, A",Yamba,Angourie Point,2024-02-01T14:44:00Z,2024,2,BUL,TRUE,TRUE,TRUE,2023-24-NSW-SMART-drumline-annual-report.pdf
27/02/2024,11:45,Great Hammerhead,270,F,Alive,ID,Yamba,Angourie Point,2024-02-27T11:45:00Z,2024,2,GHH,FALSE,TRUE,FALSE,2023-24-NSW-SMART-drumline-annual-report.pdf
8/03/2024,13:32,Tiger Shark,158,F,Alive,"ID, A",Yamba,Angourie Point,2024-03-08T13:32:00Z,2024,3,TIG,TRUE,TRUE,TRUE,2023-24-NSW-SMART-drumline-annual-report.pdf
15/04/2024,14:42,Sandbar Whaler,128,M,Alive,ID,Yamba,Angourie Point,2024-04-15T14:42:00Z,2024,4,SAN,FALSE,TRUE,FALSE,2023-24-NSW-SMART-drumline-annual-report.pdf
16/04/2024,9:04,Sandbar Whaler,130,F,Alive,ID,Yamba,Angourie Point,2024-04-16T09:04:00Z,2024,4,SAN,FALSE,TRUE,FALSE,2023-24-NSW-SMART-drumline-annual-report.pdf
18/04/2024,14:33,Sandbar Whaler,106,F,Alive,ID,Yamba,Angourie Point,2024-04-18T14:33:00Z,2024,4,SAN,FALSE,TRUE,FALSE,2023-24-NSW-SMART-drumline-annual-report.pdf
24/05/2024,9:50,Sandbar Whaler,142,F,Alive,ID,Yamba,Angourie Point,2024-05-24T09:50:00Z,2024,5,SAN,FALSE,TRUE,FALSE,2023-24-NSW-SMART-drumline-annual-report.pdf
25/05/2024,13:32,Sandbar Whaler,117,F,Alive,ID,Yamba,Angourie Point,2024-05-25T13:32:00Z,2024,5,SAN,FALSE,TRUE,FALSE,2023-24-NSW-SMART-drumline-annual-report.pdf
25/05/2024,14:38,Sandbar Whaler,141,F,Alive,ID,Yamba,Angourie Point,2024-05-25T14:38:00Z,2024,5,SAN,FALSE,TRUE,FALSE,2023-24-NSW-SMART-drumline-annual-report.pdf
2/06/2024,7:34,Sandbar Whaler,144,F,Alive,ID,Yamba,Angourie Point,2024-06-02T07:34:00Z,2024,6,SAN,FALSE,TRUE,FALSE,2023-24-NSW-SMART-drumline-annual-report.pdf
7/06/2024,9:00,Tiger Shark,330,F,Alive,"ID, A",Yamba,Angourie Point,2024-06-07T09:00:00Z,2024,6,TIG,TRUE,TRUE,TRUE,2023-24-NSW-SMART-drumline-annual-report.pdf
21/06/2024,8:33,Tiger Shark,275,F,Alive,"ID, A",Yamba,Angourie Point,2024-06-21T08:33:00Z,2024,6,TIG,TRUE,TRUE,TRUE,2023-24-NSW-SMART-drumline-annual-report.pdf
21/06/2024,12:24,Tiger Shark,280,NA,Alive,NA,Yamba,Angourie Point,2024-06-21T12:24:00Z,2024,6,TIG,TRUE,FALSE,FALSE,2023-24-NSW-SMART-drumline-annual-report.pdf
6/08/2023,13:12,White Shark,256,F,Alive,"ID, A",Yamba,Green Point,2023-08-06T13:12:00Z,2023,8,WHI,TRUE,TRUE,TRUE,2023-24-NSW-SMART-drumline-annual-report.pdf
23/08/2023,13:49,White Shark,243,F,Alive,"ID, A",Yamba,Green Point,2023-08-23T13:49:00Z,2023,8,WHI,TRUE,TRUE,TRUE,2023-24-NSW-SMART-drumline-annual-report.pdf
27/08/2023,8:00,White Shark,213,M,Alive,"ID, A",Yamba,Green Point,2023-08-27T08:00:00Z,2023,8,WHI,TRUE,TRUE,TRUE,2023-24-NSW-SMART-drumline-annual-report.pdf
5/09/2023,10:39,White Shark,213,F,Alive,"ID, A",Yamba,Green Point,2023-09-05T10:39:00Z,2023,9,WHI,TRUE,TRUE,TRUE,2023-24-NSW-SMART-drumline-annual-report.pdf
10/09/2023,11:19,White Shark,211,M,Alive,"ID, A",Yamba,Green Point,2023-09-10T11:19:00Z,2023,9,WHI,TRUE,TRUE,TRUE,2023-24-NSW-SMART-drumline-annual-report.pdf
24/10/2023,8:24,White Shark,216,M,Alive,"ID, A",Yamba,Green Point,2023-10-24T08:24:00Z,2023,10,WHI,TRUE,TRUE,TRUE,2023-24-NSW-SMART-drumline-annual-report.pdf
18/11/2023,8:40,Sandbar Whaler,127,M,Alive,ID,Yamba,Green Point,2023-11-18T08:40:00Z,2023,11,SAN,FALSE,TRUE,FALSE,2023-24-NSW-SMART-drumline-annual-report.pdf
21/11/2023,6:49,Sandbar Whaler,133,F,Alive,ID,Yamba,Green Point,2023-11-21T06:49:00Z,2023,11,SAN,FALSE,TRUE,FALSE,2023-24-NSW-SMART-drumline-annual-report.pdf
23/11/2023,10:39,Sandbar Whaler,128,F,Alive,ID,Yamba,Green Point,2023-11-23T10:39:00Z,2023,11,SAN,FALSE,TRUE,FALSE,2023-24-NSW-SMART-drumline-annual-report.pdf
23/02/2024,10:34,Sandbar Whaler,132,M,Alive,ID,Yamba,Green Point,2024-02-23T10:34:00Z,2024,2,SAN,FALSE,TRUE,FALSE,2023-24-NSW-SMART-drumline-annual-report.pdf
28/05/2024,11:24,Sandbar Whaler,148,M,Alive,ID,Yamba,Green Point,2024-05-28T11:24:00Z,2024,5,SAN,FALSE,TRUE,FALSE,2023-24-NSW-SMART-drumline-annual-report.pdf
7/07/2023,11:29,White Shark,222,F,Alive,"ID, A",Yamba,Iluka Beach,2023-07-07T11:29:00Z,2023,7,WHI,TRUE,TRUE,TRUE,2023-24-NSW-SMART-drumline-annual-report.pdf
7/07/2023,15:24,White Shark,245,M,Alive,"ID, A",Yamba,Iluka Beach,2023-07-07T15:24:00Z,2023,7,WHI,TRUE,TRUE,TRUE,2023-24-NSW-SMART-drumline-annual-report.pdf
14/07/2023,9:09,White Shark,285,F,Alive,"ID, A",Yamba,Iluka Beach,2023-07-14T09:09:00Z,2023,7,WHI,TRUE,TRUE,TRUE,2023-24-NSW-SMART-drumline-annual-report.pdf
27/08/2023,9:09,White Shark,300,NA,Alive,NA,Yamba,Iluka Beach,2023-08-27T09:09:00Z,2023,8,WHI,TRUE,FALSE,FALSE,2023-24-NSW-SMART-drumline-annual-report.pdf
28/09/2023,9:12,White Shark,179,F,Alive,"ID, A",Yamba,Iluka Beach,2023-09-28T09:12:00Z,2023,9,WHI,TRUE,TRUE,TRUE,2023-24-NSW-SMART-drumline-annual-report.pdf
9/10/2023,15:34,White Shark,204,F,Alive,"ID, A",Yamba,Iluka Beach,2023-10-09T15:34:00Z,2023,10,WHI,TRUE,TRUE,TRUE,2023-24-NSW-SMART-drumline-annual-report.pdf
15/10/2023,8:43,White Shark,183,F,Alive,"ID, A",Yamba,Iluka Beach,2023-10-15T08:43:00Z,2023,10,WHI,TRUE,TRUE,TRUE,2023-24-NSW-SMART-drumline-annual-report.pdf
31/10/2023,12:58,White Shark,259,M,Alive,"ID, A",Yamba,Iluka Beach,2023-10-31T12:58:00Z,2023,10,WHI,TRUE,TRUE,TRUE,2023-24-NSW-SMART-drumline-annual-report.pdf
12/11/2023,7:17,White Shark,236,F,Alive,"ID, A",Yamba,Iluka Beach,2023-11-12T07:17:00Z,2023,11,WHI,TRUE,TRUE,TRUE,2023-24-NSW-SMART-drumline-annual-report.pdf
24/02/2024,10:52,Bull Shark,164,M,Alive,"ID, A",Yamba,Iluka Beach,2024-02-24T10:52:00Z,2024,2,BUL,TRUE,TRUE,TRUE,2023-24-NSW-SMART-drumline-annual-report.pdf
29/02/2024,10:49,Bull Shark,190,F,Alive,"ID, A",Yamba,Iluka Beach,2024-02-29T10:49:00Z,2024,2,BUL,TRUE,TRUE,TRUE,2023-24-NSW-SMART-drumline-annual-report.pdf
24/05/2024,13:54,Common Blacktip,145,M,Alive,ID,Yamba,Iluka Beach,2024-05-24T13:54:00Z,2024,5,CBT,FALSE,TRUE,FALSE,2023-24-NSW-SMART-drumline-annual-report.pdf
14/08/2023,8:23,White Shark,226,F,Alive,"ID, A",Yamba,Iluka Beach,2023-08-14T08:23:00Z,2023,8,WHI,TRUE,TRUE,TRUE,2023-24-NSW-SMART-drumline-annual-report.pdf
20/08/2023,8:20,White Shark,217,F,Alive,"ID, A",Yamba,Iluka Beach,2023-08-20T08:20:00Z,2023,8,WHI,TRUE,TRUE,TRUE,2023-24-NSW-SMART-drumline-annual-report.pdf
31/08/2023,11:38,White Shark,270,F,Alive,"ID, A",Yamba,Iluka Beach,2023-08-31T11:38:00Z,2023,8,WHI,TRUE,TRUE,TRUE,2023-24-NSW-SMART-drumline-annual-report.pdf
24/09/2023,14:43,Tiger Shark,270,F,Alive,"ID, A",Yamba,Iluka Beach,2023-09-24T14:43:00Z,2023,9,TIG,TRUE,TRUE,TRUE,2023-24-NSW-SMART-drumline-annual-report.pdf
1/10/2023,11:52,White Shark,223,F,Alive,"ID, A",Yamba,Iluka Beach,2023-10-01T11:52:00Z,2023,10,WHI,TRUE,TRUE,TRUE,2023-24-NSW-SMART-drumline-annual-report.pdf
11/10/2023,17:04,White Shark,238,F,Alive,"ID, A",Yamba,Iluka Beach,2023-10-11T17:04:00Z,2023,10,WHI,TRUE,TRUE,TRUE,2023-24-NSW-SMART-drumline-annual-report.pdf
21/10/2023,12:28,Tiger Shark,203,F,Alive,"ID, A",Yamba,Iluka Beach,2023-10-21T12:28:00Z,2023,10,TIG,TRUE,TRUE,TRUE,2023-24-NSW-SMART-drumline-annual-report.pdf
23/10/2023,16:33,White Shark,234,M,Alive,"ID, A",Yamba,Iluka Beach,2023-10-23T16:33:00Z,2023,10,WHI,TRUE,TRUE,TRUE,2023-24-NSW-SMART-drumline-annual-report.pdf
5/11/2023,17:25,White Shark,226,F,Alive,"ID, A",Yamba,Iluka Beach,2023-11-05T17:25:00Z,2023,11,WHI,TRUE,TRUE,TRUE,2023-24-NSW-SMART-drumline-annual-report.pdf
25/11/2023,8:19,Smooth Hammerhead,171,F,Alive,ID,Yamba,Iluka Beach,2023-11-25T08:19:00Z,2023,11,SMH,FALSE,TRUE,FALSE,2023-24-NSW-SMART-drumline-annual-report.pdf
4/12/2023,13:42,White Shark,230,M,Alive,"ID, A",Yamba,Iluka Beach,2023-12-04T13:42:00Z,2023,12,WHI,TRUE,TRUE,TRUE,2023-24-NSW-SMART-drumline-annual-report.pdf
8/01/2024,15:59,Common Blacktip,162,M,Alive,ID,Yamba,Iluka Beach,2024-01-08T15:59:00Z,2024,1,CBT,FALSE,TRUE,FALSE,2023-24-NSW-SMART-drumline-annual-report.pdf
14/04/2024,7:09,Sandbar Whaler,144,M,Alive,ID,Yamba,Iluka Beach,2024-04-14T07:09:00Z,2024,4,SAN,FALSE,TRUE,FALSE,2023-24-NSW-SMART-drumline-annual-report.pdf
14/04/2024,14:44,Sandbar Whaler,203,F,Alive,ID,Yamba,Iluka Beach,2024-04-14T14:44:00Z,2024,4,SAN,FALSE,TRUE,FALSE,2023-24-NSW-SMART-drumline-annual-report.pdf
10/05/2024,8:25,Sandbar Whaler,138,F,Alive,ID,Yamba,Iluka Beach,2024-05-10T08:25:00Z,2024,5,SAN,FALSE,TRUE,FALSE,2023-24-NSW-SMART-drumline-annual-report.pdf
10/05/2024,9:21,Sandbar Whaler,143,M,Alive,ID,Yamba,Iluka Beach,2024-05-10T09:21:00Z,2024,5,SAN,FALSE,TRUE,FALSE,2023-24-NSW-SMART-drumline-annual-report.pdf
28/06/2024,12:19,Tiger Shark,308,M,Alive,"ID, A",Yamba,Iluka Beach,2024-06-28T12:19:00Z,2024,6,TIG,TRUE,TRUE,TRUE,2023-24-NSW-SMART-drumline-annual-report.pdf
27/08/2023,11:25,White Shark,223,F,Alive,"ID, A",Yamba,Main Beach,2023-08-27T11:25:00Z,2023,8,WHI,TRUE,TRUE,TRUE,2023-24-NSW-SMART-drumline-annual-report.pdf
26/09/2023,11:47,White Shark,220,F,Alive,"ID, A",Yamba,Main Beach,2023-09-26T11:47:00Z,2023,9,WHI,TRUE,TRUE,TRUE,2023-24-NSW-SMART-drumline-annual-report.pdf
24/10/2023,7:31,Sandbar Whaler,122,M,Alive,ID,Yamba,Main Beach,2023-10-24T07:31:00Z,2023,10,SAN,FALSE,TRUE,FALSE,2023-24-NSW-SMART-drumline-annual-report.pdf
14/11/2023,13:30,Greynurse Shark,271,F,Alive,ID,Yamba,Main Beach,2023-11-14T13:30:00Z,2023,11,GRN,FALSE,TRUE,FALSE,2023-24-NSW-SMART-drumline-annual-report.pdf
23/03/2024,15:35,Bull Shark,182,M,Alive,"ID, A",Yamba,Main Beach,2024-03-23T15:35:00Z,2024,3,BUL,TRUE,TRUE,TRUE,2023-24-NSW-SMART-drumline-annual-report.pdf
21/06/2024,8:46,Tiger Shark,290,M,Alive,"ID, A",Yamba,Main Beach,2024-06-21T08:46:00Z,2024,6,TIG,TRUE,TRUE,TRUE,2023-24-NSW-SMART-drumline-annual-report.pdf
21/06/2024,9:41,Dusky Whaler,320,F,Alive,ID,Yamba,Main Beach,2024-06-21T09:41:00Z,2024,6,DUS,FALSE,TRUE,FALSE,2023-24-NSW-SMART-drumline-annual-report.pdf
12/07/2023,14:07,Greynurse Shark,270,F,Alive,"ID, A",Yamba,Pippi Beach,2023-07-12T14:07:00Z,2023,7,GRN,FALSE,TRUE,TRUE,2023-24-NSW-SMART-drumline-annual-report.pdf
15/07/2023,8:23,White Shark,197,M,Alive,"ID, A",Yamba,Pippi Beach,2023-07-15T08:23:00Z,2023,7,WHI,TRUE,TRUE,TRUE,2023-24-NSW-SMART-drumline-annual-report.pdf
16/07/2023,7:54,White Shark,245,M,Alive,"ID, A",Yamba,Pippi Beach,2023-07-16T07:54:00Z,2023,7,WHI,TRUE,TRUE,TRUE,2023-24-NSW-SMART-drumline-annual-report.pdf
28/07/2023,8:57,White Shark,247,F,Alive,"ID, A",Yamba,Pippi Beach,2023-07-28T08:57:00Z,2023,7,WHI,TRUE,TRUE,TRUE,2023-24-NSW-SMART-drumline-annual-report.pdf
10/08/2023,7:14,White Shark,215,M,Alive,"ID, A",Yamba,Pippi Beach,2023-08-10T07:14:00Z,2023,8,WHI,TRUE,TRUE,TRUE,2023-24-NSW-SMART-drumline-annual-report.pdf
12/08/2023,7:41,White Shark,257,F,Alive,"ID, A",Yamba,Pippi Beach,2023-08-12T07:41:00Z,2023,8,WHI,TRUE,TRUE,TRUE,2023-24-NSW-SMART-drumline-annual-report.pdf
25/08/2023,11:42,White Shark,252,M,Alive,"ID, A",Yamba,Pippi Beach,2023-08-25T11:42:00Z,2023,8,WHI,TRUE,TRUE,TRUE,2023-24-NSW-SMART-drumline-annual-report.pdf
28/08/2023,13:39,White Shark,261,F,Alive,"ID, A",Yamba,Pippi Beach,2023-08-28T13:39:00Z,2023,8,WHI,TRUE,TRUE,TRUE,2023-24-NSW-SMART-drumline-annual-report.pdf
11/09/2023,7:32,White Shark,232,M,Alive,"ID, A",Yamba,Pippi Beach,2023-09-11T07:32:00Z,2023,9,WHI,TRUE,TRUE,TRUE,2023-24-NSW-SMART-drumline-annual-report.pdf
2/10/2023,8:08,White Shark,250,NA,Alive,NA,Yamba,Pippi Beach,2023-10-02T08:08:00Z,2023,10,WHI,TRUE,FALSE,FALSE,2023-24-NSW-SMART-drumline-annual-report.pdf
5/10/2023,14:14,White Shark,232,F,Alive,"ID, A",Yamba,Pippi Beach,2023-10-05T14:14:00Z,2023,10,WHI,TRUE,TRUE,TRUE,2023-24-NSW-SMART-drumline-annual-report.pdf
10/10/2023,13:39,White Shark,218,M,Alive,"ID, A",Yamba,Pippi Beach,2023-10-10T13:39:00Z,2023,10,WHI,TRUE,TRUE,TRUE,2023-24-NSW-SMART-drumline-annual-report.pdf
16/10/2023,13:43,Sandbar Whaler,110,F,Dead,NA,Yamba,Pippi Beach,2023-10-16T13:43:00Z,2023,10,SAN,FALSE,FALSE,FALSE,2023-24-NSW-SMART-drumline-annual-report.pdf
21/10/2023,14:10,Scalloped Hammerhead,145,F,Dead,NA,Yamba,Pippi Beach,2023-10-21T14:10:00Z,2023,10,SCH,FALSE,FALSE,FALSE,2023-24-NSW-SMART-drumline-annual-report.pdf
24/10/2023,8:18,Sandbar Whaler,117,M,Alive,ID,Yamba,Pippi Beach,2023-10-24T08:18:00Z,2023,10,SAN,FALSE,TRUE,FALSE,2023-24-NSW-SMART-drumline-annual-report.pdf
4/12/2023,8:23,Bronze Whaler,265,M,Alive,ID,Yamba,Pippi Beach,2023-12-04T08:23:00Z,2023,12,BRO,FALSE,TRUE,FALSE,2023-24-NSW-SMART-drumline-annual-report.pdf
8/12/2023,14:25,Sandbar Whaler,129,M,Alive,ID,Yamba,Pippi Beach,2023-12-08T14:25:00Z,2023,12,SAN,FALSE,TRUE,FALSE,2023-24-NSW-SMART-drumline-annual-report.pdf
15/12/2023,NA,Tiger Shark,127,M,Alive,"ID, A",Yamba,Pippi Beach,NA,2023,12,TIG,TRUE,TRUE,TRUE,2023-24-NSW-SMART-drumline-annual-report.pdf
21/12/2023,10:18,White Shark,249,M,Alive,"ID, A",Yamba,Pippi Beach,2023-12-21T10:18:00Z,2023,12,WHI,TRUE,TRUE,TRUE,2023-24-NSW-SMART-drumline-annual-report.pdf
30/12/2023,6:41,Sandbar Whaler,134,M,Alive,ID,Yamba,Pippi Beach,2023-12-30T06:41:00Z,2023,12,SAN,FALSE,TRUE,FALSE,2023-24-NSW-SMART-drumline-annual-report.pdf
25/01/2024,13:53,Sandbar Whaler,113,F,Alive,ID,Yamba,Pippi Beach,2024-01-25T13:53:00Z,2024,1,SAN,FALSE,TRUE,FALSE,2023-24-NSW-SMART-drumline-annual-report.pdf
25/01/2024,15:09,Sandbar Whaler,140,F,Alive,ID,Yamba,Pippi Beach,2024-01-25T15:09:00Z,2024,1,SAN,FALSE,TRUE,FALSE,2023-24-NSW-SMART-drumline-annual-report.pdf
17/02/2024,16:02,Bull Shark,185,F,Alive,"ID, A",Yamba,Pippi Beach,2024-02-17T16:02:00Z,2024,2,BUL,TRUE,TRUE,TRUE,2023-24-NSW-SMART-drumline-annual-report.pdf
20/02/2024,11:34,Common Blacktip,138,M,Alive,ID,Yamba,Pippi Beach,2024-02-20T11:34:00Z,2024,2,CBT,FALSE,TRUE,FALSE,2023-24-NSW-SMART-drumline-annual-report.pdf
8/04/2024,7:44,Bull Shark,230,NA,Alive,NA,Yamba,Pippi Beach,2024-04-08T07:44:00Z,2024,4,BUL,TRUE,FALSE,FALSE,2023-24-NSW-SMART-drumline-annual-report.pdf
28/04/2024,7:32,White Shark,270,M,Alive,"ID, A",Yamba,Pippi Beach,2024-04-28T07:32:00Z,2024,4,WHI,TRUE,TRUE,TRUE,2023-24-NSW-SMART-drumline-annual-report.pdf
30/04/2024,11:27,Sandbar Whaler,124,F,Alive,ID,Yamba,Pippi Beach,2024-04-30T11:27:00Z,2024,4,SAN,FALSE,TRUE,FALSE,2023-24-NSW-SMART-drumline-annual-report.pdf
9/05/2024,12:35,White Shark,268,F,Alive,"ID, A",Yamba,Pippi Beach,2024-05-09T12:35:00Z,2024,5,WHI,TRUE,TRUE,TRUE,2023-24-NSW-SMART-drumline-annual-report.pdf
12/05/2024,8:33,Bull Shark,170,F,Alive,"ID, A",Yamba,Pippi Beach,2024-05-12T08:33:00Z,2024,5,BUL,TRUE,TRUE,TRUE,2023-24-NSW-SMART-drumline-annual-report.pdf
26/05/2024,13:15,Sandbar Whaler,110,F,Alive,ID,Yamba,Pippi Beach,2024-05-26T13:15:00Z,2024,5,SAN,FALSE,TRUE,FALSE,2023-24-NSW-SMART-drumline-annual-report.pdf
21/06/2024,8:54,Tiger Shark,278,F,Alive,"ID, A",Yamba,Pippi Beach,2024-06-21T08:54:00Z,2024,6,TIG,TRUE,TRUE,TRUE,2023-24-NSW-SMART-drumline-annual-report.pdf
21/06/2024,8:58,Tiger Shark,300,F,Alive,NA,Yamba,Pippi Beach,2024-06-21T08:58:00Z,2024,6,TIG,TRUE,FALSE,FALSE,2023-24-NSW-SMART-drumline-annual-report.pdf
29/06/2024,8:44,Sandbar Whaler,126,F,Alive,ID,Yamba,Pippi Beach,2024-06-29T08:44:00Z,2024,6,SAN,FALSE,TRUE,FALSE,2023-24-NSW-SMART-drumline-annual-report.pdf
9/08/2023,13:12,White Shark,232,F,Alive,"ID, A",Yamba,Spooky Beach,2023-08-09T13:12:00Z,2023,8,WHI,TRUE,TRUE,TRUE,2023-24-NSW-SMART-drumline-annual-report.pdf
31/08/2023,14:32,White Shark,238,M,Alive,"ID, A",Yamba,Spooky Beach,2023-08-31T14:32:00Z,2023,8,WHI,TRUE,TRUE,TRUE,2023-24-NSW-SMART-drumline-annual-report.pdf
9/10/2023,9:54,Dusky Whaler,165,M,Alive,ID,Yamba,Spooky Beach,2023-10-09T09:54:00Z,2023,10,DUS,FALSE,TRUE,FALSE,2023-24-NSW-SMART-drumline-annual-report.pdf
27/11/2023,13:21,White Shark,234,F,Alive,"ID, A",Yamba,Spooky Beach,2023-11-27T13:21:00Z,2023,11,WHI,TRUE,TRUE,TRUE,2023-24-NSW-SMART-drumline-annual-report.pdf
9/01/2024,16:12,Bull Shark,246,F,Alive,"ID, A",Yamba,Spooky Beach,2024-01-09T16:12:00Z,2024,1,BUL,TRUE,TRUE,TRUE,2023-24-NSW-SMART-drumline-annual-report.pdf
21/06/2024,9:22,Tiger Shark,330,F,Alive,"ID, A",Yamba,Spooky Beach,2024-06-21T09:22:00Z,2024,6,TIG,TRUE,TRUE,TRUE,2023-24-NSW-SMART-drumline-annual-report.pdf
